"1507.03390","Adrian Iulian Borhan","A.I. Borhan, M. Gromada, G.G. Nedelcu, L. Leontie","Influence of additives (CoO, CaO, B2O3) on thermal and dielectric
  properties of BaO-Al2O3-SiO2 glass-ceramic sealant for OTM applications","28 pages, 8 figures, 3 tables",,,,"cond-mat.mtrl-sci","http://arxiv.org/licenses/nonexclusive-distrib/1.0/","  The efficiency of glass ceramic sealants plays a crucial role in high
temperature applications performance and durability, such as oxygen separation
from air. In order to develop suitable sealants, operating at about 950C,
several glass-ceramics with different compositional additives and ratios in BAS
system have been prepared and investigated. The effects of additive oxides,
CaO, CoO, B2O3, as network modifiers on the thermal and dielectric properties
of BAS glass-ceramic for further oxygen transport membrane OTM applications
were evaluated and discussed. The addition of additives has evident effects on
the main crystalline phases and physical properties of the glass-ceramics.
Among these systems, B2O3-rich BAS system, BABS, can be densified at the
sintering temperature below 700C through viscous sintering. Also, BABS shows
the lowest dilatometric softening temperature at 675C, which can be explained
by a fast densification associated with a shrinkage of 25 percents. It has
highest conductivity, a high dielectric constant of 67.8 and a loss of 0.029 at
10MHz, which provide an attractive feature for many technological applications.
The electrical results obtained for BABS glass-ceramic are consistent with the
typical requirements for an excellent sealant. However, considering all other
properties investigated, only B2O3-rich BAS meets the requirements for use as a
sealant for BSCF membrane. Low softening temperature of BABS opens more ways
for adding additives to tailor its functional properties, which enable for
using as sealant material for OTM applications.
","[{""version"":""v1"",""created"":""Mon, 13 Jul 2015 10:39:47 GMT""}]","2015-07-14"
"1507.03391","Cristina Pignotti","Cristina Pignotti","Stability results for second-order evolution equations with memory and
  switching time-delay",,,,,"math.AP","http://arxiv.org/licenses/nonexclusive-distrib/1.0/","  It is well-known that wave-type equations with memory, under appropriate
assumptions on the memory kernel, are uniformly exponentially stable. On the
other hand, time delay effects may destroy this behavior. Here, we consider the
stabilization problem for second-order evolution equations with memory and
intermittent delay feedback. We show that, under suitable assumptions involving
the delay feedback coefficient and the memory kernel, asymptotic or exponential
stability are still preserved. In particular, asymptotic stability is
guaranteed if the delay feedback coefficient belongs to $L^1(0;+\infty)$ and
the time intervals where the delay feedback is off are sufficiently large.
","[{""version"":""v1"",""created"":""Mon, 13 Jul 2015 11:00:24 GMT""}]","2015-07-14"
"1507.03392","Vladimir Mironov","V. Mironov, S. Bogomolov, A. Bondarchenko, A. Efremov, V. Loginov","Numerical model of Electron Cyclotron Resonance Ion Source","24 pages, 41 figures","Phys. Rev. ST Accel. Beams 18, 123401 (2015)","10.1103/PhysRevSTAB.18.123401",,"physics.acc-ph physics.plasm-ph","http://arxiv.org/licenses/nonexclusive-distrib/1.0/","  Important features of Electron Cyclotron Resonance Ion Source (ECRIS)
operation are accurately reproduced with a numerical code. The code uses the
particle-in-cell technique to model a dynamics of ions in ECRIS plasma. It is
shown that gas dynamical ion confinement mechanism is sufficient to provide the
ion production rates in ECRIS close to the experimentally observed values.
Extracted ion currents are calculated and compared to the experiment for few
sources. Changes in the extracted ion currents are obtained with varying the
gas flow into the source chamber and the microwave power. Empirical scaling
laws for ECRIS design are studied and the underlying physical effects are
discussed.
","[{""version"":""v1"",""created"":""Mon, 13 Jul 2015 11:04:32 GMT""}]","2015-12-23"
"1507.03393","Daniel Borchmann","Friedrich Martin Schneider and Daniel Borchmann","Topological Entropy of Formal Languages",,"Semigroup Forum 94 (2017) 556-581","10.1007/s00233-016-9782-0",,"math.DS","http://arxiv.org/licenses/nonexclusive-distrib/1.0/","  We introduce the notion of topological entropy of a formal languages as the
topological entropy of the minimal topological automaton accepting it. Using a
characterization of this notion in terms of approximations of the Myhill-Nerode
congruence relation, we are able to compute the topological entropies of
certain example languages. Those examples suggest that the notion of a ""simple""
formal language coincides with the language having zero entropy.
","[{""version"":""v1"",""created"":""Mon, 13 Jul 2015 11:07:34 GMT""},{""version"":""v2"",""created"":""Thu, 14 Jan 2016 08:32:39 GMT""}]","2018-10-16"
"1507.03394","Udo Hertrich-Jeromin","U. Hertrich-Jeromin, K. Mundilova, E.-H. Tjaden","Channel linear Weingarten surfaces","7 pages, 1 figure",,,,"math.DG","http://arxiv.org/licenses/nonexclusive-distrib/1.0/","  We demonstrate that every non-tubular channel linear Weingarten surface in
Euclidean space is a surface of revolution, hence parallel to a catenoid or a
rotational surface of non-zero constant Gauss curvature. We provide explicit
parametrizations and deduce existence of complete hyperbolic linear Weingarten
surfaces.
","[{""version"":""v1"",""created"":""Mon, 13 Jul 2015 11:11:55 GMT""}]","2015-07-14"
"1507.03395","Louay Bazzi","Louay Bazzi and Ibrahim Abou-Faycal","LP decoding excess over symmetric channels","To appear in IEEE Communications Letters",,,,"cs.IT math.IT","http://arxiv.org/licenses/nonexclusive-distrib/1.0/","  We consider the problem of Linear Programming (LP) decoding of binary linear
codes. The LP excess lemma was introduced by the first author, B. Ghazi, and R.
Urbanke (IEEE Trans. Inf. Th., 2014) as a technique to trade crossover
probability for ""LP excess"" over the Binary Symmetric Channel. We generalize
the LP excess lemma to discrete, binary-input, Memoryless, Symmetric and
LLR-Bounded (MSB) channels. As an application, we extend a result by the first
author and H. Audah (IEEE Trans. Inf. Th., 2015) on the impact of redundant
checks on LP decoding to discrete MSB channels.
","[{""version"":""v1"",""created"":""Mon, 13 Jul 2015 11:14:02 GMT""}]","2015-07-14"
"1507.03396","Marian Mrozek","P. Brendel, G. Ellis, M. Juda, M. Mrozek","Fundamental Group Algorithm for low dimensional tessellated CW complexes",,,,,"math.AT math.GT","http://arxiv.org/licenses/nonexclusive-distrib/1.0/","  We present a detailed description of a fundamental group algorithm based on
Forman's combinatorial version of Morse theory. We use this algorithm in a
classification problem of prime knots up to 14 crossings.
","[{""version"":""v1"",""created"":""Mon, 13 Jul 2015 11:14:25 GMT""}]","2015-07-19"
"1507.03397","Dragutin Mihailovic","Dragutin T. Mihailovi\'c, Vladimir R. Kosti\'c, Igor Bala\v{z}, Darko
  Kapor","Computing the Threshold of the Influence of Intercellular Nanotubes on
  Cell-to-Cell Communication Integrity","6 pages, 4 figures",,"10.1016/j.chaos.2016.06.001",,"q-bio.CB math.DS","http://arxiv.org/licenses/nonexclusive-distrib/1.0/","  We examine the threshold of the influence of the tunneling nanotubes (TNTs)
on the cell-to-cell communication integrity. A deterministic model is
introduced with the Michaelis-Menten dynamics and the intercellular exchange of
substance. The influence of TNTs are considered as a functional perturbation of
the main communication and treated as the matrix nearness problems. We analyze
communication integrity in terms of the \emph{pseudospectra} of the exchange,
to find the \emph{distance to instability}. The threshold of TNTs influence is
computed for Newman-Gastner and Erd\H{o}s-R\'enyi gap junction (GJ) networks.
","[{""version"":""v1"",""created"":""Mon, 13 Jul 2015 11:15:38 GMT""}]","2016-06-29"
"1507.03398","Ireneusz Weymann","I. Weymann, J. von Delft, A. Weichselbaum","Thermalization and dynamics in the single impurity Anderson model","21 pages, 18 figures","Phys. Rev. B 92, 155435 (2015)","10.1103/PhysRevB.92.155435",,"cond-mat.mes-hall cond-mat.str-el","http://arxiv.org/licenses/nonexclusive-distrib/1.0/","  We analyze the process of thermalization, dynamics and the eigenstate
thermalization hypothesis (ETH) for the single impurity Anderson model,
focusing on the Kondo regime. For this we construct the complete eigenbasis of
the Hamiltonian using the numerical renormalization group (NRG) method in the
language of the matrix product states. It is a peculiarity of the NRG that
while the Wilson chain is supposed to describe a macroscopic bath, very few
single particle excitations already suffice to essentially thermalize the
impurity system at finite temperature, which amounts to having added a
macroscopic amount of energy. Thus given an initial state of the system such as
the ground state together with microscopic excitations, we calculate the
spectral function of the impurity using the microcanonical and diagonal and
grand canonical ensembles. By adding or removing particles at a certain Wilson
energy shell on top of the ground state, we find qualitative agreement between
the spectral functions calculated for different ensembles. This indicates that
the system thermalizes in the long-time limit, and can be described by an
appropriate statistical-mechanical ensemble. Moreover, by calculating the
impurity spectral density at the Fermi level and the dot occupancy for energy
eigenstates relevant for microcanonical ensemble, we find good support for ETH.
The ultimate mechanism responsible for this effective thermalization within the
NRG can be identified as Anderson orthogonality: the more charge that needs to
flow to or from infinity after applying a local excitation within the Wilson
chain, the more the system looks thermal afterwards at an increased
temperature. For the same reason, however, thermalization fails if charge
rearrangement after the excitation remains mostly local.
","[{""version"":""v1"",""created"":""Mon, 13 Jul 2015 11:15:52 GMT""}]","2017-08-23"
"1507.03399","Stephen Hogan","V. Zhelyazkova and S. D. Hogan","Probing interactions between Rydberg atoms with large electric dipole
  moments in amplitude modulated electric fields","6 page, 4 figures","Phys. Rev. A, 92, 011402(R) (2015)","10.1103/PhysRevA.92.011402",,"physics.atom-ph","http://arxiv.org/licenses/nonexclusive-distrib/1.0/","  Dipole-dipole interactions between helium atoms in Rydberg-Stark states with
principal quantum number $n=53$ and approximately linear Stark energy shifts,
resulting from induced electric dipole moments of approximately 7900 D, have
been investigated experimentally. The experiments were performed in pulsed
supersonic metastable helium beams, with particle number densities of up to
$\sim10^9$ cm$^{-3}$. In the presence of amplitude-modulated, radio-frequency
electric fields, changes in the spectral intensity distributions associated
with the transitions to these states that are attributed to dipole-dipole
interactions within the ensembles of excited atoms have been observed. The
experimental results are in excellent agreement with calculations of the
Rydberg energy level structure carried out using Floquet methods, and
excitations shared by up to 4 atoms. The use of these Rydberg-Stark states as
sensors for non-resonant broadband radio-frequency electrical noise is also
discussed.
","[{""version"":""v1"",""created"":""Mon, 13 Jul 2015 11:16:10 GMT""}]","2015-07-14"
"1507.03400","Sven Bjarke Gudnason","Sven Bjarke Gudnason, Jarah Evslin","Global two-monopoles","LaTeX: 34 pages, 15 figures; V2: comments added","Phys. Rev. D 92, 045044 (2015)","10.1103/PhysRevD.92.045044",,"hep-th","http://arxiv.org/licenses/nonexclusive-distrib/1.0/","  Global two-monopoles are unstable in their simplest formulation. We construct
a model with a metric-like prefactor which we show can stabilize the global
two-monopoles. The stabilizing construction is realized with a Skyrme sector
where the metric-like prefactor is a function of the Skyrmion profile.
","[{""version"":""v1"",""created"":""Mon, 13 Jul 2015 11:19:15 GMT""},{""version"":""v2"",""created"":""Thu, 12 Nov 2015 10:42:19 GMT""}]","2015-11-13"
"1507.03401","Stefano Castruccio","Stefano Castruccio and Joseph Guinness","An Evolutionary Spectrum Approach to Incorporate Large-scale
  Geographical Descriptors on Global Processes",,,,,"stat.AP","http://arxiv.org/licenses/nonexclusive-distrib/1.0/","  We introduce a nonstationary spatio-temporal statistical model for gridded
data on the sphere. The model specifies a computationally convenient covariance
structure that depends on heterogeneous geography. Widely used statistical
models on a spherical domain are nonstationary for different latitudes, but
stationary at the same latitude (axial symmetry). This assumption has been
acknowledged to be too restrictive for quantities such as surface temperature,
whose statistical behavior is influenced by large scale geographical
descriptors such as land and ocean. We propose an evolutionary spectrum
approach that is able to account for different regimes across the Earth's
geography, and results in a more general and flexible class of models that
vastly outperforms axially symmetric models and captures longitudinal patterns
that would otherwise be assumed constant. The model can be estimated with in a
multi-step conditional likelihood approximation that preserves the
nonstationary features while allowing for easily distributed computations: we
show how the fit of a data sets larger than 20 million data can be performed in
less than one day on a state-of-the-art workstation. Once the parameters are
estimated, it is possible to instantaneously generate surrogate runs from a
common laptop. Further, the resulting estimates from the statistical model can
be regarded as a synthetic description (i.e. a compression) of the space-time
characteristics of an entire initial condition ensemble. Compared to
traditional algorithms aiming at compressing the bit-by-bit information on each
climate model run, the proposed approach achieves vastly superior compression
rates.
","[{""version"":""v1"",""created"":""Mon, 13 Jul 2015 11:19:26 GMT""},{""version"":""v2"",""created"":""Wed, 24 Feb 2016 16:40:50 GMT""}]","2016-02-25"
"1507.03402","Alejandro Kievsky","A. Kievsky and M. Gattobigio","Universal range corrections to the Efimov trimer for a class of paths to
  the unitary limit","accepted Physical Review A","Phys. Rev. A 92, 062715 (2015)","10.1103/PhysRevA.92.062715",,"cond-mat.quant-gas nucl-th","http://arxiv.org/licenses/nonexclusive-distrib/1.0/","  Using potential models we analyze range corrections to the universal law
dictated by the Efimov theory of three bosons. In the case of finite-range
interactions we have observed that, at first order, it is necessary to
supplement the theory with one finite-range parameter, $\Gamma_n^3$, for each
specific $n$-level [Kievsky and Gattobigio, Phys. Rev. A {\bf 87}, 052719
(2013)]. The value of $\Gamma_n^3$ depends on the way the potentials is changed
to tune the scattering length toward the unitary limit. In this work we analyze
a particular path in which the length $r_B=a-a_B$, measuring the difference
between the two-body scattering length $a$ and the energy scattering length
$a_B$, results almost constant. Analyzing systems with very different scales,
as atomic or nuclear systems, we observe that the finite-range parameter
remains almost constant along the path with a numerical value of
$\Gamma_0^3\approx 0.87$ for the ground state level. This observation suggests
the possibility of constructing a single universal function that incorporate
finite-range effects for this class of paths. The result is used to estimate
the three-body parameter $\kappa_*$ in the case of real atomic systems brought
to the unitary limit thought a broad Feshbach resonances. Furthermore, we show
that the finite-range parameter can be put in relation with the two-body
contact $C_2$ at the unitary limit.
","[{""version"":""v1"",""created"":""Mon, 13 Jul 2015 11:19:30 GMT""},{""version"":""v2"",""created"":""Wed, 2 Dec 2015 07:16:25 GMT""}]","2016-01-06"
"1507.03403","Wolfgang Mulzer","Matias Korman, Wolfgang Mulzer, Andre van Renssen, Marcel Roeloffzen,
  Paul Seiferth, Yannik Stein","Time-Space Trade-offs for Triangulations and Voronoi Diagrams","17 pages, 4 figures, a preliminary version appeared in WADS 2015","Computational Geometry: Theory and Applications (CGTA), 73, 2018,
  pp. 35-45","10.1016/j.comgeo.2017.01.001",,"cs.CG cs.DS","http://arxiv.org/licenses/nonexclusive-distrib/1.0/","  Let $S$ be a planar $n$-point set. A triangulation for $S$ is a maximal plane
straight-line graph with vertex set $S$. The Voronoi diagram for $S$ is the
subdivision of the plane into cells such that all points in a cell have the
same nearest neighbor in $S$. Classically, both structures can be computed in
$O(n \log n)$ time and $O(n)$ space. We study the situation when the available
workspace is limited: given a parameter $s \in \{1, \dots, n\}$, an
$s$-workspace algorithm has read-only access to an input array with the points
from $S$ in arbitrary order, and it may use only $O(s)$ additional words of
$\Theta(\log n)$ bits for reading and writing intermediate data. The output
should then be written to a write-only structure. We describe a deterministic
$s$-workspace algorithm for computing an arbitrary triangulation of $S$ in time
$O(n^2/s + n \log n \log s )$ and a randomized $s$-workspace algorithm for
finding the Voronoi diagram of $S$ in expected time $O((n^2/s) \log s + n \log
s \log^*s)$.
","[{""version"":""v1"",""created"":""Mon, 13 Jul 2015 11:36:37 GMT""},{""version"":""v2"",""created"":""Tue, 8 Nov 2016 20:03:44 GMT""},{""version"":""v3"",""created"":""Fri, 2 Oct 2020 10:45:45 GMT""}]","2020-10-05"
"1507.03404","Giuliano Niccoli G.","D. Levy-Bencheton, G. Niccoli and V. Terras","Antiperiodic dynamical 6-vertex model by separation of variables II:
  Functional equations and form factors","52 pages",,"10.1088/1742-5468/2016/03/033110",,"math-ph hep-th math.MP nlin.SI","http://arxiv.org/licenses/nonexclusive-distrib/1.0/","  We pursue our study of the antiperiodic dynamical 6-vertex model using
Sklyanin's separation of variables approach, allowing in the model new possible
global shifts of the dynamical parameter. We show in particular that the
spectrum and eigenstates of the antiperiodic transfer matrix are completely
characterized by a system of discrete equations. We prove the existence of
different reformulations of this characterization in terms of functional
equations of Baxter's type. We notably consider the homogeneous functional
$T$-$Q$ equation which is the continuous analog of the aforementioned discrete
system and show, in the case of a model with an even number of sites, that the
complete spectrum and eigenstates of the antiperiodic transfer matrix can
equivalently be described in terms of a particular class of its $Q$-solutions,
hence leading to a complete system of Bethe equations. Finally, we compute the
form factors of local operators for which we obtain determinant representations
in finite volume.
","[{""version"":""v1"",""created"":""Mon, 13 Jul 2015 11:37:57 GMT""}]","2016-04-20"
"1507.03405","Pjotrs \v{Z}guns","Pjotrs A. \v{Z}guns, Michael Wessel, Natalia V. Skorodumova","Charging of Cu atom on Mo supported thin films of ScN, MgO and NaF",,,,,"cond-mat.mtrl-sci physics.chem-ph physics.comp-ph","http://arxiv.org/licenses/nonexclusive-distrib/1.0/","  Molybdenum supported thin films of ScN, MgO and NaF with a Cu adatom have
been studied in the framework of density functional theory. We have observed a
charge transfer from the metal/film interface to the Cu atom and investigated
its relation to surface and interface deformations. We find that a weak
interaction between the metal and the film is a promising prerequisite for
adatom charging. The detailed study of Cu/NaF/Mo and NaF/Mo indicates that the
distortion of the NaF film caused by the Cu adsorption has essentially
anharmonic character, as it is coupled to a strong charge redistribution in the
system.
","[{""version"":""v1"",""created"":""Mon, 13 Jul 2015 11:39:55 GMT""}]","2015-07-14"
"1507.03406","Nicholas Harris","Nicholas C. Harris, Gregory R. Steinbrecher, Jacob Mower, Yoav Lahini,
  Mihika Prabhu, Darius Bunandar, Changchen Chen, Franco N. C. Wong, Tom
  Baehr-Jones, Michael Hochberg, Seth Lloyd, Dirk Englund","Quantum transport simulations in a programmable nanophotonic processor","4 figures, 8 pages",,"10.1038/nphoton.2017.95",,"quant-ph physics.optics","http://arxiv.org/licenses/nonexclusive-distrib/1.0/","  Environmental noise and disorder play critical roles in quantum particle and
wave transport in complex media, including solid-state and biological systems.
Recent work has predicted that coupling between noisy environments and
disordered systems, in which coherent transport has been arrested due to
localization effects, could actually enhance transport. Photonic integrated
circuits are promising platforms for studying such effects, with a central goal
being the development of large systems providing low-loss, high-fidelity
control over all parameters of the transport problem. Here, we fully map the
role of disorder in quantum transport using a nanophotonic processor consisting
of a mesh of 88 generalized beamsplitters programmable on microsecond
timescales. Over 64,400 transport experiments, we observe several distinct
transport regimes, including environment-assisted quantum transport and the
''quantum Goldilocks'' regime in strong, statically disordered discrete-time
systems. Low loss and high-fidelity programmable transformations make this
nanophotonic processor a promising platform for many-boson quantum simulation
experiments.
","[{""version"":""v1"",""created"":""Mon, 13 Jul 2015 11:44:37 GMT""},{""version"":""v2"",""created"":""Mon, 20 Jul 2015 02:59:05 GMT""},{""version"":""v3"",""created"":""Tue, 28 Jan 2020 13:54:31 GMT""}]","2020-01-29"
"1507.03407","Vojt\v{e}ch \v{R}eh\'ak","Tom\'a\v{s} Br\'azdil, Petr Hlin\v{e}n\'y, Anton\'in Ku\v{c}era,
  Vojt\v{e}ch \v{R}eh\'ak, and Mat\'u\v{s} Abaffy","Strategy Synthesis in Adversarial Patrolling Games",,,,,"cs.GT","http://arxiv.org/licenses/nonexclusive-distrib/1.0/","  Patrolling is one of the central problems in operational security. Formally,
a patrolling problem is specified by a set $U$ of nodes (admissible defender's
positions), a set $T \subseteq U$ of vulnerable targets, an admissible
defender's moves over $U$, and a function which to every target assigns the
time needed to complete an intrusion at it. The goal is to design an optimal
strategy for a defender who is moving from node to node and aims at detecting
possible intrusions at the targets. The goal of the attacker is to maximize the
probability of a successful attack. We assume that the attacker is adversarial,
i.e., he knows the strategy of the defender and can observe her moves.
  We prove that the defender has an optimal strategy for every patrolling
problem. Further, we show that for every $\varepsilon$ > 0, there exists a
finite-memory $\varepsilon$-optimal strategy for the defender constructible in
exponential time, and we observe that such a strategy cannot be computed in
polynomial time unless P=NP.
  Then we focus ourselves to unrestricted defender's moves. Here, a patrolling
problem is fully determined by its signature, the number of targets of each
attack length. We bound the maximal probability of successfully defended
attacks. Then, we introduce a decomposition method which allows to split a
given patrolling problem $G$ into smaller subproblems and construct a
defender's strategy for $G$ by ""composing"" the strategies constructed for these
subproblems.
  Finally, for patrolling problems with $T = U$ and a well-formed signature, we
give an exact classification of all sufficiently connected environments where
the defender can achieve the same value as in the fully connected uniform
environment. This result is useful for designing ""good"" environments where the
defender can act optimally.
","[{""version"":""v1"",""created"":""Mon, 13 Jul 2015 11:52:17 GMT""}]","2016-08-08"
