"1507.03315","Jos\'e A. D\'iaz-Garc\'ia","Jos\'e A. D\'iaz-Garc\'ia and Francisco J. Caro-Lopera","Estimation of mean form and mean form difference under elliptical laws","34 pages",,,,"math.ST stat.TH","http://arxiv.org/licenses/nonexclusive-distrib/1.0/","  Some ideas studied by Lele (1993), under a Gaussian perturbation model, are
generalised in the setting of matrix multivariate elliptical distributions. In
particular, several inaccuracies in the published statistical perturbation
model are revised. In addition, a number of aspects about identifiability and
estimability are also considered. Instead of using the Euclidean distance
matrix for proposing consistent estimates, this paper determines exact formulae
for the moments of matrix $\mathbf{B} =
\mathbf{X}^{c}\left(\mathbf{X}^{c}\right)^{T}$, where $\mathbf{X}^{c}$ is the
centered landmarks matrix. Consistent estimation of mean form difference under
elliptical laws is also studied. Finally, the main results of the paper and
some methodologies for selecting models and hypothesis testing are applied to a
real landmark data. comparing correlation shape structure is proposed and
applied in handwritten differentiation.
","[{""version"":""v1"",""created"":""Mon, 13 Jul 2015 03:03:38 GMT""}]","2015-07-14"
"1507.03316","Sukmoon Huh","Edoardo Ballico, Sukmoon Huh","Double lines on quadric hypersurfaces","25 pages; Comments welcome",,,,"math.AG","http://arxiv.org/licenses/nonexclusive-distrib/1.0/","  We study double line structures in projective spaces and quadric
hypersurfaces, and investigate the geometry of irreducible components of
Hilbert scheme of curves and moduli of stable sheaves of pure dimension 1 on a
smooth quadric threefold.
","[{""version"":""v1"",""created"":""Mon, 13 Jul 2015 03:21:23 GMT""}]","2015-07-14"
"1507.03317","Yo'av Rieck","Kenneth L. Baker and Tsuyoshi Kobayashi and Yo'av Rieck","The spectrum of the growth rate of the tunnel number is infinite",,,,,"math.GT","http://arxiv.org/licenses/nonexclusive-distrib/1.0/","  In a previous paper Kobayashi and Rieck defined the growth rate of the tunnel
number of a knot $K$, a knot invariant that measures the asymptotic behavior of
the tunnel number under iterated connected sum of $K$. We denote the growth
rate by $\mbox{gr}_t(K)$.
  In this paper we construct, for any $\epsilon > 0$, a hyperbolic knots $K
\subset S^{3}$ for which $1 - \epsilon < \mbox{gr}_t(K) < 1$. This is the first
proof that the spectrum of the growth rate of the tunnel number is infinite.
","[{""version"":""v1"",""created"":""Mon, 13 Jul 2015 03:22:02 GMT""}]","2015-07-14"
"1507.03318","Tamin Tai","Tamin Tai, Behnood G. Ghamsari, J. H. Kang, S. Lee, C. B. Eom, Steven
  M. Anlage","Localized High Frequency Electrodynamic Behavior of Optimally-doped
  Ba(Fe$_{1-x}$Co$_x$)$_2$As$_2$ Single Crystal films","7 pages, 6 figures",,,,"cond-mat.supr-con","http://arxiv.org/licenses/nonexclusive-distrib/1.0/","  Localized high frequency (several GHz) electrodynamic properties of a high
quality epitaxial, single-crystal Iron-Pnicitde Ba(Fe$_{1-x}$Co$_x$)$_2$As$_2$
thin film near optimal doping (x=0.08) are measured under a localized and
strong RF magnetic field, created by a near-field microwave microscope. Two
reflection electrodynamic measurements, including linear and the third harmonic
responses, are performed to understand the electromagnetic properties of
Ba(Fe$_{1-x}$Co$_x$)$_2$As$_2$. Our measurement results show that
Ba(Fe$_{1-x}$Co$_x$)$_2$As$_2$ has have a wide superconducting transition width
and may have a multi-gap nature. In addition, based on the $1/T^2$ dependence
of the third harmonics signal at lower temperature,
Ba(Fe$_{1-x}$Co$_x$)$_2$As$_2$ shows the possibility of nodal behavior.
","[{""version"":""v1"",""created"":""Mon, 13 Jul 2015 03:40:57 GMT""}]","2015-07-14"
"1507.03319","Marc Weber","Gerd Heusser, Marc Weber, Janina Hakenm\""uller, Matthias Laubenstein,
  Manfred Lindner, Werner Maneschg, Hardy Simgen, Dominik Stolzenburg, Herbert
  Strecker","GIOVE - A New Detector Setup for High Sensitivity Germanium Spectroscopy
  At Shallow Depth","17 pages, 11 figures",,,,"astro-ph.IM nucl-ex physics.ins-det","http://arxiv.org/licenses/nonexclusive-distrib/1.0/","  We report on the development and construction of the high-purity germanium
spectrometer setup GIOVE (Germanium Inner Outer Veto), recently built and now
operated at the shallow underground laboratory of the Max-Planck-Institut f\""ur
Kernphysik, Heidelberg. Particular attention was paid to the design of a novel
passive and active shield, aiming at efficient rejection of environmental and
muon induced radiation backgrounds. The achieved sensitivity level of <100
{\mu}Bq/kg for primordial radionuclides from U and Th in typical {\gamma} ray
sample screening measurements is unique among instruments located at comparably
shallow depths and can compete with instruments at far deeper underground
sites.
","[{""version"":""v1"",""created"":""Mon, 13 Jul 2015 03:42:33 GMT""}]","2015-07-14"
"1507.03320","Veer Awana Dr","P. K Maheshwari, Rajveer Jha, Bhasker Gahtori and V.P.S. Awana","Structural, and Magnetic properties of flux free large FeTe Single
  crystal","11 pages Text+Figs","J. Supecond. & Novel Mag. 28, L2893-2897 (2015)",,,"cond-mat.supr-con cond-mat.mtrl-sci cond-mat.str-el","http://arxiv.org/licenses/nonexclusive-distrib/1.0/","  We report synthesis of non superconducting parent compound of iron
chalcogenide, i.e., FeTe single crystal by self flux method. The FeTe single
crystal is crystallized in tetragonal structure with the P4/nmm space group.
The detailed SEM (scanning electron microscopy) results showed that the
crystals are formed in slab like morphology and are near (slight deficiency of
Te) stoichiometric with homogenous distribution of Fe and Te. The coupled
structural and magnetic phase transition is seen at around 70K in both
electrical resistivity and magnetization measurements, which is hysteric
(deltaT = 5K) in nature with cooling and warming cycles. Magnetic
susceptibility (chi-T) measurements showed the magnetic transition to be of
antiferromagnetic nature, which is substantiated by isothermal magnetization
(M-H) plots as well. The temperature dependent electrical resistivity measured
in 10kOe field in both in plane and out of plane field directions showed that
the hysteric width nearly becomes double to deltaT = 10K, and is maximum for
the out of plane field direction for the studied FeTe single crystal. We also
obtained a sharp spike like peak in heat capacity Cp(T) measurement due to the
coupled structural and magnetic order phase transitions.
","[{""version"":""v1"",""created"":""Mon, 13 Jul 2015 04:13:48 GMT""},{""version"":""v2"",""created"":""Fri, 15 Jan 2016 10:16:09 GMT""}]","2016-01-18"
"1507.03321","Alexander Solntsev S","Frank Setzpfandt, Alexander S. Solntsev, James Titchener, Che Wen Wu,
  Chunle Xiong, Roland Schiek, Thomas Pertsch, Dragomir N. Neshev, and Andrey
  A. Sukhorukov","Tunable generation of entangled photons in a nonlinear directional
  coupler",,"Laser Photonics Reviews 10, 131-136 (2016)","10.1002/lpor.201500216",,"quant-ph physics.optics","http://arxiv.org/licenses/nonexclusive-distrib/1.0/","  The on-chip integration of quantum light sources has enabled the realization
of complex quantum photonic circuits. However, for the practical implementation
of such circuits in quantum information applications it is crucial to develop
sources delivering entangled quantum photon states with on-demand tunability.
Here we propose and experimentally demonstrate the concept of a widely tunable
quantum light source based on spontaneous parametric down-conversion in a
nonlinear directional coupler. We show that spatial photon-pair correlations
and entanglement can be reconfigured on-demand by tuning the phase difference
between the pump beams and the phase mismatch inside the structure. We
demonstrate the generation of split states, robust N00N states, various
intermediate regimes and biphoton steering. This fundamental scheme provides an
important advance towards the realization of reconfigurable quantum circuitry.
","[{""version"":""v1"",""created"":""Mon, 13 Jul 2015 04:22:11 GMT""}]","2018-04-12"
"1507.03322","Guodong Shi","Shuangshuang Fu, Guodong Shi, and Ian R. Petersen","Forgetting in the Synchronization of Quantum Networks",,,,,"quant-ph","http://arxiv.org/licenses/nonexclusive-distrib/1.0/","  In this paper, we study the decoherence property of synchronization master
equation for networks of qubits interconnected by swapping operators. The
network Hamiltonian is assumed to be diagonal with different entries so that it
might not be commutative with the swapping operators. We prove a theorem
establishing a general condition under which almost complete decohernece is
achieved, i.e., all but two of the off-diagonal entries of the network density
operator asymptotically tend to zero. This result explicitly shows that quantum
dissipation networks tend to forget the information initially encoded when the
internal (induced by network Hamiltonian) and external (induced by swapping
operators) qubit interactions do not comply with each other.
","[{""version"":""v1"",""created"":""Mon, 13 Jul 2015 04:27:33 GMT""}]","2015-07-14"
"1507.03323","Guodong Shi","Bo Li, Junfeng Wu, Hongsheng Qi, Alexandre Proutiere, and Guodong Shi","Boolean Gossip Networks",,,,,"cs.SI","http://arxiv.org/licenses/nonexclusive-distrib/1.0/","  This paper proposes and investigates a Boolean gossip model as a simplified
but non-trivial probabilistic Boolean network. With positive node interactions,
in view of standard theories from Markov chains, we prove that the node states
asymptotically converge to an agreement at a binary random variable, whose
distribution is characterized for large-scale networks by mean-field
approximation. Using combinatorial analysis, we also successfully count the
number of communication classes of the positive Boolean network explicitly in
terms of the topology of the underlying interaction graph, where remarkably
minor variation in local structures can drastically change the number of
network communication classes. With general Boolean interaction rules,
emergence of absorbing network Boolean dynamics is shown to be determined by
the network structure with necessary and sufficient conditions established
regarding when the Boolean gossip process defines absorbing Markov chains.
Particularly, it is shown that for the majority of the Boolean interaction
rules, except for nine out of the total $2^{16}-1$ possible nonempty sets of
binary Boolean functions, whether the induced chain is absorbing has nothing to
do with the topology of the underlying interaction graph, as long as
connectivity is assumed. These results illustrate possibilities of {relating
dynamical} properties of Boolean networks to graphical properties of the
underlying interactions.
","[{""version"":""v1"",""created"":""Mon, 13 Jul 2015 04:31:12 GMT""},{""version"":""v2"",""created"":""Tue, 25 Oct 2016 04:17:33 GMT""},{""version"":""v3"",""created"":""Thu, 27 Oct 2016 04:33:27 GMT""},{""version"":""v4"",""created"":""Mon, 22 May 2017 02:18:19 GMT""}]","2017-05-23"
"1507.03324","Daniel Haxton","Jeremiah R. Jones, Francois-Henry Rouet, Keith V. Lawler, Eugene
  Vecharynski, Khaled Z. Ibrahim, Samuel Williams, Brant Abeln, Chao Yang,
  Daniel J. Haxton, C. William McCurdy, Xiaoye S. Li, Thomas N. Rescigno","An efficient basis set representation for calculating electrons in
  molecules","Submitted to JCP",,"10.1080/00268976.2016.1176262",,"physics.chem-ph quant-ph","http://arxiv.org/licenses/nonexclusive-distrib/1.0/","  The method of McCurdy, Baertschy, and Rescigno, J. Phys. B, 37, R137 (2004)
is generalized to obtain a straightforward, surprisingly accurate, and scalable
numerical representation for calculating the electronic wave functions of
molecules. It uses a basis set of product sinc functions arrayed on a Cartesian
grid, and yields 1 kcal/mol precision for valence transition energies with a
grid resolution of approximately 0.1 bohr. The Coulomb matrix elements are
replaced with matrix elements obtained from the kinetic energy operator. A
resolution-of-the-identity approximation renders the primitive one- and
two-electron matrix elements diagonal; in other words, the Coulomb operator is
local with respect to the grid indices. The calculation of contracted
two-electron matrix elements among orbitals requires only O(N log(N))
multiplication operations, not O(N^4), where N is the number of basis
functions; N = n^3 on cubic grids. The representation not only is numerically
expedient, but also produces energies and properties superior to those
calculated variationally. Absolute energies, absorption cross sections,
transition energies, and ionization potentials are reported for one- (He^+,
H_2^+ ), two- (H_2, He), ten- (CH_4) and 56-electron (C_8H_8) systems.
","[{""version"":""v1"",""created"":""Mon, 13 Jul 2015 04:44:35 GMT""},{""version"":""v2"",""created"":""Sat, 23 Jan 2016 04:19:35 GMT""}]","2016-08-24"
"1507.03325","Zhao Zhang","Zhao Zhang, Kyle Barbary, Frank Austin Nothaft, Evan Sparks, Oliver
  Zahn, Michael J. Franklin, David A. Patterson, Saul Perlmutter","Scientific Computing Meets Big Data Technology: An Astronomy Use Case",,,,,"cs.DC","http://arxiv.org/licenses/nonexclusive-distrib/1.0/","  Scientific analyses commonly compose multiple single-process programs into a
dataflow. An end-to-end dataflow of single-process programs is known as a
many-task application. Typically, tools from the HPC software stack are used to
parallelize these analyses. In this work, we investigate an alternate approach
that uses Apache Spark -- a modern big data platform -- to parallelize
many-task applications. We present Kira, a flexible and distributed astronomy
image processing toolkit using Apache Spark. We then use the Kira toolkit to
implement a Source Extractor application for astronomy images, called Kira SE.
With Kira SE as the use case, we study the programming flexibility, dataflow
richness, scheduling capacity and performance of Apache Spark running on the
EC2 cloud. By exploiting data locality, Kira SE achieves a 2.5x speedup over an
equivalent C program when analyzing a 1TB dataset using 512 cores on the Amazon
EC2 cloud. Furthermore, we show that by leveraging software originally designed
for big data infrastructure, Kira SE achieves competitive performance to the C
implementation running on the NERSC Edison supercomputer. Our experience with
Kira indicates that emerging Big Data platforms such as Apache Spark are a
performant alternative for many-task scientific applications.
","[{""version"":""v1"",""created"":""Mon, 13 Jul 2015 04:47:04 GMT""},{""version"":""v2"",""created"":""Mon, 14 Mar 2016 19:04:09 GMT""}]","2016-03-15"
"1507.03326","Sang-Sung Lee","Sang-Sung Lee, Do-Young Byun, Chung Sik Oh, Hyo Ryoung Kim, Jongsoo
  Kim, Taehyun Jung, Se-Jin Oh, Duk-Gyoo Roh, Dong-Kyu Jung, and Jae-Hwan Yeom
  (KASI, Korea)","Amplitude Correction Factors of KVN Observations","8 pages, 2 figures, 4 tables, accepted for publication in JKAS",,"10.5303/JKAS.2015.48.5.229",,"astro-ph.IM","http://arxiv.org/licenses/nonexclusive-distrib/1.0/","  We report results of investigation of amplitude calibration for very long
baseline interferometry (VLBI) observations with Korean VLBI Network (KVN).
Amplitude correction factors are estimated based on comparison of KVN
observations at 22~GHz correlated by Daejeon hardware correlator and DiFX
software correlator in Korea Astronomy and Space Science Institute (KASI) with
Very Long Baseline Array (VLBA) observations at 22~GHz by DiFX software
correlator in National Radio Astronomy Observatory (NRAO). We used the
observations for compact radio sources, 3C 454.3, NRAO 512, OJ 287, BL Lac, 3C
279, 1633+382, and 1510-089, which are almost unresolved for baselines in a
range of 350-477 km. Visibility data of the sources obtained with similar
baselines at KVN and VLBA are selected, fringe-fitted, calibrated, and compared
for their amplitudes. We found that visibility amplitudes of KVN observations
should be corrected by factors of 1.10 and 1.35 when correlated by DiFX and
Daejeon correlators, respectively. These correction factors are attributed to
the combination of two steps of 2-bit quantization in KVN observing systems and
characteristics of Daejeon correlator.
","[{""version"":""v1"",""created"":""Mon, 13 Jul 2015 04:52:06 GMT""},{""version"":""v2"",""created"":""Tue, 8 Sep 2015 00:37:07 GMT""}]","2015-11-11"
"1507.03327","Kenji Bekki dr","Kenji Bekki, Hiroyuki Hirashita, and Takuji Tsujimoto","The origin of dust extinction curves with or without the 2175 A bump in
  galaxies: The case of the Magellanic Clouds","31 pages, 13 figures, accepted for the publication in ApJ",,"10.1088/0004-637X/810/1/39",,"astro-ph.GA","http://arxiv.org/licenses/nonexclusive-distrib/1.0/","  The Large and Small Magellanic Clouds (LMC and SMC, respectively) are
observed to have characteristic dust extinction curves that are quite different
from those of the Galaxy (e.g., strength of the 2175 A bump). Although the dust
composition and size distribution of the Magellanic Clouds (MCs) that can
self-consistently explain their observed extinction curves have been already
proposed, it remain unclear whether and how the required dust properties can be
achieved in the formation histories of the MCs. We therefore investigate the
time evolution of the dust properties of the MCs and thereby derive their
extinction curves using one-zone chemical evolution models with formation and
evolution of small and large silicate and carbonaceous dust grains and dusty
winds associated with starburst events. We find that the observed SMC
extinction curve without a conspicuous 2175 A bump can be reproduced well by
our SMC model, if the small carbon grains can be selectively lost through the
dust wind during the latest starburst about 0.2 Gyr ago. We also find that the
LMC extinction curve with a weak 2175 A bump can be reproduced by our LMC model
with less efficient removal of dust through dust wind. We discuss possible
physical reasons for different dust wind efficiencies between silicate and
graphite and among galaxies.
","[{""version"":""v1"",""created"":""Mon, 13 Jul 2015 04:53:15 GMT""}]","2015-09-09"
"1507.03328","Wei Chen","Wei Chen, Fu Li, Tian Lin, Aviad Rubinstein","Combining Traditional Marketing and Viral Marketing with Amphibious
  Influence Maximization","An extended abstract appeared in the Proceedings of the 16th ACM
  Conference on Economics and Computation (EC), 2015",,,,"cs.SI","http://arxiv.org/licenses/nonexclusive-distrib/1.0/","  In this paper, we propose the amphibious influence maximization (AIM) model
that combines traditional marketing via content providers and viral marketing
to consumers in social networks in a single framework. In AIM, a set of content
providers and consumers form a bipartite network while consumers also form
their social network, and influence propagates from the content providers to
consumers and among consumers in the social network following the independent
cascade model. An advertiser needs to select a subset of seed content providers
and a subset of seed consumers, such that the influence from the seed providers
passing through the seed consumers could reach a large number of consumers in
the social network in expectation.
  We prove that the AIM problem is NP-hard to approximate to within any
constant factor via a reduction from Feige's k-prover proof system for 3-SAT5.
We also give evidence that even when the social network graph is trivial (i.e.
has no edges), a polynomial time constant factor approximation for AIM is
unlikely. However, when we assume that the weighted bi-adjacency matrix that
describes the influence of content providers on consumers is of constant rank,
a common assumption often used in recommender systems, we provide a
polynomial-time algorithm that achieves approximation ratio of
$(1-1/e-\epsilon)^3$ for any (polynomially small) $\epsilon > 0$. Our
algorithmic results still hold for a more general model where cascades in
social network follow a general monotone and submodular function.
","[{""version"":""v1"",""created"":""Mon, 13 Jul 2015 05:04:10 GMT""}]","2015-07-14"
"1507.03329","Michael Brown","Michael K. Brown","Knoerrer Periodicity and Bott Periodicity","32 pages. Corrected a few minor typos. To appear in Documenta
  Mathematica",,,,"math.AC math.KT","http://arxiv.org/licenses/nonexclusive-distrib/1.0/","  The goal of this article is to explain a precise sense in which Knoerrer
periodicity in commutative algebra and Bott periodicity in topological K-theory
are compatible phenomena. Along the way, we prove an 8-periodic version of
Knoerrer periodicity for real isolated hypersurface singularities, and we
construct a homomorphism from the Grothendieck group of the homotopy category
of matrix factorizations of a complex (real) polynomial $f$ into the
topological K-theory of its Milnor fiber (positive or negative Milnor fiber).
","[{""version"":""v1"",""created"":""Mon, 13 Jul 2015 05:07:27 GMT""},{""version"":""v2"",""created"":""Mon, 25 Jul 2016 20:45:48 GMT""},{""version"":""v3"",""created"":""Sat, 6 Aug 2016 09:35:48 GMT""},{""version"":""v4"",""created"":""Sun, 23 Oct 2016 19:55:31 GMT""}]","2016-10-25"
"1507.03330","Nicolas Sandeau","Jacob Szeftel, Nicolas Sandeau, Antoine Khater","On the physical significance of London's equation","arXiv admin note: substantial text overlap with arXiv:1407.1231",,,,"cond-mat.supr-con","http://arxiv.org/licenses/nonexclusive-distrib/1.0/","  The Meissner effect is analysed by using an approach based on Newton and
Maxwell's equations, in order to assess the relevance of London's equation. The
Hall effect is predicted. Two test experiments are proposed in detail to check
the validity of this theory and to measure London's length.
","[{""version"":""v1"",""created"":""Mon, 13 Jul 2015 06:15:05 GMT""}]","2015-07-19"
"1507.03331","Victor Magron","Victor Magron, George Constantinides, Alastair Donaldson","Certified Roundoff Error Bounds Using Semidefinite Programming","32 pages, 7 figures, 4 tables",,,,"cs.NA","http://arxiv.org/licenses/nonexclusive-distrib/1.0/","  Roundoff errors cannot be avoided when implementing numerical programs with
finite precision. The ability to reason about rounding is especially important
if one wants to explore a range of potential representations, for instance for
FPGAs or custom hardware implementations. This problem becomes challenging when
the program does not employ solely linear operations, and non-linearities are
inherent to many interesting computational problems in real-world applications.
  Existing solutions to reasoning possibly lead to either inaccurate bounds or
high analysis time in the presence of nonlinear correlations between variables.
Furthermore, while it is easy to implement a straightforward method such as
interval arithmetic, sophisticated techniques are less straightforward to
implement in a formal setting. Thus there is a need for methods which output
certificates that can be formally validated inside a proof assistant.
  We present a framework to provide upper bounds on absolute roundoff errors of
floating-point nonlinear programs. This framework is based on optimization
techniques employing semidefinite programming and sums of squares certificates,
which can be checked inside the Coq theorem prover to provide formal roundoff
error bounds for polynomial programs. Our tool covers a wide range of nonlinear
programs, including polynomials and transcendental operations as well as
conditional statements. We illustrate the efficiency and precision of this tool
on non-trivial programs coming from biology, optimization and space control.
Our tool produces more accurate error bounds for 23% of all programs and yields
better performance in 66% of all programs.
","[{""version"":""v1"",""created"":""Mon, 13 Jul 2015 06:21:01 GMT""},{""version"":""v2"",""created"":""Wed, 9 Dec 2015 18:18:00 GMT""},{""version"":""v3"",""created"":""Mon, 15 Feb 2016 23:11:14 GMT""},{""version"":""v4"",""created"":""Thu, 3 Mar 2016 18:44:50 GMT""},{""version"":""v5"",""created"":""Fri, 5 Aug 2016 15:25:50 GMT""},{""version"":""v6"",""created"":""Sun, 6 Nov 2016 16:59:31 GMT""},{""version"":""v7"",""created"":""Fri, 25 Nov 2016 11:11:56 GMT""}]","2016-11-28"
"1507.03332","Ruobing Chen","Ruobing Chen, Stefan Wild","Randomized Derivative-Free Optimization of Noisy Convex Functions",,,,,"math.OC","http://arxiv.org/licenses/nonexclusive-distrib/1.0/","  We propose STARS, a randomized derivative-free algorithm for unconstrained
optimization when the function evaluations are contaminated with random noise.
STARS takes dynamic, noise-adjusted smoothing step-sizes that minimize the
least-squares error between the true directional derivative of a noisy function
and its finite difference approximation. We provide a convergence rate analysis
of STARS for solving convex problems with additive or multiplicative noise.
Experimental results show that (1) STARS exhibits noise-invariant behavior with
respect to different levels of stochastic noise; (2) the practical performance
of STARS in terms of solution accuracy and convergence rate is significantly
better than that indicated by the theoretical result; and (3) STARS outperforms
a selection of randomized zero-order methods on both additive and
multiplicative-noisy functions.
","[{""version"":""v1"",""created"":""Mon, 13 Jul 2015 06:42:00 GMT""}]","2015-07-14"
