"1507.03439","Michael Etscheid","Michael Etscheid, Stefan Kratsch, Matthias Mnich, Heiko R\""oglin","Polynomial Kernels for Weighted Problems",,,,,"cs.CC","http://arxiv.org/licenses/nonexclusive-distrib/1.0/","  Kernelization is a formalization of efficient preprocessing for NP-hard
problems using the framework of parameterized complexity. Among open problems
in kernelization it has been asked many times whether there are deterministic
polynomial kernelizations for Subset Sum and Knapsack when parameterized by the
number $n$ of items.
  We answer both questions affirmatively by using an algorithm for compressing
numbers due to Frank and Tardos (Combinatorica 1987). This result had been
first used by Marx and V\'egh (ICALP 2013) in the context of kernelization. We
further illustrate its applicability by giving polynomial kernels also for
weighted versions of several well-studied parameterized problems. Furthermore,
when parameterized by the different item sizes we obtain a polynomial
kernelization for Subset Sum and an exponential kernelization for Knapsack.
Finally, we also obtain kernelization results for polynomial integer programs.
","[{""version"":""v1"",""created"":""Mon, 13 Jul 2015 13:15:14 GMT""}]","2015-07-14"
"1507.03440","Massimiliano Stengel","Massimiliano Stengel and David Vanderbilt","First-principles theory of flexoelectricity","56 pages, 12 figures, 7 tables. To be published in ""Flexoelectricity
  in Solids: From Theory to Applications"", A.K. Tagantsev and P. Yudin, eds.
  (World Scientific, Singapore)",,,,"cond-mat.mtrl-sci","http://arxiv.org/licenses/nonexclusive-distrib/1.0/","  In this Chapter we provide an overview of the current first-principles
perspective on flexoelectric effects in crystalline solids. We base our
theoretical formalism on the long-wave expansion of the electrical response of
a crystal to an acoustic phonon perturbation. In particular, we recover the
known expression for the piezoelectric tensor from the response at first order
in wavevector ${\bf q}$, and then obtain the flexoelectric tensor by extending
the formalism to second order in $\bf q$. We put special emphasis on the issue
of surface effects, which we first analyze heuristically, and then treat more
carefully by presenting a general theory of the microscopic response to an
arbitrary inhomogeneous strain. We demonstrate our approach by presenting a
full calculation of the flexoelectric response of a SrTiO$_3$ film, where we
point out an unusually strong dependence of the bending-induced open-circuit
voltage on the choice of surface termination. Finally, we briefly discuss some
remaining open issues concerning the methodology and some promising areas for
future research.
","[{""version"":""v1"",""created"":""Mon, 13 Jul 2015 13:15:34 GMT""},{""version"":""v2"",""created"":""Tue, 28 Jul 2015 12:13:08 GMT""}]","2015-07-29"
"1507.03441","Piotr Mikusinski","Piotr Mikusi\'nski","Transfunctions",,,,,"math.FA","http://arxiv.org/licenses/nonexclusive-distrib/1.0/","  Maps between spaces of measures on measurable spaces $(X,\Sigma_X)$ and $(Y,
\Sigma_Y)$ are treated as generalized functions between $X$ and $Y$.
","[{""version"":""v1"",""created"":""Mon, 13 Jul 2015 13:18:05 GMT""}]","2015-07-14"
"1507.03442","Erasmo Ferreira","H. G. Dosch, E. Ferreira","Diffractive Electromagnetic Processes from a Regge Point of View","13 pages, 10 figures To be published in Physical Review D. arXiv
  admin note: substantial text overlap with arXiv:1503.06649 This article
  extends and replaces arXiv:1503.06649 . The present v2 only changes layout
  and organizes references with respect to v1",,,,"hep-ph","http://arxiv.org/licenses/nonexclusive-distrib/1.0/","  The energy dependence of the cross sections for electromagnetic diffractive
processes can be well described by a single power, $W^\delta$. For $J/\psi$
photoproduction this holds in the range from 20 GeV to 2 TeV. This feature is
most easily explained by a single pole in the angular momentum plane which
depends on the scale of the process, at least in a certain range of values of
the momentum transfer. It is shown that this assumption allows a unified
description of all electromagnetic elastic diffractive processes. We also
discuss an alternative model with an energy dependent dipole cross section,
which is compatible with the data up to 2 TeV and which shows an energy
behaviour typical for a cut in the angular momentum plane.
","[{""version"":""v1"",""created"":""Mon, 13 Jul 2015 13:20:53 GMT""},{""version"":""v2"",""created"":""Tue, 28 Jul 2015 18:19:49 GMT""}]","2015-07-29"
"1507.03443","Umberto Marini Bettolo Marconi","Umberto Marini Bettolo Marconi and Claudio Maggi","Towards a statistical mechanical theory of active fluids","18 pages, 4 figures, Soft Matter, September 11, 2015",,"10.1039/C5SM01718A",,"cond-mat.soft cond-mat.stat-mech","http://arxiv.org/licenses/nonexclusive-distrib/1.0/","  We present a stochastic description of a model of N mutually repelling active
spheres in the presence of external fields and characterize its steady state
behavior. To reproduce the effects of the experimentally observed persistence
of the trajectories of the active particles we consider a Gaussian forcing
having a non vanishing correlation time $\tau$, whose finiteness is a measure
of the activity of the system. With these ingredients we show that it is
possible to develop a statistical mechanical approach similar to the one
employed in the study of equilibrium liquids and to obtain the explicit form of
the many-particle distribution function by means of the multidimensional
unified colored noise approximation. Such a distribution plays a role analogous
to the Gibbs distribution in equilibrium statistical mechanics and provides a
complete information about the microscopic state of the system. From here we
develop a method to determine the one and two-particle distribution functions
in the spirit of the Born-Green-Yvon (BGY) equations of equilibrium statistical
mechanics. The resulting equations which contain extra-correlations induced by
the activity allow to determine the stationary density profiles in the presence
of external fields, the pair correlations and the pressure of active fluids. In
the low density regime we obtain the effective pair potential $\phi(r)$ acting
between two isolated particles separated by a distance, $r$, showing the
existence an effective attraction between them induced by activity. Based on
these results, in the second half of the paper we propose a mean field theory
as an approach simpler than the BGY hierarchy and use it to derive a van der
Waals expression of the equation of state, which can serve as the basis to
understand the phase behavior of active fluids.
","[{""version"":""v1"",""created"":""Mon, 13 Jul 2015 13:22:34 GMT""},{""version"":""v2"",""created"":""Mon, 2 Nov 2015 19:01:59 GMT""}]","2015-11-03"
"1507.03444","Abhik Kumar Sanyal Dr.","Kaushik Sarkar, Nayem Sk, Ranajit Mandal and Abhik Kumar Sanyal","Canonical formulation of Pais-Ulhenbeck action and resolving the issue
  of branched Hamiltonian","17 pages",,,,"hep-th","http://arxiv.org/licenses/nonexclusive-distrib/1.0/","  Shortcomings of Dirac's constrained analysis in the context of fourth order
Pais-Uhlenbeck oscillator action and the appearance of badly affected
phase-space Hamiltonian for a generalized fourth order oscillator action,
following Ostrogradski, Dirac and Horowitz's formalism, require a viable
canonical formulation. This is achieved only after fixing appropriate variables
at the end points and taking care of the counter surface terms obtained from
variational principle. In the process a one-to-one correspondence between
different higher order theories has been established. On the other hand the
issue of branched Hamiltonian appearing in the presence of velocities with
degree higher than two in the Lagrangian, has not been resolved uniquely as
yet. However, often such terms appear with higher order theory, gravity in
particular. Here we show that canonical formulation of higher order theory
takes care of the issue elegantly.
","[{""version"":""v1"",""created"":""Mon, 13 Jul 2015 13:23:41 GMT""},{""version"":""v2"",""created"":""Mon, 21 Sep 2015 07:09:14 GMT""},{""version"":""v3"",""created"":""Wed, 7 Sep 2016 04:50:25 GMT""}]","2016-09-08"
"1507.03445","Vladimir Braun M","V.M. Braun, A.N. Manashov, N. Offen","Evolution equation for the higher-twist B-meson distribution amplitude","Extended version, includes new results on the large momentum limit
  and a detailed study of the evolution effects in a simple model","Phys. Rev. D 92, 074044 (2015)","10.1103/PhysRevD.92.074044","DESY-15-108","hep-ph hep-th","http://arxiv.org/licenses/nonexclusive-distrib/1.0/","  We find that the evolution equation for the three-particle quark-gluon
B-meson light-cone distribution amplitude (DA) of subleading twist is
completely integrable in the large $N_c$ limit and can be solved exactly. The
lowest anomalous dimension is separated from the remaining, continuous,
spectrum by a finite gap. The corresponding eigenfunction coincides with the
contribution of quark-gluon states to the two-particle DA $\phi_-(\omega)$ so
that the evolution equation for the latter is the same as for the leading-twist
DA $\phi_+(\omega)$ up to a constant shift in the anomalous dimension. Thus,
``genuine'' three-particle states that belong to the continuous spectrum
effectively decouple from $\phi_-(\omega)$ to the leading-order accuracy. In
turn, the scale dependence of the full three-particle DA turns out to be
nontrivial so that the contribution with the lowest anomalous dimension does
not become leading at any scale. The results are illustrated on a simple model
that can be used in studies of $1/m_b$ corrections to heavy-meson decays in the
framework of QCD factorization or light-cone sum rules.
","[{""version"":""v1"",""created"":""Mon, 13 Jul 2015 13:25:08 GMT""},{""version"":""v2"",""created"":""Mon, 19 Oct 2015 15:26:40 GMT""}]","2015-11-04"
"1507.03446","Marcus Neuer","Marcus J. Neuer, Christian Henke and Elmar Jacobs","Forecasting the direction of incoming radiation based on fusion of
  gyroscopic and spectroscopic data","7 pages, 4 figures",,,,"physics.ins-det","http://arxiv.org/licenses/nonexclusive-distrib/1.0/","  A method is shown to estimate the position of a radioactive source by fusing
the data from a sodium iodide detector and a gyroscope while panning the
detector. Based on simple geometry considerations, the search motion of a
detector is modelled as angular panning. Correlation of both sensor streams is
shown as a predictor for the direction of the incoming radiation. The method
also allows for a rough distance classification, where a distant source or a
homogenous radiation field can be distinguished from a single source near to
the detector.
","[{""version"":""v1"",""created"":""Mon, 13 Jul 2015 13:25:27 GMT""}]","2015-07-14"
"1507.03447","Chris Hanson S","Chris S. Hanson, Alina C. Donea and K.D. Leka","Enhanced Acoustic Emission in Relation to the Acoustic Halo Surrounding
  Active Region 11429","19 pages, 8 figures, Accepted by Solar Physics",,"10.1007/s11207-015-0743-7",,"astro-ph.SR","http://arxiv.org/licenses/nonexclusive-distrib/1.0/","  The use of acoustic holography in the high-frequency $p$-mode spectrum can
resolve the source distributions of enhanced acoustic emissions within halo
structures surrounding active regions. In doing so, statistical methods can
then be applied to ascertain relationships with the magnetic field. This is the
focus of this study. The mechanism responsible for the detected enhancement of
acoustic sources around solar active regions has not yet been explained.
Furthermore the relationship between the magnetic field and enhanced acoustic
emission has not yet been comprehensively examined. We have used vector
magnetograms from the \Helioseismic and Magnetic Imager (HMI) on-board the
Solar Dynamics Observatory (SDO) to image the magnetic-field properties in the
halo. We have studied the acoustic morphology of an active region, with a
complex halo and ""glories,"" and we have linked some acoustic properties to the
magnetic-field configuration. In particular, we find that acoustic sources are
significantly enhanced in regions of intermediate field strength with
inclinations no different from the distributions found in the quiet Sun.
Additionally we have identified a transition region between the active region
and the halo, in which the acoustic source power is hindered by inclined fields
of intermediate field strength. Finally, we have compared the results of
acoustic emission maps, calculated from holography, and the commonly used local
acoustic maps, finding that the two types of maps have similar properties with
respect to the magnetic field but lack spatial correlation when examining the
highest-powered regions.
","[{""version"":""v1"",""created"":""Mon, 13 Jul 2015 13:25:47 GMT""}]","2015-08-06"
"1507.03448","Sethupathy S","Sethupathy S and Udaya Kumar","Augmenting Numerical Stability of the Galerkin Finite Element
  Formulation for Electromagnetic Flowmeter Analysis","IET Science, Measurement & Technology, 2016",,"10.1049/iet-smt.2015.0159",,"math.NA","http://creativecommons.org/licenses/by/4.0/","  The magnetic flow meter is one of the best possible choice for the
measurement of flow rate of liquid metals in fast breeder reactors. Due to the
associated complexities in the measuring environment, theoretical evaluation of
their sensitivity is always preferred. In order to consider the 3D nature of
the problem and the general flow patterns, numerical field computational
approach is inevitable. When classical Galerkin's finite element formulation is
employed for the solution, it is known to introduce numerical oscillations at
high flow rates. The magnetic field produced by the flow induced currents
circulate within the fluid and forms the source of this numerical problem. To
overcome this, modified methods like stream-line upwind Petrov-Galerkin schemes
are generally suggested in the allied areas like fluid dynamics, in which a
similar dominance of advective (curl or circulation) component occurs over
diffusion (divergence) component. After a careful analysis of the numerical
instability through a reduced one dimensional problem, an elegant stable
approach is devised. In this scheme, a pole-zero cancellation approach is
adopted. The proposed scheme is shown to be absolutely stable. However, at
lower flow rates numerical results exhibits small oscillation, which can be
controlled by reducing the element size. The source of stability at higher flow
rates, as well as, oscillations at lower flow rates are analysed using
analytical solution of the associated difference equation. Finally the proposed
approach is applied to the original flow meter problem and the solution is
shown to be stable.
","[{""version"":""v1"",""created"":""Mon, 13 Jul 2015 13:27:13 GMT""},{""version"":""v2"",""created"":""Tue, 14 Jul 2015 05:19:20 GMT""},{""version"":""v3"",""created"":""Tue, 4 Aug 2015 12:40:51 GMT""},{""version"":""v4"",""created"":""Thu, 12 Nov 2015 17:25:21 GMT""},{""version"":""v5"",""created"":""Wed, 3 Feb 2016 12:18:36 GMT""},{""version"":""v6"",""created"":""Wed, 3 Aug 2016 12:34:55 GMT""}]","2016-08-04"
"1507.03449","Stephen Lovesey","S. W. Lovesey","Electronic and magnetic properties of orthorhombic iron selenide (FeSe)",,"Phys. Rev. B 93, 085126 (2016)","10.1103/PhysRevB.93.085126",,"cond-mat.str-el","http://arxiv.org/licenses/nonexclusive-distrib/1.0/","  Iron orbitals in orthorhombic iron selenide (FeSe) can produce charge-like
multipoles that are polar (parity-odd). Orbitals in question include Fe(3d),
Fe(4p) and p-type ligands that participate in transport properties and bonding.
The polar multipoles may contribute weak, space-group forbidden Bragg spots to
diffraction patterns collected with x-rays tuned in energy to a Fe atomic
resonance (Templeton & Templeton scattering). Ordering of conventional, axial
magnetic dipoles does not accompany the tetragonal-orthorhombic structural
phase transition in FeSe, unlike other known iron-based superconductors. We
initiate a new line of inquiry for this puzzling property of orthorhombic FeSe,
using a hidden magnetic-order that belongs to the m'm'm' magnetic
crystal-class. It is epitomized by the absence of ferromagnetism and axial
magnetic dipoles, and the appearance of magnetic monopoles and magneto-electric
quadrupoles. A similar magnetic order occurs in cuprate superconductors, YBCO &
Hg1201, where it was unveiled with the Kerr effect and in Bragg diffraction
patterns revealed by polarized neutrons. PACS number 75.25.-j
","[{""version"":""v1"",""created"":""Mon, 13 Jul 2015 13:29:25 GMT""},{""version"":""v2"",""created"":""Tue, 12 Jan 2016 10:56:59 GMT""},{""version"":""v3"",""created"":""Sun, 24 Jan 2016 17:05:36 GMT""}]","2016-03-09"
"1507.03450","Alexandru Dimca","Alexandru Dimca and Gabriel Sticlaru","Free and nearly free surfaces in $P^3$","v6: Question 5.16 is replaced by Example 5.17 containing examples
  kindly provided by Aldo Conca. Question 5.17 is replaced by Remark 5.18.
  Section 6 is discarded and the references are updated","Asian J. Math. 22 (2018), 787--810",,,"math.AG math.AC","http://arxiv.org/licenses/nonexclusive-distrib/1.0/","  We define the nearly free surfaces in $P^3$ and show that the Hilbert
polynomial of the Milnor algebra of a free or nearly free surface in $P^3$ can
be expressed in terms of the exponents. An analog of Saito's criterion of
freeness in the case of nearly free divisors is proven and examples of
irreducible free and nearly free surfaces are given.
","[{""version"":""v1"",""created"":""Mon, 13 Jul 2015 13:30:40 GMT""},{""version"":""v2"",""created"":""Mon, 20 Jul 2015 13:33:56 GMT""},{""version"":""v3"",""created"":""Thu, 30 Jul 2015 13:10:37 GMT""},{""version"":""v4"",""created"":""Tue, 25 Aug 2015 14:35:54 GMT""},{""version"":""v5"",""created"":""Tue, 17 Nov 2015 12:17:45 GMT""},{""version"":""v6"",""created"":""Thu, 13 Apr 2017 13:56:19 GMT""}]","2019-09-17"
"1507.03451","Joshua D. McGraw","Joshua D. McGraw, Tak Shing Chan, Simon Maurer, Thomas Salez, Michael
  Benzaquen, \'Elie Rapha\""el, Martin Brinkmann, Karin Jacobs","Slip-Mediated Dewetting of Polymer Microdroplets","19 pages, 4 figures + 6 figures in supporting information","Proceedings of the National Academy of Sciences of the USA, 113
  1168 (2016)","10.1073/pnas.1513565113",,"cond-mat.soft physics.flu-dyn","http://arxiv.org/licenses/nonexclusive-distrib/1.0/","  Classical hydrodynamic models predict that infinite work is required to move
a three-phase contact line, defined here as the line where a liquid/vapor
interface intersects a solid surface. Assuming a slip boundary condition, in
which the liquid slides against the solid, such an unphysical prediction is
avoided. In this article, we present the results of experiments in which a
contact line moves and where slip is a dominating and controllable factor.
Spherical cap shaped polystyrene microdroplets, with non-equilibrium contact
angle, are placed on solid self-assembled monolayer coatings from which they
dewet. The relaxation is monitored using \textit{in situ} atomic force
microscopy. We find that slip has a strong influence on the droplet evolutions,
both on the transient non-spherical shapes and contact line dynamics. The
observations are in agreement with scaling analysis and boundary element
numerical integration of the governing Stokes equations, including a Navier
slip boundary condition.
","[{""version"":""v1"",""created"":""Mon, 13 Jul 2015 13:30:48 GMT""},{""version"":""v2"",""created"":""Mon, 18 Jan 2016 20:43:10 GMT""},{""version"":""v3"",""created"":""Wed, 9 Mar 2016 10:25:44 GMT""}]","2016-04-27"
"1507.03452","Adrien Le Boudec","Adrien Le Boudec","C*-simplicity and the amenable radical","The previous versions of this article were entitled ""Discrete groups
  that are not C*-simple"". The results have been strengthened and Theorem D has
  been added",,,,"math.GR math.OA","http://arxiv.org/licenses/nonexclusive-distrib/1.0/","  A countable group is C*-simple if its reduced C*-algebra is simple. It is
well known that C*-simplicity implies that the amenable radical of the group
must be trivial. We show that the converse does not hold by constructing
explicit counter-examples. We additionally prove that every countable group
embeds into a countable group with trivial amenable radical and that is not
C*-simple.
","[{""version"":""v1"",""created"":""Mon, 13 Jul 2015 13:32:33 GMT""},{""version"":""v2"",""created"":""Mon, 20 Jul 2015 15:15:41 GMT""},{""version"":""v3"",""created"":""Mon, 2 Nov 2015 11:43:16 GMT""},{""version"":""v4"",""created"":""Sat, 29 Oct 2016 07:15:38 GMT""}]","2016-11-01"
"1507.03453","Wenlong Yuan","Wenlong Yuan, Xiaocong Ai, Xiaobin Ji, Shenjian Chen, Yao Zhang,
  Linghui Wu, Liangliang Wang, Ye Yuan","Study of tracking efficiency and its systematic uncertainty from $J/\psi
  \to p \overline{p} \pi^+ \pi^-$ at BESIII","6 pages, 6 figures, accepted by Chinese Physics C",,"10.1088/1674-1137/40/2/026201",,"hep-ex","http://arxiv.org/licenses/nonexclusive-distrib/1.0/","  Based on $J/\psi$ events collected with the BESIII detector, with
corresponding Monte Carlo samples, the tracking efficiency and its systematic
uncertainty are studied using a control sample of $J/\psi \to p \overline p
\pi^+ \pi^-$. Validation methods and different factors influencing the tracking
efficiency are presented in detail. The tracking efficiency and its systematic
uncertainty for protons and pions with the transverse momentum and polar angle
dependence are also discussed.
","[{""version"":""v1"",""created"":""Mon, 13 Jul 2015 13:38:06 GMT""},{""version"":""v2"",""created"":""Thu, 22 Oct 2015 07:54:12 GMT""}]","2016-08-03"
"1507.03454","Francesco Maggi","Eric A. Carlen, Francesco Maggi","Stability for the Brunn-Minkowski and Riesz rearrangement inequalities,
  with applications to Gaussian concentration and finite range non-local
  isoperimetry","26 pages",,,,"math.OC math-ph math.MP math.PR","http://arxiv.org/licenses/nonexclusive-distrib/1.0/","  We provide a simple, general argument to obtain improvements of
concentration-type inequalities starting from improvements of their
corresponding isoperimetric-type inequalities. We apply this argument to obtain
robust improvements of the Brunn-Minkowski inequality (for Minkowski sums
between generic sets and convex sets) and of the Gaussian concentration
inequality. The former inequality is then used to obtain a robust improvement
of the Riesz rearrangement inequality under certain natural conditions. These
conditions are compatible with the applications to a finite-range nonlocal
isoperimetric problem arising in statistical mechanics.
","[{""version"":""v1"",""created"":""Mon, 13 Jul 2015 13:43:46 GMT""}]","2015-07-14"
"1507.03455","Wang Qing","Chao-Qiang Geng, Da Huang, Lu-Hsing Tsai and Qing Wang","Connecting Neutrino Masses and Dark Matter by High-dimensional Lepton
  Number Violation Operator","19 pages, 5 figures",,,,"hep-ph","http://creativecommons.org/licenses/by/4.0/","  We propose a new model with the Majorana neutrino masses generated at
two-loop level, in which the lepton number violation (LNV) processes, such as
neutrinoless double beta decays, are mainly induced by the dimension-7 LNV
effective operator O_7=\bar l_R^c \gamma^\mu L_L(D_mu \Phi) \Phi \Phi. Note
that it is necessary to impose an Z_2 symmetry in order that O_7 dominates over
the conventional dimension-5 Weinberg operator, which naturally results in a
stable Z_2-odd neutral particle to be the cold dark matter candidate. More
interestingly, due to the non-trivial dependence of the charged lepton masses,
the model predicts the neutrino mass matrix to be in the form of the normal
hierarchy. We also focus on a specific parameter region of great
phenomenological interests, such as electroweak precision tests, dark matter
direct searches along with its relic abundance, and lepton flavor violation
processes.
","[{""version"":""v1"",""created"":""Mon, 13 Jul 2015 13:43:49 GMT""}]","2015-07-14"
"1507.03456","Massimo Giovannini","Massimo Giovannini","The refractive index of relic gravitons","30 pages, 7 figures",,"10.1088/0264-9381/33/12/125002","CERN-PH-TH/2015-161","astro-ph.CO gr-qc hep-ph hep-th","http://arxiv.org/licenses/nonexclusive-distrib/1.0/","  The dynamical evolution of the refractive index of the tensor modes of the
geometry produces a specific class of power spectra characterized by a blue
(i.e. slightly increasing) slope which is directly determined by the
competition of the slow-roll parameter and of the rate of variation of the
refractive index. Throughout the conventional stages of the inflationary and
post-inflationary evolution, the microwave background anisotropies
measurements, the pulsar timing limits and the big-bang nucleosythesis
constraints set stringent bounds on the refractive index and on its rate of
variation. Within the physically allowed region of the parameter space the
cosmic background of relic gravitons leads to a potentially large signal for
the ground based detectors (in their advanced version) and for the proposed
space-borne interferometers. Conversely, the lack of direct detection of the
signal will set a qualitatively new bound on the dynamical variation of the
refractive index.
","[{""version"":""v1"",""created"":""Mon, 13 Jul 2015 13:44:35 GMT""}]","2016-05-25"
