"1507.07061","Jirong Mao","J. Mao, M. Ono, S. Nagataki, M. Hashimoto, H. Ito, J. Matsumoto, M. G.
  Dainotti, S.-H. Lee","Matter Mixing in Core-collapse Supernova Ejecta: Large Density
  Perturbations in the Progenitor Star?","ApJ accepted",,,,"astro-ph.HE astro-ph.SR","http://arxiv.org/licenses/nonexclusive-distrib/1.0/","  Matter mixing is one important topic in the study of core-collapse supernova
(CCSN) explosions. In this paper, we perform two-dimensional hydrodynamic
simulations to reproduce the high velocity $^{56}$Ni clumps observed in SN
1987A. This is the first time that large density perturbation is proposed in
the CCSN progenitor to generate Rayleigh-Taylor (RT) instability and make the
effective matter mixing. In the case of a spherical explosion, RT instability
is efficient at both C+O/He and He/H interfaces of the SN progenitor. Radial
coherent structures shown in perturbation patterns are important for obtaining
high velocity $^{56}$Ni clumps. We can also obtain matter mixing features and
high velocity $^{56}$Ni clumps in some cases of aspherical explosion. We find
that one of the most favorable models in our work has a combination of bipolar
and equatorially asymmetric explosions in which at least 25\% of density
perturbation is introduced at different composition interfaces of the CCSN
progenitor. These simulation results are comparable to the observational
findings of SN 1987A.
","[{""version"":""v1"",""created"":""Sat, 25 Jul 2015 03:27:52 GMT""}]","2015-07-28"
"1507.07062","Kaige Hu","Kaige Hu and Ruiqin Zhang","A second mapping method in generalized discrete singular convolution
  algorithm: regularizing singularities for one electron system","25 pages, 5 figures, 8 tables",,,,"physics.comp-ph","http://arxiv.org/licenses/nonexclusive-distrib/1.0/","  A second mapping method is introduced in the generalized discrete singular
convolution algorithm. The mapping approaches are adopted to regularize
singularities for one electron system. The applications of the two mapping
methods are generalized from the radial hydrogen problem to the one-dimensional
hydrogen problem. Three mapping functions are chosen: the square-root mapping
function, the cube-root mapping function, and the logarithm mapping function.
However, the present mapping approaches fail in both the two-dimensional and
three-dimensional hydrogen problems, because the wavefunctions of s-states at
the nuclei are not correct.
","[{""version"":""v1"",""created"":""Sat, 25 Jul 2015 03:32:03 GMT""}]","2015-07-28"
"1507.07063","Nitin Samarth","Joon Sue Lee, Anthony Richardella, Danielle Reifsnyder Hickey, K.
  Andre Mkhoyan, and Nitin Samarth","Mapping the chemical potential dependence of current-induced spin
  polarization in a topological insulator",,"Phys. Rev. B 92, 155312 (2015)","10.1103/PhysRevB.92.155312",,"cond-mat.mes-hall","http://arxiv.org/licenses/nonexclusive-distrib/1.0/","  We report electrical measurements of the current-induced spin polarization of
the surface current in topological insulator devices where contributions from
bulk and surface conduction can be disen- tangled by electrical gating. The
devices use a ferromagnetic tunnel junction (permalloy/Al2O3) as a spin
detector on a back-gated (Bi,Sb)2Te3 channel. We observe hysteretic voltage
signals as the magnetization of the detector ferromagnet is switched parallel
or anti-parallel to the spin polariza- tion of the surface current. The
amplitude of the detected voltage change is linearly proportional to the
applied DC bias current in the (Bi,Sb)2Te3 channel. As the chemical potential
is tuned from the bulk bands into the surface state band, we observe an
enhancement of the spin-dependent voltages up to 300% within the range of the
electrostatic gating. Using a simple model, we extract the spin polarization
near charge neutrality (i.e. the Dirac point).
","[{""version"":""v1"",""created"":""Sat, 25 Jul 2015 03:38:31 GMT""}]","2015-10-28"
"1507.07064","Hadi Hosseini","Hadi Hosseini and Kate Larson","Strategyproof Quota Mechanisms for Multiple Assignment Problems","16 pages",,,,"cs.GT","http://arxiv.org/licenses/nonexclusive-distrib/1.0/","  We study the problem of allocating multiple objects to agents without
transferable utilities, where each agent may receive more than one object
according to a quota. Under lexicographic preferences, we characterize the set
of strategyproof, non-bossy, and neutral quota mechanisms and show that under a
mild Pareto efficiency condition, serial dictatorship quota mechanisms are the
only mechanisms satisfying these properties. Dropping the neutrality
requirement, this class of quota mechanisms further expands to sequential
dictatorship quota mechanisms. We then extend quota mechanisms to randomized
settings, and show that the random serial dictatorship quota mechanisms (RSDQ)
are envyfree, strategyproof, and ex post efficient for any number of agents and
objects and any quota system, proving that the well-studied Random Serial
Dictatorship (RSD) satisfies envyfreeness when preferences are lexicographic.
","[{""version"":""v1"",""created"":""Sat, 25 Jul 2015 03:41:43 GMT""},{""version"":""v2"",""created"":""Sat, 17 Dec 2016 00:45:47 GMT""}]","2016-12-20"
"1507.07065","Elena Pavelescu","Danielle O'Donnol and Elena Pavelescu","The total Thurston-Bennequin number of complete and complete bipartite
  Legendrian graphs","17 pages, 16 figures",,,,"math.GT","http://arxiv.org/licenses/nonexclusive-distrib/1.0/","  We study the Thurston-Bennequin number of complete and complete bipartite
Legendrian graphs. We define a new invariant called the total
Thurston-Bennequin number of the graph. We show that this invariant is
determined by the Thurston-Bennequin numbers of 3-cycles for complete graphs
and by the Thurston-Bennequin number of 4-cycles for complete bipartite graphs.
We discuss the consequences of these results for K_4, K_5 and K_{3,3}.
","[{""version"":""v1"",""created"":""Sat, 25 Jul 2015 04:11:40 GMT""}]","2015-07-28"
"1507.07066","Michitaka Furuya","Yoshimi Egawa, and Michitaka Furuya","Path-factors involving paths of order seven and nine","29 pages, 4 figures",,,,"math.CO","http://arxiv.org/licenses/nonexclusive-distrib/1.0/","  In this paper, we show the following two theorems (here $c_{i}(G-X)$ is the
number of components $C$ of $G-X$ with $|V(C)|=i$): (i)~If a graph $G$
satisfies $c_{1}(G-X)+\frac{1}{3}c_{3}(G-X)+\frac{1}{3}c_{5}(G-X)\leq
\frac{2}{3}|X|$ for all $X\subseteq V(G)$, then $G$ has a
$\{P_{2},P_{7}\}$-factor. (ii)~If a graph $G$ satisfies
$c_{1}(G-X)+c_{3}(G-X)+\frac{2}{3}c_{5}(G-X)+\frac{1}{3}c_{7}(G-X)\leq
\frac{2}{3}|X|$ for all $X\subseteq V(G)$, then $G$ has a
$\{P_{2},P_{9}\}$-factor.
","[{""version"":""v1"",""created"":""Sat, 25 Jul 2015 04:43:56 GMT""}]","2015-07-28"
"1507.07067","Michael Ruderman","Michael Ruderman","Compensation of Nonlinear Torsion in Flexible Joint Robots: Comparison
  of Two Approaches","8 pages, 9 figures",,"10.1109/TIE.2016.2574299",,"cs.SY","http://arxiv.org/licenses/nonexclusive-distrib/1.0/","  Flexible joint robots, in particularly those which are equipped with
harmonic-drive gears, can feature elasticities with hysteresis. Under heavy
loads and large joint torques the hysteresis lost motion can lead to
significant errors of tracking and positioning of the robotic links. In this
paper, two approaches for compensating the nonlinear joint torsion with
hysteresis are described and compared with each other. Both methods assume the
measured signals available only on the motor side of joint transmissions. The
first approach assumes a rigid-link manipulator model and transforms the
desired link trajectory into that of the motor drives by using the inverse
dynamics and inverse hysteresis map. The second approach relies on the modeling
of motor drives and inverse hysteresis and uses the generalized momenta when
predicting the joint torsion. Both methods are discussed in details along with
a numerical example of two-link planar manipulator under gravity.
","[{""version"":""v1"",""created"":""Sat, 25 Jul 2015 05:05:23 GMT""},{""version"":""v2"",""created"":""Sat, 22 Aug 2015 03:17:02 GMT""}]","2017-05-02"
"1507.07068","Baidurya Bhattacharya","Anirban Pal, Abhishek Agarwala, Soumyendu Raha, Baidurya Bhattacharya","Performance metrics in a hybrid MPI-OpenMP based molecular dynamics
  simulation with short-range interactions",,"Journal of Parallel and Distributed Computing, Elsevier, vol. 74,
  no. 3, pp. 2203-2214, 2014","10.1016/j.jpdc.2013.12.008",,"physics.comp-ph cond-mat.mtrl-sci cs.DC","http://arxiv.org/licenses/nonexclusive-distrib/1.0/","  We discuss the computational bottlenecks in molecular dynamics (MD) and
describe the challenges in parallelizing the computation intensive tasks. We
present a hybrid algorithm using MPI (Message Passing Interface) with OpenMP
threads for parallelizing a generalized MD computation scheme for systems with
short range interatomic interactions. The algorithm is discussed in the context
of nanoindentation of Chromium films with carbon indenters using the Embedded
Atom Method potential for Cr Cr interaction and the Morse potential for Cr C
interactions. We study the performance of our algorithm for a range of
MPIthread combinations and find the performance to depend strongly on the
computational task and load sharing in the multicore processor. The algorithm
scaled poorly with MPI and our hybrid schemes were observed to outperform the
pure message passing scheme, despite utilizing the same number of processors or
cores in the cluster. Speed-up achieved by our algorithm compared favourably
with that achieved by standard MD packages.
","[{""version"":""v1"",""created"":""Sat, 25 Jul 2015 05:28:27 GMT""}]","2015-07-28"
"1507.07069","Jose Rodriguez","Jonathan D. Hauenstein and Jose Israel Rodriguez","Multiprojective witness sets and a trace test",,,,,"math.AG","http://arxiv.org/licenses/nonexclusive-distrib/1.0/","  In the field of numerical algebraic geometry, positive-dimensional solution
sets of systems of polynomial equations are described by witness sets. In this
paper, we define multiprojective witness sets which encode the multidegree
information of an irreducible multiprojective variety. Our main results
generalize the regeneration solving procedure, a trace test, and numerical
irreducible decomposition to the multiprojective case. Examples are included to
demonstrate this new approach.
","[{""version"":""v1"",""created"":""Sat, 25 Jul 2015 05:35:45 GMT""},{""version"":""v2"",""created"":""Wed, 24 Aug 2016 16:15:55 GMT""},{""version"":""v3"",""created"":""Thu, 20 Apr 2017 13:49:02 GMT""}]","2017-04-21"
"1507.07070","Baidurya Bhattacharya","Baidurya Bhattacharya","The Extremal Index and the Maximum of a Dependent Stationary Pulse Load
  Process Observed above a High Threshold",,"Structural Safety, Elsevier, vol. 30, no. 1, pp. 34 - 48, 2008","10.1016/j.strusafe.2006.05.001",,"stat.AP stat.CO","http://arxiv.org/licenses/nonexclusive-distrib/1.0/","  Observing a load process above high thresholds, modeling it as a pulse
process with random occurrence times and magnitudes, and extrapolating
life-time maximum or design loads from the data is a common task in structural
reliability analyses. In this paper, we consider a stationary live load
sequence that arrive according to a dependent point process and allow for a
weakened mixing-type dependence in the load pulse magnitudes that
asymptotically decreases to zero with increasing separation in the sequence.
Inclusion of dependence in the model eliminates the unnecessary conservatism
introduced by the i.i.d. (independent and identically distributed) assumption
often made in determining maximum live load distribution. The scale of
fluctuation of the loading process is used to identify clusters of exceedances
above high thresholds which in turn is used to estimate the extremal index of
the process. A Bayesian updating of the empirical distribution function,
derived from the distribution of order statistics in a dependent stationary
series, is performed. The pulse arrival instants are modeled as a Cox process
goverened by a stationary lognormal intensity. An illustrative example utilizes
in-service peak strain data from ambient traffic collected on a high volume
highway bridge, and analyzes the asymptotic behavior of the maximum load.
","[{""version"":""v1"",""created"":""Sat, 25 Jul 2015 05:42:01 GMT""}]","2015-07-28"
"1507.07071","Soumen Sarkar","Basudeb Datta and Soumen Sarkar","Equilibrium triangulations of some quasitoric 4-manifolds","39 pages, 9 figures",,,,"math.GT","http://arxiv.org/licenses/nonexclusive-distrib/1.0/","  Quasitoric manifolds, introduced by M. Davis and T. Januskiewicz in 1991, are
topological generalizations of smooth complex projective spaces. In 1992,
Banchoff and K\""uhnel constructed a 10-vertex equilibrium triangulations of
$\CP^2$. We generalize this construction for quasitoric manifolds and construct
some equilibrium triangulations of $4$-dimensional quasitoric manifolds. In
some cases, our constructions give vertex minimal equilibrium triangulations.
","[{""version"":""v1"",""created"":""Sat, 25 Jul 2015 05:53:09 GMT""}]","2015-07-28"
"1507.07072","Masakazu Yoshida","Masakazu Yoshida, Gen Kimura, Takayuki Miyadera, Hideki Imai, Jun
  Cheng","Solution to the mean king's problem using quantum error-correcting codes","7 pages, 2 tables","Phys. Rev. A 91, 052326 (2015)","10.1103/PhysRevA.91.052326",,"quant-ph","http://arxiv.org/licenses/nonexclusive-distrib/1.0/","  We discuss the so-called mean king's problem, a retrodiction problem among
non-commutative observables, in the context of error detection. Describing the
king's measurement effectively by a single error operation, we give a solution
of the mean king's problem using quantum error-correcting codes. The existence
of a quantum error-correcting code from a solution is also presented.
","[{""version"":""v1"",""created"":""Sat, 25 Jul 2015 06:04:44 GMT""}]","2015-07-28"
"1507.07073","Weiyang Liu","Yandong Wen, Weiyang Liu, Meng Yang, Zhifeng Li","Efficient Face Alignment via Locality-constrained Representation for
  Robust Recognition",,,,,"cs.CV","http://arxiv.org/licenses/nonexclusive-distrib/1.0/","  Practical face recognition has been studied in the past decades, but still
remains an open challenge. Current prevailing approaches have already achieved
substantial breakthroughs in recognition accuracy. However, their performance
usually drops dramatically if face samples are severely misaligned. To address
this problem, we propose a highly efficient misalignment-robust
locality-constrained representation (MRLR) algorithm for practical real-time
face recognition. Specifically, the locality constraint that activates the most
correlated atoms and suppresses the uncorrelated ones, is applied to construct
the dictionary for face alignment. Then we simultaneously align the warped face
and update the locality-constrained dictionary, eventually obtaining the final
alignment. Moreover, we make use of the block structure to accelerate the
derived analytical solution. Experimental results on public data sets show that
MRLR significantly outperforms several state-of-the-art approaches in terms of
efficiency and scalability with even better performance.
","[{""version"":""v1"",""created"":""Sat, 25 Jul 2015 06:17:08 GMT""},{""version"":""v2"",""created"":""Sat, 31 Oct 2015 14:53:49 GMT""}]","2015-11-03"
"1507.07074","Marina Andreeva A.","M. Andreeva, A. Gupta, G. Sharma, S. Kamali, K. Okada and Y. Yoda","Field induced spin reorientation in [Fe/Cr]n multilayers studied by
  nuclear resonance reflectivity","Submitted to PRB","Phys. Rev. B 92,134403 (2015)","10.1103/PhysRevB.92.134403",,"cond-mat.mes-hall cond-mat.mtrl-sci","http://arxiv.org/licenses/nonexclusive-distrib/1.0/","  We present the depth-resolved nuclear resonance reflectivity (NRR) studies of
the magnetization evolution in [57Fe(3 nm)/Cr(1.2 nm)]*10 multilayer under the
applied external field. The measurements have been performed at the station
BL09XU of SPring-8 at different values of the external field (from 0 up to 1500
Oe). We apply the joint fit of the delayed reflectivity curves and the time
spectra of the nuclear resonance reflectivity measured at different grazing
angles for enhancement of the depth resolution and reliability of the results.
For the first time we show that the azimuth angle, which is used in all papers
devoted to the magnetization profile determination, has more complicated
physical sense due to the partially coherent averaging of the scattering
amplitudes from magnetic lateral domains. We describe the way how to select the
true azimuth angle from the determined ""effective azimuth angle"". Finally we
obtain the noncollinear twisted magnetization depth-profiles where the spin
flop state appears sequentially in different 57Fe layers at increasing applied
field.
","[{""version"":""v1"",""created"":""Sat, 25 Jul 2015 06:38:10 GMT""}]","2018-03-28"
"1507.07075","V.P. Binu","Keerthana S. Prakash, R. P. Prakash, V. P. Binu","A Study of Morphological Filtering Using Graph and Hypergraphs","Advance Computing Conference (IACC), 2015 IEEE International,12-13
  June 2015,Banglore India, Page(s):1017 - 1020,Print
  ISBN:978-1-4799-8046-8,IEEE Xplore,2015",,"10.1109/IADCC.2015.7154858",,"cs.CV","http://arxiv.org/licenses/nonexclusive-distrib/1.0/","  Mathematical morphology (MM) helps to describe and analyze shapes using set
theory. MM can be effectively applied to binary images which are treated as
sets. Basic morphological operators defined can be used as an effective tool in
image processing. Morphological operators are also developed based on graph and
hypergraph. These operators have found better performance and applications in
image processing. Bino et al. [8], [9] developed the theory of morphological
operators on hypergraph. A hypergraph structure is considered and basic
morphological operation erosion/dilation is defined. Several new operators
opening/closing and filtering are also defined on the hypergraphs. Hypergraph
based filtering have found comparatively better performance with morphological
filters based on graph. In this paper we evaluate the effectiveness of
hypergraph based ASF on binary images. Experimental results shows that
hypergraph based ASF filters have outperformed graph based ASF.
","[{""version"":""v1"",""created"":""Sat, 25 Jul 2015 06:48:55 GMT""}]","2015-07-28"
"1507.07076","Takasumi Maruyama","M.Harada, S.Hasegawa, Y.Kasugai, S.Meigo, K.Sakai, S.Sakamoto,
  K.Suzuya, E.Iwai, T.Maruyama, S.Monjushiro, K.Nishikawa, M.Taira, M.Niiyama,
  S.Ajimura, T.Hiraiwa, T.Nakano, M.Nomachi, T.Shima, T.J.C.Bezerra,
  E.Chauveau, H.Furuta, F.Suekane, I.Stancu, M.Yeh, H.Ray, G.T.Garvey,
  C.Mauger, W.C.Louis, G.B.Mills, R.Van de Water, J.Spitz","Status Report for the 20th J-PARC PAC : A Search for Sterile Neutrino at
  J-PARC MLF (J-PARC E56, JSNS2)","20th J-PARC PAC status report",,,,"physics.ins-det hep-ex","http://arxiv.org/licenses/nonexclusive-distrib/1.0/","  On April 2015, the J-PARC E56 (JSNS2: J-PARC Sterile Neutrino Search using
neutrinos from J-PARC Spallation Neutron Source) experiment officially obtained
stage-1 approval from J-PARC. We have since started to perform liquid
scintillator R&D for improving energy resolution and fast neutron rejection.
Also, we are studying Avalanche Photo-Diodes (SiPM) inside the liquid
scintillator. In addition to the R&D work, a background measurement for the
proton beam bunch timing using a small liquid scintillator volume was planned,
and the safety discussions for the measurement have been done. This report
describes the status of the R&D work and the background measurements, in
addition to the milestones required before stage-2 approval.
","[{""version"":""v1"",""created"":""Sat, 25 Jul 2015 07:05:01 GMT""}]","2015-07-28"
"1507.07077","Vinayak Abrol","V. Abrol and P. Sharma and A. K Sao","Making sense of randomness: an approach for fast recovery of
  compressively sensed signals","6 pages",,,,"cs.IT cs.CV math.IT","http://arxiv.org/licenses/nonexclusive-distrib/1.0/","  In compressed sensing (CS) framework, a signal is sampled below Nyquist rate,
and the acquired compressed samples are generally random in nature. However,
for efficient estimation of the actual signal, the sensing matrix must preserve
the relative distances among the acquired compressed samples. Provided this
condition is fulfilled, we show that CS samples will preserve the envelope of
the actual signal even at different compression ratios. Exploiting this
envelope preserving property of CS samples, we propose a new fast dictionary
learning (DL) algorithm which is able to extract prototype signals from
compressive samples for efficient sparse representation and recovery of
signals. These prototype signals are orthogonal intrinsic mode functions (IMFs)
extracted using empirical mode decomposition (EMD), which is one of the popular
methods to capture the envelope of a signal. The extracted IMFs are used to
build the dictionary without even comprehending the original signal or the
sensing matrix. Moreover, one can build the dictionary on-line as new CS
samples are available. In particularly, to recover first $L$ signals
($\in\mathbb{R}^n$) at the decoder, one can build the dictionary in just
$\mathcal{O}(nL\log n)$ operations, that is far less as compared to existing
approaches. The efficiency of the proposed approach is demonstrated
experimentally for recovery of speech signals.
","[{""version"":""v1"",""created"":""Sat, 25 Jul 2015 07:11:00 GMT""}]","2015-07-28"
"1507.07078","Angel Zald\'ivar","Angel Zald\'ivar","A Note on Gabriel dimension for idioms","6 pages",,,,"math.RA","http://arxiv.org/licenses/nonexclusive-distrib/1.0/","  The aim of this note is to illustrate that the definition and construction of
the Gabriel dimension for modular lattices in the classical sense is the same
as the module case following H. Simmons.
","[{""version"":""v1"",""created"":""Sat, 25 Jul 2015 08:04:51 GMT""}]","2015-07-28"
"1507.07079","Akihiro Ishibashi","Akihiro Ishibashi, Paolo Pani, Leonardo Gualtieri, and Vitor Cardoso","Superradiant instability of the Kerr brane","1+15 pages, no figures",,,,"hep-th gr-qc","http://arxiv.org/licenses/nonexclusive-distrib/1.0/","  We consider linear gravitational perturbations of the Kerr brane, an exact
solution of vacuum Einstein's equations in dimensions higher than four and a
low-energy solution of string theory. Decomposing the perturbations in tensor
harmonics of the transverse Ricci-flat space, we show that tensor- and
vector-type metric perturbations of the Kerr brane satisfy respectively a
massive Klein-Gordon equation and a Proca equation on the four-dimensional Kerr
space, where the mass term is proportional to the eigenvalue of the harmonics.
Massive bosonic fields trigger a well-known superradiant instability on a Kerr
black hole. We thus establish that Kerr branes in dimensions $D\geq6$ are
gravitationally unstable due to superradiance. These solutions are also
unstable against the Gregory-Laflamme instability and we discuss the conditions
for either instability to occur and their rather different nature. When the
transverse dimensions are compactified and much smaller than the Kerr horizon,
only the superradiant instability is present, with a time scale much longer
than the dynamical time scale. Our formalism can be also used to discuss other
types of higher-dimensional black objects, taking advantage of recent progress
in studying linear perturbations of four-dimensional black holes.
","[{""version"":""v1"",""created"":""Sat, 25 Jul 2015 08:27:00 GMT""}]","2015-07-28"
"1507.07080","Simon Puglisi","Djamal Belazzougui and Simon J. Puglisi","Range Predecessor and Lempel-Ziv Parsing","25 pages",,,,"cs.DS","http://arxiv.org/licenses/nonexclusive-distrib/1.0/","  The Lempel-Ziv parsing of a string (LZ77 for short) is one of the most
important and widely-used algorithmic tools in data compression and string
processing. We show that the Lempel-Ziv parsing of a string of length $n$ on an
alphabet of size $\sigma$ can be computed in $O(n\log\log\sigma)$ time ($O(n)$
time if we allow randomization) using $O(n\log\sigma)$ bits of working space;
that is, using space proportional to that of the input string in bits. The
previous fastest algorithm using $O(n\log\sigma)$ space takes
$O(n(\log\sigma+\log\log n))$ time. We also consider the important rightmost
variant of the problem, where the goal is to associate with each phrase of the
parsing its most recent occurrence in the input string. We solve this problem
in $O(n(1 + (\log\sigma/\sqrt{\log n}))$ time, using the same working space as
above. The previous best solution for rightmost parsing uses
$O(n(1+\log\sigma/\log\log n))$ time and $O(n\log n)$ space. As a bonus, in our
solution for rightmost parsing we provide a faster construction method for
efficient 2D orthogonal range reporting, which is of independent interest.
","[{""version"":""v1"",""created"":""Sat, 25 Jul 2015 08:42:56 GMT""}]","2015-07-28"
