"1507.06953","L\'aszl\'o Kozma","Parinya Chalermsook, Mayank Goswami, Laszlo Kozma, Kurt Mehlhorn,
  Thatchaphol Saranurak","Pattern-avoiding access in binary search trees","To be presented at FOCS 2015",,,,"cs.DS math.CO","http://arxiv.org/licenses/nonexclusive-distrib/1.0/","  The dynamic optimality conjecture is perhaps the most fundamental open
question about binary search trees (BST). It postulates the existence of an
asymptotically optimal online BST, i.e. one that is constant factor competitive
with any BST on any input access sequence. The two main candidates for dynamic
optimality in the literature are splay trees [Sleator and Tarjan, 1985], and
Greedy [Lucas, 1988; Munro, 2000; Demaine et al. 2009] [..]
  Dynamic optimality is trivial for almost all sequences: the optimum access
cost of most length-n sequences is Theta(n log n), achievable by any balanced
BST. Thus, the obvious missing step towards the conjecture is an understanding
of the ""easy"" access sequences. [..] The difficulty of proving dynamic
optimality is witnessed by highly restricted special cases that remain
unresolved; one prominent example is the traversal conjecture [Sleator and
Tarjan, 1985], which states that preorder sequences (whose optimum is linear)
are linear-time accessed by splay trees; no online BST is known to satisfy this
conjecture.
  In this paper, we prove two different relaxations of the traversal conjecture
for Greedy: (i) Greedy is almost linear for preorder traversal, (ii) if a
linear-time preprocessing is allowed, Greedy is in fact linear. These
statements are corollaries of our more general results that express the
complexity of access sequences in terms of a pattern avoidance parameter k.
[..] To our knowledge, these are the first upper bounds for Greedy that are not
known to hold for any other online BST. To obtain these results we identify an
input-revealing property of Greedy. Informally, this means that the execution
log partially reveals the structure of the access sequence. This property
facilitates the use of rich technical tools from forbidden submatrix theory.
  [Abridged]
","[{""version"":""v1"",""created"":""Fri, 24 Jul 2015 18:43:59 GMT""}]","2015-08-20"
"1507.06954","Alex Reinhart","Alex Reinhart, Val\'erie Ventura and Alex Athey","Detecting changes in maps of gamma spectra with Kolmogorov-Smirnov tests","8 pages, 7 figures; revised in response to reviewer comments","Nuclear Instruments and Methods A, vol. 802 (2015), pp. 31-37","10.1016/j.nima.2015.09.002",,"physics.data-an stat.AP","http://arxiv.org/licenses/nonexclusive-distrib/1.0/","  Various security, regulatory, and consequence management agencies are
interested in continuously monitoring wide areas for unexpected changes in
radioactivity. Existing detection systems are designed to search for
radioactive sources but are not suited to repeat mapping and change detection.
Using a set of daily spectral observations collected at the Pickle Research
Campus, we improved on the prior Spectral Comparison Ratio Anomaly Mapping
(SCRAM) algorithm and developed a new method based on two-sample
Kolmogorov-Smirnov tests to detect sudden spectral changes. We also designed
simulations and visualizations of statistical power to compare methods and
guide deployment scenarios.
","[{""version"":""v1"",""created"":""Fri, 24 Jul 2015 18:45:28 GMT""},{""version"":""v2"",""created"":""Wed, 2 Sep 2015 14:31:55 GMT""}]","2015-09-28"
"1507.06955","Daniel Gruss","Daniel Gruss, Cl\'ementine Maurice, Stefan Mangard","Rowhammer.js: A Remote Software-Induced Fault Attack in JavaScript","This paper has been accepted at the 13th Conference on Detection of
  Intrusions and Malware & Vulnerability Assessment (DIMVA) 2016. The final
  publication is available at link.springer.com",,,,"cs.CR","http://arxiv.org/licenses/nonexclusive-distrib/1.0/","  A fundamental assumption in software security is that a memory location can
only be modified by processes that may write to this memory location. However,
a recent study has shown that parasitic effects in DRAM can change the content
of a memory cell without accessing it, but by accessing other memory locations
in a high frequency. This so-called Rowhammer bug occurs in most of today's
memory modules and has fatal consequences for the security of all affected
systems, e.g., privilege escalation attacks.
  All studies and attacks related to Rowhammer so far rely on the availability
of a cache flush instruction in order to cause accesses to DRAM modules at a
sufficiently high frequency. We overcome this limitation by defeating complex
cache replacement policies. We show that caches can be forced into fast cache
eviction to trigger the Rowhammer bug with only regular memory accesses. This
allows to trigger the Rowhammer bug in highly restricted and even scripting
environments.
  We demonstrate a fully automated attack that requires nothing but a website
with JavaScript to trigger faults on remote hardware. Thereby we can gain
unrestricted access to systems of website visitors. We show that the attack
works on off-the-shelf systems. Existing countermeasures fail to protect
against this new Rowhammer attack.
","[{""version"":""v1"",""created"":""Fri, 24 Jul 2015 18:47:07 GMT""},{""version"":""v2"",""created"":""Thu, 27 Aug 2015 16:41:30 GMT""},{""version"":""v3"",""created"":""Thu, 18 Feb 2016 23:57:31 GMT""},{""version"":""v4"",""created"":""Fri, 1 Apr 2016 11:42:18 GMT""},{""version"":""v5"",""created"":""Tue, 5 Apr 2016 09:32:41 GMT""}]","2016-04-06"
"1507.06956","Luiz Capretz Dr.","David Carter, Luiz Fernando Capretz","A Three-Dimensional GUI for Windows Explorer",,"Journal of Three Dimensional Images, 18(1):136-141, 2004",,,"cs.HC","http://arxiv.org/licenses/nonexclusive-distrib/1.0/","  Three-dimension will be a characteristic of future user interfaces, although
we are just starting to gain an understanding of how users can navigate and
share information within a virtual 3D environment. Three-dimensional graphical
user interfaces (3D-GUI) raise many issues of design, metaphor and usability.
This research is devoted to designing a 3D-GUI as a front-end tool for a file
management system, in this case, for Microsoft Windows\c{opyright} Explorer; as
well as evaluating the efficiency of a 3D application. The software design was
implemented by extending the Half-Life 3D engine. This extension provides a
directory traversal and basic file management functions, like cut, copy, paste,
delete, and so on. This paper shows the design and implementation of a
real-world application that contains an efficient 3D-GUI.
","[{""version"":""v1"",""created"":""Fri, 24 Jul 2015 18:54:16 GMT""}]","2015-07-27"
"1507.06958","Da Zheng","Vern I. Paulsen, Da Zheng","Tensor Products of the Operator System Generated by the Cuntz Isometries","23 pages",,,,"math.OA","http://arxiv.org/licenses/nonexclusive-distrib/1.0/","  We study tensor products and nuclearity-related properties of the operator
system $\mathcal S_n$ generated by the Cuntz isometries. By using the
nuclearity of the Cuntz algebra, we can show that $\mathcal{S}_n$ is
$C^*$-nuclear, and this implies a dual row contraction version of Ando's
theorem characterizing operators of numerical radius 1. On the other hand,
without using the nuclearity of the Cuntz algebra, we are still able to show
directly this Ando type property of dual row contractions and conclude that
$\mathcal{S}_n$ is $C^*$-nuclear, which yields a new proof of the nuclearity of
the Cuntz algebras. We prove that the dual operator system of $\mathcal{S}_n$
is completely order isomorphic to an operator subsystem of $M_{n+1}$. Finally,
a lifting result concerning Popescu's joint numerical radius is proved via
operator system techniques.
","[{""version"":""v1"",""created"":""Fri, 24 Jul 2015 18:56:23 GMT""}]","2015-07-27"
"1507.06959","Luiz Capretz Dr.","Luiz Fernando Capretz","The Challenges of CASE Design Integration in the Telecommunication
  Application Domain",,"Journal of Integrated Design and Process Science, 7(3):1-10, 2003",,,"cs.SE","http://arxiv.org/licenses/nonexclusive-distrib/1.0/","  The magnitude of the problems facing the telecommunication software industry
is presently at a point at which software engineers should become deeply
involved. This paper presents a research project on advanced telecommunication
technology carried out in Europe, called BOOST (Broadband Object-Oriented
Service Technology). The project involved cooperative work among
telecommunication companies, research centres and universities from several
countries. The challenges to integrate CASE tools to support software
development within the telecommunication application domain are discussed. A
software process model that encourages component reusability, named the X
model, is described as part of a software life cycle model for the
telecommunication software industry.
","[{""version"":""v1"",""created"":""Fri, 24 Jul 2015 19:00:19 GMT""}]","2015-07-27"
"1507.06960","Mario Rocca","F. Pennini, A. Plastino, M. C. Rocca","Classical thermodynamics from quasi-probabilities","9 pages, 1 figure. To be published in Modern Physics Letters B
  (2015). arXiv admin note: substantial text overlap with arXiv:1409.4465","MODERN PHYSICS LETTERS B, vol. 30 p. 1650005 (2016)","10.3390/e17127853",,"cond-mat.stat-mech physics.class-ph","http://arxiv.org/licenses/nonexclusive-distrib/1.0/","  The basic idea of a microscopic understanding of Thermodynamics is to derive
its main features from a microscopic probability distribution. In such a vein,
we investigate the thermal statistics of quasi-probabilities's semi-classical
analogs in phase space for the important case of quadratic Hamiltonians,
focusing attention in the three more important instances, i.e., those of
Wigner, $P$-, and Husimi distributions. Introduction of an effective
temperature permits one to obtain a unified thermodynamic description that
encompasses and unifies the three different quasi-probability distributions.
This unified description turns out to be classical.
","[{""version"":""v1"",""created"":""Fri, 24 Jul 2015 19:00:55 GMT""}]","2016-09-20"
"1507.06961","Nye Evans","A. Evans, R. D. Gehrz, L. A. Helton, and C. E. Woodward","The circumstellar dust of ""Born-Again"" stars","To appear in the proceedings of ""Physics of Evolved Stars 2015 - A
  conference dedicated to the memory of Olivier Chesneau""",,"10.1051/eas/1571063",,"astro-ph.SR","http://arxiv.org/licenses/nonexclusive-distrib/1.0/","  We describe the evolution of the carbon dust shells around Very Late Thermal
Pulse (VLTP) objects as seen at infrared wavelengths. This includes a 20-year
overview of the evolution of the dust around Sakurai's object (to which Olivier
made a seminal contribution) and FG Sge. VLTPs may occur during the endpoint of
as many as 25% of solar mass stars, and may therefore provide a glimpse of the
possible fate of the Sun.
","[{""version"":""v1"",""created"":""Fri, 24 Jul 2015 19:04:02 GMT""}]","2015-12-09"
"1507.06962","Luiz Capretz Dr.","Luiz Fernando Capretz","Implications of MBTI in Software Engineering Education",,"ACM SIGCSE Bulletin, 34(4):134-137, 2002","10.1145/820127.820185",,"cs.SE cs.CY","http://arxiv.org/licenses/nonexclusive-distrib/1.0/","  A number of approaches exist to aid the understanding of individual
differences and their effects on teaching and learning. Educators have been
using the Myers-Briggs Type Indicator (MBTI) to understand differences in
learning styles and to develop teaching methods that cater for the various
personality styles. Inspired by the MBTI, we developed a range of practices for
effective teaching and learning in a software engineering course. Our aim is to
reach every student, but in different ways, by devising various teaching
approaches.
","[{""version"":""v1"",""created"":""Fri, 24 Jul 2015 19:04:14 GMT""}]","2015-07-27"
"1507.06963","Yaguang Yang","Yaguang Yang","Controllability of Spacecraft Using Only Magnetic Torques","10 pages","IEEE Transactions on Aerospace and Electronic Systems pp.955-963,
  VOL. 52, NO. 2 APRIL 2016","10.1109/TAES.2015.150520",,"math.OC","http://arxiv.org/licenses/nonexclusive-distrib/1.0/","  Spacecraft attitude control using only magnetic torques is a time-varying
system. Many designs were proposed using LQR and H-infinity formulations. The
existence of the solutions depends on the controllability of the linear
time-varying systems which has not been established. In this paper, we will
derive the conditions of the controllability for this linear time-varying
systems.
","[{""version"":""v1"",""created"":""Fri, 24 Jul 2015 19:04:56 GMT""}]","2016-03-24"
"1507.06964","Cesar J. Niche","Cesar J. Niche (UFRJ)","Decay characterization of solutions to the Navier-Stokes-Voigt equations
  in terms of the initial datum","13 pages",,,,"math.AP","http://arxiv.org/licenses/nonexclusive-distrib/1.0/","  The Navier-Stokes-Voigt equations are a regularization of the Navier-Stokes
equations that share some of its asymptotic and statistical properties and have
been used in direct numerical simulations of the latter. In this article we
characterize the decay rate of solutions to the Navier-Stokes-Voigt equations
in terms of the decay character of the initial datum and study the long time
behaviour of its solutions by comparing them to solutions to the linear part.
","[{""version"":""v1"",""created"":""Fri, 24 Jul 2015 19:13:32 GMT""}]","2015-07-27"
"1507.06965","Sara Pollock","Sara Pollock","Stabilized and inexact adaptive methods for capturing internal layers in
  quasilinear PDE","22 pages, 7 figures. Version 3 features some minor typographical
  corrections",,,,"math.NA","http://arxiv.org/licenses/nonexclusive-distrib/1.0/","  A method is developed within an adaptive framework to solve quasilinear
diffusion problems with internal and possibly boundary layers starting from a
coarse mesh. The solution process is assumed to start on a mesh where the
problem is badly resolved, and approximation properties of the exact problem
and its corresponding finite element solution do not hold. A sequence of
stabilized and inexact partial solves allow the mesh to be refined to capture
internal layers while an approximate solution is built eventually leading to an
accurate approximation of both the problem and its solution. The innovations in
the current work include a closed form definition for the numerical dissipation
and inexact scaling parameters on each mesh refinement, as well as a
convergence result for the residual of the discrete problem. Numerical
experiments demonstrate the method on a range of problems featuring steep
internal layers and high solution dependent frequencies of the diffusion
coefficients.
","[{""version"":""v1"",""created"":""Fri, 24 Jul 2015 19:14:10 GMT""},{""version"":""v2"",""created"":""Mon, 28 Sep 2015 18:36:16 GMT""},{""version"":""v3"",""created"":""Sun, 14 Feb 2016 19:13:40 GMT""}]","2016-02-16"
"1507.06966","A. B. Kuklov","Anatoly Kuklov","Giant isochoric compressibility of solid Helium-4: the bistability of
  superlcimbing dislocations","replaced with the revised version: the section on helical instability
  of screw dislocation with superfluid core and references are added","Phys. Rev. B 92, 134504 (2015)","10.1103/PhysRevB.92.134504",,"cond-mat.other","http://arxiv.org/licenses/nonexclusive-distrib/1.0/","  A significant accumulation of matter in solid Helium-4 observed during the
superflow events, dubbed as the giant isochoric compressibility (or the syringe
effect), is discussed within the model of dislocations with superfluid core. It
is shown that solid Helium-4 in a contact with superfluid reservoir can develop
a bistability with respect to the syringe fraction, with the threshold for the
bias by chemical potential determined by a typical free length of dislocations
with superfluid core. The main implications of this effect are: hysteresis and
strongly non-linear dynamical behavior leading to growth, proliferation and
possibly exiting from a crystal of superclimbing dislocations. Three major
channels for such dynamics are identified: i) injection and inflation of the
prismatic loops from the boundary; ii) Bardeed-Herring generation of the loops
in the bulk; iii) helical instability of the screw dislocations. It is argued
that the current experiments are likely to be well in this regime. Several
testable predictions for the time and the bias dependencies of the dynamics are
suggested
","[{""version"":""v1"",""created"":""Fri, 24 Jul 2015 19:15:09 GMT""},{""version"":""v2"",""created"":""Fri, 31 Jul 2015 13:34:09 GMT""}]","2017-03-09"
"1507.06967","Javier Cilleruelo","Javier Cilleruelo","Visible lattice points and the chromatic zeta function of a graph",,,,,"math.CO math.NT","http://arxiv.org/licenses/nonexclusive-distrib/1.0/","  We study the probability that a cycle of length k in the lattice [1, n]^s
does not contain more lattice points than the k vertices of the cycle. Then we
generalize this problem to other configurations induced by a given graph H,
introducting the chromatic zeta fuction of a graph.
","[{""version"":""v1"",""created"":""Fri, 24 Jul 2015 19:19:08 GMT""},{""version"":""v2"",""created"":""Sun, 6 Dec 2015 17:41:23 GMT""}]","2015-12-08"
"1507.06968","Jose Repond","M. Affatigato, U. Akgun, B. Bilki, F. Corriveau, B. Freund, N.
  Johnson, C. Neubueser, Y. Onel, J. Repond, L. Xia","Measurements of the Rate Capability of Various Resistive Plate Chambers",,,,,"physics.ins-det","http://arxiv.org/licenses/nonexclusive-distrib/1.0/","  Resistive Plate Chambers (RPCs) exhibit a significant loss of efficiency for
the detection of particles, when subjected to high particle fluxes. This rate
limitation is related to the usually high resistivity of the resistive plates
used in their construction. This paper reports on measurements of the
performance of three different glass RPC designs featuring a different total
resistance of the resistive plates. The measurements were performed with 120
GeV protons at varying beam intensities
","[{""version"":""v1"",""created"":""Fri, 24 Jul 2015 19:19:17 GMT""},{""version"":""v2"",""created"":""Mon, 7 Sep 2015 11:34:32 GMT""}]","2015-09-08"
"1507.06969","Masahiko Matsubara","Masahiko Matsubara and Enrico Bellotti","A first-principles study of carbon-related energy levels in GaN. Part I
  - complexes formed by substitutional/interstitial carbons and
  gallium/nitrogen vacancies","17 pages, 15 figures, 12 tables. Replacement for published version","Journal of Applied Physics 121, 195701 (2017)","10.1063/1.4983452",,"cond-mat.mtrl-sci","http://arxiv.org/licenses/nonexclusive-distrib/1.0/","  Various forms of carbon based complexes in GaN are studied with
first-principles calculations employing Heyd-Scuseria-Ernzerhof hybrid
functional within the framework of density functional theory. We consider
carbon complexes made of the combinations of single impurities, i.e.
$\mathrm{C_N-C_{Ga}}$, $\mathrm{C_I-C_N}$ and $\mathrm{C_I-C_{Ga}}$, where
$\mathrm{C_N}$, $\mathrm{C_{Ga}}$ and $\mathrm{C_I}$ denote C substituting
nitrogen, C substituting gallium and interstitial C, respectively, and of
neighboring gallium/nitrogen vacancies ($\mathrm{V_{Ga}}$/$\mathrm{V_N}$), i.e.
$\mathrm{C_N-V_{Ga}}$ and $\mathrm{C_{Ga}-V_N}$. Formation energies are
computed for all these configurations with different charge states after full
geometry optimizations. From our calculated formation energies, thermodynamic
transition levels are evaluated, which are related to the thermal activation
energies observed in experimental techniques such as deep level transient
spectroscopy. Furthermore, the lattice relaxation energies (Franck-Condon
shift) are computed to obtain optical activation energies, which are observed
in experimental techniques such as deep level optical spectroscopy. We compare
our calculated values of activation energies with the energies of
experimentally observed C-related trap levels and identify the physical origins
of these traps, which are unknown before.
","[{""version"":""v1"",""created"":""Fri, 24 Jul 2015 19:25:57 GMT""},{""version"":""v2"",""created"":""Tue, 24 Nov 2015 00:26:32 GMT""},{""version"":""v3"",""created"":""Sat, 17 Jun 2017 18:54:41 GMT""}]","2017-06-20"
"1507.06970","Horia Mania","Horia Mania, Xinghao Pan, Dimitris Papailiopoulos, Benjamin Recht,
  Kannan Ramchandran, Michael I. Jordan","Perturbed Iterate Analysis for Asynchronous Stochastic Optimization","30 pages",,,,"stat.ML cs.DC cs.DS cs.LG math.OC","http://arxiv.org/licenses/nonexclusive-distrib/1.0/","  We introduce and analyze stochastic optimization methods where the input to
each gradient update is perturbed by bounded noise. We show that this framework
forms the basis of a unified approach to analyze asynchronous implementations
of stochastic optimization algorithms.In this framework, asynchronous
stochastic optimization algorithms can be thought of as serial methods
operating on noisy inputs. Using our perturbed iterate framework, we provide
new analyses of the Hogwild! algorithm and asynchronous stochastic coordinate
descent, that are simpler than earlier analyses, remove many assumptions of
previous models, and in some cases yield improved upper bounds on the
convergence rates. We proceed to apply our framework to develop and analyze
KroMagnon: a novel, parallel, sparse stochastic variance-reduced gradient
(SVRG) algorithm. We demonstrate experimentally on a 16-core machine that the
sparse and parallel version of SVRG is in some cases more than four orders of
magnitude faster than the standard SVRG algorithm.
","[{""version"":""v1"",""created"":""Fri, 24 Jul 2015 19:36:13 GMT""},{""version"":""v2"",""created"":""Fri, 25 Mar 2016 20:00:45 GMT""}]","2016-03-29"
"1507.06971","S. L. Bud'ko","Sergey L. Bud'ko, Xiaoming Ma, Milan Tomic, Sheng Ran, Roser Valenti,
  Paul C. Canfield","Transition to collapsed tetragonal phase in CaFe2As2 single crystals as
  seen by 57Fe Mossbauer spectroscopy",,"Phys. Rev. B 93, 024516 (2016)","10.1103/PhysRevB.93.024516",,"cond-mat.mtrl-sci cond-mat.str-el cond-mat.supr-con","http://arxiv.org/licenses/nonexclusive-distrib/1.0/","  Temperature dependent measurements of 57Fe Mossbauer spectra on CaFe2As2
single crystals in the tetragonal and collapsed tetragonal phases are reported.
Clear features in the temperature dependencies of the isomer shift, relative
spectra area and quadrupole splitting are observed at the transition from the
tetragonal to the collapsed tetragonal phase. From the temperature dependent
isomer shift and spectral area data, an average stiffening of the phonon modes
in the collapsed tetragonal phase is inferred. The quadrupole splitting
increases by ~25% on cooling from room temperature to ~100 K in the tetragonal
phase and is only weakly temperature dependent at low temperatures in the
collapsed tetragonal phase, in agreement with the anisotropic thermal expansion
in this material. In order to gain microscopic insight about these measurements
we perform ab initio density functional theory calculations of the electric
field gradient and the electron density of CaFe2As2 in both phases. By
comparing the experimental data with the calculations we are able to fully
characterize the crystal structure of the samples in the collapsed-tetragonal
phase through determination of the As z-coordinate. Based on the obtained
temperature dependent structural data we are able to propose charge saturation
of the Fe - As bond region as the mechanism behind the stabilization of the
collapsed-tetragonal phase at ambient pressure.
","[{""version"":""v1"",""created"":""Fri, 24 Jul 2015 19:36:55 GMT""},{""version"":""v2"",""created"":""Fri, 22 Jan 2016 14:46:52 GMT""}]","2016-01-27"
"1507.06972","Jorge Noronha","Romulo Rougemont (Sao Paulo U.), Jorge Noronha (Sao Paulo U. &
  Columbia U.), Jacquelyn Noronha-Hostler (Columbia U.)","Suppression of baryon diffusion and transport in a baryon rich strongly
  coupled quark-gluon plasma","6 pages, 1 figure, tabulated data for the baryon conductivity can be
  obtained as an ancillary file; added figure, version accepted for publication
  in Phys. Rev. Lett","Phys. Rev. Lett. 115, 202301 (2015)","10.1103/PhysRevLett.115.202301",,"hep-ph hep-th nucl-ex nucl-th","http://arxiv.org/licenses/nonexclusive-distrib/1.0/","  Five dimensional black hole solutions that describe the QCD crossover
transition seen in $(2+1)$-flavor lattice QCD calculations at zero and nonzero
baryon densities are used to obtain predictions for the baryon susceptibility,
baryon conductivity, baryon diffusion constant, and thermal conductivity of the
strongly coupled quark-gluon plasma in the range of temperatures
$130\,\textrm{MeV}\le T\le 300\,\textrm{MeV}$ and baryon chemical potentials
$0\le \mu_B \le 400\,\textrm{MeV}$. Diffusive transport is predicted to be
suppressed in this region of the QCD phase diagram, which is consistent with
the existence of a critical end point at larger baryon densities. We also
calculate the fourth-order baryon susceptibility at zero baryon chemical
potential and find quantitative agreement with recent lattice results. The
baryon transport coefficients computed in this paper can be readily implemented
in state-of-the-art hydrodynamic codes used to investigate the dense QGP
currently produced at RHIC's low energy beam scan.
","[{""version"":""v1"",""created"":""Fri, 24 Jul 2015 19:39:56 GMT""},{""version"":""v2"",""created"":""Thu, 15 Oct 2015 01:20:50 GMT""}]","2015-11-12"
