"1507.07009","Gary Prezeau","Gary Prezeau","Dense Dark Matter Hairs Spreading Out from Earth, Jupiter and Other
  Compact Bodies","Accepted for publication in The Astrophysical Journal. 13 pages, 21
  figures, 1 table",,"10.1088/0004-637X/814/2/122",,"astro-ph.CO astro-ph.EP astro-ph.HE","http://arxiv.org/licenses/nonexclusive-distrib/1.0/","  It is shown that compact bodies project out strands of concentrated dark
matter filaments henceforth simply called hairs. These hairs are a consequence
of the fine-grained stream structure of dark matter halos, and as such
constitute a new physical prediction of $\Lambda$CDM. Using both an analytical
model of planetary density and numerical simulations utilizing the Fast
Accurate Integrand Renormalization (FAIR) algorithm (a fast geodesics
calculator described below) with realistic planetary density inputs, dark
matter streams moving through a compact body are shown to produce hugely
magnified dark matter densities along the stream velocity axis going through
the center of the body. Typical hair density enhancements are $10^7$ for Earth
and $10^8$ for Jupiter. The largest enhancements occur for particles streaming
through the core of the body that mostly focus at a single point called the
root of the hair. For the Earth, the root is located at about $10^6$~km from
the planetary center with a density enhancement of around $10^9$ while for a
gas giant like Jupiter, the root is located at around $10^{5}$~km with a
enhancement of around $10^{11}$. Beyond the root, the hair density precisely
reflects the density layers of the body providing a direct probe of planetary
interiors.
","[{""version"":""v1"",""created"":""Fri, 24 Jul 2015 20:30:03 GMT""},{""version"":""v2"",""created"":""Fri, 23 Oct 2015 22:20:12 GMT""}]","2015-12-02"
"1507.07010","Pablo Candela","Artur Avila, Pablo Candela","Towers for commuting endomorphisms, and combinatorial applications","13 pages. Referee's comments incorporated. To appear in Annales de
  l'Institut Fourier",,,,"math.DS math.CO","http://arxiv.org/licenses/nonexclusive-distrib/1.0/","  We give an elementary proof of a generalization of Rokhlin's lemma for
commuting non-invertible measure-preserving transformations, and we present
several combinatorial applications.
","[{""version"":""v1"",""created"":""Fri, 24 Jul 2015 20:47:57 GMT""},{""version"":""v2"",""created"":""Thu, 28 Jan 2016 11:41:15 GMT""}]","2016-01-29"
"1507.07011","Alkmini Sgouritsa","George Christodoulou, Alkmini Sgouritsa, Bo Tang","On the Efficiency of the Proportional Allocation Mechanism for Divisible
  Resources","To appear in SAGT 2015",,,,"cs.GT","http://arxiv.org/licenses/nonexclusive-distrib/1.0/","  We study the efficiency of the proportional allocation mechanism, that is
widely used to allocate divisible resources. Each agent submits a bid for each
divisible resource and receives a fraction proportional to her bids. We
quantify the inefficiency of Nash equilibria by studying the Price of Anarchy
(PoA) of the induced game under complete and incomplete information. When
agents' valuations are concave, we show that the Bayesian Nash equilibria can
be arbitrarily inefficient, in contrast to the well-known 4/3 bound for pure
equilibria. Next, we upper bound the PoA over Bayesian equilibria by 2 when
agents' valuations are subadditive, generalizing and strengthening previous
bounds on lattice submodular valuations. Furthermore, we show that this bound
is tight and cannot be improved by any simple or scale-free mechanism. Then we
switch to settings with budget constraints, and we show an improved upper bound
on the PoA over coarse-correlated equilibria. Finally, we prove that the PoA is
exactly 2 for pure equilibria in the polyhedral environment.
","[{""version"":""v1"",""created"":""Fri, 24 Jul 2015 20:48:48 GMT""}]","2015-07-28"
"1507.07012","Diego Calder\'on","D. Calder\'on, A. Ballone, J. Cuadra, M. Schartmann, A. Burkert and S.
  Gillessen","Clump formation through colliding stellar winds in the Galactic Centre","Accepted for publication in MNRAS, 11 pages, 6 figures",,"10.1093/mnras/stv2644",,"astro-ph.GA astro-ph.SR","http://arxiv.org/licenses/nonexclusive-distrib/1.0/","  The gas cloud G2 is currently being tidally disrupted by the Galactic Centre
super-massive black hole, Sgr A*. The region around the black hole is populated
by $\sim 30$ Wolf-Rayet stars, which produce strong outflows. We explore the
possibility that gas clumps, such as G2, originate from the collision of
stellar winds via the non-linear thin shell instability. Following an
analytical approach, we study the thermal evolution of slabs formed in the
symmetric collision of winds, evaluating whether instabilities occur, and
estimating possible clump masses. We find that the collision of relatively slow
($< 750$ km s$^{-1}$) and strong ($\sim 10^{-5}$ Msun yr$^{-1}$) stellar winds
from stars at short separations ($<10$ mpc) is a process that indeed could
produce clumps of G2's mass and above. Such short separation encounters of
single stars along their known orbits are not common in the Galactic Centre,
making this process a possible but unlikely origin for G2. We also discuss
clump formation in close binaries such as IRS 16SW and in asymmetric encounters
as promising alternatives that deserve further numerical study.
","[{""version"":""v1"",""created"":""Fri, 24 Jul 2015 20:50:23 GMT""},{""version"":""v2"",""created"":""Wed, 11 Nov 2015 17:58:25 GMT""}]","2015-12-16"
"1507.07013","Shengjun Yuan","Fengping Jin, Rafael Rold\'an, Mikhail I. Katsnelson, Shengjun Yuan","Screening and plasmons in pure and disordered single- and bilayer black
  phosphorus","9 pages, 9 figures","Phys. Rev. B 92, 115440 (2015)","10.1103/PhysRevB.92.115440",,"cond-mat.mes-hall cond-mat.mtrl-sci physics.comp-ph","http://arxiv.org/licenses/nonexclusive-distrib/1.0/","  We study collective plasmon excitations and screening of disordered single-
and bilayer black phosphorus beyond the low energy continuum approximation. The
dynamical polarizability of phosphorene is computed using a tight-binding model
that properly accounts for the band structure in a wide energy range.
Electron-electron interaction is considered within the Random Phase
Approximation. Damping of the plasmon modes due to different kinds of disorder,
such as resonant scatterers and long-range disorder potentials, is analyzed. We
further show that an electric field applied perpendicular to bilayer
phosphorene can be used to tune the dispersion of the plasmon modes. For
sufficiently large electric field, the bilayer BP enters in a topological phase
with a characteristic plasmon spectrum, which is gaped in the armchair
direction.
","[{""version"":""v1"",""created"":""Fri, 24 Jul 2015 21:01:55 GMT""}]","2015-09-30"
"1507.07014","Daniel Cibotaru","Daniel Cibotaru","Chern-Gauss-Bonnet and Lefschetz Duality from a currential point of view","36 pages",,,,"math.DG","http://arxiv.org/licenses/nonexclusive-distrib/1.0/","  We use the mapping cone for the relative deRham cohomology of a manifold with
boundary in order to show that the Chern-Gauss-Bonnet Theorem for oriented
Riemannian vector bundles over such manifolds is a manifestation of Lefschetz
Duality in any of the two embodiments of the latter. We explain how Thom
isomorphism fits into this picture, complementing thus the classical results
about Thom forms with compact support. When the rank is odd, we construct, by
using secondary transgression forms introduced here, a new closed pair of forms
on the disk bundle associated to a vector bundle, pair which is Lefschetz dual
to the zero section.
","[{""version"":""v1"",""created"":""Fri, 24 Jul 2015 21:04:25 GMT""}]","2015-07-28"
"1507.07016","Areeya Chantasri","Areeya Chantasri, Andrew N. Jordan","Stochastic path integral formalism for continuous quantum measurement","24 pages, 4 figures and 1 table","Phys. Rev. A 92, 032125 (2015)","10.1103/PhysRevA.92.032125",,"quant-ph cond-mat.mes-hall cond-mat.stat-mech","http://arxiv.org/licenses/nonexclusive-distrib/1.0/","  We generalize and extend the stochastic path integral formalism and action
principle for continuous quantum measurement introduced in [A. Chantasri, J.
Dressel and A. N. Jordan, Phys. Rev. A {\bf 88}, 042110 (2013)], where the
optimal dynamics, such as the most-likely paths, are obtained by extremizing
the action of the path integral. In this work, we apply exact functional
methods as well as develop a perturbative approach to investigate the
statistical behaviour of continuous quantum measurement, with examples given
for the qubit case. For qubit measurement with zero qubit Hamiltonian, we find
analytic solutions for average trajectories and their variances while
conditioning on fixed initial and final states. For qubit measurement with
unitary evolution, we use the perturbation method to compute expectation
values, variances, and multi-time correlation functions of qubit trajectories
in the short-time regime. Moreover, we consider continuous qubit measurement
with feedback control, using the action principle to investigate the global
dynamics of its most-likely paths, and finding that in an ideal case, qubit
state stabilization at any desired pure state is possible with linear feedback.
We also illustrate the power of the functional method by computing correlation
functions for the qubit trajectories with a feedback loop to stabilize the
qubit Rabi frequency.
","[{""version"":""v1"",""created"":""Fri, 24 Jul 2015 21:10:41 GMT""},{""version"":""v2"",""created"":""Tue, 22 Sep 2015 15:13:19 GMT""}]","2015-09-23"
"1507.07017","Masaki Ogura Dr.","Masaki Ogura and Victor M. Preciado","Stability of Spreading Processes over Time-Varying Large-Scale Networks",,,"10.1109/TNSE.2016.2516346",,"cs.SI math.DS math.OC physics.soc-ph q-bio.PE","http://arxiv.org/licenses/nonexclusive-distrib/1.0/","  In this paper, we analyze the dynamics of spreading processes taking place
over time-varying networks. A common approach to model time-varying networks is
via Markovian random graph processes. This modeling approach presents the
following limitation: Markovian random graphs can only replicate switching
patterns with exponential inter-switching times, while in real applications
these times are usually far from exponential. In this paper, we introduce a
flexible and tractable extended family of processes able to replicate, with
arbitrary accuracy, any distribution of inter-switching times. We then study
the stability of spreading processes in this extended family. We first show
that a direct analysis based on It\^o's formula provides stability conditions
in terms of the eigenvalues of a matrix whose size grows exponentially with the
number of edges. To overcome this limitation, we derive alternative stability
conditions involving the eigenvalues of a matrix whose size grows linearly with
the number of nodes. Based on our results, we also show that heuristics based
on aggregated static networks approximate the epidemic threshold more
accurately as the number of nodes grows, or the temporal volatility of the
random graph process is reduced. Finally, we illustrate our findings via
numerical simulations.
","[{""version"":""v1"",""created"":""Fri, 24 Jul 2015 21:16:01 GMT""},{""version"":""v2"",""created"":""Wed, 18 Nov 2015 01:27:16 GMT""}]","2016-11-04"
"1507.07018","Daniel Cibotaru","Daniel Cibotaru","A short proof of a Theorem by Hopf","4 pages, to appear in Expositiones Mathematicae",,,,"math.DG","http://arxiv.org/licenses/nonexclusive-distrib/1.0/","  A proof based on the Chern-Gauss-Bonnet Theorem is given to Hopf Theorem
concerning the degree of the Gauss map of a hypersurface in $\mathbb{R}^n$.
","[{""version"":""v1"",""created"":""Fri, 24 Jul 2015 21:17:26 GMT""}]","2015-07-28"
"1507.07019","Eli Dwek","Eli Dwek and Richard G. Arendt","The Evolution of Dust Mass in the Ejecta of SN1987A","Accepted for publication in The Astrophysical Journal. The manuscript
  has 10 pages, 6 figures, and 4 tables",,"10.1088/0004-637X/810/1/75",,"astro-ph.SR astro-ph.GA","http://arxiv.org/licenses/nonexclusive-distrib/1.0/","  We present a new analysis of the infrared (IR) emission from the ejecta of
SN1987A covering days 615, 775, 1144, 8515, and 9090 after the explosion. We
show that the observations are consistent with the rapid formation of about 0.4
Msun of dust, consisting of mostly silicates, near day 615, and evolving to
about 0.45 Msun of composite dust grains consisting of ~0.4 Msun of silicates
and ~ 0.05 Msun of amorphous carbon after day ~8500. The proposed scenario
challenges previous claims that dust in SN ejecta is predominantly carbon, and
that it grew from an initial mass of ~1e-3 Msun, to over 0.5 Msun by cold
accretion. It alleviates several problems with previous interpretations of the
data: (1) it reconciles the abundances of silicon, magnesium, and carbon with
the upper limits imposed by nucleosynthesis calculations; (2) it eliminates the
requirement that most of the dust observed around day 9000 grew by cold
accretion onto the1e-3 Msun of dust previously inferred for days 615 and 775
after the explosion; and (3) establishes the dominance of silicate over carbon
dust in the SN ejecta. At early epochs, the IR luminosity of the dust is
powered by the radioactive decay of 56Co, and at late times by at least
(1.3-1.6)e-4 Msun 44Ti. Even if only a fraction greater than ~10% of the
silicate dust survives the injection into the ISM, the observations firmly
establish the role of core collapse SNe as the major source of thermally
condensed silicate dust in the universe.
","[{""version"":""v1"",""created"":""Fri, 24 Jul 2015 21:18:04 GMT""}]","2015-09-16"
"1507.07020","Chien-Yi Chen","Chien-Yi Chen, S. Dawson, Yue Zhang","Higgs CP Violation from Vectorlike Quarks","19 pages, 5 figures","Phys. Rev. D 92, 075026 (2015)","10.1103/PhysRevD.92.075026","CALT-TH-2015-042","hep-ph","http://arxiv.org/licenses/nonexclusive-distrib/1.0/","  We explore CP violating aspects in the Higgs sector of models where new
vectorlike quarks carry Yukawa couplings mainly to the third generation quarks
of the Standard Model. We point out that in the simplest model, Higgs CP
violating interactions only exist in the hWW channel. At low energy, we find
that rare B decays can place similarly strong constraints as those from
electric dipole moments on the source of CP violation. These observations offer
a new handle to discriminate from other Higgs CP violating scenarios such as
scalar sector extensions of the Standard Model, and imply an interesting future
interplay among limits from different experiments.
","[{""version"":""v1"",""created"":""Fri, 24 Jul 2015 21:20:08 GMT""}]","2015-10-28"
"1507.07021","Nathan Baker","Emilie Purvine, Kyle Monson, Elizabeth Jurrus, Keith Star, and Nathan
  A. Baker","Energy Minimization of Discrete Protein Titration State Models Using
  Graph Theory",,,"10.1021/acs.jpcb.6b02059",,"q-bio.BM","http://arxiv.org/licenses/nonexclusive-distrib/1.0/","  There are several applications in computational biophysics which require the
optimization of discrete interacting states; e.g., amino acid titration states,
ligand oxidation states, or discrete rotamer angles. Such optimization can be
very time-consuming as it scales exponentially in the number of sites to be
optimized. In this paper, we describe a new polynomial-time algorithm for
optimization of discrete states in macromolecular systems. This algorithm was
adapted from image processing and uses techniques from discrete mathematics and
graph theory to restate the optimization problem in terms of ""maximum
flow-minimum cut"" graph analysis. The interaction energy graph, a graph in
which vertices (amino acids) and edges (interactions) are weighted with their
respective energies, is transformed into a flow network in which the value of
the minimum cut in the network equals the minimum free energy of the protein,
and the cut itself encodes the state that achieves the minimum free energy.
Because of its deterministic nature and polynomial-time performance, this
algorithm has the potential to allow for the ionization state of larger
proteins to be discovered.
","[{""version"":""v1"",""created"":""Fri, 24 Jul 2015 21:28:25 GMT""},{""version"":""v2"",""created"":""Sun, 17 Apr 2016 03:06:30 GMT""}]","2016-05-17"
"1507.07022","Peter Ireland","Peter J. Ireland, Andrew D. Bragg, and Lance R. Collins","The effect of Reynolds number on inertial particle dynamics in isotropic
  turbulence. Part II: Simulations with gravitational effects","49 pages, 36 figures",,"10.1017/jfm.2016.227",,"physics.flu-dyn physics.comp-ph","http://arxiv.org/licenses/nonexclusive-distrib/1.0/","  In Part I of this study, we analyzed the motion of inertial particles in
isotropic turbulence in the absence of gravity using direct numerical
simulation (DNS). Here, in Part II, we introduce gravity and study its effect
over a wide range of flow Reynolds numbers, Froude numbers, and particle Stokes
numbers. We see that gravity causes particles to sample the flow more uniformly
and reduces the time particles can spend interacting with the underlying
turbulence. We also find that gravity tends to increase inertial particle
accelerations, and we introduce a model to explain that effect.
  We then analyze the particle relative velocities and radial distribution
functions (RDFs), which are generally seen to be independent of Reynolds number
for low and moderate Kolmogorov-scale Stokes numbers $St$. We see that gravity
causes particle relative velocities to decrease, and that the relative
velocities have higher scaling exponents with gravity. We observe that gravity
has a non-trivial effect on clustering, acting to decrease clustering at low
$St$ and to increase clustering at high $St$. By considering the effect of
gravity on the clustering mechanisms described in the theory of Zaichik &
Alipchenkov (New J. Phys., 11:103018, 2009), we provide an explanation for this
non-trivial effect of gravity. We also show that when the effects of gravity
are accounted for in the theory of Zaichik & Alipchenkov, the results compare
favorably with DNS. The relative velocities and RDFs exhibit considerable
anisotropy at small separations, and this anisotropy is quantified using
spherical harmonic functions. We use the relative velocities and the RDFs to
compute the particle collision kernels, and find that the collision kernel
remains as it was for the case without gravity, namely nearly independent of
Reynolds number for low and moderate $St$.
","[{""version"":""v1"",""created"":""Fri, 24 Jul 2015 21:32:00 GMT""}]","2016-05-25"
"1507.07023","Kenneth Ward","Sophie Marques, Kenneth Ward","Holomorphic differentials of certain solvable covers of the projective
  line over a perfect field","36 pages. New theorem added (Theorem 2)",,,,"math.NT","http://arxiv.org/licenses/nonexclusive-distrib/1.0/","  We provide a Boseck-type basis of the space of holomorphic differentials for
a large class of solvable covers of the projective line with perfect field of
constants of characteristic $p > 0$. Within this class, we also describe the
Galois module structure of holomorphic differentials for abelian covers.
","[{""version"":""v1"",""created"":""Fri, 24 Jul 2015 21:33:09 GMT""},{""version"":""v2"",""created"":""Tue, 25 Aug 2015 20:13:18 GMT""},{""version"":""v3"",""created"":""Sat, 24 Dec 2016 04:32:42 GMT""},{""version"":""v4"",""created"":""Thu, 21 Dec 2017 21:00:13 GMT""}]","2017-12-25"
"1507.07024","Matthew Parno","Matthew Parno, Tarek Moselhy, and Youssef Marzouk","A multiscale strategy for Bayesian inference using transport maps",,,"10.1137/15M1032478",,"stat.CO math.PR stat.AP","http://arxiv.org/licenses/nonexclusive-distrib/1.0/","  In many inverse problems, model parameters cannot be precisely determined
from observational data. Bayesian inference provides a mechanism for capturing
the resulting parameter uncertainty, but typically at a high computational
cost. This work introduces a multiscale decomposition that exploits conditional
independence across scales, when present in certain classes of inverse
problems, to decouple Bayesian inference into two stages: (1) a computationally
tractable coarse-scale inference problem; and (2) a mapping of the
low-dimensional coarse-scale posterior distribution into the original
high-dimensional parameter space. This decomposition relies on a
characterization of the non-Gaussian joint distribution of coarse- and
fine-scale quantities via optimal transport maps. We demonstrate our approach
on a sequence of inverse problems arising in subsurface flow, using the
multiscale finite element method to discretize the steady state pressure
equation. We compare the multiscale strategy with full-dimensional Markov chain
Monte Carlo on a problem of moderate dimension (100 parameters) and then use it
to infer a conductivity field described by over 10,000 parameters.
","[{""version"":""v1"",""created"":""Fri, 24 Jul 2015 21:40:44 GMT""},{""version"":""v2"",""created"":""Thu, 18 Feb 2016 00:04:24 GMT""}]","2019-03-28"
"1507.07025","Felix Sidokhine","Felix Sidokhine","On Proving of Diophantine Inequalities with Prime Numbers by Evaluations
  of the Difference between Consecutive Primes",,,,,"math.NT","http://arxiv.org/licenses/nonexclusive-distrib/1.0/","  Using as the working hypothesis of an evaluation of the difference between
primes $p_{n+1} - p_n = O(\sqrt{p_n})$ we represent in detail the proofs of
Legendre's and Oppermann's conjectures.
","[{""version"":""v1"",""created"":""Fri, 24 Jul 2015 21:41:04 GMT""}]","2015-07-28"
"1507.07026","Peter Ireland","Peter J. Ireland, Andrew D. Bragg, and Lance R. Collins","The effect of Reynolds number on inertial particle dynamics in isotropic
  turbulence. Part I: Simulations without gravitational effects","37 pages, 23 figures",,"10.1017/jfm.2016.238",,"physics.flu-dyn physics.comp-ph","http://arxiv.org/licenses/nonexclusive-distrib/1.0/","  In this study, we analyze the statistics of both individual inertial
particles and inertial particle pairs in direct numerical simulations of
homogeneous isotropic turbulence in the absence of gravity. The effect of the
Taylor microscale Reynolds number $R_\lambda$ on the particle statistics is
examined over the largest range to date (from $R_\lambda = 88-597$). We first
explore the effect of preferential sampling on the single-particle statistics,
and use our understanding of preferential sampling to provide a physical
explanation for many of the trends in the particle velocity gradients, kinetic
energies, and accelerations at low $St$. As $St$ increases, inertial filtering
effects become more important, causing the particle kinetic energies and
accelerations to decrease.
  We then consider particle-pair statistics, and focus our attention on the
relative velocities and radial distribution functions (RDFs) of the particles.
The relative velocity statistics indicate that preferential-sampling effects
are important for $St \lesssim 0.1$ and that path-history/non-local effects
become increasingly important for $St \gtrsim 0.2$. The lower-order relative
velocity statistics are only weakly sensitive to changes in Reynolds number at
low $St$. We find that the RDFs peak near $St$ of order unity, that they
exhibit power-law scaling for low and intermediate $St$, and that they are
largely independent of Reynolds number for low and intermediate $St$. We also
observe that at large $St$, changes in the RDF are related to changes the
scaling exponents of the relative velocity variances. The particle collision
kernel is found to be largely insensitive to the flow Reynolds number,
suggesting that relatively low-Reynolds-number simulations may be able to
capture much of the relevant physics of droplet collisions and growth in the
adiabatic cores of atmospheric clouds.
","[{""version"":""v1"",""created"":""Fri, 24 Jul 2015 21:41:23 GMT""}]","2016-05-25"
"1507.07027","Renu Sharma","Pin Ann Lin, Jonathan Winterstein, John Kohoutek, Henri Lezec and Renu
  Sharma","Probing gas adsorption on individual facets of a metal nanoparticle","20 pages, 5 figures",,,,"cond-mat.mtrl-sci","http://arxiv.org/licenses/nonexclusive-distrib/1.0/","  Metal nanoparticle surfaces comprise of multiple planes with various atomic
arrangements that interact with gases differently1,2. Identification of gas
adsorption properties on all facets is an essential prerequisite for rational
design of metal nanoparticles for catalysis, energy storage and gas sensing.
Adsorbed gas molecules alter the electron density at metal surfaces3, changing
the energy of the surface plasmon resonance4,5. All-optical methods using light
as the excitation source can identify, in situ, gas-metal interactions in an
ensemble of metal nanoparticles by measuring energy shifts of either stationary
surface plasmon resonances over an entire particle, or delocalized symmetric
modes on multiple regions in a particle6-8. Such methods preclude the
characterization of facet-dependent gas adsorption for individual
nanoparticles. Here, by using in situ electron-energy-loss spectroscopy in an
environmental scanning-transmission electron microscope, we show that
localized, stationary surface plasmons on individual facets of triangular
crystalline Au nanoparticles in vacuum and in gaseous environments can be
excited using a nanometer size electron probe. We then show that, by exploiting
this localized spatial resolution, selective gas adsorption on specific sets of
facets can be characterized. We anticipate that this method can be extended to
quantify the concentration of adsorbed molecules, derive the binding energy for
specific facets for certain gas species, and design facet-controlled
nanoparticles to achieve specific gas adsorption properties.
","[{""version"":""v1"",""created"":""Fri, 24 Jul 2015 21:41:47 GMT""}]","2015-07-28"
