"1512.07883","Satoshi Nawata","Sergei Gukov, Satoshi Nawata, Ingmar Saberi, Marko Stosic, Piotr
  Su{\l}kowski","Sequencing BPS Spectra","160 pages, 69 figures, 4 tables; Don't be intimidated by the length -
  each section can be read more or less independently.; v2 and v3, minor
  corrections, a Mathematica file is attached as an ancillary file","JHEP 1603 (2016) 004","10.1007/JHEP03(2016)004","CALT-2015-063","hep-th math-ph math.GT math.MP math.QA","http://arxiv.org/licenses/nonexclusive-distrib/1.0/","  This paper provides both a detailed study of color-dependence of link
homologies, as realized in physics as certain spaces of BPS states, and a broad
study of the behavior of BPS states in general. We consider how the spectrum of
BPS states varies as continuous parameters of a theory are perturbed. This
question can be posed in a wide variety of physical contexts, and we answer it
by proposing that the relationship between unperturbed and perturbed BPS
spectra is described by a spectral sequence. These general considerations unify
previous applications of spectral sequence techniques to physics, and explain
from a physical standpoint the appearance of many spectral sequences relating
various link homology theories to one another. We also study structural
properties of colored HOMFLY homology for links and evaluate Poincare
polynomials in numerous examples. Among these structural properties is a novel
""sliding"" property, which can be explained by using (refined) modular S-matrix.
This leads to the identification of modular transformations in Chern-Simons
theory and 3d N=2 theory via the 3d/3d correspondence. Lastly, we introduce the
notion of associated varieties as classical limits of recursion relations of
colored superpolynomials of links, and study their properties.
","[{""version"":""v1"",""created"":""Thu, 24 Dec 2015 19:10:26 GMT""},{""version"":""v2"",""created"":""Wed, 30 Dec 2015 09:35:15 GMT""},{""version"":""v3"",""created"":""Sun, 23 Apr 2017 08:02:01 GMT""}]","2017-04-25"
"1512.07884","Joachim Kock","Joachim Kock","Combinatorial Dyson-Schwinger equations and inductive data types","32 pages. Written for the proceedings of the Workshop on
  Dyson-Schwinger Equations in Modern Mathematics & Physics, ECT* Trento, 2014.
  The main points explained are from arXiv:1512.03027","Front. Phys. 11 (2016), 111205, pp.1-15",,,"math-ph math.LO math.MP","http://arxiv.org/licenses/nonexclusive-distrib/1.0/","  The goal of this contribution is to explain the analogy between combinatorial
Dyson-Schwinger equations and inductive data types to a readership of
mathematical physicists. The connection relies on an interpretation of
combinatorial Dyson-Schwinger equations as fixpoint equations for polynomial
functors (established elsewhere by the author, and summarised here), combined
with the now-classical fact that polynomial functors provide semantics for
inductive types. The paper is expository, and comprises also a brief
introduction to type theory.
","[{""version"":""v1"",""created"":""Thu, 24 Dec 2015 19:11:16 GMT""}]","2016-10-04"
"1512.07885","Jia Liu","Jia Liu (1), Xiao-Ping Wang (1) and Wei Xue (2) ((1) PRISMA/MITP,
  Johannes Gutenberg University Mainz, (2) CTP, Massachusetts Institute of
  Technology)","LHC diphoton excess from colorful resonances","14 pages, 6 figures, 1 table",,,"MITP/15-12X","hep-ph","http://arxiv.org/licenses/nonexclusive-distrib/1.0/","  Motivated by the possible diphoton excess around $750~\rm{GeV}$ observed by
ATLAS and CMS at $13~\rm{TeV}$, we consider a coloron model from $\rm{SU}(3)_1
\times \rm{SU}(3)_2$ spontaneously breaking to the Standard Model
$\rm{SU}(3)_C$. A colored massive vector boson is resonantly produced by $q
\bar q $ in proton collision, followed by a colored scalar cascade decay. This
process gives two photons and one jet in the final states. And the kinetic edge
of the two photons can be an interpretation of the diphoton excess, while
satisfying the dijet, $\rm{t}\bar{t}$, jet+photon resonance constraints. In
this model, due to the large mass of vector resonance, the parton luminosity
function ratio between $13~\rm{TeV}$ and $8~\rm{TeV}$ can be quite large.
Therefore, the diphoton excess has not been observed at $8~\rm{TeV}$ search. On
the other hand, having all the new particles color-charged around $\rm{TeV}$,
this model predicts new signals at the LHC, which can be validated soon.
","[{""version"":""v1"",""created"":""Thu, 24 Dec 2015 19:16:17 GMT""}]","2015-12-25"
"1512.07886","Francisco A. Brito","M.A. Anacleto, D. Bazeia, F.A. Brito, J. C. Mota-Silva","Quantum-corrected two-dimensional Horava-Lifshitz black hole entropy","13 pages, no figure, Latex; version to appear in Advances in High
  Energy Physics","Advances in High Energy Physics 2016, 8465759 (2016)","10.1155/2016/8465759",,"hep-th gr-qc","http://arxiv.org/licenses/nonexclusive-distrib/1.0/","  In this paper we focus on the Halmiton-Jacobi method to determine several
thermodynamic quantities such as the temperature, entropy and specific heat of
two-dimensional Horava-Lifshitz black holes by using the generalized
uncertainty principles (GUP). We also address the product of horizons, mainly
concerning the event, Cauchy, cosmological and virtual horizons.
","[{""version"":""v1"",""created"":""Thu, 24 Dec 2015 19:18:02 GMT""},{""version"":""v2"",""created"":""Fri, 22 Jul 2016 05:09:44 GMT""}]","2016-08-29"
"1512.07887","Yurii Averboukh","Yurii Averboukh","Deterministic limit of mean field games associated with nonlinear Markov
  processes","27 pages",,,,"math.OC math.PR","http://arxiv.org/licenses/nonexclusive-distrib/1.0/","  The paper is concerned with the deterministic limit of mean field games with
the nonlocal coupling. It is assumed that the dynamics of mean field games are
given by nonlinear Markov processes. This type of games includes stochastic
mean field games as well as mean field games with finite state space. We
consider the limiting deterministic mean field game within the framework of
minimax approach. The concept of minimax solutions is close to the
probabilistic formulation. In this case the Hamilton--Jacobi equation is
considered in the minimax/viscosity sense, whereas the flow of probabilities is
determined by the probability on the set of solutions of the differential
inclusion associated with the Hamilton-Jacobi equation such that those
solutions are viable in the graph of the minimax solution. The main result of
the paper is the convergence (up to subsequence) of the solutions of the mean
field games to the minimax solution of deterministic mean field game in the
case when the underlying dynamics converge to the deterministic evolution.
","[{""version"":""v1"",""created"":""Thu, 24 Dec 2015 19:19:23 GMT""},{""version"":""v2"",""created"":""Sun, 24 Jan 2016 19:11:30 GMT""},{""version"":""v3"",""created"":""Sun, 13 Nov 2016 18:38:28 GMT""},{""version"":""v4"",""created"":""Thu, 4 Jan 2018 19:40:19 GMT""}]","2018-01-08"
"1512.07888","Carlos A. S. Almeida","D. M. Dantas, Roldao da Rocha, C. A. S. Almeida","Exotic Elko on String-Like Defects in Six Dimensions","16 pages, 6 figures. Replaced in order to match modified version
  accepted in EPL","Europhys.Lett. 117 (2017) no.5, 51001","10.1209/0295-5075/117/51001",,"hep-th","http://arxiv.org/licenses/nonexclusive-distrib/1.0/","  We analyse the trapping of eigenspinors of the charge conjugation operator
with dual helicity (Elko), in thin and thick string-like models with
codimension-2. Elko spinor fields describe mass dimension one fermions in four
dimensions (and, correspondingly, mass dimension two fermions in six
dimensions), that represent natural dark matter prime candidates. This dark
spinor has many applications, from particle physics to cosmology. On the other
hand, six-dimensional brane-world models have, among other prominent features,
the spontaneous confinement of free spin 1 fields and a mechanism that explains
the mass hierarchy of fundamental fermions. In this paper, we use scalar
couplings in order to confine the zero mode of Elko in six dimensions.
Moreover, we use the Elko dark spinor features to propose an exotic coupling in
order to remove the complex-valued terms in the massive Kaluza-Klein modes.
Hence, we show that six dimensional models can resolve the main issues of Elko
fields confinement presented in five dimensions.
","[{""version"":""v1"",""created"":""Thu, 24 Dec 2015 19:21:31 GMT""},{""version"":""v2"",""created"":""Mon, 15 May 2017 19:52:28 GMT""}]","2017-05-17"
"1512.07889","Shun Zhou","Jue Zhang and Shun Zhou","Electroweak Vacuum Stability and Diphoton Excess at 750 GeV","17 pages, 2 figures, an error removed, numerical results revised,
  more discussions added, to be published in Chin. Phys. C","Chin. Phys. C 40 (2016) 081001","10.1088/1674-1137/40/8/081001",,"hep-ph","http://arxiv.org/licenses/nonexclusive-distrib/1.0/","  Recently, both ATLAS and CMS collaborations at the CERN Large Hadron Collider
(LHC) have announced their observations of an excess of diphoton events around
the invariant mass of $750~{\rm GeV}$ with a local significance of $3.6\sigma$
and $2.6\sigma$, respectively. In this paper, we interpret the diphoton excess
as the on-shell production of a real singlet scalar in the $pp \to S \to \gamma
\gamma$ channel. To accommodate the observed production rate, we further
introduce a vector-like fermion $F$, which is carrying both color and electric
charges. The viable regions of model parameters are explored for this simple
extension of the Standard Model (SM). Moreover, we revisit the problem of
electroweak vacuum stability in the same scenario, and find that the
requirement for the electroweak vacuum stability up to high energy scales
imposes serious constraints on the Yukawa coupling of the vector-like fermion
and the quartic couplings of the SM Higgs boson and the new singlet scalar.
Consequently, a successful explanation for the diphoton excess and the absolute
stability of electroweak vacuum cannot be achieved simultaneously in this
economical setup.
","[{""version"":""v1"",""created"":""Thu, 24 Dec 2015 19:21:57 GMT""},{""version"":""v2"",""created"":""Mon, 28 Dec 2015 17:24:26 GMT""},{""version"":""v3"",""created"":""Thu, 28 Apr 2016 08:30:07 GMT""}]","2016-05-04"
"1512.07890","Wilami Teixeira da Cruz","W. T. Cruz, R. V. Maluf, D. M. Dantas and C. A. S. Almeida","Multiresonance modes in sine-Gordon brane models","24 pages. 12 figures. Version to appear in Annals of Physics","Annals of Physics 375 (2016) 49-64","10.1016/j.aop.2016.09.015",,"hep-th","http://arxiv.org/licenses/nonexclusive-distrib/1.0/","  In this work, we study the localization of the vector gauge field in two
five-dimensional braneworlds generated by scalar fields coupled to gravity. The
sine-Gordon like potentials are employed to produce different thick brane
setups. A zero mode localized is obtained, and we show the existence of
reverberations with the wave solutions indicating a quasi-localized massive
mode. More interesting results are achieved when we propose a double
sine-Gordon potential to the scalar field. The resulting thick brane shows a
more detailed topology with the presence of an internal structure composed by
two kinks. The massive spectrum of the gauge field is revalued on this scenario
revealing the existence of various resonant modes. Furthermore, we compute the
corrections to Coulomb law coming from these massive KK vector modes in these
thick scenarios, where is concluded that the dilaton parameter regulates these
corrections.
","[{""version"":""v1"",""created"":""Thu, 24 Dec 2015 19:32:27 GMT""},{""version"":""v2"",""created"":""Fri, 14 Oct 2016 15:37:38 GMT""}]","2016-10-17"
"1512.07891","Alexander Mayer","Alexander E. Mayer, Vasiliy S. Krasnikov","Atomistic and continuum modeling of non-equilibrium melting of aluminum",,,,,"cond-mat.mtrl-sci","http://arxiv.org/licenses/nonexclusive-distrib/1.0/","  MD simulations of the non-equilibrium melting of aluminum are performed both
with and without accounting of the electronic subsystem. A continuum model of
melting is purposed basing on the obtained MD results, in which the current
phase state is described in terms of fields of concentration and size of
melting sites. Growth equation for melting areas is derived from the heat
fluxes analysis. Nucleation equation for melting sites is formulated basing on
the thermofluctuational approach. The method of determination of the model
coefficients with using the MD simulation results is purposed. The continuum
model is applied to the problem of the non-equilibrium melting of aluminum
within the energy absorption area of the high-current electron beam.
","[{""version"":""v1"",""created"":""Thu, 24 Dec 2015 19:41:40 GMT""}]","2015-12-25"
"1512.07892","Dax Enshan Koh","Dax Enshan Koh","Further extensions of Clifford circuits and their classical simulation
  complexities","19 pages, 3 figures","Quantum Information and Computation, Vol. 17, No. 3&4 (2017)
  0262-0282","10.26421/QIC17.3-4-5",,"quant-ph cs.CC","http://arxiv.org/licenses/nonexclusive-distrib/1.0/","  Extended Clifford circuits straddle the boundary between classical and
quantum computational power. Whether such circuits are efficiently classically
simulable seems to depend delicately on the ingredients of the circuits. While
some combinations of ingredients lead to efficiently classically simulable
circuits, other combinations, which might just be slightly different, lead to
circuits which are likely not. We extend the results of Jozsa and Van den Nest
[Quant. Info. Comput. 14, 633 (2014)] by studying two further extensions of
Clifford circuits. First, we consider how the classical simulation complexity
changes when we allow for more general measurements. Second, we investigate
different notions of what it means to ""classically simulate"" a quantum circuit.
These further extensions give us 24 new combinations of ingredients compared to
Jozsa and Van den Nest, and we give a complete classification of their
classical simulation complexities. Our results provide more examples where
seemingly modest changes to the ingredients of Clifford circuits lead to
""large"" changes in the classical simulation complexities of the circuits, and
also include new examples of extended Clifford circuits that exhibit ""quantum
supremacy"", in the sense that it is not possible to efficiently classically
sample from the output distributions of such circuits, unless the polynomial
hierarchy collapses.
","[{""version"":""v1"",""created"":""Thu, 24 Dec 2015 19:42:32 GMT""},{""version"":""v2"",""created"":""Thu, 9 Feb 2017 03:36:45 GMT""}]","2021-04-13"
"1512.07894","Eleny Ionel","Eleny-Nicoleta Ionel and Thomas H. Parker","Thin compactifications and relative fundamental classes","Final version, 33 pages, to appear in the Journal of Symplectic
  Geometry",,,,"math.SG","http://arxiv.org/licenses/nonexclusive-distrib/1.0/","  We define a notion of relative fundamental class that applies to moduli
spaces in gauge theory and in symplectic Gromov-Witten theory. For universal
moduli spaces over a parameter space, the relative fundamental class specifies
an element of the Cech homology of the compactification of each fiber; it is
defined if the compactification is ""thin"" in the sense that its boundary has
homological codimension at least two.
","[{""version"":""v1"",""created"":""Thu, 24 Dec 2015 19:59:47 GMT""},{""version"":""v2"",""created"":""Fri, 29 Sep 2017 23:45:25 GMT""},{""version"":""v3"",""created"":""Thu, 26 Apr 2018 12:46:12 GMT""}]","2018-04-27"
"1512.07895","Jose Ramon Espinosa","J.A. Casas, J.R. Espinosa and J.M. Moreno","The 750 GeV Diphoton Excess as a First Light on Supersymmetry Breaking","14 pages, 3 figures",,"10.1016/j.physletb.2016.05.070",,"hep-ph","http://arxiv.org/licenses/nonexclusive-distrib/1.0/","  One of the most exciting explanations advanced for the recent diphoton excess
found by ATLAS and CMS is in terms of sgoldstino decays: a signal of low-energy
supersymmetry-breaking scenarios. The sgoldstino, a scalar, couples directly to
gluons and photons, with strength related to gaugino masses, that can be of the
right magnitude to explain the excess. However, fitting the suggested resonance
width, Gamma ~ 45 GeV, is not so easy. In this paper we explore efficient
possibilities to enhance the sgoldstino width, via the decay into two Higgses,
two Higgsinos and through mixing between the sgoldstino and the Higgs boson. In
addition, we present an alternative and more efficient mechanism to generate a
mass splitting between the scalar and pseudoscalar components of the
sgoldstino, which has been suggested as an interesting alternative explanation
to the apparent width of the resonance.
","[{""version"":""v1"",""created"":""Thu, 24 Dec 2015 20:13:13 GMT""},{""version"":""v2"",""created"":""Tue, 16 Feb 2016 12:44:18 GMT""}]","2016-06-22"
"1512.07896","Stefano Davini","The DarkSide Collaboration: P. Agnes, L. Agostino, I. F. M.
  Albuquerque, T. Alexander, A. K. Alton, K. Arisaka, H. O. Back, B. Baldin, K.
  Biery, G. Bonfini, M. Bossa, B. Bottino, A. Brigatti, J. Brodsky, F. Budano,
  S. Bussino, M. Cadeddu, L. Cadonati, M. Cadoni, F. Calaprice, N. Canci, A.
  Candela, H. Cao, M. Cariello, M. Carlini, S. Catalanotti, P. Cavalcante, A.
  Chepurnov, A. G. Cocco, G. Covone, L. Crippa, D. D'Angelo, M. D'Incecco, S.
  Davini, S. De Cecco, M. De Deo, M. De Vincenzi, A. Derbin, A. Devoto, F. Di
  Eusanio, G. Di Pietro, E. Edkins, A. Empl, A. Fan, G. Fiorillo, K. Fomenko,
  G. Foster, D. Franco, F. Gabriele, C. Galbiati, C. Giganti, A. M. Goretti, F.
  Granato, L. Grandi, M. Gromov, M. Guan, Y. Guardincerri, B. R. Hackett, K. R.
  Herner, E. V. Hungerford, Aldo Ianni, Andrea Ianni, I. James, T. Johnson, C.
  Jollet, K. Keeter, C. L. Kendziora, V. Kobychev, G. Koh, D. Korablev, G.
  Korga, A. Kubankin, X. Li, M. Lissia, P. Lombardi, S. Luitz, Y. Ma, I. N.
  Machulin, A. Mandarano, S. M. Mari, J. Maricic, L. Marini, C. J. Martoff, A.
  Meregaglia, P. D. Meyers, T. Miletic, R. Milincic, D. Montanari, A. Monte, M.
  Montuschi, M. E. Monzani, P. Mosteiro, B. J. Mount, V. N. Muratova, P.
  Musico, J. Napolitano, A. Nelson, S. Odrowski, M. Orsini, F. Ortica, L.
  Pagani, M. Pallavicini, E. Pantic, S. Parmeggiano, K. Pelczar, N. Pelliccia,
  S. Perasso, A. Pocar, S. Pordes, D. A. Pugachev, H. Qian, K. Randle, G.
  Ranucci, A. Razeto, B. Reinhold, A. L. Renshaw, A. Romani, B. Rossi, N.
  Rossi, S. D. Rountree, D. Sablone, P. Saggese, R. Saldanha, W. Sands, S.
  Sangiorgio, C. Savarese, E. Segreto, D. A. Semenov, E. Shields, P. N. Singh,
  M. D. Skorokhvatov, O. Smirnov, A. Sotnikov, C. Stanford, Y. Suvorov, R.
  Tartaglia, J. Tatarowicz, G. Testera, A. Tonazzo, P. Trinchese, E. V.
  Unzhakov, A. Vishneva, B. Vogelaar, M. Wada, S. Walker, H. Wang, Y. Wang, A.
  W. Watson, S. Westerdale, J. Wilhelmi, M. M. Wojcik, X. Xiang, J. Xu, C.
  Yang, J. Yoo, S. Zavatarelli, A. Zec, W. Zhong, C. Zhu, G. Zuzel","The veto system of the DarkSide-50 experiment",,"Journal of Instrumentation, 11 (2016): P03016","10.1088/1748-0221/11/03/P03016",,"physics.ins-det hep-ex","http://arxiv.org/licenses/nonexclusive-distrib/1.0/","  Nuclear recoil events produced by neutron scatters form one of the most
important classes of background in WIMP direct detection experiments, as they
may produce nuclear recoils that look exactly like WIMP interactions. In
DarkSide-50, we both actively suppress and measure the rate of neutron-induced
background events using our neutron veto, composed of a boron-loaded liquid
scintillator detector within a water Cherenkov detector. This paper is devoted
to the description of the neutron veto system of DarkSide-50, including the
detector structure, the fundamentals of event reconstruction and data analysis,
and basic performance parameters.
","[{""version"":""v1"",""created"":""Thu, 24 Dec 2015 20:16:15 GMT""}]","2017-02-06"
"1512.07897","Naci Erkan","Naci Erkan, Burak Ulas","The low mass ratio contact binary system V728 Herculis","21 pages, 4 figures, 4 tables",,"10.1016/j.newast.2015.12.009",,"astro-ph.SR","http://arxiv.org/licenses/nonexclusive-distrib/1.0/","  We present the orbital period study and the photometric analys of the contact
binary system V728 Her. Our orbital period analysis shows that the period of
the system increases (dP/dt=1.92x10^-7dyr^-1) and the mass transfer rate from
the less massive component to more massive one is 2.51x10^-8M_suny^-1. In
addition, an advanced sinusoidal variation in period can be attributed to the
light-time effect by a tertiary component or the Applegate mechanism triggered
by the secondary component. The simultaneous multicolor BVR light and radial
velocity curves solution indicates that the physical parameters of the system
are M1=1.8M_sun, M2=0.28M_sun, R1=1.87R_sun, R2=0.82R_sun, L1=5.9L_sun, and
L2=1.2L_sun. We discuss the evolutionary status and conclude that V728 Her is a
deep (f=81%), low mass ratio (q=0.16) contact binary system.
","[{""version"":""v1"",""created"":""Thu, 24 Dec 2015 20:27:01 GMT""}]","2015-12-25"
"1512.07898","Stephen Childress","Stephen Childress, Andrew D. Gilbert, and Paul Valiant","Eroding dipoles and vorticity growth for Euler flows in $
  \scriptstyle{\mathbb{R}}^3$ I. Axisymmetric flow without swirl","33 pages, 11 figures",,"10.1017/jfm.2016.573",,"physics.flu-dyn","http://arxiv.org/licenses/nonexclusive-distrib/1.0/","  A review of analyses based upon anti-parallel vortex structures suggests that
structurally stable vortex structures with eroding circulation may offer a path
to the study of rapid vorticity growth in solutions of Euler's equations in $
\scriptstyle{\mathbb{R}}^3$. We examine here the possible formation of such a
structure in axisymmetric flow without swirl, leading to maximal growth of
vorticity as $t^{4/3}$. Our study suggests that the optimizing flow giving the
$t^{4/3}$ growth mimics an exact solution of Euler's equations representing an
eroding toroidal vortex dipole which locally conserves kinetic energy. The
dipole cross-section is a perturbation of the classical Sadovskii dipole having
piecewise constant vorticity, which breaks the symmetry of closed streamlines.
The structure of this perturbed Sadovskii dipole is analyzed asymptotically at
large times, and its predicted properties are verified numerically.
","[{""version"":""v1"",""created"":""Thu, 24 Dec 2015 20:31:45 GMT""}]","2016-11-03"
"1512.07900","Mark Ainslie","Di Hu, Mark D. Ainslie, Jordan P. Rush, John H. Durrell, Jin Zou","DC Characterization of a Circular, Epoxy-Impregnated High Temperature
  Superconducting (HTS) Coil",,,"10.1007/s10948-016-3842-2",,"cond-mat.supr-con","http://arxiv.org/licenses/nonexclusive-distrib/1.0/","  Direct current (DC) characterization of high temperature superconducting
(HTS) coils is important for HTS applications, such as electric machines,
superconducting magnetic energy storage (SMES) and transformers. In this paper,
DC characterization of a circular, epoxy-impregnated HTS coil made from YBCO
coated conductor for use as a prototype axial flux HTS electric machine is
presented. Multiple voltage taps were utilized within the coil during
measurement to help provide further detailed information on its DC behavior as
a function of length. Based on the experimental results, there exist regions of
non-uniformity along the length of superconductor in the coil, resulting in
non-ideal superconducting properties of the coil. By studying the
current-voltage (I-V) curves across different regions, it is found that a
decreasing n-value and critical current exists in the non-uniform parts of the
HTS coil.
","[{""version"":""v1"",""created"":""Thu, 24 Dec 2015 20:41:14 GMT""}]","2020-06-23"
"1512.07901","Marco Bressan","Marco Bressan, Enoch Peserico, Luca Pretto","Simple set cardinality estimation through random sampling","3 pages",,,,"cs.DM","http://arxiv.org/licenses/nonexclusive-distrib/1.0/","  We present a simple algorithm that estimates the cardinality $n$ of a set $V$
when allowed to sample elements of $V$ uniformly and independently at random.
Our algorithm with probability $(1-\delta)$ returns a
$(1\pm\epsilon)-$approximation of $n$ drawing $O\big(\sqrt{n} \cdot
\epsilon^{-1}\sqrt{\log(\delta^{-1})}\big)$ samples (for
$\epsilon^{-1}\sqrt{\log(\delta^{-1})} = O(\sqrt{n})$).
","[{""version"":""v1"",""created"":""Thu, 24 Dec 2015 20:42:10 GMT""},{""version"":""v2"",""created"":""Mon, 18 Jan 2016 15:25:18 GMT""},{""version"":""v3"",""created"":""Wed, 11 Apr 2018 21:09:20 GMT""}]","2018-04-13"
"1512.07902","Vladislav Vaganov","Vladislav Vaganov","Holographic entanglement entropy for massive flavours in dS_4","36 pages, 8 figures. Minor corrections. Clarifications about lack of
  transition in EE as sphere size crosses horizon. Version published in JHEP",,"10.1007/JHEP03(2016)172",,"hep-th","http://arxiv.org/licenses/nonexclusive-distrib/1.0/","  We examine the holographic entanglement entropy of spherical regions in de
Sitter space in the presence of massive flavour fields which are modelled by
probe D7 branes in AdS_5xS^5. We focus on the finite part of the massive
correction to the entropy in the limits of small mass and large mass that are
separated by a phase transition between two topologically distinct brane
embeddings. For small masses, it approaches the flat space result for small
spheres, whereas for large spheres there is a term that goes as the log of the
sphere radius. For large masses, we find evidence for a universal contribution
logarithmic in the mass. In all cases the entanglement entropy is smooth as the
sphere radius crosses the horizon.
","[{""version"":""v1"",""created"":""Thu, 24 Dec 2015 20:43:48 GMT""},{""version"":""v2"",""created"":""Wed, 6 Apr 2016 14:50:27 GMT""}]","2016-04-07"
