"1512.07845","Martin Hairer","Martin Hairer and Jeremy Quastel","A class of growth models rescaling to KPZ","105 pages",,,,"math-ph math.AP math.MP math.PR","http://arxiv.org/licenses/nonexclusive-distrib/1.0/","  We consider a large class of $1+1$-dimensional continuous interface growth
models and we show that, in both the weakly asymmetric and the intermediate
disorder regimes, these models converge to Hopf-Cole solutions to the KPZ
equation.
","[{""version"":""v1"",""created"":""Thu, 24 Dec 2015 16:08:44 GMT""}]","2015-12-25"
"1512.07846","Apostolos Vourdas","A. Vourdas","Mobius operators and non-additive quantum probabilities in the
  Birkhoff-von Neumann lattice","in J. Geom. Phys. (2016)","J.Geom. Phys. 101, 38 (2016)","10.1016/j.geomphys.2015.12.002",,"math-ph math.MP","http://arxiv.org/licenses/nonexclusive-distrib/1.0/","  The properties of quantum probabilities are linked to the geometry of quantum
mechanics, described by the Birkhoff-von Neumann lattice. Quantum probabilities
violate the additivity property of Kolmogorov probabilities, and they are
interpreted as Dempster-Shafer probabilities. Deviations from the additivity
property are quantified with the Mobius (or non-additivity) operators which are
defined through Mobius transforms, and which are shown to be intimately related
to commutators. The lack of distributivity in the Birkhoff-von Neumann lattice
Lambda , causes deviations from the law of the total probability (which is
central in Kolmogorov's probability theory). Projectors which quantify the lack
of distributivity in Lambda , and also deviations from the law of the total
probability, are introduced. All these operators, are observables and they can
be measured experimentally. Constraints for the Mobius operators, which are
based on the properties of the Birkhoff-von Neumann lattice (which in the case
of finite quantum systems is a modular lattice), are derived.Application of
this formalism in the context of coherent states, generalizes coherence to
multi-dimensional structures.
","[{""version"":""v1"",""created"":""Thu, 24 Dec 2015 16:14:44 GMT""}]","2016-02-17"
"1512.07847","Derrick Stolee","Mohit Kumbhat, Kevin Moss, and Derrick Stolee","Choosability with union separation","10 pages, 2 figures",,,,"math.CO","http://arxiv.org/licenses/nonexclusive-distrib/1.0/","  List coloring generalizes graph coloring by requiring the color of a vertex
to be selected from a list of colors specific to that vertex. One refinement of
list coloring, called choosability with separation, requires that the
intersection of adjacent lists is sufficiently small. We introduce a new
refinement, called choosability with union separation, where we require that
the union of adjacent lists is sufficiently large. For $t \geq k$, a
$(k,t)$-list assignment is a list assignment $L$ where $|L(v)| \geq k$ for all
vertices $v$ and $|L(u)\cup L(v)| \geq t$ for all edges $uv$. A graph is
$(k,t)$-choosable if there is a proper coloring for every $(k,t)$-list
assignment. We explore this concept through examples of graphs that are not
$(k,t)$-choosable, demonstrating sparsity conditions that imply a graph is
$(k,t)$-choosable, and proving that all planar graphs are $(3,11)$-choosable
and $(4,9)$-choosable.
","[{""version"":""v1"",""created"":""Thu, 24 Dec 2015 16:19:30 GMT""}]","2015-12-25"
"1512.07848","James Johndrow","James E. Johndrow and Robert L. Wolpert","Model-free inference on extreme dependence via waiting times",,,,,"math.ST math.PR stat.ME stat.TH","http://arxiv.org/licenses/nonexclusive-distrib/1.0/","  A variety of methods have been proposed for inference about extreme
dependence for multivariate or spatially-indexed stochastic processes and time
series. Most of these proceed by first transforming data to some specific
extreme value marginal distribution, often the unit Fr\'echet, then fitting a
family of max-stable processes to the transformed data and exploring dependence
within the framework of that model. The marginal transformation, model
selection, and model fitting are all possible sources of misspecification in
this approach.
  We propose an alternative model-free approach, based on the idea that
substantial information on the strength of tail dependence and its temporal
structure are encoded in the distribution of the waiting times between
exceedances of high thresholds at different locations. We propose quantifying
the strength of extremal dependence and assessing uncertainty by using
statistics based on these waiting times. The method does not rely on any
specific underlying model for the process, nor on asymptotic distribution
theory. The method is illustrated by applications to climatological, financial,
and electrophysiology data.
  To put the proposed approach within the context of the existing literature,
we construct a class of spacetime-indexed stochastic processes whose waiting
time distributions are available in closed form by endowing the support points
in de Haan's spectral representation of max-stable processes with random birth
times, velocities, and lifetimes, and applying Smith's model to these
processes. We show that waiting times in this model are stochatically
decreasing in mean speed, and the sample mean of the waiting times obeys a
central limit theorem with a uniform convergence rate under mild conditions.
This indicates that our procedure can be implemented in this setting using
standard $t$ statistics and associated hypothesis tests.
","[{""version"":""v1"",""created"":""Thu, 24 Dec 2015 16:21:39 GMT""},{""version"":""v2"",""created"":""Thu, 28 Jul 2016 23:01:54 GMT""},{""version"":""v3"",""created"":""Mon, 21 May 2018 17:32:01 GMT""}]","2018-05-22"
"1512.07849","Konrad Dabrowski","Konrad K. Dabrowski, Fran\c{c}ois Dross, Dani\""el Paulusma","Colouring Diamond-free Graphs","30 pages, 3 figures. An extended abstract of this paper was published
  in the proceedings of SWAT 2016 (DOI:10.4230/LIPIcs.SWAT.2016.16)",,,,"cs.DM math.CO","http://arxiv.org/licenses/nonexclusive-distrib/1.0/","  The Colouring problem is that of deciding, given a graph $G$ and an integer
$k$, whether $G$ admits a (proper) $k$-colouring. For all graphs $H$ up to five
vertices, we classify the computational complexity of Colouring for
$(\mbox{diamond},H)$-free graphs. Our proof is based on combining known results
together with proving that the clique-width is bounded for $(\mbox{diamond},
P_1+2P_2)$-free graphs. Our technique for handling this case is to reduce the
graph under consideration to a $k$-partite graph that has a very specific
decomposition. As a by-product of this general technique we are also able to
prove boundedness of clique-width for four other new classes of
$(H_1,H_2)$-free graphs. As such, our work also continues a recent systematic
study into the (un)boundedness of clique-width of $(H_1,H_2)$-free graphs, and
our five new classes of bounded clique-width reduce the number of open cases
from 13 to 8.
","[{""version"":""v1"",""created"":""Thu, 24 Dec 2015 16:23:35 GMT""},{""version"":""v2"",""created"":""Mon, 5 Sep 2016 09:22:03 GMT""}]","2016-09-06"
"1512.07850","Pedro Jorge Mart\'inez","Marcelo Botta-Cantcheff, Pedro J. Mart\'inez and Guillermo A. Silva","On excited states in real-time AdS/CFT","16 pages, 6 figures, accepted for publication by JHEP",,"10.1007/JHEP02(2016)171",,"hep-th","http://arxiv.org/licenses/nonexclusive-distrib/1.0/","  The Skenderis-van Rees prescription, which allows the calculation of
time-ordered correlation functions of local operators in CFT's using
holographic methods is studied and applied for excited states. Calculation of
correlators and matrix elements of local CFT operators between generic in/out
states are carried out in global Lorentzian AdS. We find the precise form of
such states, obtain an holographic formula to compute the inner product between
them, and using the consistency with other known prescriptions, we argue that
the in/out excited states built according to the Skenderis-Van Rees
prescription correspond to {\it coherent} states in the (large-$N$) AdS-Hilbert
space. This is confirmed by explicit holographic computations. The outcome of
this study has remarkable implications on generalizing the Hartle-Hawking
construction for wave functionals of excited states in AdS quantum gravity.
","[{""version"":""v1"",""created"":""Thu, 24 Dec 2015 16:25:03 GMT""},{""version"":""v2"",""created"":""Fri, 26 Feb 2016 00:54:03 GMT""}]","2016-03-23"
"1512.07851","Joseph Keshet","Joseph Keshet, Adam Kariv, Arnon Dagan, Dvir Volk, Joey Simhon","Context-Based Prediction of App Usage",,,,,"cs.LG","http://arxiv.org/licenses/nonexclusive-distrib/1.0/","  There are around a hundred installed apps on an average smartphone. The high
number of apps and the limited number of app icons that can be displayed on the
device's screen requires a new paradigm to address their visibility to the
user. In this paper we propose a new online algorithm for dynamically
predicting a set of apps that the user is likely to use. The algorithm runs on
the user's device and constantly learns the user's habits at a given time,
location, and device state. It is designed to actively help the user to
navigate to the desired app as well as to provide a personalized feeling, and
hence is aimed at maximizing the AUC. We show both theoretically and
empirically that the algorithm maximizes the AUC, and yields good results on a
set of 1,000 devices.
","[{""version"":""v1"",""created"":""Thu, 24 Dec 2015 16:27:40 GMT""},{""version"":""v2"",""created"":""Mon, 25 Jan 2016 19:39:40 GMT""}]","2016-01-26"
"1512.07852","Hao Huang","Jacob Fox, Hao Huang, Benny Sudakov","On graphs decomposable into induced matchings of linear sizes",,,,,"math.CO","http://arxiv.org/licenses/nonexclusive-distrib/1.0/","  We call a graph $G$ an $(r,t)$-Ruzsa-Szemer\'edi graph if its edge set can be
partitioned into $t$ edge-disjoint induced matchings, each of size $r$. These
graphs were introduced in 1978 and has been extensively studied since then. In
this paper, we consider the case when $r=cn$. For $c>1/4$, we determine the
maximum possible $t$ which is a constant depending only on $c$. On the other
hand, when $c=1/4$, there could be as many as $\Omega(\log n)$ induced
matchings. We prove that this bound is tight up to a constant factor. Finally,
when $c$ is fixed strictly between $1/5$ and $1/4$, we give a short proof that
the number $t$ of induced matchings is $O(n/\log n)$. We are also able to
further improve the upper bound to $o(n/\log n)$ for fixed $c> 1/4-b$ for some
positive constant $b$.
","[{""version"":""v1"",""created"":""Thu, 24 Dec 2015 16:27:55 GMT""}]","2015-12-25"
"1512.07853","Jae Sik Lee","Kingman Cheung, P. Ko, Jae Sik Lee, Jubin Park, and Po-Yan Tseng","Higgs precision study of the 750 GeV diphoton resonance and the 125 GeV
  standard model Higgs boson with Higgs-singlet mixing","19 pages, 2 figures, to appear in PRD","Phys. Rev. D 94, 033010 (2016)","10.1103/PhysRevD.94.033010","CNU-HEP-15-08","hep-ph hep-ex","http://arxiv.org/licenses/nonexclusive-distrib/1.0/","  We interpret the potential observation of the 750 GeV di-photon resonance at
the LHC in models, in which an $SU(2)$ isospin-singlet scalar boson mixes with
the Standard Model (SM) Higgs boson through an angle $\alpha$. Allowing the
singlet scalar boson to have renormalizable couplings to vector-like leptons
and quarks and introducing sizable decay width of the 750 GeV di-photon
resonance into non-SM particles such as dark matters, we can explain the large
production cross section $\sigma(H_2) \times B(H_2 \to \gamma\gamma)$ as well
as the apparent large total width of the boson without conflicts from the
results obtained by previous global fits to the SM Higgs boson data.
","[{""version"":""v1"",""created"":""Thu, 24 Dec 2015 16:31:59 GMT""},{""version"":""v2"",""created"":""Tue, 16 Aug 2016 04:57:47 GMT""}]","2016-08-31"
"1512.07854","Viqar Husain","Masooma Ali, Viqar Husain, Shohreh Rahmati, Jonathan Ziprick","Linearized gravity with matter time","10 pages (references added)",,"10.1088/0264-9381/33/10/105012",,"gr-qc hep-th","http://arxiv.org/licenses/nonexclusive-distrib/1.0/","  We study general relativity with pressureless dust in the canonical
formulation, with the dust field chosen as a matter-time gauge. The resulting
theory has three physical degrees of freedom in the metric field. The
linearized canonical theory reveals two graviton modes and a scalar mode. We
find that the graviton modes remain Lorentz covariant despite the time gauge,
and that the scalar mode is ultralocal. We discuss also a modification of the
theory to include a parameter in the Hamiltonian analogous to that in
Horava-Lifshitz models. In this case the scalar mode is no longer ultralocal,
and acquires a propagation speed dependent on the deformation parameter.
","[{""version"":""v1"",""created"":""Thu, 24 Dec 2015 16:34:41 GMT""},{""version"":""v2"",""created"":""Tue, 5 Jan 2016 18:59:57 GMT""}]","2016-04-27"
"1512.07855","Hideaki Shimazaki","Hideaki Shimazaki","Neurons as an Information-theoretic Engine","16 pages, 4 figures; corrected four typos in the original submission","An extended edition is published as a book chapter. Shimazaki H.
  (2018) Neural Engine Hypothesis. In Chen Z. and Sarma S.V. (Eds.), Dynamic
  Neuroscience. Springer","10.1007/978-3-319-71976-4",,"q-bio.NC physics.bio-ph physics.data-an","http://arxiv.org/licenses/nonexclusive-distrib/1.0/","  We show that dynamical gain modulation of neurons' stimulus response is
described as an information-theoretic cycle that generates entropy associated
with the stimulus-related activity from entropy produced by the modulation. To
articulate this theory, we describe stimulus-evoked activity of a neural
population based on the maximum entropy principle with constraints on two types
of overlapping activities, one that is controlled by stimulus conditions and
the other, termed internal activity, that is regulated internally in an
organism. We demonstrate that modulation of the internal activity realises gain
control of stimulus response, and controls stimulus information. A cycle of
neural dynamics is then introduced to model information processing by the
neurons during which the stimulus information is dynamically enhanced by the
internal gain-modulation mechanism. Based on the conservation law for entropy
production, we demonstrate that the cycle generates entropy ascribed to the
stimulus-related activity using entropy supplied by the internal mechanism,
analogously to a heat engine that produces work from heat. We provide an
efficient cycle that achieves the highest entropic efficiency to retain the
stimulus information. The theory allows us to quantify efficiency of the
internal computation and its theoretical limit.
","[{""version"":""v1"",""created"":""Thu, 24 Dec 2015 16:40:01 GMT""},{""version"":""v2"",""created"":""Wed, 27 Dec 2017 12:47:30 GMT""}]","2017-12-29"
"1512.07856","Avik Sengupta","Avik Sengupta, Ravi Tandon, Osvaldo Simeone","Cache Aided Wireless Networks: Tradeoffs between Storage and Latency","9 pages, 4 figures",,,,"cs.IT math.IT","http://arxiv.org/licenses/nonexclusive-distrib/1.0/","  We investigate the fundamental information theoretic limits of cache-aided
wireless networks, in which edge nodes (or transmitters) are endowed with
caches that can store popular content, such as multimedia files. This
architecture aims to localize popular multimedia content by proactively pushing
it closer to the edge of the wireless network, thereby alleviating backhaul
load. An information theoretic model of such networks is presented, that
includes the introduction of a new metric, namely normalized delivery time
(NDT), which captures the worst case time to deliver any requested content to
the users. We present new results on the trade-off between latency, measured
via the NDT, and the cache storage capacity of the edge nodes. In particular, a
novel information theoretic lower bound on NDT is presented for cache aided
networks. The optimality of this bound is shown for several system parameters.
","[{""version"":""v1"",""created"":""Thu, 24 Dec 2015 16:40:15 GMT""}]","2015-12-25"
"1512.07857","Daniel Stolarski","Daniel Stolarski","Theory Motivation For Exotic Signatures: Prospects and Wishlist for Run
  II","5 pages, 3 figures, proceedings prepared for LHCP 2015",,,"CERN-PH-TH-2015-300","hep-ph hep-ex","http://arxiv.org/licenses/nonexclusive-distrib/1.0/","  Here I give some motivations for exotic signatures to search for at Run II of
the LHC, focusing on displaced phenomena. I will discuss signatures arising
from various different kinds of models including theories of dark matter and
those with exotic decays of the Higgs.
","[{""version"":""v1"",""created"":""Thu, 24 Dec 2015 16:44:41 GMT""}]","2015-12-25"
"1512.07858","Kazuto Noda","Kazuto Noda, Kensuke Inaba, and Makoto Yamashita","BCS superconducting transitions in lattice fermions","17 pages (main text:12 pages; appendix:3.5 pages), 5 figures",,,,"cond-mat.supr-con cond-mat.quant-gas","http://arxiv.org/licenses/nonexclusive-distrib/1.0/","  We develop a general description of the superconductivity of lattice fermions
based on the BCS theory. We propose a modeling of the density of states (DOS)
of lattice fermions, where divergent and semi-metallic structures are described
by asymptotic expansions around the Fermi energy. This modeling leads to a
unified representation of the transition temperature $T_c$ at half filling,
which reproduces asymptotic forms of $T_c$ derived in several lattices, such as
the square, honeycomb, and Lieb lattices, for the weakly interacting limit. The
derived asymptotic forms of $T_c$ are categorized into four types, which is
attributed to the different responses of the degenerate fermions depending on
the DOS structures. The DOS with a delta-functional singularity induces the
highest $T_c$ in the weakly interacting region, where $T_c$ is linearly
proportional to the pairing interaction $U$. Three kinds of universal ratios
defined in the BCS theory no longer reduce to constants independent of the
system parameters but can be parameterized with a certain variable that
characterizes the singular structures of the DOS. We find universal
relationship among thermodynamic quantities that holds for all parameter
regions. Further, we numerically demonstrate that in multi-band systems the
correlation effects can induce an effective delta-functional singularity. This
phenomenon generally appears in multi-energy (or multi-gap) systems and may
provide a plausible guideline for material designs of high-$T_c$
superconductor.
","[{""version"":""v1"",""created"":""Thu, 24 Dec 2015 16:44:58 GMT""}]","2015-12-25"
"1512.07859","Daniel Stolarski","Yi Chen, Daniel Stolarski, Roberto Vega-Morales","Golden Probe of the Top Yukawa","5 pages, 5 figures, proceedings prepared for LHCP 2015",,,"CAFPE 188/15, CERN-PH-TH-2015-301, UG-FT 318/15","hep-ph hep-ex","http://arxiv.org/licenses/nonexclusive-distrib/1.0/","  We describe how the Higgs decay to four leptons can be used to probe the
nature and $CP$ structure of the top Yukawa coupling.
","[{""version"":""v1"",""created"":""Thu, 24 Dec 2015 16:51:34 GMT""}]","2015-12-25"
"1512.07860","Lorenzo Campos Venuti","Lorenzo Campos Venuti and Paolo Zanardi","Dynamical Response Theory for Driven-Dissipative Quantum Systems","9 pages, 3 figures, comments welcome","Phys. Rev. A 93, 032101 (2016)","10.1103/PhysRevA.93.032101",,"quant-ph","http://arxiv.org/licenses/nonexclusive-distrib/1.0/","  We discuss dynamical response theory of driven-dissipative quantum systems
described by Markovian Master Equations generating semi-groups of maps. In this
setting thermal equilibrium states are replaced by non-equilibrium steady
states and dissipative perturbations are considered besides the Hamiltonian
ones. We derive explicit expressions for the linear dynamical response
functions for generalized dephasing channels and for Davies thermalizing
generators. We introduce the notion of maximal harmonic response and compute it
exactly for a single qubit channel. Finally, we analyze linear response near
dynamical phase transitions in quasi-free open quantum systems. It is found
that the effect of the dynamical phase transition shows up in a peak at the
edge of the spectrum in the imaginary part of the dynamical response function.
","[{""version"":""v1"",""created"":""Thu, 24 Dec 2015 16:54:34 GMT""}]","2016-03-09"
"1512.07861","Fredrick Olness","B.I. Ermolaev, F. Olness, S.I. Troyan","Resonance model for non-perturbative inputs to gluon distributions in
  the hadrons","18 pages, 4 figures, latex",,,,"hep-ph","http://arxiv.org/licenses/nonexclusive-distrib/1.0/","  We construct non-perturbative inputs for the elastic gluon-hadron scattering
amplitudes in the forward kinematic region for both polarized and non-polarized
hadrons. We use the optical theorem to relate invariant scattering amplitudes
to the gluon distributions in the hadrons. By analyzing the structure of the UV
and IR divergences, we can determine theoretical conditions on the
non-perturbative inputs, and use these to construct the results in a
generalized Basic Factorization framework using a simple Resonance Model. These
results can then be related to the K_T and Collinear Factorization expressions,
and the corresponding constrains can be extracted.
","[{""version"":""v1"",""created"":""Thu, 24 Dec 2015 16:55:59 GMT""}]","2015-12-25"
"1512.07862","Rebecca R.G.","Rebecca R.G","Closure operations that induce big Cohen-Macaulay algebras","20 pages, comments welcome. Sequel to arXiv:1512.06843. Updated
  5/22/17 based on referee report; some results clarified and exposition
  improved",,,,"math.AC","http://arxiv.org/licenses/nonexclusive-distrib/1.0/","  We study closure operations over a local domain R that satisfy a set of
axioms introduced by Geoffrey Dietz. The existence of a closure operation
satisfying the axioms (called a Dietz closure) is equivalent to the existence
of a big Cohen-Macaulay module for R. We give an additional axiom (the Algebra
Axiom), such that the existence of a Dietz closure satisfying this axiom is
equivalent to the existence of a big Cohen-Macaulay algebra. We prove that many
closure operations satisfy the Algebra Axiom, whether or not they are Dietz
closures. We discuss the smallest big Cohen-Macaulay algebra closure on a given
ring, and show that every Dietz closure satisfying the Algebra Axiom is
contained in a big Cohen-Macaulay algebra closure. This leads to proofs that in
rings of characteristic p > 0, every Dietz closure satisfying the Algebra Axiom
is contained in tight closure, and there exist Dietz closures that do not
satisfy the Algebra Axiom. Several of these results rely on work from
arXiv:1512.06843.
","[{""version"":""v1"",""created"":""Thu, 24 Dec 2015 17:09:41 GMT""},{""version"":""v2"",""created"":""Mon, 22 May 2017 17:10:28 GMT""}]","2017-05-23"
"1512.07863","Arie Blom","Arie Blom, Hessel Posthuma","An index theorem for Lie algebroids","41 pages",,,,"math.QA","http://arxiv.org/licenses/nonexclusive-distrib/1.0/","  We study Lie algebroids from the point of view noncommutative geometry. More
specifically, using ideas from deformation quantization, we use the PBW-theorem
for Lie algebroids to construct a Fedosov-type resolution for the associated
sheaves of Weyl algebras. This resolution enables us to construct a ""character
map"" --in the derived category-- from the sheafified cyclic chain complexes to
the Chevalley--Eilenberg complex of the Lie algebroid. The index theorem
computes the evaluation of this map on the trivial cycle in terms of the
Todd--Chern characteristic class. Finally, we show compatibility of the
character map with the Hochschild--Kostant--Rosenberg morphism.
","[{""version"":""v1"",""created"":""Thu, 24 Dec 2015 17:11:59 GMT""}]","2015-12-25"
