"1512.07976","Andrei Khrennikov Yu","Andrei Khrennikov","Reflections on Zeilinger-Brukner information interpretation of quantum
  mechanics","completion on information reconstructions of QM","Found. Phys. 46, 836-844 (2016)","10.1007/s10701-016-0005-z",,"quant-ph physics.hist-ph physics.pop-ph","http://arxiv.org/licenses/nonexclusive-distrib/1.0/","  In this short review I present my personal reflections on Zeilinger-Brukner
information interpretation of quantum mechanics (QM). In general, this
interpretation is very attractive for me. However, its rigid coupling to the
notion of irreducible quantum randomness is a very complicated issue which I
plan to address in more detail. This note may be useful for general public
interested in quantum foundations, especially because I try to analyze
essentials of the information interpretation critically (i.e., not just
emphasizing its advantages as it is commonly done). This review is written in
non-physicist friendly manner. Experts actively exploring this interpretation
may be interested in the paper as well, as in the comments of ""an external
observer"" who have been monitoring the development of this approach to QM
during the last 18 years. The last part of this review is devoted to the
general methodology of science with references to views of de Finetti, Wigner,
and Peres.
","[{""version"":""v1"",""created"":""Fri, 25 Dec 2015 08:11:32 GMT""},{""version"":""v2"",""created"":""Tue, 29 Dec 2015 18:10:37 GMT""},{""version"":""v3"",""created"":""Wed, 16 Mar 2016 09:42:37 GMT""}]","2017-04-18"
"1512.07977","Shanming Ruan","Shan-Ming Ruan","Generalized Vaidya spacetime for cubic gravity","14 pages,no figure","Phys. Rev. D 93, 064061 (2016)","10.1103/PhysRevD.93.064061",,"gr-qc","http://arxiv.org/licenses/nonexclusive-distrib/1.0/","  We present a kind of generalized Vaidya solutions of a new cubic gravity in
five dimensions whose field equations in spherically spacetime are always
second order like the Lovelock gravity. We also study the thermodynamics of its
apparent horizon and get its entropy expression and generalized Misner-Sharp
energy. Finally we present the first law and second law hold in this gravity.
Although all the results are analogue to those in Lovelock gravity, we in fact
introduce the contribution of new cubic term in five dimensions where cubic
Lovelock term is just zero.
","[{""version"":""v1"",""created"":""Fri, 25 Dec 2015 08:18:13 GMT""}]","2016-03-30"
"1512.07978","Teresa Montaruli","Teresa Montaruli (for the IceCube Collaboration)","Neutrino Physics and Astrophysics with IceCube","Proc. of CRIS2015, Gallipoli, Italy, 8 pages, 17 figures, to appear
  in Elsevier in Nuclear and Particle Physics Proceedings (2016)",,,,"astro-ph.HE","http://arxiv.org/licenses/nonexclusive-distrib/1.0/","  In this contribution we summarize the selected highlights of IceCube in the
domain of high-energy astrophysics and particle physics. We discuss the
highest-energy neutrino detection and its interpretation after 4 years of data.
The significance is such that the discovery of a non terrestrial component can
be claimed but its origin is not yet clarified. The high energy non-atmospheric
component is seen also in other analyses with smaller significance, for
instance when using muon neutrino induced events coming from the Northern
hemisphere. Flavor mixing is probed along cosmic distances in an analysis using
also cascade neutrino events. The results on the search for neutrino sources is
presented including the results of a joint analysis with Pierre Auger and
Telescope Array which is sensitive to correlations between highest energy
neutrinos and UHECRs measured by the three experiments. Moreover, recent
results on dark matter searches from the Sun are discussed. Finally, the
results on standard neutrino oscillations are presented.
","[{""version"":""v1"",""created"":""Fri, 25 Dec 2015 08:37:19 GMT""}]","2019-08-14"
"1512.07979","Weiwen Zou","Xin Long, Weiwen Zou, and Jianping Chen","All-optical pulse compression of broadband microwave signal based on
  stimulated Brillouin scattering","9 pages,5 figures",,"10.1364/OE.24.005162",,"physics.optics","http://arxiv.org/licenses/nonexclusive-distrib/1.0/","  Pulse compression processing based on stimulated Brillouin scattering (SBS)
in an optical fiber is theoretically and experimentally demonstrated. Broadband
microwave signal is electro-optically modulated onto the pump lightwave that is
launched into one end of the fiber. Acoustic wave in the fiber inherits the
amplitude and phase information of the pump lightwave and thus the coupling
between the acoustic wave and pump lightwave leads to the auto-correlated
process of the pump lightwave as well as the modulated microwave signal.
Derivation of the SBS coupling equations shows that the short-pulse probe
lightwave amplified by the pump lightwave possesses the nature of
auto-correlation formula. All-optical pulse compression of the broadband
microwave signal is implemented after a subtraction between the detected probe
pulse with and without SBS. A proof-of-concept experiment is carried out. The
pulse compression of a linear frequency-modulated microwave signal with 1 GHz
sweep range at the carrier frequency of 4.3 GHz is successfully realized, which
well matches the theoretical analysis.
","[{""version"":""v1"",""created"":""Fri, 25 Dec 2015 08:52:54 GMT""}]","2016-04-20"
"1512.07980","Hojjat Salehinejad","Hojjat Salehinejad, Shahryar Rahnamayan, Hamid R. Tizhoosh","Diversity Enhancement for Micro-Differential Evolution","Developed version is submitted for review to Applied soft computing",,,,"cs.NE","http://arxiv.org/licenses/nonexclusive-distrib/1.0/","  The differential evolution (DE) algorithm suffers from high computational
time due to slow nature of evaluation. In contrast, micro-DE (MDE) algorithms
employ a very small population size, which can converge faster to a reasonable
solution. However, these algorithms are vulnerable to a premature convergence
as well as to high risk of stagnation. In this paper, MDE algorithm with
vectorized random mutation factor (MDEVM) is proposed, which utilizes the small
size population benefit while empowers the exploration ability of mutation
factor through randomizing it in the decision variable level. The idea is
supported by analyzing mutation factor using Monte-Carlo based simulations. To
facilitate the usage of MDE algorithms with very-small population sizes, new
mutation schemes for population sizes less than four are also proposed.
Furthermore, comprehensive comparative simulations and analysis on performance
of the MDE algorithms over various mutation schemes, population sizes, problem
types (i.e. uni-modal, multi-modal, and composite), problem dimensionalities,
and mutation factor ranges are conducted by considering population diversity
analysis for stagnation and trapping in local optimum situations. The studies
are conducted on 28 benchmark functions provided for the IEEE CEC-2013
competition. Experimental results demonstrate high performance and convergence
speed of the proposed MDEVM algorithm.
","[{""version"":""v1"",""created"":""Fri, 25 Dec 2015 09:12:52 GMT""},{""version"":""v2"",""created"":""Mon, 26 Sep 2016 15:57:41 GMT""}]","2016-09-27"
"1512.07981","Ning Zhou","Ning Zhou, Kechen Wang and Kuhan Wang","Limits on Excited Quarks from the ATLAS Multi-jet Search","4 pages, 6 figures",,,,"hep-ph","http://arxiv.org/licenses/nonexclusive-distrib/1.0/","  We interpret the recent ATLAS multi-jet search results using 20.3 fb-1 data
at sqrt(s)=8 TeV in the context of searching for excited quarks. Within the
effective field theory framework, using the null results of that search, our
analysis shows that the excited quark mass below 5 TeV can be excluded at the
95% confidence level. Our analysis also indicates that when the validation of
effective field theory is considered, the limit can be largely compromised.
","[{""version"":""v1"",""created"":""Fri, 25 Dec 2015 09:34:29 GMT""}]","2015-12-29"
"1512.07982","Miltiadis Allamanis","Fani A. Tzima, Miltiadis Allamanis, Alexandros Filotheou, Pericles A.
  Mitkas","Inducing Generalized Multi-Label Rules with Learning Classifier Systems",,,,,"cs.NE cs.LG","http://arxiv.org/licenses/nonexclusive-distrib/1.0/","  In recent years, multi-label classification has attracted a significant body
of research, motivated by real-life applications, such as text classification
and medical diagnoses. Although sparsely studied in this context, Learning
Classifier Systems are naturally well-suited to multi-label classification
problems, whose search space typically involves multiple highly specific
niches. This is the motivation behind our current work that introduces a
generalized multi-label rule format -- allowing for flexible label-dependency
modeling, with no need for explicit knowledge of which correlations to search
for -- and uses it as a guide for further adapting the general Michigan-style
supervised Learning Classifier System framework. The integration of the
aforementioned rule format and framework adaptations results in a novel
algorithm for multi-label classification whose behavior is studied through a
set of properly defined artificial problems. The proposed algorithm is also
thoroughly evaluated on a set of multi-label datasets and found competitive to
other state-of-the-art multi-label classification methods.
","[{""version"":""v1"",""created"":""Fri, 25 Dec 2015 10:03:55 GMT""}]","2015-12-29"
"1512.07983","Mikhail Tyaglov","Olga Kushel and Mikhail Tyaglov","Circulants and critical points of polynomials","14 pages","Journal of Math. Ann. Appl., 439 (2016), no. 2, pp. 434 - 450","10.1016/j.jmaa.2016.03.005",,"math.CA math.SP","http://arxiv.org/licenses/nonexclusive-distrib/1.0/","  We prove that for any circulant matrix $C$ of size $n\times n$ with the monic
characteristic polynomial $p(z)$, the spectrum of its $(n-1)\times(n-1)$
submatrix $C_{n-1}$ constructed with first $n-1$ rows and columns of $C$
consists of all critical points of $p(z)$. Using this fact we provide a simple
proof for the Schoenberg conjecture recently proved by R. Pereira and S.
Malamud. We also prove full generalization of a higher order Schoenberg-type
conjecture proposed by M. de Bruin and A. Sharma and recently proved by W.S.
Cheung and T.W. Ng. in its original form, i.e. for polynomials whose mass
centre of roots equals zero. In this particular case, our inequality is
stronger than it was conjectured by de Bruin and Sharma. Some Schmeisser's-like
results on majorization of critical point of polynomials are also obtained.
","[{""version"":""v1"",""created"":""Fri, 25 Dec 2015 10:23:25 GMT""}]","2017-01-05"
"1512.07984","Ivan Kokurin","I.A. Kokurin","Determination of Rashba-coupling strength for surface two-dimensional
  electron gas in InAs nanowires","7 pages, 3 figures","Solid State. Commun. 195, 49 (2014)","10.1016/j.ssc.2014.07.002",,"cond-mat.mes-hall","http://arxiv.org/licenses/nonexclusive-distrib/1.0/","  A key concept in the field of semiconductor spintronics is an electric field
control of spins via the spin-orbit coupling (SOC) and the SOC strength governs
efficiency of this control. We propose a new approach that allows the
experimental determination of the Rashba SOC strength for ballistic InAs
nanowires. The energy spectrum and ballistic transport of carriers through the
nanowire with surface two-dimensional electron gas (2DEG) in a homogeneous
magnetic field are studied. A general formula for the linear-response
one-dimensional ballistic thermopower is derived in the case of complex subband
structure. The ballistic conductance and the thermopower are shown to reveal
specific features due to strong SOC that allows us to propose a method for the
SOC strength determination.
","[{""version"":""v1"",""created"":""Fri, 25 Dec 2015 10:28:07 GMT""}]","2016-01-06"
"1512.07985","Artur Lopes O.","Artur O. Lopes and Joana Mohr","Semiclassical limits, Lagrangian states and coboundary equations",,,,,"math.DS math-ph math.MP quant-ph","http://arxiv.org/licenses/nonexclusive-distrib/1.0/","  Assume that $f$ is a continuous transformation $f:S^1 \to S^1$. We consider
here the cases where $f$ is either the transformation $f(z)=z^2$ or $f$ is a
smooth diffeomorphism of the circle $S^1$. Consider a fixed continuous
potential $\tau:S^1=[0,1) \to \mathbb{R}$, $\nu\in \mathbb{R}$ and $\varphi:S^1
\to \mathbb{C}$ (a quantum state). The transformation $\hat F_{\nu}$ acting on
$\varphi:S^1 \to \mathbb{C}$, $\hat F_{\nu}(\varphi) = \phi$, defined by
$\displaystyle \phi(z) = \hat F_{\nu} (\varphi(z)) =
\varphi(f(z))e^{i\nu\tau(z)}$ describes a discrete time dynamical evolution of
the quantum state $\varphi$. Given $S: \mathbb{R}\to \mathbb{R}$ we define the
Lagrangian state $$\varphi_{x}^S(z) = \sum_{k\in\mathbb{Z}} e^{\frac{iS
(z-k)}{\hbar}} e^{-\frac{(z-k-x)^2}{4\hbar}}.$$ In this case $\hat
F_{\nu}(\varphi_{x}^S(z)) = \sum_{k\in\mathbb{Z}}e^{\frac{iS
(f(z)-k)}{\hbar}}e^{-\frac{(f(z)-k-x)^2}{4\hbar}}e^{i\nu\tau(z)}$. Under
suitable conditions on $S$ the micro-support of $\varphi^S_x (z)$, when $\hbar
\to 0$, is $(x,S'(x))$. One of meanings of the semiclassical limit in Quantum
Mechanics is to take $\nu=\frac{1}{\hbar}$ and $\hbar \to 0$. We address the
question of finding $S$ such that $\varphi^S_x$ satisfies the property: $
\forall x$, we have that $\hat{F}_\nu(\varphi^S_x)$ has micro-support on the
graph of $y\to S'(y)$ (which is the micro-support of $\varphi^S_x$). In other
words: which $S$ is such that $\hat{F}_\nu$ leaves the micro-support of
$\varphi^S_x$ invariant? This is related to a coboundary equation for $\tau$,
twist conditions and the boundary of the fat attractor.
","[{""version"":""v1"",""created"":""Fri, 25 Dec 2015 11:06:23 GMT""},{""version"":""v2"",""created"":""Tue, 12 Jan 2016 12:49:17 GMT""},{""version"":""v3"",""created"":""Mon, 25 Jan 2016 13:07:20 GMT""},{""version"":""v4"",""created"":""Fri, 28 Oct 2016 14:49:29 GMT""}]","2016-10-31"
"1512.07986","Anton Ramsak","A. Kregar and A. Ramsak","Exact unitary transformation for Rashba rings in magnetic and electric
  fields","International conference ECN-2015, Odessa, 3-6 September 2015; v2:
  added references","Int. J. Mod. Phys. B 30, 1642016 (2016)","10.1142/S0217979216420169",,"cond-mat.mes-hall","http://arxiv.org/licenses/nonexclusive-distrib/1.0/","  An exact solution for single electron states on mezoscopic rings with the
Rashba coupling and in the presence of external magnetic and electric fields is
derived by means of a unitary transformation. The transformation maps the model
to a bare ring, which gives the possibility of a very simple formulation of
single or many electron problems. As an example some exact results for spin and
energy levels are presented.
","[{""version"":""v1"",""created"":""Fri, 25 Dec 2015 11:07:05 GMT""},{""version"":""v2"",""created"":""Tue, 5 Jan 2016 14:02:56 GMT""}]","2016-04-08"
"1512.07987","Alexander Titov I.","Alexander I. Titov, Burkhard Kampfer, Atsushi Hosaka, and Hideaki
  Takabe","Quantum processes in short and intensive electromagnetic fields","61 pages, 33 figures. arXiv admin note: text overlap with
  arXiv:1303.6487, arXiv:1408.1040",,"10.1134/S1063779616030059",,"hep-ph","http://arxiv.org/licenses/nonexclusive-distrib/1.0/","  This work provides an overview of our recent results in studying two most
important and widely discussed quantum processes: electron-positron pairs
production off a probe photon propagating through a polarized short-pulsed
electromagnetic (e.g.\ laser) wave field or generalized Breit-Wheeler process,
and a single a photon emission off an electron interacting with the laser
pules, so-called non-linear Compton scattering. We show that the probabilities
of particle production in both processes are determined by interplay of two
dynamical effects, where the first one is related to the shape and duration of
the pulse and the second one is non-linear dynamics of the interaction of
charged fermions with a strong electromagnetic field. We elaborate suitable
expressions for the production probabilities and cross sections, convenient for
studying evolution of the plasma in presence of strong electromagnetic fields
","[{""version"":""v1"",""created"":""Fri, 25 Dec 2015 11:19:12 GMT""}]","2016-06-22"
"1512.07988","Maurice Margenstern","Maurice Margenstern","A weakly universal cellular automaton on the pentagrid with two states","38 pages 24 figures. arXiv admin note: text overlap with
  arXiv:1510.09129",,,,"cs.DM nlin.CG","http://arxiv.org/licenses/nonexclusive-distrib/1.0/","  In this paper, we prove that there is a weakly universal cellular automaton
on the pentagrid with two states. This paper improves in some sense a previous
result with three states. Both results make use of \textit{\`a la Moore}
neighbourhood. However, the result with three states is rotation invariant
while that with two states is not. In both cases, at each step of the
computation, the set of non quiescent states has always infinitely many cycles.
","[{""version"":""v1"",""created"":""Fri, 25 Dec 2015 11:50:14 GMT""},{""version"":""v2"",""created"":""Sat, 13 Feb 2016 17:30:22 GMT""}]","2016-02-16"
"1512.07989","Alexander V. Evako","Alexander V. Evako","Classification of graphs based on homotopy equivalence. Homotopy
  equivalent graphs. Basic graphs and complexity of homotopy equivalence
  classes of graphs","In press. Asian Journal of Mathematics and Computer Research.
  http://www.ikpress.org/articles-press/44",,,,"cs.DM math.CO","http://arxiv.org/licenses/nonexclusive-distrib/1.0/","  Graph classification plays an important role is data mining, and various
methods have been developed recently for classifying graphs. In this paper, we
propose a novel method for graph classification that is based on homotopy
equivalence of graphs. Graphs are called homotopy equivalent if one of them can
be converted to the other one by contractible transformations. A basic graph
and the complexity of a homotopy equivalence class are defined and
investigated. It is shown all graphs belonging to a given homotopy equivalence
class have similar topological properties and are represented by a basic graph
with the minimal number of points and edges. Diagrams are given of basic graphs
with the complexity N<7. The advantage of this classification is that it relies
on computer experiments demonstrating a close connection between homotopy
equivalent topological spaces and homotopy equivalent graphs.
","[{""version"":""v1"",""created"":""Fri, 25 Dec 2015 11:54:43 GMT""},{""version"":""v2"",""created"":""Sun, 16 Jul 2017 15:22:23 GMT""}]","2017-07-18"
"1512.07990","Nitin Jain","Nitin Jain, Birgit Stiller, Imran Khan, Dominique Elser, Christoph
  Marquardt, Gerd Leuchs","Attacks on practical quantum key distribution systems (and how to
  prevent them)","Minor changes incl. improvements to figures and updated references","Contemporary Physics 57, 3 (2016)","10.1080/00107514.2016.1148333",,"quant-ph","http://arxiv.org/licenses/nonexclusive-distrib/1.0/","  With the emergence of an information society, the idea of protecting
sensitive data is steadily gaining importance. Conventional encryption methods
may not be sufficient to guarantee data protection in the future. Quantum key
distribution (QKD) is an emerging technology that exploits fundamental physical
properties to guarantee perfect security in theory. However, it is not easy to
ensure in practice that the implementations of QKD systems are exactly in line
with the theoretical specifications. Such theory-practice deviations can open
loopholes and compromise the security. Several of such loopholes have been
discovered and investigated in the last decade. These activities have motivated
the proposal and implementation of appropriate countermeasures, thereby
preventing future attacks and enhancing the practical security of QKD. This
article introduces the so-called field of quantum hacking by summarizing a
variety of attacks and their prevention mechanisms.
","[{""version"":""v1"",""created"":""Fri, 25 Dec 2015 12:20:14 GMT""},{""version"":""v2"",""created"":""Sat, 17 Sep 2016 20:36:44 GMT""}]","2016-09-20"
"1512.07991","Seref Kalem","Seref Kalem, Peter Werner, Vadim Talalaev, Michael Becker, \""Orjan
  Arthursson and Nikolai Zakharov","Photoluminescence from Silicon nanoparticles embedded in ammonium
  silicon hexafluoride",,"Nanotechnology, 21, 435701-8 (2010)","10.1088/0957-4484/21/43/435701",,"cond-mat.mes-hall","http://arxiv.org/licenses/nonexclusive-distrib/1.0/","  Silicon (Si) nanoparticles (NPs) were synthesized by transforming Si wafer
surface to ammonium silicon hexafluoride (ASH) or (NH4)2SiF6 under acid vapor
treatment. Si-NPs are embedded within the polycrystalline (ASH) layer formed on
the Si surface exhibit a strong green-orange photoluminescence (PL). Difference
measurements revealed a major double component spectra consisting of a broad
band associated with the ASH-Si wafer interfacial porous oxide layer and a high
energy band attributable to Si-NPs embedded in the ASH. The origin of the
latter emission can be explained in terms of quantum/spatial confinement
effects probably mediated by oxygen related defects in or around Si-NPs.
Although Si-NPs are derived from the interface they are much smaller in size
than those embedded within the interfacial porous oxide layer (SiOx, 1 < x <
2). Transmission electron microscopy (TEM) combined with Raman scattering and
Fourier transformed infrared (FTIR) analysis confirmed the presence of Si-NPs
and Si-O bondings pointing to the role of oxygen related defects. The presence
of oxygen of up to 4.5 at.% in the (NH4)2SiF6 layer was confirmed by energy
dispersive spectroscopy (EDS) analysis.
","[{""version"":""v1"",""created"":""Fri, 25 Dec 2015 12:35:16 GMT""}]","2015-12-29"
"1512.07992","Sibo Zheng","Huayong Han, Shaoming Wang and Sibo Zheng","Dark Matter Theories in the Light of Diphoton Excess","7 pages, 4 figures; v2: typos corrected",,,,"hep-ph hep-ex","http://arxiv.org/licenses/nonexclusive-distrib/1.0/","  A new type of dark matter (DM) theories are proposed in the light of the
standard model (SM) singlet scalar $\phi$ which is responsible for the diphoton
excess at the LHC Run 2. In the so-called $\phi$-portal DM models, after taking
into account the LHC constraints and DM direct detection limits, we show that
in the perturbative framework DM as either a SM singlet scalar or Dirac fermion
can be allowed in a wide mass range between 400 GeV and 3 TeV. The DM can be
directly detected in SM multi-jets and missing energy.
","[{""version"":""v1"",""created"":""Fri, 25 Dec 2015 12:50:32 GMT""},{""version"":""v2"",""created"":""Fri, 12 Feb 2016 06:13:36 GMT""}]","2016-02-15"
"1512.07993","Natalia Kovaleva","N. N. Kovaleva, A. V. Bagdinov, A. Stupakov, A. Dejneka, E. I.
  Demikhov, A. A. Gorbatsevich, F. A. Pudonin, K. I. Kugel, and F. V.
  Kusmartsev","Collective magnetic response of inhomogeneous nanoisland FeNi films
  around the percolation transition","11 pages, 7 figures. Section Discussion in more detail, experimental
  results unchanged. Accepted for publication, Journal of Nanoparticles
  Research",,,,"cond-mat.str-el cond-mat.mes-hall cond-mat.mtrl-sci","http://arxiv.org/licenses/nonexclusive-distrib/1.0/","  By using superconducting quantum interference device (SQUID) magnetometry we
investigated anisotropic high-field (H < 7 T) low-temperature (10 K)
magnetization response of inhomogeneous nanoisland FeNi films grown by rf
sputtering deposition on Sitall (TiO2) glass substrates. In the grown FeNi
films, the FeNi layer nominal thickness varied from 0.6 to 2.5 nm, across the
percolation transition at the d_c=1.8 nm. We discovered that, beyond
conventional spin-magnetism of Fe21Ni79 permalloy, the extracted out-of-plane
magnetization response of the nanoisland FeNi films is not saturated in the
range of investigated magnetic fields and exhibits paramagnetic-like behavior.
We found that the anomalous out-of-plane magnetization response exhibits an
escalating slope with increase in the nominal film thickness from 0.6 to 1.1
nm, however, it decreases with further increase in the film thickness, and then
practically vanishes on approaching the FeNi film percolation threshold. At the
same time, the in-plane response demonstrates saturation behavior above 1.5-2
T, competing with anomalously large diamagnetic-like response, which becomes
pronounced at high magnetic fields. It is possible that the supported-metal
interaction leads to the creation of a thin charge-transfer (CT) layer and a
Schottky barrier at the FeNi film/Sitall (TiO2) interface. Then, in the system
with nanoscale circular domains, the observed anomalous paramagnetic-like
magnetization response can be associated with a large orbital moment of the
localized electrons. The observed magnetization response is determined by the
interplay between the paramagnetic- and diamagnetic-like contributions.
","[{""version"":""v1"",""created"":""Fri, 25 Dec 2015 12:55:11 GMT""},{""version"":""v2"",""created"":""Mon, 24 Oct 2016 12:19:40 GMT""},{""version"":""v3"",""created"":""Mon, 9 Apr 2018 20:25:45 GMT""}]","2018-04-11"
