"1512.07925","Sivan Ginzburg","Sivan Ginzburg, Hilke E. Schlichting, Re'em Sari","Super-Earth Atmospheres: Self-Consistent Gas Accretion and Retention","Updated (refereed) version",,"10.3847/0004-637X/825/1/29",,"astro-ph.EP","http://arxiv.org/licenses/nonexclusive-distrib/1.0/","  Some recently discovered short-period Earth to Neptune sized exoplanets
(super Earths) have low observed mean densities which can only be explained by
voluminous gaseous atmospheres. Here, we study the conditions allowing the
accretion and retention of such atmospheres. We self-consistently couple the
nebular gas accretion onto rocky cores and the subsequent evolution of gas
envelopes following the dispersal of the protoplanetary disk. Specifically, we
address mass-loss due to both photo-evaporation and cooling of the planet. We
find that planets shed their outer layers (dozens of percents in mass)
following the disk's dispersal (even without photo-evaporation), and their
atmospheres shrink in a few Myr to a thickness comparable to the radius of the
underlying rocky core. At this stage, atmospheres containing less particles
than the core (equivalently, lighter than a few % of the planet's mass) can be
blown away by heat coming from the cooling core, while heavier atmospheres cool
and contract on a timescale of Gyr at most. By relating the mass-loss timescale
to the accretion time, we analytically identify a Goldilocks region in the
mass-temperature plane in which low-density super Earths can be found: planets
have to be massive and cold enough to accrete and retain their atmospheres,
while not too massive or cold, such that they do not enter runaway accretion
and become gas giants (Jupiters). We compare our results to the observed
super-Earth population and find that low-density planets are indeed
concentrated in the theoretically allowed region. Our analytical and intuitive
model can be used to investigate possible super-Earth formation scenarios.
","[{""version"":""v1"",""created"":""Thu, 24 Dec 2015 22:07:41 GMT""},{""version"":""v2"",""created"":""Sat, 16 Apr 2016 08:21:53 GMT""}]","2016-07-06"
"1512.07926","Igor G. Irastorza","I. G. Irastorza, F. Aznar, J. Castel, S. Cebri\'an, T. Dafni, J.
  Gal\'an, J. A. Garc\'ia, J. G. Garza, H. G\'omez, D. C. Herrera, F. J. Iguaz,
  G. Luz\'on, H. Mirallas, E. Ruiz, L. Segu\'i, A. Tom\'as","Gaseous time projection chambers for rare event detection: Results from
  the T-REX project. I. Double beta decay","prepared for submission to JCAP","JCAP 1601 (2016) 01, 033","10.1088/1475-7516/2016/01/033",,"physics.ins-det hep-ex","http://arxiv.org/licenses/nonexclusive-distrib/1.0/","  As part of the T-REX project, a number of R&D and prototyping activities have
been carried out during the last years to explore the applicability of gaseous
Micromegas-read TPCs in rare event searches like double beta decay (DBD), axion
research and low-mass WIMP searches. In both this and its companion paper, we
compile the main results of the project and give an outlook of application
prospects for this detection technique. While in the companion paper we focus
on axions and WIMPs, in this paper we focus on the results regarding the
measurement of the DBD of $^{136}$Xe in a high pressure Xe (HPXe) TPC.
Particularly relevant are the results obtained in Xe + TMA mixtures with
microbulk Micromegas, showing very promising results in terms of gain,
stability of operation, and energy resolution at pressures up to 10 bar. TMA at
levels of $\sim$1\% reduces electron diffusion by a factor of 10 with respect
to pure Xe, improving the quality of the topological pattern, with a positive
impact on the discrimination capability. Operation with a medium size prototype
(30 cm diameter and 38 cm drift) of 1 kg of Xe at 10 bar in the fiducial
volumen has allowed to test the detection concept in realistic experimental
conditions. Microbulk Micromegas are able to image the DBD ionization signature
with high quality while, at the same time, measuring its energy deposition with
a resolution of at least $\sim$3% FWHM @ Q$_{\beta\beta}$, and probably down to
$\sim$1% FWHM. In addition, first results on the topological signature
information show promising background discrimination capabilities out of reach
of other experimental implementations. Moreover, microbulk Micromegas have very
low levels of intrinsic radioactivity, and offer cost-effective scaling-up
options. All these results demonstrate that Micromegas-read HPXe TPC is a very
competitive technique for the next generation DBD experiments.
","[{""version"":""v1"",""created"":""Thu, 24 Dec 2015 22:29:07 GMT""}]","2016-02-19"
"1512.07927","Manuel Hohmann","Manuel Hohmann","Finsler fluid dynamics in $\mathrm{SO}(4)$ symmetric cosmology","6 pages, no figures; to appear in the conference proceedings of the
  14th Marcel Grossmann Meeting, World Scientific Publishing Company",,"10.1142/9789813226609_0090",,"gr-qc hep-th math-ph math.MP","http://arxiv.org/licenses/nonexclusive-distrib/1.0/","  We discuss the most general Finsler spacetime geometry obeying the
cosmological symmetry group $\mathrm{SO}(4)$. On this background geometry we
derive the equations of motion for the most general kinetic fluid obeying the
same cosmological symmetry. For this purpose we propose a set of coordinates on
the tangent bundle of the spacetime manifold which greatly simplifies the
cosmological symmetry generators.
","[{""version"":""v1"",""created"":""Thu, 24 Dec 2015 22:33:15 GMT""}]","2017-11-28"
"1512.07928","Seunghoon Hong","Seunghoon Hong, Junhyuk Oh, Bohyung Han and Honglak Lee","Learning Transferrable Knowledge for Semantic Segmentation with Deep
  Convolutional Neural Network",,,,,"cs.CV","http://arxiv.org/licenses/nonexclusive-distrib/1.0/","  We propose a novel weakly-supervised semantic segmentation algorithm based on
Deep Convolutional Neural Network (DCNN). Contrary to existing
weakly-supervised approaches, our algorithm exploits auxiliary segmentation
annotations available for different categories to guide segmentations on images
with only image-level class labels. To make the segmentation knowledge
transferrable across categories, we design a decoupled encoder-decoder
architecture with attention model. In this architecture, the model generates
spatial highlights of each category presented in an image using an attention
model, and subsequently generates foreground segmentation for each highlighted
region using decoder. Combining attention model, we show that the decoder
trained with segmentation annotations in different categories can boost the
performance of weakly-supervised semantic segmentation. The proposed algorithm
demonstrates substantially improved performance compared to the
state-of-the-art weakly-supervised techniques in challenging PASCAL VOC 2012
dataset when our model is trained with the annotations in 60 exclusive
categories in Microsoft COCO dataset.
","[{""version"":""v1"",""created"":""Thu, 24 Dec 2015 22:33:27 GMT""}]","2015-12-29"
"1512.07929","Justyna Piwowar","J. Piwowar, W. Pacuski, T. Smole\'nski, M. Goryca, A. Bogucki, A.
  Golnik, M. Nawrocki, P. Kossacki, J. Suffczy\'nski","Epitaxial growth and Photoluminescence Excitation spectroscopy of CdSe
  Quantum Dots in (Zn,Cd)Se barrier","6 pages, 5 figures",,"10.1016/j.jlumin.2015.12.046",,"cond-mat.mes-hall","http://arxiv.org/licenses/nonexclusive-distrib/1.0/","  Design, epitaxial growth, and resonant spectroscopy of CdSe Quantum Dots
(QDs) embedded in an innovative (Zn,Cd)Se barrier are presented. The (Zn,Cd)Se
barrier enables shifting of QDs energy emission down to 1.87 eV, that is below
the energy of Mn$^{2+}$ ions internal transition (2.1 eV). This opens a
perspective for implementation of epitaxial CdSe QDs doped with several Mn ions
as, e. g., the light sources in high quantum yield magnetooptical devices.
Polarization resolved Photoluminescence Excitation measurements of individual
QDs reveal sharp ($\Gamma <$ 150 $\mu$eV) maxima and transfer of optical
polarization to QD confining charged exciton state with efficiency attaining 26
%. The QD doping with single Mn$^{2+}$ ions is achieved.
","[{""version"":""v1"",""created"":""Thu, 24 Dec 2015 22:33:44 GMT""}]","2016-04-20"
"1512.07930","Wei Liu","Wei Liu, Leon Ofman, Brittany Broder, Marian Karlicky, and Cooper
  Downs","Quasi-periodic Fast-mode Magnetosonic Wave Trains Within Coronal
  Waveguides Associated with Flares and CMEs","4 pages, 3 figures, accepted to the Proceedings of the 14th
  International Solar Wind Conference held in Weihai, China, June 22-26, 2015",,"10.1063/1.4943821",,"astro-ph.SR","http://arxiv.org/licenses/nonexclusive-distrib/1.0/","  Quasi-periodic, fast-mode, propagating wave trains (QFPs) are a new
observational phenomenon recently discovered in the solar corona by the Solar
Dynamics Observatory with extreme ultraviolet (EUV) imaging observations. They
originate from flares and propagate at speeds up to ~2000 km/s within
funnel-shaped waveguides in the wakes of coronal mass ejections (CMEs). QFPs
can carry sufficient energy fluxes required for coronal heating during their
occurrences. They can provide new diagnostics for the solar corona and their
associated flares. We present recent observations of QFPs focusing on their
spatio-temporal properties, temperature dependence, and statistical correlation
with flares and CMEs. Of particular interest is the 2010-Aug-01 C3.2 flare with
correlated QFPs and drifting zebra and fiber radio bursts, which might be
different manifestations of the same fast-mode wave trains. We also discuss the
potential roles of QFPs in accelerating and/or modulating the solar wind.
","[{""version"":""v1"",""created"":""Thu, 24 Dec 2015 22:58:25 GMT""}]","2016-04-20"
"1512.07931","Hugh Chen","Hugh Chen, Yusuf Erol, Eric Shen, Stuart Russell","Probabilistic Model-Based Approach for Heart Beat Detection",,,"10.1088/0967-3334/37/9/1404",,"cs.AI","http://arxiv.org/licenses/nonexclusive-distrib/1.0/","  Nowadays, hospitals are ubiquitous and integral to modern society. Patients
flow in and out of a veritable whirlwind of paperwork, consultations, and
potential inpatient admissions, through an abstracted system that is not
without flaws. One of the biggest flaws in the medical system is perhaps an
unexpected one: the patient alarm system. One longitudinal study reported an
88.8% rate of false alarms, with other studies reporting numbers of similar
magnitudes. These false alarm rates lead to a number of deleterious effects
that manifest in a significantly lower standard of care across clinics.
  This paper discusses a model-based probabilistic inference approach to
identifying variables at a detection level. We design a generative model that
complies with an overview of human physiology and perform approximate Bayesian
inference. One primary goal of this paper is to justify a Bayesian modeling
approach to increasing robustness in a physiological domain.
  We use three data sets provided by Physionet, a research resource for complex
physiological signals, in the form of the Physionet 2014 Challenge set-p1 and
set-p2, as well as the MGH/MF Waveform Database. On the extended data set our
algorithm is on par with the other top six submissions to the Physionet 2014
challenge.
","[{""version"":""v1"",""created"":""Thu, 24 Dec 2015 23:24:24 GMT""}]","2016-09-21"
"1512.07932","Massimo Taronna","Rakibur Rahman and Massimo Taronna","From Higher Spins to Strings: A Primer","106 pages, 2 figures. Contribution to the collection of reviews
  ""Introduction to Higher Spin Theory"" edited by S. Fredenhagen. V2: Typos
  corrected, acknowledgements and references added",,,,"hep-th math-ph math.MP","http://arxiv.org/licenses/nonexclusive-distrib/1.0/","  A contribution to the collection of reviews ""Introduction to Higher Spin
Theory"" edited by S. Fredenhagen, this introductory article is a pedagogical
account of higher-spin fields and their connections with String Theory. We
start with the motivations for and a brief historical overview of the subject.
We discuss the Wigner classifications of unitary irreducible
Poincar\'e-modules, write down covariant field equations for totally symmetric
massive and massless representations in flat space, and consider their
Lagrangian formulation. After an elementary exposition of the AdS unitary
representations, we review the key no-go and yes-go results concerning
higher-spin interactions, e.g., the Velo-Zwanziger acausality and its
string-theoretic resolution among others. The unfolded formalism, which
underlies Vasiliev's equations, is then introduced to reformulate the
flat-space Bargmann-Wigner equations and the AdS massive-scalar Klein-Gordon
equation, and to state the ""central on-mass-shell theorem"". These techniques
are used for deriving the unfolded form of the boundary-to-bulk propagator in
$AdS_4$, which in turn discloses the asymptotic symmetries of (supersymmetric)
higher-spin theories. The implications for string-higher-spin dualities
revealed by this analysis are then elaborated.
","[{""version"":""v1"",""created"":""Thu, 24 Dec 2015 23:53:58 GMT""},{""version"":""v2"",""created"":""Mon, 18 Apr 2016 08:40:39 GMT""}]","2016-04-19"
"1512.07933","Ryan Marchildon","Ryan P. Marchildon and Amr S. Helmy","Deterministic separation of arbitrary photon pair states in integrated
  quantum circuits","11 pages, 14 figures; to be published in Laser & Photonics Reviews",,"10.1002/lpor.201500133",,"quant-ph physics.optics","http://arxiv.org/licenses/nonexclusive-distrib/1.0/","  Entangled photon pairs generated within integrated devices must often be
spatially separated for their subsequent manipulation in quantum circuits.
Separation that is both deterministic and universal can in principle be
achieved through anti-coalescent two-photon quantum interference. However, such
interference-facilitated pair separation (IFPS) has not been extensively
studied in the integrated setting, where the strong polarization and wavelength
dependencies of integrated couplers -- as opposed to bulk-optics beamsplitters
-- can have important implications for performance beyond the identical-photon
regime. This paper provides a detailed review of IFPS and examines how these
dependencies impact separation fidelity and interference visibility. Focus is
given to IFPS mediated by an integrated directional coupler. The analysis
applies equally to both on-chip and in-fiber implementations, and can be
expanded to other coupler architectures such as multimode interferometers. When
coupler dispersion is present, the separation performance can depend on photon
bandwidth, spectral entanglement, and the linearity of the dispersion. Under
appropriate conditions, reduction in the separation fidelity due to loss of
non-classical interference can be perfectly compensated for by classical
wavelength demultiplexing effects. This work informs the design as well as the
performance assessment of circuits for achieving universal photon pair
separation for states with tunable arbitrary properties.
","[{""version"":""v1"",""created"":""Thu, 24 Dec 2015 23:54:13 GMT""}]","2015-12-29"
"1512.07934","Yves Atchade F","Yves Atchade","A scalable quasi-Bayesian framework for Gaussian graphical models","25 Pages, 2 Figures",,,,"math.ST stat.TH","http://arxiv.org/licenses/nonexclusive-distrib/1.0/","  This paper deals with the Bayesian estimation of high dimensional Gaussian
graphical models. We develop a quasi-Bayesian implementation of the
neighborhood selection method of Meinshausen and Buhlmann (2006) for the
estimation of Gaussian graphical models. The method produces a product-form
quasi-posterior distribution that can be efficiently explored by parallel
computing. We derive a non-asymptotic bound on the contraction rate of the
quasi-posterior distribution. The result shows that the proposed
quasi-posterior distribution contracts towards the true precision matrix at a
rate given by the worst contraction rate of the linear regressions that are
involved in the neighborhood selection. We develop a Markov Chain Monte Carlo
algorithm for approximate computations, following an approach from Atchade
(2015). We illustrate the methodology with a simulation study. The results show
that the proposed method can fit Gaussian graphical models at a scale unmatched
by other Bayesian methods for graphical models.
","[{""version"":""v1"",""created"":""Fri, 25 Dec 2015 00:11:51 GMT""}]","2015-12-29"
"1512.07935","Jun O'Hara","Jun O'Hara and Gil Solanes","Regularized Riesz energies of submanifolds","21 pages. The proof of Theorem 4.10 in the previous version is
  corrected (now Theorem 4.16 in the present version). The previous version
  appeared in Math. Nachr. 291 (2018), 1356-1373, doi: 10.1002/mana.201600083",,,,"math.DG","http://arxiv.org/licenses/nonexclusive-distrib/1.0/","  Given a closed submanifold, or a compact regular domain, in euclidean space,
we consider the Riesz energy defined as the double integral of some power of
the distance between pairs of points. When this integral diverges, we compare
two different regularization techniques (Hadamard's finite part and analytic
continuation), and show that they give essentially the same result. We prove
that some of these energies are invariant under Moebius transformations, thus
giving a generalization to higher dimensions of the Moebius energy of knots.
","[{""version"":""v1"",""created"":""Fri, 25 Dec 2015 00:12:12 GMT""},{""version"":""v2"",""created"":""Fri, 18 Mar 2016 11:11:10 GMT""},{""version"":""v3"",""created"":""Wed, 15 Jan 2020 11:32:37 GMT""}]","2020-01-16"
"1512.07936","Harbir Antil","Harbir Antil, Ricardo H. Nochetto, Patrick Sodre","The Stokes problem with Navier slip boundary condition: Minimal
  fractional Sobolev regularity of the domain",,,,,"math.AP math.NA math.OC","http://arxiv.org/licenses/nonexclusive-distrib/1.0/","  We prove well-posedness in reflexive Sobolev spaces of weak solutions to the
stationary Stokes problem with Navier slip boundary condition over bounded
domains $\Omega$ of $\mathbb{R}^n$ of class $W^{2-1/s}_s$, $s>n$. Since such
domains are of class $C^{1,1-n/s}$, our result improves upon the recent one by
Amrouche-Seloula, who assume $\Omega$ to be of class $C^{1,1}$. We deal with
the slip boundary condition directly via a new localization technique, which
features domain, space and operator decompositions. To flatten the boundary of
$\Omega$ locally, we construct a novel $W^2_s$ diffeomorphism for $\Omega$ of
class $W^{2-1/s}_s$. The fractional regularity gain, from $2-1/s$ to $2$,
guarantees that the Piola transform is of class $W^1_s$. This allows us to
transform $W^1_r$ vector fields without changing their regularity, provided
$r\le s$, and preserve the unit normal which is H\""older. It is in this sense
that the boundary regularity $W^{2-1/s}_s$ seems to be minimal.
","[{""version"":""v1"",""created"":""Fri, 25 Dec 2015 00:14:50 GMT""}]","2015-12-29"
"1512.07937","Alexander Kott","Alexander Kott and Curtis Arnold","Towards Approaches to Continuous Assessment of Cyber Risk in Security of
  Computer Networks","A version of this paper appeared in IEEE Security and Privacy",,,,"cs.CR","http://arxiv.org/licenses/nonexclusive-distrib/1.0/","  We review the current status and research challenges in the area of cyber
security often called continuous monitoring and risk scoring (CMRS). We focus
on two most salient aspects of CMRS. First, continuous collection of data
through automated feeds; hence the term continuous monitoring. Typical data
collected for continuous monitoring purposes include network traffic
information as well as host information from host-based agents. Second,
analysis of the collected data in order to assess the risks - the risk scoring.
This assessment may include flagging especially egregious vulnerabilities and
exposures, or computing metrics that provide an overall characterization of the
network's risk level. Currently used risk metrics are often simple sums or
counts of vulnerabilities and missing patches.
  The research challenges pertaining to CMRS fall mainly into two categories.
The first centers on the problem of integrating and fusing highly heterogeneous
information. The second group of challenges is the lack of rigorous approaches
to computing risk. Existing risk scoring algorithms remain limited to ad hoc
heuristics such as simple sums of vulnerability scores or counts of things like
missing patches or open ports, etc. Weaknesses and potentially misleading
nature of such metrics are well recognized. For example, the individual
vulnerability scores are dangerously reliant on subjective, human, qualitative
input, potentially inaccurate and expensive to obtain. Further, the total
number of vulnerabilities may matters far less than how vulnerabilities are
distributed over hosts, or over time. Similarly, neither topology of the
network nor the roles and dynamics of inter-host interactions are considered by
simple sums of vulnerabilities or missing patches.
","[{""version"":""v1"",""created"":""Fri, 25 Dec 2015 00:18:10 GMT""}]","2015-12-29"
"1512.07938","Yong Chen Dr.","Xin Wang and Yong Chen","Modulation instability and controllable rogue waves with multiple
  compression points for periodically modulated coupled Hirota equations","11 figures, 19 pages",,,,"nlin.SI","http://arxiv.org/licenses/nonexclusive-distrib/1.0/","  Based on modulation instability analysis and generalized Darboux
transformation, we derive a hierarchy of rogue wave solutions for a
variable-coefficients coupled Hirota equations. The explicit first-order rogue
wave solution is presented, and the dark-bright and composite rogue waves with
multiple compression points are shown by choosing sufficiently large periodic
modulation amplitudes in the coefficients of the coupled equations. Also, the
dark-bright and composite Peregrine combs are generated from the multiple
compression points. For the second-order case, the darkbright three sisters,
rogue wave quartets and sextets structures with one or more rogue waves
involving multiple compression points are put forward, respectively.
Furthermore, some wave characteristics such as the difference between light
intensity and continuous wave background, and pulse energy evolution of the
dark rogue wave solution features multiple compression points are discussed.
","[{""version"":""v1"",""created"":""Fri, 25 Dec 2015 00:20:25 GMT""}]","2015-12-29"
"1512.07939","Alfredo N\'ajera Ch\'avez Najera","Alfredo N\'ajera Ch\'avez","A 2-Calabi-Yau realization of finite-type cluster algebras with
  universal coefficients","33 pages. arXiv admin note: text overlap with arXiv:1303.2318 by
  other authors",,,,"math.RT math.AC math.CT math.RA","http://arxiv.org/licenses/nonexclusive-distrib/1.0/","  We categorify various finite-type cluster algebras with coefficients using
completed orbit categories associated to Frobenius categories. Namely, the
Frobenius categories we consider are the categories of finitely generated
Gorenstein projective modules over the singular Nakajima category associated to
a Dynkin diagram and their standard Frobenius quotients. In particular, we are
able to categorify all finite-type skew-symmetric cluster algebras with
universal coefficients and finite-type Grassmannian cluster algebras. Along the
way, we classify the standard Frobenius models of a certain family of
triangulated orbit categories which include all finite-type $n$-cluster
categories, for all integers $n\geq 1$.
","[{""version"":""v1"",""created"":""Fri, 25 Dec 2015 00:22:58 GMT""},{""version"":""v2"",""created"":""Thu, 11 Feb 2016 16:13:34 GMT""},{""version"":""v3"",""created"":""Wed, 18 Oct 2017 15:40:13 GMT""}]","2017-10-19"
"1512.07940","Pavel A. Andreev","Pavel A. Andreev, L. S. Kuz'menkov","Surface spin-electron acoustic waves in magnetically ordered metals","5 pages, 3 figures","Appl. Phys. Lett. Vol. 108, 191605 (2016)","10.1063/1.4949356",,"physics.plasm-ph","http://arxiv.org/licenses/nonexclusive-distrib/1.0/","  Degenerate plasmas with motionless ions show existence of three surface
waves: the Langmuir wave, the electromagnetic wave, and the zeroth sound.
Applying the separated spin evolution quantum hydrodynamics to half-space
plasma we demonstrate the existence of the surface spin-electron acoustic wave
(SSEAW). We study dispersion of the SSEAW. We show that there is hybridization
between the surface Langmuir wave and the SSEAW at rather small spin
polarization. In the hybridization area the dispersion branches are located
close to each other. In this area there is a strong interaction between these
waves leading to the energy exchange. Consequently, generating the Langmuir
waves with the frequencies close to hybridization area we can generate the
SSEAWs. Thus, we report a method of creation of the SEAWs.
","[{""version"":""v1"",""created"":""Fri, 25 Dec 2015 00:24:52 GMT""}]","2016-06-07"
