"1502.02155","Rad Niazadeh","Thomas Kesselheim, Robert Kleinberg, Rad Niazadeh","Secretary Problems with Non-Uniform Arrival Order","To appear in Proceedings of the 47th Annual ACM Symposium on Theory
  of Computing (STOC 2015)",,,,"cs.DS cs.CC math.OC","http://arxiv.org/licenses/nonexclusive-distrib/1.0/","  For many online problems, it is known that the uniform arrival order enables
the design of algorithms with much better performance guarantees than under
worst-case. The quintessential example is the secretary problem. If the
sequence of elements is presented in uniformly random order there is an
algorithm that picks the maximum value with probability 1/e, whereas no
non-trivial performance guarantee is possible if the elements arrive in
worst-case order. This work initiates an investigation into relaxations of the
random-ordering hypothesis in online algorithms, by focusing on the secretary
problems. We present two sets of properties of distributions over permutations
as sufficient conditions, called the block-independence property and
uniform-induced-ordering property. We show these two are asymptotically
equivalent by borrowing some techniques from the approximation theory.
Moreover, we show they both imply the existence of secretary algorithms with
constant probability of correct selection, approaching the optimal constant 1/e
in the limit. We substantiate our idea by providing several constructions of
distributions that satisfy block-independence. We also show that {\Theta}(log
log n) is the minimum entropy of any permutation distribution that permits
constant probability of correct selection in the secretary problem with n
elements. While our block-independence condition is sufficient for constant
probability of correct selection, it is not necessary; however, we present
complexity-theoretic evidence that no simple necessary and sufficient criterion
exists. Finally, we explore the extent to which the performance guarantees of
other algorithms are preserved when one relaxes the uniform random ordering
assumption, obtaining a positive result for Kleinberg's multiple-choice
secretary algorithm and a negative result for the weighted bipartite matching
algorithm of Korula and Pal.
","[{""version"":""v1"",""created"":""Sat, 7 Feb 2015 16:04:14 GMT""}]","2015-02-10"
"1502.02156","Sergey Zelik V.","Anton Savostianov and Sergey Zelik","Finite Dimensionality of the attractor for the hyperbolic
  Cahn-Hilliard-Oono Equation in R^3",,,"10.1002/mma.3569",,"math.AP","http://arxiv.org/licenses/nonexclusive-distrib/1.0/","  In this paper, we continue the study of the hyperbolic relaxation of the
Cahn-Hilliard-Oono equation with the sub-quintic non-linearity in the whole
space $\R^3$ started in our previous paper and verify that under the natural
assumptions on the non-linearity and the external force, the fractal dimension
of the associated global attractor in the natural energy space is finite.
","[{""version"":""v1"",""created"":""Sat, 7 Feb 2015 16:08:07 GMT""}]","2016-04-20"
"1502.02157","Zhangwei Chen","Zhangwei Chen, Xin Wang, Vinnet Bhakhri, Finn Giuliani, Alan Atkinson","Nanoindentation of Porous Bulk and Thin Films of LSCF","journal paper published","Acta Mat, 2013, 61 (15), 5720-5734","10.1016/j.actamat.2013.06.016",,"cond-mat.mtrl-sci","http://arxiv.org/licenses/nonexclusive-distrib/1.0/","  In this paper we show how reliable measurements on porous ceramic films can
be made by appropriate nanoindentation experiments and analysis.
Room-temperature mechanical properties of the mixed-conducting perovskite
material LSCF6428 were investigated by nanoindentation of porous bulk samples
and porous films sintered at temperatures from 900-1200C. A spherical indenter
was used so that the contact area was much greater than the scale of the porous
microstructure. The elastic modulus of the bulk samples was found to increase
from 33.8-174.3 GPa and hardness from 0.64-5.32 GPa as the porosity decreased
from 45-5% after sintering at 900-1200C. Densification under the indenter was
found to have little influence on the measured elastic modulus. The residual
porosity in the dense sample was found to account for the discrepancy between
the elastic moduli measured by indentation and by impulse excitation.
Crack-free LSCF6428 films of acceptable surface roughness for indentation were
also prepared by sintering at 900-1200C. Reliable measurements of the true
properties of the films were obtained by data extrapolation provided that the
ratio of indentation depth to film thickness was in the range 0.1 to 0.2. The
elastic moduli of the films and bulk materials were approximately equal for a
given porosity. The 3D microstructures of films before and after indentation
were characterized using FIB-SEM tomography. Finite element modelling of the
elastic deformation of the actual microstructures showed excellent agreement
with the nanoindentation results.
","[{""version"":""v1"",""created"":""Sat, 7 Feb 2015 16:13:27 GMT""}]","2015-02-10"
"1502.02158","Roi Weiss","Roi Weiss, Boaz Nadler","Learning Parametric-Output HMMs with Two Aliased States",,,,,"cs.LG","http://arxiv.org/licenses/nonexclusive-distrib/1.0/","  In various applications involving hidden Markov models (HMMs), some of the
hidden states are aliased, having identical output distributions. The
minimality, identifiability and learnability of such aliased HMMs have been
long standing problems, with only partial solutions provided thus far. In this
paper we focus on parametric-output HMMs, whose output distributions come from
a parametric family, and that have exactly two aliased states. For this class,
we present a complete characterization of their minimality and identifiability.
Furthermore, for a large family of parametric output distributions, we derive
computationally efficient and statistically consistent algorithms to detect the
presence of aliasing and learn the aliased HMM transition and emission
parameters. We illustrate our theoretical analysis by several simulations.
","[{""version"":""v1"",""created"":""Sat, 7 Feb 2015 16:21:28 GMT""}]","2015-02-10"
"1502.02159","Shuya Chiba","Shuya Chiba, Michitaka Furuya, Shoichi Tsuchiya","Forbidden pairs and the existence of a dominating cycle","19 pages, 11 figures",,,,"math.CO","http://arxiv.org/licenses/nonexclusive-distrib/1.0/","  A cycle in a graph is called dominating if every edge of the graph is
incident with a vertex of the cycle. In this paper, we investigate forbidden
pairs guaranteeing the existence of a dominating cycle in 2-connected graphs.
","[{""version"":""v1"",""created"":""Sat, 7 Feb 2015 16:36:09 GMT""}]","2015-02-10"
"1502.02160","Mohammad Ehab Ragab","Allam Shehata Hassanein, Sherien Mohammad, Mohamed Sameer, and
  Mohammad Ehab Ragab","A Survey on Hough Transform, Theory, Techniques and Applications","18 pages, and 11 figures","IJCSI Volume 12, Issue 1, January 2015",,,"cs.CV","http://arxiv.org/licenses/nonexclusive-distrib/1.0/","  For more than half a century, the Hough transform is ever-expanding for new
frontiers. Thousands of research papers and numerous applications have evolved
over the decades. Carrying out an all-inclusive survey is hardly possible and
enormously space-demanding. What we care about here is emphasizing some of the
most crucial milestones of the transform. We describe its variations
elaborating on the basic ones such as the line and circle Hough transforms. The
high demand for storage and computation time is clarified with different
solution approaches. Since most uses of the transform take place on binary
images, we have been concerned with the work done directly on gray or color
images. The myriad applications of the standard transform and its variations
have been classified highlighting the up-to-date and the unconventional ones.
Due to its merits such as noise-immunity and expandability, the transform has
an excellent history, and a bright future as well.
","[{""version"":""v1"",""created"":""Sat, 7 Feb 2015 16:40:17 GMT""}]","2015-02-10"
"1502.02161","Margarita Sharina","Khamidullina D.A., Sharina M.E., Shimansky V.V., Davoust E","Chemical Abundances in the Globular Clusters NGC 6229 and NGC 6779","28 pages, 16 figures, 5 tables","2014AstBu..69..409K","10.1134/S199034131404004X",,"astro-ph.SR","http://arxiv.org/licenses/nonexclusive-distrib/1.0/","  Long-slit medium-resolution spectra of the Galactic globular clusters (GCs)
NGC6229 and NGC6779, obtained with the CARELEC spectrograph at the 1.93-m
telescope of the Haute-Provence observatory, have been used to determine the
age, helium abundance (Y), and metallicity [Fe/H] as well as the first estimate
of the abundances of C, N, O, Mg, Ca, Ti, and Cr for these objects. We solved
this task by comparing the observed spectra and the integrated synthetic
spectra, calculated with the use of the stellar atmosphere models with the
parameters preset for the stars from these clusters. The model mass estimates,
$T_{\rm eff}$, and log~g were derived by comparing the observed
""color-magnitude"" diagrams and the theoretical isochrones. The summing-up of
the synthetic blanketed stellar spectra was conducted according to the Chabrier
mass function. To test the accuracy of the results, we estimated the chemical
abundances, [Fe/H], $\log~t$, and $Y$ for the NGC5904 and NGC6254 clusters,
which, according to the literature, are considered to be the closest analogues
of the two GCs of our study. Using the medium-resolution spectra from the
library of Schiavon et al., we obtained for these two clusters a satisfactory
agreement with the reported estimates for all the parameters within the errors.
We derived the following cluster parameters. NGC6229: [Fe/H]=-1.65 dex, t=12.6
Gyr, Y=0.26, [\alpha/Fe]=0.28 dex; NGC6779: [Fe/H]=-1.9 dex, t=12.6 Gyr,
Y=0.23, [\alpha/Fe]=0.08 dex; NGC5904: [Fe/H]=-1.6 dex, t=12.6 Gyr, Y=0.30,
[\alpha/Fe]=0.35 dex; NGC6254: [Fe/H]=-1.52 dex, t=11.2 Gyr, Y=0.30
[\alpha/Fe]=0.025 dex. The value [\alpha/Fe] denotes the average of the Ca and
Mg abundances.
","[{""version"":""v1"",""created"":""Sat, 7 Feb 2015 16:41:55 GMT""}]","2015-09-15"
"1502.02162","Jean-Luc Thiffeault","Marko Budisic and Jean-Luc Thiffeault","Finite-Time Braiding Exponents","16 pages, 27 figures. RevTex 4-1 style","Chaos 25, 087407 (2015)","10.1063/1.4927438",,"nlin.CD math.DS","http://arxiv.org/licenses/nonexclusive-distrib/1.0/","  Topological entropy is a common measure of the rate of mixing in a flow. It
can be computed by partition methods, or by estimating the growth rate of
material lines or other material elements. This requires detailed knowledge of
the velocity field, which is not always available, such as when we only know a
few particle trajectories (ocean float data, for example). We propose an
alternative approximation to topological entropy,applicable to two-dimensional
flows, which uses only a finite number of trajectories as input data. To
represent these sparse data sets, we use braids, algebraic objects that record
how strands, i.e., trajectories, exchange positions with respect to a
projection axis. Material curves advected by the flow are represented as
simplified loop coordinates. The exponential rate at which a braid deforms
loops over a finite time interval as the strands exchange places is the
Finite-Time Braiding Exponent (FTBE) and serves as a proxy for topological
entropy of the two-dimensional flow. We demonstrate that FTBEs are robust with
respect to the value of numerical time step,details of braid representation,
and choice of initial conditions inside the mixing region. We also explore how
closely the FTBEs approximate topological entropy depending on the number and
length of trajectories used.
","[{""version"":""v1"",""created"":""Sat, 7 Feb 2015 16:59:56 GMT""}]","2015-08-07"
"1502.02163","Hao Liao","Gui-Yuan Shi, Yi-Xiu Kong, Hao Liao, Yi-Cheng Zhang","Analysis of ground state in random bipartite matching","14 pages,6 figures",,,,"physics.soc-ph cs.SI","http://arxiv.org/licenses/nonexclusive-distrib/1.0/","  In human society, a lot of social phenomena can be concluded into a
mathematical problem called the bipartite matching, one of the most well known
model is the marriage problem proposed by Gale and Shapley. In this article, we
try to find out some intrinsic properties of the ground state of this model and
thus gain more insights and ideas about the matching problem. We apply
Kuhn-Munkres Algorithm to find out the numerical ground state solution of the
system. The simulation result proves the previous theoretical analysis using
replica method. In the result, we also find out the amount of blocking pairs
which can be regarded as a representative of the system stability. Furthermore,
we discover that the connectivity in the bipartite matching problem has a great
impact on the stability of the ground state, and the system will become more
unstable if there were more connections between men and women.
","[{""version"":""v1"",""created"":""Sat, 7 Feb 2015 17:13:00 GMT""}]","2015-02-10"
"1502.02164","Ludvig Lizana","Sebastian Ahlberg and Tobias Ambj\""ornsson and Ludvig Lizana","Many-body effects in tracer particle diffusion with applications for
  single-protein dynamics on DNA","10 pages, 8 figures",,"10.1088/1367-2630/17/4/043036",,"cond-mat.stat-mech q-bio.SC","http://arxiv.org/licenses/nonexclusive-distrib/1.0/","  30% of the DNA in E. coli bacteria is covered by proteins. Such high degree
of crowding affect the dynamics of generic biological processes (e.g. gene
regulation, DNA repair, protein diffusion etc.) in ways that are not yet fully
understood. In this paper, we theoretically address the diffusion constant of a
tracer particle in a one dimensional system surrounded by impenetrable crowder
particles. While the tracer particle always stays on the lattice, crowder
particles may unbind to a surrounding bulk and rebind at another or the same
location. In this scenario we determine how the long time diffusion constant
${\cal D}$ (after many unbinding events) depends on (i) the unbinding rate of
crowder particles $k_{\rm off}$, and (ii) crowder particle line density $\rho$,
from simulations (Gillespie algorithm) and analytical calculations. For small
$k_{\rm off}$, we find ${\cal D}\sim k_{\rm off}/\rho^2$ when crowder particles
are immobile on the line, and ${\cal D}\sim \sqrt{D k_{\rm off}}/\rho$ when
they are diffusing; $D$ is the free particle diffusion constant. For large
$k_{\rm off}$, we find agreement with mean-field results which do not depend on
$k_{\rm off}$. From literature values of $k_{\rm off}$ and $D$, we show that
the small $k_{\rm off}$-limit is relevant for in vivo protein diffusion on a
crowded DNA. Our results applies to single-molecule tracking experiments.
","[{""version"":""v1"",""created"":""Sat, 7 Feb 2015 17:18:13 GMT""}]","2015-06-23"
"1502.02165","Asaf Karagila","Yair Hayut and Asaf Karagila","Restrictions on Forcings That Change Cofinalities","8 pages; post-refereeing version","Arch. Math. Logic (2016) 55: 373","10.1007/s00153-015-0454-7",,"math.LO","http://arxiv.org/licenses/nonexclusive-distrib/1.0/","  In this paper we investigate some properties of forcing which can be
considered ""nice"" in the context of singularizing regular cardinals to have an
uncountable cofinality. We show that such forcing which changes cofinality of a
regular cardinal, cannot be too nice and must cause some ""damage"" to the
structure of cardinals and stationary sets. As a consequence there is no
analogue to the Prikry forcing, in terms of ""nice"" properties, when changing
cofinalities to be uncountable.
","[{""version"":""v1"",""created"":""Sat, 7 Feb 2015 17:28:39 GMT""},{""version"":""v2"",""created"":""Tue, 28 Jul 2015 13:11:21 GMT""}]","2018-05-15"
"1502.02166","Helio M. de Oliveira","H.M. de Oliveira and G.A.A. de Araujo","Compactly Supported One-cyclic Wavelets Derived from Beta Distributions","7 pages, 4 figures. Journal of Communication and Information Systems,
  former Journal of the Brazilian Telecommunications Society, ISSN 1980-6604
  pp.105-111","Journal of Communication and Information Systems ISSN 1980-6604
  pp.105-111","10.14209/jcis.2005.17",,"math.CA stat.ME","http://arxiv.org/licenses/nonexclusive-distrib/1.0/","  New continuous wavelets of compact support are introduced, which are related
to the beta distribution. They can be built from probability distributions
using 'blur'derivatives. These new wavelets have just one cycle, so they are
termed unicycle wavelets. They can be viewed as a soft variety of Haar wavelets
whose shape is fine-tuned by two parameters a and b. Close expressions for beta
wavelets and scale functions as well as their spectra are derived. Their
importance is due to the Central Limit Theorem applied for compactly supported
signals.
","[{""version"":""v1"",""created"":""Sat, 7 Feb 2015 17:39:10 GMT""}]","2015-08-21"
"1502.02167","Vladimir Popov L","Vladimir L. Popov","Birational splitting and algebraic group actions","Acknowledgements added",,"10.1007/s40879-015-0050-8",,"math.AG","http://arxiv.org/licenses/nonexclusive-distrib/1.0/","  According to the classical theorem, every irreducible algebraic variety
endowed with a nontrivial rational action of a connected linear algebraic group
is birationally isomorphic to a product of another algebraic variety and ${\bf
P}^s$ with positive $s$. We show that the classical proof of this theorem
actually works only in characteristic $0$ and we give a characteristic free
proof of it. To this end we prove and use a characterization of connected
linear algebraic groups $G$ with the property that every rational action of $G$
on an irreducible algebraic variety is birationally equivalent to a regular
action of $G$ on an affine algebraic variety.
","[{""version"":""v1"",""created"":""Sat, 7 Feb 2015 17:39:59 GMT""},{""version"":""v2"",""created"":""Mon, 11 Dec 2017 13:51:54 GMT""}]","2017-12-12"
"1502.02168","Renato J Cintra","H. M. de Oliveira, R. J. Cintra, R. M. Campello de Souza","Multilayer Hadamard Decomposition of Discrete Hartley Transforms","Fixed several typos. 7 pages, 5 figures, XVIII Simp\'osio Brasileiro
  de Telecomunica\c{c}\~oes, 2000, Gramado, RS, Brazil",,,,"cs.DS cs.DM","http://arxiv.org/licenses/nonexclusive-distrib/1.0/","  Discrete transforms such as the discrete Fourier transform (DFT) or the
discrete Hartley transform (DHT) furnish an indispensable tool in signal
processing. The successful application of transform techniques relies on the
existence of the so-called fast transforms. In this paper some fast algorithms
are derived which meet the lower bound on the multiplicative complexity of the
DFT/DHT. The approach is based on a decomposition of the DHT into layers of
Walsh-Hadamard transforms. In particular, fast algorithms for short block
lengths such as $N \in \{4, 8, 12, 24\}$ are presented.
","[{""version"":""v1"",""created"":""Sat, 7 Feb 2015 17:44:57 GMT""},{""version"":""v2"",""created"":""Thu, 12 Feb 2015 14:08:14 GMT""},{""version"":""v3"",""created"":""Wed, 26 Aug 2015 13:52:49 GMT""}]","2015-08-27"
"1502.02169","Alexander Soiguine","Alexander M. Soiguine","Geometric algebra, qubits, geometric evolution, and all that",,,,,"physics.gen-ph quant-ph","http://arxiv.org/licenses/nonexclusive-distrib/1.0/","  The earlier approach is used for description of qubits and geometric phase
parameters, the things critical in the area of topological quantum computing.
The used tool, Geometric (Clifford) Algebra is the most convenient formalism
for that case. Generalization of formal complex plane to an an arbitrary plane
in three dimensions and of usual Hopf fibration to the map generated by an
arbitrary unit value element of even sub-algebra of the three-dimensional
Geometric Algebra are resulting in more profound description of qubits compared
to quantum mechanical Hilbert space formalism.
","[{""version"":""v1"",""created"":""Sat, 7 Feb 2015 18:10:43 GMT""}]","2015-02-10"
"1502.02170","John Price","John C. Price, William A. Johnston, Daniel D. McKinnon","Linear-response reflection coefficient of the recorder air-jet amplifier","Text revised for clarity, no change to data or conclusions, 44 pages
  including 12 figures","J. Acoust. Soc. Am. 138, 3282 (2015)","10.1121/1.4935400",,"physics.flu-dyn","http://arxiv.org/licenses/nonexclusive-distrib/1.0/","  In a duct-flute such as the recorder, steady-state oscillations are
controlled by two parameters, the blowing pressure and the frequency of the
acoustic resonator. As in most feedback oscillators, the oscillation amplitude
is determined by gain-saturation of the amplifier, and thus it cannot be
controlled independently of blowing pressure and frequency unless the feedback
loop is opened. In this work, the loop is opened by replacing the recorder body
with a waveguide reflectometer: a section of transmission line with
microphones, a signal source, and an absorbing termination. When the mean flow
from the air-jet into the transmission line is not blocked, the air-jet
amplifier is unstable to edge-tone oscillations through a feedback path that
does not involve the acoustic resonator. When it is blocked, the air-jet is
deflected somewhat outward and the system becomes stable. It is then possible
to measure the reflection coefficient of the air-jet amplifier versus blowing
pressure and acoustic frequency under linear response conditions, avoiding the
complication of gain-saturation. The results provide a revealing test of flute
drive models under the simplest conditions and with few unknown parameters. The
strengths and weaknesses of flute drive models are discussed.
","[{""version"":""v1"",""created"":""Sat, 7 Feb 2015 18:36:55 GMT""},{""version"":""v2"",""created"":""Wed, 9 Dec 2015 17:56:52 GMT""}]","2015-12-10"
"1502.02171","Liang Zheng","Liang Zheng, Liyue Shen, Lu Tian, Shengjin Wang, Jiahao Bu, Qi Tian","Person Re-identification Meets Image Search",,,,,"cs.CV","http://arxiv.org/licenses/nonexclusive-distrib/1.0/","  For long time, person re-identification and image search are two separately
studied tasks. However, for person re-identification, the effectiveness of
local features and the ""query-search"" mode make it well posed for image search
techniques.
  In the light of recent advances in image search, this paper proposes to treat
person re-identification as an image search problem. Specifically, this paper
claims two major contributions. 1) By designing an unsupervised Bag-of-Words
representation, we are devoted to bridging the gap between the two tasks by
integrating techniques from image search in person re-identification. We show
that our system sets up an effective yet efficient baseline that is amenable to
further supervised/unsupervised improvements. 2) We contribute a new high
quality dataset which uses DPM detector and includes a number of distractor
images. Our dataset reaches closer to realistic settings, and new perspectives
are provided.
  Compared with approaches that rely on feature-feature match, our method is
faster by over two orders of magnitude. Moreover, on three datasets, we report
competitive results compared with the state-of-the-art methods.
","[{""version"":""v1"",""created"":""Sat, 7 Feb 2015 18:56:35 GMT""}]","2015-02-10"
"1502.02172","Rehan Malak","Rehan Malak, Zoltan Fodor, Christian Hoelbling, Laurent Lellouch,
  Alfonso Sastre, Kalman Szabo","Finite-volume corrections to the leading-order hadronic contribution to
  $g_\mu-2$","7 pages, 2 figures, Contribution to the Proceedings of the 32nd
  International Symposium on Lattice Field Theory (Lattice 2014), 23-28 June
  2014, Columbia University, New York, NY, USA",,,,"hep-lat","http://creativecommons.org/licenses/by-nc-sa/3.0/","  We present preliminary results of a 2+1-flavor study of finite-volume effects
in the lattice QCD computation of the leading-order hadronic contribution to
the muon anomalous magnetic moment. We also present methods for obtaining
directly the invariant hadronic polarization function, $\Pi(Q^2)$, and the
Adler function at all discrete lattice values of $Q^2$, including $Q^2=0$.
Results are obtained with HEX-smeared clover fermions.
","[{""version"":""v1"",""created"":""Sat, 7 Feb 2015 19:04:07 GMT""}]","2015-02-10"
"1502.02173","Juan Seoane-Sepulveda","P. Jim\'enez-Rodr\'iguez, G.A. Mu\~noz-Fern\'andez, M. Murillo-Arcila
  and J.B. Seoane-Sep\'ulveda","Sharp values for the constants in the polynomial Bohnenblust-Hille
  inequality","16 pages",,,,"math.FA","http://arxiv.org/licenses/nonexclusive-distrib/1.0/","  In this paper we prove that the complex polynomial Bohnenblust-Hille constant
for $2$-homogeneous polynomials in ${\mathbb C}^2$ is exactly
$\sqrt[4]{\frac{3}{2}}$. We also give the exact value of the real polynomial
Bohnenblust-Hille constant for $2$-homogeneous polynomials in ${\mathbb R}^2$.
Finally, we provide lower estimates for the real polynomial Bohnenblust-Hille
constant for polynomials in ${\mathbb R}^2$ of higher degrees.
","[{""version"":""v1"",""created"":""Sat, 7 Feb 2015 19:12:14 GMT""}]","2015-02-10"
