"1502.02196","Francisco Crespo Cutillas","Francisco Crespo, Gema Mar\'ia D\'iaz-Toca, Sebasti\'an Ferrer,
  Mart\'in Lara","Poisson and symplectic reductions of 4-DOF isotropic oscillators. The
  van der Waals system as benchmark","24 pages, 2 figures",,,,"math.DS","http://arxiv.org/licenses/nonexclusive-distrib/1.0/","  This paper is devoted to studying Hamiltonian oscillators in 1:1:1:1
resonance with symmetries, which include several models of perturbed Keplerian
systems. Normal forms are computed in Poisson and symplectic formalisms, by
mean of invariants and Lie-transforms respectively. The first procedure relies
on the quadratic invariants associated to the symmetries, and is carried out
using Gr\""obner bases. In the symplectic approach, hinging on the maximally
superintegrable character of the isotropic oscillator, the normal form is
computed {\it a la} Delaunay, using a generalization of those variables for
4-DOF systems. Due to the symmetries of the system, isolated as well as circles
of stationary points and invariant tori should be expected. These solutions
manifest themselves rather differently in both approaches, due to the
constraints among the invariants versus the singularities associated to the
Delaunay chart.
  Taking the generalized van der Waals family as a benchmark, the explicit
expression of the Delaunay normalized Hamiltonian up to the second order is
presented, showing that it may be extended to higher orders in a
straightforward way. The search for the relative equilibria is used for
comparison of their main features of both treatments. The pros and cons are
given in detail for some values of the parameter and the integrals.
","[{""version"":""v1"",""created"":""Sat, 7 Feb 2015 23:48:33 GMT""}]","2015-02-10"
"1502.02197","Irina Gelbukh","Irina Gelbukh","Co-rank and Betti number of a group","Accepted to: Czechoslovak Mathematical Journal, 2015","Czechoslovak Mathematical Journal, 65(2):565-567, 2015","10.1007/s10587-015-0195-0",,"math.GR","http://arxiv.org/licenses/nonexclusive-distrib/1.0/","  We study the maximal ranks of a free and a free abelian quotients of a
finitely generated group, called co-rank (inner rank, cut number) and the Betti
number, respectively. We show that any combination of these values within
obvious constraints is realized for some finitely presented group, which is
important for manifold and foliation topology.
","[{""version"":""v1"",""created"":""Sun, 8 Feb 2015 00:16:25 GMT""}]","2016-08-25"
"1502.02198","Stanley P. Gudder","Stan Gudder","Emergence of Four Dimensions in the Causal Set Approach to Discrete
  Quantum Gravity","25 pages",,,,"gr-qc","http://arxiv.org/licenses/nonexclusive-distrib/1.0/","  One could begin a study like the present one by simply postulating that our
universe is four-dimensional. There are ample reasons for doing this.
Experience, observation and experiment all point to the fact that we inhabit a
four-dimensional universe. Another approach would be to show that
four-dimensions arise naturally from a reasonable model of the universe or
multiverse. After reviewing the causal set approach to discrete quantum gravity
in Section~1, we shall discuss the emergence of four-dimensions in Section~2.
We shall see that certain patterns of four arise that suggest the introduction
of a 4-dimensional discrete manifold. In the later sections we shall discuss
some consequences of this introduced framework. In particular, we will show
that quantum amplitudes can be employed to describe a multiverse dynamics.
Moreover, a natural unitary operator together with energy, position and
momentum operators will be introduced and their properties studied.
","[{""version"":""v1"",""created"":""Sun, 8 Feb 2015 00:28:07 GMT""}]","2015-02-10"
"1502.02199","Tony Grubman","Tony Grubman, Y. Ahmet \c{S}ekercio\u{g}lu, David R. Wood","Partitioning de Bruijn Graphs into Fixed-Length Cycles for Robot
  Identification and Tracking","16 pages, 4 figures. Accepted for publication in Discrete Applied
  Mathematics","Discrete Applied Mathematics 213:101-113, 2016","10.1016/j.dam.2016.05.013",,"math.CO","http://arxiv.org/licenses/nonexclusive-distrib/1.0/","  We propose a new camera-based method of robot identification, tracking and
orientation estimation. The system utilises coloured lights mounted in a circle
around each robot to create unique colour sequences that are observed by a
camera. The number of robots that can be uniquely identified is limited by the
number of colours available, $q$, the number of lights on each robot, $k$, and
the number of consecutive lights the camera can see, $\ell$. For a given set of
parameters, we would like to maximise the number of robots that we can use. We
model this as a combinatorial problem and show that it is equivalent to finding
the maximum number of disjoint $k$-cycles in the de Bruijn graph
$\text{dB}(q,\ell)$.
  We provide several existence results that give the maximum number of cycles
in $\text{dB}(q,\ell)$ in various cases. For example, we give an optimal
solution when $k=q^{\ell-1}$. Another construction yields many cycles in larger
de Bruijn graphs using cycles from smaller de Bruijn graphs: if
$\text{dB}(q,\ell)$ can be partitioned into $k$-cycles, then
$\text{dB}(q,\ell)$ can be partitioned into $tk$-cycles for any divisor $t$ of
$k$. The methods used are based on finite field algebra and the combinatorics
of words.
","[{""version"":""v1"",""created"":""Sun, 8 Feb 2015 01:23:08 GMT""},{""version"":""v2"",""created"":""Thu, 19 May 2016 13:03:59 GMT""}]","2017-07-18"
"1502.02200","Ernest Ma","Ernest Ma (UC Riverside & JCIAS, HKUST)","Derivation of Dark Matter Parity from Lepton Parity","11 pages, 6 figures, version to appear in PRL","Phys. Rev. Lett. 115, 011801 (2015)","10.1103/PhysRevLett.115.011801","UCRHEP-T550 (June 2015)","hep-ph","http://arxiv.org/licenses/nonexclusive-distrib/1.0/","  It is shown that in extensions of the standard model of quarks and leptons
where additive lepton number $L$ is broken by two units, so that $Z_2$ lepton
parity, i.e. $(-1)^L$ which is either even or odd, remains exactly conserved,
there is the possibility of stable dark matter without additional symmetry.
This applies to many existing simple models of Majorana neutrino mass with dark
matter, including some radiative models. Several well-known examples are
discussed. This new insight leads to the construction of a radiative Type II
seesaw model of neutrino mass with dark matter where the dominant decay of the
doubly charged Higgs boson $\xi^{++}$ is into $W^+W^+$ instead of the expected
$l_i^+ l_j^+$ lepton pairs for the well-known tree-level model.
","[{""version"":""v1"",""created"":""Sun, 8 Feb 2015 01:46:22 GMT""},{""version"":""v2"",""created"":""Tue, 17 Feb 2015 17:08:07 GMT""},{""version"":""v3"",""created"":""Mon, 15 Jun 2015 15:30:21 GMT""}]","2015-07-08"
"1502.02201","Yuan-Chuan Zou","Jing Lv, Jing-Wen Xing, Yuan-Chuan Zou, Wei-Hua Lei, Qingwen Wu, and
  Ding-Xiong Wang","Extending the Correlation of $L_R - L_X$ to Gamma Ray Bursts","4 pages, 1 figure",,,,"astro-ph.HE","http://arxiv.org/licenses/nonexclusive-distrib/1.0/","  The well-known correlation between the radio luminosity ($L_R$) and the X-ray
luminosity ($L_X$) $L_R / L_X \simeq 10^{-5}$ holds for a variety of objects
like active galactic nuclei, galactic black holes, solar flares and cool stars.
Here we extend the relation to gamma-ray bursts (GRBs), and find the GRBs also
lay on the same $L_R-L_X$ relation, with a slightly different slope as $L_R
\propto L_X^{1.1}$. This relation implies the explosions in different scales
may have a common underlying origin.
","[{""version"":""v1"",""created"":""Sun, 8 Feb 2015 01:49:25 GMT""}]","2015-02-10"
"1502.02202","Alan Lefor","Alan T. Lefor","Comparison of Strong Gravitational Lens Model Software II. HydraLens:
  Computer-Assisted Strong Gravitational Lens Model Generation and Translation",,"Astronomy and Computing 2014. 5:28-34",,,"astro-ph.IM","http://arxiv.org/licenses/nonexclusive-distrib/1.0/","  The behavior of strong gravitational lens model software in the analysis of
lens models is not necessarily consistent among the various software available,
suggesting that the use of several models may enhance the understanding of the
system being studied. Among the publicly available codes, the model input files
are heterogeneous, making the creation of multiple models tedious. An enhanced
method of creating model files and a method to easily create multiple models,
may increase the number of comparison studies. HydraLens simplifies the
creation of model files for four strong gravitational lens model software
packages, including Lenstool, Gravlens/Lensmodel, glafic and PixeLens, using a
custom designed GUI for each of the four codes that simplifies the entry of the
model for each of these codes, obviating the need for user manuals to set the
values of the many flags and in each data field. HydraLens is designed in a
modular fashion, which simplifies the addition of other strong gravitational
lens codes in the future. HydraLens can also translate a model generated for
any of these four software packages into any of the other three. Models created
using HydraLens may require slight modifications, since some information may be
lost in the translation process. However the computer generated model greatly
simplifies the process of developing multiple lens models. HydraLens may
enhance the number of direct software comparison studies, and also assist in
the education of young investigators in gravitational lens modeling. Future
development of HydraLens will further enhance its capabilities.
","[{""version"":""v1"",""created"":""Sun, 8 Feb 2015 02:02:19 GMT""},{""version"":""v2"",""created"":""Thu, 12 Feb 2015 00:24:07 GMT""}]","2015-02-13"
"1502.02203","Behrooz Semnani","Behrooz Semnani, Amir Hamed Majedi, Safieddin Safavi-Naeini","Nonlinear quantum optical properties of graphene: the role of chirality
  and symmetry","14 pages",,"10.1088/2040-8978/18/3/035402",,"cond-mat.mes-hall","http://arxiv.org/licenses/nonexclusive-distrib/1.0/","  We present a semiclassical theory of linear and nonlinear optical response of
graphene. The emphasis is placed on the nonlinear optical response of graphene
from the standpoint of the underlying chiral symmetry. The Bloch quasiparticles
in low energy limit, around the degeneracy points are dominantly chiral. It is
shown for the first time that this chiral behavior in conjunction with scale
invariance in graphene around the Dirac points results in the strong nonlinear
optical response. Explicit expressions for the linear and nonlinear
conductivity tensors are derived based on Semiconductor Bloch Equations (SBEs).
The linear terms agree with the result of Kubo formulation. The three main
additive mechanisms contribute in the nonlinear optical response of graphene:
pure intraband, pure interband and the interplay between them. For each
contribution, an explicit response function is derived. The Kerr-type
nonlinearity of graphene is then studied and it is demonstrated that its Kerr
nonlinear coefficient is several orders of magnitude higher than that of many
other known semiconductors. In addition, the nonlinear refractive index of
graphene can also be tuned and enhanced by applying a gate voltage.
","[{""version"":""v1"",""created"":""Sun, 8 Feb 2015 02:15:17 GMT""},{""version"":""v2"",""created"":""Wed, 29 Jul 2015 00:30:24 GMT""}]","2019-07-10"
"1502.02204","Zhitao Xing","Zhitao Xing and Ercai Chen","Induced topological pressure for topological dynamical(to appear in JPM)",,,"10.1063/1.4908554",,"math.DS","http://arxiv.org/licenses/nonexclusive-distrib/1.0/","  In this paper, inspired by the article [5], we introduce the induced
topological pressure for a topological dynamical system. In particular, we
prove a variational principle for the induced topological pressure.
","[{""version"":""v1"",""created"":""Sun, 8 Feb 2015 02:24:11 GMT""}]","2015-06-23"
"1502.02205","Wei Liu","Wei Liu, Jianfa Zhang, Bing Lei, Haojun Hu, and Andrey E.
  Miroshnichenko","Invisible nanowires with interfering electric and toroidal dipoles","Three Figures; Four pages; Comments welcomed","Opt. Lett. 40, 2293-2296 (2015)","10.1364/OL.40.002293 10.1364/OL.40.002293",,"physics.optics","http://arxiv.org/licenses/nonexclusive-distrib/1.0/","  By studying the scattering of normally incident planewaves by a single
nanowire, we reveal the indispensable role of toroidal multipole excitation in
multipole expansions of radiating sources. It is found that for both
p-polarized and s-polarized incident waves, toroidal dipoles can be effectively
excited within homogenous dielectric nanowires in the optical spectrum regime.
We further demonstrate that the plasmonic core-shell nanowires can be rendered
invisible through destructive interference of the electric and toroidal
dipoles, which may inspire many nanowire based light-matter interaction
studies, and incubate biological and medical applications that require
non-invasive detections and measurements.
","[{""version"":""v1"",""created"":""Sun, 8 Feb 2015 02:49:58 GMT""},{""version"":""v2"",""created"":""Wed, 20 May 2015 09:22:42 GMT""}]","2015-05-21"
"1502.02206","Kai-Wei Chang","Kai-Wei Chang, Akshay Krishnamurthy, Alekh Agarwal, Hal Daum\'e III,
  John Langford","Learning to Search Better Than Your Teacher","In ICML 2015",,,,"cs.LG stat.ML","http://arxiv.org/licenses/nonexclusive-distrib/1.0/","  Methods for learning to search for structured prediction typically imitate a
reference policy, with existing theoretical guarantees demonstrating low regret
compared to that reference. This is unsatisfactory in many applications where
the reference policy is suboptimal and the goal of learning is to improve upon
it. Can learning to search work even when the reference is poor?
  We provide a new learning to search algorithm, LOLS, which does well relative
to the reference policy, but additionally guarantees low regret compared to
deviations from the learned policy: a local-optimality guarantee. Consequently,
LOLS can improve upon the reference policy, unlike previous algorithms. This
enables us to develop structured contextual bandits, a partial information
structured prediction setting with many potential applications.
","[{""version"":""v1"",""created"":""Sun, 8 Feb 2015 03:18:50 GMT""},{""version"":""v2"",""created"":""Wed, 20 May 2015 05:48:10 GMT""}]","2015-05-21"
"1502.02207","Jean Nganou","Jean B. Nganou","Stone MV-algebras and Strongly complete MV-algebras","15 pages",,,,"math.LO","http://arxiv.org/licenses/nonexclusive-distrib/1.0/","  Compact Hausdorff topological MV-algebras and Stone MV-algebras are
completely characterized. We obtain that compact Hausdorff topological
MV-algebras are product (both topological and algebraic) of copies $[0,1]$ with
standard topology and finite Lukasiewicz chains with discrete topology. Going
one step further we also prove that Stone MV-algebras are product (both
topological and algebraic) of finite Lukasiewicz chains with discrete topology.
We also prove that an MV-algebra is strongly complete (isomorphic to its
profinite completion) if and only if it is profinite and its maximal ideals of
finite ranks are principal.
","[{""version"":""v1"",""created"":""Sun, 8 Feb 2015 04:47:15 GMT""},{""version"":""v2"",""created"":""Thu, 26 Mar 2015 06:21:20 GMT""},{""version"":""v3"",""created"":""Mon, 4 May 2015 02:24:16 GMT""}]","2015-05-05"
"1502.02208","David Jones","David J. Jones, Kirk W. Madison, and Carl E. Wieman","Transforming a 4th year Modern Optics Course Using a Deliberate Practice
  Framework","31 pages",,"10.1103/PhysRevSTPER.11.020108",,"physics.ed-ph","http://arxiv.org/licenses/nonexclusive-distrib/1.0/","  We present a study of active learning pedagogies in an upper division physics
course. This work was guided by the principle of deliberate practice for the
development of expertise, and this principle was used in the design of the
materials and the orchestration of the classroom activities of the students. We
present our process for efficiently converting a traditional lecture course
based on instructor notes into activities for such a course with active
learning methods. Ninety percent of the same material was covered and scores on
common exam problems showed a 15 % improvement with an effect size greater than
1 after the transformation. We observe that the improvement and the associated
effect size is sustained after handing off the materials to a second
instructor. Because the improvement on exam questions was independent of
specific problem topics and because the material tested was so mathematically
advanced and broad (including linear algebra, Fourier Transforms, partial
differential equations, vector calculus), we expect the transformation process
could be applied to most upper division physics courses having a similar
mathematical base.
","[{""version"":""v1"",""created"":""Sun, 8 Feb 2015 05:26:33 GMT""},{""version"":""v2"",""created"":""Tue, 3 Mar 2015 22:51:39 GMT""}]","2015-10-28"
"1502.02209","Liqun Qi","Yisheng Song and Liqun Qi","Tensor Complementarity Problem and Semi-positive Tensors",,,,,"math.OC","http://arxiv.org/licenses/nonexclusive-distrib/1.0/","  The tensor complementarity problem $(\q, \mathcal{A})$ is to
  $$\mbox{ find } \x \in \mathbb{R}^n\mbox{ such that }\x \geq \0, \q +
\mathcal{A}\x^{m-1} \geq \0, \mbox{ and }\x^\top (\q + \mathcal{A}\x^{m-1}) =
0.$$ We prove that a real tensor $\mathcal{A}$ is a (strictly) semi-positive
tensor if and only if the tensor complementarity problem $(\q, \mathcal{A})$
has a unique solution for $\q>\0$ ($\q\geq\0$), and a symmetric real tensor is
a (strictly) semi-positive tensor if and only if it is (strictly) copositive.
That is, for a strictly copositive symmetric tensor $\mathcal{A}$, the tensor
complementarity problem $(\q, \mathcal{A})$ has a solution for all $\q \in
\mathbb{R}^n$.
","[{""version"":""v1"",""created"":""Sun, 8 Feb 2015 05:29:55 GMT""}]","2015-02-10"
"1502.02210","Bing Li","Bing Li and Carlos E. M. Wagner","CP-odd component of the lightest neutral Higgs boson in the MSSM","35 pages, 13 figures","Phys. Rev. D 91, 095019 (2015)","10.1103/PhysRevD.91.095019","EFI-15-6","hep-ph","http://arxiv.org/licenses/nonexclusive-distrib/1.0/","  The Higgs sector of the Minimal Supersymmetric Extension of the Standard
Model may be described with a two Higgs doublet model with properties that
depend on the soft supersymmetry breaking parameters. For instance, flavor
independent CP-violating phases associated with the gaugino masses, the squark
trilinear mass parameters and the Higgsino mass parameter $\mu$ may lead to
sizable CP-violation in the Higgs sector. For these CP-violating effects to
affect the properties of the recently observed SM-like Higgs resonance, the
non-standard charged and neutral Higgs bosons masses must be of the order of
the weak scale, and both $\mu$ as well as the trilinear stop mass parameter
$A_t$ must be of the order or larger than the stop mass parameters. Constraints
on this possibility come from direct searches for non-standard Higgs bosons,
precision measurements on the lightest neutral Higgs properties, including its
mass, and electric dipole moments. In this article, we discuss these
constraints within the MSSM, trying to evaluate the possible size of the CP-odd
component of the lightest neutral Higgs boson, and the possible experimental
tests of this CP-violating effect at the LHC.
","[{""version"":""v1"",""created"":""Sun, 8 Feb 2015 05:35:39 GMT""},{""version"":""v2"",""created"":""Sun, 22 Feb 2015 18:11:38 GMT""},{""version"":""v3"",""created"":""Tue, 16 Feb 2016 17:11:40 GMT""}]","2016-02-17"
"1502.02211","Clay C\'ordova","Clay Cordova","Regge Trajectories in $\mathcal{N}=2$ Supersymmetric Yang-Mills Theory","34 pages, 6 figures, + appendices. V2 references corrected","JHEP 1609 (2016) 020","10.1007/JHEP09(2016)020",,"hep-th math.RT","http://arxiv.org/licenses/nonexclusive-distrib/1.0/","  We demonstrate that $\mathcal{N}=2$ supersymmetric non-Abelian gauge theories
have towers of BPS particles obeying a Regge relation, $J \sim m^{2},$ between
their angular momenta, $J,$ and their masses, $m$. For $SU(N)$ Yang-Mills
theories, we estimate the slope of these Regge trajectories using a
non-relativistic quiver quantum mechanics model. Along the way, we also prove
various structure theorems for the quiver moduli spaces that appear in the
calculation.
","[{""version"":""v1"",""created"":""Sun, 8 Feb 2015 05:50:20 GMT""},{""version"":""v2"",""created"":""Tue, 10 Oct 2017 03:44:41 GMT""}]","2017-10-11"
"1502.02212","Lifeng Zhao","Ze Li, Lifeng Zhao","Decay and scattering of solutions to nonlinear Schr\""odinger equations
  with regular potentials for nonlinearities of sharp growth","22 pages",,,,"math.AP","http://arxiv.org/licenses/nonexclusive-distrib/1.0/","  In this paper, we prove the decay and scattering in the energy space for
nonlinear Schr\""odinger equations with regular potentials in $\Bbb R^d$ namely,
$i{\partial _t}u + \Delta u - V(x)u + \lambda |u|^{p - 1}u = 0$. We will prove
decay estimate and scattering of the solution in the small data case when
$1+\frac{2}{d}<p\le1+\frac{4}{d-2}$, $d\ge3$. The index $1+\frac{2}{d}$ is
sharp for scattering concerning the result of W. Strauss [21].
","[{""version"":""v1"",""created"":""Sun, 8 Feb 2015 06:03:08 GMT""},{""version"":""v2"",""created"":""Fri, 10 Mar 2017 04:52:21 GMT""}]","2017-03-13"
"1502.02213","Emmanuel Bossy","Olivier Simandoux, Nicolino Stasio, Jerome Gateau, Jean-Pierre
  Huignard, Christophe Moser, Demetri Psaltis, Emmanuel Bossy","Optical-resolution photoacoustic imaging through thick tissue with a
  thin capillary as a dual optical-in acoustic-out waveguide",,"Appl. Phys. Lett. 106, 094102 (2015)","10.1063/1.4913969",,"physics.optics","http://arxiv.org/licenses/nonexclusive-distrib/1.0/","  We demonstrate the ability to guide high-frequency photoacoustic waves
through thick tissue with a water-filled silica-capillary (150 \mu m inner
diameter and 30 mm long). An optical-resolution photoacoustic image of a 30 \mu
m diameter absorbing nylon thread was obtained by guiding the acoustic waves in
the capillary through a 3 cm thick fat layer. The transmission loss through the
capillary was about -20 dB, much lower than the -120 dB acoustic attenuation
through the fat layer. The overwhelming acoustic attenuation of high-frequency
acoustic waves by biological tissue can therefore be avoided by the use of a
small footprint capillary acoustic waveguide for remote detection. We finally
demonstrate that the capillary can be used as a dual optical-in acoustic-out
waveguide, paving the way for the development of minimally invasive
optical-resolution photoacoustic endoscopes free of any acoustic or optical
elements at their imaging tip.
","[{""version"":""v1"",""created"":""Sun, 8 Feb 2015 06:06:42 GMT""}]","2017-11-15"
"1502.02214","Mohammad Athar SAJJAD","M. Rafi Alam, I. Ruiz Simo, L. Alvarez-Ruso, M. Sajjad Athar and M. J.
  Vicente Vacas","Weak Production of Strange Particles and $\eta$ Mesons off the Nucleon","To appear in AIP Conf. Proc. of the Workshop CETUP*14, 12 Pages, 13
  Figures",,,,"hep-ph","http://arxiv.org/licenses/nonexclusive-distrib/1.0/","  The strange particle production induced by (anti)neutrino off nucleon has
been studied for $|\Delta S|=0$ and $|\Delta S|=1$ channels.
  The reactions those we have considered are for the production of single
kaon/antikaon, eta and associated particle production processes.
  We have developed a microscopical model based on the SU(3) chiral Lagrangian.
The basic parameters of the model are $f_\pi$, the pion decay constant, Cabibbo
angle, the proton and neutron magnetic moments and the axial vector coupling
constants for the baryons octet. For antikaon production we have also included
$\Sigma^*$(1385) resonance and for eta production $S_{11}$(1535) and
$S_{11}$(1650) resonances are included.
","[{""version"":""v1"",""created"":""Sun, 8 Feb 2015 06:12:40 GMT""}]","2015-02-10"
