"1502.02174","Shelby Kimmel","Shelby Kimmel, Cedric Yen-Yu Lin, Han-Hsuan Lin","Oracles with Costs","In this version: typos fixed and motivating examples added",,"10.4230/LIPIcs.TQC.2015.1",,"quant-ph cs.CC","http://arxiv.org/licenses/nonexclusive-distrib/1.0/","  While powerful tools have been developed to analyze quantum query complexity,
there are still many natural problems that do not fit neatly into the black box
model of oracles. We create a new model that allows multiple oracles with
differing costs. This model captures more of the difficulty of certain natural
problems. We test this model on a simple problem, Search with Two Oracles, for
which we create a quantum algorithm that we prove is asymptotically optimal. We
further give some evidence, using a geometric picture of Grover's algorithm,
that our algorithm is exactly optimal.
","[{""version"":""v1"",""created"":""Sat, 7 Feb 2015 19:18:08 GMT""},{""version"":""v2"",""created"":""Tue, 3 Nov 2015 20:56:36 GMT""}]","2016-04-12"
"1502.02175","Carlos Palazuelos","Carlos Palazuelos","Random constructions in Bell inequalities: A survey","Comments are very welcome","Found Phys 48, 857-885 (2018)","10.1007/s10701-017-0135-y",,"quant-ph","http://arxiv.org/licenses/nonexclusive-distrib/1.0/","  Initially motivated by their relevance in foundations of quantum mechanics
and more recently by their applications in different contexts of quantum
information science, violations of Bell inequalities have been extensively
studied during the last years. In particular, an important effort has been made
in order to quantify such Bell violations. Probabilistic techniques have been
heavily used in this context with two different purposes. First, to quantify
how common the phenomenon of Bell violations is; and secondly, to find large
Bell violations in order to better understand the possibilities and limitations
of this phenomenon. However, the strong mathematical content of these results
has discouraged some of the potentially interested readers. The aim of the
present work is to review some of the recent results in this direction by
focusing on the main ideas and removing most of the technical details, to make
the previous study more accessible to a wide audience.
","[{""version"":""v1"",""created"":""Sat, 7 Feb 2015 19:24:03 GMT""}]","2018-10-17"
"1502.02176","Alessandro Sisto","Piotr Przytycki and Alessandro Sisto","A note on acylindrical hyperbolicity of Mapping Class Groups","8 pages, 2 figures",,,,"math.GT math.GR","http://arxiv.org/licenses/nonexclusive-distrib/1.0/","  The aim of this note is to give the simplest possible proof that Mapping
Class Groups of closed hyperbolic surfaces are acylindrically hyperbolic, and
more specifically that their curve graphs are hyperbolic and that
pseudo-Anosovs act on them as loxodromic WPDs.
","[{""version"":""v1"",""created"":""Sat, 7 Feb 2015 19:31:12 GMT""}]","2015-02-10"
"1502.02177","Jaehoon Kim","Jaehoon Kim","Regular subgraphs of uniform hypergraphs",,,"10.1016/j.jctb.2016.03.001",,"math.CO","http://arxiv.org/licenses/nonexclusive-distrib/1.0/","  We prove that for every integer $r\geq 2$, an $n$-vertex $k$-uniform
hypergraph $H$ containing no $r$-regular subgraphs has at most
$(1+o(1)){{n-1}\choose{k-1}}$ edges if $k\geq r+1$ and $n$ is sufficiently
large. Moreover, if $r\in\{3,4\}$, $r\mid k$ and $k,n$ are both sufficiently
large, then the maximum number of edges in an $n$-vertex $k$-uniform hypergraph
containing no $r$-regular subgraphs is exactly ${{n-1} \choose {k-1}}$, with
equality only if all edges contain a specific vertex $v$. We also ask some
related questions.
","[{""version"":""v1"",""created"":""Sat, 7 Feb 2015 19:34:36 GMT""},{""version"":""v2"",""created"":""Thu, 24 Sep 2015 20:59:57 GMT""},{""version"":""v3"",""created"":""Mon, 25 Apr 2016 14:29:10 GMT""}]","2016-04-26"
"1502.02178","Shahar Dobzinski","Shahar Dobzinski and Ami Mor","On the Greedy Algorithm for Combinatorial Auctions with a Random Order",,,,,"cs.GT cs.DS","http://arxiv.org/licenses/nonexclusive-distrib/1.0/","  In this note we study the greedy algorithm for combinatorial auctions with
submodular bidders. It is well known that this algorithm provides an
approximation ratio of $2$ for every order of the items. We show that if the
valuations are vertex cover functions and the order is random then the expected
approximation ratio imrpoves to $\frac 7 4$.
","[{""version"":""v1"",""created"":""Sat, 7 Feb 2015 19:36:15 GMT""}]","2015-02-10"
"1502.02179","Derrick Wing Kwan Ng","Maryna Chynonova, Rania Morsi, Derrick Wing Kwan Ng, and Robert
  Schober","Optimal Multiuser Scheduling Schemes for Simultaneous Wireless
  Information and Power Transfer","Accepted for presentation at the European Signal Processing
  Conference 2015",,,,"cs.IT math.IT","http://arxiv.org/licenses/nonexclusive-distrib/1.0/","  In this paper, we study the downlink multiuser scheduling problem for systems
with simultaneous wireless information and power transfer (SWIPT). We design
optimal scheduling algorithms that maximize the long-term average system
throughput under different fairness requirements, such as proportional fairness
and equal throughput fairness. In particular, the algorithm designs are
formulated as non-convex optimization problems which take into account the
minimum required average sum harvested energy in the system. The problems are
solved by using convex optimization techniques and the proposed optimization
framework reveals the tradeoff between the long-term average system throughput
and the sum harvested energy in multiuser systems with fairness constraints.
Simulation results demonstrate that substantial performance gains can be
achieved by the proposed optimization framework compared to existing suboptimal
scheduling algorithms from the literature.
","[{""version"":""v1"",""created"":""Sat, 7 Feb 2015 19:38:15 GMT""},{""version"":""v2"",""created"":""Mon, 25 May 2015 08:05:20 GMT""}]","2015-05-26"
"1502.02180","Vladislav Yakovlev","Vladislav S. Yakovlev, Stanislav Yu. Kruchinin, Tim Paasch-Colberg,
  Mark I. Stockman, Ferenc Krausz","Ultrafast control of strong-field electron dynamics in solids","This manuscript was prepared for a book ""Ultrafast Ionization
  Dynamics"", which is to be published by Springer",,"10.1007/978-3-319-20173-3_12",,"cond-mat.mes-hall quant-ph","http://arxiv.org/licenses/nonexclusive-distrib/1.0/","  We review theoretical foundations and some recent progress related to the
quest of controlling the motion of charge carriers with intense laser pulses
and optical waveforms. The tools and techniques of attosecond science enable
detailed investigations of a relatively unexplored regime of nondestructive
strong-field effects. Such extremely nonlinear effects may be utilized to steer
electron motion with precisely controlled optical fields and switch electric
currents at a rate that is far beyond the capabilities of conventional
electronics.
","[{""version"":""v1"",""created"":""Sat, 7 Feb 2015 20:05:08 GMT""},{""version"":""v2"",""created"":""Tue, 17 Feb 2015 14:40:54 GMT""}]","2017-03-10"
"1502.02181","Maria Gonzalez J.","K. Astala and M.J. Gonz\'alez","Chord-arc curves and the Beurling transform","27 pages",,"10.1007/s00222-015-0630-8",,"math.CA math.CV","http://arxiv.org/licenses/nonexclusive-distrib/1.0/","  We study the relation between the geometric properties of a
quasicircle~$\Gamma$ and the complex dilatation~$\mu$ of a quasiconformal
mapping that maps the real line onto~$\Gamma$. Denoting by~$S$ the Beurling
transform, we characterize Bishop-Jones quasicircles in terms of the
boundedness of the operator~$(I-\mu S)$ on a particular weighted $L^2$~space,
and chord-arc curves in terms of its invertibility. As an application we
recover the~$L^2$ boundedness of the Cauchy integral on chord-arc curves.
","[{""version"":""v1"",""created"":""Sat, 7 Feb 2015 20:16:25 GMT""}]","2016-08-24"
"1502.02182","Jelena Badnjar","Jelena Badnjar","Comparison of Algorithms for Compressed Sensing of Magnetic Resonance
  Images",,,,,"cs.CV","http://arxiv.org/licenses/nonexclusive-distrib/1.0/","  Magnetic resonance imaging (MRI) is an essential medical tool with inherently
slow data acquisition process. Slow acquisition process requires patient to be
long time exposed to scanning apparatus. In recent years significant efforts
are made towards the applying Compressive Sensing technique to the acquisition
process of MRI and biomedical images. Compressive Sensing is an emerging theory
in signal processing. It aims to reduce the amount of acquired data required
for successful signal reconstruction. Reducing the amount of acquired image
coefficients leads to lower acquisition time, i.e. time of exposition to the
MRI apparatus. Using optimization algorithms, satisfactory image quality can be
obtained from the small set of acquired samples. A number of optimization
algorithms for the reconstruction of the biomedical images is proposed in the
literature. In this paper, three commonly used optimization algorithms are
compared and results are presented on the several MRI images.
","[{""version"":""v1"",""created"":""Sat, 7 Feb 2015 20:24:10 GMT""},{""version"":""v2"",""created"":""Wed, 25 Feb 2015 10:23:15 GMT""},{""version"":""v3"",""created"":""Tue, 3 Mar 2015 22:08:54 GMT""}]","2015-03-05"
"1502.02183","Xuhua He","Xuhua He","Centers and Cocenters of $0$-Hecke algebras","13 pages, a mistake in 4.2 is corrected",,,,"math.RT","http://arxiv.org/licenses/nonexclusive-distrib/1.0/","  In this paper, we give explicit descriptions of the centers and cocenters of
$0$-Hecke algebras associated to finite Coxeter groups.
","[{""version"":""v1"",""created"":""Sat, 7 Feb 2015 20:39:48 GMT""},{""version"":""v2"",""created"":""Tue, 31 Mar 2015 15:26:19 GMT""}]","2015-04-01"
"1502.02184","Xuhua He","Xuhua He and Sian Nie","Cocenters and representations of affine $0$-Hecke algebras","18 pages",,,,"math.RT","http://arxiv.org/licenses/nonexclusive-distrib/1.0/","  In this paper, we study the relation between the cocenter $\overline{\tilde
\ch_0}$ and the finite dimensional representations of an affine $0$-Hecke
algebra $\tilde \ch_0$. As a consequence, we obtain a new criterion on the
supersingular modules: a (virtual) module of $\tilde \ch_0$ is supersingular if
and only if its character vanishes on the non-supersingular part of
$\overline{\tilde \ch_0}$.
","[{""version"":""v1"",""created"":""Sat, 7 Feb 2015 20:42:46 GMT""}]","2015-02-10"
"1502.02185","Greg\'orio Silva Neto","Hil\'ario Alencar and Greg\'orio Silva Neto","Monotonicity formula for complete hypersurfaces in the Hyperbolic space
  and applications","10 pages, final version with minor corrections. To appear in Arkiv
  f\""or Matematik","Arkiv for Matematik, Volume 54, Number 1 (2016), pp 1-11","10.1007/s11512-015-0213-3",,"math.DG","http://arxiv.org/licenses/nonexclusive-distrib/1.0/","  In this paper we prove a monotonicity formula for the integral of the mean
curvature for complete and proper hypersurfaces of the hyperbolic space and, as
consequences, we obtain a lower bound for the integral of the mean curvature
and that the integral of the mean curvature is infinity.
","[{""version"":""v1"",""created"":""Sat, 7 Feb 2015 21:13:38 GMT""},{""version"":""v2"",""created"":""Mon, 4 May 2015 12:11:35 GMT""}]","2017-04-13"
"1502.02186","Mathieu Francoeur","Sheila Edalatpour, Martin Cuma, Tyler Trueax, Roger Backman, and
  Mathieu Francoeur","Convergence analysis of the thermal discrete dipole approximation","46 pages, 12 figures, 3 tables","Physical Review E 91 (2015) 063307","10.1103/PhysRevE.91.063307",,"physics.comp-ph","http://arxiv.org/licenses/nonexclusive-distrib/1.0/","  The thermal discrete dipole approximation (T-DDA) is a numerical approach for
modeling near-field radiative heat transfer in complex three-dimensional
geometries. In this work, the convergence of the T-DDA is investigated by
comparison against the exact results for two spheres separated by a vacuum gap.
The error associated with the T-DDA is reported for various sphere sizes,
refractive indices and vacuum gap thicknesses. The results reveal that for a
fixed number of subvolumes, the accuracy of the T-DDA degrades as the
refractive index and the sphere diameter to gap ratio increase. A converging
trend is observed as the number of subvolumes increases. The large
computational requirements associated with increasing the number of subvolumes,
and the shape error induced by large sphere diameter to gap ratios, are
mitigated by using a nonuniform discretization scheme. Nonuniform
discretization is shown to significantly accelerate the convergence of the
T-DDA, and is thus recommended for near-field thermal radiation simulations.
Errors less than 5% are obtained in 74% of the cases studied by using up to
82712 subvolumes. Additionally, the convergence analysis demonstrates that the
T-DDA is very accurate when dealing with surface polariton resonant modes
dominating radiative heat transfer in the near field.
","[{""version"":""v1"",""created"":""Sat, 7 Feb 2015 21:24:43 GMT""},{""version"":""v2"",""created"":""Sun, 24 May 2015 16:42:34 GMT""}]","2015-10-19"
"1502.02187","Riley Thornton","Riley Thornton","Cubes and Their Centers","(10/9/16) Error in box-counting results corrected; numerous small
  changes made in response to referee report (2/15/2017) Typos corrected.
  Formatting changed slightly","Acta Mathematica Hungarica 152(2) (2017) 291-313","10.1007/s10474-017-0729-z",,"math.MG","http://arxiv.org/licenses/nonexclusive-distrib/1.0/","  We study the relationship between the sizes of sets $B,S$ in $\mathbb{R}^n$
where $B$ contains the $k$-skeleton of an axes-parallel cube around each point
in $S$, generalizing the results of Keleti, Nagy, and Shmerkin about such sets
in the plane. We find sharp estimates for the possible packing and box-counting
dimensions of $B$ and $S$. These estimates follow from related cardinality
bounds for sets containing the discrete skeleta of cubes around a finite set of
a given size. The Katona-Kruskal theorem from hypergraph theory plays an
important role. We also find partial results for the Hausdorff dimension and
settle an analogous question for the dual polytope of the cube, the orthoplex.
","[{""version"":""v1"",""created"":""Sat, 7 Feb 2015 22:06:09 GMT""},{""version"":""v2"",""created"":""Sun, 9 Oct 2016 20:26:18 GMT""},{""version"":""v3"",""created"":""Thu, 16 Feb 2017 03:33:56 GMT""}]","2017-09-08"
"1502.02188","Salimeh Yasaei Sekeh","Yuri Suhov, Salimeh Yasaei Sekeh, Mark Kelbert","Entropy-power inequality for weighted entropy","17 pages, 2 figures",,,,"cs.IT math.IT math.PR","http://arxiv.org/licenses/nonexclusive-distrib/1.0/","  We analyse an analog of the entropy-power inequality for the weighted
entropy.
","[{""version"":""v1"",""created"":""Sat, 7 Feb 2015 22:22:10 GMT""},{""version"":""v2"",""created"":""Thu, 19 Feb 2015 11:59:25 GMT""},{""version"":""v3"",""created"":""Mon, 9 Mar 2015 19:54:27 GMT""}]","2015-03-10"
"1502.02189","Christian Schneider","Justin Jeet and Christian Schneider and Scott T. Sullivan and Wade G.
  Rellergert and Saed Mirzadeh and A. Cassanho and H. P. Jenssen and Eugene V.
  Tkalya and Eric R. Hudson","Results of a direct search using synchrotron radiation for the
  low-energy $^{229}$Th nuclear isomeric transition","6 pages, 4 figures",,,,"physics.atom-ph nucl-ex","http://arxiv.org/licenses/nonexclusive-distrib/1.0/","  We report the results of a direct search for the $^{229}$Th ($I^{p} =
3/2^+\leftarrow 5/2^+$) nuclear isomeric transition, performed by exposing
$^{229}$Th-doped LiSrAlF$_6$ crystals to tunable vacuum-ultraviolet synchrotron
radiation and observing any resulting fluorescence. We also use existing
nuclear physics data to establish a range of possible transition strengths for
the isomeric transition. We find no evidence for the thorium nuclear transition
between $7.3 {eV}$ and $8.8 {eV}$ with transition lifetime $(1-2){s} \lesssim
\tau \lesssim (2000-5600){s}$. This measurement excludes roughly half of the
favored transition search area and can be used to direct future searches.
","[{""version"":""v1"",""created"":""Sat, 7 Feb 2015 22:25:03 GMT""},{""version"":""v2"",""created"":""Wed, 18 Feb 2015 02:41:36 GMT""}]","2015-02-19"
"1502.02190","Agnes Beaudry","Agnes Beaudry","The Chromatic Splitting Conjecture at n=p=2","Revised version. To appear in Geometry & Topology","Geom. Topol. 21 (2017) 3213-3230","10.2140/gt.2017.21.3213",,"math.AT","http://arxiv.org/licenses/nonexclusive-distrib/1.0/","  We show that the strongest form of Hopkins' chromatic splitting conjecture,
as stated by Hovey, cannot hold at chromatic level n=2 at the prime p=2. More
precisely, for V(0) the mod 2 Moore spectrum, we prove that the kth homotopy
group of L_1L_{K(2)}V(0) is not zero when k is congruent to -3 modulo 8. We
explain how this contradicts the decomposition of L_1L_{K(2)}S predicted by the
chromatic splitting conjecture.
","[{""version"":""v1"",""created"":""Sat, 7 Feb 2015 22:39:02 GMT""},{""version"":""v2"",""created"":""Thu, 27 Aug 2015 12:33:40 GMT""},{""version"":""v3"",""created"":""Fri, 11 Aug 2017 14:52:47 GMT""}]","2018-03-16"
"1502.02191","Harris Georgiou","Harris V. Georgiou","Collective decision efficiency and optimal voting mechanisms: A
  comprehensive overview for multi-classifier models",,,,"HG/GT.0214.01v1","cs.GT","http://creativecommons.org/licenses/by/3.0/","  A new game-theoretic approach for combining multiple classifiers is proposed.
A short introduction in Game Theory and coalitions illustrate the way any
collective decision scheme can be viewed as a competitive game of coalitions
that are formed naturally when players state their preferences. The winning
conditions and the voting power of each player are studied under the scope of
voting power indices, as well and the collective competence of the group.
Coalitions and power indices are presented in relation to the Condorcet
criterion of optimality in voting systems, and weighted Borda count models are
asserted as a way to implement them in practice. A special case of coalition
games, the weighted majority games (WMG) are presented as a restricted
realization in dichotomy choice situations. As a result, the weighted majority
rules (WMR), an extended version of the simple majority rules, are asserted as
the theoretically optimal and complete solution to this type of coalition
gaming. Subsequently, a generalized version of WMRs is suggested as the means
to design a voting system that is optimal in the sense of both the correct
classification criterion and the Condorcet efficiency criterion. In the scope
of Pattern Recognition, a generalized risk-based approach is proposed as the
framework upon which any classifier combination scheme can be applied. A new
fully adaptive version of WMRs is proposed as a statistically invariant way of
adjusting the design process of the optimal WMR to the arbitrary
non-symmetrical properties of the underlying feature space. SVM theory is
associated with properties and conclusions that emerge from the game-theoretic
approach of the classification in general, while the theoretical and practical
implications of employing SVM experts in WMR combination schemes are briefly
discussed. Finally, a summary of the most important issues for further research
is presented.
","[{""version"":""v1"",""created"":""Sat, 7 Feb 2015 22:48:52 GMT""}]","2015-02-10"
"1502.02192","Agnes Szendrei","Keith A. Kearnes, Agnes Szendrei","Dualizable algebras with parallelogram terms",,,,,"math.RA","http://arxiv.org/licenses/nonexclusive-distrib/1.0/","  We prove that if A is a finite algebra with a parallelogram term that
satisfies the split centralizer condition, then A is dualizable. This yields
yet another proof of the dualizability of any finite algebra with a near
unanimity term, but more importantly proves that every finite module, group or
ring in a residually small variety is dualizable.
","[{""version"":""v1"",""created"":""Sat, 7 Feb 2015 23:00:44 GMT""},{""version"":""v2"",""created"":""Wed, 30 Dec 2015 23:20:06 GMT""}]","2016-01-01"
"1502.02193","Liane Gabora","Liane Gabora","The Silver Lining Around Fearful Living","4 pages, Psychology Today (online).
  https://www.psychologytoday.com/blog/mindbloggling/201502/the-silver-lining-around-fearful-living-0
  (2015)",,,,"cs.AI","http://arxiv.org/licenses/nonexclusive-distrib/1.0/","  This paper discusses in layperson's terms human and computational studies of
the impact of threat and fear on exploration and creativity. A first study
showed that both killifish from a lake with predators and from a lake without
predators explore a new environment to the same degree and plotting number of
new spaces covered over time generates a hump-shaped curve. However, for the
fish from the lake with predators the curve is shifted to the right; they take
longer. This pattern was replicated by a computer model of exploratory behavior
varying only one parameter, the fear parameter. A second study showed that
stories inspired by threatening photographs were rated as more creative than
stories inspired by non-threatening photographs. Various explanations for the
findings are discussed.
","[{""version"":""v1"",""created"":""Sat, 7 Feb 2015 23:27:48 GMT""}]","2015-02-10"
"1502.02194","Diego J Carrascal","Diego Carrascal, Jaime Ferrer, Justin C. Smith, Kieron Burke","The Hubbard Dimer: A density functional case study of a many-body
  problem",,,"10.1088/0953-8984/27/39/393001",,"cond-mat.str-el physics.chem-ph","http://arxiv.org/licenses/nonexclusive-distrib/1.0/","  This review explains the relationship between density functional theory and
strongly correlated models using the simplest possible example, the two-site
Hubbard model. The relationship to traditional quantum chemistry is included.
Even in this elementary example, where the exact ground-state energy and site
occupations can be found analytically, there is much to be explained in terms
of the underlying logic and aims of Density Functional Theory. Although the
usual solution is analytic, the density functional is given only implicitly. We
overcome this difficulty using the Levy-Lieb construction to create a
parametrization of the exact function with negligible errors. The symmetric
case is most commonly studied, but we find a rich variation in behavior by
including asymmetry, as strong correlation physics vies with charge-transfer
effects. We explore the behavior of the gap and the many-body Green's function,
demonstrating the `failure' of the Kohn-Sham method to reproduce the
fundamental gap. We perform benchmark calculations of the occupation and
components of the KS potentials, the correlation kinetic energies, and the
adiabatic connection. We test several approximate functionals (restricted and
unrestricted Hartree-Fock and Bethe Ansatz Local Density Approximation) to show
their successes and limitations. We also discuss and illustrate the concept of
the derivative discontinuity. Useful appendices include analytic expressions
for Density Functional energy components, several limits of the exact
functional (weak- and strong-coupling, symmetric and asymmetric), the Kohn-Sham
hopping energy functional for 3 sites, various adiabatic connection results,
proofs of exact conditions for this model, and the origin of the Hubbard model
from a minimal basis model for stretched H$_2$.
","[{""version"":""v1"",""created"":""Sat, 7 Feb 2015 23:39:52 GMT""}]","2015-09-30"
"1502.02195","Jose Edgar Madriz Aguilar","Jose Edgar Madriz Aguilar","New effective coupled $F(^{(4)}\!R,\varphi)$ modified gravity from
  $f(^{(5)}\!R)$ gravity in five dimensions","6 pages, no figures",,,,"gr-qc","http://arxiv.org/licenses/nonexclusive-distrib/1.0/","  We obtain a new kind of $F(^{(4)}\!R,\varphi)$ modified gravity theory as an
effective four-dimensional (4D) theory derived from $f(^{(5)}\!R)$ gravity in
five dimensions (5D). This new theory exhibits a different matter coupling than
the one in BBHL theory. We show that the field equations of the Wesson's
induced matter theory and of some braneworld scenarios can be obtained as
maximally symmetric solutions of the $f(^{(5)}\!R)$ theory. We found criteria
for the Goldov-Kawasaki instabilities for both the $f(^{(5)}\!R)$ and the
$F(^{(4)}\!R,\varphi)$ theories. We demonstrate that under certain conditions
imposed on the 5D geometry it is possible to interpret the
$F(^{(4)}\!R,\varphi)$ theory as a modified gravity theory with dynamical
coefficients, making this new theory a viable candidate to address the present
accelerating cosmic expansion issue.
","[{""version"":""v1"",""created"":""Sat, 7 Feb 2015 23:40:48 GMT""},{""version"":""v2"",""created"":""Thu, 23 Apr 2015 22:37:31 GMT""}]","2015-04-27"
