"1502.02232","Ilan Newman","Ilan I. Newman and Yuri Rabinovich","On Connectivity of the Facet Graphs of Simplicial Complexes","18 pages",,,,"math.CO","http://arxiv.org/licenses/nonexclusive-distrib/1.0/","  The paper studies the connectivity properties of facet graphs of simplicial
complexes of combinatorial interest. In particular, it is shown that the facet
graphs of $d$-cycles, $d$-hypertrees and $d$-hypercuts are, respectively,
$(d+1)$, $d$, and $(n-d-1)$-vertex-connected. It is also shown that the facet
graph of a $d$-cycle cannot be split into more than $s$ connected components by
removing at most $s$ vertices. In addition, the paper discusses various related
issues, as well as an extension to cell-complexes.
","[{""version"":""v1"",""created"":""Sun, 8 Feb 2015 10:20:21 GMT""}]","2015-02-10"
"1502.02233","Ognjen Arandjelovi\'c PhD","Adham Beykikhoshk, Ognjen Arandjelovic, Dinh Phung, Svetha Venkatesh","Hierarchical Dirichlet process for tracking complex topical structure
  evolution and its application to autism research literature","In Proc. Pacific-Asia Conference on Knowledge Discovery and Data
  Mining (PAKDD), 2015",,,,"cs.IR cs.CL","http://arxiv.org/licenses/nonexclusive-distrib/1.0/","  In this paper we describe a novel framework for the discovery of the topical
content of a data corpus, and the tracking of its complex structural changes
across the temporal dimension. In contrast to previous work our model does not
impose a prior on the rate at which documents are added to the corpus nor does
it adopt the Markovian assumption which overly restricts the type of changes
that the model can capture. Our key technical contribution is a framework based
on (i) discretization of time into epochs, (ii) epoch-wise topic discovery
using a hierarchical Dirichlet process-based model, and (iii) a temporal
similarity graph which allows for the modelling of complex topic changes:
emergence and disappearance, evolution, and splitting and merging. The power of
the proposed framework is demonstrated on the medical literature corpus
concerned with the autism spectrum disorder (ASD) - an increasingly important
research subject of significant social and healthcare importance. In addition
to the collected ASD literature corpus which we will make freely available, our
contributions also include two free online tools we built as aids to ASD
researchers. These can be used for semantically meaningful navigation and
searching, as well as knowledge discovery from this large and rapidly growing
corpus of literature.
","[{""version"":""v1"",""created"":""Sun, 8 Feb 2015 10:25:20 GMT""}]","2015-02-10"
"1502.02234","Moreno Ambrosin","Moreno Ambrosin and Mauro Conti and Fabio De Gaspari and Radha
  Poovendran","LineSwitch: Efficiently Managing Switch Flow in Software-Defined
  Networking while Effectively Tackling DoS Attacks","In Proceedings of the 10th ACM Symposium on Information, Computer and
  Communications Security (ASIACCS 2015). To appear",,,,"cs.NI","http://arxiv.org/licenses/nonexclusive-distrib/1.0/","  Software Defined Networking (SDN) is a new networking architecture which aims
to provide better decoupling between network control (control plane) and data
forwarding functionalities (data plane). This separation introduces several
benefits, such as a directly programmable and (virtually) centralized network
control. However, researchers showed that the required communication channel
between the control and data plane of SDN creates a potential bottleneck in the
system, introducing new vulnerabilities. Indeed, this behavior could be
exploited to mount powerful attacks, such as the control plane saturation
attack, that can severely hinder the performance of the whole network.
  In this paper we present LineSwitch, an efficient and effective solution
against control plane saturation attack. LineSwitch combines SYN proxy
techniques and probabilistic blacklisting of network traffic. We implemented
LineSwitch as an extension of OpenFlow, the current reference implementation of
SDN, and evaluate our solution considering different traffic scenarios (with
and without attack). The results of our preliminary experiments confirm that,
compared to the state-of-the-art, LineSwitch reduces the time overhead up to
30%, while ensuring the same level of protection.
","[{""version"":""v1"",""created"":""Sun, 8 Feb 2015 10:29:58 GMT""}]","2015-02-10"
"1502.02235","Stefano Longhi","Stefano Longhi","Non-reciprocal transmission in photonic lattices based on unidirectional
  coherent perfect absorption","5 pages, 5 figures","Opt. Lett. 40, 1278 (2015)","10.1364/OL.40.001278",,"physics.optics quant-ph","http://arxiv.org/licenses/nonexclusive-distrib/1.0/","  A method for realizing asymmetric (one-way) transmission of discretized light
in modulated, linear and purely passive optical lattices is suggested, which
exploits the idea of unidirectional coherent perfect absorption. The system
consists of a linear photonic lattice of coupled resonators or waveguides, side
coupled to a chain of lossy elements, in which light can avoid the occupation
of the dissipative sites when propagating in one way, but not in the opposite
one. Non-reciprocity requires modulation of the resonator/waveguide parameters,
realizing a dissipative optical Aharonov-Bohm diode with non-reciprocal
behavior.
","[{""version"":""v1"",""created"":""Sun, 8 Feb 2015 10:36:25 GMT""}]","2016-03-07"
"1502.02236","Sungroh Yoon","Sungroh Yoon, Nahmsuk Oh, Peivand Tehrani, Eui-Young Chung, and
  Giovanni De Micheli","FRAME: Fast and Realistic Attacker Modeling and Evaluation for Temporal
  Logical Correlation in Static Noise",,,,,"cs.OH","http://arxiv.org/licenses/nonexclusive-distrib/1.0/","  We propose a method called Fast and Realistic Attacker Modeling and
Evaluation (FRAME) that can reduce pessimism in static noise analysis by
exploiting temporal logical correlation of attackers and using novel techniques
termed envelopes and $\sigma$ functions. Unlike conventional pruning-based
approaches, FRAME efficiently considers all relevant attackers, thereby
producing more realistic results. FRAME was tested with complex industrial
design and successfully reduced the pessimism of conventional techniques by
30.4% on average, with little computational overhead.
","[{""version"":""v1"",""created"":""Sun, 8 Feb 2015 10:44:55 GMT""}]","2015-02-10"
"1502.02237","Hossein Esmaili Koshkoshi","Hossein Sahleh, Hossein Esmaili Koshkoshi","Standard Projective Simplicial Kernels and the Second Abelian Cohomology
  of Topological Groups","12 pages",,,,"math.GR math.GN","http://arxiv.org/licenses/nonexclusive-distrib/1.0/","  Let $A$ be an abelian topological $G$-module. We give an interpretion for the
second cohomology, $H^{2}(G,A)$, of $G$ with coefficients in $A$. As a result
we show that if $P$ is a projective topological group, then $H^{2}(P,A)=0$ for
every abelian topological $P$-module $A$.
","[{""version"":""v1"",""created"":""Sun, 8 Feb 2015 10:58:39 GMT""}]","2015-02-10"
"1502.02238","Yik Man Chiang","Yik-Man Chiang, Shaoji Feng","Nevanlinna theory of the Askey-Wilson divided difference operator","Finalised version. To appear in Advances in Mathematics",,,,"math.CV","http://arxiv.org/licenses/nonexclusive-distrib/1.0/","  This paper establishes a version of Nevanlinna theory based on Askey-Wilson
divided difference operator for meromorphic functions of finite logarithmic
order in the complex plane $\mathbb{C}$. A second main theorem that we have
derived allows us to define an Askey-Wilson type Nevanlinna deficiency which
gives a new interpretation that one should regard many important infinite
products arising from the study of basic hypergeometric series as
zero/pole-scarce. That is, their zeros/poles are indeed deficient in the sense
of difference Nevanlinna theory. A natural consequence is a version of
Askey-Wilosn type Picard theorem. We also give an alternative and
self-contained characterisation of the kernel functions of the Askey-Wilson
operator. In addition we have established a version of unicity theorem in the
sense of Askey-Wilson. This paper concludes with an application to difference
equations generalising the Askey-Wilson second-order divided difference
equation.
","[{""version"":""v1"",""created"":""Sun, 8 Feb 2015 11:05:32 GMT""},{""version"":""v2"",""created"":""Thu, 21 Apr 2016 16:13:15 GMT""},{""version"":""v3"",""created"":""Mon, 18 Sep 2017 13:22:33 GMT""},{""version"":""v4"",""created"":""Sat, 3 Feb 2018 17:30:01 GMT""}]","2018-02-06"
"1502.02239","Sungroh Yoon","Eui-Young Chung, Chang-Il Son, Kwanhu Bang, Dong Kim, Soong-Mann Shin,
  and Sungroh Yoon","A High-Performance Solid-State Disk with Double-Data-Rate NAND Flash
  Memory",,,,,"cs.AR","http://arxiv.org/licenses/nonexclusive-distrib/1.0/","  We propose a novel solid-state disk (SSD) architecture that utilizes a
double-data-rate synchronous NAND flash interface for improving read and write
performance. Unlike the conventional design, the data transfer rate in the
proposed design is doubled in harmony with synchronous signaling. The new
architecture does not require any extra pins with respect to the conventional
architecture, thereby guaranteeing backward compatibility. For performance
evaluation, we simulated various SSD designs that adopt the proposed
architecture and measured their performance in terms of read/write bandwidths
and energy consumption. Both NAND flash cell types, namely single-level cells
(SLCs) and multi-level cells (MLCs), were considered. In the experiments using
SLC-type NAND flash chips, the read and write speeds of the proposed
architecture were 1.65-2.76 times and 1.09-2.45 times faster than those of the
conventional architecture, respectively. Similar improvements were observed for
the MLC-based architectures tested. It was particularly effective to combine
the proposed architecture with the way-interleaving technique that multiplexes
the data channel between the controller and each flash chip. For a reasonably
high degree of way interleaving, the read/write performance and the energy
consumption of our approach were notably better than those of the conventional
design.
","[{""version"":""v1"",""created"":""Sun, 8 Feb 2015 11:07:50 GMT""}]","2015-02-10"
"1502.02240","Daniel Kasprowski","Daniel Kasprowski","On the K-theory of linear groups","14 pages, to appear in Annals of K-Theory","Annals of K-Theory 1 (2016), no. 4, 441-456","10.2140/akt.2016.1.441",,"math.AT math.KT","http://arxiv.org/licenses/nonexclusive-distrib/1.0/","  We prove that for a finitely generated linear group G over a field of
positive characteristic the family of quotients by finite subgroups has finite
asymptotic dimension. We use this to show that the K-theoretic assembly map for
the family of finite subgroups is split injective for every finitely generated
linear group G over a commutative ring with unit under the assumption that G
admits a finite-dimensional model for the classifying space for the family of
finite subgroups. Furthermore, we prove that this is the case if and only if an
upper bound on the rank of the solvable subgroups of G exists.
","[{""version"":""v1"",""created"":""Sun, 8 Feb 2015 11:50:14 GMT""},{""version"":""v2"",""created"":""Fri, 23 Oct 2015 10:31:19 GMT""}]","2021-05-28"
"1502.02241","Giuseppe Leto Dr.","Giuseppe Leto, Ricardo Zanmar Sanchez, Giancarlo Bellassai, Pietro
  Bruno, Maria Concetta Maccarone, Eugenio Martinetti (for the ASTRI
  Collaboration and the CTA Consortium)","All Sky Camera, LIDAR and Electric Field Meter: auxiliary instruments
  for the ASTRI SST-2M prototype","Proceedings of the 2nd AtmoHEAD Conference, Padova (Italy) May 19-21,
  2014",,"10.1051/epjconf/20158902006",,"astro-ph.IM","http://arxiv.org/licenses/nonexclusive-distrib/1.0/","  ASTRI SST-2M is the end-to-end prototype telescope of the Italian National
Institute of Astro- physics, INAF, designed to investigate the 10-100 TeV band
in the framework of the Cherenkov Telescope Array, CTA. The ASTRI SST-2M
telescope has been installed in Italy in September 2014, at the INAF ob-
serving station located at Serra La Nave on Mount Etna. The telescope is
foreseen to be completed and fully operative in spring 2015 including auxiliary
instrumentation needed to support both operations and data anal- ysis. In this
contribution we present the current status of a sub-set of the auxiliary
instruments that are being used at the Serra La Nave site, namely an All Sky
Camera, an Electric Field Meter and a Raman Lidar devoted, together with
further instrumentation, to the monitoring of the atmospheric and environmental
conditions. The data analysis techniques under development for these
instruments could be applied at the CTA sites, where similar auxiliary
instrumentation will be installed.
","[{""version"":""v1"",""created"":""Sun, 8 Feb 2015 11:52:10 GMT""}]","2019-08-14"
"1502.02242","Jelle Hellings","Jelle Hellings","Querying for Paths in Graphs using Context-Free Path Queries",,,,,"cs.DB cs.DS","http://arxiv.org/licenses/nonexclusive-distrib/1.0/","  Navigational queries for graph-structured data, such as the regular path
queries and the context-free path queries, are usually evaluated to a relation
of node-pairs $(m, n)$ such that there is a path from $m$ to $n$ satisfying the
conditions of the query. Although this relational query semantics has practical
value, we believe that the relational query semantics can only provide limited
insight in the structure of the graph data. To address the limits of the
relational query semantics, we introduce the all-path query semantics and the
single-path query semantics. Under these path-based query semantics, a query is
evaluated to all paths satisfying the conditions of the query, or,
respectively, to a single such path.
  While focusing on context-free path queries, we provide a formal framework
for evaluating queries on graphs using both path-based query semantics. For the
all-path query semantics, we show that the result of a query can be represented
by a finite context-free grammar annotated with node-information relevant for
deriving each path in the query result. For the single-path query semantics, we
propose to search for a path of minimum length. We reduce the problem of
finding such a path of minimum length to finding a string of minimum length in
a context-free language, and for deriving such a string we propose a novel
algorithm.
  Our initial results show that the path-based query semantics have added
practical value and that query evaluation for both path-based query semantics
is feasible, even when query results grow very large. For the single-path query
semantics, determining strict worst-case upper bounds on the size of the query
result remains the focus of future work.
","[{""version"":""v1"",""created"":""Sun, 8 Feb 2015 12:11:33 GMT""},{""version"":""v2"",""created"":""Sun, 31 Jan 2016 14:43:13 GMT""}]","2016-02-02"
"1502.02243","Mahito Sasada Dr.","M. Sasada, S. Mineshige, S. Yamada, H. Negoro","Shot Analysis of Kepler Blazar W2R 1926+42","2014 Fermi Symposium proceedings - eConf C14102.1",,,,"astro-ph.HE","http://arxiv.org/licenses/nonexclusive-distrib/1.0/","  Blazars show rapid and violent variabilities, which timescale are often less
than a day. We studied intraday variations by applying a shot analysis
technique to Kepler monitoring of blazar W2R 1926+42 in Quarter 14. We obtained
a mean profile calculated from 195 rapid variations. The mean profile shows
three components; one is a sharp structure distributed within $\pm$0.1 day of
the peak, and two slow-varying components. This spiky-peak component reflects
features of rapid variations directly. The profile of peak component shows an
exponential rise and decay of which timescales are different, 0.0416 and 0.0588
day respectively. This component is too sharp to represent a standard function
which is often used to express blazar variations. This asymmetric profile at
the peak is difficult to be explained by a simple variation of the Doppler
factor by changing a geometry of the emitting region. This result indicates
that intraday variations arise from a production of high-energy accelerated
particles in the jet.
","[{""version"":""v1"",""created"":""Sun, 8 Feb 2015 12:41:10 GMT""}]","2015-02-10"
"1502.02244","Ryo Nagai","Junji Hisano, Ryo Nagai, and Natsumi Nagata","Effective Theories for Dark Matter Nucleon Scattering","23 pages, 9 figures. Version accepted for publication in JHEP",,"10.1007/JHEP05(2015)037","FTPI-MINN-15/03, IPMU15-0012","hep-ph","http://arxiv.org/licenses/nonexclusive-distrib/1.0/","  We reformulate the calculation of the dark matter-nucleon scattering cross
sections based on the method of effective field theories. We assume that the
scatterings are induced by the exchange of colored mediators, and construct the
effective theories by integrating out the colored particles. All of the leading
order matching conditions as well as the renormalization group equations are
presented. We consider a Majorana fermion, and real scalar and vector bosons
for the dark matter and show the results for each case. The treatment for the
twist-2 operators is discussed in detail, and it is shown that the scale of
evaluating their nucleon matrix elements does not have to be the hadronic
scale. The effects of the QCD corrections are evaluated on the assumption that
the masses of the colored mediators are much heavier than the electroweak
scale. Our formulation is systematic and model-independent, and thus suitable
to be implemented in numerical packages, such as micrOMEGAs and DarkSUSY.
","[{""version"":""v1"",""created"":""Sun, 8 Feb 2015 13:12:02 GMT""},{""version"":""v2"",""created"":""Mon, 11 May 2015 15:23:48 GMT""}]","2015-06-11"
"1502.02245","Yuantao Gu","Xinyue Shen and Yuantao Gu","Restricted Isometry Property of Subspace Projection Matrix Under Random
  Compression","11 pages, 1 figure, journal paper",,"10.1109/LSP.2015.2402206",,"cs.IT math.IT","http://arxiv.org/licenses/nonexclusive-distrib/1.0/","  Structures play a significant role in the field of signal processing. As a
representative of structural data, low rank matrix along with its restricted
isometry property (RIP) has been an important research topic in compressive
signal processing. Subspace projection matrix is a kind of low rank matrix with
additional structure, which allows for further reduction of its intrinsic
dimension. This leaves room for improving its own RIP, which could work as the
foundation of compressed subspace projection matrix recovery. In this work, we
study the RIP of subspace projection matrix under random orthonormal
compression. Considering the fact that subspace projection matrices of $s$
dimensional subspaces in $\mathbb{R}^N$ form an $s(N-s)$ dimensional
submanifold in $\mathbb{R}^{N\times N}$, our main concern is transformed to the
stable embedding of such submanifold into $\mathbb{R}^{N\times N}$. The result
is that by $O(s(N-s)\log N)$ number of random measurements the RIP of subspace
projection matrix is guaranteed.
","[{""version"":""v1"",""created"":""Sun, 8 Feb 2015 13:21:11 GMT""}]","2015-06-23"
"1502.02246","Dong-Liang Fang Dr","Dong-Liang Fang and B. Alex Brown","Effect of first forbidden decays on the shape of neutrino spectra","5 pages, two figures, accept by Phy. Rev. C","Erratum: Phys. Rev. C93; 049903(2016)","10.1103/PhysRevC.91.025503",,"nucl-th hep-ph","http://arxiv.org/licenses/nonexclusive-distrib/1.0/","  We examine the effect of First Forbidden (FF) decays on $\beta$-decay
neutrino spectra by performing microscopic nuclear structure calculations. By
analyzing the FF decay branches of even-even nuclei we conclude that FF decays
may be responsible for part of the missing neutrinos in the so called ""Reactor
Neutrino Anomaly"". Further calculations and more experimental data are needed
for a firm conclusion.
","[{""version"":""v1"",""created"":""Sun, 8 Feb 2015 13:32:19 GMT""}]","2016-05-24"
"1502.02247","Bayu Jayawardhana","Arjan van der Schaft, Shodhan Rao, Bayu Jayawardhana","A network dynamics approach to chemical reaction networks","18 pages",,,,"math.DS math.OC","http://arxiv.org/licenses/nonexclusive-distrib/1.0/","  A crisp survey is given of chemical reaction networks from the perspective of
general nonlinear network dynamics, in particular of consensus dynamics. It is
shown how by starting from the complex-balanced assumption the reaction
dynamics governed by mass action kinetics can be rewritten into a form which
allows for a very simple derivation of a number of key results in chemical
reaction network theory, and which directly relates to the thermodynamics of
the system. Central in this formulation is the definition of a balanced
Laplacian matrix on the graph of chemical complexes together with a resulting
fundamental inequality. This directly leads to the characterization of the set
of equilibria and their stability. Both the form of the dynamics and the
deduced dynamical behavior are very similar to consensus dynamics. The
assumption of complex-balancedness is revisited from the point of view of
Kirchhoff's Matrix Tree theorem, providing a new perspective. Finally, using
the classical idea of extending the graph of chemical complexes by an extra
'zero' complex, a complete steady-state stability analysis of mass action
kinetics reaction networks with constant inflows and mass action outflows is
given.
","[{""version"":""v1"",""created"":""Sun, 8 Feb 2015 13:34:59 GMT""}]","2015-02-10"
"1502.02248","Konstantin Malyshev","K. V. Malyshev","Quasiperiodic AlGaAs superlattices for neuromorphic networks and
  nonlinear control systems","19 pages, 7 figures","Journal of Applied Physics 117, 044303 (2015)","10.1063/1.4906551",,"cond-mat.mes-hall nlin.CD quant-ph","http://arxiv.org/licenses/nonexclusive-distrib/1.0/","  The application of quasiperiodic AlGaAs superlattices as a nonlinear element
of the FitzHugh-Nagumo neuromorphic network is proposed and theoretically
investigated on the example of Fibonacci and figurate superlattices. The
sequences of symbols for the figurate superlattices were produced by
decomposition of the Fibonacci superlattices' symbolic sequences. A length of
each segment of the decomposition was equal to the corresponding figurate
number. It is shown that a nonlinear network based upon Fibonacci and figurate
superlattices provides better parallel filtration of a half-tone picture than a
network based upon traditional diodes which have cubic voltage-current
characteristics. It was found that the figurate superlattice F011(1) as a
nonlinear network's element provides the filtration error almost twice less
than the conventional ""cubic"" diode. These advantages are explained by a
wavelike shape of the decreasing part of the quasiperiodic superlattice's
voltage-current characteristic, which leads to multistability of the network's
cell. This multistability promises new interesting nonlinear dynamical
phenomena. A variety of wavy forms of voltage-current characteristics opens up
new interesting possibilities for quasiperiodic superlattices and especially
for figurate superlattices in many areas - from nervous system modeling to
nonlinear control systems development
","[{""version"":""v1"",""created"":""Sun, 8 Feb 2015 13:40:21 GMT""}]","2015-02-13"
"1502.02249","Ming Gao","Haodong Jiang, Ming Gao, Bao Yan, Weilong Wang, and Zhi Ma","Universally-composable finite-key analysis for efficient four-intensity
  decoy-state quantum key distribution","accepted by Eur. Phys. J. D",,"10.1140/epjd/e2016-60655-2",,"quant-ph","http://arxiv.org/licenses/nonexclusive-distrib/1.0/","  We propose an efficient four-intensity decoy-state BB84 protocol and derive
concise security bounds for this protocol with the universally composable
finite-key analysis method. Comparing with the efficient three-intensity
protocol, we find that our efficient four-intensity protocol can increase the
secret key rate by at least $30\%$. Particularly, this increasing rate of
secret key rate will be raised as the transmission distance increases. At a
large transmission distance, our efficient four-intensity protocol can improve
the performance of quantum key distribution profoundly.
","[{""version"":""v1"",""created"":""Sun, 8 Feb 2015 13:43:38 GMT""},{""version"":""v2"",""created"":""Tue, 15 Mar 2016 02:40:22 GMT""}]","2016-03-16"
"1502.02250","Hossein Dehghan","Hossein Dehghan","Characterizing of Inner Product Spaces by the Mapping $n_{x,y}$",,,,,"math.FA math.CA","http://arxiv.org/licenses/nonexclusive-distrib/1.0/","  For the vectors $x$ and $y$ in a normed linear spaces $X$, the mapping
$n_{x,y}: \mathbb{R}\to \mathbb{R}$ is defined by $n_{x,y}(t)=\|x+ty\|$. In
this note, comparing the mappings $n_{x,y}$ and $n_{y,x}$ we obtain a simple
and useful characterization of inner product spaces.
","[{""version"":""v1"",""created"":""Sun, 8 Feb 2015 13:47:21 GMT""}]","2015-02-10"
