"1502.06303","Eric Flesch","Eric W. Flesch","The Half Million Quasars (HMQ) Catalogue","14 pages, 11 tables, 5 figures. Accepted for publication by
  Publications of the Astronomical Society of Australia (PASA)",,"10.1017/pasa.2015.10",,"astro-ph.GA astro-ph.CO","http://arxiv.org/licenses/nonexclusive-distrib/1.0/","  A quasar catalogue is presented with a total of 510764 objects including
424748 type 1 QSOs and 26623 type 1 AGN complete from the literature to 25
January 2015. Also included are 25015 high-confidence SDSS-based photometric
quasars with radio/X-ray associations, 1595 BL Lac objects, and 32783 type 2
objects. Each object is displayed with arcsecond-accurate astrometry, red and
blue photometry, redshift, citations, and radio and X-ray associations where
present. Also, 114 new spectroscopically confirmed quasars are presented.
","[{""version"":""v1"",""created"":""Mon, 23 Feb 2015 01:56:49 GMT""}]","2015-05-20"
"1502.06304","Andrei Tarfulea","Jean-Michel Roquejoffre and Andrei Tarfulea","Gradient estimates and symmetrization for Fisher-KPP front propagation
  with fractional diffusion",,,,,"math.AP","http://arxiv.org/licenses/nonexclusive-distrib/1.0/","  In this paper, we study gradient decay estimates for solutions to the
multi-dimensional Fisher-KPP equation with fractional diffusion. It is known
that this equation exhibits exponentially advancing level sets with strong
qualitative upper and lower bounds on the solution. However, little has been
shown concerning the gradient of the solution. We prove that, under mild
conditions on the initial data, the first and second derivatives of the
solution obey a comparative exponential decay in time. We then use this
estimate to prove a symmetrization result, which shows that the reaction front
flattens and quantifiably circularizes, losing its initial structure.
","[{""version"":""v1"",""created"":""Mon, 23 Feb 2015 02:04:52 GMT""}]","2015-02-24"
"1502.06305","Ranganathan Prabhakar Dr.","Amarin G. McDonnell, Tilvawala C. Gopesh, Jennifer Lo, Moira O'Bryan,
  Leslie Y. Yeo, James R. Friend and Ranganathan Prabhakar","Motility induced changes in viscosity of suspensions of swimming
  microbes in extensional flows","12 pages, 1 appendix, 7 figures, submitted to Soft Matter - under
  review",,,,"cond-mat.soft","http://arxiv.org/licenses/nonexclusive-distrib/1.0/","  Suspensions of motile cells are model systems for understanding the unique
mechanical properties of living materials which often consist of ensembles of
self-propelled particles. We present here a quantitative comparison of theory
against experiment for the rheology of such suspensions. The influence of
motility on viscosities of cell suspensions is studied using a novel
acoustically-driven microfluidic capillary-breakup extensional rheometer.
Motility increases the extensional viscosity of suspensions of algal pullers,
but decreases it in the case of bacterial or sperm pushers. A recent model
[Saintillan, Phys. Rev. E, 2010, 81:56307] for dilute active suspensions is
extended to obtain predictions for higher concentrations, after independently
obtaining parameters such as swimming speeds and diffusivities. We show that
details of body and flagellar shape can significantly determine macroscale
rheological behaviour.
","[{""version"":""v1"",""created"":""Mon, 23 Feb 2015 02:51:49 GMT""}]","2015-02-24"
"1502.06306","Jinseok Kim","Jinseok Kim and Jana Diesner","Distortive Effects of Initial-Based Name Disambiguation on Measurements
  of Large-Scale Coauthorship Networks","This is a preprint of an article accepted for publication in Journal
  of the Association for Information Science and Technology",,"10.1002/asi.23489",,"cs.DL cs.SI physics.soc-ph","http://arxiv.org/licenses/nonexclusive-distrib/1.0/","  Scholars have often relied on name initials to resolve name ambiguities in
large-scale coauthorship network research. This approach bears the risk of
incorrectly merging or splitting author identities. The use of initial-based
disambiguation has been justified by the assumption that such errors would not
affect research findings too much. This paper tests this assumption by
analyzing coauthorship networks from five academic fields - biology, computer
science, nanoscience, neuroscience, and physics - and an interdisciplinary
journal, PNAS. Name instances in datasets of this study were disambiguated
based on heuristics gained from previous algorithmic disambiguation solutions.
We use disambiguated data as a proxy of ground-truth to test the performance of
three types of initial-based disambiguation. Our results show that
initial-based disambiguation can misrepresent statistical properties of
coauthorship networks: it deflates the number of unique authors, number of
component, average shortest paths, clustering coefficient, and assortativity,
while it inflates average productivity, density, average coauthor number per
author, and largest component size. Also, on average, more than half of top 10
productive or collaborative authors drop off the lists. Asian names were found
to account for the majority of misidentification by initial-based
disambiguation due to their common surname and given name initials.
","[{""version"":""v1"",""created"":""Mon, 23 Feb 2015 02:56:05 GMT""}]","2015-04-03"
"1502.06307","Bo Wang","Bo Wang, Xin Ma, Dongdong Liu, Zhengwei Liu, Chengyuan Wu, Jujia
  Zhang, Zhanwen Han","A super-Eddington wind scenario for the progenitors of type Ia
  supernovae: binary population synthesis calculations","14 pages, 9 figures, 1 table, accepted for publication in Astronomy
  and Astrophysics","A&A 576, A86 (2015)","10.1051/0004-6361/201425294",,"astro-ph.SR","http://arxiv.org/licenses/nonexclusive-distrib/1.0/","  The super-Eddington wind scenario has been proposed as an alternative way for
producing type Ia supernovae (SNe Ia). The super-Eddington wind can naturally
prevent the carbon--oxygen white dwarfs (CO WDs) with high mass-accretion rates
from becoming red-giant-like stars. Furthermore, it works in low-metallicity
environments, which may explain SNe Ia observed at high redshifts. In this
article, we systematically investigated the most prominent single-degenerate
WD+MS channel based on the super-Eddington wind scenario. We combined the
Eggleton stellar evolution code with a rapid binary population synthesis (BPS)
approach to predict SN Ia birthrates for the WD+MS channel by adopting the
super-Eddington wind scenario and detailed mass-accumulation efficiencies of
H-shell flashes on the WDs. Our BPS calculations found that the estimated SN Ia
birthrates for the WD+MS channel are ~0.009-0.315*10^{-3}{yr}^{-1} if we adopt
the Eddington accretion rate as the critical accretion rate, which are much
lower than that of the observations (<10% of the observed SN Ia birthrates).
This indicates that the WD+MS channel only contributes a small proportion of
all SNe Ia. The birthrates in this simulation are lower than previous studies,
the main reason of which is that new mass-accumulation efficiencies of H-shell
flashes are adopted. We also found that the critical mass-accretion rate has a
significant influence on the birthrates of SNe Ia. Meanwhile, the results of
our BPS calculations are sensitive to the values of the common-envelope
ejection efficiency.
","[{""version"":""v1"",""created"":""Mon, 23 Feb 2015 03:06:25 GMT""}]","2015-04-15"
"1502.06308","Courtney Peck","Courtney Peck and Mark Rast","Photometric Trends in the Visible Solar Continuum and Their Sensitivity
  to the Center-to-Limb Profile","Accepted to ApJ. 11 pages, 5 figures",,"10.1088/0004-637X/808/2/192",,"astro-ph.SR","http://arxiv.org/licenses/nonexclusive-distrib/1.0/","  Solar irradiance variations over solar rotational time-scales are largely
determined by the passage of magnetic structures across the visible solar disk.
Variations on solar cycle time scales are thought to be similarly due to
changes in surface magnetism with activity. Understanding the contribution of
magnetic structures to total solar irradiance and solar spectral irradiance
requires assessing their contributions as a function of disk position. Since
only relative photometry is possible from the ground, the contrasts of image
pixels are measured with respect to a center-to-limb intensity profile. Using
nine years of full-disk red and blue continuum images from the Precision Solar
Photometric Telescope at the Mauna Loa Solar Observatory (PSPT/MLSO), we
examine the sensitivity of continuum contrast measurements to the
center-to-limb profile definition. Profiles which differ only by the amount of
magnetic activity allowed in the pixels used to determine them yield oppositely
signed solar cycle length continuum contrast trends; either agreeing with the
result of Preminger et al. (2011) showing negative correlation with solar cycle
or disagreeing and showing positive correlation with solar cycle. Changes in
the center-to-limb profile shape over the solar cycle are responsible for the
contradictory contrast results, and we demonstrate that the lowest contrast
structures, internetwork and network, are most sensitive to these. Thus the
strengths of the full-disk, internetwork, and network photometric trends depend
critically on the magnetic flux density used in the quiet-sun definition. We
conclude that the contributions of low contrast magnetic structures to
variations in the solar continuum output, particularly to long-term variations,
are difficult, if not impossible, to determine without the use of radiometric
imaging.
","[{""version"":""v1"",""created"":""Mon, 23 Feb 2015 03:44:37 GMT""},{""version"":""v2"",""created"":""Tue, 7 Apr 2015 02:05:31 GMT""},{""version"":""v3"",""created"":""Thu, 25 Jun 2015 17:30:29 GMT""}]","2015-08-19"
"1502.06309","Yu-Xiang Wang","Yu-Xiang Wang, Jing Lei, Stephen E. Fienberg","Learning with Differential Privacy: Stability, Learnability and the
  Sufficiency and Necessity of ERM Principle","to appear, Journal of Machine Learning Research, 2016",,,,"stat.ML cs.CR cs.LG","http://arxiv.org/licenses/nonexclusive-distrib/1.0/","  While machine learning has proven to be a powerful data-driven solution to
many real-life problems, its use in sensitive domains has been limited due to
privacy concerns. A popular approach known as **differential privacy** offers
provable privacy guarantees, but it is often observed in practice that it could
substantially hamper learning accuracy. In this paper we study the learnability
(whether a problem can be learned by any algorithm) under Vapnik's general
learning setting with differential privacy constraint, and reveal some
intricate relationships between privacy, stability and learnability.
  In particular, we show that a problem is privately learnable **if an only
if** there is a private algorithm that asymptotically minimizes the empirical
risk (AERM). In contrast, for non-private learning AERM alone is not sufficient
for learnability. This result suggests that when searching for private learning
algorithms, we can restrict the search to algorithms that are AERM. In light of
this, we propose a conceptual procedure that always finds a universally
consistent algorithm whenever the problem is learnable under privacy
constraint. We also propose a generic and practical algorithm and show that
under very general conditions it privately learns a wide class of learning
problems. Lastly, we extend some of the results to the more practical
$(\epsilon,\delta)$-differential privacy and establish the existence of a
phase-transition on the class of problems that are approximately privately
learnable with respect to how small $\delta$ needs to be.
","[{""version"":""v1"",""created"":""Mon, 23 Feb 2015 03:52:08 GMT""},{""version"":""v2"",""created"":""Tue, 23 Jun 2015 13:02:20 GMT""},{""version"":""v3"",""created"":""Wed, 27 Apr 2016 19:55:21 GMT""}]","2016-04-28"
"1502.06310","Arkady Plotnitsky","Arkady Plotnitsky, Andrei Khrennikov","Reality without Realism: On the Ontological and Epistemological
  Architecture of Quantum Mechanics","32 pages",,"10.1007/s10701-015-9942-1",,"physics.hist-ph quant-ph","http://arxiv.org/licenses/nonexclusive-distrib/1.0/","  First, this article considers the nature of quantum reality (the reality
responsible for quantum phenomena) and the concept of realism (our ability to
represent this reality) in quantum theory, in conjunction with the roles of
locality, causality, and probability and statistics there. Second, it offers
two interpretations of quantum mechanics, developed by the authors of this
article, the second of which is also a different (from quantum mechanics)
theory of quantum phenomena. Both of these interpretations are statistical. The
first interpretation, by A. Plotnitsky, ""the statistical Copenhagen
interpretation,"" is nonrealist, insofar as the description or even conception
of the nature of quantum objects and processes is precluded. The second, by A.
Khrennikov, is ultimately realist, because it assumes that the
quantum-mechanical level of reality is underlain by a deeper level of reality,
described, in a realist fashion, by a model, based on the pre-quantum classical
statistical field theory (PCSFT), the predictions of which reproduce those of
quantum mechanics. Moreover, because the continuous fields considered in this
model are transformed into discrete clicks of detectors, experimental outcomes
in this model depend on the context of measurement in accordance with N. Bohr's
interpretation and the statistical Copenhagen interpretation, which coincides
with Bohr's interpretation in this regard.
","[{""version"":""v1"",""created"":""Mon, 23 Feb 2015 04:15:04 GMT""},{""version"":""v2"",""created"":""Sun, 12 Jul 2015 04:20:01 GMT""}]","2015-10-28"
"1502.06311","Aswin  Balasubramanian","Aswin Balasubramanian","Codimension two defects and the Springer correspondence","11pp, To appear in proceedings of String-Math 14 (Edmonton, Alberta)",,,"UTTG-27-14","hep-th math.RT","http://arxiv.org/licenses/nonexclusive-distrib/1.0/","  One can associate an invariant to a large class of regular codimension two
defects of the six dimensional $(0,2)$ SCFT $\mathscr{X}[j]$ using the
classical Springer correspondence. Such an association allows a simple
description of S-duality of associated Gaiotto-Witten boundary conditions in
$\mathcal{N}=4$ SYM for arbitrary gauge group and by extension, a determination
of certain local aspects of class $\mathcal{S}$ constructions. I point out that
the problem of \textit{classifying} the corresponding boundary conditions in
$\mathcal{N}=4$ SYM is intimately tied to possible symmetry breaking patterns
in the bulk theory. Using the Springer correspondence and the representation
theory of Weyl groups, I construct a pair of functors between the class of
boundary conditions in the theory in the phase with broken gauge symmetry and
those in the phase with unbroken gauge symmetry.
","[{""version"":""v1"",""created"":""Mon, 23 Feb 2015 04:28:28 GMT""},{""version"":""v2"",""created"":""Mon, 11 May 2015 08:39:49 GMT""}]","2015-05-12"
"1502.06312","Holger F. Hofmann","Shota Kino, Taiki Nii and Holger F. Hofmann","Characterization of measurement uncertainties using the correlations
  between local outcomes obtained from maximally entangled pairs","10 pages, added comments on quasi-probabilities and quantum state
  reconstructions, final version for publication in Phys. Rev. A","Phys. Rev. A 92, 042113 (2015)","10.1103/PhysRevA.92.042113",,"quant-ph","http://arxiv.org/licenses/nonexclusive-distrib/1.0/","  Joint measurements of non-commuting observables are characterized by
unavoidable measurement uncertainties that can be described in terms of the
error statistics for input states with well-defined values for the target
observables. However, a complete characterization of measurement errors must
include the correlations between the errors of the two observables. Here, we
show that these correlations appear in the experimentally observable
measurement statistics obtained by performing the joint measurement on
maximally entangled pairs. For two-level systems, the results indicate that
quantum theory requires imaginary correlations between the measurement errors
of X and Y since these correlations are represented by the operator product
XY=iZ in the measurement operators. Our analysis thus reveals a directly
observable consequence of non-commutativity in the statistics of quantum
measurements.
","[{""version"":""v1"",""created"":""Mon, 23 Feb 2015 04:36:16 GMT""},{""version"":""v2"",""created"":""Thu, 11 Jun 2015 03:58:34 GMT""},{""version"":""v3"",""created"":""Thu, 13 Aug 2015 00:34:43 GMT""},{""version"":""v4"",""created"":""Fri, 2 Oct 2015 01:19:29 GMT""}]","2015-10-28"
"1502.06313","Yuanjun Zhou","Yuanjun Zhou and Karin M. Rabe","Coupled nonpolar-polar metal-insulator transition in 1:1
  SrCrO$_3$/SrTiO$_3$ superlattices: A first-principles study",,"Phys. Rev. Lett. 115, 106401 (2015)","10.1103/PhysRevLett.115.106401",,"cond-mat.mtrl-sci","http://arxiv.org/licenses/nonexclusive-distrib/1.0/","  Using first principles calculations, we determined the epitaxial-strain
dependence of the ground state of the 1:1 SrCrO$_3$/SrTiO$_3$ superlattice. The
superlattice layering leads to significant changes in the electronic states
near the Fermi level, derived from Cr $t_{2g}$ orbitals. An insulating phase is
found when the tensile strain is greater than 2.2\% relative to unstrained
cubic SrTiO$_3$. The insulating character is shown to arise from Cr $t_{2g}$
orbital ordering, which is produced by an in-plane polar distortion that
couples to the superlattice d-bands and is stabilized by epitaxial strain. This
effect can be used to engineer the band structure near the Fermi level in
transition metal oxide superlattices.
","[{""version"":""v1"",""created"":""Mon, 23 Feb 2015 04:36:28 GMT""}]","2015-09-16"
"1502.06314","Cong Zhang","Fei Chen, Cong Zhang, Feng Wang, Jiangchuan Liu","Crowdsourced Live Streaming over the Cloud",,,,,"cs.MM cs.NI","http://arxiv.org/licenses/nonexclusive-distrib/1.0/","  Empowered by today's rich tools for media generation and distribution, and
the convenient Internet access, crowdsourced streaming generalizes the
single-source streaming paradigm by including massive contributors for a video
channel. It calls a joint optimization along the path from crowdsourcers,
through streaming servers, to the end-users to minimize the overall latency.
The dynamics of the video sources, together with the globalized request demands
and the high computation demand from each sourcer, make crowdsourced live
streaming challenging even with powerful support from modern cloud computing.
In this paper, we present a generic framework that facilitates a cost-effective
cloud service for crowdsourced live streaming. Through adaptively leasing, the
cloud servers can be provisioned in a fine granularity to accommodate
geo-distributed video crowdsourcers. We present an optimal solution to deal
with service migration among cloud instances of diverse lease prices. It also
addresses the location impact to the streaming quality. To understand the
performance of the proposed strategies in the realworld, we have built a
prototype system running over the planetlab and the Amazon/Microsoft Cloud. Our
extensive experiments demonstrate that the effectiveness of our solution in
terms of deployment cost and streaming quality.
","[{""version"":""v1"",""created"":""Mon, 23 Feb 2015 04:44:02 GMT""}]","2015-02-24"
"1502.06315","Zhou Wei","Zhou Wei and M. Montaz Ali","Convex mixed integer nonlinear programming problems and an outer
  approximation algorithm","16 pages","Journal of Global Optimization, (2015) 63: 213-227","10.1007/s10898-015-0284-5",,"math.OC","http://arxiv.org/licenses/nonexclusive-distrib/1.0/","  In this paper, we mainly study one class of convex mixed-integer nonlinear
programming problems (MINLPs) with non-differentiable data. By dropping the
differentiability assumption, we substitute gradients with subgradients
obtained from KKT conditions, and use the outer approximation method to
reformulate convex MINLP as one equivalent MILP master program. By solving a
finite sequence of subproblems and relaxed MILP problems, we establish an outer
approximation algorithm to find the optimal solution of this convex MINLP. The
convergence of this algorithm is also presented. The work of this paper
generalizes and extends the outer approximation method in the sense of dealing
with convex MINLPs from differentiable case to non-differentiable one.
","[{""version"":""v1"",""created"":""Mon, 23 Feb 2015 05:11:44 GMT""}]","2015-09-22"
"1502.06316","Konijeti Sreenadh","Pawan Kumar Mishra and K. Sreenadh","Existence and multiplicity results for fractional $p$-Kirchhoff equation
  with sign changing nonlinearities","Advances in pure and applied Mathematics 2016",,,,"math.AP","http://arxiv.org/licenses/nonexclusive-distrib/1.0/","  In this paper, we show the existence and multiplicity of nontrivial,
non-negative solutions of the fractional $p$-Kirchhoff problem
\begin{equation*} \begin{array}{rllll}
M\left(\displaystyle\int_{\mathbb{R}^{2n}}\frac{|u(x)-u(y)|^p}{\left|x-y\right|^{n+ps}}dx\,dy\right)(-\Delta)^{s}_p
u &=\lambda f(x)|u|^{q-2}u+ g(x)\left|u\right|^{r-2}u\, \text{in} \Omega,\\
u&=0 \;\mbox{in} \mathbb{R}^{n}\setminus \Omega, \end{array} \end{equation*}
where $(-\Delta)^{s}_p$ is the fractional $p$-Laplace operator, $\Omega$ is a
bounded domain in $\mathbb{R}^n$ with smooth boundary, $f \in
L^{\frac{r}{r-q}}(\Omega)$ and $g\in L^\infty(\Omega)$ are sign changing, $M$
is continuous function, $ps<n<2ps$ and $1<q<p<r\leq p_s^*=\frac{np}{n-ps}$.
","[{""version"":""v1"",""created"":""Mon, 23 Feb 2015 05:20:24 GMT""},{""version"":""v2"",""created"":""Sat, 3 Oct 2015 02:01:20 GMT""}]","2015-10-06"
"1502.06317","Zhou Wei","Liyun Huang, Qinghai He, Zhou Wei","BCQ and Strong BCQ for Nonconvex Generalized Equations with Applications
  to Metric Subregularity","17 pages","Set-Valued and Variational Analysis, Volume 22, Issue 4, December
  2014","10.1007/s11228-014-0287-2",,"math.OC","http://arxiv.org/licenses/nonexclusive-distrib/1.0/","  In this paper, based on basic constraint qualification (BCQ) and strong BCQ
for convex generalized equation, we are inspired to further discuss constraint
qualifications of BCQ and strong BCQ for nonconvex generalized equation and
then establish their various characterizations. As applications, we use these
constraint qualifications to study metric subregularity of nonconvex
generalized equation and provide necessary and/or sufficient conditions in
terms of constraint qualifications considered herein to ensure nonconvex
generalized equation having metric subregularity.
","[{""version"":""v1"",""created"":""Mon, 23 Feb 2015 05:28:08 GMT""}]","2015-02-25"
"1502.06318","Haris Aziz","Haris Aziz and Hans Georg Seedig and Jana Karina von Wedel","On the Susceptibility of the Deferred Acceptance Algorithm",,,,,"cs.GT","http://arxiv.org/licenses/nonexclusive-distrib/1.0/","  The Deferred Acceptance Algorithm (DAA) is the most widely accepted and used
algorithm to match students, workers, or residents to colleges, firms or
hospitals respectively. In this paper, we consider for the first time, the
complexity of manipulating DAA by agents such as colleges that have capacity
more than one. For such agents, truncation is not an exhaustive strategy. We
present efficient algorithms to compute a manipulation for the colleges when
the colleges are proposing or being proposed to. We then conduct detailed
experiments on the frequency of manipulable instances in order to get better
insight into strategic aspects of two-sided matching markets. Our results bear
somewhat negative news: assuming that agents have information other agents'
preference, they not only often have an incentive to misreport but there exist
efficient algorithms to find such a misreport.
","[{""version"":""v1"",""created"":""Mon, 23 Feb 2015 05:33:01 GMT""}]","2015-02-24"
"1502.06319","Simon Phoenix","Simon J.D. Phoenix, Stephen M. Barnett","Relay QKD Networks & Bit Transport",,,,,"quant-ph","http://arxiv.org/licenses/nonexclusive-distrib/1.0/","  We show how it is possible to operate end-to-end relays on a QKD network by
treating each relay as a trusted eavesdropper operating an intercept/resend
strategy. It is shown that, by introducing the concept of bit transport, the
key rate compared to that of single-link channels is unaffected. The technique
of bit transport extends the capability of QKD networks. We also discuss
techniques for reducing the level of trust required in the relays. In
particular we demonstrate that it is possible to create a simple quantum key
exchange scheme using secret sharing such that by the addition of a single
extra relay on a multi-relay channel requires the eavesdropper to compromise
all the relays on the channel. By coupling this with multi-path capability and
asynchronous quantum key establishment we show that, in effect, an eavesdropper
has to compromise all relays on an entire network and collect data on the
entire network from its inception.
","[{""version"":""v1"",""created"":""Mon, 23 Feb 2015 05:33:29 GMT""}]","2015-02-24"
