"1502.06412","J\'an Somor\v{c}\'ik","R\'obert T\'oth and J\'an Somor\v{c}\'ik","On a non-parametric confidence interval for the regression slope","Changes in Version 2: (1) added references to the usage of the R
  package ""mblm"" in other sciences; (2) expanded Abstract and Introduction; (3)
  updated affiliation of the first author. Changes in Version 3 : (1) Condition
  2 itroduced at a later stage; (2) true confidence levels of the Theil's CI
  added to Table 1. Changes in Version 4: section `A real life example' added",,,,"stat.ME","http://arxiv.org/licenses/nonexclusive-distrib/1.0/","  We investigate an application of the Tukey's methodology in Theil's
regression to obtain a confidence interval for the true slope in the straight
line regression model with not necessarily normal errors. This specific
approach is implemented since 2005 in a package of the software R; however,
without any theoretical background. We illustrate by Monte Carlo simulations,
that this methodology, unlike the classical Theil's approach based on Kendall's
tau, seriously deflates the true confidence level of the resulting interval. We
provide also rigorous proofs in case of four data points (in general) and in
case of five data points (under some additional conditions); together with a
real life methods usage example in the latter case. Summing up, we demonstrate
that one should never combine statistical methods without checking the
assumptions of their usage and we also give a warning to the already wide
community of R users of Theil's regression from various fields of science.
","[{""version"":""v1"",""created"":""Mon, 23 Feb 2015 13:20:34 GMT""},{""version"":""v2"",""created"":""Mon, 27 Jul 2015 09:14:43 GMT""},{""version"":""v3"",""created"":""Fri, 15 Jan 2016 13:08:43 GMT""},{""version"":""v4"",""created"":""Fri, 9 Sep 2016 10:05:37 GMT""}]","2016-09-12"
"1502.06413","Suzanne Klaver","Suzanne Klaver (for the LHCb Collaboration)","Measuring Semileptonic Asymmetries in LHCb","Proceedings of the workshop ""Flavorful Ways to New Physics"", 28-31
  October 2014, Freudenstadt, Germany",,,,"hep-ex","http://creativecommons.org/licenses/by-nc-sa/3.0/","  The $C\!P$-violating flavour-specific asymmetry in neutral $b$ mesons
provides a method for testing the Standard Model. The measurements from the D0
experiment yield values of this asymmetry that disagree with the Standard Model
at a level of 3.6 $\sigma$. This contribution discusses the latest LHCb
measurements in this sector both from $B^0$ mesons ($a_{\mathrm{sl}}^d$) and
$B^0_s$ mesons ($a_{\mathrm{sl}}^s$). Using their 2011 dataset, corresponding
to an integrated luminosity of 1.0 $\mathrm{fb}^{-1}$ obtained in 2011, LHCb
measured a value of $a_{\mathrm{sl}}^s = (-0.06 \pm 0.50_{\text{stat}} \pm
0.36_{\text{syst}}) \%$. Combining the 2011 and 2012 datasets, with an
integrated luminosity of 3 $\mathrm{fb}^{-1}$, LHCb measured $a_{\mathrm{sl}}^d
= (-0.02 \pm 0.19_{\text{stat}} \pm 0.30_{\text{syst}}) \%$. These are the most
precise measurements of the parameters $a_{\mathrm{sl}}^s$ and
$a_{\mathrm{sl}}^d$ to date. Plans for an updated result for
$a_{\mathrm{sl}}^s$ using the full 3 $\mathrm{fb}^{-1}$ dataset are discussed.
This will include new methods to determine detection asymmetries which are the
dominating systematic uncertainty of the 2011 measurement.
","[{""version"":""v1"",""created"":""Mon, 23 Feb 2015 13:23:54 GMT""},{""version"":""v2"",""created"":""Tue, 24 Feb 2015 12:57:01 GMT""}]","2019-08-13"
"1502.06414","Heiko Bauke","Anton W\""ollert, Heiko Bauke, Christoph H. Keitel","Spin polarized electron-positron pair production via elliptical
  polarized laser fields",,"Physical Review D 91, 125026 (2015)","10.1103/PhysRevD.91.125026",,"physics.atom-ph quant-ph","http://arxiv.org/licenses/nonexclusive-distrib/1.0/","  We study nonperturbative multiphoton electron-positron pair creation in
ultrastrong electromagnetic fields formed by two counterpropagating pulses with
elliptic polarization. Our numerical approach allows us to take into account
the temporal as well as the spatial variation of the standing electromagnetic
field. The spin and momentum resolved pair creation probabilities feature
characteristic Rabi oscillations and resonance spectra. Therefore, each laser
frequency features a specific momentum distribution of the created particles.
We find that, depending on the relative polarization of both pulses, the
created electrons may be spin polarized along the direction of field
propagation.
","[{""version"":""v1"",""created"":""Mon, 23 Feb 2015 13:24:34 GMT""},{""version"":""v2"",""created"":""Wed, 24 Jun 2015 14:26:30 GMT""}]","2015-06-25"
"1502.06415","Joshua Chang","Joshua C. Chang and Pak-Wing Fok and Tom Chou","Bayesian field theoretic reconstruction of bond potential and bond
  mobility in single molecule force spectroscopy","In review - Python source code available on github. Abridged abstract
  on arXiv","Biophysical journal 109.5 (2015): 966-974","10.1016/j.bpj.2015.07.028",,"physics.data-an cond-mat.stat-mech math.OC q-bio.QM","http://arxiv.org/licenses/nonexclusive-distrib/1.0/","  Quantifying the forces between and within macromolecules is a necessary first
step in understanding the mechanics of molecular structure, protein folding,
and enzyme function and performance. In such macromolecular settings, dynamic
single-molecule force spectroscopy (DFS) has been used to distort bonds. The
resulting responses, in the form of rupture forces, work applied, and
trajectories of displacements, have been used to reconstruct bond potentials.
Such approaches often rely on simple parameterizations of one-dimensional bond
potentials, assumptions on equilibrium starting states, and/or large amounts of
trajectory data. Parametric approaches typically fail at inferring
complex-shaped bond potentials with multiple minima, while piecewise estimation
may not guarantee smooth results with the appropriate behavior at large
distances. Existing techniques, particularly those based on work theorems, also
do not address spatial variations in the diffusivity that may arise from
spatially inhomogeneous coupling to other degrees of freedom in the
macromolecule, thereby presenting an incomplete picture of the overall bond
dynamics. To solve these challenges, we have developed a comprehensive
empirical Bayesian approach that incorporates data and regularization terms
directly into a path integral. All experiemental and statistical parameters in
our method are estimated empirically directly from the data. Upon testing our
method on simulated data, our regularized approach requires fewer data and
allows simultaneous inference of both complex bond potentials and diffusivity
profiles.
","[{""version"":""v1"",""created"":""Mon, 23 Feb 2015 13:25:27 GMT""}]","2017-08-24"
"1502.06416","Ana Carpio","D. R. Espeso, A. Carpio, B. Einarsson","Differential growth of wrinkled biofilms","19 pages, 13 figures","Physical Review E 91, 022710 (2015)","10.1103/PhysRevE.91.022710",,"physics.bio-ph cond-mat.soft nlin.AO nlin.CG q-bio.TO","http://arxiv.org/licenses/nonexclusive-distrib/1.0/","  Biofilms are antibiotic-resistant bacterial aggregates that grow on moist
surfaces and can trigger hospital-acquired infections. They provide a classical
example in biology where the dynamics of cellular communities may be observed
and studied. Gene expression regulates cell division and differentiation, which
affect the biofilm architecture. Mechanical and chemical processes shape the
resulting structure. We gain insight into the interplay between cellular and
mechanical processes during biofilm development on air-agar interfaces by means
of a hybrid model. Cellular behavior is governed by stochastic rules informed
by a cascade of concentration fields for nutrients, waste and autoinducers.
Cellular differentiation and death alter the structure and the mechanical
properties of the biofilm, which is deformed according to Foppl-Von Karman
equations informed by cellular processes and the interaction with the
substratum. Stiffness gradients due to growth and swelling produce wrinkle
branching. We are able to reproduce wrinkled structures often formed by
biofilms on air-agar interfaces, as well as spatial distributions of
differentiated cells commonly observed with B. subtilis.
","[{""version"":""v1"",""created"":""Mon, 23 Feb 2015 13:25:52 GMT""}]","2015-02-24"
"1502.06417","Douadi  Drihem","Douadi Drihem","Sobolev embeddings for Herz-type Triebel-Lizorkin spaces","We reprove Theorem 2 and we add some embeddings between Herz and
  Triebel-Lizorkin spaces",,,,"math.FA","http://arxiv.org/licenses/nonexclusive-distrib/1.0/","  In this paper we prove the Sobolev embeddings for Herz-type Triebel-Lizorkin
spaces, \begin{equation*} \dot{K}_{q}^{\alpha_{2},r}F_{\theta
}^{s_{2}}\hookrightarrow \dot{K}%_{s}^{\alpha_{1},p}F_{\beta }^{s_{1}}
\end{equation*} where the parameters
$\alpha_{1},\alpha_{2},s_{1},s_{2},s,q,r,p,\beta $ and $\theta $ satisfy some
suitable conditions. An application we obtain new embeddings between Herz and
Triebel-Lizorkin spaces. Moreover, we present the Sobolev embeddings for
Triebel-Lizorkin spaces equipped with power weights. All these results cover
the results on classical Triebel-Lizorkin spaces.
","[{""version"":""v1"",""created"":""Mon, 23 Feb 2015 13:28:45 GMT""},{""version"":""v2"",""created"":""Thu, 16 Jun 2016 12:15:34 GMT""}]","2016-06-17"
"1502.06418","Marek Frankowski","Marek Frankowski, Antoni \.Zywczak, Maciej Czapkiewicz, S{\l}awomir
  Zi\k{e}tek, Jaros{\l}aw Kanak, Monika Banasik, Wies{\l}aw Powro\'znik, Witold
  Skowro\'nski, Jakub Ch\k{e}ci\'nski, Jerzy Wrona, Hubert G{\l}owi\'nski,
  Janusz Dubowik, Jean-Philippe Ansermet and Tomasz Stobiecki","Buffer influence on magnetic dead layer, critical current and thermal
  stability in magnetic tunnel junctions with perpendicular magnetic anisotropy",,,,,"cond-mat.mes-hall cond-mat.mtrl-sci","http://arxiv.org/licenses/nonexclusive-distrib/1.0/","  We present a thorough research on Ta/Ru-based buffers and their influence on
features crucial from the point of view of applications of MTJs, such as
critical switching current and thermal stability. We investigate devices
consisting of buffer/FeCoB/MgO/FeCoB/Ta/Ru multilayers for three different
buffers: Ta 5 / Ru 10 / Ta 3, Ta 5 / Ru 10 / Ta 10 and Ta 5 / Ru 20 / Ta 5 (all
thicknesses in nm). In addition, we study systems with a single FeCoB layer
deposited above as well as below the MgO barrier. The crystallographic texture
and the roughness of the buffers are determined by means of XRD and atomic
force microscopy measurements. Furthermore, we examine the magnetic domain
pattern, the magnetic dead layer thickness and the perpendicular magnetic
anisotropy fields for each sample. Finally, we investigate the effect of the
current induced magnetization switching for nanopillar junctions with lateral
dimensions ranging from 1 {\mu}m down to 140 nm. Buffer Ta 5 / Ru 10 / Ta 3,
which has the thickest dead layer, exhibits a large increase in the thermal
stability factor while featuring a slightly lower critical current density
value when compared to the buffer with the thinnest dead layer Ta 5 / Ru 20 /
Ta 5.
","[{""version"":""v1"",""created"":""Mon, 23 Feb 2015 13:29:23 GMT""}]","2015-02-24"
"1502.06420","Radu Pantilie","Radu Pantilie","(Pluri)harmonic morphisms and the Penrose-Ward transform","Preprint, I.M.A.R., Bucharest, 2015, 19 pages",,,,"math.DG math-ph math.AG math.MP","http://arxiv.org/licenses/nonexclusive-distrib/1.0/","  We show that, in quaternionic geometry, the Ward transform is a manifestation
of the functoriality of the basic correspondence between the
$\rho$-quaternionic manifolds and their twistor spaces. We apply this fact,
together with the Penrose transform, to obtain existence results for
hypercomplex manifolds and for harmonic morphisms from hyper-Kaehler manifolds.
","[{""version"":""v1"",""created"":""Mon, 23 Feb 2015 13:35:01 GMT""},{""version"":""v2"",""created"":""Mon, 9 Mar 2015 07:29:59 GMT""}]","2015-03-10"
"1502.06421","Arash Phirouznia","R. Ghanbary and A. Phirouznia","Anisotropic Friedel oscillations inside the domain wall",,"Journal of Magnetism and Magnetic Materials 395, 277-282 (2015)","10.1016/j.jmmm.2015.07.074",,"cond-mat.mes-hall","http://arxiv.org/licenses/nonexclusive-distrib/1.0/","  The influence of the non-collinear magnetic configuration on Friedel is
investigated theoretically. Specifically the influence of the magnetic
configuration on the induced electric charge in a N\'{e}el type domain wall
(DW) has been obtained. The well-known Levy and Zhang eigenstates for a linear
DW have been employed. Then the dielectric function of this magnetic system has
been obtained within the random phase approximation. Results of the current
work demonstrated that magnetic configuration of the system manifests itself in
the electric properties such as induced charge distribution. Meanwhile the
anisotropy of the induced charge distribution in the real space provides a
measurable way for the determination of the DW orientation. In addition
anisotropy of the dielectric function in k-space arises as a result of the
anisotropy of the magnetic configuration. Therefore the orientation of the
magnetic DW could also be captured by full optical measurements.
","[{""version"":""v1"",""created"":""Mon, 23 Feb 2015 13:37:23 GMT""}]","2017-10-10"
"1502.06422","Kerim Goztepe","Kerim Goztepe","Recommendations on Future Operational Environments Command Control and
  Cyber Security",,,"10.13140/2.1.2406.1121",,"cs.CR","http://creativecommons.org/licenses/by-nc-sa/3.0/","  It is a well-known fact that today a nation's telecommunication networks,
critical infrastructure, and information systems are vulnerable to growing
number of attacks in cyberspace. Cyber space contains very different problems
involving various sets of threats, targets and costs. Cyber security is not
only problem of banking, communication or transportation. It also threatens
core systems of army as command control. Some significant recommendations on
command control (C2) and cyber security have been suggested for army computing
environment in this paper. This study addresses priorities of ""what should be
done for a better army cyber future"" to cyber security researchers.
","[{""version"":""v1"",""created"":""Mon, 23 Feb 2015 13:37:29 GMT""}]","2015-02-24"
"1502.06423","Vittorio Peano","V. Peano, H. G. L. Schwefel, Ch. Marquardt, F. Marquardt","Optomechanical position detection enhanced by de-amplification using
  intracavity squeezing","references added, slight changes","Phys. Rev. Lett. 115, 243603 (2015)","10.1103/PhysRevLett.115.243603",,"quant-ph","http://arxiv.org/licenses/nonexclusive-distrib/1.0/","  It has been predicted and experimentally demonstrated that by injecting
squeezed light into an optomechanical device it is possible to enhance the
precision of a position measurement. Here, we present a fundamentally different
approach where the squeezing is created directly inside the cavity by a
nonlinear medium. Counterintuitively, the enhancement of the signal to noise
ratio works by de-amplifying precisely the quadrature that is sensitive to the
mechanical motion without losing quantum information. This enhancement works
for systems with a weak optomechanical coupling and/or strong mechanical
damping. This could allow for larger mechanical bandwidth of quantum limited
detectors based on optomechanical devices. Our approach can be
straightforwardly extended to Quantum Non Demolition (QND) qubit detection.
","[{""version"":""v1"",""created"":""Mon, 23 Feb 2015 13:42:34 GMT""},{""version"":""v2"",""created"":""Mon, 30 Mar 2015 12:07:14 GMT""}]","2015-12-16"
"1502.06424","Didam G. A. Duniya","Didam Duniya (1), Daniele Bertacca (1,2), Roy Maartens (1,3) ((1)
  Western Cape, (2) Bonn, (3) Portsmouth)","Probing the imprint of interacting dark energy on very large scales","12 pages, 6 figures. Minor corrections. Version accepted by Physical
  Review D","Phys.Rev. D91 (2015) 063530","10.1103/PhysRevD.91.063530",,"astro-ph.CO","http://arxiv.org/licenses/nonexclusive-distrib/1.0/","  The observed galaxy power spectrum acquires relativistic corrections from
lightcone effects, and these corrections grow on very large scales. Future
galaxy surveys in optical, infrared and radio bands will probe increasingly
large wavelength modes and reach higher redshifts. In order to exploit the new
data on large scales, an accurate analysis requires inclusion of the
relativistic effects. This is especially the case for primordial
non-Gaussianity and for extending tests of dark energy models to horizon
scales. Here we investigate the latter, focusing on models where the dark
energy interacts non-gravitationally with dark matter. Interaction in the dark
sector can also lead to large-scale deviations in the power spectrum. If the
relativistic effects are ignored, the imprint of interacting dark energy will
be incorrectly identified and thus lead to a bias in constraints on interacting
dark energy on very large scales.
","[{""version"":""v1"",""created"":""Mon, 23 Feb 2015 13:43:08 GMT""},{""version"":""v2"",""created"":""Sat, 7 Mar 2015 14:51:52 GMT""}]","2015-08-19"
"1502.06425","Mitko Konstantinov Gaidarov","V.K. Lukyanov, D.N. Kadrev, E.V. Zemlyanaya, K. Spasova, K.V.
  Lukyanov, A.N. Antonov, M.K. Gaidarov","Microscopic analysis of $^{10,11}$Be elastic scattering on protons and
  nuclei and breakup processes of $^{11}$Be within the $^{10}$Be+$n$ cluster
  model","14 pages, 10 figures, 3 tables, accepted for publication in Physical
  Review C",,"10.1103/PhysRevC.91.034606",,"nucl-th","http://arxiv.org/licenses/nonexclusive-distrib/1.0/","  The density distributions of $^{10}$Be and $^{11}$Be nuclei obtained within
the quantum Monte Carlo (QMC) model and the generator coordinate method (GCM)
are used to calculate the microscopic optical potentials (OPs) and cross
sections of elastic scattering of these nuclei on protons and $^{12}$C at
energies $E<100$ MeV/nucleon. The real part of the OP is calculated using the
folding model with the exchange terms included, while the imaginary part of the
OP that reproduces the phase of scattering is obtained in the high-energy
approximation (HEA). In this hybrid model of OP the free parameters are the
depths of the real and imaginary parts obtained by fitting the experimental
data. The well known energy dependence of the volume integrals is used as a
physical constraint to resolve the ambiguities of the parameter values. The
role of the spin-orbit potential and the surface contribution to the OP is
studied for an adequate description of available experimental elastic
scattering cross section data. Also, the cluster model, in which $^{11}$Be
consists of a $n$-halo and the $^{10}$Be core, is adopted. Within the latter,
the breakup cross sections of $^{11}$Be nucleus on $^{9}$Be, $^{93}$Nb,
$^{181}$Ta, and $^{238}$U targets and momentum distributions of $^{10}$Be
fragments are calculated and compared with the existing experimental data.
","[{""version"":""v1"",""created"":""Mon, 23 Feb 2015 13:50:38 GMT""}]","2015-06-24"
"1502.06426","Tien-Hao Hsieh","Tien-Hao Hsieh, Shih-Ping Lai, Arnaud Belloche, Friedrich Wyrowski,
  and Chao-Ling Hung","Properties of the Molecular Cores of Low Luminosity Objects","15 pages, 8 figures, accepted to ApJ",,"10.1088/0004-637X/802/2/126",,"astro-ph.GA","http://arxiv.org/licenses/nonexclusive-distrib/1.0/","  We present a survey toward 16 Low Luminosity Objects (LLOs with an internal
luminosity, Lint, lower than 0.2 Lsun) with N2H+ (1-0), N2H+ (3-2), N2D+ (3-2),
HCO+ (3-2) and HCN (3-2) using the Arizona Radio Observatory Kitt Peak 12m
Telescope and Submillimeter Telescope. Our goal is to probe the nature of these
faint protostars which are believed to be either very low mass or extremely
young protostars. We find that the N2D+/N2H+ column density ratios of LLOs are
similar to those of typical starless cores and Class 0 objects. The N2D+/N2H+
column density ratios are relatively high (> 0.05) for LLOs with kinetic
temperatures less than 10 K in our sample. The distribution of N2H+ (1-0) line
widths spreads between that of starless cores and young Class 0 objects. If we
use the line width as a dynamic evolutionary indicator, LLOs are likely young
Class 0 protostellar sources. We further use the optically thick tracers, HCO+
(3-2) and HCN (3-2), to probe the infall signatures of our targets. We derive
the asymmetry parameters from both lines and estimate the infall velocities by
fitting the HCO+ (3-2) spectra with two-layer models. As a result, we identify
eight infall candidates based on the infall velocities and seven candidates
have infall signatures supported by asymmetry parameters from at least one of
HCO+ (3-2) and HCN (3-2).
","[{""version"":""v1"",""created"":""Mon, 23 Feb 2015 13:50:45 GMT""}]","2015-06-24"
"1502.06427","Vianney Taquet","Vianney Taquet, Ana L\'opez-Sepulcre, Cecilia Ceccarelli, Roberto
  Neri, Claudine Kahane, Steven B. Charnley","Constraining the abundances of complex organics in the inner regions of
  solar-type protostars","60 pages, 10 figures, 17 tables. Accepted for publication in ApJ",,"10.1088/0004-637X/804/2/81",,"astro-ph.SR","http://arxiv.org/licenses/nonexclusive-distrib/1.0/","  The high abundances of Complex Organic Molecules (COMs) with respect to
methanol, the most abundant COM, detected towards low-mass protostars, tend to
be underpredicted by astrochemical models. This discrepancy might come from the
large beam of the single-dish telescopes, encompassing several components of
the studied protostar, commonly used to detect COMs. To address this issue, we
have carried out multi-line observations of methanol and several COMs towards
the two low-mass protostars NGC1333-IRAS2A and -IRAS4A with the Plateau de Bure
interferometer at an angular resolution of 2 arcsec, resulting in the first
multi-line detection of the O-bearing species glycolaldehyde and ethanol and of
the N-bearing species ethyl cyanide towards low-mass protostars other than IRAS
16293. The high number of detected transitions from COMs (more than 40 methanol
transitions for instance) allowed us to accurately derive the source size of
their emission and the COMs column densities. The COMs abundances with respect
to methanol derived towards IRAS2A and IRAS4A are slightly, but not
substantitally, lower than those derived from previous single-dish
observations. The COMs abundance ratios do not vary significantly with the
protostellar luminosity, over five orders of magnitude, implying that low-mass
hot corinos are quite chemically rich as high-mass hot cores. Astrochemical
models still underpredict the abundances of key COMs, such as methyl formate or
di-methyl ether, suggesting that our understanding of their formation remains
incomplete.
","[{""version"":""v1"",""created"":""Mon, 23 Feb 2015 13:51:08 GMT""}]","2015-05-20"
"1502.06428","Igal Sason","Igal Sason","Tight Bounds for Symmetric Divergence Measures and a New Inequality
  Relating $f$-Divergences","A final version of the conference paper at the 2015 IEEE Information
  Theory Workshop, Jerusalem, Israel",,"10.1109/ITW.2015.7133079",,"cs.IT math.IT","http://arxiv.org/licenses/nonexclusive-distrib/1.0/","  Tight bounds for several symmetric divergence measures are introduced, given
in terms of the total variation distance. Each of these bounds is attained by a
pair of 2 or 3-element probability distributions. An application of these
bounds for lossless source coding is provided, refining and improving a certain
bound by Csisz\'ar. A new inequality relating $f$-divergences is derived, and
its use is exemplified. The last section of this conference paper is not
included in the recent journal paper that was published in the February 2015
issue of the IEEE Trans. on Information Theory (see arXiv:1403.7164), as well
as some new paragraphs throughout the paper which are linked to new references.
","[{""version"":""v1"",""created"":""Mon, 23 Feb 2015 13:52:30 GMT""},{""version"":""v2"",""created"":""Tue, 10 Mar 2015 16:30:35 GMT""}]","2016-11-15"
"1502.06429","Andrey Grankin","A. Grankin, E. Brion, E. Bimbard, R. Boddeda, I. Usmani, A.
  Ourjoumtsev, P. Grangier","Quantum optical non-linearities induced by Rydberg-Rydberg interactions:
  a perturbative approach",,"Phys. Rev. A 92, 043841 (2015)","10.1103/PhysRevA.92.043841",,"quant-ph physics.optics","http://arxiv.org/licenses/nonexclusive-distrib/1.0/","  In this article, we theoretically study the quantum statistical properties of
the light transmitted through or reflected from an optical cavity, filled by an
atomic medium with strong optical non-linearity induced by Rydberg-Rydberg van
der Waals interactions. Atoms are driven on a two-photon transition from their
ground state to a Rydberg level via an intermediate state by the combination of
a weak signal field and a strong control beam. By using a perturbative
approach, we get analytic results which remain valid in the regime of weak
feeding fields, even when the intermediate state becomes resonant. Therefore
they allow us to investigate quantitatively new features associated with the
resonant behaviour of the system. We also propose an effective non-linear
three-boson model of the system which, in addition to leading to the same
analytic results as the original problem, sheds light on the physical processes
at work in the system.
","[{""version"":""v1"",""created"":""Mon, 23 Feb 2015 13:55:55 GMT""}]","2019-06-14"
