"1502.06243","Douglas Lind","Douglas Lind and Klaus Schmidt","A Survey of Algebraic Actions of the Discrete Heisenberg Group","55 pages with 3 figures","Russian Math. Surveys 70:4 (2015), pp 657-714","10.1070/RM2015v070n04ABEH004957",,"math.DS math.OA","http://arxiv.org/licenses/nonexclusive-distrib/1.0/","  The study of actions of countable groups by automorphisms of compact abelian
groups has recently undergone intensive development, revealing deep connections
with operator algebras and other areas. The discrete Heisenberg group is the
simplest noncommutative example, where dynamical phenomena related to its
noncommutativity already illustrate many of these connections. The explicit
structure of this group means that these phenomena have concrete descriptions,
which are not only instances of the general theory but are also testing grounds
for further work. We survey here what is known about such actions of the
discrete Heisenberg group, providing numerous examples and emphasizing many of
the open problems that remain.
","[{""version"":""v1"",""created"":""Sun, 22 Feb 2015 16:09:34 GMT""}]","2015-12-23"
"1502.06244","Vyacheslav Yukalov","V.I. Yukalov and E.P. Yukalova","Statistical models of nonequilibrium Bose gases","Latex file, 27 pages, 2 figures","Rom. Rep. Phys. 67 (2015) 159-185",,,"cond-mat.quant-gas","http://arxiv.org/licenses/nonexclusive-distrib/1.0/","  The idea is advanced that strong perturbations of an initially equilibrium
Bose-condensed gas lead to the sequence of nonequilibrium states whose order is
inverse to the sequence of states arising in the process of the Bose-gas
relaxation from an initial nonequilibrium state. An approach is described for
constructing statistical models of nonequilibrium Bose gases. The method is
based on the averaging over heterogenous configurations of a nonequilibrium
system. A statistical model of grain turbulence is suggested. A simple model is
analyzed consisting of a mixture of two phases, one gauge symmetric and the
other with broken gauge symmetry.
","[{""version"":""v1"",""created"":""Sun, 22 Feb 2015 16:18:13 GMT""}]","2015-02-24"
"1502.06245","Vladimir Samodivkin","Vladimir Samodivkin","Changing of the domination number of a graph: edge multisubdivision and
  edge removal","11 pages",,,,"math.CO","http://arxiv.org/licenses/nonexclusive-distrib/1.0/","  For a graphical property $\mathcal{P}$ and a graph $G$, a subset $S$ of
vertices of $G$ is a $\mathcal{P}$-set if the subgraph induced by $S$ has the
property $\mathcal{P}$. The domination number with respect to the property
$\mathcal{P}$, denoted by $\gamma_{\mathcal{P}} (G)$, is the minimum
cardinality of a dominating $\mathcal{P}$-set. We define the domination
multisubdivision number with respect to $\mathcal{P}$,denoted by
$msd_{\mathcal{P}}(G)$, as a minimum positive integer $k$ such that there
exists an edge which must be subdivided $k$ times to change $\gamma_\mathcal{P}
(G)$. In this paper (a) we present necessary and sufficient conditions for a
change of $\gamma_{\mathcal{P}}(G)$ after subdividing an edge of $G$ once, (b)
we prove that if $e$ is an edge of a graph $G$ then $\gamma_\mathcal{P}
(G_{e,1}) < \gamma_\mathcal{P} (G)$ if and only if $\gamma_\mathcal{P} (G-e) <
\gamma_\mathcal{P} (G)$ ($G_{e,t}$ denote the graph obtained from $G$ by
subdivision of $e$ with $t$ vertices), (c) we also prove that for every edge of
a graph $G$ is fulfilled $\gamma_{\mathcal{P}}(G-e) \leq
\gamma_{\mathcal{P}}(G_{e,3}) \leq \gamma_{\mathcal{P}}(G-e) + 1$, and (d) we
show that $msd_{\mathcal{P}}(G) \leq 3$, where $\mathcal{P}$ is hereditary and
closed under union with $K_1$.
","[{""version"":""v1"",""created"":""Sun, 22 Feb 2015 16:37:01 GMT""}]","2015-02-24"
"1502.06246","Pavel Golovinski","P.A. Golovinski, M.A. Preobrazhenskiy","The response of an electron in the image potential on the external
  steady fields",,,,,"quant-ph","http://arxiv.org/licenses/nonexclusive-distrib/1.0/","  The exact wave functions, which describe the states of an electron, bound in
the image potential, and the magnetic field, which is perpendicular to surface
of a metal, are obtained. The correction terms to the energy of an electron in
the first order of the perturbation theory with respect to the interaction with
the external electric field are calculated. The possibility of experimental
measurement of a local electric field by the level shift is analyzed.
","[{""version"":""v1"",""created"":""Sun, 22 Feb 2015 16:49:34 GMT""}]","2015-02-24"
"1502.06247","Ezequiel Maderna","Albert Fathi, Ezequiel Maderna","Weak KAM theorem on non compact manifolds","arXiv admin note: text overlap with arXiv:1004.0086 by other authors","Nonlinear Differential Equations and Applications NoDEA, October
  2007, Volume 14, Issue 1-2, pp 1-27","10.1007/s00030-007-2047-6",,"math.DS","http://arxiv.org/licenses/nonexclusive-distrib/1.0/","  In this paper, we consider a time independent $C^2$ Hamiltonian, sa\-tisfying
the usual hypothesis of the classical Calculus of Variations, on a non-compact
connected manifold. Using the Lax-Oleinik semigroup, we give a proof of the
existence of weak KAM solutions, or viscosity solutions, for the associated
Hamilton-Jacobi Equation. This proof works also in presence of symmetries. We
also study the role of the amenability of the group of symmetries to understand
when the several critical values that can be associated with the Hamiltonian
coincide.
","[{""version"":""v1"",""created"":""Sun, 22 Feb 2015 16:59:08 GMT""}]","2015-02-24"
"1502.06248","Roland Duduchava Prof.","R. Duduchava","Mellin convolution operators in Bessel potential spaces with admissible
  meromorphic kernels","52 pages, 2 figures, Original investigation. arXiv admin note: text
  overlap with arXiv:1502.02756",,,,"math.AP math.FA math.OA","http://arxiv.org/licenses/nonexclusive-distrib/1.0/","  The paper is devoted to Mellin convolution operators with meromorphic kernels
in Bessel potential spaces. We encounter such operators while investigating
boundary value problems for elliptic equations in planar 2D domains with
angular points on the boundary.
  Our study is based upon two results. The first concerns commutants of Mellin
convolution and Bessel potential operators: Bessel potentials alter essentially
after commutation with Mellin convolutions depending on the poles of the kernel
(in contrast to commutants with Fourier convolution operatiors.) The second
basic ingredient is the results on the Banach algebra $\mathfrak{A}_p$
generated by Mellin convolution and Fourier convolution operators in weighted
$\mathbb{L}_p$-spaces obtained by the author in 1970's and 1980's. These
results are modified by adding Hankel operators. Examples of Mellin convolution
operators are considered.
  The first version of the paper was published in {\em Memoirs on Differential
Equations and Mathematical Physics} {\bf 60}, 135-177, 2013. The formulations
and proofs there contain fatal errors, which are improved in the present
preprint. Part of the results, obtained with V. Didenko, are published in the
preprint
","[{""version"":""v1"",""created"":""Sun, 22 Feb 2015 17:10:50 GMT""},{""version"":""v2"",""created"":""Mon, 6 Apr 2015 17:18:45 GMT""},{""version"":""v3"",""created"":""Sun, 27 Mar 2016 10:04:18 GMT""}]","2016-03-29"
"1502.06249","Massimiliano Sassoli de Bianchi","Diederik Aerts and Massimiliano Sassoli de Bianchi","A possible solution to the second entanglement paradox","7 pages","In D. Aerts, C. de Ronda, H. Freytes and R. Giuntini (Eds.),
  Probing the Meaning of Quantum Mechanics (pp. 351-360). Singapore: World
  Scientific (2016)","10.1142/9789813146280_0016",,"quant-ph","http://arxiv.org/licenses/nonexclusive-distrib/1.0/","  Entangled states are in conflict with a general physical principle which
expresses that a composite entity exists if and only if its components also
exist, and the hypothesis that pure states represent the actuality of a
physical entity, i.e., its 'existence'. A possible way to solve this paradox
consists in completing the standard formulation of quantum mechanics, by adding
more pure states. We show that this can be done, in a consistent way, by using
the extended Bloch representation of quantum mechanics, recently introduced to
provide a possible solution to the measurement problem. Hence, with the
solution proposed by the extended Bloch representation of quantum mechanics,
the situation of entangled states regains full intelligibility.
","[{""version"":""v1"",""created"":""Sun, 22 Feb 2015 17:13:46 GMT""},{""version"":""v2"",""created"":""Tue, 19 Jan 2016 21:05:54 GMT""}]","2023-03-01"
"1502.06250","Aleksandr Cariow","Aleksandr Cariow, Galina Cariowa, Jaroslaw Knapinski","Derivation of a low multiplicative complexity algorithm for multiplying
  hyperbolic octonions","15 pages, 4 figures",,,,"cs.DS","http://arxiv.org/licenses/nonexclusive-distrib/1.0/","  We present an efficient algorithm to multiply two hyperbolic octonions. The
direct multiplication of two hyperbolic octonions requires 64 real
multiplications and 56 real additions. More effective solutions still do not
exist. We show how to compute a product of the hyperbolic octonions with 26
real multiplications and 92 real additions. During synthesis of the discussed
algorithm we use the fact that product of two hyperbolic octonions may be
represented as a matrix - vector product. The matrix multiplicand that
participates in the product calculating has unique structural properties that
allow performing its advantageous factorization. Namely this factorization
leads to significant reducing of the computational complexity of hyperbolic
octonions multiplication.
","[{""version"":""v1"",""created"":""Sun, 22 Feb 2015 17:17:44 GMT""}]","2015-02-24"
"1502.06251","Edward Shuryak","Edward Shuryak","Gauge topology and confinement: an update","This is a writeup for proceedings of the 9th International Workshop
  on Critical Point and Onset of Deconfinement - CPOD2014. A talk of similar
  structure and content has also been given at The 32nd International Symposium
  on Lattice Field Theory, Columbia University, New York, June 2014",,,,"hep-ph hep-lat","http://arxiv.org/licenses/nonexclusive-distrib/1.0/","  In the instanton ensemble the fermionic zero modes collectivize and break
chiral symmetry. Recent studies of resulting zero mode zone confirm its very
small width and overall importance for lattice simulations.
  Confinement however has been related with completely different topological
objects, the magnetic monopoles. Instanton constituents -- instanton dyons,
discovered at nonzero holonomy by Pierre van Baal and others -- are able to
explain both confinement and chiral symmetry breaking. The talk summarizes
recent works deriving the instanton-dyon mutual interactions, and statistical
studies of their ensemble. At high density the screening is robust enough to do
it analytically, in the mean-field-type approach: we call this limit Dense
Dyonic Plasma (DDP). Above $T_c$ the classical interaction between the dyons
induce strong correlations and should be studied by direct numerical
simulations. Those works are now in progress.
","[{""version"":""v1"",""created"":""Sun, 22 Feb 2015 17:23:18 GMT""}]","2015-02-24"
"1502.06252","Gerd Petzoldt","Th. Brenner, P. Fierlinger, P. Geltenbort, E. Gutsmiedl, A. Hollering,
  T. Lauer, G. Petzoldt, D. Ruhstorfer, K. M. Seeman, O. Soltwedel, St.
  Stuiber, B. Taubenheim, D. Windmayer, T. Zechlau","Deuterated polyethylene coatings for ultra-cold neutron applications","4 pages, 3 figures",,"10.1063/1.4931388",,"physics.ins-det","http://arxiv.org/licenses/nonexclusive-distrib/1.0/","  We report on the fabrication and use of deuterated polyethylene (dPE) as a
coating material for ultra-cold neutron (UCN) storage and transport. The Fermi
potential has been determined to be 214~neV and the wall loss coefficient
$\eta$ is 1.3$\cdot$10$^4$ per wall collision. The coating technique allows for
a wide range of applications and new possibilities in this field of physics. In
particular, flexible and quasi-massless UCN guides with slit-less shutters and
slit-less UCN storage volumes become possible. These properties enable the use
in next-generation measurements of the electric dipole moment of the neutron.
","[{""version"":""v1"",""created"":""Sun, 22 Feb 2015 17:32:49 GMT""},{""version"":""v2"",""created"":""Mon, 18 May 2015 16:42:49 GMT""},{""version"":""v3"",""created"":""Thu, 5 Nov 2015 08:45:28 GMT""}]","2015-11-06"
"1502.06253","Rajan Amit Mehta","Rajan Amit Mehta","Modular Classes of Lie Groupoid Representations up to Homotopy",,"SIGMA 11 (2015), 058, 10 pages","10.3842/SIGMA.2015.058",,"math.DG","http://creativecommons.org/licenses/by-nc-sa/4.0/","  We describe a construction of the modular class associated to a
representation up to homotopy of a Lie groupoid. In the case of the adjoint
representation up to homotopy, this class is the obstruction to the existence
of a volume form, in the sense of Weinstein's ""The volume of a differentiable
stack"".
","[{""version"":""v1"",""created"":""Sun, 22 Feb 2015 17:47:44 GMT""},{""version"":""v2"",""created"":""Tue, 16 Jun 2015 22:45:15 GMT""},{""version"":""v3"",""created"":""Sat, 25 Jul 2015 04:54:00 GMT""}]","2015-07-28"
"1502.06254","Vladimir Vovk","Vladimir Vovk","The fundamental nature of the log loss function","12 pages",,,,"cs.LG stat.ME","http://arxiv.org/licenses/nonexclusive-distrib/1.0/","  The standard loss functions used in the literature on probabilistic
prediction are the log loss function, the Brier loss function, and the
spherical loss function; however, any computable proper loss function can be
used for comparison of prediction algorithms. This note shows that the log loss
function is most selective in that any prediction algorithm that is optimal for
a given data sequence (in the sense of the algorithmic theory of randomness)
under the log loss function will be optimal under any computable proper mixable
loss function; on the other hand, there is a data sequence and a prediction
algorithm that is optimal for that sequence under either of the two other
standard loss functions but not under the log loss function.
","[{""version"":""v1"",""created"":""Sun, 22 Feb 2015 17:58:05 GMT""},{""version"":""v2"",""created"":""Sun, 28 Jun 2015 15:00:20 GMT""}]","2015-06-30"
"1502.06255","Debashis Gangopadhyay","Debashis Gangopadhyay and Goutam Manna","Cosmology in presence of dark energy in an emergent gravity scenario","Latex, 8pages, 2figures",,,,"gr-qc","http://arxiv.org/licenses/nonexclusive-distrib/1.0/","  We obtain the analogues of the Friedman equations in an emergent gravity
scenario in the presence of dark energy. The background metric is taken to be
Friedman-Lemaitre-Robertson-Walker (FLRW). We show that if $\dot\phi ^{2}$ is
the dark energy density (in units of the critical density) then (a) for total
energy density greater than the pressure (non-relativistic scenario, matter
domination) the deceleration parameter $q(t)\approx\frac {1}{2} [1 + 27
\dot\phi ^{2}+...] > \frac{1}{2}$ (b) for total energy density equal to 3 times
the pressure (relativistic case, radiation domination), the deceleration
parameter $q(t)\approx 1 + 18\dot\phi ^{2} +... > 1$ and (c) for total energy
density equal to the negative of the pressure (dark energy scenario), the
deceleration parameter $q(t)< -1$. Our results indicate that many aspects of
standard cosmology can be accommodated with the presence of dark energy right
from the beginning of the universe where the time parameter $t\equiv
\frac{t}{t_{0}}$, $t_{0}$ being the present epoch.
","[{""version"":""v1"",""created"":""Sun, 22 Feb 2015 18:05:43 GMT""}]","2015-02-24"
"1502.06256","Gregory Kucherov","Karel Brinda and Maciej Sykulski and Gregory Kucherov","Spaced seeds improve k-mer-based metagenomic classification","23 pages","Bioinformatics (2015) 31 (22): 3584-3592","10.1093/bioinformatics/btv419",,"q-bio.GN cs.CE cs.LG","http://arxiv.org/licenses/nonexclusive-distrib/1.0/","  Metagenomics is a powerful approach to study genetic content of environmental
samples that has been strongly promoted by NGS technologies. To cope with
massive data involved in modern metagenomic projects, recent tools [4, 39] rely
on the analysis of k-mers shared between the read to be classified and sampled
reference genomes. Within this general framework, we show in this work that
spaced seeds provide a significant improvement of classification accuracy as
opposed to traditional contiguous k-mers. We support this thesis through a
series a different computational experiments, including simulations of
large-scale metagenomic projects. Scripts and programs used in this study, as
well as supplementary material, are available from
http://github.com/gregorykucherov/spaced-seeds-for-metagenomics.
","[{""version"":""v1"",""created"":""Sun, 22 Feb 2015 18:30:58 GMT""},{""version"":""v2"",""created"":""Thu, 5 Mar 2015 18:25:54 GMT""},{""version"":""v3"",""created"":""Thu, 9 Jul 2015 09:47:00 GMT""}]","2016-03-17"
"1502.06257","Junbin Li","Junbin Li, Xi-Ping Zhu","Local existence in retarded time under a weak decay on complete null
  cones","30 pages. arXiv admin note: text overlap with arXiv:1406.0048",,"10.1007/s11425-015-5056-7",,"gr-qc math.AP","http://arxiv.org/licenses/nonexclusive-distrib/1.0/","  In the previous paper \cite{L-Z}, for a characteristic problem with not
necessarily small initial data given on a complete null cone decaying like that
in the work \cite{Ch-K} of the stability of Minkowski spacetime by
Christodoulou and Klainerman, we proved the local existence in retarded time,
which means the solution to the vacuum Einstein equations exists in a uniform
future neighborhood, while the global existence in retarded time is the weak
cosmic censorship conjecture. In this paper, we prove that the local existence
in retarded time still holds when the data is assumed to decay slower, like
that in Bieri's work \cite{Bie} on the extension to the stability of Minkowski
spacetime. Such decay guarantees the existence of the limit of the Hawking mass
on the initial null cone, when approaching to infinity, in an optimal way.
","[{""version"":""v1"",""created"":""Sun, 22 Feb 2015 18:31:48 GMT""}]","2016-01-20"
"1502.06258","Luca Fabrizio Di Cerbo","Gabriele Di Cerbo, Luca F. Di Cerbo","On the canonical divisor of smooth toroidal compactifications","Title shortened to match published version","Math. Res. Lett. 24 (2017), no. 4, 1005-1022",,,"math.AG math.DG math.GT","http://arxiv.org/licenses/nonexclusive-distrib/1.0/","  In this paper, we show that the canonical divisor of a smooth toroidal
compactification of a complex hyperbolic manifold must be nef if the dimension
is greater or equal to three. Moreover, if $n\geq 3$ we show that the numerical
dimension of the canonical divisor of a smooth $n$-dimensional compactification
is always bigger or equal to $n-1$. We also show that up to a finite \'etale
cover all such compactifications have ample canonical class, therefore refining
a classical theorem of Mumford and Tai. Finally, we improve in all dimensions
$n\geq 3$ the cusp count for finite volume complex hyperbolic manifolds given
in [DD15a].
","[{""version"":""v1"",""created"":""Sun, 22 Feb 2015 18:40:12 GMT""},{""version"":""v2"",""created"":""Mon, 16 Mar 2015 21:28:25 GMT""},{""version"":""v3"",""created"":""Thu, 9 Apr 2015 20:24:16 GMT""},{""version"":""v4"",""created"":""Tue, 3 May 2016 15:19:18 GMT""},{""version"":""v5"",""created"":""Fri, 13 Oct 2017 19:26:16 GMT""}]","2017-10-17"
"1502.06259","Alexander Gasnikov","Alexander Gasnikov, Pavel Dvurechensky, Dmitry Kamzolov","Gradient and gradient-free methods for stochastic convex optimization
  with inexact oracle","9 pages, in Russian",,,,"math.OC","http://arxiv.org/licenses/nonexclusive-distrib/1.0/","  In the paper we generalize universal gradient method (Yu. Nesterov) to
strongly convex case and to Intermediate gradient method
(Devolder-Glineur-Nesterov). We also consider possible generalizations to
stochastic and online context. We show how these results can be generalized to
gradient-free method and method of random direction search. But the main
ingridient of this paper is assumption about the oracle. We considered the
oracle to be inexact.
","[{""version"":""v1"",""created"":""Sun, 22 Feb 2015 18:47:03 GMT""},{""version"":""v2"",""created"":""Wed, 11 Mar 2015 22:54:38 GMT""},{""version"":""v3"",""created"":""Mon, 31 Aug 2015 13:40:14 GMT""},{""version"":""v4"",""created"":""Wed, 9 Mar 2016 10:26:29 GMT""},{""version"":""v5"",""created"":""Mon, 28 Mar 2016 18:47:53 GMT""}]","2016-03-29"
"1502.06260","Xin Yuan","Xin Yuan, Tsung-Han Tsai, Ruoyu Zhu, Patrick Llull, David Brady,
  Lawrence Carin","Compressive Hyperspectral Imaging with Side Information","20 pages, 21 figures. To appear in the IEEE Journal of Selected
  Topics Signal Processing",,"10.1109/JSTSP.2015.2411575",,"cs.CV","http://arxiv.org/licenses/nonexclusive-distrib/1.0/","  A blind compressive sensing algorithm is proposed to reconstruct
hyperspectral images from spectrally-compressed measurements.The
wavelength-dependent data are coded and then superposed, mapping the
three-dimensional hyperspectral datacube to a two-dimensional image. The
inversion algorithm learns a dictionary {\em in situ} from the measurements via
global-local shrinkage priors. By using RGB images as side information of the
compressive sensing system, the proposed approach is extended to learn a
coupled dictionary from the joint dataset of the compressed measurements and
the corresponding RGB images, to improve reconstruction quality. A prototype
camera is built using a liquid-crystal-on-silicon modulator. Experimental
reconstructions of hyperspectral datacubes from both simulated and real
compressed measurements demonstrate the efficacy of the proposed inversion
algorithm, the feasibility of the camera and the benefit of side information.
","[{""version"":""v1"",""created"":""Sun, 22 Feb 2015 19:10:31 GMT""}]","2015-10-28"
"1502.06261","Svend-Age Biehs","Svend-Age Biehs, Slawa Lang, Alexander Yu. Petrov, Manfred Eich, and
  Philippe Ben-Abdallah","Hyperbolic blackbody",,"Phys. Rev. Lett. 115, 174301 (2015)","10.1103/PhysRevLett.115.174301",,"physics.optics cond-mat.stat-mech","http://arxiv.org/licenses/nonexclusive-distrib/1.0/","  The blackbody theory is revisited in the case of thermal electromagnetic
fields inside uniaxial anisotropic media in thermal equilibrium with a heat
bath. When these media are hyperbolic, we show that the spectral energy density
of these fields radically differs from that predicted by Planck's blackbody
theory. We demonstrate that the maximum of their spectral energy density is
shifted towards frequencies smaller than Wien's frequency making these media
apparently colder. Finally, we derive Stefan-Boltzmann's law for hyperbolic
media which becomes a quadratic function of the heat bath temperature.
","[{""version"":""v1"",""created"":""Sun, 22 Feb 2015 19:11:12 GMT""}]","2015-10-26"
"1502.06262","Marcelo Sobottka","Daniel Gon\c{c}alves, Marcelo Sobottka and Charles Starling","Sliding block codes between shift spaces over infinite alphabets","15 pages. Revised text","Mathematische Nachrichten (2016), 289, 17, 2178-2191","10.1002/mana.201500309",,"math.DS math.OA","http://arxiv.org/licenses/nonexclusive-distrib/1.0/","  Recently Ott, Tomforde and Willis introduced a notion of one-sided shifts
over infinite alphabets and proposed a definition for sliding block codes
between such shift spaces. In this work we propose a more general definition
for sliding block codes between Ott-Tomforde-Willis shift spaces and then we
prove Curtis-Hedlund-Lyndon type theorems for them, finding sufficient and
necessary conditions under which the class of the sliding block codes coincides
with the class of continuous shift-commuting maps.
","[{""version"":""v1"",""created"":""Sun, 22 Feb 2015 19:31:25 GMT""},{""version"":""v2"",""created"":""Fri, 19 Jun 2015 19:05:26 GMT""},{""version"":""v3"",""created"":""Tue, 14 Feb 2017 17:42:49 GMT""}]","2018-02-15"
"1502.06263","Alexy Karenowska","Alexy D. Karenowska, Andrew D. Patterson, Michael J. Peterer, Einar B.
  Magn\'usson, and Peter J. Leek","Excitation and detection of propagating spin waves at the single magnon
  level","18 pages, 5 figures",,,,"cond-mat.mes-hall","http://arxiv.org/licenses/nonexclusive-distrib/1.0/","  Ferro- and ferrimagnets play host to small-signal, microwave-frequency
magnetic excitations called spin waves, the quanta of which are known as
magnons. Over the last decade, the field of spin-wave dynamics has contributed
much to our understanding of fundamental magnetism. To date, experiments have
focussed overwhelmingly on the study of room-temperature systems within
classical limits. Here we demonstrate, for the first time, the excitation and
detection of propagating spin waves at the single magnon level. Our results
allow us to project that coupling of propagating spin-wave excitations to
quantum circuits is achievable, enabling fundamental quantum-level studies of
magnon systems and potentially opening doors to novel hybrid quantum
measurement and information processing devices.
","[{""version"":""v1"",""created"":""Sun, 22 Feb 2015 19:52:26 GMT""}]","2015-02-24"
