"1502.06357","Tobias Mai","Tobias Mai, Roland Speicher, Moritz Weber","Absence of algebraic relations and of zero divisors under the assumption
  of full non-microstates free entropy dimension","this is an extended version of arXiv:1407.5715",,,,"math.OA","http://arxiv.org/licenses/nonexclusive-distrib/1.0/","  We show that in a tracial and finitely generated $W^\ast$-probability space
existence of conjugate variables excludes algebraic relations for the
generators. Moreover, under the assumption of maximal non-microstates free
entropy dimension, we prove that there are no zero divisors in the sense that
the product of any non-commutative polynomial in the generators with any
element from the von Neumann algebra is zero if and only if at least one of
those factors is zero. In particular, this shows that in this case the
distribution of any non-constant self-adjoint non-commutative polynomial in the
generators does not have atoms.
  Questions on the absence of atoms for polynomials in non-commuting random
variables (or for polynomials in random matrices) have been an open problem for
quite a while. We solve this general problem by showing that maximality of free
entropy dimension excludes atoms.
","[{""version"":""v1"",""created"":""Mon, 23 Feb 2015 09:31:36 GMT""},{""version"":""v2"",""created"":""Wed, 2 Sep 2015 14:16:48 GMT""}]","2015-09-03"
"1502.06358","Min Yang","Min Yang, Yong Li, Chong Meng, Caixing Fu, Jun Mei, Zhiyu Yang, and
  Ping Sheng","Sound Absorption by Subwavelength Membrane Structures: A Generalized
  Perspective","8 pages, 7 figures",,"10.1016/j.crme.2015.06.008",,"cond-mat.mtrl-sci","http://arxiv.org/licenses/nonexclusive-distrib/1.0/","  Decorated membrane, comprising a thin layer of elastic film with small rigid
platelets fixed on top, has been found to be an efficient absorber of low
frequency sound. In this work we consider the problem of sound absorption from
a perspective aimed at deriving upper bounds under different scenarios, i.e.,
whether the sound is incident from one side only or from both sides, and
whether there is a reflecting surface on the back side of the membrane. By
considering the negligible thickness of the membrane, usually on the order of a
fraction of one millimeter, we derive a relation showing that the sum of the
incoming sound waves' (complex) pressure amplitudes, averaged over the area of
the membrane, must be equal to that of the outgoing waves. By using this
relation, and without going to any details of the wave solutions, it is shown
that the maximum absorption achievable from one-side incident is 50%, while the
maximum absorption with a back reflecting surface can reach 100%. The latter
was attained by the hybridized resonances. All the results are shown to be in
excellent agreement with the experiments. This generalized perspective, when
used together with the Green function formalism, can be useful in gaining
insights and delineating the constraints on what are achievable in scatterings
and absorption by thin film structures.
","[{""version"":""v1"",""created"":""Mon, 23 Feb 2015 09:33:23 GMT""}]","2015-09-15"
"1502.06359","Luca Amaru","Luca Amaru, Pierre-Emmanuel Gaillardon, Anupam Chattopadhyay, Giovanni
  De Micheli","A Sound and Complete Axiomatization of Majority-n Logic","Accepted by the IEEE Transactions on Computers",,"10.1109/TC.2015.2506566",,"cs.LO","http://arxiv.org/licenses/nonexclusive-distrib/1.0/","  Manipulating logic functions via majority operators recently drew the
attention of researchers in computer science. For example, circuit optimization
based on majority operators enables superior results as compared to traditional
logic systems. Also, the Boolean satisfiability problem finds new solving
approaches when described in terms of majority decisions. To support computer
logic applications based on majority a sound and complete set of axioms is
required. Most of the recent advances in majority logic deal only with ternary
majority (MAJ- 3) operators because the axiomatization with solely MAJ-3 and
complementation operators is well understood. However, it is of interest
extending such axiomatization to n-ary majority operators (MAJ-n) from both the
theoretical and practical perspective. In this work, we address this issue by
introducing a sound and complete axiomatization of MAJ-n logic. Our
axiomatization naturally includes existing majority logic systems. Based on
this general set of axioms, computer applications can now fully exploit the
expressive power of majority logic.
","[{""version"":""v1"",""created"":""Mon, 23 Feb 2015 09:42:56 GMT""},{""version"":""v2"",""created"":""Thu, 26 Mar 2015 20:38:22 GMT""},{""version"":""v3"",""created"":""Wed, 25 Nov 2015 10:36:25 GMT""}]","2016-11-15"
"1502.06360","Giovanni Bernardi","Giovanni Bernardi (Trinity College Dublin), Matthew Hennessy (Trinity
  College Dublin)","Mutually Testing Processes",,"Logical Methods in Computer Science, Volume 11, Issue 2 (April 14,
  2015) lmcs:776","10.2168/LMCS-11(2:1)2015",,"cs.LO","http://arxiv.org/licenses/nonexclusive-distrib/1.0/","  In the standard testing theory of DeNicola-Hennessy one process is considered
to be a refinement of another if every test guaranteed by the former is also
guaranteed by the latter. In the domain of web services this has been recast,
with processes viewed as servers and tests as clients. In this way the standard
refinement preorder between servers is determined by their ability to satisfy
clients. But in this setting there is also a natural refinement preorder
between clients, determined by their ability to be satisfied by servers. In
more general settings where there is no distinction between clients and
servers, but all processes are peers, there is a further refinement preorder
based on the mutual satisfaction of peers. We give a uniform account of these
three preorders. In particular we give two characterisations. The first is
behavioural, in terms of traces and ready sets. The second, for finite
processes, is equational.
","[{""version"":""v1"",""created"":""Mon, 23 Feb 2015 09:44:11 GMT""},{""version"":""v2"",""created"":""Mon, 13 Apr 2015 19:51:57 GMT""}]","2015-07-01"
"1502.06361","Elisa Paoli","Elisa Paoli","Small time asymptotic on the diagonal for H\""ormander's type
  hypoelliptic operators","30 pages. Corrected some typos and added remarks",,,"SISSA 10/2015/MATE","math.AP math.DG math.DS","http://arxiv.org/licenses/nonexclusive-distrib/1.0/","  We compute the small time asymptotic of the fundamental solution of
H\""ormander's type hypoelliptic operators with drift, at a stationary point,
$x_0$, of the drift field. We show that the order of the asymptotic depends on
the controllability of an associated control problem and of its approximating
system. If the control problem of the approximating system is controllable at
$x_0$, then so is also the original control problem, and in this case we show
that the fundamental solution blows up as $t^{-N/2}$, where $N$ is a number
determined by the Lie algebra at $x_0$ of the fields, that define the
hypoelliptic operator.
","[{""version"":""v1"",""created"":""Mon, 23 Feb 2015 09:47:08 GMT""},{""version"":""v2"",""created"":""Sat, 27 Jun 2015 14:24:47 GMT""}]","2015-06-30"
"1502.06362","Masrour Zoghi","Miroslav Dud\'ik and Katja Hofmann and Robert E. Schapire and
  Aleksandrs Slivkins and Masrour Zoghi","Contextual Dueling Bandits","25 pages, 4 figures, Published at COLT 2015",,,,"cs.LG","http://arxiv.org/licenses/nonexclusive-distrib/1.0/","  We consider the problem of learning to choose actions using contextual
information when provided with limited feedback in the form of relative
pairwise comparisons. We study this problem in the dueling-bandits framework of
Yue et al. (2009), which we extend to incorporate context. Roughly, the
learner's goal is to find the best policy, or way of behaving, in some space of
policies, although ""best"" is not always so clearly defined. Here, we propose a
new and natural solution concept, rooted in game theory, called a von Neumann
winner, a randomized policy that beats or ties every other policy. We show that
this notion overcomes important limitations of existing solutions, particularly
the Condorcet winner which has typically been used in the past, but which
requires strong and often unrealistic assumptions. We then present three
efficient algorithms for online learning in our setting, and for approximating
a von Neumann winner from batch-like data. The first of these algorithms
achieves particularly low regret, even when data is adversarial, although its
time and space requirements are linear in the size of the policy space. The
other two algorithms require time and space only logarithmic in the size of the
policy space when provided access to an oracle for solving classification
problems on the space.
","[{""version"":""v1"",""created"":""Mon, 23 Feb 2015 09:47:54 GMT""},{""version"":""v2"",""created"":""Sat, 13 Jun 2015 21:56:25 GMT""}]","2015-06-16"
"1502.06363","Marta Volonteri","Marta Volonteri, Pedro R. Capelo, Hagai Netzer, Jillian Bellovary,
  Massimo Dotti, Fabio Governato","Growing black holes and galaxies: black hole accretion versus star
  formation rate","Accepted for publication in MNRAS",,"10.1093/mnras/stv387",,"astro-ph.GA astro-ph.CO","http://arxiv.org/licenses/nonexclusive-distrib/1.0/","  We present a new suite of hydrodynamical simulations and use it to study, in
detail, black hole and galaxy properties. The high time, spatial and mass
resolution, and realistic orbits and mass ratios, down to 1:6 and 1:10, enable
us to meaningfully compare star formation rate (SFR) and BH accretion rate
(BHAR) timescales, temporal behaviour and relative magnitude. We find that (i)
BHAR and galaxy-wide SFR are typically temporally uncorrelated, and have
different variability timescales, except during the merger proper, lasting
~0.2-0.3 Gyr. BHAR and nuclear (<100 pc) SFR are better correlated, and their
variability are similar. Averaging over time, the merger phase leads typically
to an increase by a factor of a few in the BHAR/SFR ratio. (ii) BHAR and
nuclear SFR are intrinsically proportional, but the correlation lessens if the
long-term SFR is measured. (iii) Galaxies in the remnant phase are the ones
most likely to be selected as systems dominated by an active galactic nucleus
(AGN), because of the long time spent in this phase. (iv) The timescale over
which a given diagnostic probes the SFR has a profound impact on the recovered
correlations with BHAR, and on the interpretation of observational data.
","[{""version"":""v1"",""created"":""Mon, 23 Feb 2015 09:50:53 GMT""}]","2015-06-23"
"1502.06364","Yunzhong Chen","Yunzhong Chen, Felix Trier, Takeshi Kasama, Dennis V. Christensen,
  Nicolas Bovet, Han Li, Zoltan I. Balogh, Karl T. S. Thyd\'en, Wei Zhang,
  Sadegh Yazdi, Poul Norby, Nini Pryds, and S{\o}ren Linderoth","Creation of high mobility two-dimensional electron gases via strain
  induced polarization at an otherwise nonpolar complex oxide interface","19 pages, 4 figs; Nano Letters,2015, published online",,"10.1021/nl504622w",,"cond-mat.mtrl-sci","http://arxiv.org/licenses/nonexclusive-distrib/1.0/","  The discovery of two-dimensional electron gases (2DEGs) in SrTiO3-based
heterostructures provides new opportunities for nanoelectronics. Herein, we
create a new type of oxide 2DEG by the epitaxial-strain-induced polarization at
an otherwise nonpolar perovskite-type interface of CaZrO3/SrTiO3. Remarkably,
this heterointerface is atomically sharp, and exhibits a high electron mobility
exceeding 60,000 cm2V-1s-1 at low temperatures. The 2DEG carrier density
exhibits a critical dependence on the film thickness, in good agreement with
the polarization induced 2DEG scheme.
","[{""version"":""v1"",""created"":""Mon, 23 Feb 2015 09:55:06 GMT""}]","2015-02-24"
"1502.06365","Georg Schmidt","R. G\""ockeritz, N. Homonnay, A. M\""uller, T. Richter, B. Fuhrmann, and
  G. Schmidt","Nanosized Vertical Organic Spin-Valves","6 pages, 3 figures",,"10.1063/1.4914830",,"cond-mat.mes-hall cond-mat.mtrl-sci","http://arxiv.org/licenses/nonexclusive-distrib/1.0/","  A fabrication process for vertical organic spin-valve devices has been
developed which offers the possibility to achieve active device areas of less
than 500x500 nm^2 and is flexible in terms of material choice for the active
layers. Characterization of the resulting devices shows a large
magnetoresistance of sometimes more than 100%, however with equally large
variation from device to device. Comparison with large-area spin-valves
indicates that the magnetoresistance of both, large and small devices most
likely originates from tunneling through pinholes and tunneling
magnetoresistance.
","[{""version"":""v1"",""created"":""Mon, 23 Feb 2015 10:01:56 GMT""}]","2015-06-23"
"1502.06366","Hans-Christian Koch","H.-C. Koch, G. Bison, Z. D. Gruji\'c, W. Heil, M. Kasprzak, P.
  Knowles, A. Kraft, A. Pazgalev, A. Schnabel, J. Voigt, A. Weis","Design and performance of an absolute $^3$He/Cs magnetometer","The final publication is available at Springer via
  http://dx.doi.org/10.1140/epjd/e2015-60018-7","Eur. Phys. J. D (2015) 69: 202","10.1140/epjd/e2015-60018-7",,"physics.atom-ph","http://arxiv.org/licenses/nonexclusive-distrib/1.0/","  We report on the design and performance of a highly sensitive combined
$^3$He/Cs magnetometer for the absolute measurement of magnetic fields. The
magnetometer relies on the magnetometric detection of the free spin precession
of nuclear spin polarized $^3$He gas by optically pumped cesium magnetometers.
We plan to deploy this type of combined magnetometer in an experiment searching
for a permanent electric dipole moment of ultracold neutrons at the Paul
Scherrer Institute (Switzerland). A prototype magnetometer was built at the
University of Fribourg (Switzerland) and tested at Physikalisch-Technische
Bundesanstalt (Berlin, Germany). We demonstrate that the combined magnetometer
allows Cram\'er-Rao- limited field determinations with recording times in the
range of $\sim 500\mathrm{s}$, measurements above $500\mathrm{s}$ being limited
by the stability of the applied magnetic field. % With a $100\mathrm{s}$
recording time we were able to perform an absolute measurement of a magnetic
field of $\approx1\mathrm{\mu T}$ with a standard uncertainty of $\Delta
B\sim60\mathrm{fT}$, corresponding to $\Delta B/B<$6$\times$10$^{-8}$.
","[{""version"":""v1"",""created"":""Mon, 23 Feb 2015 10:06:52 GMT""},{""version"":""v2"",""created"":""Mon, 24 Aug 2015 13:26:06 GMT""}]","2015-08-25"
"1502.06367","Yohsuke Watanabe","Yohsuke Watanabe","Intersection numbers in the curve graph with a uniform constant","Minor revisions following comments from the referees",,,,"math.GT","http://arxiv.org/licenses/nonexclusive-distrib/1.0/","  We derive various inequalities involving the intersection number of the
curves contained in geodesics and tight geodesics in the curve graph. While
there already exist such inequalities on tight geodesics, our method applies in
the setting of geodesics. Furthermore, the method gives inequalities with a
uniform constant depending only on the topology of the surface.
","[{""version"":""v1"",""created"":""Mon, 23 Feb 2015 10:08:24 GMT""},{""version"":""v2"",""created"":""Sat, 25 Jul 2015 21:54:52 GMT""},{""version"":""v3"",""created"":""Fri, 11 Mar 2016 13:42:42 GMT""}]","2016-03-14"
"1502.06368","Jie Lu","Jie Lu and Mikael Johansson","Convergence analysis of approximate primal solutions in dual first-order
  methods",,,,,"math.OC","http://arxiv.org/licenses/nonexclusive-distrib/1.0/","  Dual first-order methods are powerful techniques for large-scale convex
optimization. Although an extensive research effort has been devoted to
studying their convergence properties, explicit convergence rates for the
primal iterates have only been established under global Lipschitz continuity of
the dual gradient. This is a rather restrictive assumption that does not hold
for several important classes of problems. In this paper, we demonstrate that
primal convergence rate guarantees can also be obtained when the dual gradient
is only locally Lipschitz. The class of problems that we analyze admits general
convex constraints including nonlinear inequality, linear equality, and set
constraints. As an approximate primal solution, we take the minimizer of the
Lagrangian, computed when evaluating the dual gradient. We derive error bounds
for this approximate primal solution in terms of the errors of the dual
variables, and establish convergence rates of the dual variables when the dual
problem is solved using a projected gradient or fast gradient method. By
combining these results, we show that the suboptimality and infeasibility of
the approximate primal solution at iteration $k$ are no worse than
$O(1/\sqrt{k})$ when the dual problem is solved using a projected gradient
method, and $O(1/k)$ when a fast dual gradient method is used.
","[{""version"":""v1"",""created"":""Mon, 23 Feb 2015 10:09:41 GMT""}]","2015-02-24"
"1502.06369","Mostafa Zaman Chowdhury","Mostafa Zaman Chowdhury, Bui Minh Trung, and Yeong Min Jang","Neighbor Cell List Optimization for Femtocell-to-Femtocell Handover in
  Dense Femtocellular Networks","International Conference on Ubiquitous and Future Networks (ICUFN),
  June 2011, Dalian, China, pp 241-245",,,,"cs.NI","http://creativecommons.org/licenses/by/3.0/","  Dense femtocells are the ultimate goal of the femtocellular network
deployment. Among three types of handovers: femtocell-to-macrocell,
macrocell-to-femtocell, and femtocell-to-femtocell, the latter two are the main
concern for the dense femtocellular network deployment. For these handover
cases, minimum as well appropriate neighbor cell list is the key element for
the successful handover. In this paper, we propose an algorithm to make minimum
but appropriate number of neighbor femtocell list for the
femtocell-to-femtocell handover. Our algorithm considers received signal level
from femto APs (FAPs); open and close access cases; and detected frequencyfrom
the neighbor femtocells. The simulation results show that the proposed scheme
is able to attain minimum but optimal number of neighbor femtocell list for the
possible femtocell-to-femtocell handover.
","[{""version"":""v1"",""created"":""Mon, 23 Feb 2015 10:16:30 GMT""}]","2015-02-24"
"1502.06370","Djamal Belazzougui","Djamal Belazzougui and Fabio Cunial","A framework for space-efficient string kernels",,,,,"cs.DS","http://arxiv.org/licenses/nonexclusive-distrib/1.0/","  String kernels are typically used to compare genome-scale sequences whose
length makes alignment impractical, yet their computation is based on data
structures that are either space-inefficient, or incur large slowdowns. We show
that a number of exact string kernels, like the $k$-mer kernel, the substrings
kernels, a number of length-weighted kernels, the minimal absent words kernel,
and kernels with Markovian corrections, can all be computed in $O(nd)$ time and
in $o(n)$ bits of space in addition to the input, using just a
$\mathtt{rangeDistinct}$ data structure on the Burrows-Wheeler transform of the
input strings, which takes $O(d)$ time per element in its output. The same
bounds hold for a number of measures of compositional complexity based on
multiple value of $k$, like the $k$-mer profile and the $k$-th order empirical
entropy, and for calibrating the value of $k$ using the data.
","[{""version"":""v1"",""created"":""Mon, 23 Feb 2015 10:18:16 GMT""}]","2015-02-24"
"1502.06371","Theo Le Bret","Theo Le Bret, Andrew Pontzen, Andrew P. Cooper, Carlos Frenk, Adi
  Zolotov, Alyson M. Brooks, Fabio Governato, Owen H. Parry","Particle tagging and its implications for stellar population dynamics","10 pages, 6 figures",,"10.1093/mnras/stx552",,"astro-ph.GA","http://arxiv.org/licenses/nonexclusive-distrib/1.0/","  We establish a controlled comparison between the properties of galactic
stellar halos obtained with hydrodynamical simulations and with `particle
tagging'. Tagging is a fast way to obtain stellar population dynamics: instead
of tracking gas and star formation, it `paints' stars directly onto a suitably
defined subset of dark matter particles in a collisionless, dark-matter-only
simulation.Our study shows that there are conditions under which particle
tagging generates good fits to the hydrodynamical stellar density profiles of a
central Milky-Way-like galaxy and its most prominent substructure. Phase-space
diffusion processes are crucial to reshaping the distribution of stars in
infalling spheroidal systems and hence the final stellar halo. We conclude that
the success of any particular tagging scheme hinges on this diffusion being
taken into account, at a minimum by making use of `live' tagging schemes, in
which particles are regularly tagged throughout the evolution of a galaxy.
","[{""version"":""v1"",""created"":""Mon, 23 Feb 2015 10:19:55 GMT""}]","2020-03-18"
"1502.06372","Andrea Crespi","Andrea Crespi","Suppression laws for multi-particle interference in Sylvester
  interferometers",,"Phys. Rev. A 91, 013811 (2015)","10.1103/PhysRevA.91.013811",,"quant-ph","http://arxiv.org/licenses/nonexclusive-distrib/1.0/","  Quantum interference of correlated particles is a fundamental quantum
phenomenon which carries signatures of the statistics properties of the
particles, such as bunching or anti-bunching. In presence of particular
symmetries, interference effects take place with high visibility, one of the
simplest cases being the suppression of coincident detection in the
Hong-Ou-Mandel effect. Tichy et al. recently demonstrated a simple sufficient
criterion for the suppression of output events in the more general case of
Fourier multi-port beam splitters. Here we study the case in which $2^q$
particles (either bosonic or fermionic) are injected simultaneously in
different ports of a Sylvester interferometer with $2^p \geq 2^q$ modes. In
particular, we prove a necessary and sufficient criterion for a significant
fraction of output states to be suppressed, for specific input configurations.
This may find application in assessing the indistinguishability of multiple
single photon sources and in the validation of boson sampling machines.
","[{""version"":""v1"",""created"":""Mon, 23 Feb 2015 10:22:07 GMT""}]","2015-06-24"
"1502.06373","Georg Schmidt","J. Kleinlein and G. Schmidt","Current-induced magnetization reversal in pseudo spin valves in
  current-in-plane configuration","17 pages, 5 figures",,,,"cond-mat.mes-hall","http://arxiv.org/licenses/nonexclusive-distrib/1.0/","  We demonstrate the current-induced complete magnetization reversal of the
free layer in lateral nanowires patterned from metallic pseudo spin valve
stacks. The reversal is induced by Oersted fields in conjunction with a dipolar
coupling via the lateral stray fields of the two magnetic layers. Starting from
the parallel state the Oersted field rotates the magnetization vectors of both
magnetic layers in opposite directions so far off the wire axis that the
dipolar coupling becomes strong enough to stabilize an antiparallel
configuration. As simulations and experiments show this coupling is only
achieved for a narrow range of layer thicknesses and for suitable wire
geometries. The reversal process is demonstrated as well for straight wires as
for wire segments of L-shaped wires with inhomogeneous magnetization in which
domain walls are present before and after the switching process.
","[{""version"":""v1"",""created"":""Mon, 23 Feb 2015 10:25:01 GMT""}]","2015-02-24"
"1502.06374","\c{S}\""ukr\""u Yal\c{c}inkaya","Alexandre Borovik and \c{S}\""ukr\""u Yal\c{c}{\i}nkaya","Adjoint representations of black box groups ${\rm PSL}_2(\mathbb{F}_q)$","41 pages",,"10.1016/j.jalgebra.2018.02.022",,"math.GR","http://arxiv.org/licenses/nonexclusive-distrib/1.0/","  Given a black box group $\mathsf{Y}$ encrypting $\rm{PSL}_2(\mathbb{F})$ over
an unknown field $\mathbb{F}$ of unknown odd characteristic $p$ and a global
exponent $E$ for $\mathsf{Y}$ (that is, an integer $E$ such that
$\mathsf{y}^E=1$ for all $\mathsf{y} \in \mathsf{Y}$), we present a Las Vegas
algorithm which constructs a unipotent element in $\mathsf{Y}$. The running
time of our algorithm is polynomial in $\log E$. This answers the question
posed by Babai and Beals in 1999. We also find the characteristic of the
underlying field in time polynomial in $\log E$ and linear in $p$.
  Furthermore, we construct, in probabilistic time polynomial in $\log E$,
  1. a black box group $\mathsf{X}$ encrypting $\rm{PGL}_2(\mathbb{F})
\cong\rm{SO}_3(\mathbb{F})$, its subgroup $\mathsf{Y}^\circ$ of index $2$
isomorphic to $\mathsf{Y}$ and a probabilistic polynomial in $\log E$ time
isomorphism $\mathsf{Y}^\circ \longrightarrow \mathsf{Y}$;
  2. a black box field $\mathsf{K}$, and
  3. polynomial time, in $\log E$, isomorphisms \[ \rm{SO}_3(\mathsf{K})
\longrightarrow \mathsf{X} \longrightarrow \rm{SO}_3(\mathsf{K}). \]
  If, in addition, we know $p$ and the standard explicitly given finite field
$\mathbb{F}$ isomorphic to $\mathbb{F}$ then we construct, in time polynomial
in $\log E$, isomorphism \[ \rm{SO}_3(\mathbb{F})\longrightarrow
\rm{SO}_3(\mathsf{K}). \]
  Unlike many papers on black box groups, our algorithms make no use of
additional oracles other than the black box group operations. Moreover, our
result acts as an $\rm{SL}_2$-oracle in the black box group theory.
  We implemented our algorithms in GAP and tested them for groups such as
$\rm{PSL}_2(\mathbb{F})$ for $|\mathbb{F}|=115756986668303657898962467957$ (a
prime number).
","[{""version"":""v1"",""created"":""Mon, 23 Feb 2015 10:26:22 GMT""},{""version"":""v2"",""created"":""Tue, 4 Apr 2017 16:08:21 GMT""},{""version"":""v3"",""created"":""Sat, 30 Sep 2017 11:20:31 GMT""}]","2018-03-13"
