"1504.02989","Maria Infusino Dr","M. Infusino, T. Kuna, J. L. Lebowitz, E. R. Speer","The Truncated Moment Problem on $\mathbb{N}_0$","36 pages","J. Math. Anal. Appl. 452 (2017), no. 1, 443-468","10.1016/j.jmaa.2017.02.060",,"math.PR","http://arxiv.org/licenses/nonexclusive-distrib/1.0/","  We find necessary and sufficient conditions for the existence of a
probability measure on $\mathbb{N}_0$, the nonnegative integers, whose first
$n$ moments are a given $n$-tuple of nonnegative real numbers. The results,
based on finding an optimal polynomial of degree $n$ which is nonnegative on
$\mathbb{N}_0$ (and which depends on the moments), and requiring that its
expectation be nonnegative, generalize previous results known for $n=1$, $n=2$
(the Percus-Yamada condition), and partially for $n=3$. The conditions for
realizability are given explicitly for $n\leq5$ and in a finitely computable
form for $n\geq6$. We also find, for all $n$, explicit bounds, in terms of the
moments, whose satisfaction is enough to guarantee realizability. Analogous
results are given for the truncated moment problem on an infinite discrete
semi-bounded subset of $\mathbb{R}$.
","[{""version"":""v1"",""created"":""Sun, 12 Apr 2015 16:36:10 GMT""},{""version"":""v2"",""created"":""Tue, 15 Sep 2015 14:57:30 GMT""}]","2021-08-16"
"1504.02990","Shaoshi Yang Dr.","Haijing Liu, Hui Gao, Shaoshi Yang, Tiejun Lv","Low-Complexity Downlink User Selection for Massive MIMO Systems","11 pages, 27 figures, Accepted to publish on IEEE Systems Journal --
  Special Issue on 5G Wireless Systems with Massive MIMO, Apr. 2015",,"10.1109/JSYST.2015.2422475",,"cs.IT math.IT","http://arxiv.org/licenses/nonexclusive-distrib/1.0/","  In this paper we propose a pair of low-complexity user selection schemes with
zero-forcing precoding for multiuser massive MIMO downlink systems, in which
the base station is equipped with a large-scale antenna array. First, we derive
approximations of the ergodic sum rates of the systems invoking the
conventional random user selection (RUS) and the location-dependant user
selection (LUS). Then, the optimal number of simultaneously served user
equipments (UEs), $K^*$, is investigated to maximize the sum rate
approximations. Upon exploiting $K^*$, we develop two user selection schemes,
namely $K^*$-RUS and $K^*$-LUS, where $K^*$ UEs are selected either randomly or
based on their locations. Both of the proposed schemes are independent of the
instantaneous channel state information of small-scale fading, therefore
enjoying the same extremely-low computational complexity as that of the
conventional RUS scheme. Moreover, both of our proposed schemes achieve
significant sum rate improvement over the conventional RUS. In addition, it is
worth noting that like the conventional RUS, the $K^*$-RUS achieves good
fairness among UEs.
","[{""version"":""v1"",""created"":""Sun, 12 Apr 2015 16:58:08 GMT""}]","2015-06-02"
"1504.02991","Arvind","Debmalya Das and Ritabrata Sengupta and Arvind","Measurement-based local quantum filters and their ability to transform
  quantum entanglement","7 pages revtex 1 figure","Pramana, 88(6): 82 , 2017","10.1007/s12043-017-1386-z",,"quant-ph","http://arxiv.org/licenses/nonexclusive-distrib/1.0/","  We introduce local filters as a means to detect the entanglement of bound
entangled states which do not yield to detection by witnesses based on positive
(P) maps which are not completely positive (CP). We demonstrate how such
non-detectable bound entangled states can be locally filtered into detectable
bound entangled states. Specifically, we show that a bound entangled state in
the orthogonal complement of the unextendible product bases (UPB), can be
locally filtered into a another bound entangled state that is detectable by the
Choi map. We reinterpret these filters as local measurements on locally
extended Hilbert spaces. We give explicit constructions of a measurement-based
implementation of these filters for $2 \otimes 2$ and $3 \otimes 3$ systems.
This provides us with a physical mechanism to implement such local filters.
","[{""version"":""v1"",""created"":""Sun, 12 Apr 2015 17:16:52 GMT""}]","2017-09-13"
"1504.02992","Luca Weihs","Mathias Drton and Luca Weihs","Generic Identifiability of Linear Structural Equation Models by Ancestor
  Decomposition",,,,,"stat.CO","http://arxiv.org/licenses/nonexclusive-distrib/1.0/","  Linear structural equation models, which relate random variables via linear
interdependencies and Gaussian noise, are a popular tool for modeling
multivariate joint distributions. These models correspond to mixed graphs that
include both directed and bidirected edges representing the linear
relationships and correlations between noise terms, respectively. A question of
interest for these models is that of parameter identifiability, whether or not
it is possible to recover edge coefficients from the joint covariance matrix of
the random variables. For the problem of determining generic parameter
identifiability, we present an algorithm that extends an algorithm from prior
work by Foygel, Draisma, and Drton (2012). The main idea underlying our new
algorithm is the use of ancestral subsets of vertices in the graph in
application of a decomposition idea of Tian (2005).
","[{""version"":""v1"",""created"":""Sun, 12 Apr 2015 17:24:42 GMT""}]","2015-04-14"
"1504.02993","Francisco Diego Mazzitelli","Mauro El\'ias and Francisco D. Mazzitelli","Ultraviolet cutoffs for quantum fields in cosmological spacetimes","19 pages. Minor changes. References added",,,,"gr-qc","http://arxiv.org/licenses/nonexclusive-distrib/1.0/","  We analyze critically the renormalization of quantum fields in cosmological
spacetimes, using non covariant ultraviolet cutoffs. We compute explicitly the
counterterms necessary to renormalize the semiclassical Einstein equations,
using comoving and physical ultraviolet cutoffs. In the first case, the
divergences renormalize bare conserved fluids, while in the second case it is
necessary to break the covariance of the bare theory. We point out that, in
general, the renormalized equations differ from those obtained with covariant
methods, even after absorbing the infinities and choosing the renormalized
parameters to force the consistency of the renormalized theory. We repeat the
analysis for the evolution equation for the mean value of an interacting scalar
field
","[{""version"":""v1"",""created"":""Sun, 12 Apr 2015 17:24:51 GMT""},{""version"":""v2"",""created"":""Sat, 25 Apr 2015 09:31:47 GMT""}]","2015-04-28"
"1504.02994","Edward Olszewski","Edward A. Olszewski","Dyons, Superstrings, and Wormholes","26 pages, 4 figures",,,,"hep-th","http://arxiv.org/licenses/nonexclusive-distrib/1.0/","  We construct dyon solutions on a collection of coincident D4-branes, obtained
by applying the group of T-duality transformations to a type I SO(32)
superstring theory in 10 dimensions. The dyon solutions, which are exact, are
obtained from an action consisting of the non-abelian Dirac-Born-Infeld action
and Wess-Zumino-like action. When one of the spatial dimensions of the
D4-branes is taken to be vanishingly small, the dyons are analogous to the 't
Hooft/Polyakov monopole residing in a 3+1 dimensional spacetime, where the
component of the Yang-Mills potential transforming as a Lorentz scalar is
re-interpreted as a Higgs boson transforming in the adjoint representation of
the gauge group. We next apply a T-duality transformation to the vanishingly
small spatial dimension. The result is a collection of D3-branes not all of
which are coincident. Two of the D3-branes which are separated from the others
acquire intrinsic, finite, curvature and are connected by a wormhole. The dyon
possesses electric and magnetic charges whose values on each D3-brane are the
negative of one another. The gravitational effects, which arise after the
T-duality transformation, occur despite the fact that the Lagrangian density
from which the dyon solutions have been obtained does not explicitly include
the gravitational interaction. These solutions provide a simple example of the
subtle relationship between the Yang-Mills and gravitational interactions, i.e.
gauge/gravity duality.
","[{""version"":""v1"",""created"":""Sun, 12 Apr 2015 17:25:26 GMT""}]","2015-04-14"
"1504.02995","Yuan Liao","Jianqing Fan, Yuan Liao, Han Liu","An Overview on the Estimation of Large Covariance and Precision Matrices",,,,,"stat.ME","http://arxiv.org/licenses/nonexclusive-distrib/1.0/","  Estimating large covariance and precision matrices are fundamental in modern
multivariate analysis. The problems arise from statistical analysis of large
panel economics and finance data. The covariance matrix reveals marginal
correlations between variables, while the precision matrix encodes conditional
correlations between pairs of variables given the remaining variables. In this
paper, we provide a selective review of several recent developments on
estimating large covariance and precision matrices. We focus on two general
approaches: rank based method and factor model based method. Theories and
applications of both approaches are presented. These methods are expected to be
widely applicable to analysis of economic and financial data.
","[{""version"":""v1"",""created"":""Sun, 12 Apr 2015 18:08:17 GMT""},{""version"":""v2"",""created"":""Wed, 15 Apr 2015 21:37:00 GMT""}]","2015-04-17"
"1504.02996","Kyler Kuehn","A. Poci, K. Kuehn, and the DES Collaboration: T. Abbott, F. B.
  Abdalla, S. Allam, A. H. Bauer, A. Benoit-L\'evy, E. Bertin, D. Brooks, P. J.
  Brown, E. Buckley-Geer, D. L. Burke, A. Carnero Rosell, M.Carrasco Kind, R.
  Covarrubias, L. N. da Costa, C. B. D'Andrea, D. L. DePoy, S. Desai, J. P.
  Dietrich, C. E Cunha, T. F. Eifler, J. Estrada, A. E. Evrard, A. Fausti Neto,
  D. A. Finley, B. Flaugher, P. Fosalba, J. Frieman, D. Gerdes, D. Gruen, R. A.
  Gruendl, K. Honscheid, D. James, N. Kuropatkin, O. Lahav, T. S. Li, M. March,
  J. Marshall, K. W. Merritt, C. J. Miller, R. C. Nichol, B. Nord, R. Ogando,
  A. A. Plazas, A.K. Romer, A. Roodman, E. S. Rykoff, M. Sako, E. Sanchez, V.
  Scarpine, M. Schubnell, I. Sevilla, C. Smith, M. Soares-Santos, F. Sobreira,
  E. Suchyta, M. E. C. Swanson, G. Tarle, J. Thaler, R. C. Thomas, D. Tucker,
  A. R. Walker, W. Wester","DESAlert: Enabling Real-Time Transient Follow-Up with Dark Energy Survey
  Data","14 pages, 6 figures, 2 tables. Final version accepted by Publications
  of the Astronomical Society of Australia",,"10.1017/pasa.2016.42",,"astro-ph.HE astro-ph.IM","http://arxiv.org/licenses/nonexclusive-distrib/1.0/","  The Dark Energy Survey (DES) is currently undertaking an observational
program imaging $1/4$ of the southern hemisphere sky with unprecedented
photometric accuracy. In the process of observing millions of faint stars and
galaxies to constrain the parameters of the dark energy equation of state, the
DES will obtain pre-discovery images of the regions surrounding an estimated
100 gamma-ray bursts (GRBs) over five years. Once GRBs are detected by, e.g.,
the Swift satellite, the DES data will be extremely useful for follow-up
observations by the transient astronomy community. We describe a
recently-commissioned suite of software that listens continuously for automated
notices of GRB activity, collates useful information from archival DES data,
and disseminates relevant data products back to the community in
near-real-time. Of particular importance are the opportunities that non-public
DES data provide for relative photometry of the optical counterparts of GRBs,
as well as for identifying key characteristics (e.g., photometric redshifts) of
potential GRB host galaxies. We provide the functional details of the DESAlert
software as it presently operates, as well as the data products that it
produces, and we show sample results from the application of DESAlert to
several previously-detected GRBs.
","[{""version"":""v1"",""created"":""Sun, 12 Apr 2015 18:15:23 GMT""},{""version"":""v2"",""created"":""Tue, 5 Jan 2016 01:47:03 GMT""},{""version"":""v3"",""created"":""Tue, 23 Aug 2016 00:43:07 GMT""}]","2016-10-05"
"1504.02997","Andreas Betz","A. C. Betz, R. Wacquez, M. Vinet, X. Jehl, A L. Saraiva, M. Sanquer,
  A. J. Ferguson, M. F. Gonzalez-Zalba","Dispersively detected Pauli Spin-Blockade in a Silicon Nanowire
  Field-Effect Transistor",,,,,"cond-mat.mes-hall","http://arxiv.org/licenses/nonexclusive-distrib/1.0/","  We report the dispersive readout of the spin state of a double quantum dot
formed at the corner states of a silicon nanowire field-effect transistor. Two
face-to-face top-gate electrodes allow us to independently tune the charge
occupation of the quantum dot system down to the few-electron limit. We measure
the charge stability of the double quantum dot in DC transport as well as
dispersively via in-situ gate-based radio frequency reflectometry, where one
top-gate electrode is connected to a resonator. The latter removes the need for
external charge sensors in quantum computing architectures and provides a
compact way to readout the dispersive shift caused by changes in the quantum
capacitance during interdot charge transitions. Here, we observe Pauli
spin-blockade in the high-frequency response of the circuit at finite magnetic
fields between singlet and triplet states. The blockade is lifted at higher
magnetic fields when intra-dot triplet states become the ground state
configuration. A lineshape analysis of the dispersive phase shift reveals
furthermore an intradot valley-orbit splitting $\Delta_{vo}$ of 145 $\mu$eV.
Our results open up the possibility to operate compact CMOS technology as a
singlet-triplet qubit and make split-gate silicon nanowire architectures an
ideal candidate for the study of spin dynamics.
","[{""version"":""v1"",""created"":""Sun, 12 Apr 2015 18:16:08 GMT""},{""version"":""v2"",""created"":""Fri, 1 May 2015 13:09:31 GMT""}]","2015-05-04"
"1504.02998","Pedro A. Garc\'ia-S\'anchez","Pedro A. Garc\'ia-S\'anchez and Christopher O'Neill and Gautam Webb","On the computation of factorization invariants for affine semigroups",,,,,"math.NT","http://arxiv.org/licenses/nonexclusive-distrib/1.0/","  We present several new algorithms for computing factorization invariant
values over affine semigroups. In particular, we give (i) the first known
algorithm to compute the delta set of any affine semigroup, (ii) an improved
method of computing the tame degree of an affine semigroup, and (iii) a dynamic
algorithm to compute catenary degrees of affine semigroup elements. Our
algorithms rely on theoretical results from combinatorial commutative algebra
involving Gr\""obner bases, Hilbert bases, and other standard techniques.
Implementation in the computer algebra system GAP is discussed.
","[{""version"":""v1"",""created"":""Sun, 12 Apr 2015 18:24:13 GMT""},{""version"":""v2"",""created"":""Mon, 20 Jul 2015 11:06:18 GMT""},{""version"":""v3"",""created"":""Sun, 9 Aug 2015 09:38:16 GMT""},{""version"":""v4"",""created"":""Tue, 3 Jan 2017 09:41:11 GMT""}]","2017-01-04"
"1504.02999","Mario Rocca","M. C. Rocca, A. R. Plastino, A. L. Plastino, G. L. Ferri, A. L. De
  Paoli","Features of the fractional diffusion-advection equation","17 pages. 9 figures. arXiv admin note: substantial text overlap with
  arXiv:1412.0255",,,,"astro-ph.SR cond-mat.stat-mech physics.class-ph","http://arxiv.org/licenses/nonexclusive-distrib/1.0/","  We advance an exact, explicit form for the solutions to the fractional
diffusion-advection equation. Numerical analysis of this equation shows that
its solutions resemble power-laws.
","[{""version"":""v1"",""created"":""Sun, 12 Apr 2015 18:30:18 GMT""}]","2015-04-14"
"1504.03000","Jose L. Rodriguez","Sergio Estrada and Jose L. Rodriguez","Envelopes and covers for groups","15 pages, Groups, Geometry, and Dynamics 2017",,,,"math.GR","http://arxiv.org/licenses/nonexclusive-distrib/1.0/","  We connect work done by Enochs, Rada and Hill in module approximation theory
with work undertaken by several group theorists and algebraic topologists in
the context of homotopical localization and cellularization of spaces. This
allows one to consider envelopes and covers of arbitrary groups. We show some
characterizing results for certain classes of groups, and present some open
questions.
","[{""version"":""v1"",""created"":""Sun, 12 Apr 2015 18:33:50 GMT""},{""version"":""v2"",""created"":""Sun, 4 Sep 2016 10:26:16 GMT""}]","2016-09-06"
"1504.03001","Sylvie Ruette","Sylvie Ruette","Chaos on the interval - a survey of relationship between the various
  kinds of chaos for continuous interval maps","Book (225 pages). Errata and changes between the published book and
  the arxiv version: see
  www.math.u-psud.fr/~ruette/abstracts/abstract-chaos-int.html","S. Ruette. Chaos on the interval. Volume 67 of University Lecture
  Series, AMS, 2017",,,"math.DS","http://arxiv.org/licenses/nonexclusive-distrib/1.0/","  Dynamical systems on the interval were widely studied because they are among
the simplest systems and nevertheless they turn out to have complex dynamics.
Many works on chaos were inspired by the behaviour of interval maps. However
these systems have many properties that are not found on other spaces. As a
consequence, one-dimensional dynamics is very rich and worth a separate study.
  The aim of this book is to survey the relations between the various sorts of
chaos and related notions for continuous interval maps. The papers on this
topic are numerous but very scattered in the literature, sometimes little known
or difficult to find; some were originally published only in Russian or without
proof.
","[{""version"":""v1"",""created"":""Sun, 12 Apr 2015 18:41:22 GMT""},{""version"":""v2"",""created"":""Fri, 29 Jul 2016 20:23:21 GMT""},{""version"":""v3"",""created"":""Tue, 29 Nov 2016 16:33:47 GMT""},{""version"":""v4"",""created"":""Tue, 21 Feb 2017 14:10:33 GMT""},{""version"":""v5"",""created"":""Thu, 12 Apr 2018 11:42:41 GMT""}]","2018-04-13"
"1504.03002","Chihway Chang","V. Vikram, C. Chang, B. Jain, D. Bacon, A. Amara, M. R. Becker, G.
  Bernstein, C. Bonnett, S. Bridle, D. Brout, M. Busha, J. Frieman, E.
  Gaztanaga, W. Hartley, M. Jarvis, T. Kacprzak, A. Kovacs, O. Lahav, B.
  Leistedt, H. Lin, P. Melchior, H. Peiris, E. Rozo, E. Rykoff, C. Sanchez, E.
  Sheldon, M. A. Troxel, R. Wechsler, J. Zuntz, T. Abbott, F. B. Abdalla, R.
  Armstrong, M. Banerji, A. H. Bauer, A. Benoit-Levy, E. Bertin, D. Brooks, E.
  Buckley-Geer, D. L. Burke, D. Capozzi, A. Carnero Rosell, M. Carrasco Kind,
  F. J. Castander, M. Crocce, C. E. Cunha, C. B. D'Andrea, L. N. da Costa, D.
  L. DePoy, S. Desai, H. T. Diehl, J. P. Dietrich, J. Estrada, A. E. Evrard, A.
  Fausti Neto, E. Fernandez, B. Flaugher, P. Fosalba, D. Gerdes, D. Gruen, R.
  A. Gruendl, K. Honscheid, D. James, S. Kent, K. Kuehn, N. Kuropatkin, T. S.
  Li, M. A. G. Maia, M. Makler, M. March, J. Marshall, P. Martini, K. W.
  Merritt, C. J. Miller, R. Miquel, E. Neilsen, R. C. Nichol, B. Nord, R.
  Ogando, A. A. Plazas, A. K. Romer, A. Roodman, E. Sanchez, V. Scarpine, I.
  Sevilla, R. C. Smith, M. Soares-Santos, F. Sobreira, E. Suchyta, M. E. C.
  Swanson, G. Tarle, J. Thaler, D. Thomas, A. R. Walker, and J. Weller","Wide-Field Lensing Mass Maps from DES Science Verification Data:
  Methodology and Detailed Analysis","21 pages, 14 figures, 2 tables; accepted to PRD",,,,"astro-ph.CO","http://arxiv.org/licenses/nonexclusive-distrib/1.0/","  Weak gravitational lensing allows one to reconstruct the spatial distribution
of the projected mass density across the sky. These ""mass maps"" provide a
powerful tool for studying cosmology as they probe both luminous and dark
matter. In this paper, we present a weak lensing mass map reconstructed from
shear measurements in a 139 sq. deg area from the Dark Energy Survey (DES)
Science Verification (SV) data. We compare the distribution of mass with that
of the foreground distribution of galaxies and clusters. The overdensities in
the reconstructed map correlate well with the distribution of optically
detected clusters. We demonstrate that candidate superclusters and voids along
the line of sight can be identified, exploiting the tight scatter of the
cluster photometric redshifts. We cross-correlate the mass map with a
foreground magnitude-limited galaxy sample from the same data. Our measurement
gives results consistent with mock catalogs from N-body simulations that
include the primary sources of statistical uncertainties in the galaxy,
lensing, and photo-z catalogs. The statistical significance of the
cross-correlation is at the 6.8-sigma level with 20 arcminute smoothing. A
major goal of this study is to investigate systematic effects arising from a
variety of sources, including PSF and photo-z uncertainties. We make maps
derived from twenty variables that may characterize systematics and find the
principal components. We find that the contribution of systematics to the
lensing mass maps is generally within measurement uncertainties. In this work,
we analyze less than 3% of the final area that will be mapped by the DES; the
tools and analysis techniques developed in this paper can be applied to
forthcoming larger datasets from the survey.
","[{""version"":""v1"",""created"":""Sun, 12 Apr 2015 18:45:38 GMT""},{""version"":""v2"",""created"":""Thu, 7 May 2015 20:52:32 GMT""},{""version"":""v3"",""created"":""Mon, 20 Jul 2015 06:59:52 GMT""}]","2015-07-21"
"1504.03003","Yutaka Itoh","Y. Itoh","{23}Na nuclear spin-lattice relaxation studies of Na2Ni2TeO6","4 pages, 6 figures","J. Phys. Soc. Jpn. 84, 064714 (2015)","10.7566/JPSJ.84.064714",,"cond-mat.str-el","http://arxiv.org/licenses/nonexclusive-distrib/1.0/","  We report on {23}Na NMR studies of a honeycomb lattice antiferromagnet
Na2Ni2TeO6 by {23}Na nuclear spin-echo techniques. The {23}Na nuclear
spin-lattice relaxation rate 1/{23}T_1 exhibits critical divergence near a Neel
temperature T_N = 26 K, a narrow critical region, and a critical exponent w =
0.34 in 1/{23}T_1 = a (T/T_N - 1)^{-w} for Na2Ni2TeO6, and T_N = 18 K for
Na2(Ni{0.5}Cu{0.5})2TeO6. Although the uniform magnetic susceptibility of
Na2Ni2TeO6 exhibits a broad maximum at 35 K characteristic of low dimensional
spin systems, the NMR results indicate three dimensional critical phenomenon
around the Neel temperature.
","[{""version"":""v1"",""created"":""Sun, 12 Apr 2015 18:53:46 GMT""}]","2015-06-02"
"1504.03004","Florin Coras","Florin Coras, Jordi Domingo-Pascual, Albert Cabellos-Aparicio","On the Scalability of LISP Mappings Caches",,,,,"cs.NI","http://arxiv.org/licenses/nonexclusive-distrib/1.0/","  The Locator/ID Separation Protocol (LISP) limits the growth of the
Default-Free Zone routing tables by creating a highly aggregatable and
quasi-static Internet core. However, LISP pushes the forwarding state to edge
routers whose timely operation relies on caching of location to identity
bindings. In this paper we develop an analytical model to study the asymptotic
scalability of the LISP cache. Under the assumptions that (i) long-term
popularity can be modeled as a constant Generalized Zipf distribution and (ii)
temporal locality is predominantly determined by long-term popularity, we find
that the scalability of the LISP cache is O(1) with respect to the amount of
prefixes (Internet growth) and users (growth of the LISP site). We validate the
model and discuss the accuracy of our assumptions using several one-day-long
packet traces.
","[{""version"":""v1"",""created"":""Sun, 12 Apr 2015 18:59:27 GMT""},{""version"":""v2"",""created"":""Tue, 14 Apr 2015 01:33:28 GMT""}]","2015-04-15"
"1504.03005","Ia Kochiashvili","I. Kochiashvili, P. M{\o}ller, B. Milvang-Jensen, L. Christensen,
  J.P.U. Fynbo, W. Freudling, B. Cl\'ement, J.-G. Cuby, J. Zabl, S. Zibetti","Emission line selected galaxies at $z=0.6-2$ in GOODS South: Stellar
  masses, SFRs, and large scale structure","18 pages, 19 figures, version accepted for publication in A&A","A&A, 580, A42 (2015)","10.1051/0004-6361/201425535",,"astro-ph.GA","http://arxiv.org/licenses/nonexclusive-distrib/1.0/","  We have obtained deep NIR narrow and broad (J and Y) band imaging data of the
GOODS-South field. The narrow band filter is centered at 1060 nm corresponding
to redshifts $z = 0.62, 1.15, 1.85$ for the strong emission lines H$\alpha$,
$[$OIII$]$/H$\beta$ and $[$OII$]$, respectively. From those data we extract a
well defined sample ($M(AB)=24.8$ in the narrow band) of objects with large
emission line equivalent widths in the narrow band. Via SED fits to published
broad band data we identify which of the three lines we have detected and
assign redshifts accordingly. This results in a well defined, strong emission
line selected sample of galaxies down to lower masses than can easily be
obtained with only continuum flux limited selection techniques. We compare the
(SED fitting-derived) main sequence of star-formation (MS) of our sample to
previous works and find that it has a steeper slope than that of samples of
more massive galaxies. We conclude that the MS steepens at lower (below
$M_{\star} = 10^{9.4} M_{\odot}$) galaxy masses. We also show that the SFR at
any redshift is higher in our sample. We attribute this to the targeted
selection of galaxies with large emission line equivalent widths, and conclude
that our sample presumably forms the upper boundary of the MS. We briefly
investigate and outline how samples with accurate redshifts down to those low
stellar masses open a new window to study the formation of large scale
structure in the early universe. In particular we report on the detection of a
young galaxy cluster at $z=1.85$ which features a central massive galaxy which
is the candidate of an early stage cD galaxy, and we identify a likely filament
mapped out by $[$OIII$]$ and $H\beta$ emitting galaxies at $z=1.15$.
","[{""version"":""v1"",""created"":""Sun, 12 Apr 2015 19:04:08 GMT""}]","2017-06-19"
