"1504.03094","Sayani Bera","Sayani Bera and Ratna Pal","Dynamics of semigroups of entire maps of $\mathbb{C}^k$","14 pages",,,,"math.DS math.CV","http://arxiv.org/licenses/nonexclusive-distrib/1.0/","  The goal of this paper is to study some basic properties of the Fatou and
Julia sets for a family of holomorphic endomorphisms of $\mathbb{C}^k,\; k \ge
2$. We are particularly interested in studying these sets for semigroups
generated by various classes of holomorphic endomorphisms of $\mathbb{C}^k,\; k
\ge 2.$ We prove that if the Julia set of a semigroup $G$ which is generated by
endomorphisms of maximal generic rank $k$ in $\mathbb{C}^k$ contains an
isolated point, then $G$ must contain an element that is conjugate to an upper
triangular automorphism of $\mathbb{C}^k.$ This generalizes a theorem of
Fornaess-Sibony. Secondly, we define recurrent domains for semigroups and
provide a description of such domains under some conditions.
","[{""version"":""v1"",""created"":""Mon, 13 Apr 2015 08:17:24 GMT""},{""version"":""v2"",""created"":""Wed, 26 Aug 2015 10:30:13 GMT""}]","2015-08-27"
"1504.03095","Junyuan Leng","Junyuan Leng, Yadong Zhou, Junjie Zhang, Chengchen Hu","An Inference Attack Model for Flow Table Capacity and Usage: Exploiting
  the Vulnerability of Flow Table Overflow in Software-Defined Network",,,,,"cs.NI","http://arxiv.org/licenses/nonexclusive-distrib/1.0/","  As the most competitive solution for next-generation network,
software-defined network (SDN) and its dominant implementation OpenFlow, are
attracting more and more interests. But besides convenience and flexibility,
SDN/OpenFlow also introduces new kinds of limitations and security issues. Of
these limitations, the most obvious and maybe the most neglected one, is the
flow table capacity of SDN/OpenFlow switches.
  In this paper, we proposed a novel inference attack targeting at SDN/OpenFlow
network, which is motivated by the limited flow table capacities of
SDN/OpenFlow switches and the following measurable network performance decrease
resulting from frequent interactions between data plane and control plane when
the flow table is full. To our best knowledge, this is the first proposed
inference attack model of this kind for SDN/OpenFlow. We also implemented an
inference attack framework according to our model and examined its efficiency
and accuracy. The simulation results demonstrate that our framework can infer
the network parameters(flow table capacity and flow table usage) with an
accuracy of 80% or higher. These findings give us a deeper understanding of
SDN/OpenFlow limitations and serve as guidelines to future improvements of
SDN/OpenFlow.
","[{""version"":""v1"",""created"":""Mon, 13 Apr 2015 08:21:31 GMT""}]","2015-04-14"
"1504.03096","Julien Laurat","V. Parigi, V. D'Ambrosio, C. Arnold, L. Marrucci, F. Sciarrino, J.
  Laurat","Storage and retrieval of vector beams of light in a
  multiple-degree-of-freedom quantum memory",,"Nature Communications 6, 7706 (2015)","10.1038/ncomms8706",,"quant-ph physics.optics","http://arxiv.org/licenses/nonexclusive-distrib/1.0/","  The full structuration of light in the transverse plane, including intensity,
phase and polarization, holds the promise of unprecedented capabilities for
applications in classical optics as well as in quantum optics and information
sciences. Harnessing special topologies can lead to enhanced focusing, data
multiplexing or advanced sensing and metrology. Here we experimentally
demonstrate the storage of such spatio-polarization-patterned beams into an
optical memory. A set of vectorial vortex modes is generated via liquid crystal
cell with topological charge in the optic axis distribution, and preservation
of the phase and polarization singularities is demonstrated after retrieval, at
the single-photon level. The realized multiple-degree-of-freedom memory can
find applications in classical data processing but also in quantum network
scenarios where structured states have been shown to provide promising
attributes, such as rotational invariance.
","[{""version"":""v1"",""created"":""Mon, 13 Apr 2015 08:29:27 GMT""},{""version"":""v2"",""created"":""Thu, 16 Jul 2015 21:18:03 GMT""}]","2019-06-26"
"1504.03097","Lovro \v{S}ubelj","Neli Blagus, Lovro \v{S}ubelj, Gregor Weiss, Marko Bajec","Sampling promotes community structure in social and information networks","15 pages, 6 figures, 5 tables","Physica A 432, 206-215 (2015)","10.1016/j.physa.2015.03.048",,"cs.SI physics.data-an physics.soc-ph","http://arxiv.org/licenses/nonexclusive-distrib/1.0/","  Any network studied in the literature is inevitably just a sampled
representative of its real-world analogue. Additionally, network sampling is
lately often applied to large networks to allow for their faster and more
efficient analysis. Nevertheless, the changes in network structure introduced
by sampling are still far from understood. In this paper, we study the presence
of characteristic groups of nodes in sampled social and information networks.
We consider different network sampling techniques including random node and
link selection, network exploration and expansion. We first observe that the
structure of social networks reveals densely linked groups like communities,
while the structure of information networks is better described by modules of
structurally equivalent nodes. However, despite these notable differences, the
structure of sampled networks exhibits stronger characterization by
community-like groups than the original networks, irrespective of their type
and consistently across various sampling techniques. Hence, rich community
structure commonly observed in social and information networks is to some
extent merely an artifact of sampling.
","[{""version"":""v1"",""created"":""Mon, 13 Apr 2015 08:37:34 GMT""}]","2015-04-14"
"1504.03098","Pablo I. Tamborenea","M. Cygorek, P. I. Tamborenea, and V. M. Axt","Insensitivity of spin dynamics to the orbital angular momentum
  transferred from twisted light to extended semiconductors","5 pages, 2 figures",,"10.1103/PhysRevB.92.115301",,"cond-mat.mes-hall","http://arxiv.org/licenses/nonexclusive-distrib/1.0/","  We study the spin dynamics of carriers due to the Rashba interaction in
semiconductor quantum disks and wells after excitation with light with orbital
angular momentum. We find that although twisted light transfers orbital angular
momentum to the excited carriers and the Rashba interaction conserves their
total angular momentum, the resulting electronic spin dynamics is essentially
the same for excitation with light with orbital angular momentum $l=+|l|$ and
$l=-|l|$. The differences between cases with different values of $|l|$ are due
to the excitation of states with slightly different energies and not to the
different angular momenta per se, and vanish for samples with large radii where
a $k$-space quasi-continuum limit can be established. These findings apply not
only to the Rashba interaction but also to all other envelope-function
approximation spin-orbit Hamiltonians like the Dresselhaus coupling.
","[{""version"":""v1"",""created"":""Mon, 13 Apr 2015 08:44:40 GMT""}]","2015-09-30"
"1504.03099","Stefan Liebscher","Anna Karnauhova, Stefan Liebscher","Connected components of meanders: I. Bi-rainbow meanders",,,,,"math.CO","http://arxiv.org/licenses/nonexclusive-distrib/1.0/","  Closed meanders are planar configurations of one or several disjoint closed
Jordan curves intersecting a given line or curve transversely. They arise as
shooting curves of parabolic PDEs in one space dimension, as trajectories of
Cartesian billiards, and as representations of elements of Temperley-Lieb
algebras.
  Given the configuration of intersections, for example as a permutation or an
arc collection, the number of Jordan curves is unknown and needs to be
determined.
  We address this question in the special case of bi-rainbow meanders, which
are given as non-branched families (rainbows) of nested arcs. Easily obtainable
results for small bi-rainbow meanders containing up to four families suggest an
expression of the number of curves by the greatest common divisor (gcd) of
polynomials in the sizes of the rainbow families.
  We prove however, that this is not the case. In fact, the number of connected
components of bi-rainbow meanders with more than four families cannot be
expressed as the gcd of polynomials in the sizes of the rainbows.
  On the other hand, we provide a complexity analysis of nose-retraction
algorithms. They determine the number of connected components of arbitrary
bi-rainbow meanders in logarithmic time. In fact, the nose-retraction
algorithms resemble the Euclidean algorithm, which is used to determine the
gcd, in structure and complexity.
  Looking for a closed formula of the number of connected components, the
nose-retraction algorithm is as good as a gcd-formula and therefore as good as
we can possibly expect.
","[{""version"":""v1"",""created"":""Mon, 13 Apr 2015 09:00:27 GMT""}]","2015-04-14"
"1504.03100","Thibault Jaisson","Thibault Jaisson and Mathieu Rosenbaum","Rough fractional diffusions as scaling limits of nearly unstable heavy
  tailed Hawkes processes","21 pages",,,,"math.PR q-fin.ST q-fin.TR","http://arxiv.org/licenses/nonexclusive-distrib/1.0/","  We investigate the asymptotic behavior as time goes to infinity of Hawkes
processes whose regression kernel has $L^1$ norm close to one and power law
tail of the form $x^{-(1+\alpha)}$, with $\alpha\in(0,1)$. We in particular
prove that when $\alpha\in(1/2,1)$, after suitable rescaling, their law
converges to that of a kind of integrated fractional Cox-Ingersoll-Ross
process, with associated Hurst parameter $H=\alpha-1/2$. This result is in
contrast to the case of a regression kernel with light tail, where a classical
Brownian CIR process is obtained at the limit. Interestingly, it shows that
persistence properties in the point process can lead to an irregular behavior
of the limiting process. This theoretical result enables us to give an
agent-based foundation to some recent findings about the rough nature of
volatility in financial markets.
","[{""version"":""v1"",""created"":""Mon, 13 Apr 2015 09:12:24 GMT""}]","2015-04-14"
"1504.03101","Carlo Ciliberto","Carlo Ciliberto, Youssef Mroueh, Tomaso Poggio and Lorenzo Rosasco","Convex Learning of Multiple Tasks and their Structure","26 pages, 1 figure, 2 tables",,,,"cs.LG","http://arxiv.org/licenses/nonexclusive-distrib/1.0/","  Reducing the amount of human supervision is a key problem in machine learning
and a natural approach is that of exploiting the relations (structure) among
different tasks. This is the idea at the core of multi-task learning. In this
context a fundamental question is how to incorporate the tasks structure in the
learning problem.We tackle this question by studying a general computational
framework that allows to encode a-priori knowledge of the tasks structure in
the form of a convex penalty; in this setting a variety of previously proposed
methods can be recovered as special cases, including linear and non-linear
approaches. Within this framework, we show that tasks and their structure can
be efficiently learned considering a convex optimization problem that can be
approached by means of block coordinate methods such as alternating
minimization and for which we prove convergence to the global minimum.
","[{""version"":""v1"",""created"":""Mon, 13 Apr 2015 09:13:23 GMT""},{""version"":""v2"",""created"":""Fri, 17 Apr 2015 20:03:21 GMT""}]","2015-04-21"
"1504.03102","Dongsu Ryu","Sungwook E. Hong (1), Hyesung Kang (2), Dongsu Ryu (3) (1 Korea
  Institute for Advanced Study, 2 Pusan National University, Korea, 3 UNIST,
  Korea)","Radio and X-ray Shocks in Clusters of galaxies","accepted for publication in ApJ",,"10.1088/0004-637X/812/1/49",,"astro-ph.HE","http://arxiv.org/licenses/nonexclusive-distrib/1.0/","  Radio relics detected in the outskirts of galaxy clusters are thought to
trace radio-emitting relativistic electrons accelerated at cosmological shocks.
In this study, using the cosmological hydrodynamic simulation data for the
large-scale structure formation and adopting a diffusive shock acceleration
(DSA) model for the production of cosmic-ray (CR) electrons, we construct mock
radio and X-ray maps of simulated galaxy clusters that are projected in the sky
plane. Various properties of shocks and radio relics, including the shock Mach
number, radio spectral index and luminosity are extracted from the synthetic
maps and compared with observations. A substantial fraction of radio and X-ray
shocks identified in these maps involve multiple shock surfaces along line of
sights (LoSs), and the morphology of shock distributions in the maps depends on
the projection direction. Among multiple shocks in a given LoS, radio
observations tend to pick up stronger shocks with flatter radio spectra, while
X-ray observations preferentially select weaker shocks with larger kinetic
energy flux. As a result, the shock Mach numbers and locations derived from
radio and X-ray observations could differ from each other in some cases. We
also find that the distributions of the spectral index and radio power of the
synthetic radio relics are somewhat inconsistent with those of observed real
relics; a bit more radio relics have been observed closer to the cluster core
and with steeper spectral indices. We suggest the inconsistency could be
explained, if very weak shocks with $M_s \la 2$ accelerate CR electrons more
efficiently, compared to the DSA model adopted here.
","[{""version"":""v1"",""created"":""Mon, 13 Apr 2015 09:19:17 GMT""},{""version"":""v2"",""created"":""Wed, 2 Sep 2015 06:13:46 GMT""}]","2015-10-14"
"1504.03103","Charis Anastopoulos","Charis Anastopoulos and Bei-Lok Hu","Probing a Gravitational Cat State","25 pages, 1 figure","Class. Quantum Grav. 32, 165022 (2015)","10.1088/0264-9381/32/16/165022",,"quant-ph gr-qc","http://arxiv.org/licenses/nonexclusive-distrib/1.0/","  We investigate the nature of a gravitational two-state system (G2S) in the
simplest setup in Newtonian gravity. In a quantum description of matter a
single motionless massive particle can in principle be in a superposition state
of two spatially-separated locations. This superposition state in gravity, or
gravitational cat state, would lead to fluctuations in the Newtonian force
exerted on a nearby test particle. The central quantity of importance for this
inquiry is the energy density correlation. This corresponds to the noise kernel
in stochastic gravity theory, evaluated in the weak field nonrelativistic
limit. In this limit, quantum fluctuations of the stress energy tensor manifest
as the fluctuations of the Newtonian force. We describe the properties of such
a G2S system and present two ways of measuring the cat state for the Newtonian
force, one by way of a classical probe, the other a quantum harmonic
oscillator. Our findings include: (i) mass density fluctuations persist even in
single particle systems, and they are of the same order of magnitude as the
mean; (ii) a classical probe generically records a non-Markovian fluctuating
force; (iii) a quantum probe interacting with the G2S system may undergo Rabi
oscillations in a strong coupling regime. This simple prototypical
gravitational quantum system could provide a robust testing ground to compare
predictions from alternative quantum theories, since the results reported here
are based on standard quantum mechanics and classical gravity.
","[{""version"":""v1"",""created"":""Mon, 13 Apr 2015 09:19:34 GMT""}]","2015-08-26"
"1504.03104","Jiri Hejtm\'anek","J. Hejtm\'anek, Z. Jir\'ak, J. \v{S}ebek","Spin-entropy contribution to thermopower in the
  [Ca$_2$CoO$_{3-t}$]$_{0.62}$(CoO$_2$) misfits","26 pages including 11 figures",,"10.1103/PhysRevB.92.125106",,"cond-mat.mtrl-sci","http://arxiv.org/licenses/nonexclusive-distrib/1.0/","  Two samples of the [Ca$_2$CoO$_{3-t}$]$_{0.62}$(CoO$_2$) misfit cobaltate,
often denoted as the Ca$_{3}$Co$_{3.93}$O$_{9}$ phase, were prepared from the
same ceramic material by the oxygen and argon annealing, resulting in different
carrier concentrations in the conducting CoO$_{2}$ layers, n=0.31 and 0.19
hole/Co, respectively. Electrical and thermal transport properties were studied
in dependence of magnetic field up to 140 kOe. The magnetothermopower data
reveal an extra spin-entropy contribution to Seebeck coefficient that is not
expected for carriers of Fermi liquid character. Its magnitude is
unprecedentedly large and makes at zero field up to 50$\%$ of the theoretical
limit k$_B$/$e$ ln2$ = 59 \mu VK^{-1}$. This spin-entropy contribution is
gradually suppressed with increasing magnetic field, and the saturation is even
observed when temperatures are low enough. To understand the results, the
thermopower is treated in terms of purely thermodynamic Kelvin formula, and
so-called Spin liquid model is evoked, providing a reason for the spin-entropy
manifestation in the [Ca$_2$CoO$_{3-t}$]$_{0.62}$(CoO$_2$) misfits.
","[{""version"":""v1"",""created"":""Mon, 13 Apr 2015 09:22:35 GMT""},{""version"":""v2"",""created"":""Wed, 15 Jul 2015 14:00:37 GMT""}]","2015-09-30"
"1504.03105","Ionel-Dumitrel Ghiba","Patrizio Neff, Ingo M\""unch, Ionel-Dumitrel Ghiba, Angela Madeo","On some fundamental misunderstandings in the indeterminate couple stress
  model. A comment on recent papers of A.R. Hadjesfandiari and G.F. Dargush","arXiv admin note: text overlap with arXiv:1504.00868",,,,"math-ph math.AP math.MP","http://arxiv.org/licenses/nonexclusive-distrib/1.0/","  In a series of papers which are either published [A.R. Hadjesfandiari and
G.F. Dargush, Couple stress theory for solids, Int. J. Solids Struct. 48,
2496-2510, 2011; A.R. Hadjesfandiari and G.F. Dargush, Fundamental solutions
for isotropic size-dependent couple stress elasticity, Int. J. Solids Struct.
50, 1253-1265, 2013] or available as preprints Hadjesfandiari and Dargush have
reconsidered the linear indeterminate couple stress model. They are postulating
a certain physically plausible split in the virtual work principle. Based on
this postulate they claim that the second-order couple stress tensor must
always be skew-symmetric. Since they use an incomplete set of boundary
conditions in their virtual work principle their statement contains
unrecoverable errors. This is shown by specifying their development to the
isotropic case. However, their choice of constitutive parameters is
mathematically possible and still yields a well-posed boundary value problem.
","[{""version"":""v1"",""created"":""Mon, 13 Apr 2015 09:26:56 GMT""},{""version"":""v2"",""created"":""Fri, 17 Apr 2015 14:21:47 GMT""}]","2015-04-20"
"1504.03106","Carlo Ciliberto","Carlo Ciliberto, Lorenzo Rosasco and Silvia Villa","Learning Multiple Visual Tasks while Discovering their Structure","19 pages, 3 figures, 3 tables",,,,"cs.LG cs.CV","http://arxiv.org/licenses/nonexclusive-distrib/1.0/","  Multi-task learning is a natural approach for computer vision applications
that require the simultaneous solution of several distinct but related
problems, e.g. object detection, classification, tracking of multiple agents,
or denoising, to name a few. The key idea is that exploring task relatedness
(structure) can lead to improved performances.
  In this paper, we propose and study a novel sparse, non-parametric approach
exploiting the theory of Reproducing Kernel Hilbert Spaces for vector-valued
functions. We develop a suitable regularization framework which can be
formulated as a convex optimization problem, and is provably solvable using an
alternating minimization approach. Empirical tests show that the proposed
method compares favorably to state of the art techniques and further allows to
recover interpretable structures, a problem of interest in its own right.
","[{""version"":""v1"",""created"":""Mon, 13 Apr 2015 09:27:23 GMT""}]","2015-04-14"
"1504.03107","Laurent  Mahy","L. Mahy, G. Rauw, M. De Becker, P. Eenens, and C. A. Flores","A spectroscopic investigation of the O-type star population in four
  Cygnus OB associations. II. Determination of the fundamental parameters","11 pages, and 26 pages of Appendix. A&A in press",,"10.1051/0004-6361/201321985",,"astro-ph.SR","http://arxiv.org/licenses/nonexclusive-distrib/1.0/","  Aims. Having established the binary status of nineteen O-type stars located
in four Cygnus OB associations, we now determine their fundamental parameters
to constrain their properties and their evolutionary status. We also
investigate their surface nitrogen abundances, which we compare with other
results from the literature obtained for galactic O-type stars. Methods. Using
optical spectra collected for each object in our sample and some UV data from
the archives, we apply the CMFGEN atmosphere code to determine their main
properties. For the binary systems, we have disentangled the components to
obtain their individual spectra and investigate them as if they were single
stars. Results. We find that the distances of several presumably single O-type
stars seem poorly constrained because their luminosities are not in agreement
with the ""standard"" luminosities of stars with similar spectral types. The ages
of these O-type stars are all less than 7 Myrs. Therefore, the ages of these
stars agree with those, quoted in the literature, of the four associations,
except for CygOB8 for which the stars seem older than the association itself.
However, we point out that the distance of certain stars is debatable relative
to values found in the literature. The N content of these stars put in
perspective with N contents of several other galactic O-type stars seems to
draw the same five groups as found in the ""Hunter"" diagram for the O and B-type
stars in the LMC even though their locations are obviously different. We
determine mass-loss rates for several objects from the Halpha line and UV
spectra. Finally, we confirm the ""mass discrepancy"" especially for O stars with
masses smaller than 30 Msun. .
","[{""version"":""v1"",""created"":""Mon, 13 Apr 2015 09:28:30 GMT""}]","2015-06-24"
"1504.03108","Christian Marliere","Christian Marliere, Samia Dhahri","An in-vivo study of electrical charge distribution on the bacterial cell
  wall by Atomic Force Microscopy in vibrating force mode","Accepted for publication in ""Nanoscale"" :
  http://pubs.rsc.org/en/journals/journalissues/nr#!recentarticles&all",,"10.1039/c5nr00968e",,"cond-mat.soft cond-mat.other","http://arxiv.org/licenses/nonexclusive-distrib/1.0/","  We report an in-vivo electromechanical Atomic Force Microscopy (AFM) study of
charge distribution on the cell wall of Gram plus Rhodococcus wratislaviensis
bacteria, naturally adherent to a glass substrate, in physiological conditions.
The method presented in this paper relies on a detailed study of AFM
approach-retract curves giving the variation of the interaction force versus
distance between tip and sample. In addition to classical height and mechanical
(as stiffness) data, mapping of local electrical properties, as bacterial
surface charge, was proved to be feasible at a spatial resolution better than
few tens of nanometers. This innovative method relies on the measurement of the
cantilever's surface stress through its deflection far from (higher than 10nm)
the repulsive contact zone. The variations of surface stress come from
modification of electrical surface charge of the cantilever (as in classical
electrocapillary measurements) likely stemming from its charging during contact
of both tip and sample electrical double layers. This method offers an
important improvement in local electrical and electrochemical measurements at
the solid-liquid interface particularly in high-molarity electrolytes when
compared to technics focused on the direct use of electrostatic force. It thus
opens a new way to directly investigate in-situ biological electrical surface
processes involved in numerous practical and fundamental problems as bacterial
adhesion, biofilm formation, microbial fuel cell, etc.
","[{""version"":""v1"",""created"":""Mon, 13 Apr 2015 09:31:30 GMT""}]","2015-06-11"
"1504.03109","Stefano Andrenacci","Pantelis-Daniel Arapoglou, Alberto Ginesi, Stefano Cioni, Stefan Erl,
  Federico Clazzer, Stefano Andrenacci, Alessandro Vanelli-Coralli","DVB-S2x Enabled Precoding for High Throughput Satellite Systems",,,,,"cs.IT math.IT","http://arxiv.org/licenses/nonexclusive-distrib/1.0/","  Multi-user Multiple-Input Multiple-Output (MU-MIMO) has allowed recent
releases of terrestrial LTE standards to achieve significant improvements in
terms of offered system capacity. The publications of the DVB-S2x standard and
particularly of its novel superframe structure is a key enabler for applying
similar interference management techniques -such as precoding- to multibeam
High Throughput Satellite (HTS) systems. This paper presents results resulting
from European Space Agency (ESA) funded R&D activities concerning the practical
issues that arise when precoding is applied over an aggressive frequency re-use
HTS network. In addressing these issues, the paper also proposes pragmatic
solutions that have been developed in order to overcome these limitations.
Through the application of a comprehensive system simulator, it is demonstrated
that important capacity gains (beyond 40%) are to be expected from applying
precoding even after introducing a number of significant practical impairments.
","[{""version"":""v1"",""created"":""Mon, 13 Apr 2015 09:39:31 GMT""}]","2015-04-14"
