"1504.03044","Toru Sasaki","Toru Sasaki, Kyoko Matsushita, Kosuke Sato, and Nobuhiro Okabe","Suzaku observations of subhalos in the Coma cluster","19 pages, 8 figures, ApJ in press",,,,"astro-ph.CO","http://arxiv.org/licenses/nonexclusive-distrib/1.0/","  We observed three massive subhalos in the Coma cluster with {\it Suzaku}.
These subhalos, labeled ""ID 1"", ""ID 2"", and ""ID 32"", were detected with a
weak-lensing survey using the Subaru/Suprime-Cam (Okabe et al. 2014a), and are
located at the projected distances of 1.4 $r_{500}$, 1.2 $r_{500}$, and 1.6
$r_{500}$ from the center of the Coma cluster, respectively. The subhalo ""ID 1""
has a compact X-ray excess emission close to the center of the weak-lensing
mass contour, and the gas mass to weak-lensing mass ratio is about 0.001. The
temperature of the emission is about 3 keV, which is slightly lower than that
of the surrounding intracluster medium (ICM) and that expected for the
temperature vs. mass relation of clusters of galaxies. The subhalo ""ID 32""
shows an excess emission whose peak is shifted toward the opposite direction
from the center of the Coma cluster. The gas mass to weak-lensing mass ratio is
also about 0.001, which is significantly smaller than regular galaxy groups.
The temperature of the excess is about 0.5 keV and significantly lower than
that of the surrounding ICM and far from the temperature vs. mass relation of
clusters. However, there is no significant excess X-ray emission in the ""ID 2""
subhalo. Assuming an infall velocity of about 2000 $\rm km~s^{-1}$, at the
border of the excess X-ray emission, the ram pressures for ""ID 1"" and ""ID 32""
are comparable to the gravitational restoring force per area. We also studied
the effect of the Kelvin-Helmholtz instability to strip the gas. Although we
found X-ray clumps associated with the weak-lensing subhalos, their X-ray
luminosities are much lower than the total ICM luminosity in the cluster
outskirts.
","[{""version"":""v1"",""created"":""Mon, 13 Apr 2015 01:47:36 GMT""}]","2015-04-14"
"1504.03045","Suk Lee","Yuan Jie Cao, Suk Lee, Kyung Hwan Chang, Jang Bo Shim, Kwang Hyeon
  Kim, Min Sun Jang, Won Sup Yoon, Dae Sik Yang, Young Je Park, Chul Yong Kim
  (Department of Radiation Oncology, College of Medicine, Korea University,
  Seoul, 136-705)","Optimized planning target volume margin in helical tomotherapy for
  prostate cancer: is there a preferred method?",,,,,"physics.med-ph","http://arxiv.org/licenses/nonexclusive-distrib/1.0/","  To compare the dosimetrical differences between plans generated by helical
tomotherapy using 2D or 3D margining technique in in prostate cancer. Ten
prostate cancer patients were included in this study. For 2D plans, planning
target volume (PTV) was created by adding 5 mm (lateral/anterior-posterior) to
clinical target volume (CTV). For 3D plans, 5 mm margin was added not only in
lateral/anterior-posterior, but also in superior-inferior to CTV. Various
dosimetrical indices, including the prescription isodose to target volume
(PITV) ratio, conformity index (CI), homogeneity index (HI), target coverage
index (TCI), modified dose homogeneity index (MHI), conformation number (CN),
critical organ scoring index (COSI), and quality factor (QF) were determined to
compare the different treatment plans. Differences between 2D and 3D PTV
indices were not significant except for CI (p = 0.023). 3D margin plans (11195
MUs) resulted in higher (13.0%) monitor units than 2D margin plans (9728 MUs).
There were no significant differences in any OARs between the 2D and 3D plans.
Overall, the average 2D plan dose was slightly lower than the 3D plan dose.
Compared to the 2D plan, the 3D plan increased average treatment time by 1.5
minutes; however, this difference was not statistically significant (p =
0.082). We confirmed that 2D and 3D margin plans are not significantly
different with regard to various dosimetric indices such as PITV, CI, and HI
for PTV, and OARs with tomotherapy.
","[{""version"":""v1"",""created"":""Mon, 13 Apr 2015 01:58:40 GMT""}]","2015-04-14"
"1504.03046","Jae-Hyuk Oh","Jae-hyuk Oh","Stochastic quantization and holographic Wilsonian renormalization group
  of scalar theories with arbitrary mass","1+18 pages, a new section is added, typo corrected","Phys. Rev. D 94, 105020 (2016)","10.1103/PhysRevD.94.105020",,"hep-th","http://arxiv.org/licenses/nonexclusive-distrib/1.0/","  We have studied a mathematical relationship between holographic Wilsonian
renormalization group(HWRG) and stochastic quantization(SQ) of scalar field
with arbitrary mass in AdS spacetime. In the stochastic theory, the field is
described by an equation with a form of harmonic oscillator with time dependent
frequency and its Euclidean action also shows explicit time dependent kernel in
it. We have obtained the stochastic 2-point correlation function and
demonstrate that it reproduces the radial evolution of the double trace
operator correctly via the suggested relation given in arXiv:1209.2242.
Moreover, we justify our stochastic procedure with time dependent kernel by
showing that it can be mapped to a new stochastic frame with a standard kernel
without time dependence. Finally, we consider more general boundary conditions
for the stochastic field to reproduce the radial evolution of the holographic
boundary effective action when alternative quantization is allowed. We
extensively study the Neumann boundary condition case and confirm that even in
this case, the relation between HWRG and SQ is precisely hold.
","[{""version"":""v1"",""created"":""Mon, 13 Apr 2015 02:04:07 GMT""},{""version"":""v2"",""created"":""Mon, 26 Oct 2015 12:43:55 GMT""}]","2016-11-30"
"1504.03047","Christopher Rasmussen","Christopher Rasmussen and Akio Tamagawa","Abelian surfaces good away from 2","9 pages, 1 table",,,,"math.NT","http://arxiv.org/licenses/nonexclusive-distrib/1.0/","  Fix a number field $k$ and a rational prime $\ell$. We consider abelian
varieties whose $\ell$-power torsion generates a pro-$\ell$ extension of
$k(\mu_{\ell^\infty})$ which is unramified away from $\ell$. It is a necessary,
but not generally sufficient, condition that such varieties have good reduction
away from $\ell$. In the special case of $\ell = 2$, we demonstrate that for
abelian surfaces $A/\mathbb{Q}$, good reduction away from $\ell$ does suffice.
The result is extended to elliptic curves and abelian surfaces over certain
number fields unramified away from $\{2,\infty\}$. An explicit example is
constructed to demonstrate that good reduction is not sufficient, at $\ell =
2$, for abelian varieties of sufficiently high dimension.
","[{""version"":""v1"",""created"":""Mon, 13 Apr 2015 02:14:10 GMT""}]","2015-04-14"
"1504.03048","Shudi Yang","Shudi Yang, Zheng-An Yao, Chang-An Zhao","The weight distributions of two classes of p ary cyclic codes with few
  weights","20 pages",,"10.1016/j.ffa.2016.11.004",,"cs.IT math.IT","http://arxiv.org/licenses/nonexclusive-distrib/1.0/","  Cyclic codes have attracted a lot of research interest for decades as they
have efficient encoding and decoding algorithms.
  In this paper, for an odd prime $p$, the weight distributions of two classes
of $p$-ary cyclic codes are completely determined. We show that both codes have
at most five nonzero weights.
","[{""version"":""v1"",""created"":""Mon, 13 Apr 2015 02:16:35 GMT""}]","2017-07-07"
"1504.03049","Atsushi Inoue","Atsushi Inoue","Lectures on Super Analysis -- Why necessary and What's that?",,,,,"math-ph math.MP","http://arxiv.org/licenses/nonexclusive-distrib/1.0/","  Roughly speaking, RA(=real analysis) means to study properties of (smooth)
functions defined on real space, and CA(=complex analysis) stands for studying
properties of (holomorphic) functions defined on spaces with complex structure.
  But to treat boson and fermion on equal footing, we need to prepare as a
""ground ring"", Fr\'echet-Grassmann algebra having countably many Grassmann
generators and we define so-called superspace over such algebra. On such
superspaces, we introduce spaces of super-smooth functions and develop
elementary differential and integral calculus. With a slight preparation of
functional analysis, we explain the Efetov's method in RMT(=random matrix
theory). The free Weyl equation is treated to answer the problem posed by
Feynman in their famous book. Simple examples of SUSYQM(=supersymmetric quantum
mechanics) are calculated from this point of view.
  In the final chapter, we give a precise proof of Berezin's formula for
changing variables under integral sign, brief introduction of real analysis on
superspace, another construction of fundamental solution of Qi's weakly
hyperbolic equation, Bernardi's question for a system version of Egorov's
theorem, etc. A little discussion of Funtional Derivative Equations which are
candidates of new branch of mathematics, is given. And finally, we construct a
Hamilton flow corresponding to the Weyl equation with external electro-magnetic
potentials, where we need the countably infinite Grassmann generators and weak
topology!
  I mention many open problems at least for me (alias ATLOM=a tiny little old
mathematician).
","[{""version"":""v1"",""created"":""Mon, 13 Apr 2015 02:47:24 GMT""},{""version"":""v2"",""created"":""Wed, 15 Apr 2015 09:55:30 GMT""},{""version"":""v3"",""created"":""Wed, 25 Nov 2015 12:08:02 GMT""},{""version"":""v4"",""created"":""Tue, 15 Dec 2015 20:51:33 GMT""}]","2015-12-16"
"1504.03050","Carlos Colosqui Prof.","Amir M. Rahmani, Yang Shao, Mehlam Jupiterwala, Carlos E. Colosqui","Poiseuille flow past a nanoscale cylinder in a slit channel: Lubrication
  theory versus molecular dynamics analysis",,"Phys. Fluids 27, 082004 (2015)","10.1063/1.4929524",,"physics.flu-dyn cond-mat.soft physics.comp-ph","http://arxiv.org/licenses/nonexclusive-distrib/1.0/","  Plane Poiseuille flow past a nanoscale cylinder that is arbitrarily confined
(i.e., symmetrically or asymmetrically confined) in a slit channel is studied
via hydrodynamic lubrication theory and molecular dynamics simulations,
considering cases where the cylinder remains static or undergoes thermal
motion. Lubrication theory predictions for the drag force and volumetric flow
rate are in close agreement with molecular dynamics simulations of flows having
molecularly thin lubrication gaps, despite the presence of significant
structural forces induced by the crystalline structure of the modeled solid.
While the maximum drag force is observed in symmetric confinement, i.e., when
the cylinder is equidistant from both channel walls, the drag decays
significantly as the cylinder moves away from the channel centerline and
approaches a wall. Hence, significant reductions in the mean drag force on the
cylinder and hydraulic resistance of the channel can be observed when thermal
motion induces random off-center displacements. Analytical expressions and
numerical results in this work provide useful insights into the hydrodynamics
of colloidal solids and macromolecules in confinement.
","[{""version"":""v1"",""created"":""Mon, 13 Apr 2015 02:51:14 GMT""}]","2016-04-26"
"1504.03051","Kenta Hayano","R. Inanc Baykur and Kenta Hayano","Hurwitz equivalence for Lefschetz fibrations and their multisections","25 pages, 16 figures, modifications requested by the anonymous
  referees",,,,"math.GT math.SG","http://arxiv.org/licenses/nonexclusive-distrib/1.0/","  In this article, we characterize isomorphism classes of Lefschetz fibrations
with multisections via their monodromy factorizations. We prove that two
Lefschetz fibrations with multisections are isomorphic if and only if their
monodromy factorizations in the relevant mapping class groups are related to
each other by a finite collection of modifications, which extend the well-known
Hurwitz equivalence. This in particular characterizes isomorphism classes of
Lefschetz pencils. We then show that, from simple relations in the mapping
class groups, one can derive new (and old) examples of Lefschetz fibrations
which cannot be written as fiber sums of blown-up pencils.
","[{""version"":""v1"",""created"":""Mon, 13 Apr 2015 02:54:46 GMT""},{""version"":""v2"",""created"":""Sun, 19 Jul 2015 05:32:36 GMT""}]","2015-07-21"
"1504.03052","Yasushi Kasahara","Yasushi Kasahara","Geometric intersection in representations of mapping class groups of
  surfaces","8 pages, 1 figure. A few corrections and clarifications; the final
  version",,,,"math.GT math.GR","http://arxiv.org/licenses/nonexclusive-distrib/1.0/","  We show that the detection of geometric intersection in an arbitrary
representation of the mapping class group of surface implies the injectivity of
that representation up to center, and vice versa. As an application, we discuss
the geometric intersection in the Johnson filtration. Also, we further consider
the problem of detecting the geometric intersection between separating simple
closed curves in a representation.
","[{""version"":""v1"",""created"":""Mon, 13 Apr 2015 02:56:20 GMT""},{""version"":""v2"",""created"":""Tue, 14 Apr 2015 10:19:01 GMT""},{""version"":""v3"",""created"":""Wed, 13 Apr 2016 04:47:58 GMT""},{""version"":""v4"",""created"":""Mon, 12 Dec 2016 04:52:09 GMT""}]","2016-12-13"
"1504.03053","Xiaosen Han","Xiaosen Han and Yisong Yang","Topologically Stratified Energy Minimizers in a Product Abelian Field
  Theory","22 pages","Nuclear Physics B Volume 898, September 2015, Pages 605-626","10.1016/j.nuclphysb.2015.07.022",,"math-ph hep-ph hep-th math.MP","http://arxiv.org/licenses/nonexclusive-distrib/1.0/","  We study a recently developed product Abelian gauge field theory by Tong and
Wong hosting magnetic impurities. We first obtain a necessary and sufficient
condition for the existence of a unique solution realizing such impurities in
the form of multiple vortices. We next reformulate the theory into an extended
model that allows the coexistence of vortices and anti-vortices. The two
Abelian gauge fields in the model induce two species of magnetic vortex-lines
resulting from $N_s$ vortices and $P_s$ anti-vortices ($s=1,2$) realized as the
zeros and poles of two complex-valued Higgs fields, respectively. An existence
theorem is established for the governing equations over a compact Riemann
surface $S$ which states that a solution with prescribed $N_1, N_2$ vortices
and $P_1,P_2$ anti-vortices of two designated species exists if and only if the
inequalities \[ \left|N_1+N_2-(P_1+P_2)\right|<\frac{|S|}{\pi},\quad
\left|N_1+2N_2-(P_1+2P_2)\right|<\frac{|S|}{\pi}, \] hold simultaneously, which
give bounds for the `differences' of the vortex and anti-vortex numbers in
terms of the total surface area of $S$. The minimum energy of these solutions
is shown to assume the explicit value \[ E= 4\pi (N_1+N_2+P_1+P_2), \] given in
terms of several topological invariants, measuring the total tension of the
vortex-lines.
","[{""version"":""v1"",""created"":""Mon, 13 Apr 2015 03:06:58 GMT""},{""version"":""v2"",""created"":""Mon, 8 Jun 2015 10:03:52 GMT""},{""version"":""v3"",""created"":""Wed, 15 Jul 2015 14:01:05 GMT""}]","2021-01-28"
"1504.03054","Brian Callander","B. Callander, E. Gasparim, L. Grama, L. A. B. San Martin","Symplectic Lefschetz Fibrations from a Lie-theoretical Viewpoint","To appear in Memoirs of Langlands, TQFT and Mirror Symmetry (Playa
  del Carmen 2014)",,,,"math.SG","http://arxiv.org/licenses/nonexclusive-distrib/1.0/","  This is an announcement of results proved in [GGS1], [GGS2], [C], and [CG]
where methods from Lie theory were used as new tools for the study of
symplectic Lefschetz fibrations.
","[{""version"":""v1"",""created"":""Mon, 13 Apr 2015 03:26:23 GMT""}]","2015-04-14"
"1504.03055","Zhi Wang","Wen-Chao Huang, Qi-Feng Liang, Dao-Xin Yao, and Zhi Wang","Manipulating the Majorana Qubit with the Landau-Zener-St\""{u}ckelberg
  Interference",,"Phys. Rev. A 92, 012308 (2015)","10.1103/PhysRevA.92.012308",,"cond-mat.supr-con quant-ph","http://arxiv.org/licenses/nonexclusive-distrib/1.0/","  Constructing a universal operation scheme for Majorana qubits remains a
central issue for the topological quantum computation. We study the
Landau-Zener-St\""{u}ckelberg interference in a Majorana qubit and show that
this interference can be used to achieve controllable operations. The Majorana
qubit consists of an rf SQUID with a topological nanowire Josephson junction
which hosts Majorana bound states. In the SQUID, a magnetic flux pulse can
drive the quantum evolution of the Majorana qubit. The qubit experiences two
Landau-Zener transitions when the amplitude of the pulse is tuned around the
superconducting flux quanta $2e/\hbar$. The Landau-Zener-St\""{u}ckelberg
interference between the two transitions rotates the Majorana qubit, with the
angle controlled by the time scale of the pulse. This rotation operation
implements a high-speed single-qubit gate on the Majorana qubit, which is a
necessary ingredient for the topological quantum computation.
","[{""version"":""v1"",""created"":""Mon, 13 Apr 2015 03:28:57 GMT""}]","2015-07-13"
"1504.03056","Shuo Cao","Shuo Cao, Marek Biesiada, Xiaogang Zheng, Zong-Hong Zhu","Exploring the properties of milliarcsecond radio sources","8 pages, 6 figures, Accepted for publication in ApJ","Astrophysical Journal, 806 (2015), 66","10.1088/0004-637X/806/1/66",,"astro-ph.CO","http://arxiv.org/licenses/nonexclusive-distrib/1.0/","  Cosmological applications of the ""redshift - angular size"" test require
knowledge of the linear size of the ""standard rod"" used. In this paper, we
study the properties of a large sample of 140 milliarcsecond compact radio
sources with flux densities measured at 6 cm and 20 cm, compiled by Gurvits et
al.(1999). Using the best-fitted cosmological parameters given by Planck/WMAP9
observations, we investigate the characteristic length $l_m$ as well as its
dependence on the source luminosity $L$ and redshift $l_m=l L^\beta (1+z)^n$.
For the full sample, measurements of the angular size $\theta$ provide a tight
constraint on the linear size parameters. We find that cosmological evolution
of the linear size is small ($|n|\simeq 10^{-2}$) and consistent with previous
analysis. However, a substantial evolution of linear sizes with luminosity is
still required ($\beta\simeq 0.17$). Furthermore, similar analysis done on
sub-samples defined by different source optical counterparts and different
redshift ranges, seems to support the scheme of treating radio galaxies and
quasars with distinct strategies. Finally, a cosmological-model-independent
method is discussed to probe the properties of angular size of milliarcsecond
radio quasars. Using the corrected redshift - angular size relation for quasar
sample, we obtained a value of the matter density parameter,
$\Omega_m=0.292^{+0.065}_{-0.090}$, in the spatially flat $\Lambda$CDM
cosmology.
","[{""version"":""v1"",""created"":""Mon, 13 Apr 2015 03:36:50 GMT""}]","2015-09-28"
"1504.03057","Kokou B Dossou","Kokou B. Dossou","Doppler shift generated by diffraction gratings under time-dependent
  incidence angle near a Wood anomaly","This paper has been withdrawn by the author because it has become
  obsolete after the publication of new articles: arXiv:1608.04166 and
  arXiv:1603.01329",,,,"physics.optics","http://arxiv.org/licenses/nonexclusive-distrib/1.0/","  Diffraction gratings are famous for their ability to exhibit, near a Wood
anomaly, an arbitrarily large angular dispersion, e.g., with respect to the
incidence angle or wavelength. For a diffraction grating under incidence by a
plane wave at a fixed frequency, by rotating the incidence angle at a given
angular velocity, the field propagated by a nonzero diffraction order will
rotate at increasingly fast angular velocity as the incidence angle approaches
the angle where Wood anomaly occurs. Such a fast rotating diffracted field has
the potential to generate a substantial Doppler shift. Indeed, under the
assumption of a grating with infinite extent, the expression for the
instantaneous frequency shift perceived by an observer, who is looking into the
light radiated by the diffraction order, is derived and it is in full agreement
with the prediction from an interpretation based on the Doppler shift generated
by a rotation of light sources. In particular the classical (non-relativistic)
Doppler shift can take arbitrarily high values as the incidence angle
approaches a Wood anomaly. It is also found that gratings of a finite size can
have a similar property. In order to have a physically detectable frequency
shift, it is important to use a grating which can maintain a significant
reflectance into higher diffraction orders near their Wood anomaly cut-off.
Interestingly, we have found that the geometry of the nanostructures of a
\emph{Morpho} butterfly wing scale is aptly suited for such a function because
it can strongly reflect into higher diffraction orders while minimising the
reflection into the specular order.
","[{""version"":""v1"",""created"":""Mon, 13 Apr 2015 03:44:44 GMT""},{""version"":""v2"",""created"":""Thu, 23 Mar 2017 01:54:42 GMT""}]","2017-03-24"
"1504.03058","Jiayue Tong","Jiayue Tong, Martin Muthee, Shao-Yu Chen, Sigfrid K. Yngvesson, Jun
  Yan","Antenna enhanced graphene THz emitter and detector",,,"10.1021/acs.nanolett.5b01635",,"cond-mat.mtrl-sci cond-mat.mes-hall","http://arxiv.org/licenses/nonexclusive-distrib/1.0/","  Recent intense electrical and optical studies of graphene have pushed the
material to the forefront of optoelectronic research. Of particular interest is
the few terahertz (THz) frequency regime where efficient light sources and
highly sensitive detectors are very challenging to make. Here we present THz
sources and detectors made with graphene field effect transistors (GFETs)
enhanced by a double-patch antenna and an on-chip silicon lens. We report the
first experimental observation of 1-3 THz radiation from graphene, as well as
four orders of magnitude performance improvements in a GFET thermoelectric
detector operating at ~2 THz. The quantitative analysis of the emitting power
and its unusual charge density dependence indicate significant non-thermal
contribution from the GFET. The polarization resolved detection measurements
with different illumination geometries allow for detailed and quantitative
analysis of various factors that contribute to the overall detector
performance. Our experimental results represent a significant advance towards
practically useful graphene THz devices.
","[{""version"":""v1"",""created"":""Mon, 13 Apr 2015 03:50:21 GMT""}]","2015-10-28"
"1504.03059","Martin Mosquera","Mart\'in A. Mosquera, Adam Wasserman","Time-dependent Electronic Populations in Fragment-based Time-dependent
  Density Functional Theory","9 pages, 3 figures",,,,"physics.chem-ph","http://creativecommons.org/licenses/by/3.0/","  Conceiving a molecule as composed of smaller molecular fragments, or
subunits, is one of the pillars of the chemical and physical sciences, and
leads to productive methods in quantum chemistry. Using a fragmentation scheme,
efficient algorithms can be proposed to address problems in the description of
chemical bond formation and breaking. We present a formally exact
time-dependent density-functional theory for the electronic dynamics of
molecular fragments with variable number of electrons. This new formalism is an
extension of previous work [Phys. Rev. Lett. {\bf 111}, 023001 (2013)]. We also
introduce a stable density-inversion method that is applicable to
time-dependent and ground-state density-functional theory, and their
extensions, including those discussed in this work.
","[{""version"":""v1"",""created"":""Mon, 13 Apr 2015 03:57:22 GMT""}]","2015-04-14"
