"1504.03171","Juan Luis Rubio","Juan Luis Rubio, Daniel Viscor, Ver\`onica Ahufinger, Jordi Mompart","Nanoscale resolution for fluorescence microscopy via adiabatic passage","5 pages, 3 figures","Opt. Express 21, Issue 19, pp. 22139-22144 (2013)","10.1364/OE.21.022139",,"quant-ph physics.bio-ph physics.optics","http://arxiv.org/licenses/nonexclusive-distrib/1.0/","  We propose the use of the subwavelength localization via adiabatic passage
technique for fluorescence microscopy with nanoscale resolution in the far
field. This technique uses a {\Lambda}-type medium coherently coupled to two
laser pulses: the pump, with a node in its spatial profile, and the Stokes. The
population of the {\Lambda} system is adiabatically transferred from one ground
state to the other except at the node position, yielding a narrow population
peak. This coherent localization allows fluorescence imaging with nanometer
lateral resolution. We derive an analytical expression to asses the resolution
and perform a comparison with the coherent population trapping and the
stimulated-emission-depletion techniques.
","[{""version"":""v1"",""created"":""Mon, 13 Apr 2015 13:23:19 GMT""}]","2015-04-14"
"1504.03172","Shunsuke Shimobayashi","S. F. Shimobayashi, B. M. Mognetti, L. Parolini, D. Orsi, P. Cicuta
  and L. Di Michele","Direct measurement of DNA-mediated adhesion between lipid bilayers","16 pages, 7 figures",,,,"physics.bio-ph cond-mat.soft","http://arxiv.org/licenses/nonexclusive-distrib/1.0/","  Multivalent interactions between deformable mesoscopic units are ubiquitous
in biology, where membrane macromolecules mediate the interactions between
neighbouring living cells and between cells and solid substrates. Lately,
analogous artificial materials have been synthesised by functionalising the
outer surface of compliant Brownian units, for example emulsion droplets and
lipid vesicles, with selective linkers, in particular short DNA sequences. This
development extended the range of applicability of DNA as a selective glue,
originally applied to solid nano and colloidal particles. On very deformable
lipid vesicles, the coupling between statistical effects of multivalent
interactions and mechanical deformation of the membranes gives rise to complex
emergent behaviours, as we recently contributed to demonstrate [Parolini et
al., Nature Communications, 2015, 6, 5948]. Several aspects of the complex
phenomenology observed in these systems still lack a quantitative experimental
characterisation and fundamental understanding. Here we focus on the
DNA-mediated multivalent interactions of a single liposome adhering to a flat
supported bilayer. This simplified geometry enables the estimate of the
membrane tension induced by the DNA-mediated adhesive forces acting on the
liposome. Our experimental investigation is completed by morphological
measurements and the characterisation of the DNA-melting transition, probed by
in-situ F\""{o}rster Resonant Energy Transfer spectroscopy. Experimental results
are compared with the predictions of an analytical theory that couples the
deformation of the vesicle to a full description of the statistical mechanics
of mobile linkers. With at most one fitting parameter, our theory is capable of
semi-quantitatively matching experimental data, confirming the quality of the
underlying assumptions.
","[{""version"":""v1"",""created"":""Mon, 13 Apr 2015 13:24:35 GMT""},{""version"":""v2"",""created"":""Thu, 16 Apr 2015 23:39:04 GMT""}]","2015-04-20"
"1504.03176","Konrad Tywoniuk","Wojciech Florkowski, Radoslaw Ryblewski, Nan Su, and Konrad Tywoniuk","Bulk viscosity in a plasma of Gribov-Zwanziger gluons","11 pages, 3 figures; published version","Acta Phys. Pol. B47 (2016) 1833","10.5506/APhysPolB.47.1833","ICCUB-15-014","hep-ph hep-lat hep-th nucl-th","http://arxiv.org/licenses/nonexclusive-distrib/1.0/","  We investigate dynamic properties of a plasma whose constituents are
confining gluons resulting from the Gribov quantization. In a static
formulation, this system reproduces qualitatively the pure-glue equation of
state and thereby encodes crucial features of the phase transition. The dynamic
description proposed in this work allows us to study non-equilibrium transport
phenomena with the inclusion of confinement effects. In particular, we
determine the non-equilibrium behaviour of the interaction measure (trace
anomaly) and find the form of the bulk viscosity coefficient. The latter may be
used in phenomenological applications to heavy-ion collisions.
","[{""version"":""v1"",""created"":""Mon, 13 Apr 2015 13:31:31 GMT""},{""version"":""v2"",""created"":""Tue, 8 Sep 2015 17:05:50 GMT""},{""version"":""v3"",""created"":""Fri, 5 Aug 2016 09:27:48 GMT""}]","2016-08-08"
"1504.03177","Mario Kieburg Dr. habil.","Tim Wirtz, Mario Kieburg, Thomas Guhr","Asymptotic Coincidence of the Statistics for Degenerate and
  Non-Degenerate Correlated Real Wishart Ensembles","Drastically extended version compared to the first version. New
  chapters on the analysis of the local and global spectral statistics
  including approximations on the position and standard deviation of outliers.
  New numerical simulations comparing the macroscopic level density and the
  distributions of the largest and the smallest eigenvalue. 24 pages, 5 figures","J. Phys. A 50, 235203 (2017)","10.1088/1751-8121/aa6a6c",,"math-ph cond-mat.stat-mech math.MP math.ST stat.TH","http://arxiv.org/licenses/nonexclusive-distrib/1.0/","  The correlated Wishart model provides the standard benchmark when analyzing
time series of any kind. Unfortunately, the real case, which is the most
relevant one in applications, poses serious challenges for analytical
calculations. Often these challenges are due to square root singularities which
cannot be handled using common random matrix techniques. We present a new way
to tackle this issue. Using supersymmetry, we carry out an anlaytical study
which we support by numerical simulations. For large but finite matrix
dimensions, we show that statistical properties of the fully correlated real
Wishart model generically approach those of a correlated real Wishart model
with doubled matrix dimensions and doubly degenerate empirical eigenvalues.
This holds for the local and global spectral statistics. With Monte Carlo
simulations we show that this is even approximately true for small matrix
dimensions. We explicitly investigate the $k$-point correlation function as
well as the distribution of the largest eigenvalue for which we find a
surprisingly compact formula in the doubly degenerate case. Moreover we show
that on the local scale the $k$-point correlation function exhibits the sine
and the Airy kernel in the bulk and at the soft edges, respectively. We also
address the positions and the fluctuations of the possible outliers in the
data.
","[{""version"":""v1"",""created"":""Mon, 13 Apr 2015 13:34:25 GMT""},{""version"":""v2"",""created"":""Wed, 2 Nov 2016 11:14:15 GMT""},{""version"":""v3"",""created"":""Wed, 26 Apr 2017 09:01:58 GMT""}]","2018-08-08"
"1504.03178","Sylvain Gigan","Hugo Defienne, Marco Barbieri, Ian A. Walmsley, Brian J. Smith, and
  Sylvain Gigan","Two-photon quantum walk in a multimode fiber","11 pages, 4 figures","Science Advances 29 Jan 2016: Vol. 2, no. 1, e1501054","10.1126/sciadv.1501054",,"quant-ph physics.optics","http://arxiv.org/licenses/nonexclusive-distrib/1.0/","  Multi-photon propagation in connected structures - a quantum walk - offers
the potential for simulating complex physical systems and provides a route to
universal quantum computation. Increasing the complexity of quantum photonic
networks where the walk occurs is essential for many applications. Here, we
implement a quantum walk of indistinguishable photon pairs in a multimode fiber
supporting 380 modes. Using wavefront shaping, we control the propagation of
the two-photon state through the fiber in which all modes are coupled.
Excitation of arbitrary output modes of the system is realized by controlling
classical and quantum interferences. This experiment demonstrates a highly
multimode platform for multi-photon interference experiments and provides a
powerful method to program a general high-dimensional multiport optical
circuit. This work paves the way for the next generation of photonic devices
for quantum simulation, computing and communication.
","[{""version"":""v1"",""created"":""Mon, 13 Apr 2015 13:36:33 GMT""},{""version"":""v2"",""created"":""Thu, 17 Mar 2016 20:22:01 GMT""}]","2016-03-21"
"1504.03179","Mykhaylo Evstigneev","A.V. Sachenko, A.I. Shkrebtii, R.M. Korkishko, V.P. Kostylyov, N.P.
  Kulish, I.O. Sokolovskiy, and M. Evstigneev","Analysis of the attainable efficiency of a direct-bandgap betavoltaic
  element",,,"10.1088/0022-3727/48/45/455101",,"cond-mat.mtrl-sci","http://arxiv.org/licenses/nonexclusive-distrib/1.0/","  Conversion of energy of beta-particles into electric energy in a p-n junction
based on direct-bandgap semiconductors, such as GaAs, considering realistic
semiconductor system parameters is analyzed. An expression for the collection
coefficient, $Q$, of the electron-hole pairs generated by beta-electrons is
derived taking into account the existence of the dead layer. We show that the
collection coefficient of beta-electrons emitted by a \Tr-source to a GaAs p-n
junction is close to 1 in a broad range of electron lifetimes in the junction,
ranging from $10^{-9}$ to $10^{-7}$ s. For the combination \Pm/GaAs, $Q$ is
relatively large ($\ge 0.4$) only for quite long lifetimes (about $10^{-7}$ s)
and large thicknesses (about $100\,\mu$m) of GaAs p-n junctions. For realistic
lifetimes of minority carriers and their diffusion coefficients, the
open-circuit voltage realized due to the irradiation of a GaAs p-n junction by
beta-particles is obtained. The attainable beta-conversion efficiency $\eta$ in
the case of a \Tr/GaAs combination is found to exceed that of the \Pm/GaAs
combination.
","[{""version"":""v1"",""created"":""Mon, 13 Apr 2015 13:36:57 GMT""}]","2015-10-28"
"1504.03180","Yongkun Li","Yongkun Li and Lili Zhao","Weighted pseudo-almost periodic functions on time scales with
  applications to cellular neural networks with discrete delays","25 pages",,"10.1002/mma.4107",,"math.CA","http://arxiv.org/licenses/nonexclusive-distrib/1.0/","  In this paper, we first propose a concept of weighted pseudo-almost periodic
functions on time scales and study some basic properties of weighted
pseudo-almost periodic functions on time scales. Then, we establish some
results about the existence of weighted pseudo-almost periodic solutions to
linear dynamic equations on time scales. Finally, as an application of our
results, we study the existence and global exponential stability of weighted
pseudo-almost periodic solutions for a class of cellular neural networks with
discrete delays on time scales. The results of this paper are completely new.
","[{""version"":""v1"",""created"":""Mon, 13 Apr 2015 13:38:31 GMT""}]","2016-07-28"
"1504.03181","Artem Nikitin","A. M. Nikitin, Y. Pan, X. Mao, R. Jehee, G. K. Araizi, Y. K. Huang, C.
  Paulsen, S. C. Wu, B. H. Yan and A. de Visser","Magnetic and superconducting phase diagram of the half-Heusler
  topological semimetal HoPdBi","14 pages, 8 figures","J. Phys.: Condens. Matter 27 (2015) 275701","10.1088/0953-8984/27/27/275701",,"cond-mat.supr-con","http://arxiv.org/licenses/nonexclusive-distrib/1.0/","  We report a study of the magnetic and electronic properties of the
non-centrosymmetric half-Heusler antiferromagnet HoPdBi ($T_N = 2.0$ K).
Magnetotransport measurements show HoPdBi has a semimetallic behaviour with a
carrier concentration $n=3.7 \times 10^{18}$ cm$^{-3}$ extracted from the
Shubnikov-de Haas effect. The magnetic phase diagram in the field-temperature
plane has been determined by transport, magnetization and thermal expansion
measurements: magnetic order is suppressed at $B_M\sim 3.6$ T for $T
\rightarrow 0$. Superconductivity with $T_c \sim 1.9$ K is found in the
antiferromagnetic phase. Ac-susceptibility measurements provide solid evidence
for bulk superconductivity below $T_c = 0.75$ K with a screening signal close
to a volume fraction of 100 %. The upper critical field shows an unusual linear
temperature variation with $B_{c2}(T \rightarrow 0) = 1.1$ T. We also report
electronic structure calculations that classify HoPdBi as a new topological
semimetal, with a non-trivial band inversion of 0.25 eV.
","[{""version"":""v1"",""created"":""Mon, 13 Apr 2015 13:41:47 GMT""}]","2015-07-31"
"1504.03182","Amaro Barreal","Amaro Barreal, Joonas P\""a\""akk\""onen, David Karpuk, Camilla Hollanti,
  Olav Tirkkonen","A Low-Complexity Message Recovery Method for Compute-and-Forward
  Relaying","5 figures, 5 pages, submitted",,,,"cs.IT math.IT","http://arxiv.org/licenses/nonexclusive-distrib/1.0/","  The Compute-and-Forward relaying strategy achieves high computation rates by
decoding linear combinations of transmitted messages at intermediate relays.
However, if the involved relays independently choose which combinations of the
messages to decode, there is no guarantee that the overall system of linear
equations is solvable at the destination. In this article it is shown that, for
a Gaussian fading channel model with two transmitters and two relays, always
choosing the combination that maximizes the computation rate often leads to a
case where the original messages cannot be recovered. It is further shown that
by limiting the relays to select from carefully designed sets of equations, a
solvable system can be guaranteed while maintaining high computation rates. The
proposed method has a constant computational complexity and requires no
information exchange between the relays.
","[{""version"":""v1"",""created"":""Mon, 13 Apr 2015 13:48:59 GMT""},{""version"":""v2"",""created"":""Mon, 20 Apr 2015 06:29:41 GMT""}]","2015-04-21"
"1504.03183","Barbara Engelhardt","Gregory Darnell and Stoyan Georgiev and Sayan Mukherjee and Barbara E
  Engelhardt","Adaptive Randomized Dimension Reduction on Massive Data","arXiv admin note: substantial text overlap with arXiv:1211.1642",,,,"stat.ML q-bio.QM","http://arxiv.org/licenses/nonexclusive-distrib/1.0/","  The scalability of statistical estimators is of increasing importance in
modern applications. One approach to implementing scalable algorithms is to
compress data into a low dimensional latent space using dimension reduction
methods. In this paper we develop an approach for dimension reduction that
exploits the assumption of low rank structure in high dimensional data to gain
both computational and statistical advantages. We adapt recent randomized
low-rank approximation algorithms to provide an efficient solution to principal
component analysis (PCA), and we use this efficient solver to improve parameter
estimation in large-scale linear mixed models (LMM) for association mapping in
statistical and quantitative genomics. A key observation in this paper is that
randomization serves a dual role, improving both computational and statistical
performance by implicitly regularizing the covariance matrix estimate of the
random effect in a LMM. These statistical and computational advantages are
highlighted in our experiments on simulated data and large-scale genomic
studies.
","[{""version"":""v1"",""created"":""Mon, 13 Apr 2015 13:52:17 GMT""}]","2015-04-14"
"1504.03184","Tslil Clingman","T. Clingman, Jeff Murugan, Jonathan P. Shock","Probability Density Functions from the Fisher Information Metric","16 pages, no figures",,,"QGaSLAB-15-02","cs.IT math.DG math.IT math.ST physics.data-an stat.TH","http://arxiv.org/licenses/nonexclusive-distrib/1.0/","  We show a general relation between the spatially disjoint product of
probability density functions and the sum of their Fisher information metric
tensors. We then utilise this result to give a method for constructing the
probability density functions for an arbitrary Riemannian Fisher information
metric tensor. We note further that this construction is extremely
unconstrained, depending only on certain continuity properties of the
probability density functions and a select symmetry of their domains.
","[{""version"":""v1"",""created"":""Mon, 13 Apr 2015 13:53:37 GMT""}]","2015-04-14"
"1504.03185","Tong-Gyu Lee","Tong-Gyu Lee, Eiji Nakano, Yasuhiko Tsue, Toshitaka Tatsumi, and Bengt
  Friman","Landau-Peierls instability in a Fulde-Ferrell type inhomogeneous chiral
  condensed phase","24pages","Phys. Rev. D 92, 034024 (2015)","10.1103/PhysRevD.92.034024","YITP-15-34; KUNS-2558","hep-ph","http://arxiv.org/licenses/nonexclusive-distrib/1.0/","  We investigate the stability of an inhomogeneous chiral condensed phase
against low energy fluctuations about a spatially modulated order parameter.
This phase corresponds to the so-called dual chiral density wave in the context
of quark matter, where the chiral condensate is spatially modulated with a
finite wavevector in a single direction. From the symmetry viewpoint, the phase
realizes a locking of flavor and translational symmetries. Starting with a
Landau-Ginzburg-Wilson effective Lagrangian, we find that the associated
Nambu-Goldstone modes, whose dispersion relations are spatially anisotropic and
soft in the direction normal to the wavevector of the modulation, wash out the
long-range order at finite temperatures, but support algebraically decaying
long-range correlations. This implies that the phase can exhibit a
quasi-one-dimensional order as in liquid crystals.
","[{""version"":""v1"",""created"":""Mon, 13 Apr 2015 13:54:13 GMT""}]","2015-08-31"
"1504.03187","Christian Angrick","Christian Angrick, Francesco Pace, Matthias Bartelmann, Mauro
  Roncarelli","Constraints on $\Omega_\mathrm{m}$ and $\sigma_8$ from the
  potential-based cluster temperature function","10 pages, 5 figures, 2 tables; accepted by MNRAS; some typos
  corrected","MNRAS 454, 1687-1696 (2015)","10.1093/mnras/stv2043",,"astro-ph.CO","http://arxiv.org/licenses/nonexclusive-distrib/1.0/","  The abundance of galaxy clusters is in principle a powerful tool to constrain
cosmological parameters, especially $\Omega_\mathrm{m}$ and $\sigma_8$, due to
the exponential dependence in the high-mass regime. While the best observables
are the X-ray temperature and luminosity, the abundance of galaxy clusters,
however, is conventionally predicted as a function of mass. Hence, the
intrinsic scatter and the uncertainties in the scaling relations between mass
and either temperature or luminosity lower the reliability of galaxy clusters
to constrain cosmological parameters. In this article, we further refine the
X-ray temperature function for galaxy clusters by Angrick et al., which is
based on the statistics of perturbations in the cosmic gravitational potential
and proposed to replace the classical mass-based temperature function, by
including a refined analytic merger model and compare the theoretical
prediction to results from a cosmological hydrodynamical simulation. Although
we find already a good agreement if we compare with a cluster temperature
function based on the mass-weighted temperature, including a redshift-dependent
scaling between mass-based and spectroscopic temperature yields even better
agreement between theoretical model and numerical results. As a proof of
concept, incorporating this additional scaling in our model, we constrain the
cosmological parameters $\Omega_\mathrm{m}$ and $\sigma_8$ from an X-ray sample
of galaxy clusters and tentatively find agreement with the recent cosmic
microwave background based results from the Planck mission at 1$\sigma$-level.
","[{""version"":""v1"",""created"":""Mon, 13 Apr 2015 13:57:57 GMT""},{""version"":""v2"",""created"":""Tue, 8 Sep 2015 09:41:52 GMT""},{""version"":""v3"",""created"":""Mon, 21 Sep 2015 13:12:43 GMT""}]","2015-10-23"
"1504.03188","Eugene Postnikov","Eugene B. Postnikov, Igor M. Sokolov","Robust linear regression with broad distributions of errors","23 pages, 8 figures","Physica A 434 (2015) 257-267","10.1016/j.physa.2015.04.025",,"physics.data-an","http://arxiv.org/licenses/nonexclusive-distrib/1.0/","  We consider the problem of linear fitting of noisy data in the case of broad
(say $\alpha$-stable) distributions of random impacts (""noise""), which can lack
even the first moment. This situation, common in statistical physics of small
systems, in Earth sciences, in network science or in econophysics, does not
allow for application of conventional Gaussian maximum-likelihood estimators
resulting in usual least-squares fits. Such fits lead to large deviations of
fitted parameters from their true values due to the presence of outliers. The
approaches discussed here aim onto the minimization of the width of the
distribution of residua. The corresponding width of the distribution can either
be defined via the interquantile distance of the corresponding distributions or
via the scale parameter in its characteristic function. The methods provide the
robust regression even in the case of short samples with large outliers, and
are equivalent to the normal least squares fit for the Gaussian noises. Our
discussion is illustrated by numerical examples.
","[{""version"":""v1"",""created"":""Mon, 13 Apr 2015 14:01:03 GMT""}]","2015-05-27"
"1504.03189","Axel Brandenburg","Axel Brandenburg (University of Colorado and Nordita)","Stellar mixing length theory with entropy rain","19 pages, 9 figures, Astrophysical J. (in press)","Astrophys. J. 832, 6 (2016)","10.3847/0004-637X/832/1/6","NORDITA-2015-42","astro-ph.SR","http://arxiv.org/licenses/nonexclusive-distrib/1.0/","  The effects of a non-gradient flux term originating from the motion of
convective elements with entropy perturbations of either sign are investigated
and incorporated into a modified version of stellar mixing length theory (MLT).
Such a term, first studied by Deardorff in the meteorological context, might
represent the effects of cold intense downdrafts caused by the rapid cooling in
the granulation layer at the top of the convection zone of late-type stars.
Such intense downdrafts were first seen in the strongly stratified simulations
of Stein & Nordlund in the late 1980s. These downdrafts transport heat
nonlocally, a phenomenon referred to as entropy rain. Moreover, the Deardorff
term can cause upward enthalpy transport even in a weakly Schwarzschild-stably
stratified layer. In that case, no giant cell convection would be excited. This
is interest in view of recent observations, which could be explained if the
dominant flow structures were of small scale even at larger depths. To study
this possibility, three distinct flow structures are examined: one in which
convective structures have similar size and mutual separation at all depths,
one in which the separation increases with depth, but their size is still
unchanged, and one in which both size and separation increase with depth, which
is the standard flow structure. It is concluded that the third possibility with
fewer and thicker downdrafts in deeper layers remains most plausible, but it
may be unable to explain the suspected absence of large-scale flows with speeds
and scales expected from MLT.
","[{""version"":""v1"",""created"":""Mon, 13 Apr 2015 14:05:40 GMT""},{""version"":""v2"",""created"":""Mon, 8 Jun 2015 13:09:54 GMT""},{""version"":""v3"",""created"":""Fri, 24 Jul 2015 14:32:34 GMT""},{""version"":""v4"",""created"":""Mon, 15 Feb 2016 03:20:13 GMT""},{""version"":""v5"",""created"":""Mon, 30 May 2016 15:00:31 GMT""},{""version"":""v6"",""created"":""Mon, 22 Aug 2016 19:06:04 GMT""},{""version"":""v7"",""created"":""Mon, 24 Oct 2016 04:29:26 GMT""}]","2016-11-11"
"1504.03190","Sam Dolan Dr","Sam R Dolan and David Dempsey","Bound states of the Dirac equation on Kerr spacetime","37 pages, 9 figures. For a Focus Issue of Classical and Quantum
  Gravity on ""Black holes and fundamental fields""","Class. Quant. Grav. 32, 184001 (2015)","10.1088/0264-9381/32/18/184001",,"gr-qc hep-th","http://arxiv.org/licenses/nonexclusive-distrib/1.0/","  We formulate the Dirac equation for a massive neutral spin-half particle on a
rotating black hole spacetime, and we consider its (quasi)bound states:
gravitationally-trapped modes which are regular across the future event
horizon. These bound states decay with time, due to the absence of
superradiance in the (single-particle) Dirac field. We introduce a practical
method for computing the spectrum of energy levels and decay rates, and we
compare our numerical results with known asymptotic results in the small-$M
\mu$ and large-$M \mu$ regimes. By applying perturbation theory in a
horizon-penetrating coordinate system, we compute the `fine structure' of the
energy spectrum, and show good agreement with numerical results. We obtain data
for a hyperfine splitting due to black hole rotation. We evolve generic initial
data in the time domain, and show how Dirac bound states appear as spectral
lines in the power spectra. In the rapidly-rotating regime, we find that the
decay of low-frequency co-rotating modes is suppressed in the (bosonic)
superradiant regime. We conclude with a discussion of physical implications and
avenues for further work.
","[{""version"":""v1"",""created"":""Mon, 13 Apr 2015 14:06:34 GMT""},{""version"":""v2"",""created"":""Thu, 12 Nov 2015 13:18:21 GMT""}]","2015-11-13"
