"1504.04736","Kamil Szpojankowski","Wiktor Ejsmont, Uwe Franz, Kamil Szpojankowski","Convolution, subordination and characterization problems in
  noncommutative probability",,"Indiana Univ. Math. J. 66 (2017), 237-257","10.1512/iumj.2017.66.5971",,"math.OA math.PR","http://arxiv.org/licenses/nonexclusive-distrib/1.0/","  Characterization problems in free probability are studied here. Using
subordination of free additive and free multiplicative convolutions we
generalize some known characterizations in free probability to random variables
with unbounded support. Using this technique we also prove a new
characterization of distributions of free random variables. A similar technique
is used to study Laha-Lukacs regressions for monotonically independent random
variables.
","[{""version"":""v1"",""created"":""Sat, 18 Apr 2015 16:04:25 GMT""}]","2021-04-20"
"1504.04737","Francis Brown","Francis Brown","Zeta elements in depth 3 and the fundamental Lie algebra of a punctured
  elliptic curve",,,,,"math.NT","http://arxiv.org/licenses/nonexclusive-distrib/1.0/","  This paper draws connections between the double shuffle equations and
structure of associators; universal mixed elliptic motives as defined by Hain
and Matsumoto; and the Rankin-Selberg method for modular forms for
$SL_2(\mathbb{Z})$. We write down explicit formulae for zeta elements
$\sigma_{2n-1}$ (generators of the Tannaka Lie algebra of the category of mixed
Tate motives over $\mathbb{Z}$) in depths up to four, give applications to the
Broadhurst-Kreimer conjecture, and completely solve the double shuffle
equations for multiple zeta values in depths two and three.
","[{""version"":""v1"",""created"":""Sat, 18 Apr 2015 16:06:13 GMT""}]","2015-04-21"
"1504.04738","Wen Hui Long","Jun Ling Song, Qiang Zhao, and Wen Hui Long","Central depressions in the charge density profiles of the nuclei around
  $^{46}$Ar","5 figures, 2 tables, and 9 pages",,,,"nucl-th","http://arxiv.org/licenses/nonexclusive-distrib/1.0/","  The occurrence of the proton bubble-like structure has been studied within
the relativistic Hartree-Fock-Bogoliubov (RHFB) and relativistic
Hartree-Bogoliubov (RHB) theories by exploring the bulk properties, the charge
density profiles and single proton spectra of argon isotopes and $N = 28$
isotones. It is found that the RHFB calculations with PKA1 effective
interaction, which can properly reproduce the charge radii of argon isotopes
and the $Z=16$ proton shell nearby, do not support the occurrence of the proton
bubble-like structure in argon isotopes due to the prediction of deeper bound
proton orbit $\pi2s_{1/2}$ than $\pi1d_{3/2}$. For $N = 28$ isotones, $^{42}$Si
and $^{40}$Mg are predicted by both RHFB and RHB models to have the proton
bubble-like structure, owing to the large gap between the proton $\pi2s_{1/2}$
and $\pi1d_{5/2}$ orbits, namely the $Z=14$ proton shell. Therefore, $^{42}$Si
is proposed as the potential candidate of proton bubble nucleus, which has
longer life-time than $^{40}$Mg.
","[{""version"":""v1"",""created"":""Sat, 18 Apr 2015 16:15:49 GMT""}]","2015-04-21"
"1504.04739","Wojciech Czarnecki","Rafal Jozefowicz, Wojciech Marian Czarnecki","Fast optimization of Multithreshold Entropy Linear Classifier","Presented at Theoretical Foundations of Machine Learning 2015
  (http://tfml.gmum.net), final version published in Schedae Informaticae
  Journal",,"10.4467/20838476SI.14.005.3022",,"cs.LG stat.ML","http://arxiv.org/licenses/nonexclusive-distrib/1.0/","  Multithreshold Entropy Linear Classifier (MELC) is a density based model
which searches for a linear projection maximizing the Cauchy-Schwarz Divergence
of dataset kernel density estimation. Despite its good empirical results, one
of its drawbacks is the optimization speed. In this paper we analyze how one
can speed it up through solving an approximate problem. We analyze two methods,
both similar to the approximate solutions of the Kernel Density Estimation
querying and provide adaptive schemes for selecting a crucial parameters based
on user-specified acceptable error. Furthermore we show how one can exploit
well known conjugate gradients and L-BFGS optimizers despite the fact that the
original optimization problem should be solved on the sphere. All above methods
and modifications are tested on 10 real life datasets from UCI repository to
confirm their practical usability.
","[{""version"":""v1"",""created"":""Sat, 18 Apr 2015 16:19:22 GMT""}]","2015-04-21"
"1504.04740","Wojciech Czarnecki","Wojciech Marian Czarnecki","On the consistency of Multithreshold Entropy Linear Classifier","Presented at Theoretical Foundations of Machine Learning 2015
  (http://tfml.gmum.net), final version published in Schedae Informaticae
  Journal",,"10.4467/20838476SI.15.012.3034",,"cs.LG stat.ML","http://arxiv.org/licenses/nonexclusive-distrib/1.0/","  Multithreshold Entropy Linear Classifier (MELC) is a recent classifier idea
which employs information theoretic concept in order to create a multithreshold
maximum margin model. In this paper we analyze its consistency over
multithreshold linear models and show that its objective function upper bounds
the amount of misclassified points in a similar manner like hinge loss does in
support vector machines. For further confirmation we also conduct some
numerical experiments on five datasets.
","[{""version"":""v1"",""created"":""Sat, 18 Apr 2015 16:29:26 GMT""}]","2015-04-21"
"1504.04741","Francisco J. Beron-Vera","Y. Wang, M. J. Olascoaga and F. J. Beron-Vera","Coherent water transport across the South Atlantic","In press","Geophysical Research Letters, 2015",,,"physics.ao-ph physics.flu-dyn physics.geo-ph","http://arxiv.org/licenses/nonexclusive-distrib/1.0/","  The role of mesoscale eddies in transporting Agulhas leakage is investigated
using a recent technique from nonlinear dynamical systems theory applied on
geostrophic currents inferred from the over two-decade-long satellite altimetry
record. Eddies are found to acquire material coherence away from the Agulhas
retroflection, near the Walvis Ridge in the South Atlantic. Yearly, 1 to 4
coherent material eddies are detected with diameters ranging from 40 to 280 km.
A total of 23 eddy cores of about 50 km in diameter and with at least 30\pct of
their contents traceable into the Indian Ocean were found to travel across the
subtropical gyre with minor filamentation. Only 1 eddy core was found to pour
its contents on the North Brazil Current. While ability of eddies to carry
Agulhas leakage northwestward across the South Atlantic is supported by our
analysis, this is more restricted than suggested by earlier ring transport
assessments.
","[{""version"":""v1"",""created"":""Sat, 18 Apr 2015 16:30:31 GMT""},{""version"":""v2"",""created"":""Fri, 1 May 2015 13:31:21 GMT""}]","2015-05-04"
"1504.04742","Vitaly Chaban","Guilherme Colherinhas, Eudes Eterno Fileti and Vitaly V. Chaban","Can Inorganic Salts Tune Electronic Properties of Graphene?",,,,,"cond-mat.mtrl-sci","http://arxiv.org/licenses/nonexclusive-distrib/1.0/","  Electronic properties of graphene quantum dots (GQDs) constitute a subject of
intense scientific interest. Being smaller than 20 nm, GQDs contain confined
excitons in all dimensions simultaneously. GQDs feature a non-zero band gap and
luminesce on excitation. Tuning their electronic structure is an attractive
goal with a technological promise. In this work, we apply density functional
theory to study an effect of neutral ionic clusters adsorbed on GQD surface. We
conclude that both HOMO and LUMO of GQD are very sensitive to the presence of
ions and to their distance from the GQD surface. However, the alteration of the
band gap itself is modest, as opposed to the case of free ions (recent
reports). Our work fosters progress in modulating electronic properties of
nanoscale carbonaceous materials.
","[{""version"":""v1"",""created"":""Sat, 18 Apr 2015 16:46:45 GMT""}]","2015-04-21"
"1504.04743","Alexander Gusev S.","Alexander S. Gusev, Firouz Sakhibov, Yury N. Efremov","Star formation rates and the kinematics of gas in the spiral arms of NGC
  628","8 pages, 6 figures, 1 table. Accepted for publication in
  Astronomische Nachrichten",,"10.1002/asna.201512170",,"astro-ph.GA","http://arxiv.org/licenses/nonexclusive-distrib/1.0/","  Relations between star formation rates along the spiral arms and the
velocities of gas inflow into the arms in grand-design galaxy NGC 628 were
studied. We found that the radial distribution of average star formation rate
in individual star formation regions in regular spiral arms correlates with the
velocity of gas inflow into the spiral arms. Both distributions have maxima at
a galactocentric distance of 4.5-5 kpc. There are no correlations between the
radial distributions of average star formation rate in star formation regions
in spiral arms and outside spiral arms in the main disc. We also did not find a
correlation between the radial distribution of average star formation rate in
star formation regions in spiral arms and HI column density.
","[{""version"":""v1"",""created"":""Sat, 18 Apr 2015 16:53:54 GMT""}]","2015-05-08"
"1504.04744","David Gelbwaser-Klimovsky","David Gelbwaser-Klimovsky and Al\'an Aspuru-Guzik","Strongly coupled quantum heat machines",,"J. Phys. Chem. Lett., 2015, 6, 3477","10.1021/acs.jpclett.5b01404",,"quant-ph","http://arxiv.org/licenses/nonexclusive-distrib/1.0/","  Quantum heat machines (QHMs) models generally assume a weak coupling to the
baths. This supposition is grounded in the separability principle between
systems and allows the derivation of the evolution equation for this case. In
the weak coupling regime, the machine's output is limited by the coupling
strength, restricting their application. Seeking to overcome this limitation,
we here analyze QHMs in the virtually unexplored strong coupling regime, where
separability, as well as other standard thermodynamic assumptions, may no
longer hold. We show that strongly coupled QHMs may be as efficient as their
weakly coupled counterparts. In addition, we find a novel turnover behavior
where their output saturates and disappears in the limit of ultra-strong
coupling.
","[{""version"":""v1"",""created"":""Sat, 18 Apr 2015 17:36:27 GMT""}]","2015-08-27"
"1504.04745","Tyler Shendruk N","Tyler N. Shendruk and Julia M. Yeomans","Multi-Particle Collision Dynamics Algorithm for Nematic Fluids",,"Soft Matter, 2015, 11, 5101-5110","10.1039/C5SM00839E",,"cond-mat.soft","http://arxiv.org/licenses/nonexclusive-distrib/1.0/","  Research on transport, self-assembly and defect dynamics within confined,
flowing liquid crystals requires versatile and computationally efficient
mesoscopic algorithms to account for fluctuating nematohydrodynamic
interactions. We present a multi-particle collision dynamics (MPCD) based
algorithm to simulate liquid-crystal hydrodynamic and director fields in two
and three dimensions. The nematic-MPCD method is shown to successfully
reproduce the features of a nematic liquid crystal, including a
nematic-isotropic phase transition with hysteresis in 3D, defect dynamics,
isotropic Frank elastic coefficients, tumbling and shear alignment regimes and
boundary condition dependent order parameter fields.
","[{""version"":""v1"",""created"":""Sat, 18 Apr 2015 17:42:11 GMT""}]","2016-06-22"
"1504.04746","Javad Taghizadeh Firouzjaee","Rahim Moradi, Javad T. Firouzjaee and Reza Mansouri","Cosmological black holes: the spherical perfect fluid collapse with
  pressure in a FRW background","14 pages, 11 figures, a few discussion added accepted version for
  Class. Quantum Grav. arXiv admin note: substantial text overlap with
  arXiv:1301.1480","Class. Quantum Grav. 32 (2015) 215001","10.1088/0264-9381/32/21/215001",,"gr-qc astro-ph.CO","http://creativecommons.org/licenses/by/4.0/","  We have constructed a spherically symmetric structure model in a cosmological
background filled with perfect fluid with non-vanishing pressure as an exact
solution of Einstein equations using the Lema\^{i}tre solution. To study its
local and quasi-local characteristics including the novel features of its
central black hole, we have suggested an algorithm to integrate the equations
numerically. The result shows intriguing effects of the pressure inside the
structure. The evolution of the central black hole within the FRW universe, its
decoupling from the expanding parts of the model, the structure of its
space-like apparent horizon, the limiting case of the dynamical horizon tending
to a slowly evolving horizon, and the decreasing mass in-fall to the black hole
is also studied. The cosmological redshift of a light emitted from the
cosmological structure to an observer in the FRW background is also calculated.
This cosmological redshift includes local and cosmic part which are explicitly
separated. We have also formulated a modified NFW density profile for a
structure to match the exact solution conditions.
","[{""version"":""v1"",""created"":""Sat, 18 Apr 2015 17:54:59 GMT""},{""version"":""v2"",""created"":""Sun, 4 Oct 2015 05:08:51 GMT""}]","2015-10-07"
"1504.04747","Pablo Poggi","P. M. Poggi, F. C. Lombardo, D. A. Wisniacki","Enhancement of quantum speed limit time due to cooperative effects in
  multilevel systems","6 pages, 4 figures. Minor revisions and updated journal reference","J. Phys. A: Math. Theor. 48 35FT02 (2015)","10.1088/1751-8113/48/35/35FT02",,"quant-ph","http://arxiv.org/licenses/nonexclusive-distrib/1.0/","  Deriving minimum evolution times is of paramount importance in quantum
mechanics. Bounds on the speed of evolution are given by the so called quantum
speed limit (QSL). In this work we use quantum optimal control methods to study
the QSL for driven many level systems which exhibit local two-level
interactions in the form of avoided crossings (ACs). Remarkably, we find that
optimal evolution times are proportionally smaller than those predicted by the
well-known two-level case, even when the ACs are isolated. We show that the
physical mechanism for such enhancement is due to non-trivial cooperative
effects between the AC and other levels, which are dynamically induced by the
shape of the optimized control field.
","[{""version"":""v1"",""created"":""Sat, 18 Apr 2015 17:59:35 GMT""},{""version"":""v2"",""created"":""Thu, 3 Sep 2015 17:29:03 GMT""}]","2015-09-04"
"1504.04748","Ming Zeng","Xuewu Wang, Ming Zeng, Zhi Zeng, Yi Wang, Ziran Zhao, Xiaoguang Yue,
  Zhifei Luo, Hengguan Yi, Baihui Yu, Jianping Cheng","The cosmic ray muon tomography facility based on large scale MRPC
  detector","7 pages, 4 figures, SORMA XV","Nucl. Instr. and Meth. in Phys. Res. A 784 (2015) 390","10.1016/j.nima.2015.01.024",,"physics.ins-det hep-ex nucl-ex","http://arxiv.org/licenses/nonexclusive-distrib/1.0/","  Cosmic ray muon tomography is a novel technology to detect high-Z material. A
prototype of TUMUTY with 73.6 cm x 73.6 cm large scale position sensitive MRPC
detectors has been developed and is introduced in this paper. Three test kits
have been tested and image is reconstructed using MAP algorithm. The
reconstruction results show that the prototype is working well and the objects
with complex structure and small size (20 mm) can be imaged on it, while the
high-Z material is distinguishable from the low-Z one. This prototype provides
a good platform for our further studies of the physical characteristics and the
performances of cosmic ray muon tomography.
","[{""version"":""v1"",""created"":""Sat, 18 Apr 2015 18:06:16 GMT""}]","2021-09-03"
"1504.04749","Erol  Vatansever","Erol Vatansever and Hamza Polat","Dynamic phase transitions in a ferromagnetic thin film system: A Monte
  Carlo simulation study","15 pages, 5 Figures",,,,"cond-mat.stat-mech","http://arxiv.org/licenses/nonexclusive-distrib/1.0/","  Dynamic phase transition properties of ferromagnetic thin film system under
the influence both bias and time dependent magnetic fields have been elucidated
by means of kinetic Monte Carlo simulation with local spin update Metropolis
algorithm. The obtained results after a detailed analysis suggest that bias
field is the conjugate field to dynamic order parameter, and it also appears to
define a phase line between two antiparallel dynamic ordered states depending
on the considered system parameters. Moreover, the data presented in this study
well qualitatively reproduce the recently published experimental findings where
time dependent magnetic behavior of a uniaxial cobalt films is studied in the
neighborhood of dynamic phase transition point.
","[{""version"":""v1"",""created"":""Sat, 18 Apr 2015 18:17:43 GMT""}]","2015-04-21"
"1504.04750","Dilek K\""u\c{c}\""uk","Dilek K\""u\c{c}\""uk and Tolga \.Inan and Burak Boyrazo\u{g}lu and
  Serkan Buhan and \""Ozg\""ul Salor and I\c{s}{\i}k \c{C}ad{\i}rc{\i} and
  Muammer Ermi\c{s}","PQStream: A Data Stream Architecture for Electrical Power Quality","Appears in Proceedings of International Workshop on Knowledge
  Discovery from Ubiquitous Data Streams of ECML/PKDD, 2007",,,,"cs.DB","http://arxiv.org/licenses/nonexclusive-distrib/1.0/","  In this paper, a data stream architecture is presented for electrical power
quality (PQ) which is called PQStream. PQStream is developed to process and
manage time-evolving data coming from the country-wide mobile measurements of
electrical PQ parameters of the Turkish Electricity Transmission System. It is
a full-fledged system with a data measurement module which carries out
processing of continuous PQ data, a stream database which stores the output of
the measurement module, and finally a Graphical User Interface for
retrospective analysis of the PQ data stored in the stream database. The
presented model is deployed and is available to PQ experts, academicians and
researchers of the area. As further studies, data mining methods such as
classification and clustering algorithms will be applied in order to deduce
useful PQ information from this database of PQ data.
","[{""version"":""v1"",""created"":""Sat, 18 Apr 2015 18:25:18 GMT""}]","2015-04-21"
"1504.04751","Dilek K\""u\c{c}\""uk","Dilek K\""u\c{c}\""uk and Meltem Turhan Y\""ondem","A Knowledge-poor Pronoun Resolution System for Turkish","Appears in Proceedings of the 6th Discourse Anaphora and Anaphora
  Resolution Colloquium (DAARC), 2007",,,,"cs.CL","http://arxiv.org/licenses/nonexclusive-distrib/1.0/","  A pronoun resolution system which requires limited syntactic knowledge to
identify the antecedents of personal and reflexive pronouns in Turkish is
presented. As in its counterparts for languages like English, Spanish and
French, the core of the system is the constraints and preferences determined
empirically. In the evaluation phase, it performed considerably better than the
baseline algorithm used for comparison. The system is significant for its being
the first fully specified knowledge-poor computational framework for pronoun
resolution in Turkish where Turkish possesses different structural properties
from the languages for which knowledge-poor systems had been developed.
","[{""version"":""v1"",""created"":""Sat, 18 Apr 2015 18:34:19 GMT""}]","2015-04-21"
"1504.04752","Paul Erhart","Paul Erhart, Babak Sadigh, Andr\'e Schleife, and Daniel {\AA}berg","A first-principles study of co-doping in lanthanum bromide","13 pages, 10 figures, accepted for publication in the Physical Review
  B","Physical Review B 91, 165206 (2015)","10.1103/PhysRevB.91.165206",,"cond-mat.mtrl-sci","http://arxiv.org/licenses/nonexclusive-distrib/1.0/","  Co-doping of Ce-doped LaBr$_3$ with Ba, Ca, or Sr improves the energy
resolution that can be achieved by radiation detectors based on these
materials. Here, we present a mechanism that rationalizes of this enhancement
that on the basis of first principles electronic structure calculations and
point defect thermodynamics. It is shown that incorporation of Sr creates
neutral $V_\text{Br}$-Sr$_\text{La}$ complexes that can temporarily trap
electrons. As a result, Auger quenching of free carriers is reduced, allowing
for a more linear, albeit slower, scintillation light yield response.
Experimental Stokes shifts can be related to different
Ce$_\text{La}$-Sr$_\text{La}$-$V_\text{Br}$ triple complex configurations.
Co-doping with other alkaline as well as alkaline earth metals is considered as
well. Alkaline elements are found to have extremely small solubilities on the
order of 0.1 ppm and below at 1000 K. Among the alkaline earth metals the
lighter dopant atoms prefer interstitial-like positions and create strong
scattering centers, which has a detrimental impact on carrier mobilities. Only
the heavier alkaline earth elements combine matching ionic radii with
sufficiently high solubilities. This provides a rationale for the experimental
finding that improved scintillator performance is exclusively achieved using
Sr, Ca, or Ba. The present mechanism demonstrates that co-doping of wide gap
materials can provide an efficient means for managing charge carrier
populations under out-of-equilibrium conditions. In the present case dopants
are introduced that manipulate not only the concentrations but the electronic
properties of intrinsic defects without introducing additional gap levels. This
leads to the availability of shallow electron traps that can temporarily
localize charge carriers, effectively deactivating carrier-carrier
recombination channels. The principles of this ... [continued]
","[{""version"":""v1"",""created"":""Sat, 18 Apr 2015 18:50:26 GMT""}]","2020-08-03"
"1504.04753","I. S. Burmistrov","A.U. Sharafutdinov and I.S. Burmistrov","Tunneling density of states in quantum dots with anisotropic exchange","11 LaTex pages, 3 figures","Phys. Rev. B 92, 035439 (2015)","10.1103/PhysRevB.92.035439",,"cond-mat.mes-hall","http://arxiv.org/licenses/nonexclusive-distrib/1.0/","  We reexamine the tunneling density of states in quantum dots and
nanoparticles within the model which is extension of the universal Hamiltonian
to the case of uniaxial anisotropic exchange. We derive the exact analytical
result for the tunneling density of states in the case of arbitrary
single-particle energy spectrum. We find that, similar to the case of the
isotropic exchange, the tunneling density of states as a function of energy has
the maximum due to a finite value of the total spin of the ground state near
the Stoner instability. We demonstrate that there are no additional extrema
which have been predicted on the basis of perturbative analysis [M.N. Kiselev
and Y. Gefen, Phys. Rev. Lett. {\bf 96}, 066805 (2006)].
","[{""version"":""v1"",""created"":""Sat, 18 Apr 2015 18:53:40 GMT""}]","2015-07-30"
"1504.04754","Ralph Chamberlin","Ralph V. Chamberlin","The Big World of Nanothermodynamics","22 pages, 14 figures, review","Entropy, Vol. 17, Issue 1, pgs. 52-73 (2015)","10.3390/e17010052",,"cond-mat.stat-mech cond-mat.mes-hall cond-mat.mtrl-sci","http://arxiv.org/licenses/nonexclusive-distrib/1.0/","  Nanothermodynamics extends standard thermodynamics to facilitate finite-size
effects on the scale of nanometers. A key ingredient is Hill's subdivision
potential that accommodates the non-extensive energy of independent small
systems, similar to how Gibbs' chemical potential accommodates distinct
particles. Nanothermodynamics is essential for characterizing the thermal
equilibrium distribution of independently relaxing regions inside bulk samples,
as is found for the primary response of most materials using various
experimental techniques. The subdivision potential ensures strict adherence to
the laws of thermodynamics: total energy is conserved by including an
instantaneous contribution from the entropy of local configurations, and total
entropy remains maximized by coupling to a thermal bath. A unique feature of
nanothermodynamics is the completely-open nanocanonical ensemble. Another
feature is that particles within each region become statistically
indistinguishable, which avoids non-extensive entropy, and mimics
quantum-mechanical behavior. Applied to mean-field theory, nanothermodynamics
gives a heterogeneous distribution of regions that yields stretched-exponential
relaxation and super-Arrhenius activation. Applied to Monte Carlo simulations,
there is a nonlinear correction to Boltzmann's factor that improves agreement
between the Ising model and measured non-classical critical scaling in magnetic
materials. Nanothermodynamics also provides a fundamental mechanism for the 1/f
noise found in many materials.
","[{""version"":""v1"",""created"":""Sat, 18 Apr 2015 19:58:48 GMT""}]","2015-04-21"
