"1504.04775","Ashok Ramu","Ashok T. Ramu and John E. Bowers","A compact heat transfer model based on an enhanced Fourier law for
  analysis of frequency-domain thermoreflectance experiments",,,,,"cond-mat.mes-hall","http://arxiv.org/licenses/nonexclusive-distrib/1.0/","  A recently developed enhanced Fourier law is applied to the problem of
extracting thermal properties of materials from frequency-domain
thermoreflectance (FDTR) experiments. The heat transfer model comprises
contributions from two phonon channels; one a high-heat-capacity diffuse
channel consisting of phonons of mean free path (MFP) less than a threshold
value, and the other a low-heat-capacity channel consisting of phonons with MFP
higher than this value that travel quasi-ballistically over length scales of
interest. The diffuse channel is treated using the Fourier law, while the
quasi-ballistic channel is analyzed using a second-order spherical harmonic
expansion of the phonon distribution function. A recent analysis of FDTR
experimental data suggested the use of FDTR in deriving large portions of the
MFP accumulation function; however, it is shown here that the data can
adequately be explained using our minimum-parameter model, thus highlighting an
important limitation of FDTR experiments in exploring the accumulation function
of bulk matter.
","[{""version"":""v1"",""created"":""Sat, 18 Apr 2015 23:08:42 GMT""},{""version"":""v2"",""created"":""Thu, 20 Aug 2015 22:03:43 GMT""}]","2015-08-24"
"1504.04776","Dongsheng Wu","Zhenlong Chen, Dongsheng Wu and Yimin Xiao","Smoothness of Local Times and Self-Intersection Local Times of Gaussian
  Random Fields",,,,,"math.PR","http://arxiv.org/licenses/nonexclusive-distrib/1.0/","  This paper is concerned with the smoothness (in the sense of Meyer-Watanabe)
of the local times of Gaussian random fields. Sufficient and necessary
conditions for the existence and smoothness of the local times, collision local
times, and self-intersection local times are established for a large class of
Gaussian random fields, including fractional Brownian motions, fractional
Brownian sheets and solutions of stochastic heat equations driven by space-time
Gaussian noise.
","[{""version"":""v1"",""created"":""Sat, 18 Apr 2015 23:20:30 GMT""}]","2015-04-21"
"1504.04777","Atsushi Nishizawa","Atsushi Nishizawa","Weak value amplification and beyond the standard quantum limit in
  position measurements","12 pages, 5 figures","Phys. Rev. A 92, 032123 (2015)","10.1103/PhysRevA.92.032123",,"quant-ph","http://arxiv.org/licenses/nonexclusive-distrib/1.0/","  In a weak measurement with post-selection, a measurement value, called the
weak value, can be amplified beyond the eigenvalues of the observable. However,
there are some controversies whether the weak value amplification is
practically useful or not in increasing sensitivity of the measurement in which
fundamental quantum noise dominates. In this paper, we investigate the
sensitivity limit of an optical interferometer by properly taking account
quantum shot noise and radiation pressure noise. To do so, we formulate the
weak value amplification in the Heisenberg picture, which enables us to
intuitively understand what happens when the measurement outcome is
post-selected and the weak value is amplified. As a result, we found that the
sensitivity limit is given by the standard quantum limit that is the same as in
a standard interferometry. We also discuss a way to circumvent the standard
quantum limit.
","[{""version"":""v1"",""created"":""Sat, 18 Apr 2015 23:33:52 GMT""},{""version"":""v2"",""created"":""Wed, 29 Apr 2015 09:15:55 GMT""}]","2015-09-30"
"1504.04778","David Simmons","Tushar Das, Lior Fishman, David Simmons, and Mariusz Urba\'nski","Extremality and dynamically defined measures, part I: Diophantine
  properties of quasi-decaying measures","Link to part II: arXiv:1508.05592","Selecta Mathematica New Ser. 24 (2018), no. 3, 2165-2206","10.1007/s00029-017-0324-8",,"math.DS math.NT","http://arxiv.org/licenses/nonexclusive-distrib/1.0/","  We present a new method of proving the Diophantine extremality of various
dynamically defined measures, vastly expanding the class of measures known to
be extremal. This generalizes and improves the celebrated theorem of Kleinbock
and Margulis ('98) resolving Sprind\v{z}uk's conjecture, as well as its
extension by Kleinbock, Lindenstrauss, and Weiss ('04), hereafter abbreviated
KLW. As applications we prove the extremality of all hyperbolic measures of
smooth dynamical systems with sufficiently large Hausdorff dimension, and of
the Patterson--Sullivan measures of all nonplanar geometrically finite groups.
The key technical idea, which has led to a plethora of new applications, is a
significant weakening of KLW's sufficient conditions for extremality.
  In Part I, we introduce and develop a systematic account of two classes of
measures, which we call $quasi$-$decaying$ and $weakly$ $quasi$-$decaying$. We
prove that weak quasi-decay implies strong extremality in the matrix
approximation framework (which has received much attention in recent years),
thus proving a conjecture of KLW. We also prove the ""inherited exponent of
irrationality"" version of this theorem, describing the relationship between the
Diophantine properties of certain subspaces of the space of matrices and
measures supported on these subspaces.
  In subsequent papers, we exhibit numerous examples of quasi-decaying
measures, in support of the thesis that ""almost any measure from dynamics
and/or fractal geometry is quasi-decaying"". In addition to the examples
described above, we also prove (for example) that Gibbs measures (including
conformal measures) of infinite iterated function systems are quasi-decaying,
even if the systems in question do not satisfy the open set condition. We also
discuss examples of non-extremal measures coming from dynamics, illustrating
where the theory must halt.
","[{""version"":""v1"",""created"":""Sun, 19 Apr 2015 01:01:03 GMT""},{""version"":""v2"",""created"":""Sun, 23 Aug 2015 10:57:59 GMT""},{""version"":""v3"",""created"":""Fri, 18 Sep 2015 11:19:23 GMT""},{""version"":""v4"",""created"":""Fri, 4 Mar 2016 18:47:32 GMT""},{""version"":""v5"",""created"":""Wed, 15 Feb 2017 16:26:08 GMT""}]","2019-06-18"
"1504.04779","Lin He","Long-Jing Yin, Jia-Bin Qiao, Wei-Jie Zuo, Wei Yan, Rui Xu, Rui-Fen
  Dou, Jia-Cai Nie, and Lin He","Landau Quantization and Fermi Velocity Renormalization in Twisted
  Graphene Bilayers","4 Figures in main text","Phys. Rev. B 92, 201408 (2015)","10.1103/PhysRevB.92.201408",,"cond-mat.mtrl-sci cond-mat.mes-hall","http://arxiv.org/licenses/nonexclusive-distrib/1.0/","  Currently there is a lively discussion concerning Fermi velocity
renormalization in twisted bilayers and several contradicted experimental
results are reported. Here we study electronic structures of the twisted
bilayers by scanning tunneling microscopy (STM) and spectroscopy (STS). The
interlayer coupling strengths between the adjacent bilayers are measured
according to energy separations of two pronounced low-energy van Hove
singularities (VHSs) in the STS spectra. We demonstrate that there is a large
range of values for the interlayer interaction in different twisted bilayers.
Below the VHSs, the observed Landau quantization in the twisted bilayers is
identical to that of massless Dirac fermions in graphene monolayer, which
allows us to measure the Fermi velocity directly. Our result indicates that the
Fermi velocity of the twisted bilayers depends remarkably on both the twisted
angles and the interlayer coupling strengths. This removes the discrepancy
about the Fermi velocity renormalization in the twisted bilayers and provides a
consistent interpretation of all current data.
","[{""version"":""v1"",""created"":""Sun, 19 Apr 2015 01:02:22 GMT""}]","2015-11-18"
"1504.04780","Yi-Nan Wang","Yi-Nan Wang","Generalized Cartan Calculus in general dimension","30 pages",,,,"hep-th math-ph math.MP","http://arxiv.org/licenses/nonexclusive-distrib/1.0/","  We develop the generalized Cartan Calculus for the groups
$G=$SL$(2,\mathbb{R})\times\mathbb{R}^+$, SL$(5,\mathbb{R})$ and SO(5,5). They
are the underlying algebraic structures of $d=9,7,6$ exceptional field theory,
respectively. These algebraic identities are needed for the ""tensor hierarchy""
structure in exceptional field theory. The validity of Poincar\'e lemmas in
this new differential geometry is also discussed. Finally we explore some
possible extension of the generalized Cartan calculus beyond the exceptional
series.
","[{""version"":""v1"",""created"":""Sun, 19 Apr 2015 01:21:13 GMT""},{""version"":""v2"",""created"":""Wed, 29 Apr 2015 02:47:50 GMT""},{""version"":""v3"",""created"":""Thu, 18 Jun 2015 06:30:39 GMT""}]","2015-06-19"
"1504.04781","Diederik Aerts","Diederik Aerts and Massimiliano Sassoli de Bianchi","The Extended Bloch Representation of Quantum Mechanics. Explaining
  Superposition, Interference and Entanglement","40 pages, 9 figures","J. Math. Phys. 57, 122110 (2016)","10.1063/1.4973356",,"quant-ph","http://arxiv.org/licenses/nonexclusive-distrib/1.0/","  The extended Bloch representation of quantum mechanics was recently derived
to offer a (hidden-measurement) solution to the measurement problem. In this
article we use it to investigate the geometry of superposition and entangled
states, explaining the interference effects, and the entanglement correlations,
in terms of the different orientations that a state-vector can take within the
generalized Bloch sphere. We also introduce a tensorial determination of the
generators of SU(N), particularly suitable to describe multipartite systems,
from the viewpoint of the sub-entities. We then use it to show that non-product
states admit a general description in which the sub-entities can always remain
in well-defined states, even when they are entangled. Therefore, the completed
version of quantum mechanics provided by the extended Bloch representation, in
which the density operators are also representative of pure states, allows to
solve not only the well-known measurement problem, but also the lesser-known
entanglement problem. This because we no longer need to give up the general
physical principle saying that a composite entity exists, and therefore is in a
pure state, if and only if its components also exist, and therefore are in
well-defined pure states.
","[{""version"":""v1"",""created"":""Sun, 19 Apr 2015 01:29:52 GMT""}]","2017-01-02"
"1504.04782","Stefano Profumo","Eric Carlson and Stefano Profumo","When Dark Matter interacts with Cosmic Rays or Interstellar Matter: A
  Morphological Study","10 pages, 4 figures, submitted; Supplementary code and emission
  skymaps available at http://planck.ucsc.edu/dmcr-morphology","Phys. Rev. D 92, 063003 (2015)","10.1103/PhysRevD.92.063003",,"astro-ph.HE astro-ph.CO astro-ph.GA hep-ph","http://arxiv.org/licenses/nonexclusive-distrib/1.0/","  Excess emission over expected diffuse astrophysical backgrounds in the
direction of the Galactic center region has been claimed at various
wavelengths, from radio to gamma rays. Among particle models advocated to
explain such observations, several invoke interactions between dark matter
particles and ordinary matter, such as cosmic rays, interstellar gas or free
electrons. Depending on the specific interstellar matter particles' species and
energy, such models predict distinct morphological features. In this study we
make detailed predictions for the morphology of models where the relevant
electromagnetic emission is proportional to the product of the dark matter
density profile and the density of interstellar matter or cosmic rays. We
compare the predicted latitudinal and longitudinal distributions with
observations, and provide the associated set of relevant spatial templates.
","[{""version"":""v1"",""created"":""Sun, 19 Apr 2015 02:04:25 GMT""}]","2015-09-09"
"1504.04783","A. Dodonov V.","D. S. Veloso and A. V. Dodonov","Prospects for observing dynamical and anti- dynamical Casimir effects in
  circuit QED due to fast modulation of qubit parameters","9 pages",,,,"quant-ph","http://arxiv.org/licenses/nonexclusive-distrib/1.0/","  We consider the nonstationary circuit QED architecture, where a single
artificial two-level atom interacts with a cavity field mode under external
modulation of one or more system parameters. Two different approaches are
employed to study the effects of Markovian dissipation on modulation-induced
transitions between the atom-field dressed states: the standard master equation
of Quantum Optics and the recently formulated dressed-picture master equation.
We estimate the associated transition rates and show that photon generation
from vacuum (""dynamical Casimir effect"", DCE) and coherent photon annihilation
from nonvacuum states (""Anti-DCE"") are possible with the current
state-of-the-art parameters.
","[{""version"":""v1"",""created"":""Sun, 19 Apr 2015 02:19:44 GMT""}]","2015-04-21"
"1504.04784","Gregory Eskin","Gregory Eskin","Aharonov-Bohm effect revisited","This article is an expended version of arXiv:1007.3979. Note the
  change of the title","Review in Mathematical Physics, Vol. 27, No.2 (2015) 1530001 (52
  pages)","10.1142/S0129055X15300010",,"math-ph math.AP math.MP","http://arxiv.org/licenses/nonexclusive-distrib/1.0/","  Aharonov-Bohm effect is a quantum mechanical phenomenon that attracted the
attention of many physicists and mathematicians since the publication of the
seminal paper of Aharonov and Bohm [1] in 1959.
  We consider different types of Aharonov-Bohm effect such as magnetic AB
effect, electric AB effect, combined electromagnetic AB effect, AB effect for
the Schr\""odinger equations with Yang-Mills potentials, and the gravitational
analog of AB effect.
  We shall describe different approaches to prove the AB effect based on the
inverse scattering problems, the inverse boundary value problems in the
presence of obstacles, spectral asymptotics, and the direct proofs of the AB
effect.
","[{""version"":""v1"",""created"":""Sun, 19 Apr 2015 03:15:53 GMT""}]","2015-06-24"
"1504.04785","Mahdi Boloursaz Mashhadi","Mahdi Boloursaz Mashhadi, Ehsan Asadi, Mohsen Eskandari, Shahrzad
  Kiani, and Farrokh Marvasti","Heart Rate Tracking using Wrist-Type Photoplethysmographic (PPG) Signals
  during Physical Exercise with Simultaneous Accelerometry","Accepted for publication in IEEE Signal Processing Letters",,"10.1109/LSP.2015.2509868",,"cs.IT math.IT","http://arxiv.org/licenses/nonexclusive-distrib/1.0/","  This paper considers the problem of casual heart rate tracking during
intensive physical exercise using simultaneous 2 channel photoplethysmographic
(PPG) and 3 dimensional (3D) acceleration signals recorded from wrist. This is
a challenging problem because the PPG signals recorded from wrist during
exercise are contaminated by strong Motion Artifacts (MAs). In this work, a
novel algorithm is proposed which consists of two main steps of MA Cancellation
and Spectral Analysis. The MA cancellation step cleanses the MA-contaminated
PPG signals utilizing the acceleration data and the spectral analysis step
estimates a higher resolution spectrum of the signal and selects the spectral
peaks corresponding to HR. Experimental results on datasets recorded from 12
subjects during fast running at the peak speed of 15 km/hour showed that the
proposed algorithm achieves an average absolute error of 1.25 beat per minute
(BPM). These experimental results also confirm that the proposed algorithm
keeps high estimation accuracies even in strong MA conditions.
","[{""version"":""v1"",""created"":""Sun, 19 Apr 2015 03:29:15 GMT""},{""version"":""v2"",""created"":""Mon, 12 Sep 2016 19:28:32 GMT""}]","2016-09-13"
"1504.04786","Zhenhua Yu","Yan-Hua Hou, Zhenhua Yu","Hydrodynamics of Normal Atomic Gases with Spin-orbit Coupling","Accepted version by Scientific Reports, 13 pages, 7 figures","Scientific Reports 5, Article number: 15307 (2015)","10.1038/srep15307",,"cond-mat.quant-gas","http://arxiv.org/licenses/nonexclusive-distrib/1.0/","  Successful realization of spin-orbit coupling in atomic gases by the NIST
scheme opens the prospect of studying the effects of spin-orbit coupling on
many-body physics in an unprecedentedly controllable way. Here we derive the
linearized hydrodynamic equations for the normal atomic gases of the spin-orbit
coupling by the NIST scheme with zero detuning. We show that the hydrodynamics
of the system crucially depends on the momentum susceptibilities which can be
modified by the spin-orbit coupling. We reveal the effects of the spin-orbit
coupling on the sound velocities and the dipole mode frequency of the gases by
applying our formalism to the ideal Fermi gas. We also discuss the
generalization of our results to other situations.
","[{""version"":""v1"",""created"":""Sun, 19 Apr 2015 03:42:31 GMT""},{""version"":""v2"",""created"":""Tue, 19 Jan 2016 07:51:42 GMT""}]","2016-01-20"
"1504.04787","Avatar Tulsi","Avatar Tulsi","Postprocessing can speed up general quantum search algorithms","Accepted for publication in Physical Review A. arXiv admin note:
  substantial text overlap with arXiv:1210.4647","Phys. Rev. A 92, 022353 (2015)","10.1103/PhysRevA.92.022353",,"quant-ph","http://arxiv.org/licenses/nonexclusive-distrib/1.0/","  A general quantum search algorithm aims to evolve a quantum system from a
known source state $|s\rangle$ to an unknown target state $|t\rangle$. It uses
a diffusion operator $D_{s}$ having source state as one of its eigenstates and
$I_{t}$, where $I_{\psi}$ denotes the selective phase inversion of
$|\psi\rangle$ state. It evolves $|s\rangle$ to a particular state $|w\rangle$,
call it w-state, in $O(B/\alpha)$ time steps where $\alpha$ is $|\langle
t|s\rangle|$ and $B$ is a characteristic of the diffusion operator. Measuring
the w-state gives the target state with the success probability of $O(1/B^{2})$
and $O(B^{2})$ applications of the algorithm can boost it from $O(1/B^{2})$ to
$O(1)$, making the total time complexity $O(B^{3}/\alpha)$. In the special case
of Grover's algorithm, $D_{s}$ is $I_{s}$ and $B$ is very close to $1$. A more
efficient way to boost the success probability is quantum amplitude
amplification provided we can efficiently implement $I_{w}$. Such an efficient
implementation is not known so far. In this paper, we present an efficient
algorithm to approximate selective phase inversions of the unknown eigenstates
of an operator using phase estimation algorithm. This algorithm is used to
efficiently approximate $I_{w}$ which reduces the time complexity of general
algorithm to $O(B/\alpha)$. Though $O(B/\alpha)$ algorithms are known to exist,
our algorithm offers physical implementation advantages.
","[{""version"":""v1"",""created"":""Sun, 19 Apr 2015 04:02:28 GMT""},{""version"":""v2"",""created"":""Mon, 10 Aug 2015 03:32:20 GMT""}]","2015-09-02"
"1504.04788","Wenlin Chen","Wenlin Chen and James T. Wilson and Stephen Tyree and Kilian Q.
  Weinberger and Yixin Chen","Compressing Neural Networks with the Hashing Trick",,,,,"cs.LG cs.NE","http://arxiv.org/licenses/nonexclusive-distrib/1.0/","  As deep nets are increasingly used in applications suited for mobile devices,
a fundamental dilemma becomes apparent: the trend in deep learning is to grow
models to absorb ever-increasing data set sizes; however mobile devices are
designed with very little memory and cannot store such large models. We present
a novel network architecture, HashedNets, that exploits inherent redundancy in
neural networks to achieve drastic reductions in model sizes. HashedNets uses a
low-cost hash function to randomly group connection weights into hash buckets,
and all connections within the same hash bucket share a single parameter value.
These parameters are tuned to adjust to the HashedNets weight sharing
architecture with standard backprop during training. Our hashing procedure
introduces no additional memory overhead, and we demonstrate on several
benchmark data sets that HashedNets shrink the storage requirements of neural
networks substantially while mostly preserving generalization performance.
","[{""version"":""v1"",""created"":""Sun, 19 Apr 2015 04:24:15 GMT""}]","2015-04-21"
"1504.04789","Richard Balka","Omer Angel, Rich\'ard Balka, Andr\'as M\'ath\'e, Yuval Peres","Restrictions of H\""older continuous functions","24 pages, 4 figures, final version",,,,"math.PR math.CA","http://arxiv.org/licenses/nonexclusive-distrib/1.0/","  For $0<\alpha<1$ let $V(\alpha)$ denote the supremum of the numbers $v$ such
that every $\alpha$-H\""older continuous function is of bounded variation on a
set of Hausdorff dimension $v$. Kahane and Katznelson (2009) proved the
estimate $1/2 \leq V(\alpha)\leq 1/(2-\alpha)$ and asked whether the upper
bound is sharp. We show that in fact $V(\alpha)=\max\{1/2,\alpha\}$. Let
$\dim_{H}$ and $\overline{\dim}_{M}$ denote the Hausdorff and upper Minkowski
dimension, respectively. The upper bound on $V(\alpha)$ is a consequence of the
following theorem. Let $\{B(t): t\in [0,1]\}$ be a fractional Brownian motion
of Hurst index $\alpha$. Then, almost surely, there exists no set $A\subset
[0,1]$ such that $\overline{\dim}_{M} A>\max\{1-\alpha,\alpha\}$ and $B\colon
A\to \mathbb{R}$ is of bounded variation. Furthermore, almost surely, there
exists no set $A\subset [0,1]$ such that $\overline{\dim}_{M} A>1-\alpha$ and
$B\colon A\to \mathbb{R}$ is $\beta$-H\""older continuous for some
$\beta>\alpha$. The zero set and the set of record times of $B$ witness that
the above theorems give the optimal dimensions. We also prove similar
restriction theorems for deterministic self-affine functions and generic
$\alpha$-H\""older continuous functions.
  Finally, let $\{\mathbf{B}(t): t\in [0,1]\}$ be a two-dimensional Brownian
motion. We prove that, almost surely, there is a compact set $D\subset [0,1]$
such that $\dim_{H} D\geq 1/3$ and $\mathbf{B}\colon D\to \mathbb{R}^2$ is
non-decreasing in each coordinate. It remains open whether $1/3$ is best
possible.
","[{""version"":""v1"",""created"":""Sun, 19 Apr 2015 04:26:09 GMT""},{""version"":""v2"",""created"":""Sat, 26 Nov 2016 06:17:52 GMT""}]","2016-11-29"
"1504.04790","Norio Okabayashi","Norio Okabayashi, Alexander Gustafsson, Angelo Peronio, Magnus
  Paulsson, Toyoko Arai, and Franz J. Giessibl","Influence of atomic tip structure on the intensity of inelastic
  tunneling spectroscopy data analyzed by combined scanning tunneling
  spectroscopy, force microscopy and density functional theory",,"Phys. Rev. B 93, 165415 (2016)","10.1103/PhysRevB.93.165415",,"cond-mat.mes-hall","http://arxiv.org/licenses/nonexclusive-distrib/1.0/","  Achieving a high intensity in inelastic scanning tunneling spectroscopy
(IETS) is important for precise measurements. The intensity of the IETS signal
can vary up to a factor three for various tips without an apparent reason
accessible by scanning tunneling microscopy (STM) alone. Here, we show that
combining STM and IETS with atomic force microscopy enables carbon monoxide
front atom identification, revealing that high IETS intensities for CO/Cu(111)
are obtained for single atom tips, while the intensity drops sharply for
multi-atom tips. Adsorbing the CO molecule on a Cu adatom [CO/Cu/Cu(111)] such
that it is elevated over the substrate strongly diminishes the tip dependence
of IETS intensity, showing that an elevated position channels most of the
tunneling current through the CO molecule even for multi-atom tips, while a
large fraction of the tunneling current bypasses the CO molecule in the case of
CO/Cu(111).
","[{""version"":""v1"",""created"":""Sun, 19 Apr 2015 04:33:15 GMT""},{""version"":""v2"",""created"":""Tue, 8 Mar 2016 08:21:36 GMT""}]","2016-04-15"
"1504.04791","Wensheng Tang","Wensheng Tang, Guangming Lang, Xuqiong Luo","Construction of symplectic (partitioned) Runge-Kutta methods with
  continuous stage","13 pages",,,,"math.NA","http://arxiv.org/licenses/nonexclusive-distrib/1.0/","  Hamiltonian systems are one of the most important class of dynamical systems
with a geometric structure called symplecticity and the numerical algorithms
which can preserve such geometric structure are of interest. In this article we
study the construction of symplectic (partitioned) Runge-Kutta methods with
continuous stage, which provides a new and simple way to construct symplectic
(partitioned) Runge-Kutta methods in classical sense. This line of construction
of symplectic methods relies heavily on the expansion of orthogonal polynomials
and the simplifying assumptions for (partitioned) Runge-Kutta type methods.
","[{""version"":""v1"",""created"":""Sun, 19 Apr 2015 04:42:33 GMT""},{""version"":""v2"",""created"":""Thu, 15 Oct 2015 10:13:15 GMT""}]","2015-10-16"
