"1504.04810","Albert Moll\'en","Albert Moll\'en (1), Matt Landreman (2), H\r{a}kan M. Smith (3),
  Stefanie Braun (3 and 4) and Per Helander (3) ((1) Department of Applied
  Physics, Chalmers University of Technology, G\""oteborg, Sweden, (2) Institute
  for Research in Electronics and Applied Physics, University of Maryland,
  College Park, USA, (3) Max-Planck-Institut f\""ur Plasmaphysik, Greifswald,
  Germany, (4) German Aerospace Center, Institute of Engineering
  Thermodynamics, Stuttgart, Germany)","Impurities in a non-axisymmetric plasma: transport and effect on
  bootstrap current","36 pages, 13 figures","Physics of Plasmas 22, 112508 (2015)","10.1063/1.4935901",,"physics.plasm-ph","http://arxiv.org/licenses/nonexclusive-distrib/1.0/","  Impurities cause radiation losses and plasma dilution, and in stellarator
plasmas the neoclassical ambipolar radial electric field is often unfavorable
for avoiding strong impurity peaking. In this work we use a new continuum
drift-kinetic solver, the SFINCS code (the Stellarator Fokker-Planck Iterative
Neoclassical Conservative Solver) [M. Landreman et al., Phys. Plasmas 21 (2014)
042503] which employs the full linearized Fokker-Planck-Landau operator, to
calculate neoclassical impurity transport coefficients for a Wendelstein 7-X
(W7-X) magnetic configuration. We compare SFINCS calculations with theoretical
asymptotes in the high collisionality limit. We observe and explain a
1/nu-scaling of the inter-species radial transport coefficient at low
collisionality, arising due to the field term in the inter-species collision
operator, and which is not found with simplified collision models even when
momentum correction is applied. However, this type of scaling disappears if a
radial electric field is present. We also use SFINCS to analyze how the
impurity content affects the neoclassical impurity dynamics and the bootstrap
current. We show that a change in plasma effective charge Zeff of order unity
can affect the bootstrap current enough to cause a deviation in the divertor
strike point locations.
","[{""version"":""v1"",""created"":""Sun, 19 Apr 2015 08:26:55 GMT""},{""version"":""v2"",""created"":""Fri, 20 Nov 2015 16:00:58 GMT""}]","2015-11-23"
"1504.04811","Sergey Tarasenko","Sergey Tarasenko","Socializing Autonomous Units with the Reflexive Game Theory and
  Resonate-and-Fire neurons","10 pages, 15 figures",,,,"cs.MA","http://arxiv.org/licenses/nonexclusive-distrib/1.0/","  In this study the concept of reflexia is applied to modeling behavior of
autonomous units. The relationship between reflexia, on the one hand, and
mirror neuron system and perception of emotions, on the other hand, is
introduced. The main method of using reflexia in a group of autonomous units is
Reflexive Game Theory (RGT). To embody RGT in a group of autonomous agents a
communication system is employed. This communication system uses frequency
domain multiplexing by means of Izhikevich's resonate-and-fire neural models.
The result of socialization of autonomous units by means of RGT and
communication system is illustrated in several examples.
","[{""version"":""v1"",""created"":""Sun, 19 Apr 2015 08:37:40 GMT""}]","2015-04-21"
"1504.04812","Akimasa Kataoka","Akimasa Kataoka, Takayuki Muto, Munetake Momose, Takashi Tsukagoshi,
  Misato Fukagawa, Hiroshi Shibai, Tomoyuki Hanawa, Koji Murakawa, Cornelis P.
  Dullemond","Millimeter-wave polarization of protoplanetary disks due to dust
  scattering","18 pages, 20 figures, including the benchmark test of RADMC-3D,
  accepted for publication in ApJ",,"10.1088/0004-637X/809/1/78",,"astro-ph.EP astro-ph.GA astro-ph.SR","http://arxiv.org/licenses/nonexclusive-distrib/1.0/","  We present a new method to constrain the grain size in protoplanetary disks
with polarization observations at millimeter wavelengths. If dust grains are
grown to the size comparable to the wavelengths, the dust grains are expected
to have a large scattering opacity and thus the continuum emission is expected
to be polarized due to self-scattering. We perform 3D radiative transfer
calculations to estimate the polarization degree for the protoplanetary disks
having radial Gaussian-like dust surface density distributions, which have been
recently discovered. The maximum grain size is set to be $100 {\rm~\mu m}$ and
the observing wavelength to be 870 ${\rm \mu m}$. We find that the polarization
degree is as high as 2.5 % with a subarcsec spatial resolution, which is likely
to be detected with near-future ALMA observations. The emission is polarized
due to scattering of anisotropic continuum emission. The map of the
polarization degree shows a double peaked distribution and the polarization
vectors are in the radial direction in the inner ring and in the azimuthal
direction in the outer ring. We also find the wavelength dependence of the
polarization degree: the polarization degree is the highest if dust grains have
a maximum size of $a_{\rm max}\sim\lambda/2\pi$, where $\lambda$ is the
observing wavelength. Hence, multi-wave and spatially resolved polarization
observations toward protoplanetary disks enable us to put a constraint on the
grain size. The constraint on the grain size from polarization observations is
independent of or may be even stronger than that from the opacity index.
","[{""version"":""v1"",""created"":""Sun, 19 Apr 2015 08:41:20 GMT""},{""version"":""v2"",""created"":""Thu, 9 Jul 2015 09:48:12 GMT""}]","2015-08-19"
"1504.04813","Ilan Komargodski","Badih Ghazi, Ilan Komargodski, Pravesh Kothari and Madhu Sudan","Communication with Contextual Uncertainty","20 pages + 1 title page",,,,"cs.CC cs.IT math.IT","http://arxiv.org/licenses/nonexclusive-distrib/1.0/","  We introduce a simple model illustrating the role of context in communication
and the challenge posed by uncertainty of knowledge of context. We consider a
variant of distributional communication complexity where Alice gets some
information $x$ and Bob gets $y$, where $(x,y)$ is drawn from a known
distribution, and Bob wishes to compute some function $g(x,y)$ (with high
probability over $(x,y)$). In our variant, Alice does not know $g$, but only
knows some function $f$ which is an approximation of $g$. Thus, the function
being computed forms the context for the communication, and knowing it
imperfectly models (mild) uncertainty in this context.
  A naive solution would be for Alice and Bob to first agree on some common
function $h$ that is close to both $f$ and $g$ and then use a protocol for $h$
to compute $h(x,y)$. We show that any such agreement leads to a large overhead
in communication ruling out such a universal solution.
  In contrast, we show that if $g$ has a one-way communication protocol with
complexity $k$ in the standard setting, then it has a communication protocol
with complexity $O(k \cdot (1+I))$ in the uncertain setting, where $I$ denotes
the mutual information between $x$ and $y$. In the particular case where the
input distribution is a product distribution, the protocol in the uncertain
setting only incurs a constant factor blow-up in communication and error.
  Furthermore, we show that the dependence on the mutual information $I$ is
required. Namely, we construct a class of functions along with a non-product
distribution over $(x,y)$ for which the communication complexity is a single
bit in the standard setting but at least $\Omega(\sqrt{n})$ bits in the
uncertain setting.
","[{""version"":""v1"",""created"":""Sun, 19 Apr 2015 08:46:16 GMT""},{""version"":""v2"",""created"":""Sun, 19 Jul 2015 05:52:05 GMT""}]","2015-07-21"
"1504.04814","Botond Szabo","Judith Rousseau and Botond Szabo","Asymptotic behaviour of the empirical Bayes posteriors associated to
  maximum marginal likelihood estimator","36 pages +24 pages supplementary material",,,,"math.ST stat.TH","http://arxiv.org/licenses/nonexclusive-distrib/1.0/","  We consider the asymptotic behaviour of the marginal maximum likelihood
empirical Bayes posterior distribution in general setting. First we
characterize the set where the maximum marginal likelihood estimator is located
with high probability. Then we provide oracle type of upper and lower bounds
for the contraction rates of the empirical Bayes posterior. We also show that
the hierarchical Bayes posterior achieves the same contraction rate as the
maximum marginal likelihood empirical Bayes posterior. We demonstrate the
applicability of our general results for various models and prior distributions
by deriving upper and lower bounds for the contraction rates of the
corresponding empirical and hierarchical Bayes posterior distributions.
","[{""version"":""v1"",""created"":""Sun, 19 Apr 2015 08:50:17 GMT""},{""version"":""v2"",""created"":""Fri, 30 Oct 2015 23:08:37 GMT""},{""version"":""v3"",""created"":""Mon, 4 Apr 2016 13:34:43 GMT""}]","2016-04-05"
"1504.04815","Zaohreh Dabiri","Zohreh Dabiri, Ali Kazempour and Mohammad Ali Sadeghzadeh","Correlation of electron-phonon in cubic zirconia: $G_0W_0 @DFPT$ scheme","6 pages, 6 figures",,,,"cond-mat.mtrl-sci","http://creativecommons.org/licenses/by-nc-sa/3.0/","  The indirect carrier-phonon vertex function is evaluated for cubic zirconia
by employing the many-body perturbation theory on top of the frozen phonon
model. The phonon-induced carrier velocity and spectral renormalization are
represented at each individual lattice vibronic mode. Our results show that for
the indirect electron-phonon scattering, optical phonons make up the dominant
contribution. It is observed that, despite the phonon-phonon interaction, there
is a substantial polaronic character for all the activated lattice optical
vibrations which is in accordance with the previous experimental and
theoretical finding concerning the crucial role of optical phonons. Eventually
our results are capable to discuss that, in the presence of optical phonons a
transition between small to large polaron is probable
","[{""version"":""v1"",""created"":""Sun, 19 Apr 2015 09:04:29 GMT""}]","2015-04-21"
"1504.04816","Qihui Li","Qihui Li","A Note On Inner Quasidiagonal C*-Algebras","arXiv admin note: text overlap with arXiv:0711.4949 by other authors",,,,"math.OA","http://creativecommons.org/licenses/by-nc-sa/3.0/","  In the paper, we give two new characterizations of separable inner
quasidiagonal C*-algebras. Base on these characterizations, we show that a
unital full free product of two inner quasidiagonal C*-algebras is inner
quasidiagonal again. As an application, we show that a unital full free product
of two inner quasidiagoanl C*-algebras with amalgmation over a full matrix
algebra is inner quasidiagonal. Meanwhile, we conclude that a unital full free
product of two AF algebras with amalgamation over a finite-dimensional
C*-algebra is inner quasidiagonal if there are faithful tracial states on each
of these two AF algebras such that the restrictions on the common subalgebra
agree.
","[{""version"":""v1"",""created"":""Sun, 19 Apr 2015 09:56:34 GMT""}]","2015-04-21"
"1504.04817","Nan Yang","Nan Yang, Jing Zhang, Hui Wang, Yu-xi Liu, Re-Bing Wu, Lian-qing Liu,
  Chun-Wen Li, and Franco Nori","Noise suppression of on-chip mechanical resonators by chaotic coherent
  feedback",,"Phys. Rev. A 92, 033812 (2015)","10.1103/PhysRevA.92.033812",,"quant-ph","http://arxiv.org/licenses/nonexclusive-distrib/1.0/","  We propose a method to decouple the nanomechanical resonator in
optomechanical systems from the environmental noise by introducing a chaotic
coherent feedback loop. We find that the chaotic controller in the feedback
loop can modulate the dynamics of the controlled optomechanical system and
induce a broadband response of the mechanical mode. This broadband response of
the mechanical mode will cut off the coupling between the mechanical mode and
the environment and thus suppress the environmental noise of the mechanical
modes. As an application, we use the protected optomechanical system to act as
a quantum memory. It's shown that the noise-decoupled optomechanical quantum
memory is efficient for storing information transferred from coherent or
squeezed light.
","[{""version"":""v1"",""created"":""Sun, 19 Apr 2015 10:12:37 GMT""}]","2015-09-16"
"1504.04818","Mingsheng Long","Mingsheng Long, Yue Cao, Jianmin Wang, Philip S. Yu","Composite Correlation Quantization for Efficient Multimodal Retrieval",,,"10.1145/2911451.2911493",,"cs.IR","http://arxiv.org/licenses/nonexclusive-distrib/1.0/","  Efficient similarity retrieval from large-scale multimodal database is
pervasive in modern search engines and social networks. To support queries
across content modalities, the system should enable cross-modal correlation and
computation-efficient indexing. While hashing methods have shown great
potential in achieving this goal, current attempts generally fail to learn
isomorphic hash codes in a seamless scheme, that is, they embed multiple
modalities in a continuous isomorphic space and separately threshold embeddings
into binary codes, which incurs substantial loss of retrieval accuracy. In this
paper, we approach seamless multimodal hashing by proposing a novel Composite
Correlation Quantization (CCQ) model. Specifically, CCQ jointly finds
correlation-maximal mappings that transform different modalities into
isomorphic latent space, and learns composite quantizers that convert the
isomorphic latent features into compact binary codes. An optimization framework
is devised to preserve both intra-modal similarity and inter-modal correlation
through minimizing both reconstruction and quantization errors, which can be
trained from both paired and partially paired data in linear time. A
comprehensive set of experiments clearly show the superior effectiveness and
efficiency of CCQ against the state of the art hashing methods for both
unimodal and cross-modal retrieval.
","[{""version"":""v1"",""created"":""Sun, 19 Apr 2015 10:16:50 GMT""},{""version"":""v2"",""created"":""Sun, 22 May 2016 08:46:41 GMT""}]","2016-05-24"
"1504.04819","Jozef Barunik","Jozef Barunik and Barbora Malinska","Forecasting the term structure of crude oil futures prices with neural
  networks",,,,,"q-fin.GN","http://arxiv.org/licenses/nonexclusive-distrib/1.0/","  The paper contributes to the rare literature modeling term structure of crude
oil markets. We explain term structure of crude oil prices using dynamic
Nelson-Siegel model, and propose to forecast them with the generalized
regression framework based on neural networks. The newly proposed framework is
empirically tested on 24 years of crude oil futures prices covering several
important recessions and crisis periods. We find 1-month, 3-month, 6-month and
12-month-ahead forecasts obtained from focused time-delay neural network to be
significantly more accurate than forecasts from other benchmark models. The
proposed forecasting strategy produces the lowest errors across all times to
maturity.
","[{""version"":""v1"",""created"":""Sun, 19 Apr 2015 10:44:19 GMT""}]","2015-04-21"
"1504.04820","Juan Alberto Rodr\'iguez-Vel\'azquez","A. Estrada-Moreno, C. Garc\'ia-G\'omez, Y. Ram\'irez-Cruz, J. A.
  Rodr\'iguez-Vel\'azquez","The Simultaneous Strong Metric Dimension of Graph Families","arXiv admin note: text overlap with arXiv:1312.1987 by other authors","Bulletin of the Malaysian Mathematical Sciences Society 39(S1)
  (2016) 175-192","10.1007/s40840-015-0268-0",,"math.CO","http://arxiv.org/licenses/nonexclusive-distrib/1.0/","  Let ${\cal G}$ be a family of graphs defined on a common (labeled) vertex set
$V$. A set $S\subset V$ is said to be a simultaneous strong metric generator
for ${\cal G}$ if it is a strong metric generator for every graph of the
family. The minimum cardinality among all simultaneous strong metric generators
for ${\cal G}$, denoted by $Sd_s({\cal G})$, is called the simultaneous strong
metric dimension of ${\cal G}$. We obtain general results on $Sd_s({\cal G})$
for arbitrary families of graphs, with special emphasis on the case of families
composed by a graph and its complement. In particular, it is shown that the
problem of finding the simultaneous strong metric dimension of families of
graphs is $NP$-hard, even when restricted to families of trees.
","[{""version"":""v1"",""created"":""Sun, 19 Apr 2015 11:01:37 GMT""}]","2017-04-25"
"1504.04821","Zdenek Dvorak","Zdenek Dvorak and Sergey Norin","Strongly sublinear separators and polynomial expansion","9 pages, no figures",,,,"math.CO","http://arxiv.org/licenses/nonexclusive-distrib/1.0/","  A result of Plotkin, Rao, and Smith implies that graphs with polynomial
expansion have strongly sublinear separators. We prove a converse of this
result showing that hereditary classes of graphs with strongly sublinear
separators have polynomial expansion. This confirms a conjecture of the first
author.
","[{""version"":""v1"",""created"":""Sun, 19 Apr 2015 11:05:08 GMT""}]","2015-04-21"
"1504.04822","Ioannis Chremmos Dr.","Ioannis Chremmos and George Fikioris","Superoscillations with arbitrary polynomial shape","10 pages, 1 figure",,,,"math-ph math.MP","http://arxiv.org/licenses/nonexclusive-distrib/1.0/","  We present a method for constructing superoscillatory functions the
superoscillatory part of which approximates a given polynomial with arbitrarily
small error in a fixed interval. These functions are obtained as the product of
the polynomial with a sufficiently flat, bandlimited envelope function whose
Fourier transform has at least N-1 continuous derivatives and an N-th
derivative of bounded variation, N being the order of the polynomial.
Polynomials of arbitrarily high order can be approximated if the Fourier
transform of the envelope is smooth, i.e. a bump function.
","[{""version"":""v1"",""created"":""Sun, 19 Apr 2015 11:08:08 GMT""}]","2015-04-21"
"1504.04823","David Kalaj","David Kalaj","Schwarz lemma for holomorphic mappings in the unit ball",,,,,"math.CV","http://arxiv.org/licenses/nonexclusive-distrib/1.0/","  In this note we establish a Schwarz type inequality for holomorphic mappings
between unit balls $B_n$ and $B_m$ in corresponding complex spaces.
","[{""version"":""v1"",""created"":""Sun, 19 Apr 2015 11:22:11 GMT""},{""version"":""v2"",""created"":""Mon, 27 Apr 2015 15:35:46 GMT""}]","2015-04-28"
"1504.04824","Emma Whelan Dr","E.T. Whelan, N. Huelamo, J.M. Alcala, J. Lillo-Box, H. Bouy, D.
  Barrado, J. Bouvier, B. Merin","Spectro-astrometry of LkCa 15 with X-Shooter: Searching for emission
  from LkCa 15b","Accepted by Astronomy & Astrophysics",,,,"astro-ph.SR","http://arxiv.org/licenses/nonexclusive-distrib/1.0/","  Planet formation is one explanation for the partial clearing of dust observed
in the disks of some T Tauri stars. Indeed studies using state-of-the-art high
angular resolution techniques have very recently begun to observe planetary
companions in these so-called transitional disks. The goal of this work is to
use spectra of the transitional disk object LkCa 15 obtained with X-Shooter on
the Very Large Telescope to investigate the possibility of using
spectro-astrometry to detect planetary companions to T Tauri stars. It is
argued that an accreting planet should contribute to the total emission of
accretion tracers such as H$\alpha$ and therefore planetary companions could be
detected with spectro-astrometry in the same way as it has been used to detect
stellar companions to young stars. A probable planetary-mass companion was
recently detected in the disk of LkCa 15. Therefore, it is an ideal target for
this pilot study. We studied several key accretion lines in the wavelength
range 300 nm to 2.2 $\mu$m with spectro-astrometry. While no
spectro-astrometric signal is measured for any emission lines the accuracy
achieved in the technique is used to place an upper limit on the contribution
of the planet to the flux of the H$\alpha$, Pa$\gamma$, and Pa$\beta$ lines.
The derived upper limits on the flux allows an upper limit of the mass
accretion rate, log($\dot{M}_{acc}$) = -8.9 to -9.3 for the mass of the
companion between 6 M$_{Jup}$ and 15 M$_{Jup}$, respectively, to be estimated
(with some assumptions).
","[{""version"":""v1"",""created"":""Sun, 19 Apr 2015 12:18:19 GMT""}]","2015-04-21"
"1504.04825","Paul Skoufranis","Paul Skoufranis","Closed Convex Hulls of Unitary Orbits in C$^*$-Algebras of Real Rank
  Zero",,"Journal of Functional Analysis 270 (2016), no. 4, 1319-1360","10.1016/j.jfa.2015.09.018",,"math.OA math.FA","http://arxiv.org/licenses/nonexclusive-distrib/1.0/","  In this paper, we study closed convex hulls of unitary orbits in various
C$^*$-algebras. For unital C$^*$-algebras with real rank zero and a faithful
tracial state determining equivalence of projections, a notion of majorization
describes the closed convex hulls of unitary orbits for self-adjoint operators.
Other notions of majorization are examined in these C$^*$-algebras. Combining
these ideas with the Dixmier property, we demonstrate unital, infinite
dimensional C$^*$-algebras of real rank zero and strict comparison of
projections with respect to a faithful tracial state must be simple and have a
unique tracial state. Also, closed convex hulls of unitary orbits of
self-adjoint operators are fully described in unital, simple, purely infinite
C$^*$-algebras.
","[{""version"":""v1"",""created"":""Sun, 19 Apr 2015 12:38:47 GMT""}]","2016-09-08"
"1504.04826","Dmitry Prokudin","Irina Mbogo, Dmitry Prokudin, Andrey Chugunov","Complex Integration of Digital Collections into Scientific Information
  Space","in Russian",,,,"cs.DL cs.CY cs.SI","http://creativecommons.org/licenses/by/3.0/","  The article considers the solution of problems of accumulation and
integration of scientific electronic collections into information space of
scientific researches. On the basis of the analysis of the existing standards
and solutions the choice of methodology and technologies of representation of
electronic materials of the scientific conference 'Internet and Modern Society'
locates. The concept of the project of integration of the created electronic
collection into the main world and domestic information systems and aggregators
of scientific information is considered.
","[{""version"":""v1"",""created"":""Sun, 19 Apr 2015 13:13:27 GMT""}]","2015-04-21"
"1504.04827","Aaron Chan","Takahide Adachi, Takuma Aihara, Aaron Chan","Classification of two-term tilting complexes over Brauer graph algebras","Revised version. To appear in Math. Z",,"10.1007/s00209-017-2006-9",,"math.RT","http://arxiv.org/licenses/nonexclusive-distrib/1.0/","  Using only the combinatorics of its defining ribbon graph, we classify the
two-term tilting complexes, as well as their indecomposable summands, of a
Brauer graph algebra. As an application, we determine precisely the class of
Brauer graph algebras which are tilting-discrete.
","[{""version"":""v1"",""created"":""Sun, 19 Apr 2015 13:17:49 GMT""},{""version"":""v2"",""created"":""Tue, 15 Mar 2016 13:20:06 GMT""},{""version"":""v3"",""created"":""Mon, 18 Apr 2016 09:47:40 GMT""},{""version"":""v4"",""created"":""Thu, 4 Jan 2018 03:47:59 GMT""}]","2018-01-08"
"1504.04828","Jean-Baptiste Fouvry","Jean-Baptiste Fouvry, Christophe Pichon and Simon Prunet","Secular resonant dressed orbital diffusion I : method and WKB limit for
  tepid discs","15 pages, 1 figure","Monthly Notices of the Royal Astronomical Society 2015 449 (2):
  1967-1981","10.1093/mnras/stv359",,"astro-ph.GA","http://arxiv.org/licenses/nonexclusive-distrib/1.0/","  The equation describing the secular diffusion of a self-gravitating
collisionless system induced by an exterior perturbation is derived while
assuming that the timescale corresponding to secular evolution is much larger
than that corresponding to the natural frequencies of the system. Its two
dimensional formulation for a tepid galactic disc is also derived using the
epicyclic approximation. Its WKB limit is found while assuming that only
tightly wound transient spirals are sustained by the disc. It yields a simple
quadrature for the diffusion coefficients which provides a straightforward
understanding of the loci of maximal diffusion within the disc.
","[{""version"":""v1"",""created"":""Sun, 19 Apr 2015 13:21:42 GMT""}]","2015-04-21"
"1504.04829","Robert Apsimon","Robert Apsimon, Jakob Esberg, Hywel Owen","Residual Dispersion in a Combiner Ring","Submitted to PRST-AB on 04/18/2015",,,,"physics.acc-ph","http://arxiv.org/licenses/nonexclusive-distrib/1.0/","  In this paper we present a proof to show that there exists no system of
linear or nonlinear optics which can simultaneously close multiple local orbit
bumps and dispersion through a single beam transport region. The second
combiner ring in the CLIC drive beam recombination system, CR2, is used as an
example of where such conditions are necessary. We determine the properties of
a lattice which is capable of closing the local orbit bumps and dispersion and
show that all resulting solutions are either unphysical or trivial.
","[{""version"":""v1"",""created"":""Sun, 19 Apr 2015 13:35:00 GMT""}]","2015-04-21"
