"1504.04755","Hugh Hudson","Hugh S. Hudson","Solar extreme events","24th European Cosmic Ray Symposium, Christian-Albrechts-Universitaet
  zu Kiel, September 2014",,"10.1088/1742-6596/632/1/012058",,"astro-ph.SR","http://arxiv.org/licenses/nonexclusive-distrib/1.0/","  Solar flares and CMEs have a broad range of magnitudes. This review discusses
the possibility of ""extreme events,"" defined as those with magnitudes greater
than have been seen in the existing historical record. For most quantitative
measures, this direct information does not extend more than a century and a
half into the recent past. The magnitude distributions (occurrence frequencies)
of solar events (flares/CMEs) typically decrease with the parameter measured or
inferred (peak flux, mass, energy etc. Flare radiation fluxes tend to follow a
power law slightly flatter than $S^{-2}$, where S represents a peak flux; solar
particle events (SPEs) follow a still flatter power law up to a limiting
magnitude, and then appear to roll over to a steeper distribution, which may
take an exponential form or follow a broken power law. This inference comes
from the terrestrial $^{14}$C record and from the depth dependence of various
radioisotope proxies in the lunar regolith and in meteorites. Recently major
new observational results have impacted our use of the relatively limited
historical record in new ways: the detection of actual events in the $^{14}$C
tree-ring records, and the systematic observations of flares and ""superflares""
by the Kepler spacecraft. I discuss how these new findings may affect our
understanding of the distribution function expected for extreme solar events.
","[{""version"":""v1"",""created"":""Sat, 18 Apr 2015 20:11:19 GMT""}]","2015-09-02"
"1504.04756","James P. Crutchfield","Sarah E. Marzen and Michael R. DeWeese and James P. Crutchfield","Time Resolution Dependence of Information Measures for Spiking Neurons:
  Atoms, Scaling, and Universality","20 pages, 6 figures;
  http://csc.ucdavis.edu/~cmg/compmech/pubs/trdctim.htm",,,,"q-bio.NC cond-mat.dis-nn cs.NE math.PR nlin.CD","http://arxiv.org/licenses/nonexclusive-distrib/1.0/","  The mutual information between stimulus and spike-train response is commonly
used to monitor neural coding efficiency, but neuronal computation broadly
conceived requires more refined and targeted information measures of
input-output joint processes. A first step towards that larger goal is to
develop information measures for individual output processes, including
information generation (entropy rate), stored information (statistical
complexity), predictable information (excess entropy), and active information
accumulation (bound information rate). We calculate these for spike trains
generated by a variety of noise-driven integrate-and-fire neurons as a function
of time resolution and for alternating renewal processes. We show that their
time-resolution dependence reveals coarse-grained structural properties of
interspike interval statistics; e.g., $\tau$-entropy rates that diverge less
quickly than the firing rate indicate interspike interval correlations. We also
find evidence that the excess entropy and regularized statistical complexity of
different types of integrate-and-fire neurons are universal in the
continuous-time limit in the sense that they do not depend on mechanism
details. This suggests a surprising simplicity in the spike trains generated by
these model neurons. Interestingly, neurons with gamma-distributed ISIs and
neurons whose spike trains are alternating renewal processes do not fall into
the same universality class. These results lead to two conclusions. First, the
dependence of information measures on time resolution reveals mechanistic
details about spike train generation. Second, information measures can be used
as model selection tools for analyzing spike train processes.
","[{""version"":""v1"",""created"":""Sat, 18 Apr 2015 20:14:19 GMT""}]","2015-04-21"
"1504.04757","Radu Grigore","Radu Grigore and Stefan Kiefer","Tree Buffers","CAV 2015 (The final publication is available at link.springer.com)",,,,"cs.DS","http://arxiv.org/licenses/nonexclusive-distrib/1.0/","  In runtime verification, the central problem is to decide if a given program
execution violates a given property. In online runtime verification, a monitor
observes a program's execution as it happens. If the program being observed has
hard real-time constraints, then the monitor inherits them. In the presence of
hard real-time constraints it becomes a challenge to maintain enough
information to produce error traces, should a property violation be observed.
In this paper we introduce a data structure, called tree buffer, that solves
this problem in the context of automata-based monitors: If the monitor itself
respects hard real-time constraints, then enriching it by tree buffers makes it
possible to provide error traces, which are essential for diagnosing defects.
We show that tree buffers are also useful in other application domains. For
example, they can be used to implement functionality of capturing groups in
regular expressions. We prove optimal asymptotic bounds for our data structure,
and validate them using empirical data from two sources: regular expression
searching through Wikipedia, and runtime verification of execution traces
obtained from the DaCapo test suite.
","[{""version"":""v1"",""created"":""Sat, 18 Apr 2015 20:39:15 GMT""},{""version"":""v2"",""created"":""Thu, 14 May 2015 11:43:56 GMT""}]","2015-05-15"
"1504.04758","Dieter Bothe","Dieter Bothe, Jan Pr\""uss","On the Interface Formation Model for Dynamic Triple Lines",,,,,"math.AP physics.flu-dyn","http://arxiv.org/licenses/nonexclusive-distrib/1.0/","  This paper revisits the theory of Y. Shikhmurzaev on forming interfaces as a
continuum thermodynamical model for dynamic triple lines. We start with the
derivation of the balances for mass, momentum, energy and entropy in a
three-phase fluid system with full interfacial physics, including a brief
review of the relevant transport theorems on interfaces and triple lines.
Employing the entropy principle in the form given in [Bothe & Dreyer, Acta
Mechanica, doi:10.1007/s00707-014-1275-1] but extended to this more general
case, we arrive at the entropy production and perform a linear closure, except
for a nonlinear closure for the sorption processes. Specialized to the
isothermal case, we obtain a thermodynamically consistent mathematical model
for dynamic triple lines and show that the total available energy is a strict
Lyapunov function for this system.
","[{""version"":""v1"",""created"":""Sat, 18 Apr 2015 20:58:55 GMT""}]","2015-04-21"
"1504.04759","Arthur Ramos BSCS","Arthur F. Ramos, Ruy J.G.B. de Queiroz and Anjolina G. de Oliveira","On the Identity Type as the Type of Computational Paths","16 pages",,,,"cs.LO","http://arxiv.org/licenses/nonexclusive-distrib/1.0/","  We introduce a new way of formalizing the intensional identity type based on
the fact that a entity known as computational paths can be interpreted as terms
of the identity type. Our approach enjoys the fact that our elimination rule is
easy to understand and use. We make this point clear constructing terms of some
relevant types using our proposed elimination rule. We also show that the
identity type, as defined by our approach, induces a groupoid structure. This
result is on par with the fact that the traditional identity type induces a
groupoid, as exposed by Hofmann \& Streicher (1994).
","[{""version"":""v1"",""created"":""Sat, 18 Apr 2015 20:59:12 GMT""}]","2015-04-21"
"1504.04760","Oleg Brandt","Oleg Brandt (for the CDF and D0 Collaborations)","Recent top quark production results from the Tevatron","Presented at the 2015 Moriond QCD Conference",,,"FERMILAB-CONF-15-097-E FERMILAB-CONF-15-097-E FERMILAB-CONF-15-097-E
  FERMILAB-CONF-15-097-E","hep-ex","http://arxiv.org/licenses/nonexclusive-distrib/1.0/","  In this article, I review recent measurements of the production of the top
quark in $p\bar p$ collisions at a centre-of-mass energy of $\sqrt s=1.96$~TeV
in Run II of the Fermilab Tevatron Collider, recorded by the CDF and D0
Collaborations. I will present the Tevatron combination of measurements of the
$t\bar t$ production cross section and its differential measurement, the first
evidence for and observation of the production of single top quarks in the
$s$-channel, as well the final Tevatron combination of the production of single
top quarks the $s$- and $t$-channels. Furthermore, I will review the
measurements of the forward-backward asymmetry in $t\bar t$ events, which can
be experimentally uniquely accessed in the $CP$-invariant $p\bar p$ initial
state at the Tevatron, and conclude with the measurements of this asymmetry in
the $b\bar b$ system.
","[{""version"":""v1"",""created"":""Sat, 18 Apr 2015 21:07:03 GMT""}]","2015-04-21"
"1504.04761","Alexander Kaplan","A. E. Kaplan","All-band Bragg solitons and cw eigenmodes","6 pages, 1 fig",,,,"physics.optics","http://creativecommons.org/licenses/by/3.0/","  We found an amazingly simple general ""all-band"" intensity profile of bandgap
(Bragg) solitons for arbitrary parameters of spatially-periodic nonlinear
systems, similar to those of multi-frequency stimulated Raman scattering, in
particular the so called Lorentzian-profile solitons. We also found nonlinear
eigen-modes of such system that propagate without energy exchange between
waves.
","[{""version"":""v1"",""created"":""Sat, 18 Apr 2015 21:09:13 GMT""}]","2015-04-21"
"1504.04762","Giovanna Citti","Luca Capogna and Giovanna Citti","Regularity for Subelliptic PDE Through Uniform Estimates in Multi-Scale
  Geometries",,,,,"math.AP","http://arxiv.org/licenses/nonexclusive-distrib/1.0/","  We aim at reviewing and extending a number of recent results addressing
stability of certain geometric and analytic estimates in the Riemannian
approximation of subRiemannian structures. In particular we extend the recent
work of the the authors with Rea [19] and Manfredini [17] concerning stability
of doubling properties, Poincar\'e inequalities, Gaussian estimates on heat
kernels and Schauder estimates from the Carnot group setting to the general
case of H\""ormander vector fields.
","[{""version"":""v1"",""created"":""Sat, 18 Apr 2015 21:09:55 GMT""}]","2015-04-21"
"1504.04763","David Novotny","David Novotn\'y, Diane Larlus, Florent Perronnin, Andrea Vedaldi","Understanding the Fisher Vector: a multimodal part model",,,,,"cs.CV","http://arxiv.org/licenses/nonexclusive-distrib/1.0/","  Fisher Vectors and related orderless visual statistics have demonstrated
excellent performance in object detection, sometimes superior to established
approaches such as the Deformable Part Models. However, it remains unclear how
these models can capture complex appearance variations using visual codebooks
of limited sizes and coarse geometric information. In this work, we propose to
interpret Fisher-Vector-based object detectors as part-based models. Through
the use of several visualizations and experiments, we show that this is a
useful insight to explain the good performance of the model. Furthermore, we
reveal for the first time several interesting properties of the FV, including
its ability to work well using only a small subset of input patches and visual
words. Finally, we discuss the relation of the FV and DPM detectors, pointing
out differences and commonalities between them.
","[{""version"":""v1"",""created"":""Sat, 18 Apr 2015 21:12:41 GMT""}]","2015-04-21"
"1504.04764","Levon Chakhmakhchyan","Levon Chakhmakhchyan, St\'ephane Gu\'erin, Claude Leroy","Chaotic spin-spin entanglement on a recursive lattice","12 pages, 7 figures. Updated version for publication","Phys. Rev. E 92, 022101 (2015)","10.1103/PhysRevE.92.022101",,"cond-mat.stat-mech nlin.CD quant-ph","http://arxiv.org/licenses/nonexclusive-distrib/1.0/","  We propose an exactly solvable multisite interaction spin-1/2
Ising-Heisenberg model on a triangulated Husimi lattice for the rigorous
studies of chaotic entanglement. By making use of the generalized star-triangle
transformation, we map the initial model onto an effective Ising one on a
Husimi lattice, which we solve then exactly by applying the recursive method.
Expressing the entanglement of the Heisenberg spins, that we quantify by means
of the concurrence, in terms of the magnetic quantities of the system, we
demonstrate its bifurcation and chaotic behavior. Furthermore, we show that the
underlying chaos may slightly enhance the amount of the entanglement, and
present on the phase diagram the transition lines from the uniform to periodic
and from the periodic to chaotic regimes.
","[{""version"":""v1"",""created"":""Sat, 18 Apr 2015 21:13:50 GMT""},{""version"":""v2"",""created"":""Mon, 24 Aug 2015 09:36:06 GMT""}]","2015-08-25"
"1504.04765","Joseph Gerver","Joseph L. Gerver","A nice example of Lebesgue integration","19 pages, 1 figure",,,,"math.CA","http://arxiv.org/licenses/nonexclusive-distrib/1.0/","  We explore the properties of an interesting new example of a function which
is Lebesgue integrable but not Riemann integrable.
","[{""version"":""v1"",""created"":""Sat, 18 Apr 2015 21:27:09 GMT""}]","2015-04-21"
"1504.04766","Philip Graff","Philip B. Graff and Alessandra Buonanno and B. S. Sathyaprakash","The Missing Link: Bayesian Detection and Measurement of
  Intermediate-Mass Black-Hole Binaries","17 pages, 9 figures, 2 tables; updated to reflect published version","Phys. Rev. D 92, 022002 (2015)","10.1103/PhysRevD.92.022002",,"gr-qc","http://arxiv.org/licenses/nonexclusive-distrib/1.0/","  We perform Bayesian analysis of gravitational-wave signals from non-spinning,
intermediate-mass black-hole binaries (IMBHBs) with observed total mass,
$M_{\mathrm{obs}}$, from $50\mathrm{M}_{\odot}$ to $500\mathrm{M}_{\odot}$ and
mass ratio $1\mbox{--}4$ using advanced LIGO and Virgo detectors. We employ
inspiral-merger-ringdown waveform models based on the effective-one-body
formalism and include subleading modes of radiation beyond the leading $(2,2)$
mode. The presence of subleading modes increases signal power for inclined
binaries and allows for improved accuracy and precision in measurements of the
masses as well as breaking of extrinsic parameter degeneracies. For low total
masses, $M_{\mathrm{obs}} \lesssim 50 \mathrm{M}_{\odot}$, the observed chirp
mass $\mathcal{M}_{\rm obs} = M_{\mathrm{obs}}\,\eta^{3/5}$ ($\eta$ being the
symmetric mass ratio) is better measured. In contrast, as increasing power
comes from merger and ringdown, we find that the total mass $M_{\mathrm{obs}}$
has better relative precision than $\mathcal{M}_{\rm obs}$. Indeed, at high
$M_{\mathrm{obs}}$ ($\geq 300 \mathrm{M}_{\odot}$), the signal resembles a
burst and the measurement thus extracts the dominant frequency of the signal
that depends on $M_{\mathrm{obs}}$. Depending on the binary's inclination, at
signal-to-noise ratio (SNR) of $12$, uncertainties in $M_{\mathrm{obs}}$ can be
as large as $\sim 20 \mbox{--}25\%$ while uncertainties in $\mathcal{M}_{\rm
obs}$ are $\sim 50 \mbox{--}60\%$ in binaries with unequal masses (those
numbers become $\sim 17\%$ versus $\sim22\%$ in more symmetric binaries).
Although large, those uncertainties will establish the existence of IMBHs. Our
results show that gravitational-wave observations can offer a unique tool to
observe and understand the formation, evolution and demographics of IMBHs,
which are difficult to observe in the electromagnetic window. (abridged)
","[{""version"":""v1"",""created"":""Sat, 18 Apr 2015 21:45:17 GMT""},{""version"":""v2"",""created"":""Mon, 31 Aug 2015 19:25:15 GMT""}]","2015-09-01"
"1504.04767","Guru  Guruganesh","Nikhil Bansal and Anupam Gupta and Guru Guruganesh","On the Lov\'asz Theta function for Independent Sets in Sparse Graphs","Extended abstract to appear at the STOC 2015 conference",,,,"cs.DS","http://arxiv.org/licenses/nonexclusive-distrib/1.0/","  We consider the maximum independent set problem on graphs with maximum
degree~$d$. We show that the integrality gap of the Lov\'asz
$\vartheta$-function based SDP is $\widetilde{O}(d/\log^{3/2} d)$. This
improves on the previous best result of $\widetilde{O}(d/\log d)$, and almost
matches the integrality gap of $\widetilde{O}(d/\log^2 d)$ recently shown for
stronger SDPs, namely those obtained using poly-$(\log(d))$ levels of the
$SA^+$ semidefinite hierarchy. The improvement comes from an improved
Ramsey-theoretic bound on the independence number of $K_r$-free graphs for
large values of $r$.
  We also show how to obtain an algorithmic version of the above-mentioned
$SA^+$-based integrality gap result, via a coloring algorithm of Johansson. The
resulting approximation guarantee of $\widetilde{O}(d/\log^2 d)$ matches the
best unique-games-based hardness result up to lower-order poly-$(\log\log d)$
factors.
","[{""version"":""v1"",""created"":""Sat, 18 Apr 2015 21:55:07 GMT""},{""version"":""v2"",""created"":""Thu, 23 Apr 2015 14:17:38 GMT""}]","2015-04-24"
"1504.04768","David Baelde","David Baelde, St\'ephanie Delaune, Lucca Hirschi","Partial Order Reduction for Security Protocols",,,,,"cs.CR cs.LO","http://creativecommons.org/licenses/by/4.0/","  Security protocols are concurrent processes that communicate using
cryptography with the aim of achieving various security properties. Recent work
on their formal verification has brought procedures and tools for deciding
trace equivalence properties (e.g., anonymity, unlinkability, vote secrecy) for
a bounded number of sessions. However, these procedures are based on a naive
symbolic exploration of all traces of the considered processes which,
unsurprisingly, greatly limits the scalability and practical impact of the
verification tools.
  In this paper, we overcome this difficulty by developing partial order
reduction techniques for the verification of security protocols. We provide
reduced transition systems that optimally eliminate redundant traces, and which
are adequate for model-checking trace equivalence properties of protocols by
means of symbolic execution. We have implemented our reductions in the tool
Apte, and demonstrated that it achieves the expected speedup on various
protocols.
","[{""version"":""v1"",""created"":""Sat, 18 Apr 2015 21:58:38 GMT""},{""version"":""v2"",""created"":""Tue, 21 Apr 2015 08:32:17 GMT""},{""version"":""v3"",""created"":""Mon, 7 Sep 2015 16:13:29 GMT""}]","2015-09-08"
"1504.04769","Vladimir Kuklin","A.V. Kirichok, V.M. Kuklin, A.V. Pryimak, A.G. Zagorodny","Ion heating, burnout of the HF field and ion sound generation under the
  development of a modulation instability of an intense Langmuir wave in a
  plasma","arXiv admin note: text overlap with arXiv:1411.3011",,"10.1063/1.4931058",,"physics.plasm-ph","http://arxiv.org/licenses/nonexclusive-distrib/1.0/","  The development of one-dimensional parametric instabilities of intense
long-wave plasma waves is considered in terms of the so-called hybrid models,
when electrons are treated as a fluid and ions are regarded as particles. The
analysis is performed for both cases when the average plasma field energy is
lower (Zakharov's hybrid model -- ZHM) or greater (Silin's hybrid model -- SHM)
than the plasma thermal energy. The efficiency of energy transfer to ions and
to ion perturbations under the development of the instability is considered for
various values of electron-to-ion mass ratios. The energy of low-frequency (LF)
oscillations (ion-sound waves) is found to be much lower than the final ion
kinetic energy. We also discuss the influence of the changes in the damping
rate of the high-frequency (HF) field on the instability development. Reduced
absorption of the HF field leads to the retardation of the HF field burnout
within plasma density cavities and to the broadening of the HF spectrum. At the
same time, the ion velocity distribution tends to the normal distribution in
both ZHM and SHM.
","[{""version"":""v1"",""created"":""Sat, 18 Apr 2015 22:05:08 GMT""}]","2015-09-30"
"1504.04770","Maxim Rabinovich","Maxim Rabinovich, C\'edric Archambeau","Online Inference for Relation Extraction with a Reduced Feature Set",,,,,"cs.CL cs.LG","http://arxiv.org/licenses/nonexclusive-distrib/1.0/","  Access to web-scale corpora is gradually bringing robust automatic knowledge
base creation and extension within reach. To exploit these large
unannotated---and extremely difficult to annotate---corpora, unsupervised
machine learning methods are required. Probabilistic models of text have
recently found some success as such a tool, but scalability remains an obstacle
in their application, with standard approaches relying on sampling schemes that
are known to be difficult to scale. In this report, we therefore present an
empirical assessment of the sublinear time sparse stochastic variational
inference (SSVI) scheme applied to RelLDA. We demonstrate that online inference
leads to relatively strong qualitative results but also identify some of its
pathologies---and those of the model---which will need to be overcome if SSVI
is to be used for large-scale relation extraction.
","[{""version"":""v1"",""created"":""Sat, 18 Apr 2015 22:08:50 GMT""}]","2015-04-21"
"1504.04771","Muhammad Tahir","M. Tahir, A. Manchon, and U. Schwingenschlogl","Photoinduced quantum spin and valley Hall effects and orbital
  magnetization in monolayer MoS2","10 pages and 2 figs","Phys. Rev. B 90, 125438 (2014)","10.1103/PhysRevB.90.125438",,"cond-mat.mes-hall","http://arxiv.org/licenses/nonexclusive-distrib/1.0/","  We theoretically demonstrate that 100\% valley-polarized transport in
monolayers of MoS$_{2}$ and other group-VI dichalcogenides can be obtained
using off-resonant circularly polarized light. By tuning the intensity of the
off-resonant light the intrinsic band gap in one valley is reduced, while it is
enhanced in the other valley, enabling single valley quantum transport. As a
consequence, we predict (i) enhancement of the longitudinal electrical
conductivity, accompanied by an increase in the spin-polarization of the
flowing electrons, (ii) enhancement of the intrinsic spin Hall effect, together
with a reduction of the intrinsic valley Hall effect, and (iii) enhancement of
the orbital magnetic moment and orbital magnetization. These mechanisms provide
appealing opportunities to the design of nanoelectronics based on
dichalcogenides.
","[{""version"":""v1"",""created"":""Sat, 18 Apr 2015 22:17:24 GMT""}]","2015-04-21"
"1504.04772","Muhammad Tahir","M. Tahir and U. Schwingenschlogl","Tunable thermoelectricity in monolayers of MoS$_{2}$ and other group-VI
  dichalcogenides","10 pages and 6 figs","New J. Phys. 16 115003 (2014)","10.1088/1367-2630/16/11/115003",,"cond-mat.mes-hall","http://arxiv.org/licenses/nonexclusive-distrib/1.0/","  We study the thermoelectric properties of monolayers of MoS$_{2}$ and other
group-VI dichalcogenides under circularly polarized off-resonant light.
Analytical expressions are derived for the Berry phase mediated magnetic
moment, orbital magnetization, as well as thermal and Nernst conductivities.
Tuning of the band gap by {\it off-resonant} light enhances the spin splitting
in both the valence and conduction bands and, thus, leads to a dramatic
improvement of the spin and valley thermoelectric properties.
","[{""version"":""v1"",""created"":""Sat, 18 Apr 2015 22:27:14 GMT""}]","2015-04-21"
"1504.04773","Danila Gorodecky","Danila Gorodecky","Reed-Muller Realization of X (mod P)",,,,,"cs.CR","http://arxiv.org/licenses/nonexclusive-distrib/1.0/","  This article provides a novel technique of X (mod P) realization. It is based
on the Reed-Muller polynomial expansion. The advantage of the approach
concludes in the capability to realize X (mod P) for an arbitrary P. The
approach is competitive with the known realizations on the speed processing.
Advantages and results of comparison with the known approaches for X [9:1] and
P=7 is demonstrated.
","[{""version"":""v1"",""created"":""Sat, 18 Apr 2015 22:52:05 GMT""}]","2015-04-21"
"1504.04774","Jianing Zhang","Claudia Kl\""uppelberg, Jianing Zhang","Time-consistency of risk measures with GARCH volatilities and their
  estimation",,,,,"q-fin.RM q-fin.CP","http://arxiv.org/licenses/nonexclusive-distrib/1.0/","  In this paper we study time-consistent risk measures for returns that are
given by a GARCH(1,1) model. We present a construction of risk measures based
on their static counterparts that overcomes the lack of time-consistency. We
then study in detail our construction for the risk measures Value-at-Risk (VaR)
and Average Value-at-Risk (AVaR). While in the VaR case we can derive an
analytical formula for its time-consistent counterpart, in the AVaR case we
derive lower and upper bounds to its time-consistent version. Furthermore, we
incorporate techniques from Extreme Value Theory (EVT) to allow for a more
tail-geared statistical analysis of the corresponding risk measures. We
conclude with an application of our results to a data set of stock prices.
","[{""version"":""v1"",""created"":""Sat, 18 Apr 2015 22:57:22 GMT""},{""version"":""v2"",""created"":""Mon, 1 Feb 2016 09:50:46 GMT""}]","2016-02-02"
