"1503.05200","Hanako Hoshino","Hanako Hoshino, Alexie Leauthaud, Claire Lackner, Chiaki Hikage,
  Eduardo Rozo, Eli Rykoff, Rachel Mandelbaum, Surhud More, Anupreeta More,
  Shun Saito, Benedetta Vulcani","Luminous Red Galaxies in Clusters: Central Occupation, Spatial
  Distributions, and Mis-centering","18 pages, 9 figures, 4 tables, submitted to MNRAS, included the
  referee comments",,"10.1093/mnras/stv1271",,"astro-ph.CO","http://arxiv.org/licenses/nonexclusive-distrib/1.0/","  Luminous Red Galaxies (LRG) from the Sloan Digital Sky Survey are considered
among the best understood samples of galaxies, and they are employed in a broad
range of cosmological studies. Because they form a relatively homogeneous
population, with high stellar masses and red colors, they are expected to
occupy halos in a relatively simple way. In this paper, we study how LRGs
occupy massive halos via direct counts in clusters and we reveal several
unexpected trends suggesting that the connection between LRGs and dark matter
halos may not be straightforward. Using the redMaPPer cluster catalog, we
derive the central occupation of LRGs as a function richness, Ncen({\lambda}).
Assuming no correlation between cluster mass and central galaxy luminosity at
fixed richness, we show that clusters contain a significantly lower fraction of
central LRGs than predicted from the two-point correlation function. At halo
masses of 10^14.5 Msun, we find Ncen=0.73, compared to Ncen of 0.89 from
correlation studies. Our central occupation function for LRGs converges to 0.95
at large halo masses. A strong anti-correlation between central luminosity and
cluster mass at fixed richness is required to reconcile our results with those
based on clustering studies. We also derive P_BNC, the probability that the
brightest cluster member is not the central galaxy. We find P_BNC ~ 20-30%
which is a factor of ~2 lower than the value found by Skibba et al. 2011.
Finally, we study the radial offsets of bright non-central LRGs from cluster
centers and show that bright non-central LRGs follow a different radial
distribution compared to red cluster members, which follow a
Navarro-Frank-White profile. This work demonstrates that even the most massive
clusters do not always have an LRG at the center, and that the brightest galaxy
in a cluster is not always the central galaxy.
","[{""version"":""v1"",""created"":""Tue, 17 Mar 2015 20:00:24 GMT""},{""version"":""v2"",""created"":""Mon, 11 May 2015 01:24:22 GMT""}]","2015-08-06"
"1503.05201","Anne Hutter","Anne Hutter, Pratika Dayal, Volker M\""uller","Clustering and lifetime of Lyman Alpha Emitters in the Epoch of
  Reionization","11 pages, 7 figures, accepted for publication in MNRAS, comments
  welcome",,"10.1093/mnras/stv929",,"astro-ph.CO astro-ph.GA","http://arxiv.org/licenses/nonexclusive-distrib/1.0/","  We calculate Lyman Alpha Emitter (LAE) angular correlation functions (ACFs)
at $z \simeq 6.6$ and the fraction of lifetime (for the 100 Myrs preceding
$z\simeq6.6$) galaxies spend as Lyman Break Galaxies (LBGs) or as LBGs with
Lyman Alpha (Ly$\alpha$) emission using a model that combines SPH cosmological
simulations (GADGET-2), dust attenuation and a radiative transfer code
(pCRASH). The ACFs are a powerful tool that significantly narrows the 3D
parameter space allowed by LAE Ly$\alpha$ and UV luminosity functions (LFs)
alone. With this work, we simultaneously constrain the escape fraction of
ionizing photons $f_{esc}=0.05-0.5$, the mean fraction of neutral hydrogen in
the intergalactic medium (IGM) $\langle \chi_{HI} \rangle \leq 0.01$ and the
dust-dependent ratio of the escape fractions of Ly$\alpha$ and UV continuum
photons $f_{\alpha}/f_c=0.6-1.2$. Our results show that reionization has the
largest impact on the amplitude of the ACFs, and its imprints are clearly
distinguishable from those of $f_{esc}$ and $f_\alpha/f_c$. We also show that
galaxies with a critical stellar mass of $M_* = 10^{8.5} (10^{9.5})M_{\odot}$
produce enough luminosity to stay visible as LBGs (LAEs). Finally, the fraction
of time during the past 100 Myrs prior to z=6.6 a galaxy spends as a LBG or as
a LBG with Ly$\alpha$ emission increases with the UV magnitude (and the stellar
mass $M_*$): considering observed (dust and IGM attenuated) luminosities, the
fraction of time a galaxy spends as a LBG (LAE) increases from 65% to 100%
(0-100%) as $M_{UV}$ decreases from $M_{UV} = -18.0$ to $-23.5$ ($M_*$
increases from $10^8-10^{10.5} M_{\odot}$). Thus in our model the brightest
(most massive) LBGs most often show Ly$\alpha$ emission.
","[{""version"":""v1"",""created"":""Tue, 17 Mar 2015 20:00:30 GMT""},{""version"":""v2"",""created"":""Thu, 7 May 2015 09:36:45 GMT""}]","2015-05-08"
"1503.05202","Patrick Breysse","Patrick C. Breysse, Ely D. Kovetz, and Marc Kamionkowski","Masking line foregrounds in intensity mapping surveys","12 pages, 10 figures, 1 table, accepted to MNRAS",,,,"astro-ph.CO","http://arxiv.org/licenses/nonexclusive-distrib/1.0/","  We address the problem of line confusion in intensity mapping surveys and
explore the possibility to mitigate line foreground contamination by
progressively masking the brightest pixels in the observed map. We consider
experiments targeting CO(1-0) at $z=3$, Ly$\alpha$ at $z=7$, and CII at $z=7$,
and use simulated intensity maps, which include both clustering and shot noise
components of the signal and possible foregrounds, in order to test the
efficiency of our method. We find that for CO and Ly$\alpha$ it is quite
possible to remove most of the foreground contribution from the maps via only
1%-3% pixel masking. The CII maps will be more difficult to clean, however, due
to instrumental constraints and the high-intensity foreground contamination
involved. While the masking procedure sacrifices much of the astrophysical
information present in our maps, we demonstrate that useful cosmological
information in the targeted lines can be successfully retrieved.
","[{""version"":""v1"",""created"":""Tue, 17 Mar 2015 20:00:32 GMT""},{""version"":""v2"",""created"":""Wed, 23 Sep 2015 19:19:03 GMT""}]","2015-09-24"
"1503.05203","Stephen D. Bartlett","Angela Karanjai, Eric G. Cavalcanti, Stephen D. Bartlett, and Terry
  Rudolph","Weak values in a classical theory with an epistemic restriction","9 pages, 2 figures, comments welcome; v2 added some references; v3
  published version","New J. Phys. 17, 073015 (2015)","10.1088/1367-2630/17/7/073015",,"quant-ph","http://arxiv.org/licenses/nonexclusive-distrib/1.0/","  Weak measurement of a quantum system followed by postselection based on a
subsequent strong measurement gives rise to a quantity called the weak value: a
complex number for which the interpretation has long been debated. We analyse
the procedure of weak measurement and postselection, and the interpretation of
the associated weak value, using a theory of classical mechanics supplemented
by an epistemic restriction that is known to be operationally equivalent to a
subtheory of quantum mechanics. Both the real and imaginary components of the
weak value appear as phase space displacements in the postselected expectation
values of the measurement device's position and momentum distributions, and we
recover the same displacements as in the quantum case by studying the
corresponding evolution in the classical theory. By using this analogous
classical theory, we gain insight into the appearance of the weak value as a
result of the statistical effects of post selection, and this provides us with
an operational interpretation of the weak value, both its real and imaginary
parts. We find that the imaginary part of the weak value is a measure of how
much postselection biases the mean phase space distribution for a given amount
of measurement disturbance. All such biases proportional to the imaginary part
of the weak value vanish in the limit where disturbance due to measurement goes
to zero. Our analysis also offers intuitive insight into how measurement
disturbance can be minimised and the limits of weak measurement.
","[{""version"":""v1"",""created"":""Tue, 17 Mar 2015 20:01:03 GMT""},{""version"":""v2"",""created"":""Thu, 26 Mar 2015 22:34:20 GMT""},{""version"":""v3"",""created"":""Wed, 15 Jul 2015 01:09:34 GMT""}]","2015-07-16"
"1503.05204","Michal Doucha","Michal Doucha","Universal and homogeneous structures on the Urysohn and Gurarij spaces","This paper contains new proofs and extends the results of the earlier
  draft arXiv:1305.0501. In the version 2, some arguments were improved. The
  third version contains updated information about the author's grant",,,,"math.GN math.FA math.LO","http://arxiv.org/licenses/nonexclusive-distrib/1.0/","  Using Fra\"" iss\' e theoretic methods we enrich the Urysohn universal space
by universal and homogeneous closed relations, retractions, closed subsets of
the product of the Urysohn space itself and some fixed compact metric space,
$L$-Lipschitz map to a fixed Polish metric space. The latter lifts to a
universal linear operator of norm $L$ on the Lispchitz-free space of the
Urysohn space.
  Moreover, we enrich the Gurarij space by a universal and homogeneous closed
subspace and norm one projection onto a $1$-complemented subspace. We construct
the Gurarij space by the classical Fra\"" iss\' e theoretic approach.
","[{""version"":""v1"",""created"":""Tue, 17 Mar 2015 20:01:06 GMT""},{""version"":""v2"",""created"":""Thu, 26 Mar 2015 15:50:06 GMT""},{""version"":""v3"",""created"":""Thu, 8 Feb 2018 16:54:23 GMT""}]","2018-02-09"
"1503.05205","Bridget Tenner","Bridget Eileen Tenner","Reduced word manipulation: patterns and enumeration","to appear in Journal of Algebraic Combinatorics",,,,"math.CO","http://arxiv.org/licenses/nonexclusive-distrib/1.0/","  We develop the technique of reduced word manipulation to give a range of
results concerning reduced words and permutations more generally. We prove a
broad connection between pattern containment and reduced words, which
specializes to our previous work for vexillary permutations. We also analyze
general tilings of Elnitsky's polygon, and demonstrate that these are closely
related to the patterns in a permutation. Building on previous work for
commutation classes, we show that reduced word enumeration is monotonically
increasing with respect to pattern containment. Finally, we give several
applications of this work. We show that a permutation and a pattern have
equally many reduced words if and only if they have the same length
(equivalently, the same number of 21-patterns), and that they have equally many
commutation classes if and only if they have the same number of 321-patterns.
We also apply our techniques to enumeration problems of pattern avoidance, and
give a bijection between 132-avoiding permutations of a given length and
partitions of that same size, as well as refinements of this data and a
connection to the Catalan numbers.
","[{""version"":""v1"",""created"":""Tue, 17 Mar 2015 20:03:25 GMT""},{""version"":""v2"",""created"":""Fri, 18 Dec 2015 17:40:24 GMT""},{""version"":""v3"",""created"":""Thu, 23 Mar 2017 15:13:59 GMT""}]","2017-03-24"
"1503.05206","Andrew King","Andrew King and Ken Pounds","Powerful Outflows and Feedback from Active Galactic Nuclei","To appear in Annual Reviews of Astronomy and Astrophysics, Vol 53. 44
  pages, 10 figures",,"10.1146/annurev-astro-082214-122316",,"astro-ph.GA astro-ph.HE","http://arxiv.org/licenses/nonexclusive-distrib/1.0/","  Active Galactic Nuclei (AGN) represent the growth phases of the supermassive
black holes in the center of almost every galaxy. Powerful, highly ionized
winds, with velocities $\sim 0.1- 0.2c$ are a common feature in X--ray spectra
of luminous AGN, offering a plausible physical origin for the well known
connections between the hole and properties of its host. Observability
constraints suggest that the winds must be episodic, and detectable only for a
few percent of their lifetimes. The most powerful wind feedback, establishing
the $M -\sigma$ relation, is probably not directly observable at all. The $M -
\sigma$ relation signals a global change in the nature of AGN feedback. At
black hole masses below $M-\sigma$ feedback is confined to the immediate
vicinity of the hole. At the $M-\sigma$ mass it becomes much more energetic and
widespread, and can drive away much of the bulge gas as a fast molecular
outflow.
","[{""version"":""v1"",""created"":""Tue, 17 Mar 2015 20:04:52 GMT""}]","2015-09-23"
"1503.05207","Rony Bitan Avraham","Rony A. Bitan","The Hasse principle for bilinear symmetric forms over a ring of integers
  of a global function field","10 pages, no figures","Journal of Number Theory (2016), pp. 346-359","10.1016/j.jnt.2016.04.004",,"math.AG","http://arxiv.org/licenses/nonexclusive-distrib/1.0/","  Let $C$ be a smooth projective curve defined over the finite field
$\mathbb{F}_q$ ($q$ is odd) and let $K=\mathbb{F}_q(C)$ be its function field.
Removing one closed point $C^\text{af} = C-\{\infty\}$ results in an integral
domain $\mathcal{O}_{\{\infty\}} = \mathbb{F}_q[C^\text{af}]$ of $K$, over
which we consider a non-degenerate bilinear and symmetric form $f$ with
orthogonal group $\underline{\textbf{O}}_V$. We show that the set
$\text{Cl}_\infty(\underline{\textbf{O}}_V)$ of
$\mathcal{O}_{\{\infty\}}$-isomorphism classes in the genus of $f$ of rank
$n>2$, is bijective as a pointed set to the abelian groups
$H^2_{\text{\'et}}(\mathcal{O}_{\{\infty\}},\underline{\mu}_2) \cong
\text{Pic}(C^\text{af})/2$, i.e. is an invariant of $C^\text{af}$. We then
deduce that any such $f$ of rank $n>2$ admits the local-global Hasse principal
if and only if $|\text{Pic}(C^\text{af})|$ is odd. For rank $2$ this principle
holds if the integral closure of $\mathcal{O}_{\{\infty\}}$ in the splitting
field of $\underline{\textbf{O}}_V \otimes_{\mathcal{O}_{\{\infty\}}} K$ is a
UFD.
","[{""version"":""v1"",""created"":""Tue, 17 Mar 2015 20:04:58 GMT""},{""version"":""v2"",""created"":""Sun, 3 Jul 2016 14:18:17 GMT""}]","2016-07-05"
"1503.05208","David Klein","David Klein and Jake Reschke","Velocity addition formulas in Robertson-Walker spacetimes","26 pages, 5 figures","J. Math. Phys. 56: 072501 (2015)","10.1063/1.4926352",,"gr-qc math-ph math.MP","http://arxiv.org/licenses/nonexclusive-distrib/1.0/","  Universal velocity addition formulas analogous to the well-known formula in
special relativity are found for four geometrically defined relative velocities
in a large class of Robertson-Walker spacetimes. Explicit examples are given.
The special relativity result is recovered as a special case, and it is shown
that the spectroscopic relative velocity, in contrast to three other geometric
relative velocities, follows the same addition law as in special relativity for
comoving observers in Robertson-Walker cosmologies.
","[{""version"":""v1"",""created"":""Tue, 17 Mar 2015 20:12:06 GMT""}]","2015-07-10"
"1503.05209","Dimitris Stamatellos","Dimitris Stamatellos (UCLAN) and Gregory J. Herczeg (KIAA, Peking
  University)","The properties of discs around planets and brown dwarfs as evidence for
  disc fragmentation","10 pages, 8 figures, MNRAS accepted",,"10.1093/mnras/stv526",,"astro-ph.GA astro-ph.EP","http://arxiv.org/licenses/nonexclusive-distrib/1.0/","  Direct imaging searches have revealed many very low-mass objects, including a
small number of planetary mass objects, as wide-orbit companions to young
stars. The formation mechanism of these objects remains uncertain. In this
paper we present the predictions of the disc fragmentation model regarding the
properties of the discs around such low-mass objects. We find that the discs
around objects that have formed by fragmentation in discs hosted by Sun-like
stars (referred to as 'parent' discs and 'parent' stars) are more massive than
expected from the ${M}_{\rm disc}-M_*$ relation (which is derived for stars
with masses $M_*>0.2 {\rm M}_{\odot}$). Accordingly, the accretion rates onto
these objects are also higher than expected from the $\dot{M}_*-M_*$ relation.
Moreover there is no significant correlation between the mass of the brown
dwarf or planet with the mass of its disc nor with the accretion rate from the
disc onto it. The discs around objects that form by disc fragmentation have
larger than expected masses as they accrete gas from the disc of their parent
star during the first few kyr after they form. The amount of gas that they
accrete and therefore their mass depend on how they move in their parent disc
and how they interact with it. Observations of disc masses and accretion rates
onto very low-mass objects are consistent with the predictions of the disc
fragmentation model. Future observations (e.g. by ALMA) of disc masses and
accretion rates onto substellar objects that have even lower masses (young
planets and young, low-mass brown dwarfs), where the scaling relations
predicted by the disc fragmentation model diverge significantly from the
corresponding relations established for higher-mass stars, will test the
predictions of this model.
","[{""version"":""v1"",""created"":""Tue, 17 Mar 2015 20:12:21 GMT""}]","2015-06-24"
"1503.05210","Alessandro Bessi","Alessandro Bessi","Speeding up lower bound estimation in powerlaw distributions",,,,,"stat.CO physics.soc-ph stat.AP","http://arxiv.org/licenses/nonexclusive-distrib/1.0/","  The traditional lower bound estimation method for powerlaw distributions
based on the Kolmogorov-Smirnov distance proved to perform better than other
competing methods. However, if applied to very large collections of data, such
a method can be computationally demanding. In this paper, we propose two
alternative methods with the aim to reduce the time required by the estimation
procedure. We apply the traditional method and the two proposed methods to
large collections of data ($N = 500,000$) with varying values of the true lower
bound. Both the proposed methods yield a significantly better performance and
accuracy than the traditional method.
","[{""version"":""v1"",""created"":""Tue, 17 Mar 2015 20:20:15 GMT""}]","2015-03-19"
"1503.05211","Gennady Kozlov","G. Kozlov","The critical end point through observables","Talk given at QCHSXI, S-Petersburg, 8-12 September, 2014. To be
  published in AIP Proceedings",,"10.1063/1.4938676",,"hep-ph","http://arxiv.org/licenses/nonexclusive-distrib/1.0/","  We develop the model of the critical phenomena of strongly interacting matter
at high temperatures and baryon densities. The dual Yang-Mills theory with
scalar degrees of freedom (the dilatons) is used. The dilatons are the
consequence of a spontaneous breaking of a scale symmetry. The phase
transitions are considered in systems where the field conjugate to the order
parameter has the critical end mode. The critical end point (CEP) is a distinct
singular feature existence of which is dictated by the chiral dynamics. The
physical realization of CEP is via the influence quantum fluctuations of
two-body Bose-Einstein correlations for observed particles to which the
critical end mode couples.
","[{""version"":""v1"",""created"":""Tue, 17 Mar 2015 20:22:10 GMT""}]","2016-02-17"
"1503.05212","Oliver Steinbock","Hua Ke, Zhihui Zhang, and Oliver Steinbock","Scroll wave drift along steps, troughs and corners",,,,,"nlin.PS","http://arxiv.org/licenses/nonexclusive-distrib/1.0/","  Three-dimensional excitable systems can create nonlinear scroll waves that
rotate around one-dimensional phase singularities. Recent theoretical work
predicts that these filaments drift along step-like height variations. Here we
test this prediction using experiments with thin layers of the
Belousov-Zhabotinsky reaction. We observe that over short distances scroll
waves are attracted towards the step and then rapidly commence a steady drift
along the step line. The translating filaments always reside in the shallow
subsystem and terminate on the step plateau near the edge. Accordingly
filaments in the deep subsystem initially collide with and shorten at the step
wall. The drift speeds obey the predicted proportional dependence on the
logarithm of the height ratio and the direction depends on the vortex
chirality. We also observe drift along the perimeter of rectangular plateaus
and find that the filaments perform sharp turns at the corners. In addition, we
investigate rectangular troughs for which vortices of equal chirality can drift
in different directions. The latter two effects are reproduced in numerical
simulations with the Barkley model. The simulations show that narrow troughs
instigate scroll wave encounters that induce repulsive interaction and symmetry
breaking. Similar phenomena could exist in the geometrical complicated
ventricles of the human heart where reentrant vortex waves cause tachycardia
and fibrillation.
","[{""version"":""v1"",""created"":""Tue, 17 Mar 2015 20:23:39 GMT""}]","2015-03-19"
"1503.05213","Tigran Kalaydzhyan","Tigran Kalaydzhyan and Edward Shuryak","Collective flow in high-multiplicity proton-proton collisions","5 pages","Phys. Rev. C 91, 054913 (2015)","10.1103/PhysRevC.91.054913",,"hep-ph hep-th nucl-th","http://arxiv.org/licenses/nonexclusive-distrib/1.0/","  We present an evidence of strong radial flow in high-multiplicity pp
collisions. We analyze the CMS data on the inclusive spectra of the charged
pions, kaons and protons in the LHC $\sqrt{s}=7$ TeV collisions. For
$<N_{\mathrm{tracks}} >\gtrsim 75$ we demonstrate the consistency of the
hydrodynamic description with the (idealized) Gubser's flow. Using a one
parameter fit of the model to experimental data, we obtain the initial fireball
size to be of the order of 1 fm. At smaller multiplicities, the fit cannot be
performed which shows a limitation of the hydrodynamic approach and provides us
with falsifiability of our theory.
","[{""version"":""v1"",""created"":""Tue, 17 Mar 2015 20:32:21 GMT""}]","2015-06-03"
"1503.05214","Tarek Elgamal","Tarek Elgamal, Mohamed Hefeeda","Analysis of PCA Algorithms in Distributed Environments",,,,,"cs.DC cs.LG cs.NA","http://arxiv.org/licenses/nonexclusive-distrib/1.0/","  Classical machine learning algorithms often face scalability bottlenecks when
they are applied to large-scale data. Such algorithms were designed to work
with small data that is assumed to fit in the memory of one machine. In this
report, we analyze different methods for computing an important machine learing
algorithm, namely Principal Component Analysis (PCA), and we comment on its
limitations in supporting large datasets. The methods are analyzed and compared
across two important metrics: time complexity and communication complexity. We
consider the worst-case scenarios for both metrics, and we identify the
software libraries that implement each method. The analysis in this report
helps researchers and engineers in (i) understanding the main bottlenecks for
scalability in different PCA algorithms, (ii) choosing the most appropriate
method and software library for a given application and data set
characteristics, and (iii) designing new scalable PCA algorithms.
","[{""version"":""v1"",""created"":""Tue, 17 Mar 2015 20:38:15 GMT""},{""version"":""v2"",""created"":""Wed, 13 May 2015 12:05:02 GMT""}]","2015-05-14"
"1503.05215","Adrian Raftery","Hana \v{S}ev\v{c}\'ikov\'a, Nan Li, Vladim\'ira Kantorov\'a, Patrick
  Gerland, Adrian E. Raftery","Age-Specific Mortality and Fertility Rates for Probabilistic Population
  Projections",,,,,"stat.AP","http://arxiv.org/licenses/nonexclusive-distrib/1.0/","  The United Nations released official probabilistic population projections
(PPP) for all countries for the first time in July 2014. These were obtained by
projecting the period total fertility rate (TFR) and life expectancy at birth
($e_0$) using Bayesian hierarchical models, yielding a large set of future
trajectories of TFR and $e_0$ for all countries and future time periods to
2100, sampled from their joint predictive distribution. Each trajectory was
then converted to age-specific mortality and fertility rates, and population
was projected using the cohort-component method. This yielded a large set of
trajectories of future age- and sex-specific population counts and vital rates
for all countries. In this paper we describe the methodology used for deriving
the age-specific mortality and fertility rates in the 2014 PPP, we identify
limitations of these methods, and we propose several methodological
improvements to overcome them. The methods presented in this paper are
implemented in the publicly available bayesPop R package.
","[{""version"":""v1"",""created"":""Tue, 17 Mar 2015 20:47:30 GMT""}]","2016-08-08"
