"1503.05362","Paula Alvarez Cartelle","LHCb collaboration: R. Aaij, B. Adeva, M. Adinolfi, A. Affolder, Z.
  Ajaltouni, S. Akar, J. Albrecht, F. Alessio, M. Alexander, S. Ali, G.
  Alkhazov, P. Alvarez Cartelle, A.A. Alves Jr, S. Amato, S. Amerio, Y. Amhis,
  L. An, L. Anderlini, J. Anderson, R. Andreassen, M. Andreotti, J.E. Andrews,
  R.B. Appleby, O. Aquines Gutierrez, F. Archilli, A. Artamonov, M. Artuso, E.
  Aslanides, G. Auriemma, M. Baalouch, S. Bachmann, J.J. Back, A. Badalov, C.
  Baesso, W. Baldini, R.J. Barlow, C. Barschel, S. Barsuk, W. Barter, V.
  Batozskaya, V. Battista, A. Bay, L. Beaucourt, J. Beddow, F. Bedeschi, I.
  Bediaga, L.J. Bel, S. Belogurov, I. Belyaev, E. Ben-Haim, G. Bencivenni, S.
  Benson, J. Benton, A. Berezhnoy, R. Bernet, A. Bertolin, M.-O. Bettler, M.
  van Beuzekom, A. Bien, S. Bifani, T. Bird, A. Bizzeti, T. Blake, F. Blanc, J.
  Blouw, S. Blusk, V. Bocci, A. Bondar, N. Bondar, W. Bonivento, S. Borghi, A.
  Borgia, M. Borsato, T.J.V. Bowcock, E. Bowen, C. Bozzi, D. Brett, M. Britsch,
  T. Britton, J. Brodzicka, N.H. Brook, A. Bursche, J. Buytaert, S. Cadeddu, R.
  Calabrese, M. Calvi, M. Calvo Gomez, P. Campana, D. Campora Perez, L.
  Capriotti, A. Carbone, G. Carboni, R. Cardinale, A. Cardini, P. Carniti, L.
  Carson, K. Carvalho Akiba, R. Casanova Mohr, G. Casse, L. Cassina, L.
  Castillo Garcia, M. Cattaneo, Ch. Cauet, G. Cavallero, R. Cenci, M. Charles,
  Ph. Charpentier, M. Chefdeville, S. Chen, S.-F. Cheung, N. Chiapolini, M.
  Chrzaszcz, X. Cid Vidal, G. Ciezarek, P.E.L. Clarke, M. Clemencic, H.V.
  Cliff, J. Closier, V. Coco, J. Cogan, E. Cogneras, V. Cogoni, L. Cojocariu,
  G. Collazuol, P. Collins, A. Comerma-Montells, A. Contu, A. Cook, M. Coombes,
  S. Coquereau, G. Corti, M. Corvo, I. Counts, B. Couturier, G.A. Cowan, D.C.
  Craik, A.C. Crocombe, M. Cruz Torres, S. Cunliffe, R. Currie, C. D'Ambrosio,
  J. Dalseno, P. David, P.N.Y. David, A. Davis, K. De Bruyn, S. De Capua, M. De
  Cian, J.M. De Miranda, L. De Paula, W. De Silva, P. De Simone, C.-T. Dean, D.
  Decamp, M. Deckenhoff, L. Del Buono, N. D\'el\'eage, D. Derkach, O.
  Deschamps, F. Dettori, B. Dey, A. Di Canto, F. Di Ruscio, H. Dijkstra, S.
  Donleavy, F. Dordei, M. Dorigo, A. Dosil Su\'arez, D. Dossett, A. Dovbnya, K.
  Dreimanis, G. Dujany, F. Dupertuis, P. Durante, R. Dzhelyadin, A. Dziurda, A.
  Dzyuba, S. Easo, U. Egede, V. Egorychev, S. Eidelman, S. Eisenhardt, U.
  Eitschberger, R. Ekelhof, L. Eklund, I. El Rifai, Ch. Elsasser, S. Ely, S.
  Esen, H.M. Evans, T. Evans, A. Falabella, C. F\""arber, C. Farinelli, N.
  Farley, S. Farry, R. Fay, D. Ferguson, V. Fernandez Albor, F. Ferreira
  Rodrigues, M. Ferro-Luzzi, S. Filippov, M. Fiore, M. Fiorini, M. Firlej, C.
  Fitzpatrick, T. Fiutowski, P. Fol, M. Fontana, F. Fontanelli, R. Forty, O.
  Francisco, M. Frank, C. Frei, M. Frosini, J. Fu, E. Furfaro, A. Gallas
  Torreira, D. Galli, S. Gallorini, S. Gambetta, M. Gandelman, P. Gandini, Y.
  Gao, J. Garc\'ia Pardi\~nas, J. Garofoli, J. Garra Tico, L. Garrido, D.
  Gascon, C. Gaspar, U. Gastaldi, R. Gauld, L. Gavardi, G. Gazzoni, A. Geraci,
  E. Gersabeck, M. Gersabeck, T. Gershon, Ph. Ghez, A. Gianelle, S. Gian\`i, V.
  Gibson, L. Giubega, V.V. Gligorov, C. G\""obel, D. Golubkov, A. Golutvin, A.
  Gomes, C. Gotti, M. Grabalosa G\'andara, R. Graciani Diaz, L.A. Granado
  Cardoso, E. Graug\'es, E. Graverini, G. Graziani, A. Grecu, E. Greening, S.
  Gregson, P. Griffith, L. Grillo, O. Gr\""unberg, B. Gui, E. Gushchin, Yu. Guz,
  T. Gys, C. Hadjivasiliou, G. Haefeli, C. Haen, S.C. Haines, S. Hall, B.
  Hamilton, T. Hampson, X. Han, S. Hansmann-Menzemer, N. Harnew, S.T. Harnew,
  J. Harrison, J. He, T. Head, V. Heijne, K. Hennessy, P. Henrard, L. Henry,
  J.A. Hernando Morata, E. van Herwijnen, M. He\ss, A. Hicheur, D. Hill, M.
  Hoballah, C. Hombach, W. Hulsbergen, T. Humair, N. Hussain, D. Hutchcroft, D.
  Hynds, M. Idzik, P. Ilten, R. Jacobsson, A. Jaeger, J. Jalocha, E. Jans, A.
  Jawahery, F. Jing, M. John, D. Johnson, C.R. Jones, C. Joram, B. Jost, N.
  Jurik, S. Kandybei, W. Kanso, M. Karacson, T.M. Karbach, S. Karodia, M.
  Kelsey, I.R. Kenyon, M. Kenzie, T. Ketel, B. Khanji, C. Khurewathanakul, S.
  Klaver, K. Klimaszewski, O. Kochebina, M. Kolpin, I. Komarov, R.F. Koopman,
  P. Koppenburg, M. Korolev, L. Kravchuk, K. Kreplin, M. Kreps, G. Krocker, P.
  Krokovny, F. Kruse, W. Kucewicz, M. Kucharczyk, V. Kudryavtsev, K. Kurek, T.
  Kvaratskheliya, V.N. La Thi, D. Lacarrere, G. Lafferty, A. Lai, D. Lambert,
  R.W. Lambert, G. Lanfranchi, C. Langenbruch, B. Langhans, T. Latham, C.
  Lazzeroni, R. Le Gac, J. van Leerdam, J.-P. Lees, R. Lef\`evre, A. Leflat, J.
  Lefran\c{c}ois, O. Leroy, T. Lesiak, B. Leverington, Y. Li, T. Likhomanenko,
  M. Liles, R. Lindner, C. Linn, F. Lionetto, B. Liu, S. Lohn, I. Longstaff,
  J.H. Lopes, P. Lowdon, D. Lucchesi, H. Luo, A. Lupato, E. Luppi, O. Lupton,
  F. Machefert, I.V. Machikhiliyan, F. Maciuc, O. Maev, S. Malde, A. Malinin,
  G. Manca, G. Mancinelli, P. Manning, A. Mapelli, J. Maratas, J.F. Marchand,
  U. Marconi, C. Marin Benito, P. Marino, R. M\""arki, J. Marks, G. Martellotti,
  M. Martinelli, D. Martinez Santos, F. Martinez Vidal, D. Martins Tostes, A.
  Massafferri, R. Matev, Z. Mathe, C. Matteuzzi, A. Mauri, B. Maurin, A.
  Mazurov, M. McCann, J. McCarthy, A. McNab, R. McNulty, B. McSkelly, B.
  Meadows, F. Meier, M. Meissner, M. Merk, D.A. Milanes, M.-N. Minard, J.
  Molina Rodriguez, S. Monteil, M. Morandin, P. Morawski, A. Mord\`a, M.J.
  Morello, J. Moron, A.-B. Morris, R. Mountain, F. Muheim, K. M\""uller, M.
  Mussini, B. Muster, P. Naik, T. Nakada, R. Nandakumar, I. Nasteva, M.
  Needham, N. Neri, S. Neubert, N. Neufeld, M. Neuner, A.D. Nguyen, T.D.
  Nguyen, C. Nguyen-Mau, M. Nicol, V. Niess, R. Niet, N. Nikitin, T. Nikodem,
  A. Novoselov, D.P. O'Hanlon, A. Oblakowska-Mucha, V. Obraztsov, S. Ogilvy, O.
  Okhrimenko, R. Oldeman, C.J.G. Onderwater, B. Osorio Rodrigues, J.M. Otalora
  Goicochea, A. Otto, P. Owen, A. Oyanguren, B.K. Pal, A. Palano, F. Palombo,
  M. Palutan, J. Panman, A. Papanestis, M. Pappagallo, L.L. Pappalardo, C.
  Parkes, C.J. Parkinson, G. Passaleva, G.D. Patel, M. Patel, C. Patrignani, A.
  Pearce, A. Pellegrino, G. Penso, M. Pepe Altarelli, S. Perazzini, P. Perret,
  L. Pescatore, K. Petridis, A. Petrolini, E. Picatoste Olloqui, B. Pietrzyk,
  T. Pila\v{r}, D. Pinci, A. Pistone, S. Playfer, M. Plo Casasus, F. Polci, A.
  Poluektov, I. Polyakov, E. Polycarpo, A. Popov, D. Popov, B. Popovici, C.
  Potterat, E. Price, J.D. Price, J. Prisciandaro, A. Pritchard, C. Prouve, V.
  Pugatch, A. Puig Navarro, G. Punzi, W. Qian, R. Quagliani, B. Rachwal, J.H.
  Rademacker, B. Rakotomiaramanana, M. Rama, M.S. Rangel, I. Raniuk, N.
  Rauschmayr, G. Raven, F. Redi, S. Reichert, M.M. Reid, A.C. dos Reis, S.
  Ricciardi, S. Richards, M. Rihl, K. Rinnert, V. Rives Molina, P. Robbe, A.B.
  Rodrigues, E. Rodrigues, P. Rodriguez Perez, S. Roiser, V. Romanovsky, A.
  Romero Vidal, M. Rotondo, J. Rouvinet, T. Ruf, H. Ruiz, P. Ruiz Valls, J.J.
  Saborido Silva, N. Sagidova, P. Sail, B. Saitta, V. Salustino Guimaraes, C.
  Sanchez Mayordomo, B. Sanmartin Sedes, R. Santacesaria, C. Santamarina Rios,
  E. Santovetti, A. Sarti, C. Satriano, A. Satta, D.M. Saunders, D. Savrina, M.
  Schiller, H. Schindler, M. Schlupp, M. Schmelling, B. Schmidt, O. Schneider,
  A. Schopper, M.-H. Schune, R. Schwemmer, B. Sciascia, A. Sciubba, A.
  Semennikov, I. Sepp, N. Serra, J. Serrano, L. Sestini, P. Seyfert, M.
  Shapkin, I. Shapoval, Y. Shcheglov, T. Shears, L. Shekhtman, V. Shevchenko,
  A. Shires, R. Silva Coutinho, G. Simi, M. Sirendi, N. Skidmore, I.
  Skillicorn, T. Skwarnicki, N.A. Smith, E. Smith, E. Smith, J. Smith, M.
  Smith, H. Snoek, M.D. Sokoloff, F.J.P. Soler, F. Soomro, D. Souza, B. Souza
  De Paula, B. Spaan, P. Spradlin, S. Sridharan, F. Stagni, M. Stahl, S. Stahl,
  O. Steinkamp, O. Stenyakin, F. Sterpka, S. Stevenson, S. Stoica, S. Stone, B.
  Storaci, S. Stracka, M. Straticiuc, U. Straumann, R. Stroili, L. Sun, W.
  Sutcliffe, K. Swientek, S. Swientek, V. Syropoulos, M. Szczekowski, P.
  Szczypka, T. Szumlak, S. T'Jampens, M. Teklishyn, G. Tellarini, F. Teubert,
  C. Thomas, E. Thomas, J. van Tilburg, V. Tisserand, M. Tobin, J. Todd, S.
  Tolk, L. Tomassetti, D. Tonelli, S. Topp-Joergensen, N. Torr, E. Tournefier,
  S. Tourneur, K. Trabelsi, M.T. Tran, M. Tresch, A. Trisovic, A.
  Tsaregorodtsev, P. Tsopelas, N. Tuning, M. Ubeda Garcia, A. Ukleja, A.
  Ustyuzhanin, U. Uwer, C. Vacca, V. Vagnoni, G. Valenti, A. Vallier, R.
  Vazquez Gomez, P. Vazquez Regueiro, C. V\'azquez Sierra, S. Vecchi, J.J.
  Velthuis, M. Veltri, G. Veneziano, M. Vesterinen, J.V. Viana Barbosa, B.
  Viaud, D. Vieira, M. Vieites Diaz, X. Vilasis-Cardona, A. Vollhardt, D.
  Volyanskyy, D. Voong, A. Vorobyev, V. Vorobyev, C. Vo\ss, J.A. de Vries, R.
  Waldi, C. Wallace, R. Wallace, J. Walsh, S. Wandernoth, J. Wang, D.R. Ward,
  N.K. Watson, D. Websdale, M. Whitehead, D. Wiedner, G. Wilkinson, M.
  Wilkinson, M.P. Williams, M. Williams, H.W. Wilschut, F.F. Wilson, J.
  Wimberley, J. Wishahi, W. Wislicki, M. Witek, G. Wormser, S.A. Wotton, S.
  Wright, K. Wyllie, Y. Xie, Z. Xing, Z. Xu, Z. Yang, X. Yuan, O. Yushchenko,
  M. Zangoli, M. Zavertyaev, L. Zhang, W.C. Zhang, Y. Zhang, A. Zhelezov, A.
  Zhokhov, L. Zhong","Measurement of $CP$ asymmetries and polarisation fractions in $B_s^0
  \rightarrow K^{*0}\bar{K}{}^{*0}$ decays",,"JHEP 07 (2015) 166","10.1007/JHEP07(2015)166","LHCb-PAPER-2014-068, CERN-PH-EP-2015-058","hep-ex","http://creativecommons.org/licenses/by/4.0/","  An angular analysis of the decay $B_s^0 \rightarrow K^{*0}\bar{K}{}^{*0}$ is
performed using $pp$ collisions corresponding to an integrated luminosity of
$1.0$ ${fb}^{-1}$ collected by the LHCb experiment at a centre-of-mass energy
$\sqrt{s} = 7$ TeV. A combined angular and mass analysis separates six helicity
amplitudes and allows the measurement of the longitudinal polarisation fraction
$f_L = 0.201 \pm 0.057 {(stat.)} \pm 0.040{(syst.)}$ for the $B_s^0 \rightarrow
K^*(892)^0 \bar{K}{}^*(892)^0$ decay. A large scalar contribution from the
$K^{*}_{0}(1430)$ and $K^{*}_{0}(800)$ resonances is found, allowing the
determination of additional $CP$ asymmetries. Triple product and direct $CP$
asymmetries are determined to be compatible with the Standard Model
expectations. The branching fraction $\mathcal{B}(B_s^0 \rightarrow K^*(892)^0
\bar{K}{}^*(892)^0)$ is measured to be $(10.8 \pm 2.1 {\ \rm (stat.)} \pm 1.4
{\ \rm (syst.)} \pm 0.6 \ (f_d/f_s) ) \times 10^{-6}$.
","[{""version"":""v1"",""created"":""Wed, 18 Mar 2015 12:05:03 GMT""},{""version"":""v2"",""created"":""Thu, 19 Mar 2015 20:54:32 GMT""},{""version"":""v3"",""created"":""Mon, 10 Aug 2015 16:41:56 GMT""}]","2016-08-10"
"1503.05363","Luka Leskovec","C.B. Lang, Luka Leskovec, Daniel Mohler, Sasa Prelovsek","Vector and scalar charmonium resonances with lattice QCD","24 pages, 8 figures, updated to match published version","JHEP 09 (2015) 089","10.1007/JHEP09(2015)089","FERMILAB-PUB-15-084-T, JLAB-THY-15-2022","hep-lat hep-ph","http://creativecommons.org/licenses/by/4.0/","  We perform an exploratory lattice QCD simulation of $D \bar D$ scattering,
aimed at determining the masses as well as the decay widths of charmonium
resonances above open charm threshold. Neglecting coupling to other channels,
the resulting phase shift for $D \bar D$ scattering in p-wave yields the
well-known vector resonance $\psi(3770)$. For $m_\pi = 156$ MeV, the extracted
resonance mass and the decay width agree with experiment within large
statistical uncertainty. The scalar charmonium resonances present a puzzle,
since only the ground state $\chi_{c0}(1P)$ is well understood, while there is
no commonly accepted candidate for its first excitation. We simulate $D \bar D$
scattering in s-wave in order to shed light on this puzzle. The resulting phase
shift supports the existence of a yet-unobserved narrow resonance with a mass
slightly below 4 GeV. A scenario with this narrow resonance and a pole at
$\chi_{c0}(1P)$ agrees with the energy-dependence of our phase shift. Further
lattice QCD simulations and experimental efforts are needed to resolve the
puzzle of the excited scalar charmonia.
","[{""version"":""v1"",""created"":""Wed, 18 Mar 2015 12:10:33 GMT""},{""version"":""v2"",""created"":""Mon, 14 Sep 2015 17:52:21 GMT""}]","2016-01-06"
"1503.05364","Ana Agore","A.L. Agore, G. Militaru","Hochschild products and global non-abelian cohomology for algebras.
  Applications","Continues arXiv:1308.5559, arXiv:1309.1986 and arXiv:1305.6022;
  restates preliminaries and definitions for sake of clarity. Final version to
  appear in J. Pure Appl. Algebra","J. Pure Appl. Algebra 221 (2017), 366-392",,,"math.RA","http://arxiv.org/licenses/nonexclusive-distrib/1.0/","  Let $A$ be a unital associative algebra over a field $k$, $E$ a vector space
and $\pi : E \to A$ a surjective linear map with $V = {\rm Ker} (\pi)$. All
algebra structures on $E$ such that $\pi : E \to A$ becomes an algebra map are
described and classified by an explicitly constructed global cohomological type
object ${\mathbb G} {\mathbb H}^{2} \, (A, \, V)$. Any such algebra is
isomorphic to a Hochschild product $A \star V$, an algebra introduced as a
generalization of a classical construction. We prove that ${\mathbb G} {\mathbb
H}^{2} \, (A, \, V)$ is the coproduct of all non-abelian cohomologies ${\mathbb
H}^{2} \, \, (A, \, (V, \cdot))$. The key object ${\mathbb G} {\mathbb H}^{2}
\, (A, \, k)$ responsible for the classification of all co-flag algebras is
computed. All Hochschild products $A \star k$ are also classified and the
automorphism groups ${\rm Aut}_{\rm Alg} (A \star k)$ are fully determined as
subgroups of a semidirect product $A^* \, \ltimes \bigl(k^* \times {\rm
Aut}_{\rm Alg} (A) \bigl)$ of groups. Several examples are given as well as
applications to the theory of supersolvable coalgebras or Poisson algebras. In
particular, for a given Poisson algebra $P$, all Poisson algebras having a
Poisson algebra surjection on $P$ with a $1$-dimensional kernel are described
and classified.
","[{""version"":""v1"",""created"":""Wed, 18 Mar 2015 12:10:43 GMT""},{""version"":""v2"",""created"":""Mon, 13 Jun 2016 12:15:29 GMT""}]","2017-01-27"
"1503.05365","Bhanukiran Perabathini","Bhanukiran Perabathini, Ejder Ba\c{s}tu\u{g}, Marios Kountouris,
  M\'erouane Debbah and Alberto Conte","Caching at the Edge: a Green Perspective for 5G Networks","to be presented at IEEE International Conference on Communications
  (ICC), London, UK, 2015",,"10.1109/ICCW.2015.7247608",,"cs.IT cs.NI math.IT","http://arxiv.org/licenses/nonexclusive-distrib/1.0/","  Endowed with context-awareness and proactive capabilities, caching users'
content locally at the edge of the network is able to cope with increasing data
traffic demand in 5G wireless networks. In this work, we focus on the energy
consumption aspects of cache-enabled wireless cellular networks, specifically
in terms of area power consumption (APC) and energy efficiency (EE). We assume
that both base stations (BSs) and mobile users are distributed according to
homogeneous Poisson point processes (PPPs) and we introduce a detailed power
model that takes into account caching. We study the conditions under which the
area power consumption is minimized with respect to BS transmit power, while
ensuring a certain quality of service (QoS) in terms of coverage probability.
Furthermore, we provide the optimal BS transmit power that maximizes the area
spectral efficiency per unit total power spent. The main takeaway of this paper
is that caching seems to be an energy efficient solution.
","[{""version"":""v1"",""created"":""Wed, 18 Mar 2015 12:17:12 GMT""}]","2016-11-15"
"1503.05366","Khadija Benaija","Khadija BENAIJA, Laila KJIRI","Project portfolio selection: Multi-criteria analysis and interactions
  between projects",,"K. Benaija, and L. Kjiri, Project portfolio selection:
  Multi-criteria analysis and interactions between projects. International
  Journal of Computer Science Issues, Vol. 11, Issue 6, 2014, pp. 134-143",,,"cs.SE","http://arxiv.org/licenses/nonexclusive-distrib/1.0/","  In the project portfolio management, the project selection phase presents the
greatest interest. In this article, we focus on this important phase by
proposing a new method of projects selection consisting of several steps. We
propose as a first step, a classification of projects based on the three most
important criteria namely the value maximization, risk minimization and
strategic alignment. The second step is building alternatives portfolio by the
portfolio managers taking into account the classification of projects already
completed in the first step. The third and final step enables the
identification of the alternative portfolio to consider the contribution of
projects to achieve the organization objectives as well as interactions between
projects.
","[{""version"":""v1"",""created"":""Wed, 18 Mar 2015 12:19:06 GMT""}]","2015-03-19"
"1503.05367","Zhiguo Ding","Zhiguo Ding, Fumiyuki Adachi and H. Vincent Poor","The Application of MIMO to Non-Orthogonal Multiple Access",,,,,"cs.IT math.IT","http://arxiv.org/licenses/nonexclusive-distrib/1.0/","  This paper considers the application of multiple-input multiple-output (MIMO)
techniques to non-orthogonal multiple access (NOMA) systems. A new design of
precoding and detection matrices for MIMO-NOMA is proposed and its performance
is analyzed for the case with a fixed set of power allocation coefficients. To
further improve the performance gap between MIMO-NOMA and conventional
orthogonal multiple access schemes, user pairing is applied to NOMA and its
impact on the system performance is characterized. More sophisticated choices
of power allocation coefficients are also proposed to meet various quality of
service requirements. Finally computer simulation results are provided to
facilitate the performance evaluation of MIMO-NOMA and also demonstrate the
accuracy of the developed analytical results.
","[{""version"":""v1"",""created"":""Wed, 18 Mar 2015 12:19:34 GMT""}]","2015-03-19"
"1503.05368","Hans J. Deeg","Hans J. Deeg (1 and 2) ((1) Instituto de Astrof\'isica de Canarias (2)
  Universidad de La Laguna, Tenerife, Spain)","Period, epoch and prediction errors of ephemeris from continuous sets of
  timing measurements","Astronomy and Astrophysics, accepted","A&A 578, A17 (2015)","10.1051/0004-6361/201425368",,"astro-ph.IM astro-ph.EP","http://arxiv.org/licenses/nonexclusive-distrib/1.0/","  Space missions such as Kepler and CoRoT have led to large numbers of eclipse
or transit measurements in nearly continuous time series. This paper shows how
to obtain the period error in such measurements from a basic linear
least-squares fit, and how to correctly derive the timing error in the
prediction of future transit or eclipse events. Assuming strict periodicity, a
formula for the period error of such time series is derived: sigma_P = sigma_T
(12/( N^3-N))^0.5, where sigma_P is the period error; sigma_T the timing error
of a single measurement and N the number of measurements. Relative to the
iterative method for period error estimation by Mighell & Plavchan (2013), this
much simpler formula leads to smaller period errors, whose correctness has been
verified through simulations. For the prediction of times of future periodic
events, the usual linear ephemeris where epoch errors are quoted for the first
time measurement, are prone to overestimation of the error of that prediction.
This may be avoided by a correction for the duration of the time series. An
alternative is the derivation of ephemerides whose reference epoch and epoch
error are given for the centre of the time series. For long continuous or
near-continuous time series whose acquisition is completed, such central epochs
should be the preferred way for the quotation of linear ephemerides. While this
work was motivated from the analysis of eclipse timing measures in space-based
light curves, it should be applicable to any other problem with an
uninterrupted sequence of discrete timings for which the determination of a
zero point, of a constant period and of the associated errors is needed.
","[{""version"":""v1"",""created"":""Wed, 18 Mar 2015 12:24:32 GMT""}]","2015-05-27"
"1503.05369","Matthew R. Bate","Matthew R. Bate and Eric R. Keto","Combining radiative transfer and diffuse interstellar medium physics to
  model star formation","Accepted for publication in MNRAS, 25 pages, 22 figures",,"10.1093/mnras/stv451",,"astro-ph.SR astro-ph.GA","http://arxiv.org/licenses/nonexclusive-distrib/1.0/","  We present a method for modelling star-forming clouds that combines two
different models of the thermal evolution of the interstellar medium (ISM). In
the combined model, where the densities are low enough that at least some part
of the spectrum is optically thin, a model of the thermodynamics of the diffuse
ISM is more significant in setting the temperatures. Where the densities are
high enough to be optically thick across the spectrum, a model of flux limited
diffusion is more appropriate. Previous methods either model the low-density
interstellar medium and ignore the thermal behaviour at high densities (e.g.
inside collapsing molecular cloud cores), or model the thermal behaviour near
protostars but assume a fixed background temperature (e.g. approximately 10 K)
on large-scales. Our new method treats both regimes. It also captures the
different thermal evolution of the gas, dust, and radiation separately. We
compare our results with those from the literature, and investigate the
dependence of the thermal behaviour of the gas on the various model parameters.
This new method should allow us to model the ISM across a wide range of
densities and, thus, develop a more complete and consistent understanding of
the role of thermodynamics in the star formation process.
","[{""version"":""v1"",""created"":""Wed, 18 Mar 2015 12:28:29 GMT""}]","2015-03-19"
"1503.05370","Iu. Ganychenko","Iu. Ganychenko, A. Kulik","Rates of approximation of nonsmooth integral-type functionals of Markov
  processes","Published at http://dx.doi.org/10.15559/vmsta-2014.12 in the Modern
  Stochastics: Theory and Applications (https://www.i-journals.org/vtxpp/VMSTA)
  by VTeX (http://www.vtex.lt/)","Modern Stochastics: Theory and Applications 2014, Vol. 1, 117-126","10.15559/vmsta-2014.12","VTeX-VMSTA-VMSTA12","math.PR","http://arxiv.org/licenses/nonexclusive-distrib/1.0/","  We provide strong $L_p$-rates of approximation of nonsmooth integral-type
functionals of Markov processes by integral sums. Our approach is, in a sense,
process insensitive and is based on a modification of some well-developed
estimates from the theory of continuous additive functionals of Markov
processes.
","[{""version"":""v1"",""created"":""Wed, 18 Mar 2015 12:40:30 GMT""}]","2015-03-19"
"1503.05371","Vadym Radchenko","Vadym Radchenko","Heat equation with general stochastic measure colored in time","Published at http://dx.doi.org/10.15559/14-VMSTA14 in the Modern
  Stochastics: Theory and Applications (https://www.i-journals.org/vtxpp/VMSTA)
  by VTeX (http://www.vtex.lt/)","Modern Stochastics: Theory and Applications 2014, Vol. 1, 129-138","10.15559/14-VMSTA14","VTeX-VMSTA-VMSTA14","math.PR","http://arxiv.org/licenses/nonexclusive-distrib/1.0/","  A stochastic heat equation on $[0,T]\times{\mathbb{R}}$ driven by a general
stochastic measure $d\mu(t)$ is investigated in this paper. For the integrator
$\mu$, we assume the $\sigma$-additivity in probability only. The existence,
uniqueness, and H\""{o}lder regularity of the solution are proved.
","[{""version"":""v1"",""created"":""Wed, 18 Mar 2015 12:46:24 GMT""}]","2015-03-19"
"1503.05372","Jianbo Gao","Jian-Bo Gao, Yun-Tao Liu, Dong-Feng Chen","A new method for analyzing collimation angle of neutron Soller
  collimator",,,"10.1088/1674-1137/40/1/016003",,"physics.ins-det nucl-ex","http://arxiv.org/licenses/nonexclusive-distrib/1.0/","  A new method for analyzing collimation angle of neutron Soller collimator is
described. Gaussian distribution formula is used to define the angle
distribution function of neutron source and neutron transmission function of
Soller collimator. A relationship between FWHM of collimator rocking curve and
collimation angle is derived.
","[{""version"":""v1"",""created"":""Wed, 18 Mar 2015 12:47:02 GMT""},{""version"":""v2"",""created"":""Wed, 1 Jul 2015 07:11:22 GMT""}]","2016-08-03"
"1503.05373","Ma Yong-Liang","Yong-Liang Ma, Masayasu Harada","Doubly heavy baryons with chiral partner structure","4 pages",,"10.1016/j.physletb.2015.07.046",,"hep-ph hep-ex","http://arxiv.org/licenses/nonexclusive-distrib/1.0/","  The spectrum and dominant strong decay properties of the doubly heavy baryons
are revisited by using a chiral effective model with chiral partner structure.
By regarding the doubly heavy baryons in the ground states and light angular
momentum $j_l = 1/2$ sector of the first orbitally excited states as chiral
partners to each other, we estimate the mass splitting of the chiral partners
which arises from the spontaneous breaking of chiral symmetry to be about $430$
MeV for baryons including an unflavored light quark and about $350$ MeV for
that including a strange quark. We point out that, similar to the heavy-light
meson sector, the intermultiplet decay from a baryon with negative parity to
its chiral partner and a pion is determined by the mass splitting throught the
generalized Goldberger-Treiman relation. Furthermore, the isospin violating
decay of $\Omega_{cc}$ baryon, $((1/2)^-, (3/2)^-)_s \to ((1/2)^+, (3/2)^+)_s +
\pi^0$ through the $\eta$-$\pi^0$ mixing is the dominant decay channel of the
doubly heavy baryons including a strange quark.
","[{""version"":""v1"",""created"":""Wed, 18 Mar 2015 12:48:23 GMT""}]","2015-07-29"
