"1503.05290","Yuguang Fan","Yuguang Fan","Convergence of Trimmed L\'evy Processes to Trimmed Stable Random
  Variables at $0$",,,"10.1016/j.spa.2015.04.005",,"math.PR","http://arxiv.org/licenses/nonexclusive-distrib/1.0/","  Let $^{(r,s)}X_t$ be the L\'evy process $X_t$ with the $r$ largest jumps and
$s$ smallest jumps up till time $t$ deleted and let $^{(r)}\tilde X_t$ be $X_t$
with the $r$ largest jumps in modulus up till time $t$ deleted. We show that
$({}^{(r,s)}X_t - a_t)/b_t$ or $({}^{(r)}\tilde X_t - a_t)/b_t$ converges to a
proper nondegenerate nonnormal limit distribution as $t \downarrow 0$ if and
only if $(X_t-a_t)/b_t $ converges as $t \downarrow 0$ to an $\alpha$-stable
random variable, with $ 0 <\alpha<2 $, where $a_t$ and $b_t>0$ are non
stochastic functions in $t$. Together with the asymptotic normality case
treated in \cite{fan2014an}, this completes the domain of attraction problem
for trimmed L\'evy processes at $0$.
","[{""version"":""v1"",""created"":""Wed, 18 Mar 2015 06:21:58 GMT""}]","2015-11-23"
"1503.05291","Mohammad Eghbali-Arani","M. Eghbali-Arani, H. Yavari, M. A. Shahzamanian, V. Giovannetti, and
  Sh. Barzanjeh","Generating quantum discord between two distant Bose-Einstein condensates
  with Bell-like detection",,"JOSA B, Vol. 32, Issue 5, pp. 798-804 (2015)","10.1364/JOSAB.32.000798",,"quant-ph","http://arxiv.org/licenses/nonexclusive-distrib/1.0/","  We propose a technique that enables the creation of quantum discord between
two distant nodes, each containing a cavity consist of the Bose-Einstein
condensate, by applying a non-ideal Bell-like detection on the output modes of
optical cavities. We find the covariance matrix of the system after the
non-ideal Bell-like detection, showing explicitly that one enables manipulation
of the quantum correlations, and particularly quantum discord, between remote
Bose-Einstein condensates. We also find that the non-ideal Bell-like detection
can create entanglement between distant Bose-Einstein condensates at the two
remote sites
","[{""version"":""v1"",""created"":""Wed, 18 Mar 2015 07:01:40 GMT""},{""version"":""v2"",""created"":""Tue, 24 Mar 2015 10:12:46 GMT""}]","2015-04-13"
"1503.05292","Yann Ponty","Ashok Rajaraman, Cedric Chauve, Yann Ponty (INRIA Saclay Ile de
  France, LIX)","Assessing the robustness of parsimonious predictions for gene
  neighborhoods from reconciled phylogenies","Accepted, to appear in ISBRA - 11th International Symposium on
  Bioinformatics Research and Applications - 2015, Jun 2015, Norfolk, Virginia,
  United States",,,,"q-bio.QM q-bio.PE","http://arxiv.org/licenses/nonexclusive-distrib/1.0/","  The availability of a large number of assembled genomes opens the way to
study the evolution of syntenic character within a phylogenetic context. The
DeCo algorithm, recently introduced by B{\'e}rard et al. allows the computation
of parsimonious evolutionary scenarios for gene adjacencies, from pairs of
reconciled gene trees. Following the approach pioneered by Sturmfels and
Pachter, we describe how to modify the DeCo dynamic programming algorithm to
identify classes of cost schemes that generates similar parsimonious
evolutionary scenarios for gene adjacencies, as well as the robustness to
changes to the cost scheme of evolutionary events of the presence or absence of
specific ancestral gene adjacencies. We apply our method to six thousands
mammalian gene families, and show that computing the robustness to changes to
cost schemes provides new and interesting insights on the evolution of gene
adjacencies and the DeCo model.
","[{""version"":""v1"",""created"":""Wed, 18 Mar 2015 07:12:48 GMT""},{""version"":""v2"",""created"":""Thu, 19 Mar 2015 17:52:20 GMT""}]","2015-03-20"
"1503.05293","Michael Moeller","Martin Burger, Lina Eckardt, Guy Gilboa, Michael Moeller","Spectral Representations of One-Homogeneous Functionals",,,,,"math.NA math.SP","http://arxiv.org/licenses/nonexclusive-distrib/1.0/","  This paper discusses a generalization of spectral representations related to
convex one-homogeneous regularization functionals, e.g. total variation or
$\ell^1$-norms. Those functionals serve as a substitute for a Hilbert space
structure (and the related norm) in classical linear spectral transforms, e.g.
Fourier and wavelet analysis. We discuss three meaningful definitions of
spectral representations by scale space and variational methods and prove that
(nonlinear) eigenfunctions of the regularization functionals are indeed atoms
in the spectral representation. Moreover, we verify further useful properties
related to orthogonality of the decomposition and the Parseval identity.
  The spectral transform is motivated by total variation and further developed
to higher order variants. Moreover, we show that the approach can recover
Fourier analysis as a special case using an appropriate $\ell^1$-type
functional and discuss a coupled sparsity example.
","[{""version"":""v1"",""created"":""Wed, 18 Mar 2015 07:15:04 GMT""}]","2015-03-19"
"1503.05294","Kisor Ray","Kisor Ray, Sourav Bag, Saumen Sarkar","Easy and Fast Design and Implementation of PostgreSQL based image
  handling application","05 pages, 04 figures, 02 tables, International Journal of Advanced
  Research in Computer Science and Software Engineering, Volume 5, Issue 2,
  February 2015, ISSN 2277 128X",,,,"cs.DB","http://arxiv.org/licenses/nonexclusive-distrib/1.0/","  In modern computing, RDBMS are great to store different types of data. To a
developer, one of the major objectives is to provide a very low cost and easy
to use solution to an existing problem. While commercial databases are more
easy to use along with their new as well as documented features come with
complicated licensing cost, free open source databases are not that
straightforward under many situations. This paper shows how a completely free
advanced open source RDBMS like PostgreSQL could be designed and modified to
store and retrieve high quality images in order to use them along with a
frontend application.
","[{""version"":""v1"",""created"":""Wed, 18 Mar 2015 07:23:23 GMT""}]","2015-03-19"
"1503.05295","Boris Shapiro","B.Shapiro","Problems around polynomials - the good, the bad and the ugly ...","7 pages, no figures",,,,"math.CA","http://arxiv.org/licenses/nonexclusive-distrib/1.0/","  This is a list of several open problems dealing mainly with univariate
polynomials.
","[{""version"":""v1"",""created"":""Wed, 18 Mar 2015 07:26:56 GMT""}]","2015-03-19"
"1503.05296","Omar Al-Jarrah","O. Y. Al-Jarrah, P. D. Yoo, S Muhaidat, G. K. Karagiannidis, and K.
  Taha","Efficient Machine Learning for Big Data: A Review",,,,,"cs.LG cs.AI","http://arxiv.org/licenses/nonexclusive-distrib/1.0/","  With the emerging technologies and all associated devices, it is predicted
that massive amount of data will be created in the next few years, in fact, as
much as 90% of current data were created in the last couple of years,a trend
that will continue for the foreseeable future. Sustainable computing studies
the process by which computer engineer/scientist designs computers and
associated subsystems efficiently and effectively with minimal impact on the
environment. However, current intelligent machine-learning systems are
performance driven, the focus is on the predictive/classification accuracy,
based on known properties learned from the training samples. For instance, most
machine-learning-based nonparametric models are known to require high
computational cost in order to find the global optima. With the learning task
in a large dataset, the number of hidden nodes within the network will
therefore increase significantly, which eventually leads to an exponential rise
in computational complexity. This paper thus reviews the theoretical and
experimental data-modeling literature, in large-scale data-intensive fields,
relating to: (1) model efficiency, including computational requirements in
learning, and data-intensive areas structure and design, and introduces (2) new
algorithmic approaches with the least memory requirements and processing to
minimize computational cost, while maintaining/improving its
predictive/classification accuracy and stability.
","[{""version"":""v1"",""created"":""Wed, 18 Mar 2015 07:56:12 GMT""}]","2015-03-19"
"1503.05297","Assaf Ben-Yishai","Assaf Ben-Yishai and Ofer Shayevitz","The AWGN BC with MAC Feedback: A Reduction to Noiseless Feedback via
  Interaction","Invited talk ITW 2015, Jerusalem",,,,"cs.IT math.IT","http://arxiv.org/licenses/nonexclusive-distrib/1.0/","  We consider the problem of communication over a two-user Additive White
Gaussian Noise Broadcast Channel (AWGN-BC) with an AWGN Multiple Access (MAC)
active feedback. We describe a constructive reduction from this setup to the
well-studied setup of linear-feedback coding over the AWGN-BC with noiseless
feedback (and different parameters). This reduction facilitates the design of
linear-feedback coding schemes in the (passive) noiseless feedback regime,
which can then be easily and constructively transformed into coding schemes in
the MAC feedback regime that attain the exact same rates. Our construction
introduces an element of interaction into the coding protocol, and is based on
modulo-lattice operations. As an example, we apply our method to the
Ozarow-Leung scheme, and demonstrate how MAC feedback can be used to increase
the capacity region of the AWGN-BC.
","[{""version"":""v1"",""created"":""Wed, 18 Mar 2015 08:04:21 GMT""},{""version"":""v2"",""created"":""Thu, 16 Apr 2015 06:28:00 GMT""},{""version"":""v3"",""created"":""Wed, 20 May 2015 08:05:16 GMT""}]","2015-05-21"
"1503.05298","Gemma Morral Adell","Gemma Morral and Pascal Bianchi","Distributed on-line multidimensional scaling for self-localization in
  wireless sensor networks","32 pages, 5 figures, 1 table",,,,"cs.DC cs.IT math.IT","http://arxiv.org/licenses/nonexclusive-distrib/1.0/","  The present work considers the localization problem in wireless sensor
networks formed by fixed nodes. Each node seeks to estimate its own position
based on noisy measurements of the relative distance to other nodes. In a
centralized batch mode, positions can be retrieved (up to a rigid
transformation) by applying Principal Component Analysis (PCA) on a so-called
similarity matrix built from the relative distances. In this paper, we propose
a distributed on-line algorithm allowing each node to estimate its own position
based on limited exchange of information in the network. Our framework
encompasses the case of sporadic measurements and random link failures. We
prove the consistency of our algorithm in the case of fixed sensors. Finally,
we provide numerical and experimental results from both simulated and real
data. Simulations issued to real data are conducted on a wireless sensor
network testbed.
","[{""version"":""v1"",""created"":""Wed, 18 Mar 2015 08:05:02 GMT""}]","2015-03-19"
"1503.05299","Masaaki Nagahara","Masaaki Nagahara","Discrete Signal Reconstruction by Sum of Absolute Values","IEEE Signal Processing Letters (to appear)",,"10.1109/LSP.2015.2414932",,"cs.IT math.IT math.OC","http://arxiv.org/licenses/nonexclusive-distrib/1.0/","  In this letter, we consider a problem of reconstructing an unknown discrete
signal taking values in a finite alphabet from incomplete linear measurements.
The difficulty of this problem is that the computational complexity of the
reconstruction is exponential as it is. To overcome this difficulty, we extend
the idea of compressed sensing, and propose to solve the problem by minimizing
the sum of weighted absolute values. We assume that the probability
distribution defined on an alphabet is known, and formulate the reconstruction
problem as linear programming. Examples are shown to illustrate that the
proposed method is effective.
","[{""version"":""v1"",""created"":""Wed, 18 Mar 2015 08:11:33 GMT""}]","2015-03-19"
"1503.05300","Hernando Quevedo","Hernando Quevedo and Saken Toktarbay","Generating static perfect-fluid solutions of Einstein's equations",,,"10.1063/1.4921062",,"gr-qc math-ph math.MP","http://arxiv.org/licenses/nonexclusive-distrib/1.0/","  We present a method for generating exact interior solutions of Einstein's
equations in the case of static and axially symmetric perfect-fluid spacetimes.
The method is based upon a transformation that involves the metric functions as
well as the density and pressure of the seed solution. In the limiting vacuum
case, it reduces to the Zipoy-Voorhees transformation that can be used to
generate metrics with multipole moments. All the metric functions of the new
solution can be calculated explicitly from the seed solution in a simple
manner. The physical properties of the resulting new solutions are shown to be
completely different from those of the seed solution.
","[{""version"":""v1"",""created"":""Wed, 18 Mar 2015 08:12:52 GMT""}]","2015-06-11"
"1503.05301","Julius Fergy Rabago","Jerico B. Bacani and Julius Fergy T. Rabago","On Linear Recursive Sequences with Coefficients in Arithmetic-Geometric
  Progressions","This is a preprint of a paper whose final and definite form will be
  published in Applied Mathematical Sciences, ISSN 1312-885X (print); ISSN
  1314-7552 (online)",,,,"math.NT","http://creativecommons.org/licenses/by/3.0/","  We present a certain generalization of a recent result of M. I. Cirnu on
linear recurrence relations with coefficient in progressions [2]. We provide
some interesting examples related to some well-known integer sequences, such as
Fibonacci sequence, Pell sequence, Jacobsthal sequence, and the Balancing
sequence of numbers. The paper also provides several approaches in solving the
linear recurrence relation under consideration. We end the paper by giving out
an open problem.
","[{""version"":""v1"",""created"":""Wed, 18 Mar 2015 08:15:14 GMT""}]","2015-03-19"
"1503.05302","Ting Yang","Zhen-Qing Chen and Ting Yang","Dirichlet heat kernel estimates for fractional Laplacian under non-local
  perturbation",,,,,"math.PR","http://arxiv.org/licenses/nonexclusive-distrib/1.0/","  For $d\ge 2$ and $0<\beta<\alpha<2$, consider a family of non-local operators
$\mathcal{L}^{b}=\Delta^{\alpha/2}+\mathcal{S}^{b}$ on $\mathbb{R}^d$, where $$
\mathcal{S}^{b}f(x):=\lim_{\varepsilon\to 0}\mathcal{A}(d,-\beta)\int_{ \{z\in
\mathbb{R}^d: |z|>\varepsilon\}} (f(x+z)-f(x))\frac{b(x,z)}{|z|^{d+\beta}}\,dz,
$$ and $b(x,z)$ is a bounded measurable function on
$\mathbb{R}^{d}\times\mathbb{R}^{d}$ with $b(x,z)=b(x,-z)$ for every
$x,z\in\mathbb{R}^{d}$. Here ${\cal A}(d, -\beta)$ is a normalizing constant so
that $\mathcal{S}^b=-(-\Delta)^{\beta/2}$ when $b(x, z)\equiv 1$. It was
recently shown in Chen and Wang [arXiv:1312.7594 [math.PR]] that when $b(x, z)
\geq -\frac{\mathcal{A}(d, -\alpha)} {\mathcal{A}(d, -\beta)}\, |z|^{\beta
-\alpha}$, then $\mathcal{L}^b$ admits a unique fundamental solution $p^b(t, x,
y)$ which is strictly positive and continuous. The kernel $p^b(t, x, y)$
uniquely determines a conservative Feller process $X^b$, which has strong
Feller property. The Feller process $X^b$ is also the unique solution to the
martingale problem of $(\mathcal{L}^b, \mathcal{S}(\mathbb{R}^d))$, where
$\mathcal{S}(\mathbb{R}^d)$ denotes the space of tempered functions on
$\mathbb{R}^d$. In this paper, we are concerned with the subprocess $X^{b,D}$
of $X^{b}$ killed upon leaving a bounded $C^{1,1}$ open set $D\subset
\mathbb{R}^d$. We establish explicit sharp two-sided estimates for the
transition density function of $X^{b, D}$.
","[{""version"":""v1"",""created"":""Wed, 18 Mar 2015 08:17:13 GMT""}]","2015-03-19"
"1503.05303","Walter Dambrosio","Alberto Boscaggin, Walter Dambrosio and Duccio Papini","Asymptotic and chaotic solutions of a singularly perturbed Nagumo-type
  equation",,"Nonlinearity 28 (2015) 3465-3485","10.1088/0951-7715/28/10/3465",,"math.CA math.DS","http://arxiv.org/licenses/nonexclusive-distrib/1.0/","  We deal with the singularly perturbed Nagumo-type equation $$ \epsilon^2 u''
+ u(1-u)(u-a(s)) = 0, $$ where $\epsilon > 0$ is a real parameter and $a:
\mathbb{R} \to \mathbb{R}$ is a piecewise constant function satisfying $0 <
a(s) < 1$ for all $s$. We prove the existence of chaotic, homoclinic and
heteroclinic solutions, when $\epsilon$ is small enough. We use a dynamical
systems approach, based on the Stretching Along Paths method and on the
Conley-Wazewski's method.
","[{""version"":""v1"",""created"":""Wed, 18 Mar 2015 08:27:20 GMT""}]","2015-09-02"
"1503.05304","Mikhail Braun","M.A.Braun","The inclusive jet production in the BFKL-Bartels approach with a running
  coupling introduced via bootstrap","13 pages, 6 figures, A new paragraph in the Introduction, a new
  figure in Sec. 3, results not changed",,,,"hep-ph","http://arxiv.org/licenses/nonexclusive-distrib/1.0/","  The inclusive cross-section for production of a jet with a given transverse
momentum off a heavy nucleus is derived in the BFKL framework with a running
coupling on the basis of the bootstrap relation. The cross-section depends on
the same three different coupling constants as the total cross-section unlike
the cross-section for gluon production derived in the dipole approach.
","[{""version"":""v1"",""created"":""Wed, 18 Mar 2015 08:29:49 GMT""},{""version"":""v2"",""created"":""Sun, 17 May 2015 09:01:02 GMT""}]","2015-05-19"
"1503.05305","Julius Fergy Rabago","Jerico B. Bacani and Julius Fergy T. Rabago","On Generalized Fibonacci Numbers","This is a preprint of a paper whose final and definite form will be
  published in Applied Mathematical Sciences, ISSN 1312-885X (print); ISSN
  1314-7552 (online)","Applied Mathematical Sciences, Vol. 9, 2015, no. 52, 2595 - 2607","10.12988/ams.2015.5163",,"math.NT","http://creativecommons.org/licenses/by/3.0/","  We provide a formula for the $n^{th}$ term of the $k$-generalized
Fibonacci-like number sequence using the $k$-generalized Fibonacci number or
$k$-nacci number, and by utilizing the newly derived formula, we show that the
limit of the ratio of successive terms of the sequence tends to a root of the
equation $x + x^{-k} = 2$. We then extend our results to $k$-generalized
Horadam ($k$GH) and $k$-generalized Horadam-like ($k$GHL) numbers. In dealing
with the limit of the ratio of successive terms of $k$GH and $k$GHL, a lemma
due to Z. Wu and H. Zhang [8] shall be employed. Finally, we remark that an
analogue result for $k$-periodic $k$-nary Fibonacci sequence can also be
derived.
","[{""version"":""v1"",""created"":""Wed, 18 Mar 2015 08:30:46 GMT""}]","2015-04-08"
"1503.05306","Petr Akhmetiev Mikhailovich","Petr M. Akhmetiev","Higher Helicity of Magnetic Lines and Arf-invariants",,,,,"math.GT","http://arxiv.org/licenses/nonexclusive-distrib/1.0/","  We recall the definition of the quadratic helicity invariant and of the
higher asymptotic ergodic $M$-invariant. We present a simpler new proof (in
part) that the $M$-invariant is ergodic. The $M$-invariant is a higher
invariant, this means that for the magnetic field with closed magnetic lines
the invariant is not a function of pairwise linking numbers of the magnetic
lines. This property is based of the following fact: an arithmetic residue of
the $M$-invariant for a triple of closed magnetic lines (such a triple is a
model of a link with even pairwise linking coefficients) coincides with the
Arf-invariant.
  The new results concern magnetic fields on closed 3-dimensional manifolds and
use the $M$-invariant. To make this idea precise we generalize the
Arf-invariants of classical semi-boundary links (including the Arf-Brown
invariant) and we introduce a new Arf-invariant, called the hyperquaternionic
Arf-invariant.
","[{""version"":""v1"",""created"":""Wed, 18 Mar 2015 08:32:46 GMT""},{""version"":""v2"",""created"":""Mon, 30 Mar 2015 11:26:10 GMT""}]","2015-03-31"
"1503.05307","Jerome Petri","Jerome Petri","Multipolar electromagnetic fields around neutron stars: exact vacuum
  solutions and related properties","accepted for publication in MNRAS, references added and typos
  corrected",,"10.1093/mnras/stv598",,"astro-ph.HE gr-qc","http://arxiv.org/licenses/nonexclusive-distrib/1.0/","  The magnetic field topology in the surrounding of neutron stars is one of the
key questions in pulsar magnetospheric physics. A very extensive literature
exists about the assumption of a dipolar magnetic field but very little
progress has been made in attempts to include multipolar components in a
self-consistent way. In this paper, we study the effect of multipolar
electromagnetic fields anchored in the star. We give exact analytical solutions
in closed form for any order $l$ and apply them to the retarded point
quadrupole ($l=2$), hexapole ($l=3$) and octopole ($l=4$), a generalization of
the retarded point dipole ($l=1$). We also compare the Poynting flux from each
multipole and show that the spin down luminosity depends on the ratio $R/r_{\rm
L}$, $R$ being the neutron star radius and $r_{\rm L}$ the light-cylinder
radius. Therefore the braking index also depends on $R/r_{\rm L}$. As such
multipole fields possess very different topology, most importantly smaller
length scales compared to the dipolar field, especially close to the neutron
star, we investigate the deformation of the polar caps induced by these
multipolar fields. Such fields could have a strong impact on the interpretation
of the pulsed radio emission suspected to emanate from these polar caps as well
as on the inferred geometry deduced from the high-energy light-curve fitting
and on the magnetic field strength. Discrepancies between the two-pole caustic
model and our new multipole-caustic model are emphasized with the quadrupole
field. To this respect, we demonstrate that working with only a dipole field
can be very misleading.
","[{""version"":""v1"",""created"":""Wed, 18 Mar 2015 08:36:25 GMT""},{""version"":""v2"",""created"":""Wed, 1 Apr 2015 09:09:03 GMT""}]","2015-06-24"
"1503.05308","Hendrik Eerten van","Hendrik van Eerten","Simulation and physical model based gamma-ray burst afterglow analysis","Invited contribution to Journal of High Energy Astrophysics special
  issue ""Swift: 10 years of discovery"". Replaced with expanded version matching
  JHEAP publication","2015, Journal of High Energy Astrophysics 7, 23","10.1016/j.jheap.2015.04.004",,"astro-ph.HE","http://arxiv.org/licenses/nonexclusive-distrib/1.0/","  Advances in our numerical and theoretical understanding of gamma-ray burst
afterglow processes allow us to construct models capable of dealing with
complex relativistic jet dynamics and non-thermal emission, that can be
compared directly to data from instruments such as Swift. Because afterglow
blast waves and power law spectra are intrinsically scale-invariant under
changes of explosion energy and medium density, templates can be generated from
large-scale hydrodynamics simulations. This allows for iterative template-based
model fitting using the physical model parameters (quantifying the properties
of the burster, emission and observer) directly as fit variables. Here I review
how such an approach to afterglow analysis works in practice, paying special
attention to the underlying model assumptions, possibilities, caveats and
limitations of this type of analysis. Because some model parameters can be
degenerate in certain regions of parameter space, or unconstrained if data in a
limited number of a bands is available, a Bayesian approach is a natural fit.
The main features of the standard afterglow model are reviewed in detail.
","[{""version"":""v1"",""created"":""Wed, 18 Mar 2015 08:38:45 GMT""},{""version"":""v2"",""created"":""Mon, 20 Apr 2015 14:12:26 GMT""}]","2015-09-29"
"1503.05309","Giuseppe Morello","Giuseppe Morello","A blind method to detrend instrumental systematics in exoplanetary
  light-curves","accepted by ApJ",,"10.1088/0004-637X/808/1/56",,"astro-ph.EP","http://arxiv.org/licenses/nonexclusive-distrib/1.0/","  The study of the atmospheres of transiting exoplanets requires a photometric
precision, and repeatability, of one part in $\sim 10^4$. This is beyond the
original calibration plans of current observatories, hence the necessity to
disentangle the instrumental systematics from the astrophysical signals in raw
datasets. Most methods used in the literature are based on an approximate
instrument model. The choice of parameters of the model and their functional
forms can sometimes be subjective, causing controversies in the literature.
Recently, Morello et al. (2014, 2015) have developed a non-parametric
detrending method that gave coherent and repeatable results when applied to
Spitzer/IRAC datasets that were debated in the literature. Said method is based
on Independent Component Analysis (ICA) of individual pixel time-series,
hereafter ""pixel-ICA"". The main purpose of this paper is to investigate the
limits and advantages of pixel-ICA on a series of simulated datasets with
different instrument properties, and a range of jitter timescales and shapes,
non-stationarity, sudden change points, etc. The performances of pixel-ICA are
compared against the ones of other methods, in particular polynomial centroid
division (PCD), and pixel-level decorrelation (PLD) method (Deming et al.
2014). We find that in simulated cases pixel-ICA performs as well or better
than other methods, and it also guarantees a higher degree of objectivity,
because of its purely statistical foundation with no prior information on the
instrument systematics. The results of this paper, together with previous
analyses of Spitzer/IRAC datasets, suggest that photometric precision and
repeatability of one part in $10^4$ can be achieved with current infrared space
instruments.
","[{""version"":""v1"",""created"":""Wed, 18 Mar 2015 08:41:14 GMT""},{""version"":""v2"",""created"":""Tue, 2 Jun 2015 21:43:50 GMT""}]","2015-08-06"
