"1503.05975","Boram Yoon","Tanmoy Bhattacharya, Rajan Gupta, Boram Yoon","Disconnected Quark Loop Contributions to Nucleon Structure","7 pages, talk presented at Lattice 2014, PoS (LATTICE2014) 141",,,"LA-UR-14-28704","hep-lat","http://arxiv.org/licenses/nonexclusive-distrib/1.0/","  We calculate the disconnected contribution to isoscalar nucleon charges for
scalar, axial and tensor channels of light and strange quarks. The calculation
has been done with the Clover valence quarks on the MILC $N_f=2+1+1$ HISQ
lattices whose light quark masses corresponding to the pion masses of 305 MeV
and 217 MeV at $a \approx 0.12$ fm and 312 MeV at $a \approx 0.09$ fm.
All-mode-averaging technique is used for the evaluation two-point functions.
Disconnected quark loops are estimated by using the truncated solver method
with Gaussian random noise sources. Contamination from the excited states is
removed by fitting the results of various source-sink separations and operator
insertions to the formula including up to the first excited state,
simultaneously.
","[{""version"":""v1"",""created"":""Fri, 20 Mar 2015 01:17:39 GMT""}]","2015-03-23"
"1503.05976","Takenori Fujii","Ryohei Takayanagi, Takenori Fujii, and Atsushi Asamitsu","Simultaneous control of thermoelectric properties in p-type and n-type
  materials by electric double-layer gating : New design for thermoelectric
  device","10 pages, 4 figures. Accepted in Applied physics express",,"10.7567/APEX.8.051101",,"cond-mat.mtrl-sci cond-mat.str-el","http://arxiv.org/licenses/nonexclusive-distrib/1.0/","  We report novel design for thermoelectric device which can control
thermoelectric properties of p-type and n-type materials simultaneously by
electric double-layer gating. Here, p-type Cu2O and n-type ZnO were used as
positive and negative electrodes of the electric double-layer capacitor
structure. When the gate voltage was applied between two electrodes, the holes
and electrons were accumulated on the surface of Cu2O and ZnO, respectively.
The thermopower was measured by applying thermal gradient along the accumulated
layer on the electrodes. We demonstrate here that the accumulated layers are
worked as a p-n pair of the thermoelectric device.
","[{""version"":""v1"",""created"":""Fri, 20 Mar 2015 01:23:44 GMT""}]","2015-06-24"
"1503.05977","Yakov Nekrich","J. Ian Munro and Yakov Nekrich and Jeffrey Scott Vitter","Dynamic Data Structures for Document Collections and Graphs",,,,,"cs.DS","http://arxiv.org/licenses/nonexclusive-distrib/1.0/","  In the dynamic indexing problem, we must maintain a changing collection of
text documents so that we can efficiently support insertions, deletions, and
pattern matching queries. We are especially interested in developing efficient
data structures that store and query the documents in compressed form. All
previous compressed solutions to this problem rely on answering rank and select
queries on a dynamic sequence of symbols. Because of the lower bound in
[Fredman and Saks, 1989], answering rank queries presents a bottleneck in
compressed dynamic indexing. In this paper we show how this lower bound can be
circumvented using our new framework. We demonstrate that the gap between
static and dynamic variants of the indexing problem can be almost closed. Our
method is based on a novel framework for adding dynamism to static compressed
data structures. Our framework also applies more generally to dynamizing other
problems. We show, for example, how our framework can be applied to develop
compressed representations of dynamic graphs and binary relations.
","[{""version"":""v1"",""created"":""Fri, 20 Mar 2015 01:31:25 GMT""}]","2015-03-23"
"1503.05978","Kevin Daily","K. M. Daily and Alejandro Kievsky and Chris H. Greene","Adiabatic hyperspherical analysis of realistic nuclear potentials","9 pages, 3 figures, 1 table",,,,"nucl-th","http://arxiv.org/licenses/nonexclusive-distrib/1.0/","  Using the hyperspherical adiabatic method with the realistic nuclear
potentials Argonne V14, Argonne V18, and Argonne V18 with the Urbana IX
three-body potential, we calculate the adiabatic potentials and the triton
bound state energies. We find that a discrete variable representation with the
slow variable discretization method along the hyperradial degree of freedom
results in energies consistent with the literature. However, using a Laguerre
basis results in missing energy, even when extrapolated to an infinite number
of basis functions and channels. We do not include the isospin $T=3/2$
contribution in our analysis.
","[{""version"":""v1"",""created"":""Fri, 20 Mar 2015 01:45:12 GMT""}]","2015-03-23"
"1503.05979","Georgi Medvedev S.","Pawel Hitczenko and Georgi S. Medvedev","Stability of equilibria of randomly perturbed maps",,"Discrete and Continuous Dynamical Systems - B, 22(2), 2017","10.3934/dcdsb.2017017",,"math.DS math.PR","http://arxiv.org/licenses/nonexclusive-distrib/1.0/","  We derive a sufficient condition for stability in probability of an
equilibrium of a randomly perturbed map in ${\mathbb R}^d$. This condition can
be used to stabilize weakly unstable equilibria by random forcing. Analytical
results on stabilization are illustrated with numerical examples of randomly
perturbed linear and nonlinear maps in one- and two-dimensional spaces.
","[{""version"":""v1"",""created"":""Fri, 20 Mar 2015 01:51:04 GMT""},{""version"":""v2"",""created"":""Fri, 6 May 2016 23:16:07 GMT""}]","2017-05-16"
"1503.05980","Jie Li","Jie Li and Xiaohu Tang","Optimal Exact Repair Strategy for the Parity Nodes of the $(k+2,k)$
  Zigzag Code","11 pages",,,,"cs.IT math.IT","http://arxiv.org/licenses/nonexclusive-distrib/1.0/","  In this paper, we reinterprets the $(k+2,k)$ Zigzag code in coding matrix and
then propose an optimal exact repair strategy for its parity nodes, whose
repair disk I/O approaches a lower bound derived in this paper.
","[{""version"":""v1"",""created"":""Fri, 20 Mar 2015 02:04:59 GMT""}]","2015-03-23"
"1503.05981","Emily Richards","Emily E. Richards, L. van Zee, K. L. Barnes, S. Staudaher, D. A. Dale,
  T. T. Braun, D. C. Wavle, D. Calzetti, J. J. Dalcanton, J. S. Bullock, and R.
  Chandar","Baryonic Distributions in the Dark Matter Halo of NGC5005","31 pages, 9 figures, accepted for publication in MNRAS",,"10.1093/mnras/stv568",,"astro-ph.GA astro-ph.CO","http://arxiv.org/licenses/nonexclusive-distrib/1.0/","  We present results from multiwavelength observations of the galaxy NGC5005.
We use new neutral hydrogen (HI) observations from the Very Large Array to
examine the neutral gas morphology and kinematics. We find an HI disk with a
well-behaved flat rotation curve in the radial range 20\arcsec-140\arcsec.
Ionized gas observations from the SparsePak integral field unit on the WIYN
3.5m telescope provide kinematics for the central 70\arcsec. We use both the
SparsePak and HI velocity fields to derive a rotation curve for NGC5005. Deep
3.6{\mu}m observations from the Spitzer Space Telescope probe the faint
extended stellar population of NGC5005. The images reveal a large stellar disk
with a high surface brightness component that transitions to a low surface
brightness component at a radius nearly 1.6 times farther than the extent of
the gas disk detected in HI. The 3.6{\mu}m image is also decomposed into bulge
and disk components to account for the stellar light distribution. Optical
broadband B and R and narrowband H{\alpha} from the WIYN 0.9m telescope
complement the 3.6{\mu}m data by providing information about the dominant
stellar population and current star formation activity. The neutral and ionized
gas rotation curve is used along with the stellar bulge and disk light profiles
to decompose the mass distributions in NGC5005 and determine a dark matter halo
model. The maximum stellar disk contribution to the total rotation curve is
only about 70\%, suggesting that dark matter makes a significant contribution
to the dynamics at all radii.
","[{""version"":""v1"",""created"":""Fri, 20 Mar 2015 02:55:20 GMT""}]","2015-06-24"
"1503.05982","Henrique Boschi-Filho","Edward Quijada and Henrique Boschi-Filho","Wilson Loops for M2- and M5-brane spaces","Cover + 14 pages. The manuscript was completely rewritten due to
  fundamental errors in the previous version","Phys. Rev. D 92, 066010 (2015)","10.1103/PhysRevD.92.066010",,"hep-th","http://arxiv.org/licenses/nonexclusive-distrib/1.0/","  We calculate configuration energies of string-like membranes in M2- and
M5-brane spaces. In the near horizon approximation these backgrounds reduce to
$AdS_4\times S^7$ and $AdS_7\times S^4$ spaces and the dual theories are
supersymmetric $SU(N)$ gauge theories, in accordance with the AdS/CFT
correspondence. In this case the string-like configuration energy is identified
with the quark and anti-quark energy interaction in the dual theories. Far from
the horizon the dual theory is more involved but any how we were able to
calculate the string-like configuration energy. For limiting regimes we find
simpler solutions for which some potentials exhibit a confinement behavior
while others are non-confining.
","[{""version"":""v1"",""created"":""Fri, 20 Mar 2015 02:57:14 GMT""},{""version"":""v2"",""created"":""Tue, 28 Jul 2015 20:00:28 GMT""}]","2015-09-30"
"1503.05983","Gaurav Shukla","Gaurav Shukla, Zhongqing Wu, Han Hsu, Andrea Floris, Matteo
  Cococcioni, and Renata M. Wentzcovitch","Thermoelasticity of Fe2+-bearing bridgmanite","Accepted for Geophysical Research Letters (DOI: 10.1002/2014GL062888)",,"10.1002/2014GL062888",,"cond-mat.mtrl-sci","http://arxiv.org/licenses/nonexclusive-distrib/1.0/","  We present LDA+U calculations of high temperature elastic properties of
bridgmanite with composition (Mg$_{(1-x)}$Fe$_{x}^{2+}$)SiO$_3$ for
$0\le{x}\le0.125$. Results of elastic moduli and acoustic velocities for the
Mg-end member (x=0) agree very well with the latest high pressure and high
temperature experimental measurements. In the iron-bearing system, we focus
particularly on the change in thermoelastic parameters across the state change
that occurs in ferrous iron above $\sim$30 GPa, often attributed to a high-spin
(HS) to intermediate spin (IS) crossover but explained by first principles
calculations as a lateral displacement of substitutional iron in the perovskite
cage. We show that the measured effect of this change on the equation of state
of this system can be explained by the lateral displacement of substitutional
iron, not by the HS to IS crossover. The calculated elastic properties of
(Mg$_{0.875}$Fe$_{0.125}^{2+}$)SiO$_3$ along an adiabatic mantle geotherm,
somewhat overestimate longitudinal velocities but produce densities and shear
velocities quite consistent with Preliminary Reference Earth Model data
throughout most of the lower mantle.
","[{""version"":""v1"",""created"":""Fri, 20 Mar 2015 03:16:07 GMT""}]","2015-06-24"
"1503.05984","Shufeng Wang","Yu Li, Weibo Yan, Yunlong Li, Shufeng Wang, Wei Wang, Zuqiang Bian,
  Lixin Xiao, Qihuang Gong","Direct Observation of Long Electron-Hole Diffusion Distance in
  CH3NH3PbI3 Perovskite Thin Film","37 pages, 5 figures, 2 tables",,"10.1038/srep14485",,"physics.chem-ph cond-mat.mtrl-sci","http://arxiv.org/licenses/nonexclusive-distrib/1.0/","  In high performance perovskite based solar cells, CH3NH3PbI3 is the key
material. We carried out a study on charge diffusion in spin-coated CH3NH3PbI3
perovskite thin film by transient fluorescent spectroscopy. A
thickness-dependent fluorescent lifetime was found. By coating the film with an
electron or hole transfer layer, [6,6]-phenyl-C61-butyric acid methyl ester
(PCBM) or 2,2,7,7-tetrakis(N,N-di-p-methoxyphenylamine)-9,9-spirobifluorene
(Spiro-OMeTAD) respectively, we observed the charge transfer directly through
the fluorescence quenching. One-dimensional diffusion model was applied to
obtain long charge diffusion distances in thick films, which is ~1.7 um for
electrons and up to ~6.3 um for holes. Short diffusion distance of few hundreds
of nanosecond was also observed in thin films. This thickness dependent charge
diffusion explained the formerly reported short charge diffusion distance (~100
nm) in films and resolved its confliction to thick working layer (300-500 nm)
in real devices. This study presents direct support to the high performance
perovskite solar cells and will benefit the devices design.
","[{""version"":""v1"",""created"":""Fri, 20 Mar 2015 03:23:53 GMT""},{""version"":""v2"",""created"":""Tue, 22 Sep 2015 10:38:48 GMT""}]","2015-10-02"
"1503.05985","Arne Laucht Dr.","Arne Laucht, Juha T. Muhonen, Fahd A. Mohiyaddin, Rachpon Kalra, Juan
  P. Dehollain, Solomon Freer, Fay E. Hudson, Menno Veldhorst, Rajib Rahman,
  Gerhard Klimeck, Kohei M. Itoh, David N. Jamieson, Jeffrey C. McCallum,
  Andrew S. Dzurak, Andrea Morello","Electrically controlling single spin qubits in a continuous microwave
  field","Main paper: 13 pages, 4 figures. Supplementary information: 25 pages,
  13 figures","Science Advances 1, 1500022 (2015)","10.1126/sciadv.1500022",,"cond-mat.mes-hall quant-ph","http://arxiv.org/licenses/nonexclusive-distrib/1.0/","  Large-scale quantum computers must be built upon quantum bits that are both
highly coherent and locally controllable. We demonstrate the quantum control of
the electron and the nuclear spin of a single 31P atom in silicon, using a
continuous microwave magnetic field together with nanoscale electrostatic
gates. The qubits are tuned into resonance with the microwave field by a local
change in electric field, which induces a Stark shift of the qubit energies.
This method, known as A-gate control, preserves the excellent coherence times
and gate fidelities of isolated spins, and can be extended to arbitrarily many
qubits without requiring multiple microwave sources.
","[{""version"":""v1"",""created"":""Fri, 20 Mar 2015 03:47:34 GMT""}]","2015-04-14"
"1503.05986","Junfang Tian","Junfang Tian, Bin Jia, Shoufeng Ma, Chenqiang Zhu, Rui Jiang, YaoXian
  Ding","Cellular automaton model with dynamical 2D speed-gap relation reproduces
  empirical and experimental features of traffic flow",,,,,"nlin.CG physics.soc-ph","http://creativecommons.org/licenses/by-nc-sa/3.0/","  This paper proposes an improved cellular automaton traffic flow model based
on the brake light model, which takes into account that the desired time gap of
vehicles is remarkably larger than one second. Although the hypothetical steady
state of vehicles in the deterministic limit corresponds to a unique
relationship between speeds and gaps in the proposed model, the traffic states
of vehicles dynamically span a two-dimensional region in the plane of speed
versus gap, due to the various randomizations. It is shown that the model is
able to well reproduce (i) the free flow, synchronized flow, jam as well as the
transitions among the three phases; (ii) the evolution features of disturbances
and the spatiotemporal patterns in a car-following platoon; (iii) the empirical
time series of traffic speed obtained from NGSIM data. Therefore, we argue that
a model can potentially reproduce the empirical and experimental features of
traffic flow, provided that the traffic states are able to dynamically span a
2D speed-gap region.
","[{""version"":""v1"",""created"":""Fri, 20 Mar 2015 04:04:11 GMT""}]","2015-03-23"
"1503.05987","Martial Longla","Martial Longla, Magda Peligrad, Hailin Sang","On kernel estimators of density for reversible Markov chains",,"M. Longla, M. Peligrad and H. Sang: On kernel estimators of
  density for reversible Markov chains. Probability and Statistics Letters 2015
  (100) pp 149-157","10.1016/j.spl.2015.02.013",,"math.PR","http://arxiv.org/licenses/nonexclusive-distrib/1.0/","  In this paper we investigate the kernel estimator of the density for a
stationary reversible Markov chain. The proofs are based on a new central limit
theorem for a triangular array of reversible Markov chains obtained under
conditions imposed to covariances, which has interest in itself.
","[{""version"":""v1"",""created"":""Fri, 20 Mar 2015 04:33:22 GMT""}]","2015-03-23"
"1503.05988","Haifeng Xu","Shaddin Dughmi and Haifeng Xu","Algorithmic Bayesian Persuasion",,,,,"cs.GT","http://arxiv.org/licenses/nonexclusive-distrib/1.0/","  Persuasion, defined as the act of exploiting an informational advantage in
order to effect the decisions of others, is ubiquitous. Indeed, persuasive
communication has been estimated to account for almost a third of all economic
activity in the US. This paper examines persuasion through a computational
lens, focusing on what is perhaps the most basic and fundamental model in this
space: the celebrated Bayesian persuasion model of Kamenica and Gentzkow. Here
there are two players, a sender and a receiver. The receiver must take one of a
number of actions with a-priori unknown payoff, and the sender has access to
additional information regarding the payoffs. The sender can commit to
revealing a noisy signal regarding the realization of the payoffs of various
actions, and would like to do so as to maximize her own payoff assuming a
perfectly rational receiver.
  We examine the sender's optimization task in three of the most natural input
models for this problem, and essentially pin down its computational complexity
in each. When the payoff distributions of the different actions are i.i.d. and
given explicitly, we exhibit a polynomial-time (exact) algorithm, and a
""simple"" $(1-1/e)$-approximation algorithm. Our optimal scheme for the i.i.d.
setting involves an analogy to auction theory, and makes use of Border's
characterization of the space of reduced-forms for single-item auctions. When
action payoffs are independent but non-identical with marginal distributions
given explicitly, we show that it is #P-hard to compute the optimal expected
sender utility. Finally, we consider a general (possibly correlated) joint
distribution of action payoffs presented by a black box sampling oracle, and
exhibit a fully polynomial-time approximation scheme (FPTAS) with a bi-criteria
guarantee. We show that this result is the best possible in the black-box model
for information-theoretic reasons.
","[{""version"":""v1"",""created"":""Fri, 20 Mar 2015 04:35:44 GMT""},{""version"":""v2"",""created"":""Fri, 3 Apr 2015 01:48:41 GMT""},{""version"":""v3"",""created"":""Mon, 15 Feb 2016 04:52:21 GMT""}]","2016-02-16"
"1503.05989","Joseph Fowler","J. W. Fowler, B. K. Alpert, W. B. Doriese, D. A. Fischer, C. Jaye, Y.
  I. Joe, G. C. O'Neil, D. S. Swetz, J. N. Ullom (US National Institute of
  Standards and Technology)","Microcalorimeter Spectroscopy at High Pulse Rates: a Multi-Pulse Fitting
  Technique","This version exactly matches the submission to journal",,"10.1088/0067-0049/219/2/35",,"astro-ph.IM","http://arxiv.org/licenses/nonexclusive-distrib/1.0/","  Transition edge sensor microcalorimeters can measure x-ray and gamma-ray
energies with very high energy resolution and high photon-collection
efficiency. For this technology to reach its full potential in future x-ray
observatories, each sensor must be able to measure hundreds or even thousands
of photon energies per second. Current ""optimal filtering"" approaches to
achieve the best possible energy resolution work only for photons well isolated
in time, a requirement in direct conflict with the need for high-rate
measurements. We describe a new analysis procedure to allow fitting for the
pulse height of all photons even in the presence of heavy pulse pile-up. In the
limit of isolated pulses, the technique reduces to the standard optimal
filtering with long records. We employ reasonable approximations to the noise
covariance function in order to render multi-pulse fitting computationally
viable even for very long data records. The technique is employed to analyze
x-ray emission spectra at 600 eV and 6 keV at rates up to 250 counts per second
in microcalorimeters having exponential signal decay times of approximately 1.2
ms.
","[{""version"":""v1"",""created"":""Fri, 20 Mar 2015 04:42:21 GMT""},{""version"":""v2"",""created"":""Tue, 31 Mar 2015 15:01:07 GMT""}]","2017-02-03"
"1503.05990","Rohini Kumar","Rohini Kumar, Lea Popovic","Large deviations for multi-scale jump-diffusion processes","Accepted for publication in Stochastic Processes and their
  Applications",,"10.1016/j.spa.2016.07.016",,"math.PR","http://arxiv.org/licenses/nonexclusive-distrib/1.0/","  We obtain large deviation results for a two time-scale model of
jump-diffusion processes. The processes on the two time scales are fully
inter-dependent, the slow process has small perturbative noise and the fast
process is ergodic. Our results extend previous large deviation results for
diffusions. We provide concrete examples in their applications to finance and
biology, with an explicit calculation of the large deviation rate function.
","[{""version"":""v1"",""created"":""Fri, 20 Mar 2015 04:45:57 GMT""},{""version"":""v2"",""created"":""Thu, 15 Sep 2016 21:47:10 GMT""}]","2016-09-19"
"1503.05991","Ci Li","Ci. Li and Zhi. Song","Generation of Bell, W and GHZ states via exceptional points in
  non-Hermitian quantum spin systems",,"Phys. Rev. A 91, 062104 (2015)","10.1103/PhysRevA.91.062104",,"quant-ph","http://arxiv.org/licenses/nonexclusive-distrib/1.0/","  We study quantum phase transitions in non-Hermitian XY and transverse-field
Ising spin chains, in which the non-Hermiticity arises from the imaginary
magnetic field. Analytical and numerical results show that at exceptional
points, coalescing eigenstates in these models close to W, distant Bell and GHZ
states, which can be steady states in dynamical preparation scheme proposed by
T. D. Lee et. al. (Phys. Rev. Lett. 113, 250401 (2014)). Selecting proper
initial states, numerical simulations demonstrate the time evolution process to
the target states with high fidelity.
","[{""version"":""v1"",""created"":""Fri, 20 Mar 2015 04:46:40 GMT""}]","2015-06-10"
"1503.05992","Sugata Sanyal","Subhamoy Chakraborti, D. P. Acharjya, Sugata Sanyal","Application Security framework for Mobile App Development in Enterprise
  setup","7 pages",,,,"cs.CR","http://arxiv.org/licenses/nonexclusive-distrib/1.0/","  Enterprise Mobility has been increasing the reach over the years. Initially
Mobile devices were adopted as consumer devices. However, the enterprises world
over have rightly taken the leap and started using the ubiquitous technology
for managing its employees as well as to reach out to the customers. While the
Mobile ecosystem has been evolving over the years, the increased exposure of
mobility in Enterprise framework have caused major focus on the security
aspects of it. While a significant focus have been put on network security,
this paper discusses on the approach that can be taken at Mobile application
layer, which would reduce the risk to the enterprises.
","[{""version"":""v1"",""created"":""Fri, 20 Mar 2015 04:55:50 GMT""}]","2015-03-23"
"1503.05993","Christopher O'Neill","Claire Kiers, Christopher O'Neill, Vadim Ponomarenko","Numerical semigroups on compound sequences",,"Communications in Algebra 44 (2016), no. 9, 3842-3852","10.1080/00927872.2015.1087013",,"math.AC","http://arxiv.org/licenses/nonexclusive-distrib/1.0/","  We generalize the geometric sequence $\{a^p, a^{p-1}b, a^{p-2}b^2,...,b^p\}$
to allow the $p$ copies of $a$ (resp. $b$) to all be different. We call the
sequence $\{a_1a_2a_3\cdots a_p, b_1a_2a_3\cdots a_p, b_1b_2a_3\cdots
a_p,\ldots, b_1b_2b_3\cdots b_p\}$ a \emph{compound sequence}. We consider
numerical semigroups whose minimal set of generators form a compound sequence,
and compute various semigroup and arithmetical invariants, including the
Frobenius number, Ap\'ery sets, Betti elements, and catenary degree. We compute
bounds on the delta set and the tame degree.
","[{""version"":""v1"",""created"":""Fri, 20 Mar 2015 05:13:52 GMT""},{""version"":""v2"",""created"":""Thu, 25 Jun 2015 00:18:36 GMT""},{""version"":""v3"",""created"":""Fri, 26 Jun 2015 02:34:56 GMT""}]","2018-08-15"
"1503.05994","Giordano Scappucci","G. Scappucci, W. M. Klesse, L. A. Yeoh, D. J. Carter, O. Warschkow, N.
  A. Marks, D. L. Jaeger, G. Capellini, M. Y. Simmons, A. R. Hamilton","Bottom-up assembly of metallic germanium",,,"10.1038/srep12948",,"cond-mat.mtrl-sci","http://arxiv.org/licenses/nonexclusive-distrib/1.0/","  Extending chip performance beyond current limits of miniaturisation requires
new materials and functionalities that integrate well with the silicon
platform. Germanium fits these requirements and has been proposed as a
high-mobility channel material,[1] a light emitting medium in
silicon-integrated lasers,[2,3] and a plasmonic conductor for bio-sensing.[4,5]
Common to these diverse applications is the need for homogeneous, high electron
densities in three-dimensions (3D). Here we use a bottom-up approach to
demonstrate the 3D assembly of atomically sharp doping profiles in germanium by
a repeated stacking of two-dimensional (2D) high-density phosphorus layers.
This produces high-density (10^19 to 10^20 cm-3) low-resistivity (10^-4 Ohmcm)
metallic germanium of precisely defined thickness, beyond the capabilities of
diffusion-based doping technologies.[6] We demonstrate that free electrons from
distinct 2D dopant layers coalesce into a homogeneous 3D conductor using
anisotropic quantum interference measurements, atom probe tomography, and
density functional theory.
","[{""version"":""v1"",""created"":""Fri, 20 Mar 2015 05:20:21 GMT""}]","2019-01-23"
