"1503.05899","Sherwin Doroudi","Sherwin Doroudi, Brian Fralix, Mor Harchol-Balter","Clearing Analysis on Phases: Exact Limiting Probabilities for Skip-free,
  Unidirectional, Quasi-birth-death Processes",,,,,"math.PR","http://arxiv.org/licenses/nonexclusive-distrib/1.0/","  Many problems in computing, service, and manufacturing systems can be modeled
via infinite repeating Markov chains with an infinite number of levels and a
finite number of phases. Many such chains are quasi-birth-death processes
(QBDs) with transitions that are skip-free in level, in that one can only
transition between consecutive levels, and unidirectional in phase, in that one
can only transition from lower-numbered phases to higher-numbered phases. We
present a procedure, which we call Clearing Analysis on Phases (CAP), for
determining the limiting probabilities of such Markov chains exactly. The CAP
method yields the limiting probability of each state in the repeating portion
of the chain as a linear combination of scalar bases raised to a power
corresponding to the level of the state. The weights in these linear
combinations can be determined by solving a finite system of linear equations.
","[{""version"":""v1"",""created"":""Thu, 19 Mar 2015 19:21:36 GMT""},{""version"":""v2"",""created"":""Mon, 6 Apr 2015 05:21:24 GMT""},{""version"":""v3"",""created"":""Sun, 11 Oct 2015 21:29:54 GMT""}]","2015-10-13"
"1503.05900","Todd Kuffner","Thomas J. DiCiccio, Todd A. Kuffner and G. Alastair Young","Quantifying nuisance parameter effects via decompositions of asymptotic
  refinements for likelihood-based statistics","Accepted for publication in the Journal of Statistical Planning and
  Inference",,,,"math.ST stat.TH","http://arxiv.org/licenses/nonexclusive-distrib/1.0/","  Accurate inference on a scalar interest parameter in the presence of a
nuisance parameter may be obtained using an adjusted version of the signed root
likelihood ratio statistic, in particular Barndorff-Nielsen's $R^*$ statistic.
The adjustment made by this statistic may be decomposed into a sum of two
terms, interpreted as correcting respectively for the possible effect of
nuisance parameters and the deviation from standard normality of the signed
root likelihood ratio statistic itself. We show that the adjustment terms are
determined to second-order in the sample size by their means. Explicit
expressions are obtained for the leading terms in asymptotic expansions of
these means. These are easily calculated, allowing a simple way of quantifying
and interpreting the respective effects of the two adjustments, in particular
of the effect of a high dimensional nuisance parameter. Illustrations are given
for a number of examples, which provide theoretical insight to the effect of
nuisance parameters on parametric inference. The analysis provides a
decomposition of the mean of the signed root statistic involving two terms: the
first has the property of taking the same value whether there are no nuisance
parameters or whether there is an orthogonal nuisance parameter, while the
second is zero when there are no nuisance parameters. Similar decompositions
are discussed for the Bartlett correction factor of the likelihood ratio
statistic, and for other asymptotically standard normal pivots.
","[{""version"":""v1"",""created"":""Thu, 19 Mar 2015 19:21:57 GMT""}]","2015-03-20"
"1503.05901","Katrin Gelfert","Jairo Bochi, Christian Bonatti and Katrin Gelfert","Dominated Pesin theory: convex sum of hyperbolic measures","final version, new co-author, to appear in: Israel Journal of
  Mathematics",,,,"math.DS","http://arxiv.org/licenses/nonexclusive-distrib/1.0/","  In the uniformly hyperbolic setting it is well known that the set of all
measures supported on periodic orbits is dense in the convex space of all
invariant measures. In this paper we consider the converse question, in the
non-uniformly hyperbolic setting: assuming that some ergodic measure converges
to a convex combination of hyperbolic ergodic measures, what can we deduce
about the initial measures?
  To every hyperbolic measure $\mu$ whose stable/unstable Oseledets splitting
is dominated we associate canonically a unique class $H(\mu)$ of periodic
orbits for the homoclinic relation, called its \emph{intersection class}. In a
dominated setting, we prove that a measure for which almost every measure in
its ergodic decomposition is hyperbolic with the same index such as the
dominated splitting is accumulated by ergodic measures if, and only if, almost
all such ergodic measures have a common intersection class.
  We provide examples which indicate the importance of the domination
assumption.
","[{""version"":""v1"",""created"":""Thu, 19 Mar 2015 19:27:10 GMT""},{""version"":""v2"",""created"":""Mon, 22 Feb 2016 16:34:20 GMT""},{""version"":""v3"",""created"":""Wed, 19 Jul 2017 06:20:40 GMT""}]","2017-07-20"
"1503.05902","Andrew Baker Dr","Andrew Baker","$\mathcal{E}_\infty$ ring spectra and elements of Hopf invariant $1$","Final published version with corrections; appeared in a memorial
  volume dedicated to Sam Gitler, Boletin de la Sociedad Matematica Mexicana 23
  (2017), 195-231",,,,"math.AT","http://arxiv.org/licenses/nonexclusive-distrib/1.0/","  The $2$-primary Hopf invariant $1$ elements in the stable homotopy groups of
spheres form the most accessible family of elements. In this paper we explore
some properties of the $\mathcal{E}_\infty$ ring spectra obtained from certain
iterated mapping cones by applying the free algebra functor. In fact, these are
equivalent to Thom spectra over infinite loop spaces related to the classifying
spaces $B\mathrm{SO},\,B\mathrm{Spin},\,B\mathrm{String}$. We show that the
homology of these Thom spectra are all extended comodule algebras of the form
$\mathcal{A}_*\square_{\mathcal{A}(r)_*}P_*$ over the dual Steenrod algebra
$\mathcal{A}_*$ with $\mathcal{A}_*\square_{\mathcal{A}(r)_*}\mathbb{F}_2$ as
an algebra retract. This suggests that these spectra might be wedges of module
spectra over the ring spectra $H\mathbb{Z}$, $k\mathrm{O}$ or $\mathrm{tmf}$,
however apart from the first case, we have no concrete results on this.
","[{""version"":""v1"",""created"":""Thu, 19 Mar 2015 19:28:42 GMT""},{""version"":""v2"",""created"":""Sat, 28 Mar 2015 20:05:23 GMT""},{""version"":""v3"",""created"":""Sun, 17 May 2015 10:34:25 GMT""},{""version"":""v4"",""created"":""Tue, 22 Sep 2015 21:17:14 GMT""},{""version"":""v5"",""created"":""Thu, 7 Jan 2016 20:32:25 GMT""},{""version"":""v6"",""created"":""Fri, 8 Jan 2016 16:03:13 GMT""},{""version"":""v7"",""created"":""Mon, 25 Jan 2016 23:21:30 GMT""},{""version"":""v8"",""created"":""Sun, 16 Apr 2017 10:31:46 GMT""}]","2017-04-18"
"1503.05903","Abbas Arab","Abbas Arab and Qiliang Li","MoS2 Nanoribbons Thermoelectric Generators","22 pages, 9 figures",,,,"cond-mat.mes-hall physics.atom-ph","http://arxiv.org/licenses/nonexclusive-distrib/1.0/","  In this work, we have designed and simulated new thermoelectric generator
based on monolayer and few-layer MoS2 nanoribbons. The proposed thermoelectric
generator is composed of thermocouples made of both n-type and p-type MoS2
nanoribbon legs. Density Functional Tight-Binding Non-Equilibrium Green's
Function (DFTB-NEGF) method has been used to calculate the transmission
spectrum of MoS2 armchair and zigzag nanoribbons. Phonon transmission spectrum
are calculated based on parameterization of Stillinger-Weber potential.
Thermoelectric figure of merit, ZT, is calculated using these electronic and
phonon transmission spectrum. Monolayer and bilayer MoS2 armchair nanoribbons
are found to have the highest ZT value for p-type and n-type legs, repectively.
Moreover, we have compared the thermoelectric current of doped monolayer MoS2
armchair nanoribbons and SZi thin films. Results indicate that thermoelectric
current of MoS2 monolayer nanoribbons is several orders of magnitude higher
than that of Si thin films.
","[{""version"":""v1"",""created"":""Thu, 19 Mar 2015 19:34:54 GMT""}]","2015-03-20"
"1503.05904","Rishab Nithyanand","Bridger Hahn, Rishab Nithyanand, Phillipa Gill, Rob Johnson","Games Without Frontiers: Investigating Video Games as a Covert Channel",,,,,"cs.CR","http://arxiv.org/licenses/nonexclusive-distrib/1.0/","  The Internet has become a critical communication infrastructure for citizens
to organize protests and express dissatisfaction with their governments. This
fact has not gone unnoticed, with governments clamping down on this medium via
censorship, and circumvention researchers working to stay one step ahead.
  In this paper, we explore a promising new avenue for covert channels:
real-time strategy-video games. Video games have two key features that make
them attractive cover protocols for censorship circumvention. First, due to the
popularity of gaming platforms such as Steam, there are a lot of different
video games, each with their own protocols and server infrastructure. Users of
video-game-based censorship-circumvention tools can therefore diversify across
many games, making it difficult for the censor to respond by simply blocking a
single cover protocol. Second, games in the same genre have many common
features and concepts. As a result, the same covert channel framework can be
easily adapted to work with many different games. This means that circumvention
tool developers can stay ahead of the censor by creating a diverse set of tools
and by quickly adapting to blockades created by the censor.
  We demonstrate the feasibility of this approach by implementing our coding
scheme over two real-time strategy-games (including a very popular
closed-source game). We evaluate the security of our system prototype -- Castle
-- by quantifying its resilience to a censor-adversary, its similarity to real
game traffic, and its ability to avoid common pitfalls in covert channel
design. We use our prototype to demonstrate that our approach can provide
throughput which is amenable to transfer of textual data, such at e-mail, SMS
messages, and tweets, which are commonly used to organize political actions.
","[{""version"":""v1"",""created"":""Thu, 19 Mar 2015 19:37:04 GMT""},{""version"":""v2"",""created"":""Mon, 23 Mar 2015 19:32:04 GMT""},{""version"":""v3"",""created"":""Tue, 19 May 2015 20:00:19 GMT""}]","2015-05-21"
"1503.05905","Nigel Badnell","N. R. Badnell, G. J. Ferland, T. W. Gorczyca, D. Nikolic, and G. A.
  Wagle","Bootstrapping dielectronic recombination from second-row elements and
  the Orion Nebula","Ap.J. At Press",,"10.1088/0004-637X/804/2/100",,"astro-ph.GA","http://arxiv.org/licenses/nonexclusive-distrib/1.0/","  Dielectronic recombination (DR) is the dominant recombination process for
most heavy elements in photoionized clouds. Accurate DR rates for a species can
be predicted when the positions of autoionizing states are known. Unfortunately
such data are not available for most third and higher-row elements. This
introduces an uncertainty that is especially acute for photoionized clouds,
where the low temperatures mean that DR occurs energetically through very
low-lying autoionizing states. This paper discusses S$^{2+} \rightarrow$ S$^+$
DR, the process that is largely responsible for establishing the [S~III]/[S~II]
ratio in nebulae. We derive an empirical rate coefficient using a novel method
for second-row ions, which do have accurate data. Photoionization models are
used to reproduce the [O~III] / [O~II] / [O~I] / [Ne~III] intensity ratios in
central regions of the Orion Nebula. O and Ne have accurate atomic data and can
be used to derive an empirical S$^{2+} \rightarrow$ S$^+$ DR rate coefficient
at $\sim 10^{4}$~K. We present new calculations of the DR rate coefficient for
S$^{2+} \rightarrow$ S$^+$ and quantify how uncertainties in the autoionizing
level positions affect it. The empirical and theoretical results are combined
and we derive a simple fit to the resulting rate coefficient at all
temperatures for incorporation into spectral synthesis codes. This method can
be used to derive empirical DR rates for other ions, provided that good
observations of several stages of ionization of O and Ne are available.
","[{""version"":""v1"",""created"":""Thu, 19 Mar 2015 19:39:21 GMT""}]","2015-05-20"
"1503.05906","Alexandre F\^ete","A. F\^ete, C. Cancellieri, D. Li, D. Stornaiuolo, A. D. Caviglia, S.
  Gariglio, J.-M. Triscone","Growth-induced electron mobility enhancement at the LaAlO$_3$/SrTiO$_3$
  interface",,"Appl. Phys. Lett. 106, 051604 (2015)","10.1063/1.4907676",,"cond-mat.mtrl-sci","http://arxiv.org/licenses/nonexclusive-distrib/1.0/","  We have studied the electronic properties of the 2D electron liquid present
at the LaAlO$_3$/SrTiO$_3$ interface in series of samples prepared at different
growth temperatures. We observe that interfaces fabricated at 650{\deg}C
exhibit the highest low temperature mobility ($\approx 10000 \textrm{
cm}^2/\textrm{Vs}$) and the lowest sheet carrier density ($\approx 5\times
10^{12} \textrm{ cm}^{-2}$). These samples show metallic behavior and
Shubnikov-de Haas oscillations in their magnetoresistance. Samples grown at
higher temperatures (800-900{\deg}C) display carrier densities in the range of
$\approx 2-5 \times 10^{13} \textrm{ cm}^{-2}$ and mobilities of $\approx 1000
\textrm{ cm}^2/\textrm{Vs}$ at 4K. Reducing their carrier density by field
effect to $8\times 10^{12} \textrm{ cm}^{-2}$ lowers their mobilites to
$\approx 50 \textrm{ cm}^2/\textrm{Vs}$ bringing the conductance to the
weak-localization regime.
","[{""version"":""v1"",""created"":""Thu, 19 Mar 2015 19:40:41 GMT""}]","2015-03-20"
"1503.05907","Daniel Christen Mr.","Daniel Christen","Syntagma Lexical Database",,,,,"cs.CL","http://arxiv.org/licenses/nonexclusive-distrib/1.0/","  This paper discusses the structure of Syntagma's Lexical Database (focused on
Italian). The basic database consists in four tables. Table Forms contains word
inflections, used by the POS-tagger for the identification of input-words.
Forms is related to Lemma. Table Lemma stores all kinds of grammatical features
of words, word-level semantic data and restrictions. In the table Meanings
meaning-related data are stored: definition, examples, domain, and semantic
information. Table Valency contains the argument structure of each meaning,
with syntactic and semantic features for each argument. The extended version of
SLD contains the links to Syntagma's Semantic Net and to the WordNet synsets of
other languages.
","[{""version"":""v1"",""created"":""Thu, 19 Mar 2015 19:45:24 GMT""}]","2015-03-20"
"1503.05909","Alberto  Ohashi","Alberto Ohashi, Alexandre B Simas","Principal Components Analysis for Semimartingales and Stochastic PDE","54 pages",,,,"math.ST math.PR q-fin.CP stat.TH","http://arxiv.org/licenses/nonexclusive-distrib/1.0/","  In this work, we develop a novel principal component analysis (PCA) for
semimartingales by introducing a suitable spectral analysis for the quadratic
variation operator. Motivated by high-dimensional complex systems typically
found in interest rate markets, we investigate correlation in high-dimensional
high-frequency data generated by continuous semimartingales. In contrast to the
traditional PCA methodology, the directions of large variations are not
deterministic, but rather they are bounded variation adapted processes which
maximize quadratic variation almost surely. This allows us to reduce
dimensionality from high-dimensional semimartingale systems in terms of
quadratic covariation rather than the usual covariance concept.
  The proposed methodology allows us to investigate space-time data driven by
multi-dimensional latent semimartingale state processes. The theory is applied
to discretely-observed stochastic PDEs which admit finite-dimensional
realizations. In particular, we provide consistent estimators for
finite-dimensional invariant manifolds for Heath-Jarrow-Morton models. More
importantly, components of the invariant manifold associated to volatility and
drift dynamics are consistently estimated and identified. The proposed
methodology is illustrated with both simulated and real data sets.
","[{""version"":""v1"",""created"":""Thu, 19 Mar 2015 19:47:07 GMT""},{""version"":""v2"",""created"":""Wed, 9 Mar 2016 04:04:43 GMT""}]","2016-03-10"
"1503.05910","Otis Chodosh","Alessandro Carlotto, Otis Chodosh, Michael Eichmair","Effective versions of the positive mass theorem","All comments welcome! The final version has appeared in Invent. Math",,"10.1007/s00222-016-0667-3",,"math.DG gr-qc","http://arxiv.org/licenses/nonexclusive-distrib/1.0/","  The study of stable minimal surfaces in Riemannian $3$-manifolds $(M, g)$
with non-negative scalar curvature has a rich history. In this paper, we prove
rigidity of such surfaces when $(M, g)$ is asymptotically flat and has horizon
boundary. As a consequence, we obtain an effective version of the positive mass
theorem in terms of isoperimetric or, more generally, closed volume-preserving
stable CMC surfaces that is appealing from both a physical and a purely
geometric point of view. We also include a proof of the following conjecture of
R. Schoen: An asymptotically flat Riemannian $3$-manifold with non-negative
scalar curvature that contains an unbounded area-minimizing surface is
isometric to flat $\mathbb{R}^3$.
","[{""version"":""v1"",""created"":""Thu, 19 Mar 2015 19:47:20 GMT""},{""version"":""v2"",""created"":""Tue, 7 Jun 2016 07:20:28 GMT""}]","2016-12-21"
"1503.05911","Thomas Sch\""urmann","Thomas Sch\""urmann","A note on entropy estimation","7 pages, including 4 figures; two references added","Neural Computation, October 2015, Vol. 27, No. 10 , Pages
  2097-2106","10.1162/NECO_a_00775",,"physics.data-an cs.IT math.IT math.ST stat.TH","http://arxiv.org/licenses/nonexclusive-distrib/1.0/","  We compare an entropy estimator $H_z$ recently discussed in [10] with two
estimators $H_1$ and $H_2$ introduced in [6][7]. We prove the identity $H_z
\equiv H_1$, which has not been taken into account in [10]. Then, we prove that
the statistical bias of $H_1$ is less than the bias of the ordinary likelihood
estimator of entropy. Finally, by numerical simulation we verify that for the
most interesting regime of small sample estimation and large event spaces, the
estimator $H_2$ has a significant smaller statistical error than $H_z$.
","[{""version"":""v1"",""created"":""Thu, 19 Mar 2015 19:53:31 GMT""},{""version"":""v2"",""created"":""Fri, 5 Jun 2015 05:14:46 GMT""}]","2015-10-23"
"1503.05912","Angel Manuel Ramos","A.M. Ramos, C.P. Please","Some comments on the Butler-Volmer equation for modeling Lithium-ion
  batteries",,,,,"physics.chem-ph","http://arxiv.org/licenses/nonexclusive-distrib/1.0/","  In this article the Butler-Volmer equation used in describing Lithium-ion
(Li-ion) batteries is discussed. First, a complete mathematical model based on
a macro-homogeneous approach developed by Neuman is presented. Two common
mistakes found in the literature regarding a sign in a boundary conditions and
the use of the transfer coefficient are mentioned. The paper focuses on the
form of the Butler-Volmer equation in the model. It is shown how practical
problems can be avoided by taking care in the form used, particularly to avoid
difficulties when the solid particle in the electrodes approaches a fully
charged or discharged state or the electrolyte gets depleted. This shows that
the open circuit voltage and the exchange current density must depend on the
lithium concentration in both the solid and the electrolyte in a particular way
at the extremes of the concentration ranges.
","[{""version"":""v1"",""created"":""Thu, 19 Mar 2015 19:57:14 GMT""}]","2015-03-20"
"1503.05915","Noam Libeskind","Noam I. Libeskind, Yehuda Hoffman, R. Brent Tully, Helene M. Courtois,
  Daniel Pomarede, Stefan Gottloeber, Matthias Steinmetz","Planes of satellite galaxies and the cosmic web","9 pages, 3 figures, 3 tables. Accepted by MNRAS, 9 June 2015",,"10.1093/mnras/stv1302",,"astro-ph.GA","http://arxiv.org/licenses/nonexclusive-distrib/1.0/","  Recent observational studies have demonstrated that the majority of satellite
galaxies tend to orbit their hosts on highly flattened, vast, possibly
co-rotating planes. Two nearly parallel planes of satellites have been
confirmed around the M31 galaxy and around the Centaurus A galaxy, while the
Milky Way also sports a plane of satellites. It has been argued that such an
alignment of satellites on vast planes is unexpected in the standard
({\Lambda}CDM) model of cosmology if not even in contradiction to its generic
predictions. Guided by {\Lambda}CDM numerical simulations, which suggest that
satellites are channeled towards hosts along the axis of the slowest collapse
as dictated by the ambient velocity shear tensor, we re-examine the planes of
local satellites systems within the framework of the local shear tensor derived
from the Cosmicflows-2 dataset. The analysis reveals that the Local Group and
Centaurus A reside in a filament stretched by the Virgo cluster and compressed
by the expansion of the Local Void. Four out of five thin planes of satellite
galaxies are indeed closely aligned with the axis of compression induced by the
Local Void. Being the less massive system, the moderate misalignment of the
Milky Way's satellite plane can likely be ascribed to its greater
susceptibility to tidal torques, as suggested by numerical simulations. The
alignment of satellite systems in the local universe with the ambient shear
field is thus in general agreement with predictions of the {\Lambda}CDM model.
","[{""version"":""v1"",""created"":""Thu, 19 Mar 2015 20:00:15 GMT""},{""version"":""v2"",""created"":""Wed, 10 Jun 2015 08:43:16 GMT""}]","2015-08-06"
"1503.05916","Felix Kahlhoefer","Mikael Chala (DESY), Felix Kahlhoefer (DESY), Matthew McCullough
  (CERN), Germano Nardini (DESY) and Kai Schmidt-Hoberg (DESY)","Constraining Dark Sectors with Monojets and Dijets","30 pages, 14 figures. v2: discussion of total ttbar cross section
  added, matches published version","JHEP 1507 (2015) 089","10.1007/JHEP07(2015)089","DESY 15-036, CERN-PH-TH-2015-057","hep-ph hep-ex","http://arxiv.org/licenses/nonexclusive-distrib/1.0/","  We consider dark sector particles (DSPs) that obtain sizeable interactions
with Standard Model fermions from a new mediator. While these particles can
avoid observation in direct detection experiments, they are strongly
constrained by LHC measurements. We demonstrate that there is an important
complementarity between searches for DSP production and searches for the
mediator itself, in particular bounds on (broad) dijet resonances. This
observation is crucial not only in the case where the DSP is all of the dark
matter but whenever - precisely due to its sizeable interactions with the
visible sector - the DSP annihilates away so efficiently that it only forms a
dark matter subcomponent. To highlight the different roles of DSP direct
detection and LHC monojet and dijet searches, as well as perturbativity
constraints, we first analyse the exemplary case of an axial-vector mediator
and then generalise our results. We find important implications for the
interpretation of LHC dark matter searches in terms of simplified models.
","[{""version"":""v1"",""created"":""Thu, 19 Mar 2015 20:00:15 GMT""},{""version"":""v2"",""created"":""Wed, 24 Jun 2015 09:31:54 GMT""}]","2015-07-28"
"1503.05917","Vasaant Krishnan","V. Krishnan, S. P. Ellingsen, M. J. Reid, A. Brunthaler, A. Sanna, J.
  McCallum, C. Reynolds, H. E. Bignall, C. J. Phillips, R. Dodson, M. Rioja, J.
  L. Caswell, X. Chen, J. R. Dawson, K. Fujisawa, S. Goedhart, J. A. Green, K.
  Hachisuka, M. Honma, K. Menten, Z. Q. Shen, M. A. Voronkov, A. J. Walsh, Y.
  Xu, B. Zhang, X. W. Zheng","First Parallax Measurements Towards a 6.7 GHz Methanol Maser with the
  Australian Long Baseline Array - Distance to G339.884-1.259",,,"10.1088/0004-637X/805/2/129",,"astro-ph.GA","http://arxiv.org/licenses/nonexclusive-distrib/1.0/","  We have conducted the first parallax and proper motion measurements of 6.7
GHz methanol maser emission using the Australian Long Baseline Array (LBA). The
parallax of G339.884$-$1.259 measured from five epochs of observations is
0.48$\pm $0.08 mas, corresponding to a distance of $2.1^{+0.4}_{-0.3}$ kpc,
placing it in the Scutum spiral arm. This is consistent (within the combined
uncertainty) with the kinematic distance estimate for this source at 2.5$\pm
$0.5 kpc using the latest Solar and Galactic rotation parameters. We find from
the Lyman continuum photon flux that the embedded core of the young star is of
spectral type B1, demonstrating that luminous 6.7 GHz methanol masers can be
associated with high-mass stars towards the lower end of the mass range.
","[{""version"":""v1"",""created"":""Thu, 19 Mar 2015 20:00:17 GMT""}]","2015-06-03"
