"1503.06050","Jan Ryckebusch","C. Colle, O. Hen, W. Cosyn, I. Korover, E. Piasetzky, J. Ryckebusch,
  and L.B. Weinstein","Extracting the Mass Dependence and Quantum Numbers of Short-Range
  Correlated Pairs from A(e,e'p) and A(e,e'pp) Scattering","6 pages, 3 figures","Phys. Rev. C 92, 024604 (2015)","10.1103/PhysRevC.92.024604",,"nucl-th nucl-ex","http://arxiv.org/licenses/nonexclusive-distrib/1.0/","  The nuclear mass dependence of the number of short-range correlated (SRC)
proton-proton (pp) and proton-neutron (pn) pairs in nuclei is a sensitive probe
of the dynamics of short-range pairs in the ground state of atomic nuclei. This
work presents an analysis of electroinduced single-proton and two-proton
knockout measurements off 12C, 27Al, 56Fe, and 208Pb in kinematics dominated by
scattering off SRC pairs. The nuclear mass dependence of the observed
A(e,e'pp)/12C(e,e'pp) cross-section ratios and the extracted number of pp- and
pn-SRC pairs are much softer than the mass dependence of the total number of
possible pairs. This is in agreement with a physical picture of SRC affecting
predominantly nucleon-nucleon pairs in a nodeless relative-S state of the
mean-field basis.
","[{""version"":""v1"",""created"":""Fri, 20 Mar 2015 12:26:13 GMT""}]","2015-08-19"
"1503.06051","Helios Sanchis-Alepuz","Helios Sanchis-Alepuz, Christian S. Fischer, Christian Kellermann and
  Lorenz von Smekal","Glueballs from the Bethe-Salpeter equation","10 pages, 2 figures, 1 table",,,,"hep-ph hep-lat hep-th","http://arxiv.org/licenses/nonexclusive-distrib/1.0/","  We formulate a framework to determine the mass of glueball states of Landau
gauge Yang-Mills theory in the continuum. To this end we derive a
Bethe-Salpeter equation for two gluon bound states including the effects of
Faddeev-Popov ghosts. We construct a suitable approximation scheme such that
the interactions in the bound state equation match a corresponding successful
approximation of the Dyson-Schwinger equations for the Landau gauge ghost and
gluon propagators. Based upon a recently obtained solution for the propagators
in the complex momentum plane we obtain results for the mass of the scalar and
pseudoscalar glueballs. In the scalar channel we find a mass value in agreement
with lattice gauge theory.
","[{""version"":""v1"",""created"":""Fri, 20 Mar 2015 12:26:41 GMT""}]","2015-03-23"
"1503.06052","Xavier Molinero","X. Molinero and M. Olsen and M. Serna","On the Complexity of Exchanging",,,,,"cs.GT","http://arxiv.org/licenses/nonexclusive-distrib/1.0/","  We analyze the computational complexity of the problem of deciding whether,
for a given simple game, there exists the possibility of rearranging the
participants in a set of $j$ given losing coalitions into a set of $j$ winning
coalitions. We also look at the problem of turning winning coalitions into
losing coalitions. We analyze the problem when the simple game is represented
by a list of wining, losing, minimal winning or maximal loosing coalitions.
","[{""version"":""v1"",""created"":""Fri, 20 Mar 2015 12:28:44 GMT""},{""version"":""v2"",""created"":""Tue, 24 Mar 2015 13:45:33 GMT""}]","2015-03-25"
"1503.06053","Huafeng Zhang","Huafeng Zhang","Universal R-matrix of quantum affine gl(1,1)","14 pages",,"10.1007/s11005-015-0797-3",,"math.QA math-ph math.MP math.RT","http://arxiv.org/licenses/nonexclusive-distrib/1.0/","  The universal $R$-matrix of the quantum affine superalgebra associated to the
Lie superalgebra $\mathfrak{gl}(1,1)$ is realized as the Casimir element of
certain Hopf pairing, based on the explicit coproduct formula of all the
Drinfeld loop generators.
","[{""version"":""v1"",""created"":""Fri, 20 Mar 2015 12:30:32 GMT""}]","2015-09-02"
"1503.06054","Mats Andersson","Mats Andersson","A global Brian\c{c} con-Skoda-Huneke-Sznajdman theorem",,,,,"math.CV math.AG","http://arxiv.org/licenses/nonexclusive-distrib/1.0/","  We prove a global effective membership result for polynomials on a
non-reduced algebraic subvariety of $\C^N$. It can be seen as a global version
of a recent local result of Sznajdman, generalizing the
Brian\c{c}on-Skoda-Huneke theorem for the local ring of holomorphic functions
at a point on a reduced analytic space.
","[{""version"":""v1"",""created"":""Fri, 20 Mar 2015 12:32:30 GMT""},{""version"":""v2"",""created"":""Wed, 7 Dec 2016 15:31:55 GMT""}]","2016-12-08"
"1503.06055","Richard D'Arcy","Richard D'Arcy and Alexander Shemyakin","Calculation of the effect of slit size on emittance measurements made by
  a two-slit scanner",,,,,"physics.acc-ph","http://arxiv.org/licenses/nonexclusive-distrib/1.0/","  Parallel slit-slit devices are commonly used to measure the transverse
emittance of a particle beam, selecting a portion of the beam with the front
slit and measuring the angular distribution with the rear. This paper
calculates the effect of finite slit sizes on measured emittance and Twiss
functions in the case of Gaussian spatial and angular distributions of the
oncoming beam. A formula for recovering the true emittance from the measured
values is derived.
","[{""version"":""v1"",""created"":""Fri, 20 Mar 2015 12:37:31 GMT""},{""version"":""v2"",""created"":""Mon, 11 Jan 2016 15:39:23 GMT""}]","2016-01-12"
"1503.06056","Falko Dulat","Charalampos Anastasiou, Claude Duhr, Falko Dulat, Franz Herzog and
  Bernhard Mistlberger","Higgs boson gluon-fusion production in N3LO QCD","5 pages, 3 figures","Phys. Rev. Lett. 114, 212001 (2015)","10.1103/PhysRevLett.114.212001","CERN-PH-TH/2015-055, CP3-15-07","hep-ph hep-ex","http://arxiv.org/licenses/nonexclusive-distrib/1.0/","  We present the cross-section for the production of a Higgs boson at
hadron-colliders at next-to- next-to-next-to-leading order (N3LO) in
perturbative QCD. The calculation is based on a method to perform a series
expansion of the partonic cross-section around the threshold limit to an
arbitrary order. We perform this expansion to sufficiently high order to obtain
the value of the hadronic cross at N3LO in the large top-mass limit. For
renormalisation and factorisation scales equal to half the Higgs mass, the N3LO
corrections are of the order of +2.2%. The total scale variation at N3LO is 3%,
reducing the uncertainty due to missing higher order QCD corrections by a
factor of three.
","[{""version"":""v1"",""created"":""Fri, 20 Mar 2015 12:41:38 GMT""}]","2015-06-03"
"1503.06057","Friedrich  Lippoth","Friedrich Lippoth, Georg Prokert","Stability of Equilibria of a two-phase Stokes-Osmosis problem",,,,,"math.AP","http://arxiv.org/licenses/nonexclusive-distrib/1.0/","  Within the framework of variational modelling we derive a two-phase moving
boundary problem that describes the motion of a semipermeable membrane
separating two viscous liquids in a fixed container. The model includes the
effects of osmotic pressure and surface tension of the membrane. For this
problem we prove that the manifold of steady states is locally exponentially
attractive.
","[{""version"":""v1"",""created"":""Fri, 20 Mar 2015 12:52:00 GMT""}]","2015-03-23"
"1503.06058","Johan Dahlin","Thomas B. Sch\""on, Fredrik Lindsten, Johan Dahlin, Johan W{\aa}gberg,
  Christian A. Naesseth, Andreas Svensson and Liang Dai","Sequential Monte Carlo Methods for System Identification","In proceedings of the 17th IFAC Symposium on System Identification
  (SYSID). Added cover page",,"10.1016/j.ifacol.2015.12.224",,"stat.CO math.OC stat.ML","http://arxiv.org/licenses/nonexclusive-distrib/1.0/","  One of the key challenges in identifying nonlinear and possibly non-Gaussian
state space models (SSMs) is the intractability of estimating the system state.
Sequential Monte Carlo (SMC) methods, such as the particle filter (introduced
more than two decades ago), provide numerical solutions to the nonlinear state
estimation problems arising in SSMs. When combined with additional
identification techniques, these algorithms provide solid solutions to the
nonlinear system identification problem. We describe two general strategies for
creating such combinations and discuss why SMC is a natural tool for
implementing these strategies.
","[{""version"":""v1"",""created"":""Fri, 20 Mar 2015 13:06:38 GMT""},{""version"":""v2"",""created"":""Fri, 16 Oct 2015 21:22:57 GMT""},{""version"":""v3"",""created"":""Thu, 10 Mar 2016 14:44:32 GMT""}]","2016-03-11"
"1503.06059","Michael Goldman","Michael Goldman, Marc Josien, Felix Otto","New bounds for the inhomogenous Burgers and the Kuramoto-Sivashinsky
  equations",,,,,"math.AP math.FA","http://arxiv.org/licenses/nonexclusive-distrib/1.0/","  We give a substantially simplified proof of near-optimal estimate on the
Kuramoto-Sivashinsky equation from [F. Otto, ""Optimal bounds on the
Kuramoto-Sivashinsky equation"", JFA 2009], at the same time slightly improving
the result. The result in the above cited paper relied on two ingredients: a
regularity estimate for capillary Burgers and an a novel priori estimate for
the inhomogeneous inviscid Burgers equation, which works out that in many ways
the conservative transport nonlinearity acts as a coercive term. It is the
proof of the second ingredient that we substantially simplify by proving a
modified K\'arm\'an-Howarth-Monin identity for solutions of the inhomogeneous
inviscid Burgers equation. This gives a new interpretation of the results
obtained in [F. Golse, B. Perthame ""Optimal regularizing effect for scalar
conservation laws"", Rev. Mat. Iber., 2013].
","[{""version"":""v1"",""created"":""Fri, 20 Mar 2015 13:12:20 GMT""}]","2015-03-23"
"1503.06060","Dominique Gay","Romain Guigour\`es, Dominique Gay, Marc Boull\'e, Fabrice Cl\'erot,
  Fabrice Rossi","Country-scale Exploratory Analysis of Call Detail Records through the
  Lens of Data Grid Models","Submitted to Industrial Track of ECML/PKDD 2015",,,,"cs.DB stat.ML","http://arxiv.org/licenses/nonexclusive-distrib/1.0/","  Call Detail Records (CDRs) are data recorded by telecommunications companies,
consisting of basic informations related to several dimensions of the calls
made through the network: the source, destination, date and time of calls. CDRs
data analysis has received much attention in the recent years since it might
reveal valuable information about human behavior. It has shown high added value
in many application domains like e.g., communities analysis or network
planning. In this paper, we suggest a generic methodology for summarizing
information contained in CDRs data. The method is based on a parameter-free
estimation of the joint distribution of the variables that describe the calls.
We also suggest several well-founded criteria that allows one to browse the
summary at various granularities and to explore the summary by means of
insightful visualizations. The method handles network graph data, temporal
sequence data as well as user mobility data stemming from original CDRs data.
We show the relevance of our methodology for various case studies on real-world
CDRs data from Ivory Coast.
","[{""version"":""v1"",""created"":""Fri, 20 Mar 2015 13:13:42 GMT""}]","2015-03-23"
"1503.06061","Jules Hedges","Jules Hedges","The selection monad as a CPS transformation",,,,,"cs.PL","http://arxiv.org/licenses/nonexclusive-distrib/1.0/","  A computation in the continuation monad returns a final result given a
continuation, ie. it is a function with type $(X \to R) \to R$. If we instead
return the intermediate result at $X$ then our computation is called a
selection function. Selection functions appear in diverse areas of mathematics
and computer science (especially game theory, proof theory and topology) but
the existing literature does not heavily emphasise the fact that the selection
monad is a CPS translation. In particular it has so far gone unnoticed that the
selection monad has a call/cc-like operator with interesting similarities and
differences to the usual call/cc, which we explore experimentally using
Haskell.
  Selection functions can be used whenever we find the intermediate result more
interesting than the final result. For example a SAT solver computes an
assignment to a boolean function, and then its continuation decides whether it
is a satisfying assignment, and we find the assignment itself more interesting
than the fact that it is or is not satisfying. In game theory we find the move
chosen by a player more interesting than the outcome that results from that
move. The author and collaborators are developing a theory of games in which
selection functions are viewed as generalised notions of rationality, used to
model players. By realising that strategic contexts in game theory are examples
of continuations we can see that classical game theory narrowly misses being in
CPS, and that a small change of viewpoint yields a theory of games that is
better behaved, and especially more compositional.
","[{""version"":""v1"",""created"":""Fri, 20 Mar 2015 13:28:02 GMT""}]","2015-03-23"
"1503.06062","Marcio Batista","M\'arcio Batista, Jos\'e I. Santos","On the first stability eigenvalue of surfaces with constant weighted
  mean curvature","12 pages",,,,"math.DG","http://arxiv.org/licenses/nonexclusive-distrib/1.0/","  Let $\Sigma$ be a compact immersed surface with constant weighted mean
curvature $H_f$ in a weighted manifold $(M^3,g,f)$. In this paper we obtain
upper bounds for the first eigenvalue of the weighted Jacobi operator on
$\Sigma$ in terms of $H_f$ and the curvature of the ambient. As consequence we
obtain that there is no stable self-shrinker of the mean curvature flow.
","[{""version"":""v1"",""created"":""Fri, 20 Mar 2015 13:29:19 GMT""}]","2015-03-23"
"1503.06063","Ioannis Papoutsakis","Ioannis Papoutsakis","Tree spanners of small diameter",,,,,"cs.DM","http://arxiv.org/licenses/nonexclusive-distrib/1.0/","  A graph that contains a spanning tree of diameter at most $t$ clearly admits
a tree $t$-spanner, since a tree $t$-spanner of a graph $G$ is a sub tree of
$G$ such that the distance between pairs of vertices in the tree is at most $t$
times their distance in $G$. In this paper, graphs that admit a tree
$t$-spanner of diameter at most $t+1$ are studied. For $t$ equal to 1 or 2 the
problem has been solved. For $t=3$ we present an algorithm that determines if a
graph admits a tree 3-spanner of diameter at most 4. For $t\geq4$ it is proved
that it is an NP-complete problem to decide whether a graph admits a tree
$t$-spanner of diameter at most $t+1$.
","[{""version"":""v1"",""created"":""Fri, 20 Mar 2015 13:30:08 GMT""}]","2015-03-23"
"1503.06064","Ignacio Villanueva","Ignacio Villanueva","Radial continuous rotation invariant valuations on star bodies","Two minor gaps and several typos corrected thanks to the referee","Adv. Math., 291 (2016), 961-981","10.1016/j.aim.2015.12.030",,"math.MG","http://arxiv.org/licenses/nonexclusive-distrib/1.0/","  We characterize the positive radial continuous and rotation invariant
valuations $V$ defined on the star bodies of $\mathbb R^n$ as the applications
on star bodies which admit an integral representation with respect to the
Lebesgue measure. That is, $$V(K)=\int_{S^{n-1}}\theta(\rho_K)dm,$$ where
$\theta$ is a positive continuous function, $\rho_K$ is the radial function
associated to $K$ and $m$ is the Lebesgue measure on $S^{n-1}$. As a corollary,
we obtain that every such valuation can be uniformly approximated on bounded
sets by a linear combination of dual quermassintegrals.
","[{""version"":""v1"",""created"":""Fri, 20 Mar 2015 13:33:40 GMT""},{""version"":""v2"",""created"":""Fri, 5 Feb 2016 15:06:48 GMT""}]","2016-02-08"
"1503.06065","Federico Sembolini","Federico Sembolini, Gustavo Yepes, Frazer R. Pearce, Alexander Knebe,
  Scott T. Kay, Chris Power, Weiguang Cui, Alexander M. Beck, Stefano Borgani,
  Claudio Dalla Vecchia, Romeel Dav\'e, Pascal Jahan Elahi, Sean February,
  Shuiyao Huang, Alex Hobbs, Neal Katz, Erwin Lau, Ian G. McCarthy, Giuseppe
  Murante, Daisuke Nagai, Kaylea Nelson, Richard D. A. Newton, Ewald Puchwein,
  Justin I. Read, Alexandro Saro, Joop Schaye, Robert J. Thacker","nIFTy galaxy cluster simulations I: dark matter & non-radiative models","21 pages, 13 figures, 4 tables - submitted to MNRAS",,"10.1093/mnras/stw250",,"astro-ph.CO","http://arxiv.org/licenses/nonexclusive-distrib/1.0/","  We have simulated the formation of a galaxy cluster in a $\Lambda$CDM
universe using twelve different codes modeling only gravity and non-radiative
hydrodynamics (\art, \arepo, \hydra\ and 9 incarnations of GADGET). This range
of codes includes particle based, moving and fixed mesh codes as well as both
Eulerian and Lagrangian fluid schemes. The various GADGET implementations span
traditional and advanced smoothed-particle hydrodynamics (SPH) schemes. The
goal of this comparison is to assess the reliability of cosmological
hydrodynamical simulations of clusters in the simplest astrophysically relevant
case, that in which the gas is assumed to be non-radiative. We compare images
of the cluster at $z=0$, global properties such as mass, and radial profiles of
various dynamical and thermodynamical quantities. The underlying gravitational
framework can be aligned very accurately for all the codes allowing a detailed
investigation of the differences that develop due to the various gas physics
implementations employed. As expected, the mesh-based codes ART and AREPO form
extended entropy cores in the gas with rising central gas temperatures. Those
codes employing traditional SPH schemes show falling entropy profiles all the
way into the very centre with correspondingly rising density profiles and
central temperature inversions. We show that methods with modern SPH schemes
that allow entropy mixing span the range between these two extremes and the
latest SPH variants produce gas entropy profiles that are essentially
indistinguishable from those obtained with grid based methods.
","[{""version"":""v1"",""created"":""Fri, 20 Mar 2015 13:36:15 GMT""}]","2016-02-17"
"1503.06066","W. Beugeling","W. Beugeling, E. Kalesaki, C. Delerue, Y.-M. Niquet, D.
  Vanmaekelbergh, and C. Morais Smith","Topological states in multi-orbital HgTe honeycomb lattices","includes supplementary material","Nat. Commun. 6:6316 (2015)","10.1038/ncomms7316",,"cond-mat.mes-hall cond-mat.mtrl-sci","http://creativecommons.org/licenses/by/3.0/","  Research on graphene has revealed remarkable phenomena arising in the
honeycomb lattice. However, the quantum spin Hall effect predicted at the K
point could not be observed in graphene and other honeycomb structures of light
elements due to an insufficiently strong spin-orbit coupling. Here we show
theoretically that 2D honeycomb lattices of HgTe can combine the effects of the
honeycomb geometry and strong spin-orbit coupling. The conduction bands,
experimentally accessible via doping, can be described by a tight-binding
lattice model as in graphene, but including multi-orbital degrees of freedom
and spin-orbit coupling. This results in very large topological gaps (up to 35
meV) and a flattened band detached from the others. Owing to this flat band and
the sizable Coulomb interaction, honeycomb structures of HgTe constitute a
promising platform for the observation of a fractional Chern insulator or a
fractional quantum spin Hall phase.
","[{""version"":""v1"",""created"":""Fri, 20 Mar 2015 13:41:46 GMT""}]","2015-03-23"
"1503.06067","Pere Ara","Pere Ara and Ruy Exel","K-theory for the tame C*-algebra of a separated graph","42 pages. Final version, to appear in Journal of Functional Analysis","Journal of Functional Analysis 269 (2015), 2995-3041",,,"math.OA","http://arxiv.org/licenses/nonexclusive-distrib/1.0/","  A {\it separated graph} is a pair $(E,C)$ consisting of a directed graph $E$
and a set $C=\bigsqcup_{v\in E^0}C_v$, where each $C_v$ is a partition of the
set of edges whose terminal vertex is $v$. Given a separated graph $(E,C)$,
such that all the sets $X\in C$ are finite, the K-theory of the graph
C*-algebra $C^*(E,C)$ is known to be determined by the kernel and the cokernel
of a certain map, denoted by $1_C- A_{(E,C)}$, from $\mathbb Z^{(C)}$ to
$\mathbb Z^{(E^0)}$. In this paper, we compute the K-theory of the {\it tame}
graph C*-algebra $\mathcal O(E,C)$ associated to $(E,C)$, which has been
recently introduced by the authors. Letting $\pi$ denote the natural surjective
homomorphism from $C^*(E,C)$ onto $\mathcal O(E,C)$, we show that $K_1(\pi)$ is
a group isomorphism, and that $K_0(\pi)$ is a split monomorphism, whose
cokernel is a torsion-free abelian group. We also prove that this cokernel is a
free abelian group when the graph $E$ is finite, and determine its generators
in terms of a sequence of separated graphs $\{(E_n, C^n)\}_{n=1}^{\infty}$
naturally attached to $(E,C)$. On the way to showing our main results, we
obtain an explicit description of a connecting map arising in a six-term exact
sequence computing the K-theory of an amalgamated free product, and we also
exhibit an explicit isomorphism between $\mathrm{ker} (1_C - A_{(E,C)})$ and
$K_1(C^*(E,C))$.
","[{""version"":""v1"",""created"":""Fri, 20 Mar 2015 13:41:55 GMT""},{""version"":""v2"",""created"":""Mon, 18 May 2015 15:15:14 GMT""}]","2015-09-30"
"1503.06068","Petro Lutsyk","M.P. Gorishnyi","Photoeffect in polythiopentacene films and influence of permanent
  illumination on it","ISSN 0503-1265","Ukr. J. Phys. 2007. V. 52, N 12, 1154-1161",,,"cond-mat.mtrl-sci","http://arxiv.org/licenses/nonexclusive-distrib/1.0/","  The internal photoeffect in polythiopentacene (PTP) films is investigated. It
is discovered that, in capacitor cells, the spectral dependence of the frontal
photo-emf Vf correlates with the PTP absorption spectrum, while that of the
back photo-emf Vb anticorrelates with it. The polarities of Vf and Vb coincide.
In this case, the charge of the free PTP surface is negative, whereas that of
the frontal SnO2 electrode is positive. Back low- and strong-absorption
illuminations photogenerate holes that diffuse to the free PTP surface and
decrease Vdf . These illuminations change the polarity of Vb. The spectra of
the density of short-circuit current Jsc of the sandwich cells SnO2 PTPAg and
Vb correlate. Under the modulated illumination of these cells through the SnO2
and Ag electrodes, the drift flow of nonequilibrium holes in the electric
field, conditioned by the antiblocking bending of the PTP bands near these
electrodes, prevails.
","[{""version"":""v1"",""created"":""Fri, 20 Mar 2015 13:44:25 GMT""}]","2015-03-23"
"1503.06069","Hubert Bornhorn","Hubert Bornhorn","Mahler measures, K-theory and values of L-functions","English version of authors 1998 PhD thesis (shortened)",,,,"math.NT","http://arxiv.org/licenses/nonexclusive-distrib/1.0/","  The Mahler measure of a polynomial $P$ in $n$ variables is defined as the
mean of $\log|P|$ over the $n$-dimensional torus. For certain polynomials with
integer coefficients in two variables the Mahler measure is known to be related
to special values of L-functions of arithmetic objects (e.g. Dirichlet
characters and elliptic curves over $\mathbb{Q}$). Inspired by work of Deninger
Boyd has investigated this relationship numerically. In this paper we reduce
some conjectures of Boyd to Beilinson`s conjectures on special values of
L-functions. The methods in use are widely of K-theoretical nature.
","[{""version"":""v1"",""created"":""Fri, 20 Mar 2015 13:46:25 GMT""}]","2015-03-23"
"1503.06070","Qinghai Zhong","Yushuang Fan and Qinghai Zhong","On the Erd{\H{o}}s-Ginzburg-Ziv constant of groups of the form
  $C_2^r\oplus C_n$",,,"10.1142/S1793042116500573",,"math.CO math.NT","http://creativecommons.org/licenses/by/3.0/","  Let $G$ be a finite abelian group. The Erd{\H{o}}s-Ginzburg-Ziv constant
$\mathsf s(G)$ of $G$ is defined as the smallest integer $l\in \mathbb{N}$ such
that every sequence $S$ over $G$ of length $|S|\geq l$ has a zero-sum
subsequence $T$ of length $|T|= {\exp}(G)$. The value of this classical
invariant for groups with rank at most two is known. But the precise value of
$\mathsf s(G)$ for the groups of rank larger than two is difficult to
determine. In this paper we pay our attentions to the groups of the form
$C_2^{r-1}\oplus C_{2n}$, where $r\geq 3$ and $n\ge 2$. We give a new upper
bound of $\mathsf s(C_2^{r-1}\oplus C_{2n})$ for odd integer $n$. For $r\in
[3,4]$, we obtain that $\mathsf s(C_2^2\oplus C_{2n})=4n+3$ for $n\ge 2$ and
$\mathsf s(C_2^{3}\oplus C_{2n})=4n+5$ for $n\geq 36$.
","[{""version"":""v1"",""created"":""Fri, 20 Mar 2015 13:46:51 GMT""}]","2015-09-16"
