"1505.02075","Marianna Nicolosi Asmundo","Domenico Cantone, Cristiano Longo, Marianna Nicolosi-Asmundo, Daniele
  Francesco Santamaria","Web ontology representation and reasoning via fragments of set theory",,,,,"cs.LO","http://arxiv.org/licenses/nonexclusive-distrib/1.0/","  In this paper we use results from Computable Set Theory as a means to
represent and reason about description logics and rule languages for the
semantic web.
  Specifically, we introduce the description logic $\mathcal{DL}\langle
4LQS^R\rangle(\D)$--admitting features such as min/max cardinality constructs
on the left-hand/right-hand side of inclusion axioms, role chain axioms, and
datatypes--which turns out to be quite expressive if compared with
$\mathcal{SROIQ}(\D)$, the description logic underpinning the Web Ontology
Language OWL. Then we show that the consistency problem for
$\mathcal{DL}\langle 4LQS^R\rangle(\D)$-knowledge bases is decidable by
reducing it, through a suitable translation process, to the satisfiability
problem of the stratified fragment $4LQS^R$ of set theory, involving variables
of four sorts and a restricted form of quantification. We prove also that,
under suitable not very restrictive constraints, the consistency problem for
$\mathcal{DL}\langle 4LQS^R\rangle(\D)$-knowledge bases is
\textbf{NP}-complete. Finally, we provide a $4LQS^R$-translation of rules
belonging to the Semantic Web Rule Language (SWRL).
","[{""version"":""v1"",""created"":""Fri, 8 May 2015 16:00:44 GMT""}]","2015-05-11"
"1505.02076","Azam Rahmatinejad","Azam Rahmatinejad, Tayeb Kakavand, Rohallah Razavi","Studying the entropy excess and entropy excess ratio in (105,106,107)Pd
  within BCS model",,,,,"nucl-th","http://arxiv.org/licenses/nonexclusive-distrib/1.0/","  Pairing correlations and their influence on nuclear properties has been
studied within BCS model. Using this theoretical model with inclusion of
pairing interaction between nucleons, nuclear level density and entropy of
Pd(105,106,107) have been extracted. The results well coincide with the
empirical values of the nuclear level densities obtained by Oslo group. Then
the entropy excess of Pd107 and Pd105 compared to Pd106 as a function of the
temperature has been studied. Also the role of neutron and proton system in
entropy excess have been investigated by the using of the entropy excess ratio
proposed by Razavi et al. [R. Razavi, A.N. Behkami, S. Mohammadi, and M.
Gholami, Phys. Rev. C 86, 047303 (2012)].
","[{""version"":""v1"",""created"":""Fri, 8 May 2015 16:01:38 GMT""}]","2015-05-11"
"1505.02077","Marta Ferreira","Helena Ferreira and Marta Ferreira","Estimating the extremal index through local dependence",,,,,"math.ST stat.TH","http://arxiv.org/licenses/nonexclusive-distrib/1.0/","  The extremal index is an important parameter in the characterization of
extreme values of a stationary sequence. Our new estimation approach for this
parameter is based on the extremal behavior under the local dependence
condition D$^{(k)}$($u_n$). We compare a process satisfying one of this
hierarchy of increasingly weaker local mixing conditions with a process of
cycles satisfying the D$^{(2)}$($u_n$) condition. We also analyze local
dependence within moving maxima processes and derive a necessary and sufficient
condition for D$^{(k)}$($u_n$). In order to evaluate the performance of the
proposed estimators, we apply an empirical diagnostic for local dependence
conditions, we conduct a simulation study and compare with existing methods. An
application to a financial time series is also presented.
","[{""version"":""v1"",""created"":""Fri, 8 May 2015 16:02:06 GMT""}]","2015-05-11"
"1505.02078","John Williamson Dr.","John J. Williamson, Peter D. Olmsted","Kinetics of symmetry and asymmetry in a phase-separating bilayer
  membrane","Typos corrected. In press, Phys. Rev. E., Supplemental Material
  (videos) will be available through the journal website","Physical Review E, 92 (2015) 052721","10.1103/PhysRevE.92.052721",,"cond-mat.soft cond-mat.stat-mech physics.bio-ph","http://arxiv.org/licenses/nonexclusive-distrib/1.0/","  We simulate a phase-separating a bilayer in which the leaflets experience a
direct coupling favouring local compositional symmetry (""registered"" bilayer
phases), and an indirect coupling due to hydrophobic mismatch that favours
strong local asymmetry (""antiregistered"" bilayer phases). For wide ranges of
overall leaflet compositions, multiple competing states are possible. For
estimated physical parameters, a quenched bilayer may first evolve toward a
metastable state more asymmetric than if the leaflets were uncorrelated;\
subsequently, it must nucleate to reach its equilibrium, more symmetric, state.
These phase-transition kinetics exhibit characteristic signatures through which
fundamental and opposing inter-leaflet interactions may be probed. We emphasise
how bilayer phase diagrams with a separate axis for each leaflet can account
for overall and local symmetry/asymmetry, and capture a range of observations
in the experiment and simulation literature.
","[{""version"":""v1"",""created"":""Fri, 8 May 2015 16:02:17 GMT""},{""version"":""v2"",""created"":""Fri, 31 Jul 2015 17:31:30 GMT""},{""version"":""v3"",""created"":""Thu, 29 Oct 2015 13:22:08 GMT""},{""version"":""v4"",""created"":""Wed, 25 Nov 2015 14:29:42 GMT""}]","2016-04-12"
"1505.02079","Vasili Stumpf","Vasili Stumpf, Kirill Gokhberg, and Lorenz S. Cederbaum","The role of metal ions in X-ray induced photochemistry","Supplementary Material added; Bibliography updated",,"10.1038/nchem.2429",,"physics.chem-ph physics.atm-clus","http://arxiv.org/licenses/nonexclusive-distrib/1.0/","  Metal ions play numerous important roles in biological systems being central
to the function of biomolecules. In this letter we show that the absorption of
X-rays by these ions leads to a complicated chain of ultrafast relaxation steps
resulting in the complete degradation of their nearest environment. We
conducted high quality ab initio studies on microsolvated Mg clusters
demonstrating that ionisation of an 1s-electron of Mg leads to a complicated
electronic cascade comprising both intra- and intermolecular steps and lasting
only a few hundreds femtoseconds. The metal cation reverts to its original
charge state at the end of the cascade, while the nearest solvation shell
becomes multiply ionised and large concentrations of radical and slow electron
species build up in the metal vicinity. We conclude that such cascades
involving metal ions are essential for understanding the radiation chemistry of
solutions and radiation damage to metal containing biomolecules.
","[{""version"":""v1"",""created"":""Fri, 8 May 2015 16:03:51 GMT""},{""version"":""v2"",""created"":""Tue, 12 May 2015 16:58:23 GMT""}]","2016-03-23"
"1505.02080","Andrea Addazi AndAdd","Andrea Addazi","Neutron-antineutron transition as a test-bed for dynamical CPT
  violations","More references. More comments about phenomenological aspects and
  model building",,"10.1142/S0217751X16500846",,"hep-ph","http://arxiv.org/licenses/nonexclusive-distrib/1.0/","  We show a simple mechanism for a dynamical CPT violation in the neutron
sector. In particular, we show a {\it CPT-violating see-saw mechanism},
generating a Majorana mass and a CPT violating mass for the neutron.
CPT-violating see-saw involves a sterile partner of the neutron, living in a
hidden sector, in which CPT is spontaneously broken. In particular, neutrons
(antineutrons) can communicate with the hidden sector through non-perturbative
quantum gravity effects called {\it exotic instantons}. Exotic instantons
dynamically break R-parity, generating one effective vertex between the neutron
and its sterile partner. In this way, we show how a small CPT violating mass
term for the neutron is naturally generated. This model can be tested in the
next generation of experiments in neutron-antineutron physics. This strongly
motivates researches of CPT-violating effects in neutron-antineutron physics,
as a test-bed for dynamical CPT-violations in SM.
","[{""version"":""v1"",""created"":""Fri, 8 May 2015 16:05:02 GMT""},{""version"":""v2"",""created"":""Thu, 11 Jun 2015 12:35:21 GMT""},{""version"":""v3"",""created"":""Mon, 6 Jul 2015 15:23:09 GMT""},{""version"":""v4"",""created"":""Sun, 30 Aug 2015 16:40:49 GMT""}]","2016-06-29"
"1505.02081","Koen Thas","Manuel M\'erida-Angulo and Koen Thas","Deitmar schemes, graphs and zeta functions","49 pages; preprint (May 2015)",,,,"math.AG","http://arxiv.org/licenses/nonexclusive-distrib/1.0/","  In [19] it was explained how one can naturally associate a Deitmar scheme
(which is a scheme defined over the field with one element, $\mathbb{F}_1$) to
a so-called ""loose graph"" (which is a generalization of a graph). Several
properties of the Deitmar scheme can be proven easily from the combinatorics of
the (loose) graph, and known realizations of objects over $\mathbb{F}_1$ such
as combinatorial $\mathbb{F}_1$-projective and $\mathbb{F}_1$-affine spaces
exactly depict the loose graph which corresponds to the associated Deitmar
scheme. In this paper, we first modify the construction of loc. cit., and show
that Deitmar schemes which are defined by finite trees (with possible end
points) are ""defined over $\mathbb{F}_1$"" in Kurokawa's sense; we then derive a
precise formula for the Kurokawa zeta function for such schemes (and so also
for the counting polynomial of all associated $\mathbb{F}_q$-schemes). As a
corollary, we find a zeta function for all such trees which contains
information such as the number of inner points and the spectrum of degrees, and
which is thus very different than Ihara's zeta function (which is trivial in
this case). Using a process called ""surgery,"" we show that one can determine
the zeta function of a general loose graph and its associated { Deitmar,
Grothendieck }-schemes in a number of steps, eventually reducing the
calculation essentially to trees. We study a number of classes of examples of
loose graphs, and introduce the Grothendieck ring of $\mathbb{F}_1$-schemes
along the way in order to perform the calculations. Finally, we compare the new
zeta function to Ihara's zeta function for graphs in a number of examples, and
include a computer program for performing more tedious calculations.
","[{""version"":""v1"",""created"":""Fri, 8 May 2015 16:08:46 GMT""}]","2016-08-08"
"1505.02083","Gregory Edwards","Gregory Edwards","A scalar curvature bound along the conical K\""ahler-Ricci flow","23 pages",,,,"math.DG","http://arxiv.org/licenses/nonexclusive-distrib/1.0/","  Starting with a model conical K\""ahler metric, we prove a uniform scalar
curvature bound for solutions to the conical K\""ahler-Ricci flow assuming a
semi-ampleness type condition on the twisted canonical bundle. In the proof, we
also establish uniform estimates for the potentials and their time derivatives.
","[{""version"":""v1"",""created"":""Fri, 8 May 2015 16:11:57 GMT""}]","2015-05-11"
"1505.02084","Ian Leroux","Nils Scharnhorst, Jannes B. W\""ubbena, Stephan Hannig, Kornelius
  Jakobsen, Johannes Kramer, Ian D. Leroux and Piet O. Schmidt","High-bandwidth transfer of phase stability through a fiber frequency
  comb","6 pages, 3 figures. To be published in Optics Express. Clarified
  method for measuring laser noise spectra. Improved spectroscopic data in Fig.
  3, with motional decoherence now suppressed","Optics Express 23, 19771-19776 (2015)","10.1364/OE.23.019771",,"physics.optics physics.atom-ph","http://arxiv.org/licenses/nonexclusive-distrib/1.0/","  We demonstrate phase locking of a 729 nm diode laser to a 1542 nm master
laser via an erbium-doped-fiber frequency comb, using a transfer-oscillator
feedforward scheme which suppresses the effect of comb noise in an
unprecedented 1.8 MHz bandwidth. We illustrate its performance by carrying out
coherent manipulations of a trapped calcium ion with 99 % fidelity even at
few-microsecond timescales. We thus demonstrate that transfer-oscillator
locking can provide sufficient phase stability for high-fidelity quantum logic
manipulation even without pre-stabilization of the slave diode laser.
","[{""version"":""v1"",""created"":""Fri, 8 May 2015 16:14:12 GMT""},{""version"":""v2"",""created"":""Tue, 30 Jun 2015 15:01:21 GMT""}]","2016-01-15"
"1505.02085","Shahid Shah","Shahid M. Shah and Vinod Sharma","Enhancing Secrecy Rate Region for Recent Messages for a Slotted Multiple
  Access Wiretap Channel to Shannon Capacity Region","Submitted to a journal for possible publication",,,,"cs.IT cs.CR math.IT","http://arxiv.org/licenses/nonexclusive-distrib/1.0/","  Security constraint results in \textit{rate-loss} in wiretap channels. In
this paper we propose a coding scheme for two user Multiple Access Channel with
Wiretap (MAC-WT), where previous messages are used as a key to enhance the
secrecy rates of both the users until we achieve the usual capacity region of a
Multiple Access Channel (MAC) without the wiretapper (Shannon capacity region).
With this scheme all the messages transmitted in the recent past are secure
with respect to all the information of the eavesdropper till now. To achieve
this goal we introduce secret key buffers at both the users, as well as at the
legitimate receiver (Bob). Finally we consider a fading MAC-WT and show that
with this coding/decoding scheme we can achieve the capacity region of a fading
MAC (in ergodic sense).
","[{""version"":""v1"",""created"":""Fri, 8 May 2015 16:14:14 GMT""},{""version"":""v2"",""created"":""Wed, 13 May 2015 11:14:04 GMT""},{""version"":""v3"",""created"":""Sun, 15 Jan 2017 06:15:54 GMT""}]","2017-01-17"
"1505.02086","Zhiyi Chi","Zhiyi Chi","Random reversible Markov matrices with tunable extremal eigenvalues",,,,,"math.PR","http://arxiv.org/licenses/nonexclusive-distrib/1.0/","  Random sampling of large Markov matrices with a tunable spectral gap, a
nonuniform stationary distribution, and a nondegenerate limiting empirical
spectral distribution (ESD) is useful. Fix $c>0$ and $p>0$. Let $A_n$ be the
adjacency matrix of a random graph following $\mathrm{G}(n, p/n)$, known as the
Erd\H{o}s-R\'enyi distribution. Add $c/n$ to each entry of $A_n$ and then
normalize its rows. It is shown that the resulting Markov matrix has the
desired properties. Its ESD weakly converges in probability to a symmetric
nondegenerate distribution, and its extremal eigenvalues, other than 1, fall in
$[-1/\sqrt{1+c/k},-b]\cup [b,1/\sqrt{1+c/k}]$ for any $0< b < 1/\sqrt{1+c}$,
where $k = \lfloor p \rfloor + 1$. Thus, for $p\in (0,1)$, the spectral gap
tends to $1-1/\sqrt{1+c}$.
","[{""version"":""v1"",""created"":""Fri, 8 May 2015 16:14:18 GMT""},{""version"":""v2"",""created"":""Tue, 8 Sep 2015 14:18:16 GMT""}]","2015-09-09"
"1505.02087","Andreas Fring","Boubakeur Khantoul and Andreas Fring","Time-dependent massless Dirac fermions in graphene","5 pages","Physics Letters A 379 (2015) 2704","10.1016/j.physleta.2015.08.011",,"quant-ph cond-mat.mes-hall","http://arxiv.org/licenses/nonexclusive-distrib/1.0/","  Using the Lewis-Riesenfeld method of invariants we construct explicit
analytical solutions for the massless Dirac equation in 2+1 dimensions
describing quasi-particles in graphene. The Hamiltonian of the system
considered contains some explicit time-dependence in addition to one resulting
from being minimally coupled to a time-dependent magnetic field. The eigenvalue
equations for the two spinor components of the Lewis-Riesenfeld invariant are
found to decouple into a pair of supersymmetric invariants in a similar fashion
as the known decoupling for the time-independent Dirac Hamiltonians.
","[{""version"":""v1"",""created"":""Fri, 8 May 2015 16:17:32 GMT""},{""version"":""v2"",""created"":""Tue, 15 Sep 2015 12:38:36 GMT""}]","2015-09-16"
"1505.02088","Giovanni Italo Martone","Giovanni I. Martone","Visibility and stability of superstripes in a spin-orbit-coupled
  Bose-Einstein condensate","11 pages, 6 figures, peer-reviewed conference proceedings published
  on the EPJ-ST volume ""Novel Quantum Phases and Mesoscopic Physics in Quantum
  Gases"". The content of this article has been partially included in the review
  paper arXiv:1410.5526","Eur. Phys. J. Special Topics 224, 553 (2015)","10.1140/epjst/e2015-02386-x",,"cond-mat.quant-gas","http://arxiv.org/licenses/nonexclusive-distrib/1.0/","  We consider a spin-$1/2$ Bose-Einstein condensate with equal Rashba and
Dresselhaus spin-orbit coupling. After reviewing some relevant features of the
quantum phases of the system, we present a short study on how their properties
are changed by the presence of non-zero magnetic detunings and spin-asymmetric
interactions. At small values of the Raman coupling and of the magnetic field
the so-called stripe phase occurs, which displays both superfluidity and
periodic density modulations, in analogy with supersolids. We finally review a
recent proposal (Phys. Rev. A 90, 041604) to improve the visibility of the
fringes, based on the space separation of the two spin components into a 2D
bi-layer configuration and on the application of a $\pi/2$ Bragg pulse, and we
show that this new configuration also yields a sizable increase of the
stability of the stripe phase against magnetic fluctuations.
","[{""version"":""v1"",""created"":""Fri, 8 May 2015 16:18:18 GMT""},{""version"":""v2"",""created"":""Mon, 5 Oct 2015 09:08:52 GMT""}]","2015-10-06"
"1505.02089","Jorge Pullin","Jorge Pullin","The ADM papers and part of their modern legacy: loop quantum gravity","7 pages, prepared for Classical and Quantum Gravity for its
  ""Milestones of General Relativity"" focus issue to be published during the
  Centenary Year of GR",,"10.1088/0264-9381/32/12/124004","LSU-REL-050815","gr-qc hep-th quant-ph","http://arxiv.org/licenses/nonexclusive-distrib/1.0/","  We present a summary for non-specialists of loop quantum gravity as part of
the modern legacy of the series of papers by Arnowitt, Deser and Misner circa
1960.
","[{""version"":""v1"",""created"":""Fri, 8 May 2015 16:18:58 GMT""}]","2015-06-17"
"1505.02090","Patrick McCauley","Patrick I. McCauley, Yingna Su, Nicole Schanche, Kaitlin E. Evans,
  Chuan Su, Sean McKillop, and Katharine K. Reeves","Prominence and Filament Eruptions Observed by the Solar Dynamics
  Observatory: Statistical Properties, Kinematics, and Online Catalog","Accepted by Solar Physics; 40 pages, 20 figures, 5 tables",,"10.1007/s11207-015-0699-7",,"astro-ph.SR physics.plasm-ph","http://arxiv.org/licenses/nonexclusive-distrib/1.0/","  We present a statistical study of prominence and filament eruptions observed
by the Atmospheric Imaging Assembly (AIA) aboard the Solar Dynamics Observatory
(SDO). Several properties are recorded for 904 events that were culled from the
Heliophysics Event Knowledgebase (HEK) and incorporated into an online catalog
for general use. These characteristics include the filament and eruption type,
eruption symmetry and direction, apparent twisting and writhing motions, and
the presence of vertical threads and coronal cavities. Associated flares and
white-light coronal mass ejections (CME) are also recorded. Total rates are
given for each property along with how they differ among filament types. We
also examine the kinematics of 106 limb events to characterize the distinct
slow- and fast-rise phases often exhibited by filament eruptions. The average
fast-rise onset height, slow-rise duration, slow-rise velocity, maximum
field-of-view (FOV) velocity, and maximum FOV acceleration are 83 Mm, 4.4
hours, 2.1 km/s, 106 km/s, and 111 m/s^2, respectively. All parameters exhibit
lognormal probability distributions similar to that of CME speeds. A positive
correlation between latitude and fast-rise onset height is found, which we
attribute to a corresponding negative correlation in the average vertical
magnetic field gradient, or decay index, estimated from potential field source
surface (PFSS) extrapolations. We also find the decay index at the fast-rise
onset point to be 1.1 on average, consistent with the critical instability
threshold theorized for straight current channels. Finally, we explore
relationships between the derived kinematics properties and apparent twisting
motions. We find that events with evident twist have significantly faster CME
speeds and significantly lower fast-rise onset heights, suggesting
relationships between these values and flux rope helicity.
","[{""version"":""v1"",""created"":""Fri, 8 May 2015 16:21:31 GMT""}]","2015-05-11"
"1505.02091","Ale\v{s} Bizjak","Arno Pauly, Willem Fouch\'e, George Davie","Weihrauch-completeness for layerwise computability",,"Logical Methods in Computer Science, Volume 14, Issue 2 (May 22,
  2018) lmcs:4519","10.23638/LMCS-14(2:11)2018",,"cs.LO","http://creativecommons.org/licenses/by/4.0/","  We introduce the notion of being Weihrauch-complete for layerwise
computability and provide several natural examples related to complex
oscillations, the law of the iterated logarithm and Birkhoff's theorem. We also
consider hitting time operators, which share the Weihrauch degree of the former
examples but fail to be layerwise computable.
","[{""version"":""v1"",""created"":""Fri, 8 May 2015 16:26:07 GMT""},{""version"":""v2"",""created"":""Tue, 4 Apr 2017 16:14:53 GMT""},{""version"":""v3"",""created"":""Sun, 18 Feb 2018 14:15:38 GMT""},{""version"":""v4"",""created"":""Fri, 6 Apr 2018 14:42:54 GMT""},{""version"":""v5"",""created"":""Sun, 20 May 2018 09:15:39 GMT""}]","2018-06-28"
"1505.02092","Alessio Corti","Alessio Corti and Liana Heuberger","Del Pezzo surfaces with 1/3(1,1) points","42 pages. v2: model construction added of last remaining surface,
  minor corrections, minor changes to presentation, references added",,,,"math.AG","http://arxiv.org/licenses/nonexclusive-distrib/1.0/","  We classify del Pezzo surfaces with 1/3(1,1) points in 29 qG-deformation
families grouped into six unprojection cascades (this overlaps with work of
Fujita and Yasutake), we tabulate their biregular invariants, we give good
model constructions for surfaces in all families as degeneracy loci in rep
quotient varieties and we prove that precisely 26 families admit
qG-degenerations to toric surfaces. This work is part of a program to study
mirror symmetry for orbifold del Pezzo surfaces.
","[{""version"":""v1"",""created"":""Fri, 8 May 2015 16:29:56 GMT""},{""version"":""v2"",""created"":""Tue, 6 Oct 2015 13:36:59 GMT""}]","2015-10-07"
"1505.02093","Ali \""Ovg\""un","I. Sakalli and A. Ovgun","Tunneling of Vector Particles from Lorentzian Wormholes in 3+1
  Dimensions","4 pages","Eur. Phys. J. Plus (2015) 130: 110","10.1140/epjp/i2015-15110-9",,"gr-qc","http://arxiv.org/licenses/nonexclusive-distrib/1.0/","  In this article, we consider the Hawking radiation (HR) of vector (massive
spin-1) particles from the traversable Lorentzian wormholes (TLWH) in 3+1
dimensions. We start by providing the Proca equations for the TLWH. Using the
Hamilton-Jacobi (HJ)ans\""{a}tz with the WKB approximation in the quantum
tunneling method, we obtain the probabilities of the emission/absorption modes.
Then, we derive the tunneling rate of the emitted vector particles and manage
to read the standard Hawking temperature of the TLWH. The result obtained
represents a negative temperature, which is also discussed.
","[{""version"":""v1"",""created"":""Fri, 8 May 2015 16:30:33 GMT""}]","2015-06-09"
"1505.02094","Chittaranjan Hens","Chittaranjan Hens, Syamal K. Dana, Ulrike Feudel","Extreme multistability: Attractor manipulation and robustness","15 pages, 6 figures, accepted in Chaos",,"10.1063/1.4921351",,"nlin.CD nlin.AO","http://arxiv.org/licenses/nonexclusive-distrib/1.0/","  The coexistence of infinitely many attractors is called extreme
multistability in dynamical systems. In coupled systems, this phenomenon is
closely related to partial synchrony and characterized by the emergence of a
conserved quantity. We propose a general design of coupling that leads to
partial synchronization, which may be a partial complete synchronization or
partial antisynchronization and even a mixed state of complete synchronization
and antisynchronization in two coupled systems and, thereby reveal the
emergence of extreme multistability. The proposed design of coupling has wider
options and allows amplification or attenuation of the amplitude of the
attractors whenever it is necessary. We demonstrate that this phenomenon is
robust to parameter mismatch of the coupled oscillators.
","[{""version"":""v1"",""created"":""Fri, 8 May 2015 16:45:50 GMT""}]","2015-06-11"
"1505.02095","Thomas Zojer","Eric Bergshoeff, Jan Rosseel, Thomas Zojer","Newton-Cartan (super)gravity as a non-relativistic limit","29 pages; v2: added comment about different NR gravities and more
  refs; v3: more refs, matches published version","Class.Quant.Grav. 32 (2015) 205003","10.1088/0264-9381/32/20/205003","UG-15-68, TUW-15-16","hep-th gr-qc","http://arxiv.org/licenses/nonexclusive-distrib/1.0/","  We define a procedure that, starting from a relativistic theory of
supergravity, leads to a consistent, non-relativistic version thereof. As a
first application we use this limiting procedure to show how the Newton-Cartan
formulation of non-relativistic gravity can be obtained from general
relativity. Then we apply it in a supersymmetric case and derive a novel,
non-relativistic, off-shell formulation of three-dimensional Newton-Cartan
supergravity.
","[{""version"":""v1"",""created"":""Fri, 8 May 2015 16:47:21 GMT""},{""version"":""v2"",""created"":""Wed, 27 May 2015 09:51:58 GMT""},{""version"":""v3"",""created"":""Mon, 28 Sep 2015 15:05:49 GMT""}]","2015-09-29"
