"1505.02236","Nitin Nitsure","Sudarshan Gurjar and Nitin Nitsure","Schematic Harder-Narasimhan stratification for families of principal
  bundles in higher dimensions","Reason for re-submission: Simplified definitions and presentation. 27
  pages",,,,"math.AG","http://arxiv.org/licenses/nonexclusive-distrib/1.0/","  For any family of principal bundles with a reductive structure group G on a
family X/S of smooth projective varieties in characteristic zero, it is known
that the parameter scheme S has a set theoretic stratification by locally
closed subsets which correspond to the Harder-Narasimhan types of the
restriction of the principal bundle to the various fibers of X/S. We show that
each of these subsets has in fact the structure of a locally closed subscheme
of the parameter scheme S, with the following universal property: Under any
base change, the pullback family admits a relative Harder-Narasimhan filtration
(defined appropriately) with a given Harder-Narasimhan type if and only if the
base change factors via the schematic stratum corresponding to that
Harder-Narasimhan type. It follows that principal bundles of any given
Harder-Narasimhan type on X/S form an Artin algebraic stack over S, and as the
Harder-Narasimhan type varies, these stacks define a stratification the stack
of all principal G-bundles on X/S by locally closed substacks.
  This result extends to principal bundles in higher dimensions our earlier
similar results which were proved for principal bundles on families of curves.
The result is new even for vector bundles, that is, for G = GL(n).
","[{""version"":""v1"",""created"":""Sat, 9 May 2015 07:32:59 GMT""},{""version"":""v2"",""created"":""Sat, 1 Oct 2016 05:42:51 GMT""}]","2016-10-04"
"1505.02237","Chuanzhong  Li","Yu Zhang, Chuanzhong Li, Jingsong He","Rogue waves in a resonant erbium-doped fiber system with higher-order
  effects","25 Pages Applied Mathematics and Computation 273(2016) 826-841",,"10.1016/j.amc.2015.10.015",,"nlin.SI math-ph math.MP physics.optics","http://arxiv.org/licenses/nonexclusive-distrib/1.0/","  We mainly investigate a coupled system of the generalized nonlinear
Schr\""odinger equation and the Maxwell-Bloch equations which describes the wave
propagation in an erbium-doped nonlinear fiber with higher-order effects
including the forth-order dispersion and quintic non-Kerr nonlinearity. We
derive the one-fold Darbox transformation of this system and construct the
determinant representation of the $n$-fold Darboux transformation. Then the
determinant representation of the $n$th new solutions $(E^{[n]},\, p^{[n]},\,
\eta^{[n]})$ which were generated from the known seed solutions $(E, \, p, \,
\eta)$ is established through the $n$-fold Darboux transformation. The
solutions $(E^{[n]},\, p^{[n]},\, \eta^{[n]})$ provide the bright and dark
breather solutions of this system. Furthermore, we construct the determinant
representation of the $n$th-order bright and dark rogue waves by Taylor
expansions and also discuss the hybrid solutions which are the nonlinear
superposition of the rogue wave and breather solutions.
","[{""version"":""v1"",""created"":""Sat, 9 May 2015 07:44:04 GMT""},{""version"":""v2"",""created"":""Fri, 13 Nov 2015 09:02:17 GMT""}]","2015-11-16"
"1505.02238","Hojjat Mostafanasab","Hojjat Mostafanasab","2-D Skew Constacyclic Codes Over $R[x,y,\rho,\theta]$","13 pages. This paper has been published in Journal of Algebra and
  Related Topics, Vol. 4, No 2, (2016), pp 49-63",,,,"math.RA","http://arxiv.org/licenses/nonexclusive-distrib/1.0/","  In this paper, we give some characterizations of the ring
$R[x,y,\rho,\theta]$ where R is a commutative ring. We investigate 2-D skew
$(\lambda_1,\lambda_2)$-constacyclic codes.
","[{""version"":""v1"",""created"":""Sat, 9 May 2015 07:44:47 GMT""},{""version"":""v2"",""created"":""Mon, 2 Jan 2017 18:00:02 GMT""}]","2017-01-03"
"1505.02239","Cheng Li Mr.","Cheng Li, S. R. Souza, M. B. Tsang and Feng-Shou Zhang","Nuclear energy release from fragmentation",,,"10.1016/j.nuclphysa.2016.04.002",,"nucl-th","http://arxiv.org/licenses/nonexclusive-distrib/1.0/","  Nuclear energy released by splitting Uranium and Thorium isotopes into two,
three, four, up to eight fragments with nearly equal size are studied. We found
that the energy released come from equally splitting the $^{235,238}$U and
$^{230,232}$Th nuclei into to three fragments is largest. The statistical
multifragmentation model is employed to calculate the probability of different
breakup channels for the excited nuclei. Weighing the the probability
distributions of fragments multiplicity at different excitation energies for
the $^{238}$U nucleus, we found that an excitation energy between 1.2 and 2
MeV/u is optimal for the $^{235}$U, $^{238}$U, $^{230}$Th and $^{232}$Th nuclei
to release nuclear energy of about 0.7-0.75 MeV/u.
","[{""version"":""v1"",""created"":""Sat, 9 May 2015 08:09:53 GMT""},{""version"":""v2"",""created"":""Tue, 12 May 2015 08:23:11 GMT""},{""version"":""v3"",""created"":""Wed, 13 May 2015 05:00:35 GMT""},{""version"":""v4"",""created"":""Mon, 18 May 2015 02:31:50 GMT""}]","2016-05-04"
"1505.02240","Hideo Hosono","Hideo Hosono, Keiichi Tanabe, Eiji Takayama-Muromachi, Hiroshi
  Kageyama, Shoji Yamanaka, Hiroshi Kumakura, Minoru Nahara, Hidenori
  Hiramatsu, and Satoru Fujitsu","Exploration of new superconductors and functional materials and
  fabrication of superconducting tapes and wires of iron pnictides","141 pages, 127 Figures, 14 Tables, 535 Refrences","Sci. Technol. Adv. Mater. 16, 033503-1-86 (2015) Open Access","10.1088/1468-6996/16/3/033503",,"cond-mat.supr-con","http://arxiv.org/licenses/nonexclusive-distrib/1.0/","  This paper reviews the highlights of a 4-years-long research project
supported by the Japanese Government to explore new superconducting materials
and relevant functional materials. The project found several tens of new
superconductors by examining ~1000 materials, each of which was chosen by
Japanese team member experts with a background in solid state chemistry. This
review summarizes the major achievements of the project in newly found
superconducting materials, and the wire and tape fabrication of iron-based
superconductors. It is a unique feature of this review to incorporate a list of
~700 unsuccessful materials examined for superconductivity in the project. In
addition, described are new functional materials and functionalities discovered
during the project.
","[{""version"":""v1"",""created"":""Sat, 9 May 2015 08:17:23 GMT""}]","2015-05-12"
"1505.02241","Or Katz","Or Katz, Or Peleg, Ofer Firstenberg","Coherent coupling of alkali atoms by random collisions",,"Phys. Rev. Lett. 115, 113003 (2015)","10.1103/PhysRevLett.115.113003",,"physics.atom-ph quant-ph","http://arxiv.org/licenses/nonexclusive-distrib/1.0/","  Random spin-exchange collisions in warm alkali vapor cause rapid decoherence
and act to equilibriate the spin state of the atoms. In contrast, here we
demonstrate experimentally and theoretically a coherent coupling of one alkali
specie to another specie, mediated by these random collisions. We show that,
the minor specie (potassium) inherits the magnetic properties of the dominant
specie (rubidium), including its lifetime (T1), coherence time (T2),
gyromagnetic ratio, and SERF magnetic-field threshold. We further show that
this coupling can be completely controlled by varying the strength of the
magnetic field. Finally, we explain these phenomena analytically by
modes-mixing of the two species via spin-exchange collisions.
","[{""version"":""v1"",""created"":""Sat, 9 May 2015 08:22:00 GMT""}]","2015-09-16"
"1505.02242","Alexander Cherny Yu.","Alexander Yu. Cherny, Jean-S\'ebastien Caux, and Joachim Brand","Landau instability and mobility edges of the interacting one-dimensional
  Bose gas in weak random potentials","9 pages, 4 figures","J. Phys. B: At. Mol. Opt. Phys. 51, 015301 (2018)","10.1088/1361-6455/aa9803",,"cond-mat.quant-gas","http://arxiv.org/licenses/nonexclusive-distrib/1.0/","  We study the frictional force exerted on the trapped, interacting 1D Bose gas
under the influence of a moving random potential. Specifically we consider weak
potentials generated by optical speckle patterns with finite correlation
length. We show that repulsive interactions between bosons lead to a superfluid
response and suppression of frictional force, which can inhibit the onset of
Anderson localisation. We perform a quantitative analysis of the Landau
instability based on the dynamic structure factor of the integrable
Lieb-Liniger model and demonstrate the existence of effective mobility edges.
","[{""version"":""v1"",""created"":""Sat, 9 May 2015 08:22:37 GMT""},{""version"":""v2"",""created"":""Thu, 7 Apr 2016 07:32:52 GMT""},{""version"":""v3"",""created"":""Sat, 1 Jul 2017 19:39:21 GMT""},{""version"":""v4"",""created"":""Tue, 14 Nov 2017 15:50:12 GMT""}]","2017-11-30"
"1505.02243","Szabolcs Zakany","Rinat Kashaev, Marcos Marino, Szabolcs Zakany","Matrix models from operators and topological strings, 2","37 pages, 4 figures; v2: misprints corrected, comments and Appendix
  added",,"10.1007/s00023-016-0471-z",,"hep-th math-ph math.AG math.MP","http://arxiv.org/licenses/nonexclusive-distrib/1.0/","  The quantization of mirror curves to toric Calabi--Yau threefolds leads to
trace class operators, and it has been conjectured that the spectral properties
of these operators provide a non-perturbative realization of topological string
theory on these backgrounds. In this paper, we find an explicit form for the
integral kernel of the trace class operator in the case of local P1xP1, in
terms of Faddeev's quantum dilogarithm. The matrix model associated to this
integral kernel is an O(2) model, which generalizes the ABJ(M) matrix model. We
find its exact planar limit, and we provide detailed evidence that its 1/N
expansion captures the all genus topological string free energy on local P1xP1.
","[{""version"":""v1"",""created"":""Sat, 9 May 2015 08:28:48 GMT""},{""version"":""v2"",""created"":""Mon, 1 Feb 2016 16:47:38 GMT""}]","2016-11-03"
"1505.02244","Yuichi Matsuda","Y. Matsuda, T. Nagao, D. Iono, B. Hatsukade, K. Kohno, Y. Tamura, Y.
  Yamaguchi and I. Shimizu","The ALMA Patchy Deep Survey: A blind search for [CII] emitters at z~4.5","6 pages, 3 figures, accepted for publication in MNRAS",,"10.1093/mnras/stv1044",,"astro-ph.GA","http://arxiv.org/licenses/nonexclusive-distrib/1.0/","  We present a result of a blind search for [CII] 158 $\mu$m emitters at $z\sim
4.5$ using ALMA Cycle~0 archival data. We collected extra-galactic data
covering at 330-360 GHz (band~7) from 8 Cycle~0 projects from which initial
results have been already published. The total number of fields is 243 and the
total on-source exposure time is 19.2 hours. We searched for line emitters in
continuum-subtracted data cubes with spectral resolutions of 50, 100, 300 and
500 km/s. We could not detect any new line emitters above a 6-$\sigma$
significance level. This result provides upper limits to the [CII] luminosity
function at $z\sim 4.5$ over $L_{\rm [CII]} \sim 10^8 - 10^{10} L_{\odot}$ or
star formation rate, SFR $\sim$ 10-1000 M$_{^\odot}$/yr. These limits are at
least 2 orders of magnitude larger than the [CII] luminosity functions expected
from the $z \sim 4$ UV luminosity function or from numerical simulation.
However, this study demonstrates that we would be able to better constrain the
[CII] luminosity function and to investigate possible contributions from dusty
galaxies to the cosmic star-formation rate density by collecting Cycle~1+2
archival data as the ALMA Patchy Deep Survey.
","[{""version"":""v1"",""created"":""Sat, 9 May 2015 08:41:10 GMT""}]","2015-08-06"
"1505.02245","Moon-Jin Kang","Moon-Jin Kang and Alexis F. Vasseur","Criteria on contractions for entropic discontinuities of systems of
  conservation laws",,,"10.1007/s00205-016-1003-1",,"math.AP","http://creativecommons.org/licenses/by/3.0/","  We study the contraction properties (up to shift) for admissible
Rankine-Hugoniot discontinuities of $n\times n$ systems of conservation laws
endowed with a convex entropy. We first generalize the criterion developed in
[47], using the spatially inhomogeneous pseudo-distance introduced in [50]. Our
generalized criterion guarantees the contraction property for extremal shocks
of a large class of systems, including the Euler system. Moreover, we introduce
necessary conditions for contraction, specifically targeted for intermediate
shocks. As an application, we show that intermediate shocks of the
two-dimensional isentropic magnetohydrodynamics do not verify any of our
contraction properties. We also investigate the contraction properties, for
contact discontinuities of the Euler system, for a certain range of contraction
weights.
  All results do not involve any smallness condition on the initial
perturbation, nor on the size of the shock.
","[{""version"":""v1"",""created"":""Sat, 9 May 2015 08:44:00 GMT""}]","2016-05-04"
"1505.02246","Yaping Mao","Yaping Mao, Fengnan Yanling, Zhao Wang, Chengfu Ye","Proper connection number and graph products","16 pages, 2 figures. arXiv admin note: text overlap with
  arXiv:1505.01424. text overlap with arXiv:1504.02414 by other authors",,,,"math.CO","http://creativecommons.org/licenses/by/3.0/","  A path $P$ in an edge-colored graph $G$ is called \emph{a proper path} if no
two adjacent edges of $P$ are colored the same, and $G$ is \emph{proper
connected} if every two vertices of $G$ are connected by a proper path in $G$.
The \emph{proper connection number} of a connected graph $G$, denoted by
$pc(G)$, is the minimum number of colors that are needed to make $G$ proper
connected. In this paper, we study the proper connection number on the
lexicographical, strong, Cartesian, and direct product and present several
upper bounds for these products of graphs.
","[{""version"":""v1"",""created"":""Sat, 9 May 2015 08:56:39 GMT""}]","2015-05-12"
"1505.02247","Thomas Holzmann","T. Holzmann, R. Prettenthaler, J. Pestana, D. Muschick, G. Graber, C.
  Mostegel, F. Fraundorfer, H. Bischof","Performance Evaluation of Vision-Based Algorithms for MAVs","Presented at OAGM Workshop, 2015 (arXiv:1505.01065)",,,"OAGM/2015/14","cs.CV","http://arxiv.org/licenses/nonexclusive-distrib/1.0/","  An important focus of current research in the field of Micro Aerial Vehicles
(MAVs) is to increase the safety of their operation in general unstructured
environments. Especially indoors, where GPS cannot be used for localization,
reliable algorithms for localization and mapping of the environment are
necessary in order to keep an MAV airborne safely. In this paper, we compare
vision-based real-time capable methods for localization and mapping and point
out their strengths and weaknesses. Additionally, we describe algorithms for
state estimation, control and navigation, which use the localization and
mapping results of our vision-based algorithms as input.
","[{""version"":""v1"",""created"":""Sat, 9 May 2015 09:07:08 GMT""}]","2015-05-12"
"1505.02248","Luca Bonaventura","Luca Bonaventura","Local Exponential Methods: a domain decomposition approach to
  exponential time integration of PDEs",,,,,"math.NA cs.NA physics.comp-ph","http://arxiv.org/licenses/nonexclusive-distrib/1.0/","  A local approach to the time integration of PDEs by exponential methods is
proposed, motivated by theoretical estimates by A.Iserles on the decay of
off-diagonal terms in the exponentials of sparse matrices. An overlapping
domain decomposition technique is outlined, that allows to replace the
computation of a global exponential matrix by a number of independent and
easily parallelizable local problems. Advantages and potential problems of the
proposed technique are discussed. Numerical experiments on simple, yet relevant
model problems show that the resulting method allows to increase computational
efficiency with respect to standard implementations of exponential methods.
","[{""version"":""v1"",""created"":""Sat, 9 May 2015 09:21:30 GMT""}]","2015-05-12"
"1505.02249","Ariyan Javanpeykar","Ariyan Javanpeykar and Daniel Loughran","Complete intersections: Moduli, Torelli, and good reduction","37 pages. Typo's fixed. Expanded Section 2.5",,,,"math.AG math.NT","http://arxiv.org/licenses/nonexclusive-distrib/1.0/","  We study the arithmetic of complete intersections in projective space over
number fields. Our main results include arithmetic Torelli theorems and
versions of the Shafarevich conjecture, as proved for curves and abelian
varieties by Faltings. For example, we prove an analogue of the Shafarevich
conjecture for cubic and quartic threefolds and intersections of two quadrics.
","[{""version"":""v1"",""created"":""Sat, 9 May 2015 09:27:13 GMT""},{""version"":""v2"",""created"":""Mon, 1 Aug 2016 13:29:04 GMT""}]","2016-08-02"
"1505.02250","Mert Pilanci","Mert Pilanci, Martin J. Wainwright","Newton Sketch: A Linear-time Optimization Algorithm with
  Linear-Quadratic Convergence",,,,,"math.OC cs.DS cs.LG stat.ML","http://arxiv.org/licenses/nonexclusive-distrib/1.0/","  We propose a randomized second-order method for optimization known as the
Newton Sketch: it is based on performing an approximate Newton step using a
randomly projected or sub-sampled Hessian. For self-concordant functions, we
prove that the algorithm has super-linear convergence with exponentially high
probability, with convergence and complexity guarantees that are independent of
condition numbers and related problem-dependent quantities. Given a suitable
initialization, similar guarantees also hold for strongly convex and smooth
objectives without self-concordance. When implemented using randomized
projections based on a sub-sampled Hadamard basis, the algorithm typically has
substantially lower complexity than Newton's method. We also describe
extensions of our methods to programs involving convex constraints that are
equipped with self-concordant barriers. We discuss and illustrate applications
to linear programs, quadratic programs with convex constraints, logistic
regression and other generalized linear models, as well as semidefinite
programs.
","[{""version"":""v1"",""created"":""Sat, 9 May 2015 09:36:26 GMT""}]","2015-05-12"
"1505.02251","Aris Kosmopoulos","Aris Kosmopoulos and Georgios Paliouras and Ion Androutsopoulos","Probabilistic Cascading for Large Scale Hierarchical Classification",,,,,"cs.LG cs.CL cs.IR","http://arxiv.org/licenses/nonexclusive-distrib/1.0/","  Hierarchies are frequently used for the organization of objects. Given a
hierarchy of classes, two main approaches are used, to automatically classify
new instances: flat classification and cascade classification. Flat
classification ignores the hierarchy, while cascade classification greedily
traverses the hierarchy from the root to the predicted leaf. In this paper we
propose a new approach, which extends cascade classification to predict the
right leaf by estimating the probability of each root-to-leaf path. We provide
experimental results which indicate that, using the same classification
algorithm, one can achieve better results with our approach, compared to the
traditional flat and cascade classifications.
","[{""version"":""v1"",""created"":""Sat, 9 May 2015 09:39:04 GMT""}]","2015-05-12"
"1505.02252","Yun Fan","Yun Fan, Hualu Liu","Quasi-cyclic Codes of Index 1.5",,,,,"cs.IT math.IT","http://arxiv.org/licenses/nonexclusive-distrib/1.0/","  We introduce quasi-cyclic codes of index 1.5, construct such codes in terms
of polynomials and matrices; and prove that the quasi-cyclic codes of index 1.5
are asymptotically good.
","[{""version"":""v1"",""created"":""Sat, 9 May 2015 09:52:21 GMT""}]","2015-05-12"
"1505.02253","Mariusz Mrozek Mr.","M. Mrozek, D. Rudnicki, P. Kehayias, A. Jarmola, D. Budker, and W.
  Gawlik","Longitudinal spin relaxation in nitrogen-vacancy ensembles in diamond","11 pages, 9 figures",,,,"physics.atom-ph cond-mat.mes-hall","http://arxiv.org/licenses/nonexclusive-distrib/1.0/","  We present an experimental study of the longitudinal electron-spin relaxation
of ensembles of negatively charged nitrogen-vacancy (NV ) centers in diamond.
The measurements were performed with samples having different NV-
concentrations and at different temperatures and magnetic fields. We found that
the relaxation rate T1-1 increases when transition frequencies in NV- centers
with different orientations become degenerate and interpret this as
cross-relaxation caused by dipole-dipole interaction.
","[{""version"":""v1"",""created"":""Sat, 9 May 2015 10:37:21 GMT""}]","2015-05-12"
"1505.02254","Vaidas Juknevicius","Vaidas Juknevicius","Scaling properties of generalized two-dimensional Kuramoto-Sivashinsky
  equations","10 pages, 8 Figures","Eur. Phys. J. B (2016) 89: 32","10.1140/epjb/e2016-60830-3",,"nlin.PS nlin.CD","http://arxiv.org/licenses/nonexclusive-distrib/1.0/","  This paper presents numerical results for the two-dimensional isotropic
Kuramoto-Sivashinsky equation (KSE) with an additional nonlinear term and a
single independent parameter. Surfaces generated by this equation exhibit a
certain dependence of the average saturated roughness on the system size that
indicates power-law shape of the surface spectrum for small wave numbers. This
leads to a conclusion that although cellular surface patterns of definite scale
dominate in the range of short distances, there are also scale-free long-range
height variations present in the large systems. The dependence of the spectral
exponent on the equation parameter gives some insight into the scaling behavior
for large systems.
","[{""version"":""v1"",""created"":""Sat, 9 May 2015 10:39:54 GMT""}]","2016-02-18"
"1505.02255","Daniele Ritelli","Giovanni Mingari Scarpello and Daniele Ritelli","A hypergeometric treatment to explain the nonlinear true behavior of
  redundant constraints on a straight elastic rod","13 pages, 8 figures",,,,"math.CA","http://arxiv.org/licenses/nonexclusive-distrib/1.0/","  In theory and practice of elastic straight rods, the statically indeterminate
reactions acted by perfect constraints are commonly believed not to depend on
the flexural stiffness $EJ$. We solve exactly two elastica problems in order to
obtain hypergeometrically (helped by Lagrange, Lauricella, Appell), the true
displacements upon which the forces method is founded. As a consequence, the
above reactions are found to depend on stiffness: the presumptive independence
credited as general, is far from being always true, but, quite the contrary, is
valid only within a first-order approximation.
","[{""version"":""v1"",""created"":""Sat, 9 May 2015 10:42:20 GMT""}]","2015-05-12"
"1505.02256","Andrew Forbes","Darryl Naidoo, Filippus Roux, Angela Dudley, Igor Litvin, Bruno
  Piccirillo, Lorenzo Marucci and Andrew Forbes","Controlled generation of higher-order Poincare sphere beams from a laser",,,,,"physics.optics","http://arxiv.org/licenses/nonexclusive-distrib/1.0/","  The angular momentum state of light can be described by positions on a
higher-order Poincar\'e (HOP) sphere, where superpositions of spin and orbital
angular momentum states give rise to laser beams that have found many
applications, including optical communication, quantum information processing,
microscopy, optical trapping and tweezing and materials processing. Many
techniques exist to create such beams but none to date allow their creation at
the source. Here we report on a new class of laser that is able to generate all
states on the HOP sphere. We exploit geometric phase control with a
non-homogenous polarization optic and a wave-plate inside a laser cavity to map
spin angular momentum (SAM) to orbital angular momentum (OAM). Rotation of
these two elements provides the necessary degrees of freedom to traverse the
entire HOP sphere. As a result, we are able to demonstrate that the OAM
degeneracy of a standard laser cavity may be broken, producing pure OAM modes
as the output, and that generalized vector vortex beams may be created from the
same laser, for example, radially and azimuthally polarized laser beams. It is
noteworthy that all other aspects of the laser cavity follow a standard design,
facilitating easy implementation.
","[{""version"":""v1"",""created"":""Sat, 9 May 2015 11:10:50 GMT""}]","2015-05-12"
