"1505.02113","Jose A. de Diego","J. A. de Diego, J. Polednikova, A. Bongiovanni, A. M. P\'erez
  Garc\'ia, M. A. De Leo, T. Verdugo, J. Cepa","Testing microvariability in quasar differential light curves using
  several field stars","Accepted in The Astronomical Journal, 16 pages, 7 figures",,"10.1088/0004-6256/150/2/44",,"astro-ph.IM astro-ph.CO","http://arxiv.org/licenses/nonexclusive-distrib/1.0/","  Microvariability consists in small time scale variations of low amplitude in
the photometric light curves of quasars, and represents an important tool to
investigate their inner core. Detection of quasar microvariations is
challenging for their non-periodicity, as well as the need for high monitoring
frequency and high signal-to-noise ratio. Statistical tests developed for the
analysis of quasar differential light curves usually show either low power or
low reliability, or both. In this paper we compare two statistical procedures
that include several stars to perform tests with enhanced power and high
reliability. We perform light curve simulations of variable quasars and
non-variable stars, and analyze them with statistical procedures developed from
the F-test and the analysis of variance. The results show a large improvement
in the power of both statistical probes, and a larger reliability, when several
stars are included in the analysis. The results from the simulations agree with
those obtained from observations of real quasars. The high power and high
reliability of the tests discussed in this paper improve the results that can
be obtained from short and long time scale variability studies. These
techniques are not limited to quasar variability; on the contrary, they can be
easily implemented to other sources such as variable stars. Their applications
to future research and to the analysis of large field photometric monitoring
archives can reveal new variable sources.
","[{""version"":""v1"",""created"":""Fri, 8 May 2015 18:07:05 GMT""}]","2016-08-08"
"1505.02114","David Gerard","David Gerard and Peter Hoff","Adaptive Higher-order Spectral Estimators","29 pages, 3 figures","Electronic Journal of Statistics 11 (2017) 3703--3737","10.1214/17-EJS1330",,"stat.ME","http://arxiv.org/licenses/nonexclusive-distrib/1.0/","  Many applications involve estimation of a signal matrix from a noisy data
matrix. In such cases, it has been observed that estimators that shrink or
truncate the singular values of the data matrix perform well when the signal
matrix has approximately low rank. In this article, we generalize this approach
to the estimation of a tensor of parameters from noisy tensor data. We develop
new classes of estimators that shrink or threshold the mode-specific singular
values from the higher-order singular value decomposition. These classes of
estimators are indexed by tuning parameters, which we adaptively choose from
the data by minimizing Stein's unbiased risk estimate. In particular, this
procedure provides a way to estimate the multilinear rank of the underlying
signal tensor. Using simulation studies under a variety of conditions, we show
that our estimators perform well when the mean tensor has approximately low
multilinear rank, and perform competitively when the signal tensor does not
have approximately low multilinear rank. We illustrate the use of these methods
in an application to multivariate relational data.
","[{""version"":""v1"",""created"":""Fri, 8 May 2015 18:07:09 GMT""},{""version"":""v2"",""created"":""Wed, 22 Feb 2017 17:39:37 GMT""}]","2018-06-20"
"1505.02115","Imre Hagymasi","I. Hagymasi, J. Solyom, O. Legeza","Momentum distribution functions in a one-dimensional extended periodic
  Anderson model","4 pages, 4 figures","Advances in Condensed Matter Physics, Volume 2015 (2015), Article
  ID 614017","10.1155/2015/614017",,"cond-mat.str-el","http://arxiv.org/licenses/nonexclusive-distrib/1.0/","  We study the momentum distribution of the electrons in an extended periodic
Anderson model, where the interaction, $U_{cf}$, between itinerant and
localized electrons is taken into account. In the symmetric half-filled model,
due to the increase of the interorbital interaction, the $f$ electrons become
more and more delocalized, while the itinerancy of conduction electrons
decreases. Above a certain value of $U_{cf}$ the $f$ electrons become again
localized together with the conduction electrons. In the less than half-filled
case, we observe that $U_{cf}$ causes strong correlations between the $f$
electrons in the mixed valence regime.
","[{""version"":""v1"",""created"":""Fri, 8 May 2015 18:09:27 GMT""}]","2016-02-11"
"1505.02116","Pascal Degiovanni","Benjamin Roussel, Pascal Degiovanni and In\`es Safi","Perturbative fluctuation dissipation relation for non-equilibrium finite
  frequency noise in quantum circuits","4 pages with 4 figures plus supplementary information as appendices","Phys. Rev. B 93, 045102 (2016)","10.1103/PhysRevB.93.045102",,"cond-mat.mes-hall","http://arxiv.org/licenses/nonexclusive-distrib/1.0/","  We develop a general perturbative computation of finite-frequency quantum
noise which applies, in particular, to both good or weakly transmitting
strongly correlated conductors coupled to a generic environment. Under a
minimal set of hypotheses, we show that the noise can be expressed through the
non-equilibrium DC current only, generalizing a non-equilibrium fluctuation
dissipation relation. We use this relation to derive explicit predictions for
the non equilibrium finite frequency noise for a single channel conductor
connected to an arbitrary Ohmic environment.
","[{""version"":""v1"",""created"":""Fri, 8 May 2015 18:15:13 GMT""}]","2016-01-20"
"1505.02117","G\""unter Stolz","Houssam Abdul-Rahman and G\""unter Stolz","A uniform area law for the entanglement of eigenstates in the disordered
  XY chain","28 pages, v2: changes in introduction after feedback received, some
  references added, v3: some improvements and updates, main results unchanged","J. Math. Phys. 56 (2015), no. 12, 121901, 25 pp","10.1063/1.4938573",,"math-ph math.MP math.SP","http://arxiv.org/licenses/nonexclusive-distrib/1.0/","  We consider the isotropic or anisotropic XY spin chain in the presence of a
transversal random magnetic field, with parameters given by random variables.
It is shown that eigenfunction correlator localization of the corresponding
effective one-particle Hamiltonian implies a uniform area law bound in
expectation for the bipartite entanglement entropy of all eigenstates of the XY
chain, i.e. a form of many-body localization at all energies. Here entanglement
with respect to arbitrary connected subchains of the chain can be considered.
Applications where the required eigenfunction correlator bounds are known
include the isotropic XY chain in random field as well as the anisotropic chain
in strong or strongly disordered random field.
","[{""version"":""v1"",""created"":""Fri, 8 May 2015 18:15:33 GMT""},{""version"":""v2"",""created"":""Mon, 18 May 2015 17:38:24 GMT""},{""version"":""v3"",""created"":""Sun, 27 Sep 2015 21:22:26 GMT""}]","2022-10-13"
"1505.02118","Linbo Wang","Linbo Wang, Thomas S. Richardson, Xiao-Hua Zhou","Causal analysis of ordinal treatments and binary outcomes under
  truncation by death","To appear in Journal of the Royal Statistical Society: Series B
  (Statistical Methodology)",,,,"stat.ME","http://arxiv.org/licenses/nonexclusive-distrib/1.0/","  It is common that in multiarm randomized trials, the outcome of interest is
""truncated by death,"" meaning that it is only observed or well defined
conditioning on an intermediate outcome. In this case, in addition to pairwise
contrasts, the joint inference for all treatment arms is also of interest.
Under a monotonicity assumption we present methods for both pairwise and joint
causal analyses of ordinal treatments and binary outcomes in presence of
truncation by death. We illustrate via examples the appropriateness of our
assumptions in different scientific contexts.
","[{""version"":""v1"",""created"":""Fri, 8 May 2015 18:25:19 GMT""},{""version"":""v2"",""created"":""Tue, 3 May 2016 20:16:37 GMT""},{""version"":""v3"",""created"":""Mon, 21 Nov 2016 05:38:10 GMT""}]","2016-11-22"
"1505.02119","Kazunori Nakayama","Kazunori Nakayama, Masahiro Takimoto","Higgs inflation and suppression of axion isocurvature perturbation","5 pages; added references",,"10.1016/j.physletb.2015.07.001","UT-15-18","hep-ph","http://arxiv.org/licenses/nonexclusive-distrib/1.0/","  We point out that cosmological constraint from the axion isocurvature
perturbation is relaxed if the Higgs field obtains a large field value during
inflation in the DFSZ axion model. This scenario is consistent with the Higgs
inflation model, in which two Higgs doublets have non-minimal couplings and
play a role of inflaton.
","[{""version"":""v1"",""created"":""Fri, 8 May 2015 18:26:56 GMT""},{""version"":""v2"",""created"":""Fri, 22 May 2015 15:11:41 GMT""}]","2015-07-08"
"1505.02120","Luca Calatroni","Luca Calatroni, Cao Chung, Juan Carlos De Los Reyes, Carola-Bibiane
  Sch\""onlieb, Tuomo Valkonen","Bilevel approaches for learning of variational imaging models",,,,,"math.OC cs.CV","http://arxiv.org/licenses/nonexclusive-distrib/1.0/","  We review some recent learning approaches in variational imaging, based on
bilevel optimisation, and emphasize the importance of their treatment in
function space. The paper covers both analytical and numerical techniques.
Analytically, we include results on the existence and structure of minimisers,
as well as optimality conditions for their characterisation. Based on this
information, Newton type methods are studied for the solution of the problems
at hand, combining them with sampling techniques in case of large databases.
The computational verification of the developed techniques is extensively
documented, covering instances with different type of regularisers, several
noise models, spatially dependent weights and large image databases.
","[{""version"":""v1"",""created"":""Fri, 8 May 2015 18:27:34 GMT""}]","2016-08-08"
"1505.02121","Roberto Zucchini","Roberto Zucchini","On higher holonomy invariants in higher gauge theory I","Latex, 90 pages, 5 figures. Figures may take up to a few seconds to
  be loaded",,"10.1142/S0219887816500900","DIFA 15","hep-th math-ph math.DG math.MP","http://arxiv.org/licenses/nonexclusive-distrib/1.0/","  This is the first of a series of two technical papers devoted to the analysis
of holonomy invariants in strict higher gauge theory with end applications in
higher Chern--Simons theory. For a flat 2--connection, we define the 2-holonomy
of surface knots of arbitrary genus and determine its covariance properties
under 1--gauge transformation and change of base data.
","[{""version"":""v1"",""created"":""Fri, 8 May 2015 18:27:49 GMT""}]","2016-08-17"
"1505.02122","Roberto Zucchini","Roberto Zucchini","On higher holonomy invariants in higher gauge theory II","Latex, 34 pages, no figures",,"10.1142/S0219887816500912","DIFA 15","hep-th math-ph math.DG math.MP","http://arxiv.org/licenses/nonexclusive-distrib/1.0/","  This is the second of a series of two technical papers devoted to the
analysis of holonomy invariants in strict higher gauge theory with end
applications in higher Chern--Simons theory. We provide a definition of trace
over a crossed module such to yield surface knot invariants upon application to
2-holonomies. We show further that the properties of the trace are best
described using the theory quandle crossed modules.
","[{""version"":""v1"",""created"":""Fri, 8 May 2015 18:28:26 GMT""}]","2016-08-17"
"1505.02123","Puneet Anantha Murthy","P. A. Murthy, I. Boettcher, L. Bayha, M. Holzmann, D. Kedar, M.
  Neidig, M. G. Ries, A. N. Wenz, G. Z\""urn, S. Jochim","Observation of the Berezinskii-Kosterlitz-Thouless Phase Transition in
  an Ultracold Fermi Gas","9 pages, 5 figures","Phys. Rev. Lett. 115, 010401 (2015)","10.1103/PhysRevLett.115.010401",,"cond-mat.quant-gas cond-mat.stat-mech cond-mat.str-el","http://arxiv.org/licenses/nonexclusive-distrib/1.0/","  We experimentally investigate the first-order correlation function of a
trapped Fermi gas in the two-dimensional BEC-BCS crossover. We observe a
transition to a low-temperature superfluid phase with algebraically decaying
correlations. We show that the spatial coherence of the entire trapped system
can be characterized by a single temperature-dependent exponent. We find the
exponent at the transition to be constant over a wide range of interaction
strengths across the crossover. This suggests that the phase transitions in
both the bosonic regime and the strongly interacting crossover regime are of
Berezinskii-Kosterlitz-Thouless-type and lie within the same universality
class. On the bosonic side of the crossover, our data are well-described by
Quantum Monte Carlo calculations for a Bose gas. In contrast, in the strongly
interacting regime, we observe a superfluid phase which is significantly
influenced by the fermionic nature of the constituent particles.
","[{""version"":""v1"",""created"":""Fri, 8 May 2015 18:32:35 GMT""},{""version"":""v2"",""created"":""Thu, 2 Jul 2015 11:08:59 GMT""}]","2015-07-03"
"1505.02124","Valentino Tosatti","Valentino Tosatti","The Calabi-Yau Theorem and K\""ahler currents","19 pages; submitted to the proceedings of the conference ""60 years of
  Calabi Conjecture""","Adv. Theor. Math. Phys. 20 (2016), no.2, 381-404","10.4310/ATMP.2016.v20.n2.a4",,"math.CV math.DG","http://arxiv.org/licenses/nonexclusive-distrib/1.0/","  In this note we give an overview of some applications of the Calabi-Yau
theorem to the construction of singular positive (1,1) currents on compact
complex manifolds. We show how recent developments allow us to give streamlined
proofs of existing results, as well as new ones.
","[{""version"":""v1"",""created"":""Fri, 8 May 2015 18:32:54 GMT""},{""version"":""v2"",""created"":""Wed, 9 Mar 2016 14:27:49 GMT""},{""version"":""v3"",""created"":""Thu, 18 Aug 2016 18:52:08 GMT""}]","2016-08-19"
"1505.02125","Rishi Nath","Rishi Nath and James A. Sellers","Congruences for spin characters of the double covers of the symmetric
  and alternating groups","15 pages, 5 figures",,,,"math.RT math.CO math.NT","http://arxiv.org/licenses/nonexclusive-distrib/1.0/","  Let $p$ be an odd prime. The bar partitions with sign and $p$-bar-core
partitions with sign respectively label the spin characters and $p$-defect zero
spin characters of the double cover of the symmetric group, and by restriction,
those of the alternating group. The generating functions for these objects have
been determined by J. Olsson. We study these functions from an arithmetic
perspective, using classical analytic tools and elementary generating function
manipulation to obtain many Ramanujan-like congruences.
","[{""version"":""v1"",""created"":""Fri, 8 May 2015 18:34:45 GMT""}]","2015-05-11"
"1505.02126","Aram Karakhanyan","Aram L. Karakhanyan, Martin Str\""omqvist","Estimates for capacity and discrepancy of convex surfaces in sieve-like
  domains with an application to homogenization",,,,,"math.AP","http://arxiv.org/licenses/nonexclusive-distrib/1.0/","  We consider the intersection of a convex surface $\Ga$ with a periodic
perforation of $\R^d$, which looks like a sieve, given by $T_\e = \bigcup_{k\in
\Z^d}\{\e k+a_\e T\}$ where $T$ is a given compact set and $a_\e\ll \e$ is the
size of the perforation in the $\e$-cell $(0, \e)^d\subset \R^d$. When $\e$
tends to zero we establish uniform estimates for $p$-capacity $1<p<d$ and
discrepancy of distributions of intersection $\Ga\cap T_\e$. As an application
one gets that the thin obstacle problem with the obstacle defined on the
intersection of $\Ga$ and perforations, in given bounded domain, is
homogenizable when $p<1+\frac d4$. This result is new even for the classical
Laplace operator.
","[{""version"":""v1"",""created"":""Fri, 8 May 2015 18:35:20 GMT""}]","2015-05-11"
"1505.02127","Ivo Sachs","Ivo Sachs","Conformal Invariance for a Class of Scale Invariant Theories in Four
  Dimensions",,,,,"hep-th","http://arxiv.org/licenses/nonexclusive-distrib/1.0/","  For a four dimensional, unitary, diffeomorphism- and scale invariant quantum
field theory without higher derivatives and a well defined scale current we
argue that scale invariance implies conformal invariance. The proof relies on
the Wess-Zumino consistency condition for the Weyl anomaly.
","[{""version"":""v1"",""created"":""Fri, 8 May 2015 18:40:26 GMT""}]","2015-05-11"
"1505.02128","Tapan Hota","Tapan Kumar Hota, Satayajit Pramanik, Manoranjan Mishra","Onset of fingering instability in a finite slice of adsorbed solute","30 pages, 12 figures","Phys. Rev. E 92, 023013 (2015)","10.1103/PhysRevE.92.023013",,"physics.flu-dyn","http://arxiv.org/licenses/nonexclusive-distrib/1.0/","  The effect of a linear adsorption isotherm on the onset of fingering
instability in a miscible displacement in the application of liquid
chromatography, pollutant contamination in aquifers etc. is investigated. Such
fingering instability on the solute dynamics arise due to the miscible viscus
fingering (VF) between the displacing fluid and sample solvent. We use a
Fourier pseudo-spectral method to solve the initial value problem appeared in
the linear stability analysis. The present linear stability analysis is of
generic type and it captures the early time diffusion dominated region which
was never expressible through the quasi-steady state analysis (QSSA). In
addition, it measures the onset of instability more accurately than the QSSA
methods. It is shown that the onset time depends non-monotonically on the
retention parameter of the solute adsorption. This qualitative influence of the
retention parameter on the onset of instability resemblances with the results
obtained from direct numerical simulations of the nonlinear equations.
Moreover, the present linear stability method helps for an appropriate
characterisation of the linear and the nonlinear regimes of miscible VF
instability and also can be useful for the fluid flow problems with the
unsteady base-state.
","[{""version"":""v1"",""created"":""Fri, 8 May 2015 18:41:54 GMT""}]","2015-08-19"
"1505.02131","Joaquin E. Drut","L. Rammelm\""uller, W. J. Porter, A. C. Loheac, J. E. Drut","Few-fermion systems in one dimension: Ground- and excited-state energies
  and contacts","8 pages, 12 figures; published version","Phys. Rev. A 92, 013631 (2015)","10.1103/PhysRevA.92.013631",,"cond-mat.quant-gas hep-lat","http://arxiv.org/licenses/nonexclusive-distrib/1.0/","  Using the lattice Monte Carlo method, we compute the energy and Tan's contact
in the ground state as well as the first excited state of few- to many-fermion
systems in a one-dimensional periodic box. We focus on unpolarized systems of
N=4,6,...,12 particles, with a zero-range interaction, and a wide range of
attractive couplings. In addition, we provide extrapolations to the
infinite-volume and thermodynamic limits.
","[{""version"":""v1"",""created"":""Fri, 8 May 2015 18:45:10 GMT""},{""version"":""v2"",""created"":""Tue, 4 Aug 2015 13:00:48 GMT""}]","2015-08-05"
"1505.02132","Ryan Foote","Ryan H. Foote, Daniel R. Ward, J. R. Prance, John King Gamble, Erik
  Nielsen, Brandur Thorgrimsson, D. E. Savage, A. L. Saraiva, Mark Friesen, S.
  N. Coppersmith, M. A. Eriksson","Transport through an impurity tunnel coupled to a Si/SiGe quantum dot","5 pages, 3 figures","Appl. Phys. Lett. 107, 103112 (2015)","10.1063/1.4930909",,"cond-mat.mes-hall quant-ph","http://arxiv.org/licenses/nonexclusive-distrib/1.0/","  Achieving controllable coupling of dopants in silicon is crucial for
operating donor-based qubit devices, but it is difficult because of the small
size of donor-bound electron wavefunctions. Here we report the characterization
of a quantum dot coupled to a localized electronic state, and we present
evidence of controllable coupling between the quantum dot and the localized
state. A set of measurements of transport through this device enable the
determination of the most likely location of the localized state, consistent
with an electronically active impurity in the quantum well near the edge of the
quantum dot. The experiments we report are consistent with a gate-voltage
controllable tunnel coupling, which is an important building block for hybrid
donor and gate-defined quantum dot devices.
","[{""version"":""v1"",""created"":""Fri, 8 May 2015 18:50:11 GMT""},{""version"":""v2"",""created"":""Tue, 12 May 2015 21:20:08 GMT""}]","2015-09-16"
"1505.02133","Alexey Yamilov","P. Neupane and A. Yamilov","On applicability of inhomogeneous diffusion approach to localized
  transport through disordered waveguides","5 pages, 3 figures","Phys. Rev. B 92, 014207 (2015)","10.1103/PhysRevB.92.014207",,"cond-mat.dis-nn","http://arxiv.org/licenses/nonexclusive-distrib/1.0/","  In this work we show analytically and numerically that wave transport through
random waveguides can be modeled as a diffusion with an inhomogeneous diffusion
coefficient (IDC). In localized regime, IDC retains the memory of the source
position. In an absorbing random medium, IDC becomes independent of the source.
","[{""version"":""v1"",""created"":""Fri, 8 May 2015 18:52:01 GMT""}]","2015-11-05"
"1505.02134","Sim\~ao Stelmastchuk Nicolau","Pedro Catuogno and Sim\~ao N. Stelmastchuk","Transport Theorem and Continuity Equations: a Stochastic Approach","9 pages",,,,"math.PR math-ph math.MP","http://arxiv.org/licenses/nonexclusive-distrib/1.0/","  We give a stochastic generalization of transport theorem on smooth manifold.
Furthermore, we deduce a system of continuity equation and present some
application on torus.
","[{""version"":""v1"",""created"":""Fri, 8 May 2015 18:55:04 GMT""}]","2015-05-11"
"1505.02135","Animesh Kumar","Garima Maheshwari and Animesh Kumar","Optimal Quantization of TV White Space Regions for a Broadcast Based
  Geolocation Database","8 pages, 12 figures, submitted to IEEE DySPAN (Technology) 2015",,,,"cs.IT math.IT","http://arxiv.org/licenses/nonexclusive-distrib/1.0/","  In the current paradigm, TV white space databases communicate the available
channels over a reliable Internet connection to the secondary devices. For
places where an Internet connection is not available, such as in developing
countries, a broadcast based geolocation database can be considered. This
geolocation database will broadcast the TV white space (or the primary services
protection regions) on rate-constrained digital channel.
  In this work, the quantization or digital representation of protection
regions is considered for rate-constrained broadcast geolocation database.
Protection regions should not be declared as white space regions due to the
quantization error. In this work, circular and basis based approximations are
presented for quantizing the protection regions. In circular approximation,
quantization design algorithms are presented to protect the primary from
quantization error while minimizing the white space area declared as protected
region. An efficient quantizer design algorithm is presented in this case. For
basis based approximations, an efficient method to represent the protection
regions by an `envelope' is developed. By design this envelope is a sparse
approximation, i.e., it has lesser number of non-zero coefficients in the basis
when compared to the original protection region. The approximation methods
presented in this work are tested using three experimental data-sets.
","[{""version"":""v1"",""created"":""Fri, 8 May 2015 18:56:45 GMT""}]","2015-05-11"
"1505.02136","Erkki V. Thuneberg","M.A. Silaev, E.V. Thuneberg, and M. Fogelstr\""om","Lifshitz transition in the double-core vortex in 3He-B","11 pages, 6 figures, updated to the published version","Phys. Rev. Lett. 115, 235301 (2015)","10.1103/PhysRevLett.115.235301",,"cond-mat.supr-con","http://arxiv.org/licenses/nonexclusive-distrib/1.0/","  We study the spectrum of fermion states localized within the vortex core of a
weak-coupling p-wave superfluid. The low energy spectrum consists of two
anomalous branches that cross the Fermi level as functions of the impact
parameter, and generate large density of states at the locations of the half
cores of the vortex. Fermi liquid interactions significantly change the vortex
structure, which leads to Lifshitz transition in the effective Fermi surface of
the vortex core fermions. We apply the results to revise the interpretation of
an experiment on rotational dynamics of vortices in superfluid 3He-B.
","[{""version"":""v1"",""created"":""Fri, 8 May 2015 18:58:21 GMT""},{""version"":""v2"",""created"":""Thu, 3 Dec 2015 22:25:29 GMT""}]","2015-12-07"
