"1505.02175","Rong-Chun Ge","Rong-Chun Ge and Stephen Hughes","Quantum dynamics of two quantum dots coupled through localized plasmons:
  An intuitive and accurate quantum optics approach using quasinormal modes",,"Phys. Rev. B 92, 205420 (2015)","10.1103/PhysRevB.92.205420",,"cond-mat.mes-hall quant-ph","http://arxiv.org/licenses/nonexclusive-distrib/1.0/","  We study the quantum dynamics of two quantum dots (QDs) or artificial atoms
coupled through the fundamental localized plasmon of a gold nanorod resonator.
We derive an intuitive and efficient time-local master equation, in which the
effect of the metal nanorod is taken into consideration self-consistently using
a quasinormal mode (QNM) expansion technique of the photon Green function. Our
efficient QNM technique offers an alternative and more powerful approach over
the standard Jaynes-Cummings model, where the radiative decay, nonradiative
decay, and spectral reshaping effect of the electromagnetic environment is
rigorously included in a clear and transparent way. We also show how one can
use our approach to compliment the approximate Jaynes-Cummings model in certain
spatial regimes where it is deemed to be valid. We then present a study of the
quantum dynamics and photoluminescence spectra of the two plasmon-coupled QDs.
We first explore the non-Markovian regime, which is found to be important only
on the ultrashort time scale of the plasmon mode which is about 40$\,$fs. For
the field free evolution case of excited QDs near the nanorod, we demonstrate
how spatially separated QDs can be effectively coupled through the plasmon
resonance and we show how frequencies away from the plasmon resonance can be
more effective for coherently coupling the QDs. Despite the strong inherent
dissipation of gold nanoresonators, we show that qubit entanglements as large
as 0.7 can be achieved from an initially separate state, which has been limited
to less than 0.5 in previous work for weakly coupled reservoirs. We also study
the superradiance and subradiance decay dynamics of the QD pair. Finally, we
investigate the rich quantum dynamics of QDs that are incoherently pumped, ...
","[{""version"":""v1"",""created"":""Fri, 8 May 2015 20:40:33 GMT""},{""version"":""v2"",""created"":""Tue, 17 Nov 2015 22:19:26 GMT""}]","2015-11-20"
"1505.02176","Alper Hayreter","Alper Hayreter and German Valencia","Spin correlations and new physics in $\tau$-lepton decays at the LHC","25 pages, 11 figures, 14 tables. v2: added two subsections and
  relevant discussions, corresponds to version to be published at JHEP",,"10.1007/JHEP07(2015)174",,"hep-ph","http://arxiv.org/licenses/nonexclusive-distrib/1.0/","  We use spin correlations to constrain anomalous $\tau$-lepton couplings at
the LHC including its anomalous magnetic moment, electric dipole moment and
weak dipole moments. Single spin correlations are ideal to probe interference
terms between the SM and new dipole-type couplings as they are not suppressed
by the $\tau$-lepton mass. Double spin asymmetries give rise to $T$-odd
correlations useful to probe $CP$ violation purely within the new physics
amplitudes, as their appearance from interference with the SM is suppressed by
$m_\tau$. We compare our constraints to those obtained earlier on the basis of
deviations from the Drell-Yan cross-section.
","[{""version"":""v1"",""created"":""Fri, 8 May 2015 20:41:09 GMT""},{""version"":""v2"",""created"":""Thu, 9 Jul 2015 18:17:07 GMT""}]","2015-09-02"
"1505.02183","Fabo  Feng","Fabo Feng and C. A. L. Bailer-Jones","Obliquity and precession as pacemakers of Pleistocene deglaciations","19 pages, 10 figures, 2 tables, accepted for publication in
  Quaternary Science Reviews",,,,"astro-ph.EP physics.ao-ph","http://arxiv.org/licenses/nonexclusive-distrib/1.0/","  The Milankovitch theory states that the orbital eccentricity, precession, and
obliquity of the Earth influence our climate by modulating the summer
insolation at high latitudes in the northern hemisphere. Despite considerable
success of this theory in explaining climate change over the Pleistocene epoch
(2.6 to 0.01 Myr ago), it is inconclusive with regard to which combination of
orbital elements paced the 100 kyr glacial-interglacial cycles over the late
Pleistocene. Here we explore the role of the orbital elements in pacing the
Pleistocene deglaciations by modeling ice-volume variations in a Bayesian
approach. When comparing models, this approach takes into account the
uncertainties in the data as well as the different degrees of model complexity.
We find that the Earth's obliquity (axial tilt) plays a dominant role in pacing
the glacial cycles over the whole Pleistocene, while precession only becomes
important in pacing major deglaciations after the transition of the dominant
period from 41 kyr to 100 kyr (the mid-Pleistocene transition). We also find
that geomagnetic field and orbital inclination variations are unlikely to have
paced the Pleistocene deglaciations. We estimate that the mid-Pleistocene
transition took place over a 220 kyr interval centered on a time 715 kyr ago,
although the data permit a range of 600--1000 kyr. This transition, occurring
within just two 100\,kyr cycles, indicates a relatively rapid change in the
climate response to insolation.
","[{""version"":""v1"",""created"":""Fri, 8 May 2015 20:53:36 GMT""}]","2015-05-12"
"1505.02186","Heide Gluesing-Luerssen","Heide Gluesing-Luerssen and Carolyn Troha","Construction of Subspace Codes through Linkage",,,,,"cs.IT math.CO math.IT","http://arxiv.org/licenses/nonexclusive-distrib/1.0/","  A construction is presented that allows to produce subspace codes of long
length using subspace codes of shorter length in combination with a rank metric
code. The subspace distance of the resulting code, called linkage code, is as
good as the minimum subspace distance of the constituent codes. As a special
application, the construction of the best known partial spreads is reproduced.
Finally, for a special case of linkage, a decoding algorithm is presented which
amounts to decoding with respect to the smaller constituent codes and which can
be parallelized.
","[{""version"":""v1"",""created"":""Fri, 8 May 2015 21:01:40 GMT""}]","2015-05-12"
"1505.02189","David Feder","Farokh Mivehvar and David L. Feder","Enhanced stripe phases in spin-orbit-coupled Bose-Einstein condensates
  in ring cavities","14 pages + appendices","Phys. Rev. A 92, 023611 (2015)","10.1103/PhysRevA.92.023611",,"cond-mat.quant-gas","http://arxiv.org/licenses/nonexclusive-distrib/1.0/","  The coupled dynamics of the atom and photon fields in optical ring cavities
with two counter-propagating modes give rise to both spin-orbit interactions as
well as long-ranged interactions between atoms of a many-body system. At zero
temperature, the interplay between the two-body and cavity-mediated
interactions determines the ground state of a Bose-Einstein condensate. In this
work, we find that cavity quantum electrodynamics in the weak-coupling regime
favors a stripe-phase state over a plane-wave phase as the strength of
cavity-mediated interactions increases. Indeed, the stripe phase is
energetically stabilized even for condensates with attractive intra- and
inter-species interactions for sufficiently large cavity interactions. The
elementary excitation spectra in both phases correspond to linear dispersion
relation at long wavelengths, indicating that both phases exhibit
superfluidity, though the plane-wave phase also displays a characteristic
roton-type feature. The results suggest that even in the weak coupling regime
cavities can yield interesting new physics in ultracold quantum gases.
","[{""version"":""v1"",""created"":""Fri, 8 May 2015 21:04:23 GMT""}]","2015-08-19"
"1505.02191","Mauro Cuevas","M\'aximo Riso, Mauro Cuevas and Ricardo A. Depine","Tunable plasmonic enhancement of light scattering and absorption in
  graphene-coated subwavelength wires","Accepted for publication in Journal of Optics 2015",,,,"physics.optics","http://arxiv.org/licenses/nonexclusive-distrib/1.0/","  The electromagnetic response of subwavelength wires coated with a graphene
monolayer illuminated by a linearly polarized plane waves is investigated. The
results show that the scattering and extintion cross-sections of the coated
wire can be dramatically enhanced when the incident radiation resonantly
excites localized surface plasmons. The enhancements occur for p--polarized
incident waves and for excitation frequencies that correspond to complex poles
in the coefficients of the multipole expansion for the scattered field. By
dynamically tuning the chemical potential of graphene, the spectral position of
the enhancements can be chosen over a wide range.
","[{""version"":""v1"",""created"":""Fri, 8 May 2015 21:26:48 GMT""},{""version"":""v2"",""created"":""Tue, 12 May 2015 15:57:08 GMT""}]","2015-05-13"
"1505.02192","Munik Shrestha","Munik Shrestha, Samuel V. Scarpino, Cristopher Moore","A message-passing approach for recurrent-state epidemic models on
  networks","12 pages, 8 figures",,"10.1103/PhysRevE.92.022821",,"physics.soc-ph cs.SI","http://creativecommons.org/licenses/by/3.0/","  Epidemic processes are common out-of-equilibrium phenomena of broad
interdisciplinary interest. Recently, dynamic message-passing (DMP) has been
proposed as an efficient algorithm for simulating epidemic models on networks,
and in particular for estimating the probability that a given node will become
infectious at a particular time. To date, DMP has been applied exclusively to
models with one-way state changes, as opposed to models like SIS
(susceptible-infectious-susceptible) and SIRS
(susceptible-infectious-recovered-susceptible) where nodes can return to
previously inhabited states. Because many real-world epidemics can exhibit such
recurrent dynamics, we propose a DMP algorithm for complex, recurrent epidemic
models on networks. Our approach takes correlations between neighboring nodes
into account while preventing causal signals from backtracking to their
immediate source, and thus avoids ""echo chamber effects"" where a pair of
adjacent nodes each amplify the probability that the other is infectious. We
demonstrate that this approach well approximates results obtained from Monte
Carlo simulation and that its accuracy is often superior to the pair
approximation (which also takes second-order correlations into account).
Moreover, our approach is more computationally efficient than the pair
approximation, especially for complex epidemic models: the number of variables
in our DMP approach grows as $2mk$ where $m$ is the number of edges and $k$ is
the number of states, as opposed to $mk^2$ for the pair approximation. We
suspect that the resulting reduction in computational effort, as well as the
conceptual simplicity of DMP, will make it a useful tool in epidemic modeling,
especially for inference tasks where there is a large parameter space to
explore.
","[{""version"":""v1"",""created"":""Fri, 8 May 2015 21:30:38 GMT""}]","2015-09-30"
"1505.02193","Maresuke Shiraishi","Nicola Bartolo, Sabino Matarrese, Marco Peloso, Maresuke Shiraishi","Parity-violating CMB correlators with non-decaying statistical
  anisotropy","23 pages, 2 figures. Abstract abridged. Accepted for publication in
  JCAP","JCAP07(2015)039","10.1088/1475-7516/2015/07/039","UMN-TH-3435/15, IPMU15-0067","astro-ph.CO gr-qc hep-ph hep-th","http://arxiv.org/licenses/nonexclusive-distrib/1.0/","  We examine the cosmological correlators induced by the simultaneous breaking
of parity and of statistical isotropy, e.g., in presence of the coupling ${\cal
L} = f(\phi) ( - \frac{1}{4} F^2 + \frac{\gamma}{4} F \tilde{F} )$ between the
inflaton $\phi$ and a vector field with vacuum expectation value ${\bf A}$. For
a suitably chosen function $f$, the energy in the vector field $\rho_{\rm A}$
does not decay during inflation. This results in nearly scale-invariant
signatures of broken statistical isotropy and parity. Specifically, we find
that the scalar-scalar correlator of primordial curvature perturbations
includes a quadrupolar anisotropy, $P_\zeta ( {\bf k}) = P(k)[ 1 + g_* (
\hat{\bf k} \cdot \hat{\bf A})^2]$, and a (angle-averaged) scalar bispectrum
that is a linear combination of the first $3$ Legendre polynomials,
$B_\zeta(k_1, k_2, k_3) = \sum_L c_L P_L (\hat{\bf k}_1 \cdot \hat{\bf k}_2)
P(k_1) P(k_2) + 2~{\rm perms} $, with $c_0 : c_1 : c_2 = 2 : -3 : 1$ ($c_1 \neq
0$ is a consequence of parity violation, corresponding to the constant $\gamma
\neq 0$). The latter is one of the main results of this paper, which provides
for the first time a clear example of an inflationary model where a
non-negligible $c_1$ contribution to the bispectrum is generated. The
scalar-tensor and tensor-tensor correlators induce characteristic signatures in
the Cosmic Microwave Background temperature anisotropies (T) and polarization
(E/B modes); namely, non-diagonal contributions to $\langle a_{\ell_1 m_1}
a_{\ell_2 m_2}^* \rangle$, with $|\ell_1 - \ell_2| = 1$ in TT, TE, EE and BB,
and $|\ell_1 - \ell_2| = 2$ in TB and EB. The latest CMB bounds on the scalar
observables ($g_*$, $c_0$, $c_1$ and $c_2$), translate into the upper limit
$\rho_{\rm A} / \rho_\phi \lesssim 10^{-9}$ at $\gamma=0$. We find that the
upper limit on the vector energy density becomes much more stringent as
$\gamma$ grows.
","[{""version"":""v1"",""created"":""Fri, 8 May 2015 21:36:13 GMT""},{""version"":""v2"",""created"":""Sat, 25 Jul 2015 08:10:44 GMT""}]","2015-07-28"
"1505.02194","Sarah Muldoon","Sarah Feldt Muldoon, Eric W. Bridgeford, and Danielle S. Bassett","Small-World Propensity in Weighted, Real-World Networks","Manuscript and SI; 13 pages, 7 figures",,,,"q-bio.NC physics.data-an","http://arxiv.org/licenses/nonexclusive-distrib/1.0/","  Quantitative descriptions of network structure in big data can provide
fundamental insights into the function of interconnected complex systems.
Small-world structure, commonly diagnosed by high local clustering yet short
average path length between any two nodes, directly enables information flow in
coupled systems, a key function that can differ across conditions or between
groups. However, current techniques to quantify small-world structure are
dependent on nuisance variables such as density and agnostic to critical
variables such as the strengths of connections between nodes, thereby hampering
accurate and comparable assessments of small-world structure in different
networks. Here, we address both limitations with a novel metric called the
Small-World Propensity (SWP). In its binary instantiation, the SWP provides an
unbiased assessment of small-world structure in networks of varying densities.
We extend this concept to the case of weighted networks by developing (i) a
standardized procedure for generating weighted small-world networks, (ii) a
weighted extension of the SWP, and (iii) a stringent and generalizable method
for mapping real-world data onto the theoretical model. In applying these
techniques to real world brain networks, we uncover the surprising fact that
the canonical example of a biological small-world network, the C. elegans
neuronal network, has strikingly low SWP in comparison to other examined brain
networks. These metrics, models, and maps form a coherent toolbox for the
assessment of architectural properties in real-world networks and their
statistical comparison across conditions.
","[{""version"":""v1"",""created"":""Fri, 8 May 2015 21:53:05 GMT""}]","2015-05-12"
"1505.02195","Dervis Vural","Dervis Can Vural, Alexander Isakov, L. Mahadevan","The Organization and Control of an Evolving Interdependent Population","To download simulation code cf. article in Proceedings of the Royal
  Society, Interface","Journal of the Royal Society Interface 12: 20150044 (2015)","10.1098/rsif.2015.0044",,"q-bio.PE","http://arxiv.org/licenses/nonexclusive-distrib/1.0/","  Starting with Darwin, biologists have asked how populations evolve from a low
fitness state that is evolutionarily stable to a high fitness state that is
not. Specifically of interest is the emergence of cooperation and
multicellularity where the fitness of individuals often appears in conflict
with that of the population. Theories of social evolution and evolutionary game
theory have produced a number of fruitful results employing two-state two-body
frameworks. In this study we depart from this tradition and instead consider a
multi-player, multi-state evolutionary game, in which the fitness of an agent
is determined by its relationship to an arbitrary number of other agents. We
show that populations organize themselves in one of four distinct phases of
interdependence depending on one parameter, selection strength. Some of these
phases involve the formation of specialized large-scale structures. We then
describe how the evolution of independence can be manipulated through various
external perturbations.
","[{""version"":""v1"",""created"":""Fri, 8 May 2015 21:53:06 GMT""},{""version"":""v2"",""created"":""Sat, 7 Nov 2015 14:34:18 GMT""}]","2015-11-10"
"1505.02196","C. J. A. P. Martins","C. J. A. P. Martins and A. M. M. Pinho","Fine-structure constant constraints on dark energy","5 pages, 3 figures","Phys. Rev. D91 (2015) 103501","10.1103/PhysRevD.91.103501",,"astro-ph.CO gr-qc hep-ph hep-th","http://arxiv.org/licenses/nonexclusive-distrib/1.0/","  We use astrophysical and atomic clock tests of the stability of the
fine-structure constant $\alpha$, together with Type Ia supernova and Hubble
parameter data, to constrain the simplest class of dynamical dark energy models
where the same degree of freedom is assumed to provide both the dark energy and
(through a dimensionless coupling, $\zeta$, to the electromagnetic sector) the
$\alpha$ variation. We show how current data tightly constrains a combination
of $\zeta$ and the dark energy equation of state $w_0$. At the $95\%$
confidence level and marginalizing over $w_0$ we find $|\zeta|<5\times10^{-6}$,
with the atomic clock tests dominating the constraints. The forthcoming
generation of high-resolution ultra-stable spectrographs will enable
significantly tighter constraints.
","[{""version"":""v1"",""created"":""Fri, 8 May 2015 21:59:28 GMT""}]","2015-05-12"
"1505.02197","Cynthia J. Olson Reichhardt","C. Reichhardt, D. Ray, and C.J. Olson Reichhardt","Magnus-Induced Ratchet Effects for Skyrmions Interacting with Asymmetric
  Substrates","7 pages, 7 figures","New J. Phys. 17, 073034 (2015)","10.1088/1367-2630/17/7/073034",,"cond-mat.mes-hall cond-mat.mtrl-sci","http://arxiv.org/licenses/nonexclusive-distrib/1.0/","  When a particle is driven with an ac force over an asymmetric potential, it
can undergo a ratchet effect that produces a net dc motion of the particle.
Ratchet effects have been observed in numerous systems such as superconducting
vortices on asymmetric pinning substrates. Skyrmions, stable topological spin
textures with particle-like properties, have many similarities to vortices but
their behavior is strongly influenced by non-disspative effects arising from a
Magnus term in their equation of motion. We show using numerical simulations
that pronounced ratchet effects can occur for ac driven skyrmions moving over
asymmetric quasi-one-dimensional substrates. We find a new type of ratchet
effect called a Magnus-induced transverse ratchet that arises when the ac
driving force is applied perpendicular rather than parallel to the asymmetry
direction of the substrate. This transverse ratchet effect only occurs when the
Magnus term is finite, and the threshold ac amplitude needed to induce it
decreases as the Magnus term becomes more prominent. Ratcheting skyrmions
follow ordered orbits in which the net displacement parallel to the substrate
asymmetry direction is quantized. Skyrmion ratchets represent a new ac
current-based method for controlling skyrmion positions and motion for
spintronic applications.
","[{""version"":""v1"",""created"":""Fri, 8 May 2015 22:05:26 GMT""}]","2017-12-06"
"1505.02198","Tetsuya Kobayashi","Tetsuya J. Kobayashi, Ryo Yokota and Kazuyuki Aihara","Feedback Regulation and its Efficiency in Biochemical Networks",,,"10.1007/s10955-015-1443-2",,"q-bio.MN q-bio.PE","http://arxiv.org/licenses/nonexclusive-distrib/1.0/","  Intracellular biochemical networks fluctuate dynamically due to various
internal and external sources of fluctuation. Dissecting the fluctuation into
biologically relevant components is important for understanding how a cell
controls and harnesses noise and how information is transferred over apparently
noisy intracellular networks. While substantial theoretical and experimental
advancement on the decomposition of fluctuation was achieved for feedforward
networks without any loop, we still lack a theoretical basis that can
consistently extend such advancement to feedback networks. The main obstacle
that hampers is the circulative propagation of fluctuation by feedback loops.
In order to define the relevant quantity for the impact of feedback loops for
fluctuation, disentanglement of the causally interlocked influence between the
components is required. In addition, we also lack an approach that enables us
to infer non-perturbatively the influence of the feedback to fluctuation as the
dual reporter system does in the feedforward network. In this work, we resolve
these problems by extending the work on the fluctuation decomposition and the
dual reporter system. For a single-loop feedback network with two components,
we define feedback loop gain as the feedback efficiency that is consistent with
the fluctuation decomposition for feedforward networks. Then, we clarify the
relation of the feedback efficiency with the fluctuation propagation in an
open-looped FF network. Finally, by extending the dual reporter system, we
propose a conjugate feedback and feedforward system for estimating the feedback
efficiency only from the statistics of the system non-perturbatively.
","[{""version"":""v1"",""created"":""Fri, 8 May 2015 22:07:19 GMT""}]","2016-02-17"
"1505.02199","S. M. Hossein Tabatabaei Yazdi","S. M. Hossein Tabatabaei Yazdi, Yongbo Yuan, Jian Ma, Huimin Zhao,
  Olgica Milenkovic","A Rewritable, Random-Access DNA-Based Storage System","26 pages, 12 figures",,,,"cs.IT math.IT","http://arxiv.org/licenses/nonexclusive-distrib/1.0/","  We describe the first DNA-based storage architecture that enables random
access to data blocks and rewriting of information stored at arbitrary
locations within the blocks. The newly developed architecture overcomes
drawbacks of existing read-only methods that require decoding the whole file in
order to read one data fragment. Our system is based on new constrained coding
techniques and accompanying DNA editing methods that ensure data reliability,
specificity and sensitivity of access, and at the same time provide
exceptionally high data storage capacity. As a proof of concept, we encoded
parts of the Wikipedia pages of six universities in the USA, and selected and
edited parts of the text written in DNA corresponding to three of these
schools. The results suggest that DNA is a versatile media suitable for both
ultrahigh density archival and rewritable storage applications.
","[{""version"":""v1"",""created"":""Fri, 8 May 2015 22:12:53 GMT""}]","2015-05-12"
"1505.02200","Edward J. Kim","Edward J. Kim, Robert J. Brunner, Matias Carrasco Kind","A Hybrid Ensemble Learning Approach to Star-Galaxy Classification","15 pages, 18 figures. Accepted for publication in MNRAS. Code
  available at https://github.com/EdwardJKim/astroclass","MNRAS 2015 453 (1): 507-521","10.1093/mnras/stv1608",,"astro-ph.IM","http://arxiv.org/licenses/nonexclusive-distrib/1.0/","  There exist a variety of star-galaxy classification techniques, each with
their own strengths and weaknesses. In this paper, we present a novel
meta-classification framework that combines and fully exploits different
techniques to produce a more robust star-galaxy classification. To demonstrate
this hybrid, ensemble approach, we combine a purely morphological classifier, a
supervised machine learning method based on random forest, an unsupervised
machine learning method based on self-organizing maps, and a hierarchical
Bayesian template fitting method. Using data from the CFHTLenS survey, we
consider different scenarios: when a high-quality training set is available
with spectroscopic labels from DEEP2, SDSS, VIPERS, and VVDS, and when the
demographics of sources in a low-quality training set do not match the
demographics of objects in the test data set. We demonstrate that our Bayesian
combination technique improves the overall performance over any individual
classification method in these scenarios. Thus, strategies that combine the
predictions of different classifiers may prove to be optimal in currently
ongoing and forthcoming photometric surveys, such as the Dark Energy Survey and
the Large Synoptic Survey Telescope.
","[{""version"":""v1"",""created"":""Fri, 8 May 2015 22:14:48 GMT""},{""version"":""v2"",""created"":""Tue, 14 Jul 2015 16:57:42 GMT""}]","2015-08-20"
