"1506.02005","Shibdas Roy","Shibdas Roy and Ian R. Petersen","Robust $H_\infty$ Estimation of Uncertain Linear Quantum Systems","Minor corrections, 14 pages, 3 figures, International Journal of
  Robust and Nonlinear Control",,"10.1002/rnc.3530",,"cs.SY math.OC quant-ph","http://arxiv.org/licenses/nonexclusive-distrib/1.0/","  We consider classical estimators for a class of physically realizable linear
quantum systems. Optimal estimation using a complex Kalman filter for this
problem has been previously explored. Here, we study robust $H_\infty$
estimation for uncertain linear quantum systems. The estimation problem is
solved by converting it to a suitably scaled $H_\infty$ control problem. The
solution is obtained in the form of two algebraic Riccati equations. Relevant
examples involving dynamic squeezers are presented to illustrate the efficacy
of our method.
","[{""version"":""v1"",""created"":""Fri, 5 Jun 2015 18:24:11 GMT""},{""version"":""v2"",""created"":""Mon, 29 Feb 2016 04:41:06 GMT""},{""version"":""v3"",""created"":""Tue, 11 Apr 2017 10:38:14 GMT""}]","2017-04-12"
"1506.02006","Lorenzo A. Sadun","Alex Clark and Lorenzo Sadun","Small cocycles, fine torus fibrations, and a ${\mathbb Z}^2$ subshift
  with neither","Updated with additional text to clarify some difficult or ambiguous
  statements. Title changed to emphasize that our counterexample is in
  dimension 2",,,,"math.DS","http://arxiv.org/licenses/nonexclusive-distrib/1.0/","  Following an earlier similar conjecture of Kellendonk and Putnam, Giordano,
Putnam and Skau conjectured that all minimal, free ${\mathbb Z}^d$ actions on
Cantor sets admit ""small cocycles."" These represent classes in $H^1$ that are
mapped to small vectors in ${\mathbb R}^d$ by the Ruelle-Sullivan (RS) map. We
show that there exist ${\mathbb Z}^d$ actions where no such small cocycles
exist, and where the image of $H^1$ under RS is ${\mathbb Z}^d$. Our methods
involve tiling spaces and shape deformations, and along the way we prove a
relation between the image of RS and the set of ""virtual eigenvalues,"" i.e.
elements of ${\mathbb R}^d$ that become topological eigenvalues of the tiling
flow after an arbitrarily small change in the shapes and sizes of the tiles.
","[{""version"":""v1"",""created"":""Fri, 5 Jun 2015 18:31:11 GMT""},{""version"":""v2"",""created"":""Fri, 19 Jun 2015 19:36:39 GMT""},{""version"":""v3"",""created"":""Fri, 17 Feb 2017 19:46:27 GMT""}]","2017-02-21"
"1506.02007","Micola Bondarenco","M.V. Bondarenco","Limiting Energy Loss Distributions for Multiphoton Channeling Radiation","6 pages, 2 figures. Proceedings of Channeling-2014 conference",,"10.1016/j.nimb.2015.02.004",,"physics.acc-ph","http://arxiv.org/licenses/nonexclusive-distrib/1.0/","  Recent results in the theory of multiphoton spectra for coherent radiation
sources are overviewed, with the emphasis on channeling radiation. For the
latter case, the importance of the order of resummation and averaging is
illustrated. Limiting shapes of multiphoton spectra at high intensity are
discussed for different channeling regimes. In some spectral regions, there
emerges an approximate correspondence between the radiative energy loss and the
electron integrals of motion.
","[{""version"":""v1"",""created"":""Fri, 5 Jun 2015 18:44:09 GMT""}]","2015-12-09"
"1506.02009","Bet\""ul Pamuk","Bet\""ul Pamuk, Philip B. Allen, M.-V. Fern\'andez-Serra","Electronic and Nuclear Quantum Effects on the Ice XI/Ice Ih Phase
  Transition","8 pages, 6 figures","Phys. Rev. B 92, 134105 (2015)","10.1103/PhysRevB.92.134105",,"cond-mat.mtrl-sci","http://arxiv.org/licenses/nonexclusive-distrib/1.0/","  We study the isotope effect on the temperature of the proton order/disorder
phase transition between ice XI and ice Ih, using the quasiharmonic
approximation combined with \textit{ab initio} density functional theory
calculations. We show that this method is accurate enough to obtain a phase
transition temperature difference between light ice (H$_2$O) and heavy ice
(D$_2$O) of 6 K as compared to the experimental value of 4 K. More importantly,
we are able to explain the origin of the isotope effect on the much debated
large temperature difference observed in the phase transition. The source of
the difference is directly linked to the physics behind the anomalous isotope
effect on the volume of hexagonal ice that was recently explained in [Phys.
Rev. Lett. 108, 193003 (2012)]. These results indicate that the same physics
might be behind the isotope effects in transition temperatures between other
ice phases.
","[{""version"":""v1"",""created"":""Fri, 5 Jun 2015 19:07:26 GMT""},{""version"":""v2"",""created"":""Sun, 11 Oct 2015 16:47:28 GMT""}]","2015-10-14"
"1506.02010","Pierre Sacr\'e","Pierre Sacr\'e, Alessio Franci","Singularly perturbed phase response curves",,,,,"math.DS","http://arxiv.org/licenses/nonexclusive-distrib/1.0/","  In this paper we propose a novel geometric method, based on singular
perturbations, to approximate isochrones of relaxation oscillators and predict
the qualitative shape of their (finite) phase response curve. This approach
complements the infinitesimal phase response curve approach to relaxation
oscillators and overcomes its limitations near the singular limit. We
illustrate the power of the methodology by deriving semi-analytic formula for
the (finite) phase response curve of generic planar relaxation oscillators to
impulses and square pulses of finite duration and verify its goodness
numerically on the FitzHugh-Nagumo model.
","[{""version"":""v1"",""created"":""Fri, 5 Jun 2015 19:16:06 GMT""},{""version"":""v2"",""created"":""Mon, 15 Jun 2015 22:05:54 GMT""}]","2015-06-17"
"1506.02011","Henrik Jeldtoft Jensen","Jaleh Zand, Ugur Tirnakli and Henrik Jeldtoft Jensen","On the relevance of q-distribution functions: The return time
  distribution of restricted random walker","14 pages, 3 figures. The replacement correct that two papers in the
  reference list were not mentioned in the text",,"10.1088/1751-8113/48/42/425004",,"math-ph math.MP","http://arxiv.org/licenses/nonexclusive-distrib/1.0/","  There exist a large literature on the application of $q$-statistics to the
out-of-equilibrium non-ergodic systems in which some degree of strong
correlations exists. Here we study the distribution of first return times to
zero, $P_R(0,t)$, of a random walk on the set of integers $\{0,1,2,...,L\}$
with a position dependent transition probability given by $|n/L|^a$. We find
that for all values of $a\in[0,2]$ $P_R(0,t)$ can be fitted by
$q$-exponentials, but only for $a=1$ is $P_R(0,t)$ given exactly by a
$q$-exponential in the limit $L\rightarrow\infty$. This is a remarkable result
since the exact analytical solution of the corresponding continuum model
represents $P_R(0,t)$ as a sum of Bessel functions with a smooth dependence on
$a$ from which we are unable to identify $a=1$ as of special significance.
However, from the high precision numerical iteration of the discrete Master
Equation, we do verify that only for $a=1$ is $P_R(0,t)$ exactly a
$q$-exponential and that a tiny departure from this parameter value makes the
distribution deviate from $q$-exponential. Further research is certainly
required to identify the reason for this result and also the applicability of
$q$-statistics and its domain.
","[{""version"":""v1"",""created"":""Fri, 5 Jun 2015 19:16:18 GMT""},{""version"":""v2"",""created"":""Thu, 11 Jun 2015 11:50:42 GMT""}]","2015-10-28"
"1506.02012","Hendrik Jennen","H. Jennen, J. G. Pereira","Dark energy as a kinematic effect","6 pages, conclusions updated, references added","Phys. Dark Univ. 11 (2016) 49-53","10.1016/j.dark.2015.11.002",,"gr-qc hep-th","http://arxiv.org/licenses/nonexclusive-distrib/1.0/","  We present a generalization of teleparallel gravity that is consistent with
local spacetime kinematics regulated by the de Sitter group $SO(1,4)$. The
mathematical structure of teleparallel gravity is shown to be given by a
nonlinear Riemann-Cartan geometry without curvature, which inspires us to build
the generalization on top of a de Sitter-Cartan geometry with a cosmological
function. The cosmological function is given its own dynamics and naturally
emerges nonminimally coupled to the gravitational field in a manner akin to
teleparallel dark energy models or scalar-tensor theories in general
relativity. New in the theory here presented, the cosmological function gives
rise to a kinematic contribution in the deviation equation for the world lines
of adjacent free-falling particles. While having its own dynamics, dark energy
manifests itself in the local kinematics of spacetime.
","[{""version"":""v1"",""created"":""Fri, 5 Jun 2015 19:17:06 GMT""},{""version"":""v2"",""created"":""Thu, 3 Dec 2015 11:41:59 GMT""}]","2015-12-04"
"1506.02013","Eric Bax","James Li, Eric Bax, Nilanjan Roy, Andrea Leistra","VCG Payments for Portfolio Allocations in Online Advertising",,,,,"cs.GT q-fin.RM","http://arxiv.org/licenses/nonexclusive-distrib/1.0/","  Some online advertising offers pay only when an ad elicits a response.
Randomness and uncertainty about response rates make showing those ads a risky
investment for online publishers. Like financial investors, publishers can use
portfolio allocation over multiple advertising offers to pursue revenue while
controlling risk. Allocations over multiple offers do not have a distinct
winner and runner-up, so the usual second-price mechanism does not apply. This
paper develops a pricing mechanism for portfolio allocations. The mechanism is
efficient, truthful, and rewards offers that reduce risk.
","[{""version"":""v1"",""created"":""Fri, 5 Jun 2015 19:17:46 GMT""}]","2015-06-08"
"1506.02014","Alejandro Hnilo Dr.","Carlos R. Bonazzola, Alejandro A. Hnilo, Marcelo G. Kovalsky and Jorge
  R.Tredicce","Features of the extreme events observed in the all-solid state laser
  with a saturable absorber","9 pages, 9 figures","Phys. Rev. A 92, 053816 (2015)","10.1103/PhysRevA.92.053816",,"physics.optics","http://arxiv.org/licenses/nonexclusive-distrib/1.0/","  Extreme events (sometimes also called optical rogue waves), in the form of
pulses of extraordinary intensity, are easily observed in its chaotic regime if
the Fresnel number of the cavity is high. This result suggests that the
nonlinear interaction among transverse modes is an essential ingredient in the
formation of extreme events in this type of lasers, but there is no theoretical
description of the phenomenon yet. We report here a set of experimental results
on the regularities of these extreme events, to provide a basis for the
development of such a description. Among these results, we point out here: i)
the decay of the correlation across the transversal section of the laser beam,
and ii) the appearance of extreme events even if the time elapsed since the
previous pulse is relatively short (in terms of the average inter-pulse
separation), what indicates the existence of some unknown mechanism of energy
storage. We hypothesize that this mechanism is related with the imperfect
depletion of the gain by some of the transversal modes. We also present
evidence in support of this hypothesis.
","[{""version"":""v1"",""created"":""Fri, 5 Jun 2015 19:18:02 GMT""}]","2015-11-11"
"1506.02015","Nathaniel Stern","Guohua Wei, Teodor K. Stanev, David A. Czaplewski, Il Woong Jung, and
  Nathaniel P. Stern","Silicon-nitride photonic circuits interfaced with monolayer MoS$_2$","8 pages, 4 figures","Appl. Phys. Lett. 107, 091112 (2015)","10.1063/1.4929779",,"cond-mat.mtrl-sci physics.optics","http://arxiv.org/licenses/nonexclusive-distrib/1.0/","  We report on the integration of monolayer molybdenum disulphide with silicon
nitride microresonators assembled by visco-elastic layer transfer techniques.
Evanescent coupling from the resonator mode to the monolayer is confirmed
through measurements of cavity transmission. The absorption of the monolayer
semiconductor flakes in this geometry is determined to be 850 dB/cm, which is
larger than that of graphene and black phosphorus with the same thickness. This
technique can be applied to diverse monolayer semiconductors for assembling
hybrid optoelectronic devices such as photodetectors and modulators operating
over a wide spectral range.
","[{""version"":""v1"",""created"":""Fri, 5 Jun 2015 19:20:10 GMT""}]","2015-09-07"
"1506.02016","Luca Tessieri","L. Tessieri, I. F. Herrera-Gonz\'alez, F. M. Izrailev","The band-centre anomaly in the 1D Anderson model with correlated
  disorder","42 pages, 15 figures",,"10.1088/1751-8113/48/35/355001",,"cond-mat.dis-nn","http://arxiv.org/licenses/nonexclusive-distrib/1.0/","  We study the band-centre anomaly in the one-dimensional Anderson model with
weak correlated disorder. Our analysis is based on the Hamiltonian map
approach; the correspondence between the discrete model and its continuous
counterpart is discussed in detail. We obtain analytical expressions of the
localisation length and of the invariant measure of the phase variable, valid
for energies in a neighbourhood of the band centre. By applying these general
results to specific forms of correlated disorder, we show how correlations can
enhance or suppress the anomaly at the band centre.
","[{""version"":""v1"",""created"":""Fri, 5 Jun 2015 19:20:37 GMT""}]","2016-08-08"
"1506.02017","Roland Speicher","Serban Belinschi, Piotr Sniady and Roland Speicher","Eigenvalues of non-hermitian random matrices and Brown measure of
  non-normal operators: hermitian reduction and linearization method","final version","Linear Algebra and its Applications Volume 537, 15 January 2018,
  Pages 48-83","10.1016/j.laa.2017.09.024",,"math.OA math.PR","http://arxiv.org/licenses/nonexclusive-distrib/1.0/","  We study the Brown measure of certain non-hermitian operators arising from
Voiculescu's free probability theory. Usually those operators appear as the
limit in *-moments of certain ensembles of non-hermitian random matrices, and
the Brown measure gives then a canonical candidate for the limit eigenvalue
distribution of the random matrices. A prominent class for our operators is
given by polynomials in *-free variables. Other explicit examples include
R-diagonal elements and elliptic elements, for which the Brown measure was
already known, and a new class of triangular-elliptic elements. Our method for
the calculation of the Brown measure is based on a rigorous mathematical
treatment of the hermitian reduction method, as considered in the physical
literature, combined with subordination ideas and the linearization trick.
","[{""version"":""v1"",""created"":""Fri, 5 Jun 2015 19:21:55 GMT""},{""version"":""v2"",""created"":""Wed, 2 Sep 2015 13:42:40 GMT""},{""version"":""v3"",""created"":""Fri, 8 Sep 2017 15:38:04 GMT""}]","2023-01-16"
"1506.02018","Gabriella Tarantello","Gabriella Tarantello","Blow up analysis for a cosmic strings equation","82 pages",,,,"math.AP","http://arxiv.org/licenses/nonexclusive-distrib/1.0/","  In this paper we develop a blow up analysis for solutions of a planar
semilinear elliptic equation involving exponential nonlinearities. Such
solutions describe cosmic strings, and we show how their blow up behaviour is
characterised by new and surprising phenomena. For example in some cases, the
blow up profile of the solution is described in terms of a differential problem
that bares a geometrical meaning in the context of the uniformization of the
Riemann sphere with conical singularities.
","[{""version"":""v1"",""created"":""Fri, 5 Jun 2015 19:23:46 GMT""}]","2015-06-08"
"1506.02019","Isabelle Boisse","I. Boisse, A. Santerne, J.-P. Beaulieu, W. Fakhardji, N.C. Santos, P.
  Figueira, S.G. Sousa, and C. Ranc","The first radial velocity measurements of a microlensing event: no
  evidence for the predicted binary","submitted on 3rd June 2015 to A&ALetter",,"10.1051/0004-6361/201526666",,"astro-ph.EP astro-ph.IM astro-ph.SR","http://arxiv.org/licenses/nonexclusive-distrib/1.0/","  The gravitational microlensing technique allows the discovery of exoplanets
around stars distributed in the disk of the galaxy towards the bulge. However,
the alignment of two stars that led to the discovery is unique over the
timescale of a human life and cannot be re-observed. Moreover, the target host
is often very faint and located in a crowded region. These difficulties hamper
and often make impossible the follow-up of the target and study of its possible
companions. Gould et al. (2013) predicted the radial-velocity curve of a binary
system, OGLE-2011-BLG-0417, discovered and characterised from a microlensing
event by Shin et al. (2012). We used the UVES spectrograph mounted at the VLT,
ESO to derive precise radial-velocity measurements of OGLE-2011-BLG-0417. To
gather high-precision on faint targets of microlensing events, we proposed to
use the source star as a reference to measure the lens radial velocities. We
obtained ten radial velocities on the putative V=18 lens with a dispersion of
~100 m/s, spread over one year. Our measurements do not confirm the
microlensing prediction for this binary system. The most likely scenario is
that the assumed V=18 mag lens is actually a blend and not the primary lens
that is 2 magnitude fainter. Further observations and analyses are needed to
understand the microlensing observation and infer on the nature and
characteristics of the lens itself.
","[{""version"":""v1"",""created"":""Fri, 5 Jun 2015 19:26:47 GMT""}]","2015-12-09"
"1506.02020","Eric Bax","Ragavendran Gopalakrishnan, Eric Bax, Krishna Prasad Chitrapura,
  Sachin Garg","Portfolio Allocation for Sellers in Online Advertising",,,,,"cs.GT q-fin.PM q-fin.RM","http://arxiv.org/licenses/nonexclusive-distrib/1.0/","  In markets for online advertising, some advertisers pay only when users
respond to ads. So publishers estimate ad response rates and multiply by
advertiser bids to estimate expected revenue for showing ads. Since these
estimates may be inaccurate, the publisher risks not selecting the ad for each
ad call that would maximize revenue. The variance of revenue can be decomposed
into two components -- variance due to `uncertainty' because the true response
rate is unknown, and variance due to `randomness' because realized response
statistics fluctuate around the true response rate. Over a sequence of many ad
calls, the variance due to randomness nearly vanishes due to the law of large
numbers. However, the variance due to uncertainty doesn't diminish.
  We introduce a technique for ad selection that augments existing estimation
and explore-exploit methods. The technique uses methods from portfolio
optimization to produce a distribution over ads rather than selecting the
single ad that maximizes estimated expected revenue. Over a sequence of similar
ad calls, ads are selected according to the distribution. This approach
decreases the effects of uncertainty and increases revenue.
","[{""version"":""v1"",""created"":""Fri, 5 Jun 2015 19:26:53 GMT""}]","2015-06-08"
"1506.02021","Wenpin Tang","Steven N. Evans, Jim Pitman, Wenpin Tang","The spans in Brownian motion","33 pages, 4 figures. This paper is published by
  http://projecteuclid.org/euclid.aihp/1500624032","Annales de l'Institut Henri Poincare - Probabilities and
  Statistics 2017, Vol 53, No. 3, 1108-1135","10.1214/16-AIHP749",,"math.PR","http://arxiv.org/licenses/nonexclusive-distrib/1.0/","  For $d \in \{1,2,3\}$, let $(B^d_t;~ t \geq 0)$ be a $d$-dimensional standard
Brownian motion. We study the $d$-Brownian span set $Span(d):=\{t-s;~
B^d_s=B^d_t~\mbox{for some}~0 \leq s \leq t\}$. We prove that almost surely the
random set $Span(d)$ is $\sigma$-compact and dense in $\mathbb{R}_{+}$. In
addition, we show that $Span(1)=\mathbb{R}_{+}$ almost surely; the Lebesgue
measure of $Span(2)$ is $0$ almost surely and its Hausdorff dimension is $1$
almost surely; and the Hausdorff dimension of $Span(3)$ is $\frac{1}{2}$ almost
surely. We also list a number of conjectures and open problems.
","[{""version"":""v1"",""created"":""Fri, 5 Jun 2015 19:37:11 GMT""},{""version"":""v2"",""created"":""Sun, 23 Jul 2017 16:31:00 GMT""}]","2017-07-25"
"1506.02022","Tom Kibble","T. W. B. Kibble and Tanmay Vachaspati","Monopoles on strings","21 pages. Revised version with extra references. To be published in
  40th anniversary issue of J. Phys. G","J. Phys. G: Nucl. Part. Phys. 42 (2015) 094002","10.1088/0954-3899/42/9/094002",,"astro-ph.CO hep-th","http://arxiv.org/licenses/nonexclusive-distrib/1.0/","  In cosmological scenarios based on grand unification, string theory or
braneworlds, many kinds of topological or non-topological defects, including
monopoles and cosmic strings, are predicted to be formed in the early universe.
Here we review specifically the physics of composite objects involving
monopoles tied to strings. There is a wide variety of these, including for
example ""dumbbells"" and ""necklaces,"" depending on how many strings attach to
each monopole and on the extent to which the various fluxes are confined to the
strings. We also briefly survey the prospects for observing such structures,
the existing observational limits, and potential evidence for a cosmological
role.
","[{""version"":""v1"",""created"":""Fri, 5 Jun 2015 19:44:32 GMT""},{""version"":""v2"",""created"":""Sat, 20 Jun 2015 15:43:48 GMT""}]","2015-09-02"
"1506.02023","Dustin Cartwright","Dustin Cartwright","Combinatorial tropical surfaces","29 pages, 5 figures. This is an expansion of sections 5 and 6 of
  arXiv:1308.3813v1",,,,"math.CO math.AG","http://arxiv.org/licenses/nonexclusive-distrib/1.0/","  We study the combinatorial properties of 2-dimensional tropical complexes. In
particular, we prove tropical analogues of the Hodge index theorem and
Noether's formula. In addition, we introduce algebraic equivalence for divisors
on tropical complexes of arbitrary dimension.
","[{""version"":""v1"",""created"":""Fri, 5 Jun 2015 19:46:29 GMT""}]","2015-06-08"
"1506.02024","Dor Shaviv","Dor Shaviv, Phan-Minh Nguyen, Ayfer Ozgur","Capacity of the Energy Harvesting Channel with a Finite Battery","submitted to IEEE Transactions on Information Theory; revised
  following reviewers' comments",,,,"cs.IT math.IT","http://arxiv.org/licenses/nonexclusive-distrib/1.0/","  We consider an energy harvesting channel, in which the transmitter is powered
by an exogenous stochastic energy harvesting process $E_t$, such that $0\leq
E_t\leq\bar{E}$, which can be stored in a battery of finite size $\bar{B}$. We
provide a simple and insightful formula for the approximate capacity of this
channel with bounded guarantee on the approximation gap independent of system
parameters. This approximate characterization of the capacity identifies two
qualitatively different operating regimes for this channel: in the large
battery regime, when $\bar{B}\geq \bar{E}$, the capacity is approximately equal
to that of an AWGN channel with an average power constraint equal to the
average energy harvesting rate, i.e. it depends only on the mean of $E_t$ and
is (almost) independent of the distribution of $E_t$ and the exact value of
$\bar{B}$. In particular, this suggests that a battery size
$\bar{B}\approx\bar{E}$ is approximately sufficient to extract the infinite
battery capacity of the system. In the small battery regime, when
$\bar{B}<\bar{E}$, we clarify the dependence of the capacity on the
distribution of $E_t$ and the value of $\bar{B}$. There are three steps to
proving this result which can be of interest in their own right: 1) we
characterize the capacity of this channel as an $n$-letter mutual information
rate under various assumptions on the availability of energy arrival
information; 2) we characterize the approximately optimal online power control
policy that maximizes the long-term average throughput of the system; 3) we
show that the information-theoretic capacity of this channel is equal, within a
constant gap, to its long-term average throughput. This last result provides a
connection between the information- and communication-theoretic formulations of
the energy-harvesting communication problem that have been so far studied in
isolation.
","[{""version"":""v1"",""created"":""Fri, 5 Jun 2015 19:52:47 GMT""},{""version"":""v2"",""created"":""Fri, 1 Jul 2016 17:36:49 GMT""}]","2016-07-04"
"1506.02025","Max Jaderberg","Max Jaderberg, Karen Simonyan, Andrew Zisserman, Koray Kavukcuoglu","Spatial Transformer Networks",,,,,"cs.CV","http://arxiv.org/licenses/nonexclusive-distrib/1.0/","  Convolutional Neural Networks define an exceptionally powerful class of
models, but are still limited by the lack of ability to be spatially invariant
to the input data in a computationally and parameter efficient manner. In this
work we introduce a new learnable module, the Spatial Transformer, which
explicitly allows the spatial manipulation of data within the network. This
differentiable module can be inserted into existing convolutional
architectures, giving neural networks the ability to actively spatially
transform feature maps, conditional on the feature map itself, without any
extra training supervision or modification to the optimisation process. We show
that the use of spatial transformers results in models which learn invariance
to translation, scale, rotation and more generic warping, resulting in
state-of-the-art performance on several benchmarks, and for a number of classes
of transformations.
","[{""version"":""v1"",""created"":""Fri, 5 Jun 2015 19:54:26 GMT""},{""version"":""v2"",""created"":""Thu, 3 Dec 2015 16:13:08 GMT""},{""version"":""v3"",""created"":""Thu, 4 Feb 2016 18:08:46 GMT""}]","2016-02-05"
