"1506.02122","Yury Tsyganov S","Y. S. Tsyganov, A. N. Polyakov, A. M. Sukhov","Parameter monitoring system of the Dubna Gas-Filled Recoil Separator","parameter monitoring C++ code",,,,"physics.ins-det","http://arxiv.org/licenses/nonexclusive-distrib/1.0/","  PC-based one-crate monitoring and control system of the Dubna Gas Filled
Recoil Separator (DGFRS) is considered. It is developed for the long-term
experiments at the U400 FLNR cyclotron and is aimed at the synthesis of super
heavy nuclei in heavy ion induced complete fusion reactions. Parameters related
to:
  a) beam and cyclotron;
  b) separator by itself,
  c) detection system,
  d) target and entrance window are measured and stored in the protocol file of
the experiment. Special attention is paid to generating the alarm signals and
implementing further the appropriate procedures
","[{""version"":""v1"",""created"":""Sat, 6 Jun 2015 06:40:00 GMT""}]","2015-06-09"
"1506.02123","Titus K Mathew","Titus K. Mathew, Chinthak Murali and Shejeelammal J","Evolution of entropic dark energy and its phantom nature","14 pages, 8 figures",,"10.1142/S0217732316500711",,"gr-qc","http://arxiv.org/licenses/nonexclusive-distrib/1.0/","  Assuming the form of the entropic dark energy as arises form the surface term
in the Einstein-Hilbert's action, it's evolution were analyzed in an expanding
flat universe. The model parameters were evaluated by constraining model using
the Union data on Type Ia supernovae. We found that the model predicts an early
decelerated phase and a later accelerated phase at the background level. The
evolution of the Hubble parameter, dark energy density, equation of state
parameter and deceleration parameter were obtained. The model is diagnosed with
$Om$ parameter. The model is hardly seems to be supporting the linear
perturbation growth for the structure formation. We also found that the
entropic dark energy shows phantom nature for redshifts $z<0.257.$ During the
phantom epoch, the model predicts big-rip effect at which both the scale factor
of expansion and the dark energy density become infinitely large and the big
rip time is found to be around 36 Giga Years from now.
","[{""version"":""v1"",""created"":""Sat, 6 Jun 2015 06:55:23 GMT""},{""version"":""v2"",""created"":""Tue, 23 Jun 2015 07:18:50 GMT""},{""version"":""v3"",""created"":""Thu, 10 Dec 2015 06:43:49 GMT""}]","2016-04-27"
"1506.02124","Roman Mikhailov","Roman Mikhailov and Inder Bir S. Passi","Generalized dimension subgroups and derived functors","21 pages",,,,"math.GR math.AT math.RA","http://arxiv.org/licenses/nonexclusive-distrib/1.0/","  Every two-sided ideal $\mathfrak a$ in the integral group ring $\mathbb Z[G]
$ of a group $G$ determines a normal subgroup $G \cap (1 + \mathfrak a)$ of
$G$. In this paper certain problems related to the identification of such
subgroups, and their relationship with derived functors in the sense of
Dold-Puppe, are discussed.
","[{""version"":""v1"",""created"":""Sat, 6 Jun 2015 07:32:06 GMT""},{""version"":""v2"",""created"":""Wed, 10 Jun 2015 15:00:16 GMT""}]","2015-06-11"
"1506.02125","Barbara Kaltenbacher","Vanja Nikolic and Barbara Kaltenbacher","On higher regularity for the Westervelt equation with strong nonlinear
  damping",,,,,"math.AP","http://arxiv.org/licenses/nonexclusive-distrib/1.0/","  We show higher interior regularity for the Westervelt equation with strong
nonlinear damping term of the $q$-Laplace type. Secondly, we investigate an
interface coupling problem for these models, which arise, e.g., in the context
of medical applications of high intensity focused ultrasound in the treatment
of kidney stones. We show that the solution to the coupled problem exhibits
piecewise $H^2$ regularity in space, provided that the gradient of the acoustic
pressure is essentially bounded in space and time on the whole domain. This
result is of importance in numerical approximations of the present problem, as
well as in gradient based algorithms for finding the optimal shape of the
focusing acoustic lens in lithotripsy.
","[{""version"":""v1"",""created"":""Sat, 6 Jun 2015 07:45:47 GMT""}]","2015-06-09"
"1506.02126","Frank Werner","Claudia K\""onig, Frank Werner and Thorsten Hohage","Convergence Rates for Exponentially Ill-Posed Inverse Problems with
  Impulsive Noise","to appear in SIAM J. Numer. Anal","SIAM J. Numer. Anal., 2016, 54, 341-360","10.1137/15M1022252",,"math.NA","http://arxiv.org/licenses/nonexclusive-distrib/1.0/","  This paper is concerned with exponentially ill-posed operator equations with
additive impulsive noise on the right hand side, i.e. the noise is large on a
small part of the domain and small or zero outside. It is well known that
Tikhonov regularization with an $L^1$ data fidelity term outperforms Tikhonov
regularization with an $L^2$ fidelity term in this case. This effect has
recently been explained and quantified for the case of finitely smoothing
operators. Here we extend this analysis to the case of infinitely smoothing
forward operators under standard Sobolev smoothness assumptions on the
solution, i.e. exponentially ill-posed inverse problems. It turns out that high
order polynomial rates of convergence in the size of the support of large noise
can be achieved rather than the poor logarithmic convergence rates typical for
exponentially ill-posed problems. The main tools of our analysis are Banach
spaces of analytic functions and interpolation-type inequalities for such
spaces. We discuss two examples, the (periodic) backwards heat equation and an
inverse problem in gradiometry.
","[{""version"":""v1"",""created"":""Sat, 6 Jun 2015 08:23:10 GMT""},{""version"":""v2"",""created"":""Thu, 26 Nov 2015 12:43:23 GMT""}]","2016-03-18"
"1506.02127","Yu Song","Yu Song, Gang Dai","Spin filter and spin valve in ferromagnetic graphene","5 pages, 5 figures","Appl. Phys. Lett. 106, 223104 (2015)","10.1063/1.4921668",,"cond-mat.mes-hall","http://arxiv.org/licenses/nonexclusive-distrib/1.0/","  We propose and demonstrate that a EuO-induced and top-gated graphene
ferromagnetic junction can be simultaneously operated as a spin filter as well
as a spin valve. We attribute such a remarkable result to a coexistence of a
half-metal band and a common energy gap for opposite spins in ferromagnetic
graphene. We show that, both the spin filter and the spin valve can be
effectively controlled by a back gate voltage, and they survive for practical
metal contacts and finite temperature. Specifically, larger single spin
currents and on-state currents can be reached with contacts with work functions
similar to graphene, and the spin filter can operate at higher temperature than
the spin valve.
","[{""version"":""v1"",""created"":""Sat, 6 Jun 2015 08:41:56 GMT""}]","2015-06-09"
"1506.02128","Rua-Huan Tsaih Dr.","Wen-Jan Chang, Rua-HuanTsaih, David C. Yen, Tzu-Shian Han","The ICT predicament of new ICT-enabled service",,,,,"cs.CY","http://arxiv.org/licenses/nonexclusive-distrib/1.0/","  The advancement of information and communication technologies (ICT) has
triggered many ICT-enabled services. Regarding this service, the complementary
ICT system involves with customers' devices, industry-wide ICT development and
nation-wide ICT infrastructure, which are difficult for any individual
organization to control. The ICT predicament is the phenomenon that the
complementary ICT system is inferior in delivering the promised service quality
of new ICT-enabled service. With the ICT predicament, companies face the
decision-making dilemma in launching the new service or postponing the launch.
This study proposes a process to resolve the decision-making dilemma regarding
the ICT predicament.
","[{""version"":""v1"",""created"":""Sat, 6 Jun 2015 08:47:48 GMT""}]","2015-06-09"
"1506.02129","Mohammad Golshani","Mohammad Golshani, Rahman Mohammadpour","Cardinal collapsing and product forcing",,,,,"math.LO","http://arxiv.org/licenses/nonexclusive-distrib/1.0/","  Suppose $\kappa$ is a singular strong limit cardinal of countable cofinality
and let $\langle \kappa_{n}: n<\omega \rangle$ be an incrasing sequence of
regular cardinals cofinal in $\kappa$. We show that if $cf(2^\kappa)=
\kappa^+$, then forcing with the full product $\prod_{n<\omega}Add(\kappa_n,1)$
collapses $2^\kappa$ into $\kappa^+$. This result gives a consistent positive
answer to a question of Sy Friedman. We also give a new proof of a result due
to Shelah by showing that if the sequence carries a scale of length $\kappa^+,$
then forcing with $\prod_{n<\omega}Add(\kappa_n,1)$ adds a generic filter for
$Add(\kappa^+, 1)$, and indeed \[ \prod_{n<\omega}Add(\kappa_n,1)/fin \simeq
Add(\kappa^+, 1). \]
","[{""version"":""v1"",""created"":""Sat, 6 Jun 2015 09:01:43 GMT""},{""version"":""v2"",""created"":""Fri, 2 Oct 2015 11:22:58 GMT""},{""version"":""v3"",""created"":""Fri, 9 Jul 2021 04:05:00 GMT""}]","2021-07-12"
"1506.02130","Mohammad R. Garousi","Ali Jalali, Mohammad R. Garousi","On D-brane action at order $ \alpha'^2$","Latex file, 20 pages, no figure; V2: the version appears in PRD","Phys. Rev. D 92, 106004 (2015)","10.1103/PhysRevD.92.106004",,"hep-th","http://arxiv.org/licenses/nonexclusive-distrib/1.0/","  We use compatibility of D-brane action with linear T-duality, S-duality and
with S-matrix elements as guiding principles to find all world volume couplings
of one massless closed and two open strings at order $\alpha'^2$ in type II
superstring theories. In particular, we find that the squares of second
fundamental form appear only in world volume curvatures, and confirm the
observation that dilaton appears in string frame action via the transformation
$\hat{R}_{\mu\nu}\rightarrow \hat{R}_{\mu\nu}+\nabla_{\mu}\nabla_{\nu}\Phi$.
","[{""version"":""v1"",""created"":""Sat, 6 Jun 2015 09:29:11 GMT""},{""version"":""v2"",""created"":""Mon, 9 Nov 2015 13:32:25 GMT""}]","2015-11-25"
"1506.02131","Manuel Delgado","Manuel Delgado and Pedro A. Garc\'ia S\'anchez","numericalsgps, a GAP package for numerical semigroups","12 pages","ACM Communications in Computer Algebra, 50 (2016) 12-24","10.1145/2930964.2930966",,"math.AC","http://arxiv.org/licenses/nonexclusive-distrib/1.0/","  The package numericalsgps performs computations with and for numerical
semigroups. Recently also affine semigroups are admitted as objects for
calculations. This manuscript is a survey of what the package does, and at the
same time of the trending topics on numerical semigroups.
","[{""version"":""v1"",""created"":""Sat, 6 Jun 2015 09:34:46 GMT""}]","2019-02-12"
"1506.02132","Chandan  Pradhan","Chandan Pradhan, Kunal Sankhe, Sumit Kumar and Garimella Rama Murthy","Full-Duplex eNodeB and UE Design for 5G Networks","7 pages and 6 figures, Accepted and will also be available in
  proceedings of Wireless Telecommunications Symposium (WTS) 2015",,,"1506.01910","cs.IT cs.NI math.IT","http://arxiv.org/licenses/nonexclusive-distrib/1.0/","  The recent progress in the area of self-interference cancellation (SIC)
design has enabled the development of full-duplex (FD) single and multiple
antenna systems. In this paper, we propose a design for FD eNodeB (eNB) and
user equipment (UE) for 5G networks. The use of FD operation enables
simultaneous in-band uplink and downlink operation and thereby cutting down the
spectrum requirement by half. FD operation requires the same subcarrier
allocation to UE in both uplink and downlink. Long Term Evolution LTE) uses
orthogonal frequency division multiple access (OFDMA) for downlink. To enable
FD operation, we propose using single carrier frequency division multiple
access SC-FDMA) for downlink along with the conventional method of using it for
uplink. Taking advantage of channel reciprocity, singular value decomposition
(SVD) based eamforming in the downlink allows multiple users (MU) to operate on
same set of subcarriers. In uplink, frequency domain minimum mean square error
(MMSE) equalizer along with successive interference cancellation with optimal
ordering (SSIC-OO) algorithm is used to decouple signals of users operating in
the same set of subcarriers. The work includes simulations showing efficient FD
operation both at UE and eNB for downlink and uplink respectively.
","[{""version"":""v1"",""created"":""Sat, 6 Jun 2015 09:47:42 GMT""}]","2015-07-09"
"1506.02133","Bikshandarkoil Srinivasan","Bikshandarkoil R. Srinivasan","Comment on the paper: Synthesis, growth and characterization of cadmium
  manganese thiocyanate (CMTC) crystal","8 Pages, 1 Figure",,,,"cond-mat.mtrl-sci","http://arxiv.org/licenses/nonexclusive-distrib/1.0/","  The authors of the title paper (Spectrochim. Acta 79A (2011) 340-343) report
the crystal growth of cadmium manganese thiocyanate CdMn(SCN)4 and its
characterization by single crystal X-ray diffraction and infrared spectrum.
Many points of criticism, concerning the crystal growth and reported
experimental data are highlighted in this report.
","[{""version"":""v1"",""created"":""Sat, 6 Jun 2015 10:21:30 GMT""}]","2015-06-09"
"1506.02134","Lan Chen","Jinglan Qiu, Huixia Fu, Yang Xu, Qing Zhou, Sheng Meng, Hui Li, Lan
  Chen, Kehui Wu","From Silicene to Half-Silicane by Hydrogenation","We think more discusses about the adsorption mechanism are needed",,,,"cond-mat.mtrl-sci cond-mat.mes-hall","http://arxiv.org/licenses/nonexclusive-distrib/1.0/","  Graphane is graphene fully hydrogenated from both sides, forming a 1x1
structure, where all C atoms are in sp3 configuration. In silicene, the Si
atoms are in a mix-sp2/sp3 configuration, it is therefore natural to imagine
silicane in analogue to graphane. However, monoatomic silicene sheet grown on
substrates generally reconstructs into different phases, and only partially
hydrogenated silicene with reconstructions had been reported before. In this
report we produce half-silicane, where one Si sublattice is fully H-saturated
and the other sublattice is intact, forming a perfect 1x1 structure. By
hydrogenating various silicene phases on Ag(111) substrate, we found that only
the (2r3x2r3)R30{\deg} phase can produce half-silicane. Interestingly, this
phase was previous considered to be a highly defective or incomplete silicene
structure. Our results indicate that the structure of (2r3x2r3)R30{\deg} phase
involves a complete silicene-1x1 lattice instead of defective fragments, and
the formation mechanism of half-silicane was discussed with the help of first
principles calculations.
","[{""version"":""v1"",""created"":""Sat, 6 Jun 2015 11:20:16 GMT""},{""version"":""v2"",""created"":""Wed, 15 Jul 2015 07:51:28 GMT""}]","2015-07-16"
"1506.02135","Matteo Bonato","M. Bonato, M. Negrello, Z.-Y. Cai, G. De Zotti, A. Bressan, T. Wada,
  K. Kohno, R. Maiolino, C. Gruppioni, F. Pozzi, A. Lapi","Predictions for surveys with the SPICA Mid-infrared Instrument","12 pages, 17 figures, accepted for publication in MNRAS",,"10.1093/mnras/stv1316",,"astro-ph.GA astro-ph.CO","http://arxiv.org/licenses/nonexclusive-distrib/1.0/","  We present predictions for number counts and redshift distributions of
galaxies detectable in continuum and in emission lines with the Mid-infrared
(MIR) Instrument (SMI) proposed for the Space Infrared Telescope for Cosmology
and Astrophysics (SPICA). We have considered 24 MIR fine-structure lines, four
Polycyclic Aromatic Hydrocarbon (PAH) bands (at 6.2, 7.7, 8.6 and 11.3$\mu$m)
and two silicate bands (in emission and in absorption) at 9.7$\mu$m and
18.0$\mu$m. Six of these lines are primarily associated with Active Galactic
Nuclei (AGNs), the others with star formation. A survey with the SMI
spectrometers of 1 hour integration per field-of-view (FoV) over an area of
$1\,\hbox{deg}^2$ will yield $5\,\sigma$ detections of $\simeq 140$ AGN lines
and of $\simeq 5.2\times10^{4}$ star-forming galaxies, $\simeq 1.6\times10^{4}$
of which will be detected in at least two lines. The combination of a shallow
($20.0\,\hbox{deg}^{2}$, $1.4\times10^{-1}$ h integration per FoV) and a deep
survey ($6.9\times10^{-3}\,\hbox{deg}^{2}$, $635$ h integration time), with the
SMI camera, for a total of $\sim$1000 h, will accurately determine the MIR
number counts of galaxies and of AGNs over five orders of magnitude in flux
density, reaching values more than one order of magnitude fainter than the
deepest Spitzer $24\,\mu$m surveys. This will allow us to determine the cosmic
star formation rate (SFR) function down to SFRs more than 100 times fainter
than reached by the Herschel Observatory.
","[{""version"":""v1"",""created"":""Sat, 6 Jun 2015 11:28:57 GMT""}]","2015-07-15"
"1506.02136","Gabriele Sicuro","Gabriele Sicuro and Piergiulio Tempesta and Antonio Rodr\'iguez and
  Constantino Tsallis","On the robustness of the $q$-Gaussian family",,"Annals of Physics, 363, p. 316-336 (2015)","10.1016/j.aop.2015.09.006",,"cond-mat.stat-mech math-ph math.MP","http://arxiv.org/licenses/nonexclusive-distrib/1.0/","  We introduce three deformations, called $\alpha$-, $\beta$- and
$\gamma$-deformation respectively, of a $N$-body probabilistic model, first
proposed by Rodr\'iguez et al. (2008), having $q$-Gaussians as $N\to\infty$
limiting probability distributions. The proposed $\alpha$- and
$\beta$-deformations are asymptotically scale-invariant, whereas the
$\gamma$-deformation is not. We prove that, for both $\alpha$- and
$\beta$-deformations, the resulting deformed triangles still have $q$-Gaussians
as limiting distributions, with a value of $q$ independent (dependent) on the
deformation parameter in the $\alpha$-case ($\beta$-case). In contrast, the
$\gamma$-case, where we have used the celebrated $Q$-numbers and the Gauss
binomial coefficients, yields other limiting probability distribution
functions, outside the $q$-Gaussian family. These results suggest that
scale-invariance might play an important role regarding the robustness of the
$q$-Gaussian family.
","[{""version"":""v1"",""created"":""Sat, 6 Jun 2015 11:37:52 GMT""},{""version"":""v2"",""created"":""Fri, 30 Oct 2015 20:46:50 GMT""}]","2015-11-03"
"1506.02137","Feng Qi","Feng Qi, Robin J. Chapman","Two closed forms for the Bernoulli polynomials","7 pages","Journal of Number Theory 159 (2016), 89--100","10.1016/j.jnt.2015.07.021",,"math.CO math.CA math.NT","http://arxiv.org/licenses/nonexclusive-distrib/1.0/","  In the paper, the authors find two closed forms involving the Stirling
numbers of the second kind and in terms of a determinant of combinatorial
numbers for the Bernoulli polynomials and numbers.
","[{""version"":""v1"",""created"":""Sat, 6 Jun 2015 11:41:48 GMT""},{""version"":""v2"",""created"":""Wed, 10 Jun 2015 12:52:47 GMT""}]","2015-09-15"
"1506.02138","Alan Cornell","Ammar Abdalgabar and Alan S. Cornell","Large trilinear $A_t$ soft supersymmetry breaking coupling from 5D MSSM","6 pages, 6 figures, to appear in the proceedings of the High Energy
  Particle Physics Workshop 2015 (iThemba Labs, Johannesburg, South Africa)",,"10.1088/1742-6596/645/1/012001","WITS-MITP-009","hep-ph","http://arxiv.org/licenses/nonexclusive-distrib/1.0/","  The possibility of generating a large trilinear $A_t$ soft supersymmetry
breaking coupling at low energies through renormalisation group evolution in
the 5D MSSM is investigated. Using the power law running in five dimensions and
a compactification scale in the 10-$10^3$ TeV range, to show that gluino mass
may drive a large enough $A_t$ to reproduce the measured Higgs mass and have a
light stop superpartner below $\sim 1$ TeV as preferred by the fine tuning
argument for the Higgs mass.
","[{""version"":""v1"",""created"":""Sat, 6 Jun 2015 12:22:55 GMT""}]","2015-10-28"
"1506.02139","Gonzalo Olmo","Gonzalo J. Olmo and D. Rubiera-Garcia","Non-Riemannian geometry: towards new avenues for the physics of modified
  gravity","6 pages. Proceedings of the conference ""Spanish Relativity Meeting -
  ERE2014"", held in Valencia (Spain)","J.Phys.Conf.Ser. 600 (2015) 1, 012041","10.1088/1742-6596/600/1/012041","IFIC/15-56","gr-qc","http://arxiv.org/licenses/nonexclusive-distrib/1.0/","  Less explored than their metric (Riemannian) counterparts, metric-affine (or
Palatini) theories bring an unexpected phenomenology for gravitational physics
beyond General Relativity. Lessons of crystalline structures, where the
presence of defects in their microstructure requires the use of non-Riemannian
geometry for the proper description of their properties in the macroscopic
continuum level, are discussed. In this analogy, concepts such as wormholes and
geons play a fundamental role. Applications of the metric-affine formalism
developed by the authors in the last three years are reviewed.
","[{""version"":""v1"",""created"":""Sat, 6 Jun 2015 12:24:25 GMT""}]","2015-07-31"
"1506.02140","Mihai Tomozeiu","Mihai Tomozeiu, Lucio Mayer and Thomas Quinn","The evolution of dwarf galaxy satellites with different dark matter
  density profiles in the ErisMod simulations. I. The early infalls",,,"10.3847/0004-637X/818/2/193",,"astro-ph.GA","http://arxiv.org/licenses/nonexclusive-distrib/1.0/","  We present the first simulations of tidal stirring of dwarf galaxies in the
Local Group carried out in a cosmological context. We use the ErisDARK
simulation of a MW-sized galaxy to identify some of the most massive subhalos
($M_{vir} > 10^8 M_{\odot}$) that fall into the main host before $z=2$.
Subhalos are replaced before infall with high-resolution models of dwarf
galaxies comprising a faint stellar disk embedded in a dark matter halo. The
set of models contains cuspy halos as well as halos with ""cored"" profiles (with
asymptotic inner slope $\gamma = 0.6$). The simulations are then run to $z=0$
with as many as 54 million particles and resolution as small as $\sim 4$ pc
using the N-Body code ChaNGa. The stellar components of all satellites are
significantly affected by tidal stirring, losing stellar mass and undergoing a
morphological transformation towards a pressure supported spheroidal system.
However, while some remnants with cuspy halos maintain significant rotational
flattening and disk-like features, all the shallow halo models achieve
$v/\sigma < 0.5$ and round shapes typical of dSph satellites of the MW and M31.
Mass loss is also enhanced in the latter, and remnants can reach luminosities
and velocity dispersions as low as those of Ultra Faint Dwarfs (UFDs). We argue
that cuspy progenitors must be the exception rather than the rule among
satellites of the MW since all the MW and M31 satellites in the luminosity
range of our remnants are dSphs, a result matched only in the simulation with
""cored"" models.
","[{""version"":""v1"",""created"":""Sat, 6 Jun 2015 12:26:00 GMT""}]","2016-03-09"
"1506.02141","Stanislav Patlazhan","Stanislav Patlazhan","Effect of slip boundary conditions on interfacial stability of two-layer
  viscous fluids under shear","28 pages, 12 figures",,,,"physics.flu-dyn","http://arxiv.org/licenses/nonexclusive-distrib/1.0/","  The traditional approach in the study of hydrodynamic stability of stratified
fluids includes the stick boundary conditions between layers. However, this
rule may be violated in polymer systems and as a consequence various
instabilities may arise. The main objective of this paper is to analyze
theoretically the influence of slip boundary conditions on the hydrodynamic
stability of the interface between two immiscible viscous layers subjected to
simple shear flow. It is found that the growth rate of long-wave disturbances
is fairly sensitive to the slip at the interface between layers as well as at
the external boundary. These phenomena are shown to give different
contributions to the stability of shear flow depending on viscosity, thickness,
and density ratios of the layers. Particularly, the interfacial slip can
increase the perturbation growth rate and lead to unstable flow. An important
consequence of this effect is the violation of stability for sheared layers
with equal viscosities and densities in a broad range of thickness ratios. The
conditions of long-wave propagation are analyzed as well, showing a strong
dependence on the type of boundary conditions.
","[{""version"":""v1"",""created"":""Sat, 6 Jun 2015 12:27:17 GMT""},{""version"":""v2"",""created"":""Tue, 9 Jun 2015 14:38:30 GMT""}]","2015-06-10"
