"1506.03261","Montserrat Casals-Ruiz","Montserrat Casals-Ruiz","Embeddability and universal theory of partially commutative groups","40 pages in International Mathematical Research Notices 2015",,"10.1093/imrn/rnv122",,"math.GR","http://arxiv.org/licenses/nonexclusive-distrib/1.0/","  The first part of the paper centers in the study of embeddability between
partially commutative groups. In [KK], for a finite simplicial graph $\Gamma$,
the authors introduce an infinite, locally infinite graph $\Gamma^e$, called
the extension graph of $\Gamma$. They show that each finite induced subgraph
$\Delta$ of $\Gamma^e$ gives rise to an embedding between the partially
commutative groups $G(\Delta)$ and $G({\Gamma})$. Furthermore, it is proven
that in many instances the converse also holds. Our first result is the
decidability of the Extension Graph Embedding Problem: there is an algorithm
that given two finite simplicial graphs {\Delta} and {\Gamma} decides whether
or not $\Delta$ is an induced subgraph of $\Gamma^e$. As a corollary we obtain
the decidability of the Embedding Problem for 2-dimensional partially
commutative groups. In the second part of the paper, we relate the Embedding
Problem between partially commutative groups to the model-theoretic question of
classification up to universal equivalence. We use our characterisation to
transfer algebraic and algorithmic results on embeddability to model-theoretic
ones and obtain some rigidity results on the elementary theory of atomic pc
groups as well as to deduce the existence of an algorithm to decide if an
arbitrary pc group is universally equivalent to a 2-dimensional one.
","[{""version"":""v1"",""created"":""Wed, 10 Jun 2015 11:37:44 GMT""}]","2015-06-11"
"1506.03262","Travis Gagie","Christina Boucher, Alexander Bowe, Travis Gagie, Giovanni Manzini and
  Jouni Sir\'en","Relative Select",,,,,"cs.DS","http://arxiv.org/licenses/nonexclusive-distrib/1.0/","  Motivated by the problem of storing coloured de Bruijn graphs, we show how,
if we can already support fast select queries on one string, then we can store
a little extra information and support fairly fast select queries on a similar
string.
","[{""version"":""v1"",""created"":""Wed, 10 Jun 2015 11:38:11 GMT""}]","2015-06-11"
"1506.03263","Jurgen Fuchs","Jens Fjelstad, J\""urgen Fuchs","Mapping class group representations from Drinfeld doubles of finite
  groups","68 pages, several figures. v2: 60 pages; removed a few examples and
  rearranged the presentation of the remaining examples",,,,"math.QA hep-th math-ph math.GT math.MP","http://arxiv.org/licenses/nonexclusive-distrib/1.0/","  We investigate representations of mapping class groups of surfaces that arise
from the untwisted Drinfeld double of a finite group G, focusing on surfaces
without marked points or with one marked point. We obtain concrete descriptions
of such representations in terms of finite group data. This allows us to
establish various properties of these representations. In particular we show
that they have finite images, and that for surfaces of genus at least 3 their
restriction to the Torelli group is non-trivial iff G is non-abelian.
","[{""version"":""v1"",""created"":""Wed, 10 Jun 2015 11:39:15 GMT""},{""version"":""v2"",""created"":""Mon, 11 May 2020 11:52:14 GMT""}]","2020-05-12"
"1506.03264","Giacomo Indiveri","Giacomo Indiveri and Shih-Chii Liu","Memory and information processing in neuromorphic systems","Submitted to Proceedings of IEEE, review of recently proposed
  neuromorphic computing platforms and systems","Proceedings of the IEEE, Vol 13, No. 8, (2015), pg. 1379 - 1397","10.1109/JPROC.2015.2444094",,"cs.NE","http://arxiv.org/licenses/nonexclusive-distrib/1.0/","  A striking difference between brain-inspired neuromorphic processors and
current von Neumann processors architectures is the way in which memory and
processing is organized. As Information and Communication Technologies continue
to address the need for increased computational power through the increase of
cores within a digital processor, neuromorphic engineers and scientists can
complement this need by building processor architectures where memory is
distributed with the processing. In this paper we present a survey of
brain-inspired processor architectures that support models of cortical networks
and deep neural networks. These architectures range from serial clocked
implementations of multi-neuron systems to massively parallel asynchronous ones
and from purely digital systems to mixed analog/digital systems which implement
more biological-like models of neurons and synapses together with a suite of
adaptation and learning mechanisms analogous to the ones found in biological
nervous systems. We describe the advantages of the different approaches being
pursued and present the challenges that need to be addressed for building
artificial neural processing systems that can display the richness of behaviors
seen in biological systems.
","[{""version"":""v1"",""created"":""Wed, 10 Jun 2015 11:42:28 GMT""}]","2017-11-08"
"1506.03265","Matteo Ceccarello","Matteo Ceccarello, Andrea Pietracaprina, Geppino Pucci and Eli Upfal","A Practical Parallel Algorithm for Diameter Approximation of Massive
  Weighted Graphs",,,,,"cs.DC","http://arxiv.org/licenses/nonexclusive-distrib/1.0/","  We present a space and time efficient practical parallel algorithm for
approximating the diameter of massive weighted undirected graphs on distributed
platforms supporting a MapReduce-like abstraction. The core of the algorithm is
a weighted graph decomposition strategy generating disjoint clusters of bounded
weighted radius. Theoretically, our algorithm uses linear space and yields a
polylogarithmic approximation guarantee; moreover, for important practical
classes of graphs, it runs in a number of rounds asymptotically smaller than
those required by the natural approximation provided by the state-of-the-art
$\Delta$-stepping SSSP algorithm, which is its only practical linear-space
competitor in the aforementioned computational scenario. We complement our
theoretical findings with an extensive experimental analysis on large benchmark
graphs, which demonstrates that our algorithm attains substantial improvements
on a number of key performance indicators with respect to the aforementioned
competitor, while featuring a similar approximation ratio (a small constant
less than 1.4, as opposed to the polylogarithmic theoretical bound).
","[{""version"":""v1"",""created"":""Wed, 10 Jun 2015 11:43:41 GMT""},{""version"":""v2"",""created"":""Tue, 14 Jul 2015 08:03:19 GMT""},{""version"":""v3"",""created"":""Mon, 9 Nov 2015 13:15:40 GMT""}]","2015-11-10"
"1506.03266","Michael Gabbay","Dov Gabbay, Michael Gabbay","The Attack as Strong Negation, Part I",,,,,"cs.LO","http://arxiv.org/licenses/nonexclusive-distrib/1.0/","  We add strong negation $N$ to classical logic and interpret the attack
relation of ""$x$ attacks $y$"" in argumentation as $(x\to Ny)$. We write a
corresponding object level (using $N$ only) classical theory for each
argumentation network and show that the classical models of this theory
correspond exactly to the complete extensions of the argumentation network. We
show by example how this approach simplifies the study of abstract
argumentation networks. We compare with other translations of abstract
argumentation networks into logic, such as classical predicate logic or modal
logics, or logic programming, and we also compare with Abstract Dialectical
Frameworks.
","[{""version"":""v1"",""created"":""Wed, 10 Jun 2015 11:44:53 GMT""}]","2015-06-11"
"1506.03267","Vladimir Georgescu","Vladimir Georgescu, Victor Nistor","On the Essential Spectrum of N-Body Hamiltonians with Asymptotically
  Homogeneous Interactions","33 pages. In version 2, the affiliation criteria have been improved
  and the introduction has been modified in a substantial way. In version 3, a
  table of contents has been added",,,,"math.SP math-ph math.AP math.FA math.MP math.OA","http://arxiv.org/licenses/nonexclusive-distrib/1.0/","  We determine the essential spectrum of Hamiltonians with N-body type
interactions that have radial limits at infinity. This extends the HVZ-theorem,
which treats perturbations of the Laplacian by potentials that tend to zero at
infinity. Our proof involves $C^*$-algebra techniques that allows one to treat
large classes of operators with local singularities and general behavior at
infinity. In our case, the configuration space of the system is a finite
dimensional, real vector space $X$, and we consider the $C^*$-algebra
$\mathcal{E}(X)$ of functions on $X$ generated by functions of the form
$v\circ\pi_Y$, where $Y$ runs over the set of all linear subspaces of $X$,
$\pi_Y$ is the projection of $X$ onto the quotient $X/Y$, and
$v:X/Y\to\mathbb{C}$ is a continuous function that has uniform radial limits at
infinity. The group $X$ acts by translations on $\mathcal{E}(X)$, and hence the
crossed product $\mathscr{E}(X) := \mathcal{E}(X)\rtimes X$ is well defined;
the Hamiltonians that are of interest to us are the self-adjoint operators
affiliated to it. We determine the characters of $\mathcal{E}(X)$. This then
allows us to describe the quotient of $\mathscr{E}(X)$ with respect to the
ideal of compact operators, which in turn gives a formula for the essential
spectrum of any self-adjoint operator affiliated to $\mathscr(X)$.
","[{""version"":""v1"",""created"":""Wed, 10 Jun 2015 11:53:59 GMT""},{""version"":""v2"",""created"":""Fri, 5 Aug 2016 14:18:40 GMT""},{""version"":""v3"",""created"":""Mon, 8 Aug 2016 13:04:32 GMT""}]","2016-08-09"
"1506.03268","Daniel Fiorilli","R\'egis de la Bret\`eche and Daniel Fiorilli","Entiers friables dans des progressions arithm\'etiques de grand module","29 pages, in French",,,,"math.NT","http://arxiv.org/licenses/nonexclusive-distrib/1.0/","  We study the average error term in the usual approximation to the number of
$y$-friable integers congruent to $a$ modulo $q$, where $a\neq 0$ is a fixed
integer. We show that in the range $\exp\{(\log\log x)^{5/3+\varepsilon}\} \leq
y \leq x$ and on average over $q\leq x/M$ with $M\rightarrow \infty$ of
moderate size, this average error term is asymptotic to $-|a|\Psi(x/|a|,y)/2x$.
Previous results of this sort were obtained by the second author for reasonably
dense sequences, however the sequence of $y$-friable integers studied in the
current paper is thin, and required the use of different techniques, which are
specific to friable integers.
","[{""version"":""v1"",""created"":""Wed, 10 Jun 2015 11:59:51 GMT""}]","2015-06-11"
"1506.03269","Roberto Venegeroles","Roberto Venegeroles","Exact invariant measures: How the strength of measure settles the
  intensity of chaos","8 pages, 2 figures (revised version)","Physical Review E 91, 062914 (2015)","10.1103/PhysRevE.91.062914",,"nlin.CD cond-mat.stat-mech math.DS","http://arxiv.org/licenses/nonexclusive-distrib/1.0/","  The aim of this paper is to show how extracting dynamical behavior and
ergodic properties from deterministic chaos with the assistance of exact
invariant measures. On the one hand, we provide an approach to deal with the
inverse problem of finding nonlinear interval maps from a given invariant
measure. Then, we show how to identify ergodic properties by means of
transitions along the phase space via exact measures. On the other hand, we
discuss quantitatively how infinite measures imply maps having subexponential
Lyapunov instability (weakly chaotic), as opposed to finite measure ergodic
maps, that are fully chaotic. In addition, we provide general solutions of maps
for which infinite invariant measures are exactly known throughout the interval
(a demand from this field). Finally, we give a simple proof that infinite
measure implies universal Mittag-Leffler statistics of observables, rather than
narrow distributions typically observed in finite measure ergodic maps.
","[{""version"":""v1"",""created"":""Wed, 10 Jun 2015 12:15:25 GMT""},{""version"":""v2"",""created"":""Tue, 23 Jun 2015 00:44:19 GMT""}]","2015-06-24"
"1506.03270","Jingzhi Tie","Shu-Cheng Chang, Ting-Jung Kuo, Chien Lin and Jingzhi Tie","CR Sub-Laplacian Comparison and Liouville-type Theorem in a Complete
  Noncompact Sasakian Manifold",,,,,"math.AP math.DG math.GT","http://arxiv.org/licenses/nonexclusive-distrib/1.0/","  In this paper, we first obtain the sub-Laplacian comparison theorem in a
complete noncompact pseudohermitian manifold of vanishing torsion (i.e.
Sasakian manifold). Secondly, we derive the sub-gradient estimate for positive
pseudoharmonic functions in a complete noncompact pseudohermitian manifold
which satisfies the CR sub-Laplacian comparison property. It is served as the
CR analog of Yau's gradient estimate. As a consequence, we have the natural CR
analogue of Liouville-type theorems in a complete noncompact Sasakian manifold
of nonnegative pseudohermitian Ricci curvature tensors.
","[{""version"":""v1"",""created"":""Wed, 10 Jun 2015 12:17:44 GMT""},{""version"":""v2"",""created"":""Wed, 31 Jan 2018 03:45:39 GMT""}]","2018-02-01"
"1506.03271","Gergely Neu","Gergely Neu","Explore no more: Improved high-probability regret bounds for
  non-stochastic bandits","To appear at NIPS 2015",,,,"cs.LG stat.ML","http://arxiv.org/licenses/nonexclusive-distrib/1.0/","  This work addresses the problem of regret minimization in non-stochastic
multi-armed bandit problems, focusing on performance guarantees that hold with
high probability. Such results are rather scarce in the literature since
proving them requires a large deal of technical effort and significant
modifications to the standard, more intuitive algorithms that come only with
guarantees that hold on expectation. One of these modifications is forcing the
learner to sample arms from the uniform distribution at least
$\Omega(\sqrt{T})$ times over $T$ rounds, which can adversely affect
performance if many of the arms are suboptimal. While it is widely conjectured
that this property is essential for proving high-probability regret bounds, we
show in this paper that it is possible to achieve such strong results without
this undesirable exploration component. Our result relies on a simple and
intuitive loss-estimation strategy called Implicit eXploration (IX) that allows
a remarkably clean analysis. To demonstrate the flexibility of our technique,
we derive several improved high-probability bounds for various extensions of
the standard multi-armed bandit framework. Finally, we conduct a simple
experiment that illustrates the robustness of our implicit exploration
technique.
","[{""version"":""v1"",""created"":""Wed, 10 Jun 2015 12:19:21 GMT""},{""version"":""v2"",""created"":""Thu, 16 Jul 2015 12:59:46 GMT""},{""version"":""v3"",""created"":""Tue, 3 Nov 2015 08:42:39 GMT""}]","2015-11-04"
"1506.03272","Daniel M. Dantchev","Galin Valchev and Daniel Dantchev","Critical and near critical phase behaviour and interplay between the
  thermodynamic Casimir and van der Waals forces in confined non-polar fluid
  medium with competing surface and substrate potentials","22 pages, 9 figures, 2 tables","Physical Review E 92,012119 (2015)","10.1103/PhysRevE.92.012119",,"cond-mat.stat-mech quant-ph","http://arxiv.org/licenses/nonexclusive-distrib/1.0/","  We study the behavior of the critical Casimir force and its interplay with
the van der Waals force acting between two parallel slabs separated at a
distance $L$ from each other confining a non-polar simple fluid or a binary
liquid mixture. The surfaces of the slabs are coated by thin layers exerting
strong preference to the liquid phase of the fluid, or one of the components of
the mixture. The slabs influence the fluid by long-range competing dispersion
potentials. Under such conditions one usually expects {\it attractive} Casimir
force governed by universal scaling function to which the dispersion potentials
provide only corrections to scaling. We demonstrate, however, that below a
given $L<L_{\rm crit}$ the competition between the effects due to the coatings
and the slabs can result in {\it sign change} of the Casimir force when one
changes the temperature $T$, the chemical potential of the fluid $\mu$, or $L$.
The last implies that by choosing specific materials for the slabs, coatings
and the fluid for $L \lesssim L_{\rm crit}$ one can realize {\it repulsive}
Casimir force with {\it non-universal} behavior which, upon increasing $L$,
gradually turns into an {\it attractive} one described by an {\it universal}
scaling function for $L\gg L_{\rm crit}$. We presented arguments and relevant
data for specific substances in support of the experimental feasibility of the
predicted behavior of the force.
","[{""version"":""v1"",""created"":""Wed, 10 Jun 2015 12:20:08 GMT""}]","2015-07-20"
"1506.03273","James Mitrani","James M. Mitrani","Time-resolved LII signals from aggregates of soot particles levitated in
  room temperature air","This paper has been withdrawn, because the results are incomplete,
  and were presented prematurely",,,,"physics.optics cond-mat.mtrl-sci","http://creativecommons.org/licenses/publicdomain/","  We observed and modeled time-resolved laser-induced incandescence (LII)
signals from soot aggregates. Time-resolved LII signals were observed from
research-grade soot particles, levitated in room temperature air. We were able
to measure sizes and structural properties of our soot particles ex situ, and
use those measurements as input parameters when modeling the observed LII
signals. We showed that at low laser fluences, aggregation significantly
influences LII signals by reducing conductive cooling to the ambient air. At
moderate laser fluences, laser-induced disintegration of aggregates occurs, so
the effects of aggregation on LII signals are negligible. These results can be
applied to extend LII for monitoring formation of soot and nanoparticle
aggregates.
","[{""version"":""v1"",""created"":""Wed, 10 Jun 2015 12:23:31 GMT""},{""version"":""v2"",""created"":""Mon, 21 Dec 2015 15:21:22 GMT""}]","2015-12-22"
"1506.03274","Jonathan Menu","J. Menu, R. van Boekel, Th. Henning, Ch. Leinert, C. Waelkens,
  L.B.F.M. Waters","The structure of disks around intermediate-mass young stars from
  mid-infrared interferometry. Evidence for a population of group II disks with
  gaps","24 pages, 11 figures, A&A in press","A&A 581, A107 (2015)","10.1051/0004-6361/201525654",,"astro-ph.SR","http://arxiv.org/licenses/nonexclusive-distrib/1.0/","  The disks around Herbig Ae/Be stars are commonly divided into group I and
group II based on their far-infrared spectral energy distribution, and the
common interpretation for that is flared and flat disks. Recent observations
suggest that many flaring disks have gaps, whereas flat disks are thought to be
gapless. The different groups of objects can be expected to have different
structural signatures in high-angular-resolution data. Over the past 10 years,
the MIDI instrument on the Very Large Telescope Interferometer has collected
observations of several tens of protoplanetary disks. We model the large set of
observations with simple geometric models. A population of radiative-transfer
models is synthesized for interpreting the mid-infrared signatures. Objects
with similar luminosities show very different disk sizes in the mid-infrared.
Restricting to the young objects of intermediate mass, we confirm that most
group I disks are in agreement with being transitional. We find that several
group II objects have mid-infrared sizes and colors overlapping with sources
classified as group I, transition disks. This suggests that these sources have
gaps, which has been demonstrated for a subset of them. This may point to an
intermediate population between gapless and transition disks. Flat disks with
gaps are most likely descendants of flat disks without gaps. Gaps, potentially
related to the formation of massive bodies, may therefore even develop in disks
in a far stage of grain growth and settling. The evolutionary implications of
this new population could be twofold. Either gapped flat disks form a separate
population of evolved disks, or some of them may further evolve into flaring
disks with large gaps. The latter transformation may be governed by the
interaction with a massive planet, carving a large gap and dynamically exciting
the grain population in the disk.
","[{""version"":""v1"",""created"":""Wed, 10 Jun 2015 12:26:17 GMT""},{""version"":""v2"",""created"":""Sat, 12 Sep 2015 14:09:47 GMT""}]","2015-09-16"
"1506.03275","Pascal Viot","Julien-Piera Vest, Gilles Tarjus and Pascal Viot","Mode-coupling approach for the slow dynamics of a liquid on a spherical
  substrate","10 pages, 7 figures",,"10.1063/1.4928513",,"cond-mat.soft","http://arxiv.org/licenses/nonexclusive-distrib/1.0/","  We study the dynamics of a one-component liquid constrained on a spherical
substrate, a 2-sphere, and investigate how the mode-coupling theory (MCT) can
describe the new features brought by the presence of curvature. To this end we
have derived the MCT equations in a spherical geometry. We find that, as seen
from the MCT, the slow dynamics of liquids in curved space at low temperature
does not qualitatively differ from that of glass-forming liquids in Euclidean
space. The MCT predicts the right trend for the evolution of the relaxation
slowdown with curvature but is dramatically off at a quantitative level.
","[{""version"":""v1"",""created"":""Wed, 10 Jun 2015 12:34:22 GMT""}]","2015-09-30"
"1506.03276","Anton Menshov","Vitali\u{i} Roman'kov, Anton Menshov","$p$-solvability of regular equations over unitriangular groups over
  prime finite fields","10 pages",,,,"math.GR","http://arxiv.org/licenses/nonexclusive-distrib/1.0/","  An equation over a group with one unknown is called regular if the exponent
sum of the unknown is nonzero. In this paper we prove that some regular
equations of exponent $rp^s$, where $r \in \mathbb{Z}$, $s \in \mathbb{N}$,
$\gcd(r,p)=1$, over the group UT$_n(\mathbb{F}_p)$ ($n \geq 2$) are solvable in
an overgroup isomorphic to UT$_{(n-1)p^s + 1}(\mathbb{F}_p)$. Applying this for
$n=3$ we prove that any regular equation of exponent $rp^s$ over the Heisenberg
$p$-group UT$_3(\mathbb{F}_p)$ is solvable in an overgroup isomorphic to
UT$_{2p^s + 1}(\mathbb{F}_p)$. The proofs of these results are constructive and
allow to obtain solutions of equations in explicit form.
","[{""version"":""v1"",""created"":""Wed, 10 Jun 2015 12:34:47 GMT""}]","2015-06-11"
"1506.03277","Nathaniel Baker","Nathaniel T. Baker and Alban Poth\'erat and Laurent Davoust","Dimensionality, secondary flows and helicity in low-Rm MHD vortices",,,"10.1017/jfm.2015.420",,"physics.flu-dyn","http://arxiv.org/licenses/nonexclusive-distrib/1.0/","  In this paper, we examine the dimensionality of a single electrically driven
vortex bounded by two no-slip and perfectly insulating horizontal walls distant
by $h$. The study was performed in the weakly inertial limit by means of an
asymptotic expansion, which is valid for any Hartmann number. We show that the
dimensionality of the leading order can be fully described using the single
parameter $l_z^\nu / h$, where $l_z^\nu$ represents the distance over which the
Lorentz force is able to act before being balanced by viscous dissipation. The
base flow happens to introduce inertial recirculations in the meridional plane
at the first order, which are shown to follow two radically different
mechanisms: inverse Ekman pumping driven by a vertical pressure gradient along
the axis of the vortex, or direct Ekman pumping driven by a radial pressure
gradient in the Hartman boundary layers. We demonstrate that when the base flow
is quasi-2D, the relative importance of direct and inverse pumping is solely
determined by the aspect ratio $\eta / h$, where $\eta$ refers to the width of
the vortex. Of both mechanisms, only inverse pumping appears to act as a
significant source of helicity.
","[{""version"":""v1"",""created"":""Wed, 10 Jun 2015 12:35:36 GMT""},{""version"":""v2"",""created"":""Fri, 30 Jun 2017 08:37:31 GMT""}]","2017-07-03"
"1506.03278","Olivier Minazzoli","Hendrik Ludwig, Olivier Minazzoli, Salvatore Capozziello","Merging matter and geometry in the same Lagrangian",,"Physics Letters B, Volume 751, 17 December 2015, Pages 576-578","10.1016/j.physletb.2015.11.023",,"gr-qc","http://arxiv.org/licenses/nonexclusive-distrib/1.0/","  We show that a Lagrangian density proportional to $\sqrt{-g} \L_m^2/R$
reduces to a pressuron theory of gravity that is indistinguishable from General
Relativity in the dust limit. The combination of matter and geometry in the
same Lagrangian density intrinsically satisfies Mach's Principle --- since
matter cannot exist without curvature and vice versa --- while it may have the
correct phenomenology in order to describe actual gravity.
","[{""version"":""v1"",""created"":""Wed, 10 Jun 2015 12:36:11 GMT""},{""version"":""v2"",""created"":""Mon, 19 Oct 2015 15:27:27 GMT""}]","2015-11-24"
