"1506.03085","Pieter van Dokkum","Pieter G. van Dokkum, Erica June Nelson, Marijn Franx, Pascal Oesch,
  Ivelina Momcheva, Gabriel Brammer, Natascha M. Forster Schreiber, Rosalind E.
  Skelton, Katherine E. Whitaker, Arjen van der Wel, Rachel Bezanson, Mattia
  Fumagalli, Garth D. Illingworth, Mariska Kriek, Joel Leja, Stijn Wuyts","Forming Compact Massive Galaxies","Accepted for publication in ApJ. Figure 18 summarizes the kinematics
  part of the paper. Figure 22 demonstrates how star forming galaxies grow in
  size and mass (in observations and simulations), and Figure 28 is a cartoon
  version of a model that describes the evolution of star forming and quiescent
  galaxies since z~3",,"10.1088/0004-637X/813/1/23",,"astro-ph.GA astro-ph.CO astro-ph.SR","http://arxiv.org/licenses/nonexclusive-distrib/1.0/","  In this paper we study a key phase in the formation of massive galaxies: the
transition of star forming galaxies into massive (M_stars~10^11 Msun), compact
(r_e~1 kpc) quiescent galaxies, which takes place from z~3 to z~1.5. We use HST
grism redshifts and extensive photometry in all five 3D-HST/CANDELS fields,
more than doubling the area used previously for such studies, and combine these
data with Keck MOSFIRE and NIRSPEC spectroscopy. We first confirm that a
population of massive, compact, star forming galaxies exists at z~2, using
K-band spectroscopy of 25 of these objects at 2.0<z<2.5. They have a median
NII/Halpha ratio of 0.6, are highly obscured with SFR(tot)/SFR(Halpha)~10, and
have a large range of observed line widths. We infer from the kinematics and
spatial distribution of Halpha that the galaxies have rotating disks of ionized
gas that are a factor of ~2 more extended than the stellar distribution. By
combining measurements of individual galaxies, we find that the kinematics are
consistent with a nearly Keplerian fall-off from V_rot~500 km/s at 1 kpc to
V_rot~250 km/s at 7 kpc, and that the total mass out to this radius is
dominated by the dense stellar component. Next, we study the size and mass
evolution of the progenitors of compact massive galaxies. Even though
individual galaxies may have had complex histories with periods of compaction
and mergers, we show that the population of progenitors likely followed a
simple inside-out growth track in the size-mass plane of d(log r_e) ~ 0.3 d(log
M_stars). This mode of growth gradually increases the stellar mass within a
fixed physical radius, and galaxies quench when they reach a stellar density or
velocity dispersion threshold. As shown in other studies, the mode of growth
changes after quenching, as dry mergers take the galaxies on a relatively steep
track in the size-mass plane.
","[{""version"":""v1"",""created"":""Tue, 9 Jun 2015 20:01:24 GMT""},{""version"":""v2"",""created"":""Fri, 7 Aug 2015 18:49:22 GMT""},{""version"":""v3"",""created"":""Wed, 9 Sep 2015 21:48:39 GMT""},{""version"":""v4"",""created"":""Sun, 20 Sep 2015 00:05:59 GMT""}]","2015-10-28"
"1506.03086","Phillip Dukes","Phillip Dukes","Continuous-time quantum walks over connected graphs, amplitudes and
  invariants","Second draft, comments welcomed. 10 pages, 6 figures",,,,"quant-ph","http://arxiv.org/licenses/nonexclusive-distrib/1.0/","  We examine the time dependent amplitude $ \phi_{j}\left( t\right)$ at each
vertex $j$ of a continuous-time quantum walk on the cycle $C_{n}$. In many
cases the Lissajous curve of the real vs. imaginary parts of each $
\phi_{j}\left( t\right)$ reveals interesting shapes of the space of
time-accessible amplitudes. We find two invariants of continuous-time quantum
walks. First, considering the rate at which each amplitude evolves in time we
find the quantity $T = \displaystyle\sum_{j=0}^{n-1} \lvert\dfrac{d
\phi_{j}\left( t\right)}{d t}\rvert^{2}$ is time invariant. The value of $T$
for any initial state can be minimized with respect to a global phase factor
$e^{i \theta t}$ to some value $T_{min}$. An operator for $T_{min}$ is defined.
For any simply connected graph $g$ the highest possible value of $T_{min}$ with
respect to the initial state is found to be $T_{min}^{max}=\left(
\frac{\lambda_{max}}{2}\right)^{2}$ where $\lambda_{max}$ is the maximum
eigenvalue in the Laplace spectrum of $g$. A second invariant is found in the
time-dependent probability distribution $P_{j}\left(t\right) =
\lvert\phi_{j}\left(t\right)\rvert^{2}$ of any initial state satisfying
$T_{min}^{max}$, with these conditions
$\displaystyle\sum_{j=0}^{n-1}\left(P_{j}^{max} - P_{j}^{min}\right)^{2} =
\dfrac{4}{n}$ for all simply connected graphs of $n$ vertices.
","[{""version"":""v1"",""created"":""Tue, 9 Jun 2015 20:01:34 GMT""},{""version"":""v2"",""created"":""Mon, 2 Nov 2015 18:28:09 GMT""}]","2015-11-03"
"1506.03087","Donald C. Ellison","Donald C. Warren, Donald C. Ellison, Andrei M. Bykov and Shiu-Hang Lee","Electron and Ion Acceleration in Relativistic Shocks with Applications
  to GRB Afterglows","Accepted for publication in MNRAS",,"10.1093/mnras/stv1304",,"astro-ph.HE","http://arxiv.org/licenses/nonexclusive-distrib/1.0/","  We have modeled the simultaneous first-order Fermi shock acceleration of
protons, electrons, and helium nuclei by relativistic shocks. By parameterizing
the particle diffusion, our steady-state Monte Carlo simulation allows us to
follow particles from particle injection at nonthermal thermal energies to
above PeV energies, including the nonlinear smoothing of the shock structure
due to cosmic-ray (CR) backpressure. We observe the mass-to-charge (A/Z)
enhancement effect believed to occur in efficient Fermi acceleration in
non-relativistic shocks and we parameterize the transfer of ion energy to
electrons seen in particle-in-cell (PIC) simulations. For a given set of
environmental and model parameters, the Monte Carlo simulation determines the
absolute normalization of the particle distributions and the resulting
synchrotron, inverse-Compton, and pion-decay emission in a largely
self-consistent manner. The simulation is flexible and can be readily used with
a wide range of parameters typical of gamma-ray burst (GRB) afterglows. We
describe some preliminary results for photon emission from shocks of different
Lorentz factors and outline how the Monte Carlo simulation can be generalized
and coupled to hydrodynamic simulations of GRB blast waves. We assume Bohm
diffusion for simplicity but emphasize that the nonlinear effects we describe
stem mainly from an extended shock precursor where higher energy particles
diffuse further upstream. Quantitative differences will occur with different
diffusion models, particularly for the maximum CR energy and photon emission,
but these nonlinear effects should be qualitatively similar as long as the
scattering mean free path is an increasing function of momentum.
","[{""version"":""v1"",""created"":""Tue, 9 Jun 2015 20:01:43 GMT""}]","2015-07-15"
"1506.03088","Elena Massara","Elena Massara, Francisco Villaescusa-Navarro, Matteo Viel, P. M.
  Sutter","Voids in massive neutrino cosmologies","31 pages, 14 figures","JCAP11(2015)018","10.1088/1475-7516/2015/11/018",,"astro-ph.CO","http://arxiv.org/licenses/nonexclusive-distrib/1.0/","  Cosmic voids are a promising environment to characterize neutrino-induced
effects on the large-scale distribution of matter in the universe. We perform a
comprehensive numerical study of the statistical properties of voids,
identified both in the matter and galaxy distributions, in massive and massless
neutrino cosmologies. The matter density field is obtained by running several
independent $N$-body simulations with cold dark matter and neutrino particles,
while the galaxy catalogs are modeled by populating the dark matter halos in
simulations via a halo occupation distribution (HOD) model to reproduce the
clustering properties observed by the Sloan Digital Sky Survey (SDSS) II Data
Release 7. We focus on the impact of massive neutrinos on the following void
statistical properties: number density, ellipticities, two-point statistics,
density and velocity profiles. Considering the matter density field, we find
that voids in massive neutrino cosmologies are less evolved than those in the
corresponding massless neutrinos case: there is a larger number of small voids
and a smaller number of large ones, their profiles are less evacuated, and they
present a lower wall at the edge. Moreover, the degeneracy between $\sigma_8$
and $\Omega_{\nu}$ is broken when looking at void properties. In terms of the
galaxy density field, we find that differences among cosmologies are difficult
to detect because of the small number of galaxy voids in the simulations.
Differences are instead present when looking at the matter density and velocity
profiles around these voids.
","[{""version"":""v1"",""created"":""Tue, 9 Jun 2015 20:02:04 GMT""},{""version"":""v2"",""created"":""Thu, 12 Nov 2015 15:44:35 GMT""}]","2015-11-18"
"1506.03089","In Sung  Jang","In Sung Jang and Myung Gyoon Lee","The Tip of the Red Giant Branch Distances to Type Ia Supernova Host
  Galaxies. III. NGC 4038/39 and NGC 5584","12 pages, 9 figures, 6 tables, accepted for publication in ApJ",,"10.1088/0004-637X/807/2/133",,"astro-ph.GA","http://arxiv.org/licenses/nonexclusive-distrib/1.0/","  We present the tip of the red giant branch (TRGB) distances to Type Ia
supernova (SNe Ia) host galaxies NGC 4038/39 and NGC 5584. Based on the deep
images constructed using archival Hubble Space Telescope data, we detect red
giant branch stars in each galaxy. VI photometry of the resolved stars and
corresponding I-band luminosity functions show the TRGB to be at I_{TRGB} =
27.67 \pm 0.05 for NGC 4038/39 and I_{TRGB} = 27.77 \pm 0.04 for NGC 5584. From
these estimates, we determine the distance modulus to NGC 4038/39 to be (m-M)_0
= 31.67 \pm 0.05 (random) \pm 0.12 (systematic) (corresponding to a linear
distance of 21.58 \pm 0.50 \pm 1.19 Mpc) and the distance modulus to NGC 5584
to be (m-M)_0 = 31.76 \pm 0.04 (random) \pm 0.12 (systematic) (corresponding to
a linear distance of 22.49 \pm 0.41 \pm 1.24 Mpc). We derive a mean absolute
maximum magnitude of SNe Ia of M_V = -19.29 \pm 0.08 from the distance
estimates of five SNe Ia (including two SNe in this study and three SNe Ia from
our previous studies), and we derive a value of M_V = -19.19 \pm 0.10 using
three low-reddened SNe Ia among the five SNe Ia. With these estimates, we
derive a value of the Hubble constant, H_0 = 69.8 \pm 2.6 (random) \pm 3.9
(systematic) km/s/Mpc and 72.2 \pm 3.3 (random) \pm 4.0 (systematic) km/s/Mpc,
respectively. The value from the five SNe is similar to those from the cosmic
microwave background analysis, and not much different within errors, from those
of recent Cepheid calibrations of SNe Ia. The value from the three SNe is
between the values from the two methods.
","[{""version"":""v1"",""created"":""Tue, 9 Jun 2015 20:02:15 GMT""}]","2015-07-15"
"1506.03090","Ben Heidenreich","I\~naki Garc\'ia-Etxebarria and Ben Heidenreich","Strongly coupled phases of $\mathcal{N}=1$ S-duality","66 pages, 34 figures",,,"MPP-2015-122","hep-th","http://arxiv.org/licenses/nonexclusive-distrib/1.0/","  We analyze S-duality of orientifolds of the Calabi-Yau cone over the first
del Pezzo surface ($dP_1$). The S-duals of known phases, described by quiver
gauge theories, contain intrinsically strongly-coupled sectors. These sectors
are realized by a higher multiplicity intersection of NS5 branes and D5 branes
atop an O5 plane, and can be thought of as stuck at the infinite coupling point
between two Seiberg-dual gauge theories. We argue that such sectors appear
generically in orientifolds of non-orbifold singularities, where in many
examples every orientifold phase contains such a sector. Understanding such
sectors is therefore key to understanding orientifolds of Calabi-Yau
singularities. We construct the strongly-coupled sectors for $dP_1$
orientifolds using deconfinement, and show that they have interesting,
non-trivial properties. Using this construction, we verify the predictions of
S-duality for $dP_1$.
","[{""version"":""v1"",""created"":""Tue, 9 Jun 2015 20:02:23 GMT""}]","2015-06-11"
"1506.03091","Philip Bechtle","Philip Bechtle, Tilman Plehn, Christian Sander","The Status of Supersymmetry after the LHC Run 1","34 Pages, 21 Figures. Originally published in ""The Large Hadron
  Collider -- Harvest of Run 1"", edited by T. Sch\""orner-Sadenius, Springer,
  2015, (pp. 421-462), 532 Pages, 253 Figures, ISBN 978-3-319-15000-0, eBook
  ISBN 978-3-319-15001-7. For more details see
  http://www.springer.com/de/book/9783319150000",,,,"hep-ex hep-ph","http://arxiv.org/licenses/nonexclusive-distrib/1.0/","  Supersymmetry (SUSY) is a complete and renormalisable candidate for an
extension of the Standard Model. At an energy scale not too far above the
electroweak scale it would solve the hierarchy problem of the SM Higgs boson,
dynamically explain electroweak symmetry breaking, and provide a dark-matter
candidate. Since it doubles the Standard Model degrees of freedom, SUSY
predicts a large number of additional particles, whose properties and effects
on precision measurements can be explicitly predicted in a given SUSY model. In
this review the motivation for SUSY is outlined, the various searches
strategies for SUSY particles at the LHC are described, and the status of SUSY
in global analyses after the LHC Run 1 is summarized.
","[{""version"":""v1"",""created"":""Tue, 9 Jun 2015 20:02:27 GMT""}]","2015-06-11"
"1506.03092","Breanna Binder","Breanna Binder, Jacob Gross, Benjamin F. Williams, Daniel Simons","Energy-Dependent Orbital Phases in NGC 300 X-1","Accepted to MNRAS; 12 pages, 10 figures",,,,"astro-ph.HE","http://arxiv.org/licenses/nonexclusive-distrib/1.0/","  NGC~300 X-1 is a Wolf Rayet + black hole binary that exhibits periodic
decreases in X-ray flux. We present two new observations of NGC~300 X-1 from
the Chandra X-ray Observatory (totaling $\sim$130 ks) along with ACS imaging
data from the Hubble Space Telescope. We observe significant short-term
variability in the X-ray emission that is inconsistent with an occultation by
the donor star, but is consistent with structure in the outer accretion disk or
the wind of the donor star. We simultaneously fit a partially-covered disk
blackbody and Comptonized corona model to the eclipse egress and non-eclipsing
portions of the X-ray spectrum. We find that the only model parameters that
varied between the eclipse egress and non-eclipsing portions of the spectra
were the partial covering fraction ($\sim$86% during eclipse egress and
$\sim$44% during non-eclipse) and absorbing column ($\sim$12.3$\times10^{22}$
cm$^{-2}$ during eclipse egress, compared to $\sim$1.4$\times10^{22}$ cm$^{-2}$
during non-eclipse). The X-ray spectra are consistent with the movement of the
X-ray source through the dense stellar winds of the companion star. From our
new HST imaging, we find the WR star within the X-ray error circle, along with
additional optical sources including an AGB star and an early-type main
sequence star. Finally, we use our egress measurement to rephase previous
radial velocity measurements reported in the literature, and find evidence that
the velocities are strongly affected by the ionization of the wind by the
compact object. Thus, we argue the inferred mass of the black hole may not be
reliable.
","[{""version"":""v1"",""created"":""Tue, 9 Jun 2015 20:02:32 GMT""}]","2015-06-11"
"1506.03093","Carlos Paez","C. J. P\'aez, D. A. Bahamon, Ana L. C. Pereira and P. A. Schulz","Resonant tunneling through protected quantum dots at phosphorene edges","8 pages,7 figures","Beilstein J. Nanotechnol. 2016, 7, 1983-1990","10.3762/bjnano.7.189",,"cond-mat.mes-hall","http://arxiv.org/licenses/nonexclusive-distrib/1.0/","  We theoretically investigate phosphorene zigzag nanorribons as a platform for
constriction engineering. In the presence of a constriction at the upper edge,
quantum confinement of edge protected states reveals resonant tunnelling
Breit-Wigner transmission peaks, if the upper edge is uncoupled to the lower
edge. Coupling between edges in thin constrictions gives rise to Fano-like and
anti-resonances in the transmission spectrum of the system.
","[{""version"":""v1"",""created"":""Tue, 9 Jun 2015 20:02:43 GMT""},{""version"":""v2"",""created"":""Mon, 18 Jul 2016 18:44:35 GMT""}]","2016-12-14"
"1506.03094","Alexander Kirillov","K. M. Belotsky, E. A. Esipova, A. A. Kirillov","On the classical description of the recombination of dark matter
  particles with a Coulomb-like interaction","11 pages, 4 figures. V3 has tiny corrections, matches published
  version","Physics Letters B 761 (2016) 81-86","10.1016/j.physletb.2016.08.009",,"astro-ph.CO","http://arxiv.org/licenses/nonexclusive-distrib/1.0/","  Cold dark matter (DM) scenario may be cured of several problems by involving
self-interaction of dark matter. Viability of the models of long-range
interacting DM crucially depends on the effectiveness of recombination of the
DM particles, making thereby their interaction short-range. Usually in numeric
calculations, recombination is described by cross section obtained on a
feasible quantum level. However in a wide range of parameter values, a
classical treatment, where the particles are bound due to dipole radiation, is
applicable. The cross sections, obtained in both approaches, are very different
and lead to diverse consequences. Classical cross section has a steeper
dependence on relative velocity, what leads to the fact that, after decoupling
of DM particles from thermal background of ""dark photons"" (carriers of DM
long-range interaction), recombination process does not ""freeze out"",
diminishing gradually density of unbound DM particles. Our simplified estimates
show, that at the taken parameter values (the mass of DM particle is $100$ GeV,
interaction constant is $100^{-1}$, and quite natural assumptions on initial
conditions, from which the result is very weakly dependent) the difference in
residual density reaches about $5$ orders of magnitude on pre-galactic stage.
This estimate takes into account thermal effects induced by dipole radiation
and recombination, which resulted in the increase of both temperature and
density of DM particles by a half order of magnitude.
","[{""version"":""v1"",""created"":""Tue, 9 Jun 2015 20:02:50 GMT""},{""version"":""v2"",""created"":""Mon, 28 Mar 2016 09:20:42 GMT""},{""version"":""v3"",""created"":""Mon, 5 Sep 2016 09:48:56 GMT""}]","2016-09-06"
"1506.03096","Stefano Carniani","S. Carniani, A. Marconi, R. Maiolino, B. Balmaverde, M. Brusa, M.
  Cano-D\'iaz, C. Cicone, A. Comastri, G. Cresci, F. Fiore, C. Feruglio, F. La
  Franca, V. Mainieri, F. Mannucci, T. Nagao, H. Netzer, E. Piconcelli, G.
  Risaliti, R. Schneider, O. Shemmer","Ionised outflows in z $\sim$ 2.4 quasar host galaxies","13 pages, 11 figures; accepted for publication in A&A","A&A 580, A102 (2015)","10.1051/0004-6361/201526557",,"astro-ph.GA","http://arxiv.org/licenses/nonexclusive-distrib/1.0/","  AGN-driven outflows are invoked by galaxy evolutionary models to quench star
formation and to explain the origin of the relations observed locally between
super massive black holes and their host galaxies. This work aims to detect the
presence of extended ionised outflows in luminous quasars where we expect the
maximum activity both in star formation and in black hole accretion. Currently,
there are only a few studies based on spatially resolved observations of
outflows at high redshift, $z>2$. We analyse a sample of six luminous (${\rm
L>10^{47} \ erg/s}$) quasars at $z\sim2.4$, observed in H-band using the
near-IR integral field spectrometer SINFONI at VLT. We perform a kinematic
analysis of the [OIII] emission line at $\lambda = 5007\AA$. [OIII] has a
complex gas kinematic, with blue-shifted velocities of a few hundreds of km/s
and line widths up to 1500 km/s. Using the spectroastrometric method we infer
size of the ionised outflows of up to $\sim$2 kpc. The properties of the
ionised outflows, mass outflow rate, momentum rate and kinetic power, are
correlated with the AGN luminosity. The increase in outflow rate with
increasing AGN luminosity is consistent with the idea that a luminous AGN
pushes away the surrounding gas through fast outflows driven by radiation
pressure, which depends on the emitted luminosity. We derive mass outflow rates
of about 6-700 M$_{\odot}$/yr for our sample, which are lower than those
observed in molecular outflows. Indeed physical properties of ionised outflows
show dependences on AGN luminosity which are similar to those of molecular
outflows but indicating that the mass of ionised gas is smaller than that of
the molecular one. Alternatively, this discrepancy between ionised and
molecular outflows could be explained with different acceleration mechanisms.
","[{""version"":""v1"",""created"":""Tue, 9 Jun 2015 20:10:08 GMT""}]","2015-08-12"
"1506.03097","Gaspar A. Bakos","M. Zhang (1), G. \'A. Bakos (1,2,3), K. Penev (1), Z. Csubry (1), J.
  D. Hartman (1), W. Bhatti (1), M. de Val-Borro (1), ((1) Princeton
  University)","Precision multi-band photometry with a DSLR camera","15 pages, 15 figures, submitted to PASP",,"10.1088/1538-3873/128/961/035001",,"astro-ph.IM astro-ph.EP","http://arxiv.org/licenses/nonexclusive-distrib/1.0/","  Ground-based exoplanet surveys such as SuperWASP, HATNet and KELT have
discovered close to two hundred transiting extrasolar planets in the past
several years. The strategy of these surveys is to look at a large field of
view and measure the brightnesses of its bright stars to around half a percent
per point precision, which is adequate for detecting hot Jupiters. Typically,
these surveys use CCD detectors to achieve high precision photometry. These
CCDs, however, are expensive relative to other consumer-grade optical imaging
devices, such as digital single-lens reflex cameras (DSLRs). We look at the
possibility of using a digital single-lens reflex camera for precision
photometry. Specifically, we used a Canon EOS 60D camera that records light in
3 colors simultaneously. The DSLR was integrated into the HATNet survey and
collected observations for a month, after which photometry was extracted for
6600 stars in a selected stellar field. We found that the DSLR achieves a
best-case median absolute deviation (MAD) of 4.6 mmag per 180 s exposure when
the DSLR color channels are combined, and 1000 stars are measured to better
than 10 mmag (1%). Also, we achieve 10\,mmag or better photometry in the
individual colors. This is good enough to detect transiting hot Jupiters. We
performed a candidate search on all stars and found four candidates, one of
which is KELT-3b, the only known transiting hot Jupiter in our selected field.
We conclude that the Canon 60D is a cheap, lightweight device capable of useful
photometry in multiple colors.
","[{""version"":""v1"",""created"":""Tue, 9 Jun 2015 20:11:54 GMT""}]","2016-03-23"
"1506.03098","Shriharsh P. Tendulkar","Shriharsh P. Tendulkar (1), Romain Hasc\""oet (2), Chengwei Yang (3 and
  4), Victoria M. Kaspi (4), Andrei M. Beloborodov (2), Hongjun An (5), Matteo
  Bachetti (6), Steven E. Boggs (7), Finn E. Christensen (8), William W. Craig
  (8 and 9), Sebastien Guillot (4 and 10), Charles A. Hailey (2), Fiona A.
  Harrison (1), Daniel Stern (11), William Zhang (12) ((1) CalTech, (2)
  Columbia University, (3) Beijing Institute of Technology, (4) McGill
  University, (5) KIPAC, Stanford, (6) INAF Cagliari, (7) SSL, UC Berkeley, (8)
  DTU Space, (9) LLNL, (10) PUC Chile, (11) NASA JPL, (12) NASA GSFC)","Phase-resolved NuSTAR and Swift-XRT Observations of Magnetar 4U 0142+61","14 pages, 8 figures, 4 tables. Accepted for publication in ApJ",,"10.1088/0004-637X/808/1/32",,"astro-ph.HE","http://arxiv.org/licenses/nonexclusive-distrib/1.0/","  We present temporal and spectral analysis of simultaneous 0.5-79 keV
Swift-XRT and NuSTAR observations of the magnetar 4U 0142+61. The pulse profile
changes significantly with photon energy between 3 and 35 keV. The pulse
fraction increases with energy, reaching a value of ~20%, similar to that
observed in 1E 1841-045 and much lower than the ~80% pulse fraction observed in
1E 2259+586. We do not detect the 55-ks phase modulation reported in previous
Suzaku-HXD observations. The phase-averaged spectrum of 4U 0142+61 above 20 keV
is dominated by a hard power law with a photon index, $\Gamma$ ~ 0.65, and the
spectrum below 20 keV can be described by two blackbodies, a blackbody plus a
soft power law, or by a Comptonized blackbody model. We study the full
phase-resolved spectra using the electron-positron outflow model of Beloborodov
(2013). Our results are consistent with the parameters of the active j-bundle
derived from INTEGRAL data by Hascoet et al. (2014). We find that a significant
degeneracy appears in the inferred parameters if the footprint of the j-bundle
is allowed to be a thin ring instead of a polar cap. The degeneracy is reduced
when the footprint is required to be the hot spot inferred from the soft X-ray
data.
","[{""version"":""v1"",""created"":""Tue, 9 Jun 2015 20:32:57 GMT""}]","2015-08-06"
