"1506.03167","David Witmer","Guy Kindler, Ryan O'Donnell, David Witmer","Remarks on the Most Informative Function Conjecture at fixed mean",,,,,"cs.IT cs.CC math.IT","http://arxiv.org/licenses/nonexclusive-distrib/1.0/","  In 2013, Courtade and Kumar posed the following problem: Let $\boldsymbol{x}
\sim \{\pm 1\}^n$ be uniformly random, and form $\boldsymbol{y} \sim \{\pm
1\}^n$ by negating each bit of $\boldsymbol{x}$ independently with probability
$\alpha$. Is it true that the mutual information $I(f(\boldsymbol{x})
\mathbin{;} \boldsymbol{y})$ is maximized among $f:\{\pm 1\}^n \to \{\pm 1\}$
by $f(x) = x_1$? We do not resolve this problem. Instead, we make a couple of
observations about the fixed-mean version of the conjecture. We show that
Courtade and Kumar's stronger Lex Conjecture fails for small noise rates. We
also prove a continuous version of the conjecture on the sphere and show that
it implies the previously-known analogue for Gaussian space.
","[{""version"":""v1"",""created"":""Wed, 10 Jun 2015 05:09:58 GMT""},{""version"":""v2"",""created"":""Tue, 30 Jun 2015 22:19:38 GMT""},{""version"":""v3"",""created"":""Mon, 25 Jan 2016 16:30:11 GMT""}]","2016-01-26"
"1506.03168","Harleen Dahiya Dr.","Narinder Kumar and Harleen Dahiya","Chiral Odd Generalized Parton Distributions and Spin Densities in the
  Impact Parameter Space","20 Pages, 12 figures. To appear in Phys. Rev. D","Phys. Rev. D 91, 114031 (2015)",,,"hep-ph","http://arxiv.org/licenses/nonexclusive-distrib/1.0/","  In the present work we have studied the chiral odd Generalized Parton
Distributions (GPDs) in the impact parameter space by assuming a flexible
parametrization in a quark-diquark model. In order to obtain the explicit
contributions from the up and down quarks, we have considered both the scalar
(spin-0) and the axial-vector (spin-1) configurations for the diquark. We have
also studied the spin densities for the up and down quarks in this model for
monopole, dipole and quadrupole contributions for unpolarized and polarized
quarks in unpolarized and polarized proton.
","[{""version"":""v1"",""created"":""Wed, 10 Jun 2015 05:11:39 GMT""}]","2015-08-04"
"1506.03169","Shane Chern","Shane Chern","Congruences for 1-shell totally symmetric plane partitions",,"Integers 17 (2017), Paper No. A21",,,"math.NT","http://arxiv.org/licenses/nonexclusive-distrib/1.0/","  Let $f(n)$ denote the number of 1-shell totally symmetric plane partitions of
weight $n$. Recently, Hirschhorn and Sellers, Yao, and Xia established a number
of congruences modulo 2 and 5, 4 and 8, and 25 for $f(n)$, respectively. In
this note, we shall prove several new congruences modulo 125 and 11 by using
some results of modular forms. For example, for all $n\ge 0$, we have
\begin{align*} f(1250n+125)&\equiv 0 \pmod{125},\\ f(1250n+1125)&\equiv 0
\pmod{125},\\ f(2750n+825)&\equiv 0 \pmod{11},\\ f(2750n+1925)&\equiv 0
\pmod{11}. \end{align*}
","[{""version"":""v1"",""created"":""Wed, 10 Jun 2015 05:15:29 GMT""},{""version"":""v2"",""created"":""Fri, 9 Jun 2017 02:21:10 GMT""}]","2017-06-12"
"1506.03170","Dieter Rautenbach","Oliver Bendele, Dieter Rautenbach","Optimal Colorings with Rainbow Paths",,,,,"math.CO","http://arxiv.org/licenses/nonexclusive-distrib/1.0/","  Let $G$ be a connected graph of chromatic number $k$. For a $k$-coloring $f$
of $G$, a full $f$-rainbow path is a path of order $k$ in $G$ whose vertices
are all colored differently by $f$.
  We show that $G$ has a $k$-coloring $f$ such that every vertex of $G$ lies on
a full $f$-rainbow path, which provides a positive answer to a question posed
by Lin (Simple proofs of results on paths representing all colors in proper
vertex-colorings, Graphs Combin. 23 (2007) 201-203). Furthermore, we show that
if $G$ has a cycle of length $k$, then $G$ has a $k$-coloring $f$ such that,
for every vertex $u$ of $G$, some full $f$-rainbow path begins at $u$, which
solves a problem posed by Bessy and Bousquet (Colorful paths for 3-chromatic
graphs, arXiv 1503.00965v1). Finally, we establish some more results on the
existence of optimal colorings with (directed) full rainbow paths.
","[{""version"":""v1"",""created"":""Wed, 10 Jun 2015 05:24:19 GMT""},{""version"":""v2"",""created"":""Thu, 1 Jun 2017 10:03:40 GMT""}]","2017-06-02"
"1506.03171","Kenji Yasunaga","Kenji Yasunaga","Error Correction by Structural Simplicity: Correcting Samplable Additive
  Errors",,,,,"cs.IT math.IT","http://arxiv.org/licenses/nonexclusive-distrib/1.0/","  This paper explores the possibilities and limitations of error correction by
the structural simplicity of error mechanisms. Specifically, we consider
channel models, called \emph{samplable additive channels}, in which (a) errors
are efficiently sampled without the knowledge of the coding scheme or the
transmitted codeword; (b) the entropy of the error distribution is bounded; and
(c) the number of errors introduced by the channel is unbounded. For the
channels, several negative and positive results are provided. Assuming the
existence of one-way functions, there are samplable additive errors of entropy
$n^{\epsilon}$ for $\epsilon \in (0,1)$ that are pseudorandom, and thus not
correctable by efficient coding schemes. It is shown that there is an oracle
algorithm that induces a samplable distribution over $\{0,1\}^n$ of entropy $m
= \omega( \log n)$ that is not pseudorandom, but is uncorrectable by efficient
schemes of rate less than $1 - m/n - o(1)$. The results indicate that
restricting error mechanisms to be efficiently samplable and not pseudorandom
is insufficient for error correction. As positive results, some conditions are
provided under which efficient error correction is possible.
","[{""version"":""v1"",""created"":""Wed, 10 Jun 2015 05:29:24 GMT""},{""version"":""v2"",""created"":""Mon, 1 Feb 2016 06:51:36 GMT""},{""version"":""v3"",""created"":""Tue, 4 Apr 2017 02:26:41 GMT""},{""version"":""v4"",""created"":""Mon, 14 May 2018 00:45:55 GMT""}]","2018-05-15"
"1506.03172","Manoj Gopalkrishnan","Manoj Gopalkrishnan","A Scheme for Molecular Computation of Maximum Likelihood Estimators for
  Log-Linear Models","13 pages, no figures",,,,"cs.NE math.ST q-bio.MN stat.TH","http://arxiv.org/licenses/nonexclusive-distrib/1.0/","  We propose a novel molecular computing scheme for statistical inference. We
focus on the much-studied statistical inference problem of computing maximum
likelihood estimators for log-linear models. Our scheme takes log-linear models
to reaction systems, and the observed data to initial conditions, so that the
corresponding equilibrium of each reaction system encodes the corresponding
maximum likelihood estimator. The main idea is to exploit the coincidence
between thermodynamic entropy and statistical entropy. We map a Maximum Entropy
characterization of the maximum likelihood estimator onto a Maximum Entropy
characterization of the equilibrium concentrations for the reaction system.
This allows for an efficient encoding of the problem, and reveals that reaction
networks are superbly suited to statistical inference tasks. Such a scheme may
also provide a template to understanding how in vivo biochemical signaling
pathways integrate extensive information about their environment and history.
","[{""version"":""v1"",""created"":""Wed, 10 Jun 2015 05:34:40 GMT""},{""version"":""v2"",""created"":""Fri, 10 Jun 2016 11:45:50 GMT""}]","2016-06-13"
"1506.03173","Parthapratim  Pradhan","Parthapratim Pradhan","Thermodynamic Product Formula for Ho\v{r}ava Lifshitz Black Hole","7 pages Physics Letters B, 30 July 2015",,"10.1016/j.physletb.2015.05.054",,"gr-qc hep-th","http://arxiv.org/licenses/nonexclusive-distrib/1.0/","  We examine the thermodynamic properties of inner and outer horizons in the
background of Ho\v{r}ava Lifshitz black hole. We compute the \emph{horizon
radii product, the surface area product, the entropy product, the surface
temperature product, the Komar energy product and the specific heat product}
for both the horizons of said black hole. We show that surface area product,
entropy product and irreducible mass product are \emph{universal} quantities,
whereas the surface temperature product, Komar energy product and specific heat
product are \emph{not universal} quantities because they all are depends on
mass parameter. We also observe that the \emph{First law} of black hole
thermodynamics and \emph {Smarr-Gibbs-Duhem } relations do not hold for this
black hole. The underlying reason behind this failure due to the scale
invariance of the coupling constant. We further derive the \emph{Smarr mass
formula} and \emph{Christodolou-Ruffini mass formula} for such black hole
spacetime. Moreover we study the stability of such black hole by computing the
specific heat for both the horizons. It has been observed that under certain
condition the black hole possesses second order phase transition.
","[{""version"":""v1"",""created"":""Wed, 10 Jun 2015 05:42:51 GMT""}]","2015-06-11"
"1506.03174","Nariya Kawazumi","Nariya Kawazumi","A tensorial description of the Turaev cobracket on genus 0 compact
  surfaces",,,,,"math.GT math.NT math.QA","http://arxiv.org/licenses/nonexclusive-distrib/1.0/","  We give a tensorial description of the Turaev cobracket on any genus 0
compact surface through the standard group-like expansion, where the Bernoulli
numbers appear.
","[{""version"":""v1"",""created"":""Wed, 10 Jun 2015 05:54:42 GMT""},{""version"":""v2"",""created"":""Mon, 20 Jun 2016 08:06:29 GMT""}]","2016-06-21"
"1506.03175","Somnath Ghosh Dr.","Ajanta Barh, B. P. Pal, G. P. Agrawal, R. K. Varshney, and B. M. A.
  Rahman","Specialty Fibers for Terahertz Generation and Transmission: A Review","15 pages",,,,"physics.optics","http://arxiv.org/licenses/nonexclusive-distrib/1.0/","  Terahertz (THz) frequency range, lying between the optical and microwave
range covers a significant portion of the electro-magnetic spectrum. Though its
initial usage started in the 1960s, active research in the THz field started
only in the 1990s by researchers from both optics and microwaves disciplines.
The use of optical fibers for THz application has attracted considerable
attention in recent years. In this article, we review the progress and current
status of optical fiber-based techniques for THz generation and transmission.
The first part of this review focuses on THz sources. After a review on various
types of THz sources, we discuss how specialty optical fibers can be used for
THz generation. The second part of this review focuses on the guided wave
propagation of THz waves for their transmission. After discussing various wave
guiding schemes, we consider new fiber designs for THz transmission.
","[{""version"":""v1"",""created"":""Wed, 10 Jun 2015 05:55:56 GMT""}]","2015-06-11"
"1506.03176","Enrico Carlini","E. Carlini, M.V. Catalisano, L. Chiantini, A.V. Geramita, Y. Woo","Symmetric tensors: rank, Strassen's conjecture and e-computability","arXiv admin note: text overlap with arXiv:1412.2975",,,,"math.AC","http://arxiv.org/licenses/nonexclusive-distrib/1.0/","  In this paper we introduce a new method to produce lower bounds for the
Waring rank of symmetric tensors. We also introduce the notion of
$e$-computability and we use it to prove that Strassen's Conjecture holds in
infinitely many new cases.
","[{""version"":""v1"",""created"":""Wed, 10 Jun 2015 05:58:55 GMT""},{""version"":""v2"",""created"":""Thu, 11 Jun 2015 00:19:53 GMT""}]","2015-06-12"
"1506.03177","Yu Zhiming","Zhiming Yu, Hui Pan, and Yugui Yao","Electric field controlled spin- and valley-polarized edge states in
  silicene with extrinsic Rashba effect","5 pages, 5 figures","Physical Review B 92, 155419 (2015)","10.1103/PhysRevB.92.155419",,"cond-mat.mes-hall cond-mat.mtrl-sci","http://arxiv.org/licenses/nonexclusive-distrib/1.0/","  In the presence of extrinsic Rashba spin-orbit coupling, we find that
silicene can host a new quantum anomalous Hall state with spin- and
valley-polarized edge states, which can be effectively controlled by the
exchange field and electric field. In this new state, the pair of nontrivial
edge states reside in one specific valley and have a strong but opposite spin
polarization. A distinctive feature of this new state is that both of the spin
and valley index of the edge states can be switched by reversing the electric
field. We also present a microscopic mechanism for the origination of the new
state. Our findings provide an efficient way to control the topologically
protected spin- and valley-polarized edge states, which is crucial for
spintronics and valleytronics.
","[{""version"":""v1"",""created"":""Wed, 10 Jun 2015 05:59:03 GMT""},{""version"":""v2"",""created"":""Tue, 20 Oct 2015 04:36:58 GMT""}]","2015-10-21"
"1506.03178","Tadashi Nakajima","Tadashi Nakajima, Takashi Tsuji and Yoichi Takeda","Physical Properties of Gliese 229B Based on Newly Determined Carbon and
  Oxygen Abundances of Gliese 229A","20 pages, 4 figures",,"10.1088/0004-6256/150/2/53",,"astro-ph.SR","http://arxiv.org/licenses/nonexclusive-distrib/1.0/","  Recently Tsuji & Nakajima (2914) and Tsuji, Nakajima & Takeda (2015) have
developed a method of molecular line spectroscopy of M dwarfs with which Carbon
and oxygen abundances are derived respectively from CO and H2O lines in the K
band. They applied this method to Gl229A, the primary star of the brown dwarf
companion, Gl229B. The derived abundances of Gl229A are logAc=-3.27+/-0.07 and
logAo=-3.10+/-0.02, which are close to the classical values of the solar
abundances of carbon and oxygen. We generate model spectra of Gl229B for the
metallicity of Gl229A as well as for the classical solar metallicity. We find
that the differences of the resulting spectra are not so large for the
differences of the metallicity of 0.1 dex or so, but we now discuss the
spectrum of Gl229B on the basis of the reliable metallicity. From the
literature, the lower limit to the age of Gl229A is found to be 0.3Gyr. From
the kinematics of Gl229A, we evaluate the upper limit to the age of Gl229A to
be 3.0Gyr. The observed and model spectra are compared and goodness of fit is
obtained in the range of model parameters, 750<Teff<1000K, and 4.5<logg<5.5.
Among the candidates that satisfy the age constraint, the best combinations of
model parameters are (Teff,logg)=(800K,47.5) and (850K,5.0), while acceptable
combinations are (750K,4.75),(850K,4.75) and (900K,5.0).
","[{""version"":""v1"",""created"":""Wed, 10 Jun 2015 06:03:11 GMT""}]","2015-08-06"
"1506.03179","Lingjie Li","L. C. Wang, L. J. Li, Z. W. Ma, X. Zhang, L. C. Lee","Energy of Alfven waves generated during magnetic reconnection","15 pages, 7 figures",,,,"physics.plasm-ph","http://arxiv.org/licenses/nonexclusive-distrib/1.0/","  A new method for the determination of the Alfven wave energy generated during
magnetic reconnection is introduced and used to analyze the results from
two-dimensional MHD simulations. It is found that the regions with strong
Alfven wave perturbations almost coincide with that where both magnetic-field
lines and flow-stream lines are bent, suggesting that this method is reliable
for identifying Alfven waves. The magnetic energy during magnetic reconnection
is mainly transformed into the thermal energy. The conversion rate to Alfven
wave energy from the magnetic energy is strongly correlated to the magnetic
reconnection rate. The maximum conversion rate at the time with the peak
reconnection rate is found to be only about 4% for the cases with the plasma
beta=0.01,0.1, and 1.0.
","[{""version"":""v1"",""created"":""Wed, 10 Jun 2015 06:06:07 GMT""}]","2015-06-11"
"1506.03180","Luca Nanni","Luca Nanni","A New Derivation of the Time-Dependent Schr\""odinger Equation from Wave
  and Matrix Mechanics","6 pages. Advances in Physics Theories and Applications, Vol. 43
  (2015) ISSN 2224-719X (Paper) ISSN 2225-0638 (Online) Vol 43, 2015 Advances
  in Physics Theories and Applications - Vol 43, 2015",,,,"physics.gen-ph quant-ph","http://arxiv.org/licenses/nonexclusive-distrib/1.0/","  An alternative method is proposed for deriving the time dependent
Schroedinger equation from the pictures of wave and matrix mechanics. The
derivation is of a mixed classical quantum character, since time is treated as
a classical variable, thus avoiding any controversy over its meaning in quantum
mechanics. The derivation method proposed in this paper requires no ad hoc
assumption and avoids going through a second-order differential equation that
can be reduced to the well known time-dependent Schroedinger equation only
postulating a complex wavefunction with an exponential time dependence, as did
by Schroedinger in its original paper of 1926.
","[{""version"":""v1"",""created"":""Wed, 10 Jun 2015 06:09:58 GMT""}]","2015-06-11"
"1506.03181","Mohammad Shihabul Haque","Mohammad Shihabul Haque, Jorgen Peddersen, Andhi Janapsatya, Sri
  Parameswaran","DEW: A Fast Level 1 Cache Simulation Approach for Embedded Processors
  with FIFO Replacement Policy",,,"10.1109/DATE.2010.5457153",,"cs.AR","http://arxiv.org/licenses/nonexclusive-distrib/1.0/","  Increasing the speed of cache simulation to obtain hit/miss rates en- ables
performance estimation, cache exploration for embedded sys- tems and energy
estimation. Previously, such simulations, particu- larly exact approaches, have
been exclusively for caches which uti- lize the least recently used (LRU)
replacement policy. In this paper, we propose a new, fast and exact cache
simulation method for the First In First Out(FIFO) replacement policy. This
method, called DEW, is able to simulate multiple level 1 cache configurations
(dif- ferent set sizes, associativities, and block sizes) with FIFO replace-
ment policy. DEW utilizes a binomial tree based representation of cache
configurations and a novel searching method to speed up sim- ulation over
single cache simulators like Dinero IV. Depending on different cache block
sizes and benchmark applications, DEW oper- ates around 8 to 40 times faster
than Dinero IV. Dinero IV compares 2.17 to 19.42 times more cache ways than DEW
to determine accu- rate miss rates.
","[{""version"":""v1"",""created"":""Wed, 10 Jun 2015 06:14:33 GMT""},{""version"":""v2"",""created"":""Mon, 31 Aug 2015 18:28:46 GMT""}]","2015-09-01"
"1506.03182","Mohammad Shihabul Haque","Mohammad Shihabul Haque, Akash Kumar, Yajun Ha, Qiang Wu and Shaobo
  Luo","TRISHUL: A Single-pass Optimal Two-level Inclusive Data Cache Hierarchy
  Selection Process for Real-time MPSoCs",,,"10.1109/ASPDAC.2013.6509615",,"cs.AR","http://arxiv.org/licenses/nonexclusive-distrib/1.0/","  Hitherto discovered approaches analyze the execution time of a real time
application on all the possible cache hierarchy setups to find the application
specific optimal two level inclusive data cache hierarchy to reduce cost, space
and energy consumption while satisfying the time deadline in real time
Multiprocessor Systems on Chip. These brute force like approaches can take
years to complete. Alternatively, memory access trace driven crude estimation
methods can find a cache hierarchy quickly by compromising the accuracy of
results. In this article, for the first time, we propose a fast and accurate
trace driven approach to find the optimal real time application specific two
level inclusive data cache hierarchy. Our proposed approach TRISHUL predicts
the optimal cache hierarchy performance first and then utilizes that
information to find the optimal cache hierarchy quickly. TRISHUL can suggest a
cache hierarchy, which has up to 128 times smaller size, up to 7 times faster
compared to the suggestion of the state of the art crude trace driven two level
inclusive cache hierarchy selection approach for the application traces
analyzed.
","[{""version"":""v1"",""created"":""Wed, 10 Jun 2015 06:26:02 GMT""},{""version"":""v2"",""created"":""Mon, 31 Aug 2015 18:09:02 GMT""}]","2015-09-01"
"1506.03183","Inna Aznauryan","I.G. Aznauryan and V.D. Burkert","Electroexcitation of the Delta(1232)3/2+ and Delta(1600)3/2+ in a
  light-front relativistic quark model","7 pages, 3 figures","Phys. Rev. C 92, 035211 (2015)","10.1103/PhysRevC.92.035211",,"hep-ph","http://arxiv.org/licenses/nonexclusive-distrib/1.0/","  The magnetic-dipole form factor and the ratios R_EM and R_SM for the gamma* N
-> Delta(1232)3/2}+ transition are predicted within light-front relativistic
quark model up to photon virtuality Q2=12 GeV2. We also predict the helicity
amplitudes of the gamma* N -> Delta(1600)3/2+ transition assuming the
Delta(1600)3/2+ is the first radial excitation of the ground state
Delta(1232)3/2+.
","[{""version"":""v1"",""created"":""Wed, 10 Jun 2015 06:33:54 GMT""}]","2015-10-07"
"1506.03184","Cong Yao","Xinyu Zhou and Shuchang Zhou and Cong Yao and Zhimin Cao and Qi Yin","ICDAR 2015 Text Reading in the Wild Competition","3 pages, 2 figures",,,,"cs.CV","http://arxiv.org/licenses/nonexclusive-distrib/1.0/","  Recently, text detection and recognition in natural scenes are becoming
increasing popular in the computer vision community as well as the document
analysis community. However, majority of the existing ideas, algorithms and
systems are specifically designed for English. This technical report presents
the final results of the ICDAR 2015 Text Reading in the Wild (TRW 2015)
competition, which aims at establishing a benchmark for assessing detection and
recognition algorithms devised for both Chinese and English scripts and
providing a playground for researchers from the community. In this article, we
describe in detail the dataset, tasks, evaluation protocols and participants of
this competition, and report the performance of the participating methods.
Moreover, promising directions for future research are discussed.
","[{""version"":""v1"",""created"":""Wed, 10 Jun 2015 06:46:55 GMT""}]","2015-06-11"
"1506.03185","Yun Li","Yun Li, M.B.N. Kouwenhoven, D. Stamatellos and S.P. Goodwin","The dynamical evolution of low-mass hydrogen-burning stars, brown dwarfs
  and planetary-mass objects formed through disc fragmentation","38 pages, 15 figures","Yun Li et al. 2015 ApJ 805 116","10.1088/0004-637X/805/2/116",,"astro-ph.SR astro-ph.EP","http://arxiv.org/licenses/nonexclusive-distrib/1.0/","  Theory and simulations suggest that it is possible to form low-mass
hydrogen-burning stars, brown dwarfs and planetary-mass objects via disc
fragmentation. As disc fragmentation results in the formation of several bodies
at comparable distances to the host star, their orbits are generally unstable.
Here, we study the dynamical evolution of these objects. We set up the initial
conditions based on the outcomes of the SPH simulations of Stamatellos &
Whitworth, and for comparison we also study the evolution of systems resulting
from lower-mass fragmenting discs. We refer to these two sets of simulations as
set 1 and set 2. At 10 Myr, approximately half of the host stars have one
companion left, and approximately 22% (set 1) to 9.8% (set 2) of the host stars
are single. Systems with multiple secondaries in relatively stable
configurations are common (about 30% and 44%, respectively). The majority of
the companions are ejected within 1 Myr with velocities mostly below 5 km/s,
with some runaway escapers with velocities over 30 km/s. About 6% (set 1) and
2% (set 2) of the companions pair up into very low-mass binary systems. The
majority of these pairs escape as very low-mass binaries, while others remain
bound to the host star in hierarchical configurations (often with retrograde
inner orbits). Physical collisions with the host star (0.43 and 0.18 events per
host star for set 1 and set 2) and between companions (0.08 and 0.04 events per
host star for set 1 and set 2) are relatively common and their frequency
increases with increasing disc mass. Our study predicts observable properties
of very low-mass binaries, low-mass hierarchical systems, the brown dwarf
desert, and free-floating brown dwarfs and planetary-mass objects in and near
young stellar groupings, which can be used to distinguish between different
formation scenarios of very low-mass stars, brown dwarfs and planetary-mass
objects.
","[{""version"":""v1"",""created"":""Wed, 10 Jun 2015 06:55:28 GMT""}]","2015-06-11"
"1506.03186","Mohammad Shihabul Haque","Mohammad Shihabul Haque, Jorgen Peddersen, Sri Parameswaran","CIPARSim: Cache Intersection Property Assisted Rapid Single-pass FIFO
  Cache Simulation Technique",,,"10.1109/ICCAD.2011.6105316",,"cs.AR","http://arxiv.org/licenses/nonexclusive-distrib/1.0/","  In this paper, for the first time, we introduce a cache property called the
Intersection Property that helps to reduce singlepass simulation time in a
manner similar to inclusion property. An intersection property defines
conditions that if met, prove a particular element exists in larger caches,
thus avoiding further search time. We have discussed three such intersection
properties for caches using the FIFO replacement policy in this paper. A rapid
singlepass FIFO cache simulator CIPARSim has also been proposed. CIPARSim is
the first singlepass simulator dependent on the FIFO cache properties to reduce
simulation time significantly. CIPARSim simulation time was up to 5 times
faster compared to the state of the art singlepass FIFO cache simulator for the
cache configurations tested. CIPARSim produces the cache hit and miss rates of
an application accurately on various cache configurations. During simulation,
CIPARSim intersection properties alone predict up to 90% of the total hits,
reducing simulationtime immensely
","[{""version"":""v1"",""created"":""Wed, 10 Jun 2015 06:57:55 GMT""},{""version"":""v2"",""created"":""Mon, 31 Aug 2015 18:21:08 GMT""}]","2015-09-01"
