"1506.08341","Benjamin Linowitz","Benjamin Linowitz and Jeffrey S. Meyer","Systolic Surfaces of Arithmetic Hyperbolic 3-Manifolds",,,,,"math.GT math.NT","http://arxiv.org/licenses/nonexclusive-distrib/1.0/","  In this paper we examine the geometry of minimal surfaces of arithmetic
hyperbolic 3-manifolds. In particular, we give bounds on the totally geodesic
2-systole, construct infinitely many incommensurable manifolds with the same
initial geometric genus spectrum in which volume and 1-systole are controlled,
and analyze the growth of the genera of minimal surfaces across
commensurability classes. These results have applications to the study of how
Heegard genus grows across commensurability classes.
","[{""version"":""v1"",""created"":""Sun, 28 Jun 2015 00:36:41 GMT""}]","2015-06-30"
"1506.08342","Zhixin Qian","Zhixin Qian","Static dielectric function with exact exchange contribution in the
  electron liquid","15 pages","Journal of Mathematical Physics 56, 111901 (2015)","10.1063/1.4935547",,"cond-mat.str-el","http://arxiv.org/licenses/nonexclusive-distrib/1.0/","  The exchange contribution, $\Pi_1 ({\bf k}, 0)$, to the static dielectric
function in the electron liquid is evaluated exactly. Expression for it is
derived analytically in terms of one quadrature. The expression, as presented
in Eq. (3) in the Introduction, turns out to be very simple. A fully explicit
expression (with no more integral in it) for $\Pi_1 ({\bf k}, 0)$ is further
developed in terms of series. Equation (3) is proved to be equal to the
expression obtained before under some mathematical assumption by Engel and
Vosko, thus in the meanwhile putting the latter on a rigorous basis. The
expansions of $\Pi_1 ({\bf k}, 0)$ at the wavectors of $k=0$, $k=2k_F$, and at
limiting large $k$ are derived. The results all verify those obtained by Engel
and Vosko.
","[{""version"":""v1"",""created"":""Sun, 28 Jun 2015 01:26:25 GMT""},{""version"":""v2"",""created"":""Sat, 1 Aug 2015 05:11:45 GMT""}]","2016-01-08"
"1506.08343","Fei Liu","Fei Liu","Calculating work in weakly driven quantum master equations: backward and
  forward equations","1 figure","Phys. Rev. E 93, 012127 (2016)","10.1103/PhysRevE.93.012127",,"cond-mat.stat-mech quant-ph","http://arxiv.org/licenses/nonexclusive-distrib/1.0/","  I present a technical report indicating that the two methods used for
calculating characteristic functions for the work distribution in weakly driven
quantum master equations are equivalent. One involves applying the notion of
quantum jump trajectory [Phys. Rev. E 89, 042122 (2014)], while the other is
based on two energy measurements on the combined system and reservoir [Silaev,
et al., Phys. Rev. E 90, 022103 (2014)]. These represent backward and forward
methods, respectively, which adopt a very similar approach to that of the
Kolmogorov backward and forward equations used in classical stochastic theory.
The microscopic basis for the former method is also clarified. In addition, a
previously unnoticed equality related to the heat is also revealed.
","[{""version"":""v1"",""created"":""Sun, 28 Jun 2015 01:42:14 GMT""},{""version"":""v2"",""created"":""Mon, 14 Dec 2015 09:06:45 GMT""}]","2016-01-27"
"1506.08344","Allan Alinea","Allan L. Alinea, Takahiro Kubota, and Wade Naylor","Logarithmic divergences in the $k$-inflationary power spectra computed
  through the uniform approximation","version 4 : extended Section 6 on remarks on logarithmic divergences","JCAP 02 (2016) 028","10.1088/1475-7516/2016/02/028",,"gr-qc astro-ph.CO hep-th","http://arxiv.org/licenses/nonexclusive-distrib/1.0/","  We investigate a calculation method for solving the Mukhanov-Sasaki equation
in slow-roll $k$-inflation based on the uniform approximation (UA) in
conjunction with an expansion scheme for slow-roll parameters with respect to
the number of $e$-folds about the so-called \textit{turning point}. Earlier
works on this method has so far gained some promising results derived from the
approximating expressions for the power spectra among others, up to second
order with respect to the Hubble and sound flow parameters, when compared to
other semi-analytical approaches (e.g., Green's function and WKB methods).
However, a closer inspection is suggestive that there is a problem when
higher-order parts of the power spectra are considered; residual logarithmic
divergences may come out that can render the prediction physically
inconsistent. Looking at this possibility, we map out up to what order with
respect to the mentioned parameters several physical quantities can be
calculated before hitting a logarithmically divergent result. It turns out that
the power spectra are limited up to second order, the tensor-to-scalar ratio up
to third order, and the spectral indices and running converge to all orders.
This indicates that the expansion scheme is incompatible with the working
equations derived from UA for the power spectra but compatible with that of the
spectral indices. For those quantities that involve logarithmically divergent
terms in the higher-order parts, existing results in the literature for the
convergent lower-order parts calculated in the equivalent fashion should be
viewed with some caution; they do not rest on solid mathematical ground.
","[{""version"":""v1"",""created"":""Sun, 28 Jun 2015 02:02:33 GMT""},{""version"":""v2"",""created"":""Sun, 5 Jul 2015 01:29:54 GMT""},{""version"":""v3"",""created"":""Sat, 7 Nov 2015 02:02:25 GMT""},{""version"":""v4"",""created"":""Sun, 20 Dec 2015 12:51:24 GMT""}]","2016-07-18"
"1506.08345","Derrick Stolee","Jennifer Diemunsch, Nathan Graber, Lucas Kramer, Victor Larsen, Lauren
  M. Nelsen, Luke L. Nelsen, Devon Sigler, Derrick Stolee, and Charlie Suer","Color-blind index in graphs of very low degree","10 pages, 3 figures, and a 4 page appendix","Discrete Applied Mathematics, Volume 225, 10 July 2017, Pages
  122-129","10.1016/j.dam.2017.03.006",,"math.CO","http://arxiv.org/licenses/nonexclusive-distrib/1.0/","  Let $c:E(G)\to [k]$ be an edge-coloring of a graph $G$, not necessarily
proper. For each vertex $v$, let $\bar{c}(v)=(a_1,\ldots,a_k)$, where $a_i$ is
the number of edges incident to $v$ with color $i$. Reorder $\bar{c}(v)$ for
every $v$ in $G$ in nonincreasing order to obtain $c^*(v)$, the color-blind
partition of $v$. When $c^*$ induces a proper vertex coloring, that is,
$c^*(u)\neq c^*(v)$ for every edge $uv$ in $G$, we say that $c$ is color-blind
distinguishing. The minimum $k$ for which there exists a color-blind
distinguishing edge coloring $c:E(G)\to [k]$ is the color-blind index of $G$,
denoted $\operatorname{dal}(G)$. We demonstrate that determining the
color-blind index is more subtle than previously thought. In particular,
determining if $\operatorname{dal}(G) \leq 2$ is NP-complete. We also connect
the color-blind index of a regular bipartite graph to 2-colorable regular
hypergraphs and characterize when $\operatorname{dal}(G)$ is finite for a class
of 3-regular graphs.
","[{""version"":""v1"",""created"":""Sun, 28 Jun 2015 02:08:56 GMT""}]","2017-09-21"
"1506.08346","Yevgeniy Puzyrev","Georgios D. Barmparis (1,2), Yevgeniy S. Puzyrev (1), X.-G. Zhang
  (2,3,4), and Sokrates T. Pantelides (1,5,6) ((1) Department of Physics and
  Astronomy, Vanderbilt University, (2) Center for Nanophase Materials
  Sciences, Oak Ridge National Laboratory, (3) Computer Science and Mathematics
  Division, Oak Ridge National Laboratory, (4) Department of Physics and the
  Quantum Theory Project, University of Florida, (5) Materials Science and
  Technology Division, Oak Ridge National Laboratory, (6) Department of
  Electrical Engineering and Computeer Science, Vanderbilt University)","Theory of inelastic multiphonon scattering and carrier capture by
  defects in semiconductors. Application to capture cross sections","37 pages, 5 figures","Phys. Rev. B 92, 214111 (2015)","10.1103/PhysRevB.92.214111",,"cond-mat.mtrl-sci","http://arxiv.org/licenses/nonexclusive-distrib/1.0/","  Inelastic scattering and carrier capture by defects in semiconductors are the
primary causes of hot-electron-mediated degradation of power devices, which
holds up their commercial development. At the same time, carrier capture is a
major issue in the performance of solar cells and light-emitting diodes. A
theory of nonradiative inelastic scattering by defects, however, is
non-existent, while the the- ory for carrier capture by defects has had a long
and arduous history. Here we report the construction of a comprehensive theory
of inelastic scattering by defects, with carrier capture being a special case.
We distinguish between capture under thermal equilibrium conditions and capture
under non-equilibrium conditions, e.g., in the presence of electrical current
or hot carriers where carriers undergo scattering by defects and are described
by a mean free path. In the thermal-equilibrium case, capture is mediated by a
non-adiabatic perturbation Hamiltonian, originally identified by Huang and Rhys
and by Kubo, which is equal to linear electron-phonon coupling to first order.
In the non-equilibrium case, we demonstrate that the primary capture mechanism
is within the Born-Oppenheimer approximation, with coupling to the defect
potential inducing Franck-Condon electronic transitions, followed by
multiphonon dissipation of the transition energy, while the non-adiabatic terms
are of secondary importance. We report density-functional-theory calculations
of the capture cross section for a prototype defect using the
Projector-Augmented-Wave which allows us to employ all-electron wavefunctions.
We adopt a Monte Carlo scheme to sample multiphonon configurations and obtain
converged results. The theory and the results represent a foundation upon which
to build engineering-level models for hot-electron degradation of power devices
and the performance of solar cells and light-emitting diodes.
","[{""version"":""v1"",""created"":""Sun, 28 Jun 2015 02:40:06 GMT""},{""version"":""v2"",""created"":""Tue, 30 Jun 2015 21:34:15 GMT""},{""version"":""v3"",""created"":""Fri, 21 Aug 2015 19:20:34 GMT""}]","2015-12-30"
"1506.08347","Golnaz Ghiasi","Golnaz Ghiasi and Charless C. Fowlkes","Occlusion Coherence: Detecting and Localizing Occluded Faces",,,,,"cs.CV","http://arxiv.org/licenses/nonexclusive-distrib/1.0/","  The presence of occluders significantly impacts object recognition accuracy.
However, occlusion is typically treated as an unstructured source of noise and
explicit models for occluders have lagged behind those for object appearance
and shape. In this paper we describe a hierarchical deformable part model for
face detection and landmark localization that explicitly models part occlusion.
The proposed model structure makes it possible to augment positive training
data with large numbers of synthetically occluded instances. This allows us to
easily incorporate the statistics of occlusion patterns in a discriminatively
trained model. We test the model on several benchmarks for landmark
localization and detection including challenging new data sets featuring
significant occlusion. We find that the addition of an explicit occlusion model
yields a detection system that outperforms existing approaches for occluded
instances while maintaining competitive accuracy in detection and landmark
localization for unoccluded instances.
","[{""version"":""v1"",""created"":""Sun, 28 Jun 2015 03:12:34 GMT""},{""version"":""v2"",""created"":""Thu, 25 Aug 2016 00:27:35 GMT""}]","2016-08-26"
"1506.08348","Mohammad Salahuddin","Mohammad A. Salahuddin, Halima Elbiaze, Wessam Ajib and Roch Glitho","Social Network Analysis Inspired Content Placement with QoS in
  Cloud-based Content Delivery Networks","6 pages, 4 figures, 2 tables",,,,"cs.NI cs.MM","http://arxiv.org/licenses/nonexclusive-distrib/1.0/","  Content Placement (CP) problem in Cloud-based Content Delivery Networks
(CCDNs) leverage resource elasticity to build cost effective CDNs that
guarantee QoS. In this paper, we present our novel CP model, which optimally
places content on surrogates in the cloud, to achieve (a) minimum cost of
leasing storage and bandwidth resources for data coming into and going out of
the cloud zones and regions, (b) guarantee Service Level Agreement (SLA), and
(c) minimize degree of QoS violations. The CP problem is NP-Hard, hence we
design a unique push-based heuristic, called Weighted Social Network Analysis
(W-SNA) for CCDN providers. W-SNA is based on Betweeness Centrality (BC) from
SNA and prioritizes surrogates based on their relationship to the other
vertices in the network graph. To achieve our unique objectives, we further
prioritize surrogates based on weights derived from storage cost and content
requests. We compare our heuristic to current state of the art Greedy Site (GS)
and purely Social Network Analysis (SNA) heuristics, which are relevant to our
work. We show that W-SNA outperforms GS and SNA in minimizing cost and QoS.
Moreover, W-SNA guarantees SLA but also minimizes the degree of QoS violations.
To the best of our knowledge, this is the first model and heuristic of its
kind, which is timely and gives a fundamental pre-allocation scheme for future
online and dynamic resource provision for CCDNs.
","[{""version"":""v1"",""created"":""Sun, 28 Jun 2015 03:25:27 GMT""},{""version"":""v2"",""created"":""Wed, 12 Aug 2015 16:50:07 GMT""},{""version"":""v3"",""created"":""Thu, 10 Sep 2015 16:05:46 GMT""}]","2015-09-11"
"1506.08349","Lantian Li Mr.","Lantian Li and Yiye Lin and Zhiyong Zhang and Dong Wang","Improved Deep Speaker Feature Learning for Text-Dependent Speaker
  Recognition","arXiv admin note: substantial text overlap with arXiv:1505.06427",,,,"cs.CL cs.LG cs.NE","http://arxiv.org/licenses/nonexclusive-distrib/1.0/","  A deep learning approach has been proposed recently to derive speaker
identifies (d-vector) by a deep neural network (DNN). This approach has been
applied to text-dependent speaker recognition tasks and shows reasonable
performance gains when combined with the conventional i-vector approach.
Although promising, the existing d-vector implementation still can not compete
with the i-vector baseline. This paper presents two improvements for the deep
learning approach: a phonedependent DNN structure to normalize phone variation,
and a new scoring approach based on dynamic time warping (DTW). Experiments on
a text-dependent speaker recognition task demonstrated that the proposed
methods can provide considerable performance improvement over the existing
d-vector implementation.
","[{""version"":""v1"",""created"":""Sun, 28 Jun 2015 03:32:02 GMT""}]","2015-06-30"
"1506.08350","Yadong Mu","Yadong Mu and Wei Liu and Wei Fan","Stochastic Gradient Made Stable: A Manifold Propagation Approach for
  Large-Scale Optimization","14 pages, 9 figures",,,,"cs.LG cs.NA","http://arxiv.org/licenses/nonexclusive-distrib/1.0/","  Stochastic gradient descent (SGD) holds as a classical method to build large
scale machine learning models over big data. A stochastic gradient is typically
calculated from a limited number of samples (known as mini-batch), so it
potentially incurs a high variance and causes the estimated parameters bounce
around the optimal solution. To improve the stability of stochastic gradient,
recent years have witnessed the proposal of several semi-stochastic gradient
descent algorithms, which distinguish themselves from standard SGD by
incorporating global information into gradient computation. In this paper we
contribute a novel stratified semi-stochastic gradient descent (S3GD) algorithm
to this nascent research area, accelerating the optimization of a large family
of composite convex functions. Though theoretically converging faster, prior
semi-stochastic algorithms are found to suffer from high iteration complexity,
which makes them even slower than SGD in practice on many datasets. In our
proposed S3GD, the semi-stochastic gradient is calculated based on efficient
manifold propagation, which can be numerically accomplished by sparse matrix
multiplications. This way S3GD is able to generate a highly-accurate estimate
of the exact gradient from each mini-batch with largely-reduced computational
complexity. Theoretic analysis reveals that the proposed S3GD elegantly
balances the geometric algorithmic convergence rate against the space and time
complexities during the optimization. The efficacy of S3GD is also
experimentally corroborated on several large-scale benchmark datasets.
","[{""version"":""v1"",""created"":""Sun, 28 Jun 2015 03:33:38 GMT""},{""version"":""v2"",""created"":""Tue, 12 Jan 2016 21:30:08 GMT""}]","2016-01-14"
"1506.08351","Jing-Han Chen","Jing-Han Chen, Nickolaus M. Bruno, Ibrahim Karaman, Yujin Huang,
  Jianguo Li, and Joseph H. Ross Jr","Calorimetric and magnetic study for Ni$_{50}$Mn$_{36}$In$_{14}$ and
  relative cooling power in paramagnetic inverse magnetocaloric systems",,"J. Appl. Phys. 116, 203901 (2014)","10.1063/1.4902527",,"cond-mat.mtrl-sci","http://arxiv.org/licenses/nonexclusive-distrib/1.0/","  The non-stoichiometric Heusler alloy Ni$_{50}$Mn$_{36}$In$_{14}$ undergoes a
martensitic phase transformation in the vicinity of 345 K, with the high
temperature austenite phase exhibiting paramagnetic rather than ferromagnetic
behavior, as shown in similar alloys with lower-temperature transformations.
Suitably prepared samples are shown to exhibit a sharp transformation, a
relatively small thermal hysteresis, and a large field-induced entropy change.
We analyzed the magnetocaloric behavior both through magnetization and direct
field-dependent calorimetry measurements. For measurements passing through the
first-order transformation, an improved method for heat-pulse relaxation
calorimetry was designed. The results provide a firm basis for the analytic
evaluation of field-induced entropy changes in related materials. An analysis
of the relative cooling power (RCP), based on the integrated field-induced
entropy change and magnetizing behavior of the Mn spin system with
ferromagnetic correlations, shows that a significant RCP may be obtained in
these materials by tuning the magnetic and structural transformation
temperatures through minor compositional changes or local order changes.
","[{""version"":""v1"",""created"":""Sun, 28 Jun 2015 03:36:17 GMT""}]","2015-06-30"
"1506.08352","Lurong Jiang","Junbiao Liu, Xinyu Jin, Lurong Jiang, Yongxiang Xia, Bo Ouyang, Fang
  Dong, Yicong Lang, Wenping Zhang","Threshold for the Outbreak of Cascading Failures in Degree-degree
  Uncorrelated Networks","11 pages, 4 figures",,,,"cs.SI cs.NI physics.soc-ph","http://arxiv.org/licenses/nonexclusive-distrib/1.0/","  In complex networks, the failure of one or very few nodes may cause cascading
failures. When this dynamical process stops in steady state, the size of the
giant component formed by remaining un-failed nodes can be used to measure the
severity of cascading failures, which is critically important for estimating
the robustness of networks. In this paper, we provide a cascade of overload
failure model with local load sharing mechanism, and then explore the threshold
of node capacity when the large-scale cascading failures happen and un-failed
nodes in steady state cannot connect to each other to form a large connected
sub-network. We get the theoretical derivation of this threshold in
degree-degree uncorrelated networks, and validate the effectiveness of this
method in simulation. This threshold provide us a guidance to improve the
network robustness under the premise of limited capacity resource when creating
a network and assigning load. Therefore, this threshold is useful and important
to analyze the robustness of networks.
","[{""version"":""v1"",""created"":""Sun, 28 Jun 2015 03:46:24 GMT""}]","2015-06-30"
"1506.08353","Haijuan Hu","Haijuan Hu, Jacques Froment, Quansheng Liu","A note on patch-based low-rank minimization for fast image denoising","4pages (two columns)",,,,"cs.CV","http://arxiv.org/licenses/nonexclusive-distrib/1.0/","  Patch-based low-rank minimization for image processing attracts much
attention in recent years. The minimization of the matrix rank coupled with the
Frobenius norm data fidelity can be solved by the hard thresholding filter with
principle component analysis (PCA) or singular value decomposition (SVD). Based
on this idea, we propose a patch-based low-rank minimization method for image
denoising. The main denoising process is stated in three equivalent way: PCA,
SVD and low-rank minimization. Compared to recent patch-based sparse
representation methods, experiments demonstrate that the proposed method is
rather rapid, and it is effective for a variety of natural grayscale images and
color images, especially for texture parts in images. Further improvements of
this method are also given. In addition, due to the simplicity of this method,
we could provide an explanation of the choice of the threshold parameter,
estimation of PSNR values, and give other insights into this method.
","[{""version"":""v1"",""created"":""Sun, 28 Jun 2015 03:52:42 GMT""},{""version"":""v2"",""created"":""Wed, 21 Feb 2018 03:14:36 GMT""}]","2018-02-22"
"1506.08354","Jianjun Cheng","Jianjun Cheng, Longjie Li, Mingwei Leng, Weiguo Lu, Yukai Yao, and
  Xiaoyun Chen","A divisive spectral method for network community detection","23pages, 10 figures, and 2 tables",,"10.1088/1742-5468/2016/03/033403",,"cs.SI physics.soc-ph","http://arxiv.org/licenses/nonexclusive-distrib/1.0/","  Community detection is a fundamental problem in the domain of complex-network
analysis. It has received great attention, and many community detection methods
have been proposed in the last decade. In this paper, we propose a divisive
spectral method for identifying community structures from networks, which
utilizes a sparsification operation to pre-process the networks first, and then
uses a repeated bisection spectral algorithm to partition the networks into
communities. The sparsification operation makes the community boundaries more
clearer and more sharper, so that the repeated spectral bisection algorithm
extract high-quality community structures accurately from the sparsified
networks. Experiments show that the combination of network sparsification and
spectral bisection algorithm is highly successful, the proposed method is more
effective in detecting community structures from networks than the others.
","[{""version"":""v1"",""created"":""Sun, 28 Jun 2015 04:10:42 GMT""},{""version"":""v2"",""created"":""Mon, 13 Jul 2015 09:22:45 GMT""}]","2016-04-20"
"1506.08355","Andrii Neronov","A.Neronov, Ie.Vovk","Test of relativistic gravity using microlensing of relativistically
  broadened lines in gravitationally lensed quasars","8 pages, 5 figures","Phys. Rev. D 93, 023006 (2016)","10.1103/PhysRevD.93.023006",,"gr-qc astro-ph.CO astro-ph.HE hep-th","http://arxiv.org/licenses/nonexclusive-distrib/1.0/","  We show that observation of the time-dependent effect of microlensing of
relativistically broadened emission lines (such as e.g. the Fe Kalpha line in
X-rays) in strongly lensed quasars could provide data on celestial mechanics of
circular orbits in the direct vicinity of the horizon of supermassive black
holes. This information can be extracted from the observation of evolution of
red / blue edge of the magnified line just before and just after the period of
crossing of the innermost stable circular orbit by the microlensing caustic.
The functional form of this evolution is insensitive to numerous astrophysical
parameters of the accreting black hole and of the microlensing caustics network
system (as opposed to the evolution the full line spectrum). Measurement of the
temporal evolution of the red / blue edge could provide a precision measurement
of the radial dependence of the gravitational redshift and of velocity of the
circular orbits, down to the innermost stable circular orbit. These
measurements could be used to discriminate between the General Relativity and
alternative models of the relativistic gravity in which the dynamics of photons
and massive bodies orbiting the gravitating centre is different from that of
the geodesics in the Schwarzschild or Kerr space-times.
","[{""version"":""v1"",""created"":""Sun, 28 Jun 2015 04:25:17 GMT""}]","2016-02-03"
"1506.08356","Vladimir Zhdankin","Vladimir Zhdankin, Dmitri A. Uzdensky, Stanislav Boldyrev","Temporal Analysis of Dissipative Structures in Magnetohydrodynamic
  Turbulence","Submitted to the Astrophysical Journal. 48 pages, 18 figures","The Astrophysical Journal, 811, 6 (2015)","10.1088/0004-637X/811/1/6",,"astro-ph.HE astro-ph.SR physics.flu-dyn physics.plasm-ph physics.space-ph","http://arxiv.org/licenses/nonexclusive-distrib/1.0/","  Energy dissipation is highly intermittent in turbulent plasmas, being
localized in coherent structures such as current sheets. The statistical
analysis of spatial dissipative structures is an effective approach to studying
turbulence. In this paper, we generalize this methodology to investigate
four-dimensional spatiotemporal structures, i.e., dissipative processes
representing sets of interacting coherent structures, which correspond to
flares in astrophysical systems. We develop methods for identifying and
characterizing these processes, and then perform a statistical analysis of
dissipative processes in numerical simulations of driven magnetohydrodynamic
turbulence. We find that processes are often highly complex, long-lived, and
weakly asymmetric in time. They exhibit robust power-law probability
distributions and scaling relations, including a distribution of dissipated
energy with power-law index near -1.75, indicating that intense dissipative
events dominate the overall energy dissipation. We compare our results with the
previously observed statistical properties of solar flares.
","[{""version"":""v1"",""created"":""Sun, 28 Jun 2015 04:42:43 GMT""}]","2015-09-16"
