"1506.08377","Dimitrios K. Papoulias","T. S. Kosmas, O. G. Miranda, D. K. Papoulias, M. Tortola and J. W. F.
  Valle","Sensitivities to neutrino electromagnetic properties at the TEXONO
  experiment","18 pages, 4 figures, 1 table, version published in PLB","Phys.Lett. B750 (2015) 459-465","10.1016/j.physletb.2015.09.054","IFIC/15-39","hep-ph","http://arxiv.org/licenses/nonexclusive-distrib/1.0/","  The possibility of measuring neutral-current coherent elastic
neutrino-nucleus scattering (CENNS) at the TEXONO experiment has opened high
expectations towards probing exotic neutrino properties. Focusing on low
threshold Germanium-based targets with kg-scale mass, we find a remarkable
efficiency not only for detecting CENNS events due to the weak interaction, but
also for probing novel electromagnetic neutrino interactions. Specifically, we
demonstrate that such experiments are complementary in performing precision
Standard Model tests as well as in shedding light on sub-leading effects due to
neutrino magnetic moment and neutrino charge radius. This work employs
realistic nuclear structure calculations based on the quasi-particle random
phase approximation (QRPA) and takes into consideration the crucial quenching
effect corrections. Such a treatment, in conjunction with a simple statistical
analysis, shows that the attainable sensitivities are improved by one order of
magnitude as compared to previous studies.
","[{""version"":""v1"",""created"":""Sun, 28 Jun 2015 09:14:52 GMT""},{""version"":""v2"",""created"":""Fri, 2 Oct 2015 23:07:40 GMT""}]","2015-10-06"
"1506.08378","Marcel Ausloos","Marcel Ausloos","Slow-down or speed-up of inter- and intra-cluster diffusion of
  controversial knowledge in stubborn communities based on a small world
  network","16 pages, 28 references, 6 Tables, prepared for a Frontiers Research
  Topic ""Opinions, Choices and Actions: Applications of Sociophysics to the
  diffusion of ideas"" issue, A. Martins & S.Galam, Eds","Front. Phys. 3:43 (2015)","10.3389/fphy.2015.00043",,"physics.soc-ph cond-mat.dis-nn cond-mat.stat-mech cs.SI","http://arxiv.org/licenses/nonexclusive-distrib/1.0/","  Diffusion of knowledge is expected to be huge when agents are open minded.
The report concerns a more difficult diffusion case when communities are made
of stubborn agents. Communities having markedly different opinions are for
example the Neocreationist and Intelligent Design Proponents (IDP), on one
hand, and the Darwinian Evolution Defenders (DED), on the other hand. The case
of knowledge diffusion within such communities is studied here on a network
based on an adjacency matrix built from time ordered selected quotations of
agents, whence for inter- and intra-communities. The network is intrinsically
directed and not necessarily reciprocal. Thus, the adjacency matrices have
complex eigenvalues, the eigenvectors present complex components. A
quantification of the slow-down or speed-up effects of information diffusion in
such temporal networks, with non-Markovian contact sequences, can be made by
comparing the real time dependent (directed) network to its counterpart, the
time aggregated (undirected) network, - which has real eigenvalues. In order to
do so, small world networks which both contain an $odd$ number of nodes are
studied and compared to similar networks with an $even$ number of nodes.
  It is found that (i) the diffusion of knowledge is more difficult on the
largest networks, (ii) the network size influences the slowing-down or
speeding-up diffusion process. Interestingly, it is observed that (iii) the
diffusion of knowledge is slower in IDP and faster in DED communities. It is
suggested that the finding can be ""rationalized"", if some ""scientific quality""
and ""publication habit"" is attributed to the agents, as common sense would
guess. This finding offers some opening discussion toward tying scientific
knowledge to belief.
","[{""version"":""v1"",""created"":""Sun, 28 Jun 2015 09:22:13 GMT""}]","2015-08-17"
"1506.08379","Eduard Gorbar","E.V. Gorbar, V.P. Gusynin, and O.O. Sobol","Supercritical electric dipole and migration of electron wave function in
  graphene","8 pages, 6 Figures, and video; submitted to Europhysics Letters","Europhysics Letters, 111 (2015) 37003","10.1209/0295-5075/111/37003",,"cond-mat.str-el cond-mat.mes-hall hep-ph","http://arxiv.org/licenses/nonexclusive-distrib/1.0/","  We study the Dirac equation for quasiparticles in gapped graphene with two
oppositely charged impurities by using the technique of linear combination of
atomic orbitals and variational Galerkin--Kantorovich method. We show that for
sufficiently large charges of impurities the wave function of the occupied
electron bound state of the highest energy changes its localization from the
negatively charged impurity to the positively charged one as the distance
between the impurities increases. This migration of the electron wave function
of supercritical electric dipole is a generalization of the familiar phenomenon
of the atomic collapse of single charged impurity to the case where
electron-hole pairs are spontaneously created from vacuum in bound states with
charge impurities thus partially screening them.
","[{""version"":""v1"",""created"":""Sun, 28 Jun 2015 09:49:21 GMT""},{""version"":""v2"",""created"":""Fri, 24 Jul 2015 08:23:27 GMT""}]","2015-09-03"
"1506.08380","Ruiqiang Guo","Youdi Kuang, Lucas Lindsay, Sanqiang Shi, Xinjiang Wang, Ruiqiang Guo,
  Baoling Huang","Thermal conductivity of graphene mediated by strain and size",,,,,"cond-mat.mtrl-sci","http://arxiv.org/licenses/nonexclusive-distrib/1.0/","  Based on first-principles calculations and full iterative solution of the
linearized Boltzmann-Peierls transport equation for phonons within three-phonon
scattering framework, we characterize the lattice thermal conductivities
$\kappa$ of strained and unstrained graphene. We find $\kappa$ converges to
5450 W/m-K for infinite unstrained graphene, while $\kappa$ diverges for
strained graphene with increasing system size at room temperature. The
different $\kappa$ behaviors for these systems are further validated
mathematically through phonon lifetime analysis. Flexural acoustic phonons are
the dominant heat carriers in both unstrained and strained graphene within the
temperature considered. Ultralong mean free paths of flexural phonons
contribute to finite size effects on $\kappa$ for samples as large as 8 cm at
room temperature. The calculated size-dependent and temperature-dependent
$\kappa$ for finite samples agree well with experimental data, demonstrating
the ability of the present approach to predict $\kappa$ of larger graphene
sample. Tensile strain hardens the flexural modes and increases their
lifetimes, causing interesting dependence of $\kappa$ on sample size and strain
due to the competition between boundary scattering and intrinsic phonon-phonon
scattering. These findings shed light on the nature of thermal transport in
two-dimensional materials and may guide predicting and engineering $\kappa$ of
graphene by varying strain and size.
","[{""version"":""v1"",""created"":""Sun, 28 Jun 2015 09:58:49 GMT""}]","2015-06-30"
"1506.08381","Yuri I. Ozhigov","Mariano Lemus, Yuri Ozhigov, Nikita Skovoroda","Reliability of optical gate array for C-Sign operator","15 pages, 7 figures",,,,"quant-ph","http://arxiv.org/licenses/nonexclusive-distrib/1.0/","  We study optical gate array of KLM model of quantum computer for C-Sign
operator, which contains linear elements and two nonlinear phase shifts. Linear
elements and photon counting are taken to be ideal, whereas nonlinear phase
shifts are subject of realistic and unavoidable factors of decoherence: the
immediate photon leak from cavities and mediated leakage with the atom, which
flies out of the cavity and plays the role of ancilla. We use JC model with
Lindblad master equation to estimate the dependence of the validity of C-Sign
operator from the rate of photon leak and estimate the limitation, which this
validity imposes to quantum computations.
","[{""version"":""v1"",""created"":""Sun, 28 Jun 2015 10:58:37 GMT""}]","2015-06-30"
"1506.08382","Linyuan Lu","Linyuan Lu and Arthur L.B. Yang","A combinatorial identity on Galton-Watson process","9 pages",,,,"math.CO","http://arxiv.org/licenses/nonexclusive-distrib/1.0/","  Let $f(m,c)=\sum_{k=0}^{\infty} (km+1)^{k-1} c^k e^{-c(km+1)/m} / (m^kk!)$.
For any positive integer $m$ and positive real $c$, the identity
$f(m,c)=f(1,c)^{1/m}$ arises in the random graph theory. In this paper, we
present two elementary proofs of this identity: a pure combinatorial proof and
a power-serial proof. We also proved that this identity holds for any positive
reals $m$ and $c$.
","[{""version"":""v1"",""created"":""Sun, 28 Jun 2015 11:10:49 GMT""}]","2015-06-30"
"1506.08383","In Yong Park","I. Y. Park","4D covariance of holographic quantization of Einstein gravity","31 pages, 5 figures, sign error in eq.(25) (and affected eqs)
  corrected","Theor.Math.Phys. 195 (2018) 745-763","10.1134/S0040577918050094",,"hep-th","http://arxiv.org/licenses/nonexclusive-distrib/1.0/","  It has been observed in [Park 2014] that the physical states of the ADM
formulation of 4D Einstein gravity holographically reduce and can be described
by a 3D language. Obviously the approach poses the 4D covariance issue; it
turns out that there are two covariance issues whose address is the main theme
of the present work. Although the unphysical character of the trace piece of
the fluctuation metric has been long known, it has not been taken care of in a
manner suitable for the Feynman diagram computations; a proper handling of the
trace piece through gauge-fixing is the key to more subtler of the covariance
issues. As for the second covariance issue, a renormalization program can be
carried out covariantly to any loop order at intermediate steps, thereby
maintaining the 4D covariance; it is only at the final stage that one should
consider the 3D physical external states. With the physical external states,
the 1PI effective action reduces to 3D and renormalizability is restored just
as in the entirely-3D approach of [Park 2014]. We revisit the one-loop
two-point renormalization with careful attention to the trace piece of the
fluctuation metric and in particular outline one-loop renormalization of the
Newton's constant.
","[{""version"":""v1"",""created"":""Sun, 28 Jun 2015 11:35:20 GMT""},{""version"":""v2"",""created"":""Thu, 28 Apr 2016 13:33:38 GMT""},{""version"":""v3"",""created"":""Wed, 19 Jul 2017 16:35:52 GMT""},{""version"":""v4"",""created"":""Sun, 29 Apr 2018 23:33:31 GMT""}]","2018-05-01"
"1506.08384","Johannes Th\""urigen","Johannes Th\""urigen","Group field theories generating polyhedral complexes","accepted for publication in PoS, Frontiers of Fundamental Physics 14
  (AMU Marseille)","PoS(FFP14)177, 2015","10.22323/1.224.0177",,"gr-qc hep-th","http://arxiv.org/licenses/nonexclusive-distrib/1.0/","  Group field theories are a generalization of matrix models which provide both
a second quantized reformulation of loop quantum gravity as well as generating
functions for spin foam models. While states in canonical loop quantum gravity,
in the traditional continuum setting, are based on graphs with vertices of
arbitrary valence, group field theories have been defined so far in a
simplicial setting such that states have support only on graphs of fixed
valency. This has led to the question whether group field theory can indeed
cover the whole state space of loop quantum gravity. In this contribution based
on [1] I present two new classes of group field theories which satisfy this
objective: i) a straightforward, but rather formal generalization to multiple
fields, one for each valency and ii) a simplicial group field theory which
effectively covers the larger state space through a dual weighting, a technique
common in matrix and tensor models. To this end I will further discuss in some
detail the combinatorial structure of the complexes generated by the group
field theory partition function. The new group field theories do not only
strengthen the links between the mentioned quantum gravity approaches but,
broadening the theory space of group field theories, they might also prove
useful in the investigation of renormalizability.
","[{""version"":""v1"",""created"":""Sun, 28 Jun 2015 11:38:37 GMT""}]","2018-08-01"
"1506.08385","Bruno Kahn","Bruno Kahn and R. Sujatha","Birational motives, II: Triangulated birational motives","Compared to the initial version: previous Subsection 4.2 has been
  upgraded to Section 5; previous Lemmas 5.2.5 and 5.2.6 have been corrected to
  Proposition 6.2.5 and Lemma 6.2.6; at the referee's request, previous
  Appendix B and the proof of previous Proposition C.1.1 (now A.4.1) have been
  removed (please consult the initial version for them)","International Mathematics Research Notices, Vol. 2017, No. 22, pp.
  6778-6831","10.1093/imrn/rnw184",,"math.AG","http://arxiv.org/licenses/nonexclusive-distrib/1.0/","  We develop birational versions of Voevodsky's triangulated categories of
motives over a field, and relate them with the pure birational motives studied
in arXiv:0902.4902 [math.AG]. We also get an interpretation of unramified
cohomology in this framework, leading to ""higher derived functors of unramified
cohomology"".
","[{""version"":""v1"",""created"":""Sun, 28 Jun 2015 11:48:24 GMT""},{""version"":""v2"",""created"":""Wed, 3 Aug 2016 15:10:37 GMT""}]","2017-12-20"
"1506.08386","Bruno Kahn","Bruno Kahn","Motifs et adjoints","in French. Minor changes; added Th. 8.6 to justify the terminology
  ""Tate-Safarevic motive""; its proof will be completed elsewhere","Rend. Semin. Mat. Univ. Padova 139 (2018), 77-128",,,"math.AG math.NT","http://arxiv.org/licenses/nonexclusive-distrib/1.0/","  We show in many cases the existence of adjoints to extension of scalars on
categories of motivic nature, in the framework of field extensions. This is to
be contrasted with the more classical situation where one deals with a finite
type morphism of schemes. Among various applications, one is a functorial
construction of the ""Tate-Safarevic motive"" introduced in arXiv:1401.6847
[math.NT]. We also deduce a possible approach to Bloch's conjecture on
surfaces, by reduction to curves.
","[{""version"":""v1"",""created"":""Sun, 28 Jun 2015 11:59:08 GMT""},{""version"":""v2"",""created"":""Mon, 13 Jul 2015 15:52:58 GMT""},{""version"":""v3"",""created"":""Mon, 23 Nov 2015 10:37:28 GMT""},{""version"":""v4"",""created"":""Thu, 23 Mar 2017 13:37:56 GMT""}]","2020-06-04"
"1506.08387","Tomohiko Mizutani","Tomohiko Mizutani","Robustness Analysis of Preconditioned Successive Projection Algorithm
  for General Form of Separable NMF Problem","19 pages","Linear Algebra and its Applications, 497, pp. 1-22, 2016","10.1016/j.laa.2016.02.016",,"stat.ML math.OC","http://arxiv.org/licenses/nonexclusive-distrib/1.0/","  The successive projection algorithm (SPA) has been known to work well for
separable nonnegative matrix factorization (NMF) problems arising in
applications, such as topic extraction from documents and endmember detection
in hyperspectral images. One of the reasons is in that the algorithm is robust
to noise. Gillis and Vavasis showed in [SIAM J. Optim., 25(1), pp. 677-698,
2015] that a preconditioner can further enhance its noise robustness. The proof
rested on the condition that the dimension $d$ and factorization rank $r$ in
the separable NMF problem coincide with each other. However, it may be
unrealistic to expect that the condition holds in separable NMF problems
appearing in actual applications; in such problems, $d$ is usually greater than
$r$. This paper shows, without the condition $d=r$, that the preconditioned SPA
is robust to noise.
","[{""version"":""v1"",""created"":""Sun, 28 Jun 2015 12:10:27 GMT""},{""version"":""v2"",""created"":""Thu, 28 Jan 2016 08:35:07 GMT""}]","2016-03-03"
"1506.08388","Luk\'a\v{s} Folwarczn\'y","Luk\'a\v{s} Folwarczn\'y and Du\v{s}an Knop","IV-matching is strongly NP-hard","5 pages, 2 figures",,,,"cs.DM cs.CC","http://arxiv.org/licenses/nonexclusive-distrib/1.0/","  IV-matching is a generalization of perfect bipartite matching. The complexity
of finding IV-matching in a graph was posted as an open problem at the ICALP
2014 conference.
  In this note, we resolve the question and prove that, contrary to the
expectations of the authors, the given problem is strongly NP-hard (already in
the simplest non-trivial case of four layers). Hence it is unlikely that there
would be an efficient (polynomial or pseudo-polynomial) algorithm solving the
problem.
","[{""version"":""v1"",""created"":""Sun, 28 Jun 2015 12:25:15 GMT""}]","2015-06-30"
"1506.08389","Ahmet Beyaz","Ahmet Beyaz","On fillings of homotopy equivalent contact structures","5 pages",,,,"math.GT","http://arxiv.org/licenses/nonexclusive-distrib/1.0/","  This paper provides a topological method for filling contact structures on
the connected sums of $S^2\times S^3$. Examples of nonsymplectomorphic strong
fillings of homotopy equivalent contact structures with vanishing first Chern
class on $\#_k S^2\times S^3$ $(k\geq2)$ are produced.
","[{""version"":""v1"",""created"":""Sun, 28 Jun 2015 12:34:25 GMT""}]","2015-06-30"
"1506.08390","Olga Shekhovtsova","O. Shekhovtsova","Study of predominant hadronic modes of $\tau$-lepton using a Monte Carlo
  generator TAUOLA","8 pages, 3 figures",,"10.1134/S0021364015180137",,"hep-ph","http://arxiv.org/licenses/nonexclusive-distrib/1.0/","  TAUOLA is a Monte Carlo generator dedicated to generating tau-lepton decays
and it is used in the analysis of experimental data both at B-factories and
LHC. TAUOLA is a long-term project that started in the 90's and has been under
development up to now. In this note we discuss the status of the predominant
hadronic tau-lepton decays into two ($Br \simeq 25.52\%$) and three pions ($Br
\simeq 18.67\%$).
","[{""version"":""v1"",""created"":""Sun, 28 Jun 2015 12:34:47 GMT""},{""version"":""v2"",""created"":""Sat, 22 Aug 2015 05:50:34 GMT""}]","2016-01-20"
"1506.08391","Ilan Golani","Shay Cohen, Yoav Benjamini, and Ilan Golani","Coping with Space Neophobia in Drosophila melanogaster: The Asymmetric
  Dynamics of Crossing a Doorway to the Untrodden",,,"10.1371/journal.pone.0140207",,"q-bio.NC","http://arxiv.org/licenses/nonexclusive-distrib/1.0/","  Insects exhibit remarkable cognitive skills in the field and several
cognitive abilities have been demonstrated in Drosophila in the laboratory. By
devising an ethologically relevant experimental setup that also allows
comparison of behavior across remote taxonomic groups we sought to reduce the
gap between the field and the laboratory, and reveal as yet undiscovered
ethological phenomena within a wider phylogenetic perspective. We tracked
individual flies that eclosed in a small (45mm) arena containing a piece of
fruit, connected to a larger (130mm) arena by a wide (5mm) doorway. Using this
setup we show that the widely open doorway initially functions as a barrier:
the likelihood of entering the large arena increases gradually, requiring
repeated approaches to the doorway, and even after entering the flies
immediately return. Gradually the flies acquire the option to avoid returning,
spending more relative time and performing relatively longer excursions in the
large arena. The entire process may take up three successive days. This
behavior constitutes coping with space neophobia, the avoidance of untrodden
space. It appears to be the same as the neophobic doorway-crossing reported in
mouse models of anxiety. In both mice and flies the moment-to-moment
developmental dynamics of transition between trodden and untrodden terrain
appear to be the same, and in mice it is taken to imply memory and, therefore,
cognition. Recent claims have been made for a deep homology between the
arthropod central complex and the vertebrate basal ganglia, two structures
involved in navigation. The shared dynamics of space occupancy in flies and
mice might indicate the existence of cognitive exploration also in the flies or
else a convergent structure exhibiting the same developmental dynamics.
","[{""version"":""v1"",""created"":""Sun, 28 Jun 2015 12:47:43 GMT""}]","2016-02-17"
"1506.08392","Michael Elkin","Michael Elkin, Seth Pettie","A Linear-Size Logarithmic Stretch Path-Reporting Distance Oracle for
  General Graphs",,,,,"cs.DS","http://arxiv.org/licenses/nonexclusive-distrib/1.0/","  In 2001 Thorup and Zwick devised a distance oracle, which given an $n$-vertex
undirected graph and a parameter $k$, has size $O(k n^{1+1/k})$. Upon a query
$(u,v)$ their oracle constructs a $(2k-1)$-approximate path $\Pi$ between $u$
and $v$. The query time of the Thorup-Zwick's oracle is $O(k)$, and it was
subsequently improved to $O(1)$ by Chechik. A major drawback of the oracle of
Thorup and Zwick is that its space is $\Omega(n \cdot \log n)$. Mendel and Naor
devised an oracle with space $O(n^{1+1/k})$ and stretch $O(k)$, but their
oracle can only report distance estimates and not actual paths. In this paper
we devise a path-reporting distance oracle with size $O(n^{1+1/k})$, stretch
$O(k)$ and query time $O(n^\epsilon)$, for an arbitrarily small $\epsilon > 0$.
In particular, our oracle can provide logarithmic stretch using linear size.
Another variant of our oracle has size $O(n \log\log n)$, polylogarithmic
stretch, and query time $O(\log\log n)$.
  For unweighted graphs we devise a distance oracle with multiplicative stretch
$O(1)$, additive stretch $O(\beta(k))$, for a function $\beta(\cdot)$, space
$O(n^{1+1/k} \cdot \beta)$, and query time $O(n^\epsilon)$, for an arbitrarily
small constant $\epsilon >0$. The tradeoff between multiplicative stretch and
size in these oracles is far below girth conjecture threshold (which is stretch
$2k-1$ and size $O(n^{1+1/k})$). Breaking the girth conjecture tradeoff is
achieved by exhibiting a tradeoff of different nature between additive stretch
$\beta(k)$ and size $O(n^{1+1/k})$. A similar type of tradeoff was exhibited by
a construction of $(1+\epsilon,\beta)$-spanners due to Elkin and Peleg.
However, so far $(1+\epsilon,\beta)$-spanners had no counterpart in the
distance oracles' world.
  An important novel tool that we develop on the way to these results is a
{distance-preserving path-reporting oracle}.
","[{""version"":""v1"",""created"":""Sun, 28 Jun 2015 12:56:32 GMT""}]","2015-06-30"
"1506.08393","Vincent Lahoche","Vincent Lahoche and Daniele Oriti","Renormalization of a tensorial field theory on the homogeneous space
  SU(2)/U(1)","48 pages, 18 figures",,,,"hep-th gr-qc math-ph math.MP","http://arxiv.org/licenses/nonexclusive-distrib/1.0/","  We study the renormalization of a general field theory on the 2-sphere with
tensorial interaction and gauge invariance under the diagonal action of SU(2).
We derive the power counting for arbitrary dimension d. For the case d=4, we
prove perturbative renormalizability to all orders via multi-scale analysis,
study both the renormalised and effective perturbation series, and establish
the asymptotic freedom of the model. We also outline a general power counting
for the homogeneous space SO(D)/SO(D-1), of direct interest for quantum gravity
models in general dimensions, and point out the obstructions to the direct
generalisation of our results to these cases.
","[{""version"":""v1"",""created"":""Sun, 28 Jun 2015 12:57:03 GMT""},{""version"":""v2"",""created"":""Wed, 11 May 2016 22:56:06 GMT""},{""version"":""v3"",""created"":""Thu, 26 Jan 2017 14:35:36 GMT""}]","2017-01-27"
"1506.08394","Niv Cohen","Niv Cohen and Oded Kenneth","The Aharonov Casher Effect: The Case of g not equal to 2","5 pages, 2 figures",,,,"cond-mat.mes-hall quant-ph","http://arxiv.org/licenses/nonexclusive-distrib/1.0/","  The Aharonov Casher effect predicts the existence in two dimensions of
ceil(Phi/2pi) -1 bounded zero modes associated with a magnetic flux Phi.
Aharonov and Casher discussed the case of gyromagnetic factor equals 2, we will
discuss the general case of any gyromagnetic factor. As a simple model, we
study the case where the magnetic field lies in a thin annulus. First we
examine the wavefunctions of the zero-energy bounded states, predicted by the
Aharonov Casher Effect for electrons with gyromagnetic ratio equal 2. We then
calculate the wave function and energies for a gyromagnetic ratio g not equal
to 2. We give the dependence of the bound states energies on g and the angular
momentum. Finally, we provide an order of magnitude estimations for the binding
energies.
","[{""version"":""v1"",""created"":""Sun, 28 Jun 2015 13:07:32 GMT""}]","2015-06-30"
