"1506.08357","Yukihide Takayama","Yukihide Takayama","An Example of non-simply connected non-liftable Calabi-Yau 3-fold in
  positive characteristic","5 pages",,,,"math.AG","http://arxiv.org/licenses/nonexclusive-distrib/1.0/","  We show an example of non-simply connected non-liftable Calabi-Yau threefold
over an algebraically closed field of characteristic $3$. It is constructed
from a simply connected example by S.~Schr\""oer.
","[{""version"":""v1"",""created"":""Sun, 28 Jun 2015 05:32:03 GMT""},{""version"":""v2"",""created"":""Thu, 25 Feb 2016 06:51:29 GMT""}]","2016-02-26"
"1506.08358","Fumiharu Kobayashi","Fumiharu Kobayashi and Yoshiko Kanada-En'yo","Analysis of the effect of core structure upon dineutron correlation
  using antisymmetrized molecular dynamics","11 pages, 5 figures",,"10.1103/PhysRevC.93.024310",,"nucl-th","http://arxiv.org/licenses/nonexclusive-distrib/1.0/","  We extend the method of antisymmetrized molecular dynamics to investigate
dineutron correlation. We apply this method to $^{10}$Be as an example and
investigate the motion of two neutrons around a largely deformed $^8$Be core by
analyzing the two-neutron overlap function around the core. We show that the
core structure plays an important role in dineutron formation and expansion
from the core and that the present framework is effective for the studies of
dineutron correlation.
","[{""version"":""v1"",""created"":""Sun, 28 Jun 2015 05:35:57 GMT""}]","2016-03-23"
"1506.08359","Sedighe Sajadian","Sedighe Sajadian","Detecting stellar spots through polarimetry observations of microlensing
  events in caustic-crossing","Accepted for publication in MNRAS, 10 pages, 7 figures, 1 table",,"10.1093/mnras/stv1349",,"astro-ph.SR astro-ph.CO","http://arxiv.org/licenses/nonexclusive-distrib/1.0/","  In this work, we investigate if gravitational microlensing can magnify the
polarization signal of a stellar spot and make it be observable. A stellar spot
on a source star of microlensing makes polarization signal through two channels
of Zeeman effect and breaking circular symmetry of the source surface
brightness due to its temperature contrast. We first explore the
characteristics of perturbations in polarimetric microlensing during
caustic-crossing of a binary lensing as follows: (a) The cooler spots over the
Galactic bulge sources have the smaller contributions in the total flux,
although they have stronger magnetic fields. (b) The maximum deviation in the
polarimetry curve due to the spot happens when the spot is located near the
source edge and the source spot is first entering the caustic whereas the
maximum photometric deviation occurs for the spots located at the source
center. (c) There is a (partial) degeneracy for indicating spot's size, its
temperature contrast and its magnetic induction from the deviations in light or
polarimetric curves. (d) If the time when the photometric deviation due to spot
becomes zero (between positive and negative deviations) is inferred from
microlensing light curves, we can indicate the magnification factor of the
spot, characterizing the spot properties except its temperature contrast. The
stellar spots alter the polarization degree as well as strongly change its
orientation which gives some information about the spot position. Although, the
photometry observations are more efficient in detecting stellar spots than the
polarimetry ones, but polarimetry observations can specify the magnetic field
of the source spots.
","[{""version"":""v1"",""created"":""Sun, 28 Jun 2015 05:40:30 GMT""}]","2015-08-06"
"1506.08360","Jinxia  Zhu","Jinxia Zhu and Hailiang Yang","Optimal financing and dividend distribution in a general diffusion model
  with regime switching",,,,,"math.OC q-fin.PM","http://arxiv.org/licenses/nonexclusive-distrib/1.0/","  We study the optimal financing and dividend distribution problem with
restricted dividend rates in a diffusion type surplus model where the drift and
volatility coefficients are general functions of the level of surplus and the
external environment regime. The environment regime is modeled by a Markov
process. Both capital injections and dividend payments incur expenses. The
objective is to maximize the expectation of the total discounted dividends
minus the total cost of capital injections. We prove that it is optimal to
inject capitals only when the surplus tends to fall below zero and to pay out
dividends at the maximal rate when the surplus is at or above the threshold
dependent on the environment regime.
","[{""version"":""v1"",""created"":""Sun, 28 Jun 2015 05:45:17 GMT""}]","2015-06-30"
"1506.08361","Jaderick Pabico","Jaderick P. Pabico","Simultaneously Solving Computational Problems Using an Artificial
  Chemical Reactor","6 pages, appeared in R.P. Salda\~na (ed.) Proceedings (CDROM) of the
  6th Philippine Computing Science Congress (PCSC 2006), Ateneo De Manila
  University, Loyola Heights, Quezon City, Philippines, 28-29 March 2006, pp
  48-53 (ISSN 1908-1146)",,,,"cs.ET cs.NE","http://creativecommons.org/licenses/by-nc-sa/4.0/","  This paper is centered on using chemical reaction as a computational metaphor
for simultaneously solving problems. An artificial chemical reactor that can
simultaneously solve instances of three unrelated problems was created. The
reactor is a distributed stochastic algorithm that simulates a chemical
universe wherein the molecular species are being represented either by a human
genomic contig panel, a Hamiltonian cycle, or an aircraft landing schedule. The
chemical universe is governed by reactions that can alter genomic sequences,
re-order Hamiltonian cycles, or reschedule an aircraft landing program.
Molecular masses were considered as measures of goodness of solutions, and
represented radiation hybrid (RH) vector similarities, costs of Hamiltonian
cycles, and penalty costs for landing an aircraft before and after target
landing times. This method, tested by solving in tandem with deterministic
algorithms, has been shown to find quality solutions in finding the minima RH
vector similarities of genomic data, minima costs in Hamiltonian cycles of the
traveling salesman, and minima costs for landing aircrafts before or after
target landing times.
","[{""version"":""v1"",""created"":""Sun, 28 Jun 2015 06:01:50 GMT""}]","2015-06-30"
"1506.08362","Dongxu Li","Dongxu Li, Artem R. Oganov, Xiao Dong, Xiang-Feng Zhou, Qiang Zhu,
  Guangrui Qian, Huafeng Dong","Nitrogen oxides under pressure stability, ionization, polymerization,
  and superconductivity",,,,,"cond-mat.mtrl-sci","http://arxiv.org/licenses/nonexclusive-distrib/1.0/","  Nitrogen oxides are textbook class of molecular compounds, with extensive
industrial applications. Nitrogen and oxygen are also among the most abundant
elements in the universe. We explore the N-O system at 0 K and up to 500 GPa
though ab initio evolutionary simulations. Results show that two phase
transformations of stable molecular NO2 exist at 7 and 64 GPa, and followed by
decomposition of NO2 at 91 GPa. All of the NO+NO3- structures are found to be
metastable at T=0 K, so experimentally reported ionic NO+NO3- is either
metastable or stabilized by temperature. Upon increasing pressure, N2O5
transforms from P-1 to C2/c structure at 51 GPa. NO becomes thermodynamically
stable at 198 GPa. This polymeric phase is superconducting (Tc = 2.0 K) and
contains a -N-N- backbone.
","[{""version"":""v1"",""created"":""Sun, 28 Jun 2015 06:02:56 GMT""}]","2015-06-30"
"1506.08363","Dong-Kyu Lee","Dong-Kyu Lee, Ji-Hun Kang, Jun-Seok Lee, Hyo-Seok Kim, Chulki Kim, Jae
  Hun Kim, Taikjin Lee, Joo-Hiuk Son, Q-Han Park, and Minah Seo","Highly sensitive and selective sugar detection by terahertz
  nano-antennas",,,,,"physics.optics","http://arxiv.org/licenses/nonexclusive-distrib/1.0/","  Molecular recognition and discrimination of carbohydrates are important
because carbohydrates perform essential roles in most living organisms for
energy metabolism and cell-to-cell communication. Nevertheless, it is difficult
to identify or distinguish various carbohydrate molecules owing to the lack of
a significant distinction in the physical or chemical characteristics. Although
there has been considerable effort to develop a sensing platform for individual
carbohydrates selectively using chemical receptors or an ensemble array, their
detection and discrimination limits have been as high in the millimolar
concentration range. Here we show a highly sensitive and selective detection
method for the discrimination of carbohydrate molecules using nano-slot-antenna
array-based sensing chips which operate in the terahertz frequency range. This
THz metamaterial sensing tool recognizes various types of carbohydrate
molecules over a wide range of molecular concentrations. Strongly localized and
enhanced terahertz transmission by nano-antennas can effectively increase the
molecular absorption cross sections, thereby enabling the detection of these
molecules even at low concentrations. We verified the performance of
nano-antenna sensing chip by both THz spectra and images of transmittance.
Screening and identification of various carbohydrates can be applied to test
even real market beverages with a high sensitivity and selectivity.
","[{""version"":""v1"",""created"":""Sun, 28 Jun 2015 06:10:06 GMT""}]","2015-06-30"
"1506.08364","Yevgeny Stadnik","Yevgeny V. Stadnik, Victor V. Flambaum","New generation low-energy probes for ultralight axion and scalar dark
  matter","10 pages, Invited brief review for Modern Physics Letters A, Guest
  Editor: Maxim Yu. Khlopov","Mod. Phys. Lett. A 32, 1740004 (2017)","10.1142/S0217732317400041",,"hep-ph astro-ph.CO nucl-th physics.atom-ph","http://arxiv.org/licenses/nonexclusive-distrib/1.0/","  We present a brief overview of a new generation of high-precision laboratory
and astrophysical measurements to search for ultralight (sub-eV) axion,
axion-like pseudoscalar and scalar dark matter, which form either a coherent
condensate or topological defects (solitons). In these new detection methods,
the sought effects are linear in the interaction constant between dark matter
and ordinary matter, which is in stark contrast to traditional searches for
dark matter, where the sought effects are quadratic or higher order in the
underlying interaction constants (which are extremely small).
","[{""version"":""v1"",""created"":""Sun, 28 Jun 2015 06:38:21 GMT""}]","2017-05-30"
"1506.08365","Filippo Bracci","Filippo Bracci, Manuel D. Contreras, Santiago Diaz-Madrigal","Topological invariants for semigroups of holomorphic self-maps of the
  unit disc","28 pages, final version, to appear in J. Math. Pures Appl",,,,"math.CV math.DS","http://arxiv.org/licenses/nonexclusive-distrib/1.0/","  Let $(\varphi_t)$, $(\phi_t)$ be two one-parameter semigroups of holomorphic
self-maps of the unit disc $\mathbb D\subset \mathbb C$. Let $f:\mathbb D \to
\mathbb D$ be a homeomorphism. We prove that, if $f \circ \phi_t=\varphi_t
\circ f$ for all $t\geq 0$, then $f$ extends to a homeomorphism of
$\bar{\mathbb D}$ outside exceptional maximal contact arcs (in particular, for
elliptic semigroups, $f$ extends to a homeomorphism of $\bar{\mathbb D}$).
Using this result, we study topological invariants for one-parameter semigroups
of holomorphic self-maps of the unit disc.
","[{""version"":""v1"",""created"":""Sun, 28 Jun 2015 06:43:23 GMT""},{""version"":""v2"",""created"":""Fri, 4 Mar 2016 16:46:00 GMT""}]","2016-03-07"
"1506.08366","Chitta Ranjan Das","C.R. Das and L.V. Laperashvili","False Vacuum Higgs Inflation and the Graviweak Unification","25 pages. arXiv admin note: substantial text overlap with
  arXiv:1503.03911; text overlap with arXiv:1002.4275, arXiv:1412.3811 by other
  authors",,,,"hep-ph hep-th","http://arxiv.org/licenses/nonexclusive-distrib/1.0/","  In the present paper we develop a model of the Higgs inflation based on the
non-minimal coupling of the Higgs boson to gravity predicted by Graviweak
Unification. But later we get rid of the non-minimal coupling to gravity by
making the conformal transformation from the Jordan frame to the Einstein
frame. We construct a self-consistent $Spin(4,4)$-invariant model of the
unification of gravity with weak $SU(2)$ interactions in the assumption of the
existence of visible and invisible sectors of the Universe. Assuming the
interaction between the ordinary and mirror Higgs fields, we develop a special
Hybrid model of inflation. According to this model, the inflaton starts trapped
from the ""false vacuum"" of the Universe at the Higgs field VEV $v\sim 10^{18}$
GeV (in the visible world). Then the inflations of the two Higgs doublet
fields, visible $\phi$ and mirror $\phi'$, lead to the emergence of the
Standard Model vacua at the Electroweak scales with the Higgs boson VEVs
$v_1\approx 246$ GeV and $v'_1=\zeta v_1$ in the visible and invisible worlds,
respectively. Considering the results of cosmology and calculating the number
of e-folds $N^*$, we predict $\zeta\simeq 100-115$ for $N^*\simeq 50-60$, in
agreement with previous results of the model with broken mirror parity. We also
consider RGEs, taking into account the mixing term - the interaction between
the ordinary and mirror Higgs bosons, assuming the smallness of the mixing
coupling.
","[{""version"":""v1"",""created"":""Sun, 28 Jun 2015 06:53:47 GMT""},{""version"":""v2"",""created"":""Sat, 10 Oct 2015 11:56:58 GMT""},{""version"":""v3"",""created"":""Thu, 7 Jan 2016 10:02:14 GMT""}]","2016-01-08"
"1506.08367","Anar Akhmedov","Anar Akhmedov, and Weiyi Zhang","The fundamental group of symplectic $4$-manifolds with $b^+=1$","34 pages, 6 figures. In this version, we revised the paper according
  to the comments and suggestions of the reviewers. Comments are welcome",,,,"math.GT math.AG math.SG","http://arxiv.org/licenses/nonexclusive-distrib/1.0/","  In this article we apply the technique of Luttinger surgery to study the
complexity of the fundamental group of symplectic $4$-manifolds with
holomorphic Euler number $\chi_h=1$. We discuss the topology of symplectic
$4$-manifolds with $b^+=1$ and provide various constructions of symplectic
$4$-manifolds with $b^+=1$ and prescribed $c_1^2$.
","[{""version"":""v1"",""created"":""Sun, 28 Jun 2015 07:05:42 GMT""},{""version"":""v2"",""created"":""Mon, 7 Sep 2015 03:28:20 GMT""}]","2015-09-08"
"1506.08368","Hong-Guang Duan","Hong-Guang Duan, Arend G. Dijkstra, Peter Nalbach and Michael Thorwart","An efficient tool to calculate two-dimensional optical spectra for
  photoactive molecular complexes",,,"10.1103/PhysRevE.92.042708",,"physics.chem-ph cond-mat.soft quant-ph","http://arxiv.org/licenses/nonexclusive-distrib/1.0/","  We combine the coherent modified Redfield theory (CMRT) with the equation of
motion-phase matching approach (PMA) to calculate two-dimensional photon echo
spectra for photoactive molecular complexes with an intermediate strength of
the coupling to their environment. Both techniques are highly efficient, yet
they involve approximations at different levels. By explicitly comparing with
the numerically exact quasi-adiabatic path integral approach, we show for the
Fenna-Matthews-Olson complex that the CMRT describes the decay rates in the
population dynamics well, but final stationary populations and the oscillation
frequencies differ slightly. In addition, we use the combined CMRT+PMA to
calculate two-dimensional photon-echo spectra for a simple dimer model. We find
excellent agreement with the exact path integral calculations at short waiting
times where the dynamics is still coherent. For long waiting times, differences
occur due to different final stationary states, specifically for strong
system-bath coupling. For weak to intermediate system-bath couplings, which is
most important for natural photosynthetic complexes, the combined CMRT+PMA
gives reasonable results with acceptable computational efforts.
","[{""version"":""v1"",""created"":""Sun, 28 Jun 2015 07:06:09 GMT""}]","2015-10-28"
"1506.08369","Zakhar Kabluchko","Zakhar Kabluchko and Mikhail Lifshits","Least Energy Approximation for Processes with Stationary Increments","29 pages, 1 figure","J. Theor. Probab., 2017, 30, no. 1, 268--296",,,"math.PR math.OC","http://arxiv.org/licenses/nonexclusive-distrib/1.0/","  A function $f=f_T$ is called least energy approximation to a function $B$ on
the interval $[0,T]$ with penalty $Q$ if it solves the variational problem $$
\int_0^T \left[ f'(t)^2 + Q(f(t)-B(t)) \right] dt \searrow \min. $$ For
quadratic penalty the least energy approximation can be found explicitly. If
$B$ is a random process with stationary increments, then on large intervals
$f_T$ also is close to a process of the same class and the relation between the
corresponding spectral measures can be found. We show that in a long run (when
$T\to \infty$) the expectation of energy of optimal approximation per unit of
time converges to some limit which we compute explicitly. For Gaussian and
L\'evy processes we complete this result with almost sure and $L^1$
convergence. As an example, the asymptotic expression of approximation energy
is found for fractional Brownian motion.
","[{""version"":""v1"",""created"":""Sun, 28 Jun 2015 07:14:00 GMT""}]","2019-07-04"
"1506.08370","Ido Tal","Ido Tal","On the Construction of Polar Codes for Channels with Moderate Input
  Alphabet Sizes","9 pages",,,,"cs.IT math.IT","http://arxiv.org/licenses/nonexclusive-distrib/1.0/","  Current deterministic algorithms for the construction of polar codes can only
be argued to be practical for channels with small input alphabet sizes. In this
paper, we show that any construction algorithm for channels with moderate input
alphabet size which follows the paradigm of ""degrading after each polarization
step"" will inherently be impractical with respect to a certain ""hard""
underlying channel. This result also sheds light on why the construction of
LDPC codes using density evolution is impractical for channels with moderate
sized input alphabets.
","[{""version"":""v1"",""created"":""Sun, 28 Jun 2015 07:34:53 GMT""}]","2015-06-30"
"1506.08371","Taikan Suehara","Taikan Suehara, Tomohiko Tanabe","LCFIPlus: A Framework for Jet Analysis in Linear Collider Studies","12 pages, 2 figures","Nucl.Instrum.Meth. A808 (2016), 109-116","10.1016/j.nima.2015.11.054",,"physics.ins-det hep-ex","http://arxiv.org/licenses/nonexclusive-distrib/1.0/","  We report on the progress in flavor identification tools developed for a
future $e^+e^-$ linear collider such as the International Linear Collider (ILC)
and Compact Linear Collider (CLIC). Building on the work carried out by the
LCFIVertex collaboration, we employ new strategies in vertex finding and jet
finding, and introduce new discriminating variables for jet flavor
identification. We present the performance of the new algorithms in the
conditions simulated using a detector concept designed for the ILC. The
algorithms have been successfully used in ILC physics simulation studies, such
as those presented in the ILC Technical Design Report.
","[{""version"":""v1"",""created"":""Sun, 28 Jun 2015 07:46:07 GMT""}]","2018-04-16"
"1506.08372","Miaomiao Zhang","Miaomiao Zhang, Min Fang, Hongchi Wang, Jia Sun, Min Wang, Zhibo Jiang
  and Sumedh Anathpindika","A deep near-infrared survey toward the Aquila molecular cloud - I.
  Molecular hydrogen outflows","77 pages, 2 tables, 53 figures, accepted by ApJS",,"10.1088/0067-0049/219/2/21",,"astro-ph.SR","http://arxiv.org/licenses/nonexclusive-distrib/1.0/","  We have performed an unbiased deep near-infrared survey toward the Aquila
molecular cloud with a sky coverage of ~1 deg2. We identified 45 molecular
hydrogen emission-line objects(MHOs), of which only 11 were previously known.
Using the Spitzer archival data we also identified 802 young stellar objects
(YSOs) in this region. Based on the morphology and the location of MHOs and YSO
candidates, we associate 43 MHOs with 40 YSO candidates. The distribution of
jet length shows an exponential decrease in the number of outflows with
increasing length and the molecular hydrogen outflows seem to be oriented
randomly. Moreover, there is no obvious correlation between jet lengths, jet
opening angles, or jet H2 1-0 S(1) luminosities and spectral indices of the
possible driving sources in this region. We also suggest that molecular
hydrogen outflows in the Aquila molecular cloud are rather weak sources of
turbulence, unlikely to generate the observed velocity dispersion in the region
of survey.
","[{""version"":""v1"",""created"":""Sun, 28 Jun 2015 08:00:51 GMT""}]","2015-08-19"
"1506.08373","Soumi Roy Chowdhury","Soumi Roy Chowdhury and Ranjan Chaudhury","Investigation of fermionic pairing on two- dimensional tight binding
  lattice under phonon and electronic mechanisms within a simple Fermi liquid
  like scenario and beyond- possible consequences for superconductivity in
  overdoped cuprates",,,,,"cond-mat.supr-con","http://arxiv.org/licenses/nonexclusive-distrib/1.0/","  Cooper's one pair problem is investigated for a 2D lattice in the background
of both passive and active Fermi sea in a weakly correlated environment. Boson
exchange mechanisms involving excitons as well as phonons are invoked for
pairing in the s- wave channel. The important quantities calculated are pairing
energy and coherence length as functions of bosonic energy, attracted coupling
constant and band filling factor. Comparison of our theoretical results with
those from experiments on overdoped cuprate superconductors and other type of
theoretical calculations show electronic mechanism to be the more likely
mechanism of pairing in the overdoped phase.
","[{""version"":""v1"",""created"":""Sun, 28 Jun 2015 08:25:37 GMT""},{""version"":""v2"",""created"":""Mon, 14 Sep 2015 08:01:29 GMT""},{""version"":""v3"",""created"":""Mon, 11 Apr 2016 15:49:19 GMT""}]","2016-04-12"
"1506.08374","Ebin Bastola","Ebin Bastola","The catalytic activity of gold/cadmium sulfide (Au/CdS) nanocrystals","46 pages",,,,"cond-mat.mtrl-sci","http://arxiv.org/licenses/nonexclusive-distrib/1.0/","  Semiconductor nanocrystals (NCs) are the building blocks for the future
opto-electronic devices, and other energy-harvesting applications. Although the
energy demand has been increasing, energy sources are diminishing. Hydrogen,
green energy source, is used in space shuttles and other transportation means.
The hydrogen production using semiconductors such as TiO2 suffers from several
limitations, and hence, alterative techniques for hydrogen production are
desired. Recently, photocatalysis using different nanostructures has been
studied.1-6 In this project, we have studied the catalytic activity of
gold/cadmium sulphide (Au/CdS) NCs to reduce protons into hydrogen
qualitatively. The Au/CdS NCs absorb a large amount of visible photons due to
plasmon resonance and create electron-hole pairs. The excited electrons migrate
to the catalysts, and the protons are reduced while the ligands on the surface
of NCs scavenge holes. Thus, photocatalysis occurs due to the energy transfer
from metal to semiconductor materials. The hydrogen production using Au/CdS
metal semiconductor NCs is more efficient than that of using CdS semiconductor
NCs.
","[{""version"":""v1"",""created"":""Sun, 28 Jun 2015 08:32:00 GMT""}]","2015-06-30"
"1506.08375","Guilhem Gamard","Guilhem Gamard and Gwena\""el Richomme","Comparison of Coverability and Multi-Scale Coverability in One and Two
  Dimensions",,,,,"cs.DM math.CO","http://arxiv.org/licenses/nonexclusive-distrib/1.0/","  A word is quasiperiodic (or coverable) if it can be covered with occurrences
of another finite word, called its quasiperiod. A word is multi-scale
quasiperiodic (or multi-scale coverable) if it has infinitely many different
quasiperiods. These notions were previously studied in the domains of text
algorithms and combinatorics of right infinite words.
  We extend them to infinite pictures (two-dimensional words). Then we compare
the regularity properties (uniform recurrence, uniform frequencies, topological
entropy) of quasiperiodicity with multi-scale quasiperiodicity, and we also
compare each of them with its one-dimensional counterpart.
  We also study which properties of quasiperiods enforce properties on the
quasiperiodic words.
","[{""version"":""v1"",""created"":""Sun, 28 Jun 2015 08:37:53 GMT""}]","2015-06-30"
"1506.08376","Alborz Azarang","Alborz Azarang","A one-line undergraduate proof of Zariski's lemma and Hilbert's
  nullstellensatz","2 page",,,,"math.AC","http://arxiv.org/licenses/nonexclusive-distrib/1.0/","  We give an undergraduate short and simple proof for Zariski's lemma.
","[{""version"":""v1"",""created"":""Sun, 28 Jun 2015 08:43:43 GMT""}]","2015-06-30"
