"1501.00969","Kirill Belashchenko","K. D. Belashchenko, Jeevaka Weerasinghe, Sai Mu, and B. S. Pujari","Spectral signatures of thermal spin disorder and excess Mn in
  half-metallic NiMnSb","5 pages, 7 figures, updated version with minor revisions and an
  additional figure, accepted in Phys. Rev. B (Rapid Communication)","Phys. Rev. B 91, 180408 (2015)","10.1103/PhysRevB.91.180408",,"cond-mat.mtrl-sci","http://arxiv.org/licenses/nonexclusive-distrib/1.0/","  Effects of thermal spin disorder and excess Mn on the electronic spectrum of
half-metallic NiMnSb are studied using first-principles calculations.
Temperature-dependent spin disorder, introduced within the vector disordered
local moment model, causes the valence band at the $\Gamma$ point to broaden
and shift upwards, crossing the Fermi level and thereby closing the
half-metallic gap above room temperature. The spectroscopic signatures of
excess Mn on the Ni, Sb, and empty sites (Mn$_\mathrm{Ni}$, Mn$_\mathrm{Sb}$,
and Mn$_\mathrm{E}$) are analyzed. Mn$_\mathrm{Ni}$ is spectroscopically
invisible. The relatively weak coupling of Mn$_\mathrm{Sb}$ and Mn$_\mathrm{E}$
spins to the host strongly deviates from the Heisenberg model, and the spin of
Mn$_\mathrm{E}$ is canted in the ground state. While the half-metallic gap is
preserved in the collinear ground state of Mn$_\mathrm{Sb}$, thermal spin
disorder of the weakly coupled Mn$_\mathrm{Sb}$ spins destroys it at low
temperatures. This property of Mn$_\mathrm{Sb}$ may be the source of the
observed low-temperature transport anomalies.
","[{""version"":""v1"",""created"":""Mon, 5 Jan 2015 20:43:29 GMT""},{""version"":""v2"",""created"":""Thu, 30 Apr 2015 19:31:39 GMT""}]","2015-06-03"
"1501.00970","Heidi Fearn Prof","H. Fearn","A delayed choice quantum eraser explained by the transactional
  interpretation of quantum mechanics","24 pages 4 figures, fifth draft",,"10.1007/s10701-015-9956-8",,"quant-ph","http://arxiv.org/licenses/nonexclusive-distrib/1.0/","  This paper explains the delayed choice quantum eraser of Kim et al. in terms
of the transactional interpretation of quantum mechanics by John Cramer. It is
kept deliberately mathematically simple to help explain the transactional
technique. The emphasis is on a clear understanding of how the instantaneous
""collapse"" of the wave function due to a measurement at a specific time and
place may be reinterpreted as a gradual collapse over the entire path of the
photon and over the entire transit time from slit to detector. This is made
possible by the use of a retarded offer wave, which is thought to travel from
the slits (or rather the small region within the parametric crystal where
down-conversion takes place) to the detector and an advanced counter wave
traveling backward in time from the detector to the slits. The point here is to
make clear how simple the Cramer transactional picture is and how much more
intuitive the collapse of the wave function becomes if viewed in this way. Also
any confusion about possible retro-causal signaling is put to rest. A delayed
choice quantum eraser does not require any sort of backward in time
communication. This paper makes the point that it is preferable to use the
Transactional Interpretation (TI) over the usual Copenhagen Interpretation (CI)
for a more intuitive understanding of the quantum eraser delayed choice
experiment. Both methods give exactly the same end results and can be used
interchangeably.
","[{""version"":""v1"",""created"":""Mon, 5 Jan 2015 20:46:07 GMT""},{""version"":""v2"",""created"":""Thu, 8 Jan 2015 00:33:25 GMT""},{""version"":""v3"",""created"":""Fri, 9 Jan 2015 23:08:58 GMT""},{""version"":""v4"",""created"":""Wed, 22 Jul 2015 20:38:12 GMT""},{""version"":""v5"",""created"":""Wed, 9 Sep 2015 21:45:13 GMT""}]","2016-02-17"
"1501.00971","Colin Defant","Colin Defant","An Arithmetic Function Arising from the Dedekind $\psi$ Function","13 pages, 0 figures",,,,"math.NT","http://arxiv.org/licenses/nonexclusive-distrib/1.0/","  We define $\overline{\psi}$ to be the multiplicative arithemtic function that
satisfies \[\overline{\psi}(p^{\alpha})=\begin{cases} p^{\alpha-1}(p+1), &
\mbox{if } p\neq 2; \\ p^{\alpha-1}, & \mbox{if } p=2 \end{cases}\] for all
primes $p$ and positive integers $\alpha$. Let $\lambda(n)$ be the number of
iterations of the function $\overline{\psi}$ needed for $n$ to reach $2$. It
follows from a theorem due to White that $\lambda$ is additive. Following
Shapiro's work on the iterated $\varphi$ function, we determine bounds for
$\lambda$. We also use the function $\lambda$ to partition the set of positive
integers into three sets $S_1,S_2,S_3$ and determine some properties of these
sets.
","[{""version"":""v1"",""created"":""Mon, 5 Jan 2015 20:52:44 GMT""},{""version"":""v2"",""created"":""Wed, 7 Jan 2015 20:29:24 GMT""}]","2015-01-08"
"1501.00972","Amitai Yuval","Jake P. Solomon and Amitai M. Yuval","Geodesics of positive Lagrangians in Milnor fibers","38 pages; added references and background, improved exposition, fixed
  minor errors","Int. Math. Res. Notices 2017 (2016), no. 3, 830-868","10.1093/imrn/rnw052",,"math.SG math.DG","http://arxiv.org/licenses/nonexclusive-distrib/1.0/","  The space of positive Lagrangians in an almost Calabi-Yau manifold is an open
set in the space of all Lagrangian submanifolds. A Hamiltonian isotopy class of
positive Lagrangians admits a natural Riemannian metric $\Upsilon$, which gives
rise to a notion of geodesics. We study geodesics of positive $O_n(\mathbb{R})$
invariant Lagrangian spheres in $n$-dimensional $A_m$ Milnor fibers. We show
the existence and uniqueness of smooth solutions to the initial value problem
and the boundary value problem. In particular, we obtain examples of smooth
geodesics of positive Lagrangians in arbitrary dimension. As an application, we
show that the Riemannian metric $\Upsilon$ induces a metric space structure on
the space of positive $O_n(\mathbb{R})$ invariant Lagrangian spheres in the
above mentioned Milnor fibers.
","[{""version"":""v1"",""created"":""Mon, 5 Jan 2015 20:56:08 GMT""},{""version"":""v2"",""created"":""Wed, 25 Feb 2015 07:32:40 GMT""},{""version"":""v3"",""created"":""Wed, 25 May 2016 14:07:13 GMT""}]","2017-02-10"
"1501.00973","Sarira Sahu","Sarira Sahu, Luis Salvador Miranda and Subhash Rajpoot","Multi-TeV flaring from blazars: Markarian 421 a case study","8 pages, two columns, 3 figures","Eur. Phys. J. C 76, 127 (2016)","10.1140/epjc/s10052-016-3975-2",,"astro-ph.HE","http://arxiv.org/licenses/nonexclusive-distrib/1.0/","  The TeV blazar Markarian 421 underwent multi-TeV flaring during April 2004
and simultaneously observed in x-ray and TeV energies. It was observed that the
TeV outbursts had no counterparts in the lower energies, which implies that
this might be an orphan flare. In the context of hadronic model, we have shown
that this multi-TeV flaring can be produced due to the interaction of
Fermi-accelerated protons of energy $\lesssim 168$ TeV with the background
photons in the low energy tail of the synchrotron self-Compton spectrum of the
blazar jet. We fit very well the flaring spectrum with this model. Based on
this study, we speculate that Mrk 501 and PG 1553+113 are possible candidates
for orphan flaring in the future.
","[{""version"":""v1"",""created"":""Mon, 5 Jan 2015 20:56:10 GMT""},{""version"":""v2"",""created"":""Fri, 7 Oct 2016 19:23:07 GMT""}]","2016-10-10"
"1501.00976","Zaaloul Abdellah","Zaaloul Abdellah, Haqiq Abdelkrim","Enhanced Slotted Aloha Mechanism by Introducing ZigZag Decoding","11 pages, 10 figures in Journal of mathematics and computer science
  2014. arXiv admin note: substantial text overlap with arXiv:1501.00881",,,,"cs.IT cs.NI math.IT","http://arxiv.org/licenses/nonexclusive-distrib/1.0/","  Various random access mechanisms, such as Aloha protocol and its
corresponding variants have been widely studied as efficient methods to
coordinate the medium access among competing users. But when two or more
wireless users transmit packets at the same time over the same channel a
collisions occur. When this happens, the received packets are discarded and
retransmissions are required, which is a waste of power and bandwidth. In such
a situation one of the most important objectives is to find techniques to
improve these protocols to reduce the number of collisions or to avoid them.
Several studies have contributed to this problem. In this paper, we propose a
new approach named ZigZag decoding to enhance slotted Aloha mechanism by
reducing the loss rate of packets colliding. We model the system by a Markov
chain witch the number of backlogged packets is taken as the system state. We
use a stochastic game to achieve our objective. We evaluate and compare the
performances parameters of the proposed approach with those of slotted Aloha
mechanism. All found results show that our approach is more efficient than the
slotted Aloha mechanism.
","[{""version"":""v1"",""created"":""Mon, 5 Jan 2015 17:08:45 GMT""}]","2015-01-07"
"1501.00977","Vitor Cardoso","Vitor Cardoso, Gaurav Khanna","Black holes in anti-de Sitter: quasinormal modes, tails and tales of
  flat spacetime","6 pages, RevTex4. Accepted for publication in Physical Review D. v2:
  References added",,"10.1103/PhysRevD.91.024031",,"gr-qc hep-ph hep-th","http://arxiv.org/licenses/nonexclusive-distrib/1.0/","  Black holes in asymptotically anti-de Sitter (AdS) spacetimes have been the
subject of intense scrutiny, including detailed frequency-domain analysis and
full nonlinear evolutions. Remarkably, studies of linearized perturbations in
the time-domain are scarce or non-existing. We close this gap by evolving
linearized scalar wavepackets in the background of rotating BHs in AdS
spacetimes. Our results show a number of interesting features. Small BHs in AdS
behave as asymptotically flat BHs for early/intermediate times, displaying the
same ringdown modes and power-law tails. As the field bounces back and forth
between the horizon and the timelike boundary it ""thermalizes"" and the modes of
AdS settle in. Finally, we have indications that wavepackets in the vicinity of
fastly spinning BHs grow exponentially in time, signalling a superradiant
instability of the geometry previously reported through a frequency-domain
analysis.
","[{""version"":""v1"",""created"":""Mon, 5 Jan 2015 21:00:09 GMT""},{""version"":""v2"",""created"":""Thu, 8 Jan 2015 15:20:11 GMT""}]","2015-06-23"
"1501.00978","Subir Sachdev","Matthias Punk, Andrea Allais, and Subir Sachdev","A quantum dimer model for the pseudogap metal","9+10 pages, 17 figures","Proceedings of the National Academy of Sciences 112, 9552 (2015)","10.1073/pnas.1512206112",,"cond-mat.str-el hep-th","http://arxiv.org/licenses/nonexclusive-distrib/1.0/","  We propose a quantum dimer model for the metallic state of the hole-doped
cuprates at low hole density, $p$. The Hilbert space is spanned by spinless,
neutral, bosonic dimers and spin $S=1/2$, charge $+e$ fermionic dimers. The
model realizes a `fractionalized Fermi liquid' with no symmetry-breaking and
small hole pocket Fermi surfaces enclosing a total area determined by $p$.
Exact diagonalization, on lattices of sizes up to $8 \times 8$, shows
anisotropic quasiparticle residue around the pocket Fermi surfaces. We discuss
the relationship to experiments.
","[{""version"":""v1"",""created"":""Mon, 5 Jan 2015 21:00:09 GMT""},{""version"":""v2"",""created"":""Sun, 5 Jul 2015 10:55:02 GMT""}]","2015-11-24"
"1501.00979","Ching-Kit Chan","Ching-Kit Chan, Tony E. Lee, Sarang Gopalakrishnan","Limit cycle phase in driven-dissipative spin systems","9 pages, 6 figures","Phys. Rev. A 91, 051601 (2015)","10.1103/PhysRevA.91.051601",,"cond-mat.quant-gas nlin.PS quant-ph","http://arxiv.org/licenses/nonexclusive-distrib/1.0/","  We explore the phase diagram of interacting spin-$1/2$ systems in the
presence of anisotropic interactions, spontaneous decay and driving. We find a
rich phase diagram featuring a limit cycle phase in which the magnetization
oscillates in time. We analyze the spatio-temporal fluctuations of this limit
cycle phase at the Gaussian level, and show that spatial fluctuations lead to
quasi-long-range limit cycle ordering for dimension $d = 2$. This result can be
interpreted in terms of a spatio-temporal Goldstone mode corresponding to phase
fluctuations of the limit cycle. We also demonstrate that the limit-cycle phase
exhibits an asymmetric power spectrum measurable in fluorescence experiments.
","[{""version"":""v1"",""created"":""Mon, 5 Jan 2015 21:00:09 GMT""}]","2015-05-20"
"1501.00980","Hanno Rein","Hanno Rein","Reanalysis of radial velocity data from the resonant planetary system
  HD128311","4 pages, 2 figures, accepted by MNRAS Letters",,"10.1093/mnrasl/slu202",,"astro-ph.EP astro-ph.IM astro-ph.SR","http://arxiv.org/licenses/nonexclusive-distrib/1.0/","  The multi-planetary system HD128311 hosts at least two planets. Its dynamical
formation history has been studied extensively in the literature. We reanalyse
the latest radial velocity data for this system with the affine-invariant
Markov chain Monte Carlo sampler EMCEE. Using the high order integrator IAS15,
we perform a fully dynamical fit, allowing the planets to interact during the
sampling process. A stability analysis using the MEGNO indicator reveals that
the system is located in a stable island of the parameter space. In contrast to
a previous study, we find that the system is locked in a 2:1 mean motion
resonance. The resonant angle $\varphi_1$ is librating with a libration
amplitude of approximately 37{\deg}. The existence of mean motion resonances
has important implication for planet formation theories. Our results confirm
predictions of models involving planet migration and stochastic forces.
","[{""version"":""v1"",""created"":""Mon, 5 Jan 2015 21:00:12 GMT""}]","2015-01-16"
"1501.00981","Heidi Korhonen","H. Korhonen (FINCA, NBI, StarPlan), J. M. Andersen (Boston, StarPlan),
  N. Piskunov (Uppsala), T. Hackman (Helsinki), D. Juncher (NBI, StarPlan), S.
  P. Jarvinen (AIP), and U. G. Joergensen (NBI, StarPlan)","Stellar activity as noise in exoplanet detection I. Methods and
  application to solar-like stars and activity cycles","Accepted to MNRAS",,"10.1093/mnras/stu2730",,"astro-ph.EP","http://arxiv.org/licenses/nonexclusive-distrib/1.0/","  The detection of exoplanets using any method is prone to confusion due to the
intrinsic variability of the host star. We investigate the effect of cool
starspots on the detectability of the exoplanets around solar-like stars using
the radial velocity method. For investigating this activity-caused ""jitter"" we
calculate synthetic spectra using radiative transfer, known stellar atomic and
molecular lines, different surface spot configurations, and an added planetary
signal. Here, the methods are described in detail, tested and compared to
previously published studies. The methods are also applied to investigate the
activity jitter in old and young solar-like stars, and over a solar-like
activity cycles. We find that the mean full jitter amplitude obtained from the
spot surfaces mimicking the solar activity varies during the cycle
approximately between 1 m/s and 9 m/s. With a realistic observing frequency a
Neptune mass planet on a one year orbit can be reliably recovered. On the other
hand, the recovery of an Earth mass planet on a similar orbit is not feasible
with high significance. The methods developed in this study have a great
potential for doing statistical studies of planet detectability, and also for
investigating the effect of stellar activity on recovered planetary parameters.
","[{""version"":""v1"",""created"":""Mon, 5 Jan 2015 21:00:12 GMT""}]","2015-06-23"
"1501.00982","Jianfeng Wu","Jianfeng Wu, Jerome A. Orosz, Jeffrey E. McClintock, Danny Steeghs,
  Penelope Longa-Pena, Paul J. Callanan, Lijun Gou, Luis C. Ho, Peter G.
  Jonker, Mark T. Reynolds, Manuel A. P. Torres","A Dynamical Study of the Black Hole X-ray Binary Nova Muscae 1991","ApJ accepted version; minor revision; added a subsection about
  systematic uncertainties","2015ApJ...806...92W","10.1088/0004-637X/806/1/92",,"astro-ph.HE astro-ph.SR","http://arxiv.org/licenses/nonexclusive-distrib/1.0/","  We present a dynamical study of the Galactic black hole binary system Nova
Muscae 1991 (GS/GRS 1124-683). We utilize 72 high resolution Magellan
Echellette (MagE) spectra and 72 strictly simultaneous V-band photometric
observations; the simultaneity is a unique and crucial feature of this
dynamical study. The data were taken on two consecutive nights and cover the
full 10.4-hour orbital cycle. The radial velocities of the secondary star are
determined by cross-correlating the object spectra with the best-match template
spectrum obtained using the same instrument configuration. Based on our
independent analysis of five orders of the echellette spectrum, the
semi-amplitude of the radial velocity of the secondary is measured to be K_2 =
406.8+/-2.7 km/s, which is consistent with previous work, while the uncertainty
is reduced by a factor of 3. The corresponding mass function is f(M) =
3.02+/-0.06 M_\odot. We have also obtained an accurate measurement of the
rotational broadening of the stellar absorption lines (v sin i = 85.0+/-2.6
km/s) and hence the mass ratio of the system q = 0.079+/-0.007. Finally, we
have measured the spectrum of the non-stellar component of emission that veils
the spectrum of the secondary. In a future paper, we will use our
veiling-corrected spectrum of the secondary and accurate values of K_2 and q to
model multi-color light curves and determine the systemic inclination and the
mass of the black hole.
","[{""version"":""v1"",""created"":""Mon, 5 Jan 2015 21:00:13 GMT""},{""version"":""v2"",""created"":""Sat, 18 Apr 2015 03:35:24 GMT""},{""version"":""v3"",""created"":""Thu, 31 Dec 2015 23:07:51 GMT""}]","2016-01-05"
"1501.00983","Decker French","K. Decker French (1), Yujin Yang (2), Ann Zabludoff (1), Desika
  Narayanan (1,3), Yancy Shirley (1), Fabian Walter (4), John-David Smith (5),
  Christy A. Tremonti (6) ((1) Steward Observatory, University of Arizona, (2)
  Argelander-Institut f\""ur Astronomie, Universit\""at Bonn, (3) Haverford
  College, (4) Max-Planck-Institut f\""ur Astronomie, (5) University of Toledo,
  (6) University of Wisconsin- Madison)","Discovery of Large Molecular Gas Reservoirs in Post-Starburst Galaxies","Accepted to ApJ",,"10.1088/0004-637X/801/1/1",,"astro-ph.GA","http://arxiv.org/licenses/nonexclusive-distrib/1.0/","  Post-starburst (or ""E+A"") galaxies are characterized by low H$\alpha$
emission and strong Balmer absorption, suggesting a recent starburst, but
little current star formation. Although many of these galaxies show evidence of
recent mergers, the mechanism for ending the starburst is not yet understood.
To study the fate of the molecular gas, we search for CO (1-0) and (2-1)
emission with the IRAM 30m and SMT 10m telescopes in 32 nearby ($0.01<z<0.12$)
post-starburst galaxies drawn from the Sloan Digital Sky Survey. We detect CO
in 17 (53%). Using CO as a tracer for molecular hydrogen, and a Galactic
conversion factor, we obtain molecular gas masses of
$M(H_2)=10^{8.6}$-$10^{9.8} M_\odot$ and molecular gas mass to stellar mass
fractions of $\sim10^{-2}$-$10^{-0.5}$, comparable to those of star-forming
galaxies. The large amounts of molecular gas rule out complete gas consumption,
expulsion, or starvation as the primary mechanism that ends the starburst in
these galaxies. The upper limits on $M(H_2)$ for the 15 undetected galaxies
range from $10^{7.7} M_\odot$ to $10^{9.7} M_\odot$, with the median more
consistent with early-type galaxies than with star-forming galaxies. Upper
limits on the post-starburst star formation rates (SFRs) are lower by
$\sim10\times$ than for star-forming galaxies with the same $M(H_2)$. We also
compare the molecular gas surface densities ($\Sigma_{\rm H_2}$) to upper
limits on the SFR surface densities ($\Sigma_{\rm SFR}$), finding a significant
offset, with lower $\Sigma_{\rm SFR}$ for a given $\Sigma_{\rm H_2}$ than is
typical for star-forming galaxies. This offset from the Kennicutt-Schmidt
relation suggests that post-starbursts have lower star formation efficiency, a
low CO-to-H$_2$ conversion factor characteristic of ULIRGs, and/or a
bottom-heavy initial mass function, although uncertainties in the rate and
distribution of current star formation remain.
","[{""version"":""v1"",""created"":""Mon, 5 Jan 2015 21:00:13 GMT""}]","2015-03-09"
"1501.00984","Richard Teague","Richard Teague, Dmitry Semenov, Stephane Guilloteau, Thomas Henning,
  Anne Dutrey, Valentine Wakelam, Edwige Chapillon and Vincent Pietu","Chemistry in Disks. IX. Observations and modeling of HCO+ and DCO+ in DM
  Tau","13 pages with 8 figures, to be published in A&A, accepted 29/12/14","A&A 574, A137 (2015)","10.1051/0004-6361/201425268",,"astro-ph.EP","http://arxiv.org/licenses/nonexclusive-distrib/1.0/","  We present resolved Plateau de Bure Array observations of DM Tau in lines of
HCO+ (3-2), (1-0) and DCO+ (3-2). A power-law fitting approach allowed a
derivation of column densities of these two molecules. A chemical inner hole of
~50 AU was found in both HCO+ and DCO+ with DCO+ emission extending to only 450
AU. An isotopic ratio of R_D = N(DCO+) / N(HCO+) was found to range from 0.1 at
50 AU and 0.2 at 450 AU. Chemical modeling allowed an exploration of the
sensitivity of these molecular abundances to physical parameters out with
temperature, finding that X-rays were the domination ionization source in the
HCO+ molecular region and that R_D also is sensitive to the CO depletion. The
ionization fraction, assuming a steady state system, was found to be x(e-) ~
10$^{-7}$. Modeling suggests that HCO+ is the dominant charged molecule in the
disk but its contribution to ionization fraction is dwarfed by atmoic ions such
as C+, S+ and H+.
","[{""version"":""v1"",""created"":""Mon, 5 Jan 2015 21:00:13 GMT""}]","2015-02-11"
"1501.00985","Sumanta Tewari","Eugene Dumitrescu, Girish Sharma, Jay D. Sau, and Sumanta Tewari","Equivalence of topological mirror and chiral superconductivity in one
  dimension","5+ pages, 1 figure","Phys. Rev. B 92, 045421 (2015)","10.1103/PhysRevB.92.045421",,"cond-mat.mes-hall","http://arxiv.org/licenses/nonexclusive-distrib/1.0/","  Recently it has been proposed that a unitary topological mirror symmetry can
stabilize multiple zero energy Majorana fermion modes in one dimensional (1D)
time reversal (TR) invariant topological superconductors. Here we establish an
exact equivalence between 1D ""topological mirror superconductivity"" and chiral
topological superconductivity in BDI class which can also stabilize multiple
Majorana-Kramers pairs in 1D TR-invariant topological superconductors. The
equivalence proves that topological mirror superconductivity can be understood
as chiral superconductivity in the BDI symmetry class co-existing with
time-reversal symmetry. Furthermore, we show that the mirror Berry phase
coincides with the chiral winding invariant of the BDI symmetry class, which is
independent of the presence of the time-reversal symmetry. Thus, the
time-reversal invariant topological mirror superconducting state may be viewed
as a special case of the BDI symmetry class in the well-known Altland-Zirnbauer
periodic table of free fermionic phases. We illustrate the results with the
examples of 1D spin-orbit coupled quantum wires in the presence of nodeless
s_{\pm} superconductivity and the recently discussed experimental system of
ferromagnetic atom (Fe) chains embedded on a lead (Pb) superconductor.
","[{""version"":""v1"",""created"":""Mon, 5 Jan 2015 21:00:14 GMT""}]","2015-07-29"
"1501.00986","Lei Wang","Lei Wang, Mauro Iazzi, Philippe Corboz and Matthias Troyer","Efficient Continuous-time Quantum Monte Carlo Method for the Ground
  State of Correlated Fermions","12 pages, 1 table and 6 figures","Phys. Rev. B 91, 235151 (2015)","10.1103/PhysRevB.91.235151",,"cond-mat.str-el hep-lat physics.comp-ph","http://arxiv.org/licenses/nonexclusive-distrib/1.0/","  We present the ground state extension of the efficient quantum Monte Carlo
algorithm for lattice fermions of arXiv:1411.0683. Based on continuous-time
expansion of imaginary-time projection operator, the algorithm is free of
systematic error and scales \emph{linearly} with projection time and
interaction strength. Compared to the conventional quantum Monte Carlo methods
for lattice fermions, this approach has greater flexibility and is easier to
combine with powerful machinery such as histogram reweighting and extended
ensemble simulation techniques. We discuss the implementation of the
continuous-time projection in detail using the spinless $t-V$ model as an
example and compare the numerical results with exact diagonalization,
density-matrix-renormalization-group and infinite projected entangled-pair
states calculations. Finally we use the method to study the fermionic quantum
critical point of spinless fermions on a honeycomb lattice and confirm previous
results concerning its critical exponents.
","[{""version"":""v1"",""created"":""Mon, 5 Jan 2015 21:00:14 GMT""}]","2015-07-02"
