"1501.01061","Ryan Comes","Ryan B. Comes, Kerry Siebein, Jiwei Lu, and Stuart A. Wolf","Microstructural Effects of Chemical Island Templating in Patterned
  Matrix-Pillar Oxide Nanocomposites","9 pages, 8 figures; 5 pages supplement, 5 figures","CrystEngComm, 17, 2041-2049 (2015)","10.1039/C5CE00025D",,"cond-mat.mtrl-sci","http://arxiv.org/licenses/nonexclusive-distrib/1.0/","  The ability to pattern the location of pillars in epitaxial matrix-pillar
nanocomposites is a key challenge to develop future technologies using these
intriguing materials. One such model system employs a ferrimagnetic
CoFe$_{2}$O$_{4}$ (CFO) pillar embedded in a ferroelectric BiFeO$_{3}$ (BFO)
matrix, which has been proposed as a possible memory or logic system. These
composites self-assemble spontaneously with pillars forming through nucleation
at a random location when grown via physical vapor deposition. Recent results
have shown that if an island of the pillar material is pre-patterned on the
substrate, it is possible to control the nucleation process and determine the
locations where pillars form. In this work, we employ electron microscopy and
x-ray diffraction to examine the chemical composition and microstructure of
patterned CFO-BFO nanocomposites. Cross-sectional transmission electron
microscopy is used to examine the nucleation effects at the interface between
the template island and resulting pillar.Evidence of grain boundaries and
lattice tilting in the templated pillars is also presented and attributed to
the microstructure of the seed island.
","[{""version"":""v1"",""created"":""Tue, 6 Jan 2015 02:00:36 GMT""},{""version"":""v2"",""created"":""Sun, 25 Oct 2015 22:33:32 GMT""}]","2015-10-27"
"1501.01062","Ilya Razenshteyn","Alexandr Andoni, Ilya Razenshteyn","Optimal Data-Dependent Hashing for Approximate Near Neighbors","36 pages, 5 figures, an extended abstract appeared in the proceedings
  of the 47th ACM Symposium on Theory of Computing (STOC 2015)",,,,"cs.DS","http://arxiv.org/licenses/nonexclusive-distrib/1.0/","  We show an optimal data-dependent hashing scheme for the approximate near
neighbor problem. For an $n$-point data set in a $d$-dimensional space our data
structure achieves query time $O(d n^{\rho+o(1)})$ and space $O(n^{1+\rho+o(1)}
+ dn)$, where $\rho=\tfrac{1}{2c^2-1}$ for the Euclidean space and
approximation $c>1$. For the Hamming space, we obtain an exponent of
$\rho=\tfrac{1}{2c-1}$.
  Our result completes the direction set forth in [AINR14] who gave a
proof-of-concept that data-dependent hashing can outperform classical Locality
Sensitive Hashing (LSH). In contrast to [AINR14], the new bound is not only
optimal, but in fact improves over the best (optimal) LSH data structures
[IM98,AI06] for all approximation factors $c>1$.
  From the technical perspective, we proceed by decomposing an arbitrary
dataset into several subsets that are, in a certain sense, pseudo-random.
","[{""version"":""v1"",""created"":""Tue, 6 Jan 2015 02:21:59 GMT""},{""version"":""v2"",""created"":""Wed, 18 Mar 2015 04:12:39 GMT""},{""version"":""v3"",""created"":""Thu, 16 Jul 2015 03:37:53 GMT""}]","2015-07-17"
"1501.01063","A. Mainzer","A. Mainzer, T. Grav, J. Bauer, T. Conrow, R. M. Cutri, J. Dailey, J.
  Fowler, J. Giorgini, T. Jarrett, J. Masiero, T. Spahr, T. Statler, E. L.
  Wright","Survey Simulations of a New Near-Earth Asteroid Detection System","AJ accepted; corrected typo",,"10.1088/0004-6256/149/5/172",,"astro-ph.EP","http://arxiv.org/licenses/nonexclusive-distrib/1.0/","  We have carried out simulations to predict the performance of a new
space-based telescopic survey operating at thermal infrared wavelengths that
seeks to discover and characterize a large fraction of the potentially
hazardous near-Earth asteroid (NEA) population. Two potential architectures for
the survey were considered: one located at the Earth-Sun L1 Lagrange point, and
one in a Venus-trailing orbit. A sample cadence was formulated and tested,
allowing for the self-follow-up necessary for objects discovered in the daytime
sky on Earth. Synthetic populations of NEAs with sizes >=140 m in effective
spherical diameter were simulated using recent determinations of their physical
and orbital properties. Estimates of the instrumental sensitivity, integration
times, and slew speeds were included for both architectures assuming the
properties of new large-format 10 um detector arrays capable of operating at
~35 K. Our simulation included the creation of a preliminary version of a
moving object processing pipeline suitable for operating on the trial cadence.
We tested this pipeline on a simulated sky populated with astrophysical sources
such as stars and galaxies extrapolated from Spitzer and WISE data, the catalog
of known minor planets (including Main Belt asteroids, comets, Jovian Trojans,
etc.), and the synthetic NEA model. Trial orbits were computed for simulated
position-time pairs extracted from the synthetic surveys to verify that the
tested cadence would result in orbits suitable for recovering objects at a
later time. Our results indicate that the Earth-Sun L1 and Venus-trailing
surveys achieve similar levels of integral completeness for potentially
hazardous asteroids larger than 140 m; placing the telescope in an interior
orbit does not yield an improvement in discovery rates. This work serves as a
necessary first step for the detailed planning of a next-generation NEA survey.
","[{""version"":""v1"",""created"":""Tue, 6 Jan 2015 02:28:04 GMT""},{""version"":""v2"",""created"":""Fri, 9 Jan 2015 06:42:44 GMT""}]","2015-06-23"
"1501.01064","Khang Hoang","Khang Hoang, Keyur Desai, S. D. Mahanti","Charge ordering and self-assembled nanostructures in a fcc Coulomb
  lattice gas","5 pages, 6 figures","Phys. Rev. B 72, 064102 (2005)","10.1103/PhysRevB.72.064102",,"cond-mat.mtrl-sci","http://arxiv.org/licenses/nonexclusive-distrib/1.0/","  The compositional ordering of Ag, Pb, Sb, Te ions in
(AgSbTe$_{2}$)$_{x}$(PbTe)$_{2(1-x)}$ systems possessing a NaCl structure is
studied using a Coulomb lattice gas (CLG) model on a face-centered cubic (fcc)
lattice and Monte Carlo simulations. Our results show different possible
microstructural orderings. Ordered superlattice structures formed out of
AgSbTe$_{2}$ layers separated by Pb$_{2}$Te$_{2}$ layers are observed for a
large range of $x$ values. For $x=0.5$, we see an array of tubular structures
formed by AgSbTe$_{2}$ and Pb$_{2}$Te$_{2}$ blocks. For $x=1$, AgSbTe$_{2}$ has
a body-centered tetragonal (bct) structure which is in agreement with previous
Monte Carlo simulation results for restricted primitive model (RPM) at closed
packed density. The phase diagram of this frustrated CLG system is discussed.
","[{""version"":""v1"",""created"":""Tue, 6 Jan 2015 02:28:56 GMT""}]","2015-01-07"
"1501.01065","Ho Lee","Ho Lee","Low dimensional Born-Infeld equations coupled with a collisionless
  matter model",,,,,"math-ph math.MP","http://arxiv.org/licenses/nonexclusive-distrib/1.0/","  We consider the Born-Infeld nonlinear electromagnetic field equations and
study its Cauchy problem in the case that the Vlasov equation is considered as
a matter model. In the present paper, the Vlasov equation is considered on the
so-called one and one-half dimensional phase space, and in consequence the
Born-Infeld equations are reduced to a quasilinear hyperbolic system with two
unknowns. A transformation is introduced in order to make the field equations
easy to handle, and suitable assumptions are made on initial data so that the
nonlinearity of the field is controlled.
","[{""version"":""v1"",""created"":""Tue, 6 Jan 2015 02:29:33 GMT""}]","2015-01-07"
"1501.01066","Yasuhiko Tsue","Y.Tsue (Kochi Univ., Japan), C.Providencia (Univ de Coimbra,
  Portugal), J. da Providencia (Univ. de Coimbra, Portugal), M.Yamamura (Kansai
  Univ., Japan)","New boson realization of the Lipkin model obeying the su(2)-algebra","7 pages, no figure",,"10.1093/ptep/ptv069",,"nucl-th","http://arxiv.org/licenses/nonexclusive-distrib/1.0/","  New boson representation of the su(2)-algebra proposed by the present authors
for describing the damped and amplified oscillator is examined in the Lipkin
model as one of simple many-fermion models. This boson representation is
expressed in terms of two kinds of bosons with a certain positive parameter. In
order to describe the case of any fermion number, third boson is introduced.
Through this examination, it is concluded that this representation is well
workable for the boson realization of the Lipkin model in any fermion number.
","[{""version"":""v1"",""created"":""Tue, 6 Jan 2015 03:02:33 GMT""}]","2015-06-03"
"1501.01067","Keith Motes","Keith R. Motes, Jonathan P. Olson, Evan J. Rabeaux, Jonathan P.
  Dowling, S. Jay Olson, Peter P. Rohde","Linear Optical Quantum Metrology with Single Photons: Exploiting
  Spontaneously Generated Entanglement to Beat the Shot-Noise Limit","10 pages, 8 figures","Phys. Rev. Lett. 114, 170802 (2015)","10.1103/PhysRevLett.114.170802","LB14398","quant-ph","http://arxiv.org/licenses/nonexclusive-distrib/1.0/","  Quantum number-path entanglement is a resource for super-sensitive quantum
metrology and in particular provides for sub-shotnoise or even
Heisenberg-limited sensitivity. However, such number-path entanglement has
thought to have been resource intensive to create in the first place ---
typically requiring either very strong nonlinearities, or nondeterministic
preparation schemes with feed-forward, which are difficult to implement. Very
recently, arising from the study of quantum random walks with multi-photon
walkers, as well as the study of the computational complexity of passive linear
optical interferometers fed with single-photon inputs, it has been shown that
such passive linear optical devices generate a superexponentially large amount
of number-path entanglement. A logical question to ask is whether this
entanglement may be exploited for quantum metrology. We answer that question
here in the affirmative by showing that a simple, passive, linear-optical
interferometer --- fed with only uncorrelated, single-photon inputs, coupled
with simple, single-mode, disjoint photodetection --- is capable of
significantly beating the shotnoise limit. Our result implies a pathway forward
to practical quantum metrology with readily available technology.
","[{""version"":""v1"",""created"":""Tue, 6 Jan 2015 03:04:00 GMT""},{""version"":""v2"",""created"":""Mon, 4 May 2015 06:14:43 GMT""}]","2015-05-05"
"1501.01068","Thiago de Assis","T. A. de Assis","The role of Hurst exponent on cold field electron emission from
  conducting materials: from electric field distribution to Fowler-Nordheim
  plots","Accepted for publication in Scientific Reports","Scientific Reports 5, 10175 (2015)","10.1038/srep10175",,"cond-mat.mtrl-sci","http://arxiv.org/licenses/nonexclusive-distrib/1.0/","  This work considers the effects of the Hurst exponent ($H$) on the local
electric field distribution and the slope of the Fowler-Nordheim (FN) plot when
considering the cold field electron emission properties of rough Large-Area
Conducting Field Emitter Surfaces (LACFESs). A LACFES is represented by a
self-affine Weierstrass-Mandelbrot function in a given spatial direction. For
$0.1 \leqslant H < 0.5$, the local electric field distribution exhibits two
clear exponential regimes. Moreover, a scaling between the macroscopic current
density ($J_M$) and the characteristic kernel current density ($J_{kC}$),
$J_{M} \sim [J_{kC}]^{\beta_{H}}$, with an H-dependent exponent $\beta_{H} >
1$, has been found. This feature, which is less pronounced (but not absent) in
the range where more smooth surfaces have been found ($0.5 \leqslant H
\leqslant 0.9$), is a consequence of the dependency between the area efficiency
of emission of a LACFES and the macroscopic electric field, which is often
neglected in the interpretation of cold field electron emission experiments.
Considering the recent developments in orthodox field emission theory, we show
that the exponent $\beta_{H}$ must be considered when calculating the slope
characterization parameter (SCP) and thus provides a relevant method of more
precisely extracting the characteristic field enhancement factor from the slope
of the FN plot.
","[{""version"":""v1"",""created"":""Tue, 6 Jan 2015 03:13:34 GMT""},{""version"":""v2"",""created"":""Mon, 12 Jan 2015 02:37:27 GMT""},{""version"":""v3"",""created"":""Wed, 4 Mar 2015 03:37:59 GMT""},{""version"":""v4"",""created"":""Thu, 16 Apr 2015 02:46:31 GMT""}]","2015-06-04"
"1501.01069","Ciro Pinto","Ciro Pinto, Jeremy S. Sanders, Norbert Werner, Jelle de Plaa, Andrew
  C. Fabian, Yu-Ying Zhang, Jelle S. Kaastra, Alexis Finoguenov and Jussi
  Ahoranta","Chemical Enrichment RGS cluster sample (CHEERS): Constraints on
  turbulence","16 pages, 18 figures, 3 tables, accepted for publications in
  Astronomy and Astrophysics","A&A 575, A38 (2015)","10.1051/0004-6361/201425278",,"astro-ph.HE astro-ph.GA physics.plasm-ph","http://arxiv.org/licenses/nonexclusive-distrib/1.0/","  Feedback from AGN, galactic mergers, and sloshing are thought to give rise to
turbulence, which may prevent cooling in clusters. We aim to measure the
turbulence in clusters of galaxies and compare the measurements to some of
their structural and evolutionary properties. It is possible to measure the
turbulence of the hot gas in clusters by estimating the velocity widths of
their X-ray emission lines. The RGS Spectrometers aboard XMM-Newton are
currently the only instruments provided with sufficient effective area and
spectral resolution in this energy domain. We benefited from excellent 1.6Ms
new data provided by the CHEERS project. The new observations improve the
quality of the archival data and allow us to place constraints for some
clusters, which were not accessible in previous work. One-half of the sample
shows upper limits on turbulence less than 500km/s. For several sources, our
data are consistent with relatively strong turbulence with upper limits on the
velocity widths that are larger than 1000km/s. The NGC507 group of galaxies
shows transonic velocities, which are most likely associated with the merging
phenomena and bulk motions occurring in this object. Where both low- and
high-ionization emission lines have good enough statistics, we find larger
upper limits for the hot gas, which is partly due to the different spatial
extents of the hot and cool gas phases. Our upper limits are larger than the
Mach numbers required to balance cooling, suggesting that dissipation of
turbulence may prevent cooling, although other heating processes could be
dominant. The systematics associated with the spatial profile of the source
continuum make this technique very challenging, though still powerful, for
current instruments. The ASTRO-H and Athena missions will revolutionize the
velocity estimates and discriminate between different spatial regions and
temperature phases.
","[{""version"":""v1"",""created"":""Tue, 6 Jan 2015 03:18:18 GMT""}]","2015-02-20"
"1501.01070","Herald Kllapi","Herald Kllapi, Panos Sakkos, Alex Delis, Dimitrios Gunopulos, Yannis
  Ioannidis","Elastic Processing of Analytical Query Workloads on IaaS Clouds","12 pages",,,,"cs.DB cs.DC","http://arxiv.org/licenses/nonexclusive-distrib/1.0/","  Many modern applications require the evaluation of analytical queries on
large amounts of data. Such queries entail joins and heavy aggregations that
often include user-defined functions (UDFs). The most efficient way to process
these specific type of queries is using tree execution plans. In this work, we
develop an engine for analytical query processing and a suite of specialized
techniques that collectively take advantage of the tree form of such plans. The
engine executes these tree plans in an elastic IaaS cloud infrastructure and
dynamically adapts by allocating and releasing pertinent resources based on the
query workload monitored over a sliding time window. The engine offers its
services for a fee according to service-level agreements (SLAs) associated with
the incoming queries; its management of cloud resources aims at maximizing the
profit after removing the costs of using these resources. We have fully
implemented our algorithms in the Exareme dataflow processing system. We
present an extensive evaluation that demonstrates that our approach is very
efficient (exhibiting fast response times), elastic (successfully adjusting the
cloud resources it uses as the engine continually adapts to query workload
changes), and profitable (approximating very well the maximum difference
between SLA-based income and cloud-based expenses).
","[{""version"":""v1"",""created"":""Tue, 6 Jan 2015 03:38:45 GMT""}]","2015-01-07"
"1501.01071","Hongxia Zhong","Hongxia Zhong, Zeyuan Ni, Yangyang Wang, Meng Ye, Zhigang Song,
  Yuanyuan Pan, Ruge Quhe, Jinbo Yang, Li Yang, Junjie Shi, and Jing Lu","Interfacial Properties of Monolayer and Bilayer MoS2 Contacts with
  Metals: Beyond the Energy Band Calculations","36 pages, 13 figures, 3 tables",,,,"cond-mat.mes-hall cond-mat.mtrl-sci","http://arxiv.org/licenses/nonexclusive-distrib/1.0/","  Although many prototype devices based on two-dimensional (2D) MoS2 have been
fabricated and wafer scale growth of 2D MoS2 has been realized, the fundamental
nature of 2D MoS2-metal contacts has not been well understood yet. We provide a
comprehensive ab initio study of the interfacial properties of a series of
monolayer (ML) and bilayer (BL) MoS2-metal contacts (metal = Sc, Ti, Ag, Pt,
Ni, and Au). A comparison between the calculated and observed Schottky barrier
heights (SBHs) suggests that many-electron effects are strongly suppressed in
channel 2D MoS2 due to a charge transfer. The extensively adopted energy band
calculation scheme fails to reproduce the observed SBHs in 2D MoS2-Sc
interface. By contrast, an ab initio quantum transport device simulation better
reproduces the observed SBH in the two types of contacts and highlights the
importance of a higher level theoretical approach beyond the energy band
calculation in the interface study. BL MoS2-metal contacts have a reduced SBH
than ML MoS2-metal contacts due to the interlayer coupling and thus have a
higher electron injection efficiency.
","[{""version"":""v1"",""created"":""Tue, 6 Jan 2015 03:49:25 GMT""},{""version"":""v2"",""created"":""Wed, 1 Jul 2015 21:31:52 GMT""}]","2015-07-03"
"1501.01072","Goro Akagi","Goro Akagi and Masato Kimura","Unidirectional evolution equations of diffusion type",,,,,"math.AP","http://arxiv.org/licenses/nonexclusive-distrib/1.0/","  This paper is concerned with the uniqueness, existence, comparison principle
and long-time behavior of solutions to the initial-boundary value problem for a
unidirectional diffusion equation. The unidirectional evolution often appears
in Damage
  Mechanics due to the strong irreversibility of crack propagation or damage
evolution. The existence of solutions is proved in an L^2-framework by
introducing a peculiar discretization of the unidirectional diffusion equation
by means of variational inequities of obstacle type and by developing a
regularity theory for such variational inequalities. The novel discretization
argument will be also applied to prove the comparison principle as well as to
investigate the long-time behavior of solutions.
","[{""version"":""v1"",""created"":""Tue, 6 Jan 2015 04:14:48 GMT""}]","2015-01-07"
"1501.01073","Samia Allaoua Chelloug","Samia Allaoua Chelloug","Impact of the Temperature and Humidity Variations on Link Quality of
  xm1000 Mote Sensors","9 pages in International Journal of Ad hoc, Sensor & Ubiquitous
  Computing (IJASUC) Vol.5, No.6, December 2014",,"10.5121/ijasuc.2014.5603",,"cs.NI","http://creativecommons.org/licenses/by/3.0/","  The core motivations of deploying a sensor network for a specific application
come from the autonomy of sensors, their reduced size, and their capabilities
for computing and communicating in a short range. However, many challenges for
sensor networks still exist: minimizing energy consumption, and ensuring the
performance of communication that may be affected by many parameters. The work
described in this paper covers mainly the analysis of the impact of the
temperature and humidity variations on link quality of XM1000 operating under
TinyOS. Two-way ANOVA test has been applied and the obtained results show that
both the temperature and humidity variations impact RSSI.
","[{""version"":""v1"",""created"":""Tue, 6 Jan 2015 04:16:19 GMT""}]","2015-01-07"
"1501.01074","Carlos Rijs Mr","Carlos Rijs, Hamed Moradi, Damien Przybylski, Paul S. Cally","MHD wave refraction and the acoustic halo effect around solar active
  regions - a 3D study",,,"10.1088/0004-637X/801/1/27",,"astro-ph.SR","http://arxiv.org/licenses/nonexclusive-distrib/1.0/","  An enhancement in high-frequency acoustic power is commonly observed in the
solar photosphere and chromosphere surrounding magnetic active regions. We
perform 3D linear forward wave modelling with a simple wavelet pulse acoustic
source to ascertain whether the formation of the acoustic halo is caused by MHD
mode conversion through regions of moderate and inclined magnetic fields. This
conversion type is most efficient when high frequency waves from below
intersect magnetic field lines at a large angle. We find a strong relationship
between halo formation and the equipartition surface at which the Alfv\'en
speed $a$ matches the sound speed $c$, lending support to the theory that
photospheric and chromospheric halo enhancement is due to the creation and
subsequent reflection of magnetically dominated fast waves from essentially
acoustic waves as they cross $a=c$. In simulations where we have capped $a$
such that waves are not permitted to refract after reaching the $a=c$ height,
halos are non-existent, which suggests that the power enhancement is wholly
dependent on returning fast waves. We also reproduce some of the observed halo
properties, such as a dual 6 and 8 mHz enhancement structure and a spatial
spreading of the halo with height.
","[{""version"":""v1"",""created"":""Tue, 6 Jan 2015 04:17:29 GMT""}]","2015-06-23"
"1501.01075","Omar Abuzaghleh","Omar Abuzaghleh, Miad Faezipour and Buket D. Barkana","Skincure: An Innovative Smart Phone-Based Application To Assist In
  Melanoma Early Detection And Prevention","appears in Signal & Image Processing : An International Journal
  (SIPIJ) Vol.5, No.6, December 2014",,"10.5121/sipij.2014.5601",,"cs.CV cs.CY","http://arxiv.org/licenses/nonexclusive-distrib/1.0/","  Melanoma spreads through metastasis, and therefore it has been proven to be
very fatal. Statistical evidence has revealed that the majority of deaths
resulting from skin cancer are as a result of melanoma. Further investigations
have shown that the survival rates in patients depend on the stage of the
infection; early detection and intervention of melanoma implicates higher
chances of cure. Clinical diagnosis and prognosis of melanoma is challenging
since the processes are prone to misdiagnosis and inaccuracies due to doctors
subjectivity. This paper proposes an innovative and fully functional
smart-phone based application to assist in melanoma early detection and
prevention. The application has two major components; the first component is a
real-time alert to help users prevent skin burn caused by sunlight; a novel
equation to compute the time for skin to burn is thereby introduced. The second
component is an automated image analysis module which contains image
acquisition, hair detection and exclusion, lesion segmentation, feature
extraction, and classification. The proposed system exploits PH2 Dermoscopy
image database from Pedro Hispano Hospital for development and testing
purposes. The image database contains a total of 200 dermoscopy images of
lesions, including normal, atypical, and melanoma cases. The experimental
results show that the proposed system is efficient, achieving classification of
the normal, atypical and melanoma images with accuracy of 96.3%, 95.7% and
97.5%, respectively.
","[{""version"":""v1"",""created"":""Tue, 6 Jan 2015 04:19:55 GMT""}]","2015-01-07"
