"1501.01131","Biplab Pal","Atanu Nandy, Biplab Pal and Arunava Chakrabarti","Flat band analogues and flux driven extended electronic states in a
  class of geometrically frustrated fractal networks","9 pages, 9 figures, 1 Table","J. Phys.: Condens. Matter, Volume 27, Issue 12, Page 125501 (2015)","10.1088/0953-8984/27/12/125501",,"cond-mat.dis-nn cond-mat.mes-hall","http://arxiv.org/licenses/nonexclusive-distrib/1.0/","  We demonstrate, by explicit construction, that a single band tight binding
Hamiltonian defined on a class of deterministic fractals of the b = 3N
Sierpinski type can give rise to an infinity of dispersionless, flat-band like
states which can be worked out analytically using the scale invariance of the
underlying lattice. The states are localized over clusters of increasing sizes,
displaying the existence of a multitude of localization areas. The onset of
localization can, in principle, be delayed in space by an appropriate choice of
the energy of the electron. A uniform magnetic field threading the elementary
plaquettes of the network is shown to destroy this staggered localization and
generate absolutely continuous sub-bands in the energy spectrum of these
non-translationally invariant networks.
","[{""version"":""v1"",""created"":""Tue, 6 Jan 2015 10:35:20 GMT""},{""version"":""v2"",""created"":""Wed, 7 Jan 2015 12:24:10 GMT""}]","2015-03-11"
"1501.01132","Wahb Ettoumi","Wahb Ettoumi, J\'er\^ome Kasparian, Jean-Pierre Wolf","Laser filamentation as a new phase transition universality class","8 pages, 9 figures",,"10.1103/PhysRevLett.114.063903",,"nlin.PS physics.optics","http://arxiv.org/licenses/nonexclusive-distrib/1.0/","  We show that the onset of laser multiple filamentation can be described as a
critical phenomenon that we characterize both experimentally and numerically by
measuring a set of seven critical exponents. This phase transition deviates
from any existing universality class, and offers a unique perspective of
conducting two-dimensional experiments of statistical physics at a human scale.
","[{""version"":""v1"",""created"":""Tue, 6 Jan 2015 10:35:58 GMT""}]","2015-06-23"
"1501.01133","Aina Frau-Pascual","Aina Frau-Pascual (INRIA Grenoble Rh\^one-Alpes / LJK Laboratoire Jean
  Kuntzmann, INRIA Saclay - Ile de France), Thomas Vincent (INRIA Grenoble
  Rh\^one-Alpes / LJK Laboratoire Jean Kuntzmann), Jennifer Sloboda (INRIA
  Grenoble Rh\^one-Alpes / LJK Laboratoire Jean Kuntzmann), Philippe CIUCIU
  (CEA, INRIA Saclay - Ile de France), Florence Forbes (INRIA Grenoble
  Rh\^one-Alpes / LJK Laboratoire Jean Kuntzmann)","Physiologically Informed Bayesian Analysis of ASL fMRI Data",,"Bayesian and Graphical Models for Biomedical Imaging, Sep 2014,
  Boston, United States. Springer International Publishing, 8677, pp.37 - 48,
  Lecture Notes in Computer Science","10.1007/978-3-319-12289-2_4",,"stat.AP q-bio.NC","http://arxiv.org/licenses/nonexclusive-distrib/1.0/","  Arterial Spin Labelling (ASL) functional Magnetic Resonance Imaging (fMRI)
data provides a quantitative measure of blood perfusion, that can be correlated
to neuronal activation. In contrast to BOLD measure, it is a direct measure of
cerebral blood flow. However, ASL data has a lower SNR and resolution so that
the recovery of the perfusion response of interest suffers from the
contamination by a stronger hemodynamic component in the ASL signal. In this
work we consider a model of both hemodynamic and perfusion components within
the ASL signal. A physiological link between these two components is analyzed
and used for a more accurate estimation of the perfusion response function in
particular in the usual ASL low SNR conditions.
","[{""version"":""v1"",""created"":""Tue, 6 Jan 2015 10:37:07 GMT""}]","2015-01-07"
"1501.01134","Alpha Mastrano","Alpha Mastrano, Arthur George Suvorov, Andrew Melatos","Neutron star deformation due to poloidal-toroidal magnetic fields of
  arbitrary multipole order: a new analytic approach","14 pages, 6 figures, 1 table. Accepted for publication in the Monthly
  Notices of the Royal Astronomical Society","MNRAS 2015, 447, 3475","10.1093/mnras/stu2671",,"astro-ph.HE","http://arxiv.org/licenses/nonexclusive-distrib/1.0/","  A recipe is presented to construct an analytic, self-consistent model of a
non-barotropic neutron star with a poloidal-toroidal field of arbitrary
multipole order, whose toroidal component is confined in a torus around the
neutral curve inside the star, as in numerical simulations of twisted tori. The
recipe takes advantage of magnetic-field-aligned coordinates to ensure
continuity of the mass density at the surface of the torus. The density
perturbation and ellipticity of such a star are calculated in general and for
the special case of a mixed dipole-quadrupole field as a worked example. The
calculation generalises previous work restricted to dipolar, poloidal-toroidal
and multipolar, poloidal-only configurations. The results are applied, as an
example, to magnetars whose observations (e.g., spectral features and pulse
modulation) indicate that the internal magnetic fields may be at least one
order of magnitude stronger than the external fields, as inferred from their
spin downs, and are not purely dipolar.
","[{""version"":""v1"",""created"":""Tue, 6 Jan 2015 10:37:54 GMT""}]","2015-01-26"
"1501.01135","Olivier Bernardi","Olivier Bernardi, Alejandro H. Morales","Some probabilistic trees with algebraic roots",,,,,"math.CO","http://arxiv.org/licenses/nonexclusive-distrib/1.0/","  In this article we consider several probabilistic processes defining random
grapha. One of these processes appeared recently in connection with a
factorization problem in the symmetric group. For each of the probabilistic
processes, we prove that the probability for the random graph to be a tree has
an extremely simple expression, which is independent of most parameters of the
problem. This raises many open questions.
","[{""version"":""v1"",""created"":""Tue, 6 Jan 2015 10:38:21 GMT""}]","2015-01-07"
"1501.01136","Jean-Francois Petiot","Jean-Christophe Turlot (LMAP), Jean Fran\c{c}ois Petiot","Intervalles de confiance pour une proportion : lesquels doit-on
  enseigner ?","in French in Colloque Francophone International sur l'Enseignement de
  la Statistique -CFIES 2015, Jan 2015, Bordeaux, France",,,,"math.ST stat.TH","http://arxiv.org/licenses/nonexclusive-distrib/1.0/","  The most frequently taught confidence intervals for a proportion are the
classical Wald (Ws) and the Clopper-Pearson (CP) ones because of the simplicity
of their definition. However, their actual coverage probability of the
parameter p is erratic, often quite far from the nominal probability which is
aimed at. Other confidence intervals are clearly preferable to the former, but
their expression is generally complex and they are difficult to interpret. But
nevertheless, through a simple modification of the definition of the Ws and CP
intervals, we obtain some confidence intervals with much better coverage
probabilities. Namely, these confidence intervals are the Agresti-Coull and
Mid-P intervals that we present here. We highly recommend them in a basic
Statistics course.
","[{""version"":""v1"",""created"":""Tue, 6 Jan 2015 10:39:52 GMT""}]","2015-01-07"
"1501.01137","Daniel Santel","Belle Collaboration: D. Santel, K. Kinoshita, P. Chang, A. Abdesselam,
  I. Adachi, H. Aihara, S. Al Said, K. Arinstein, D. M. Asner, T. Aushev, R.
  Ayad, A. M. Bakich, V. Bansal, B. Bhuyan, A. Bobrov, A. Bondar, G. Bonvicini,
  M. Bra\v{c}ko, T. E. Browder, D. \v{C}ervenkov, V. Chekelian, B. G. Cheon, K.
  Chilikin, K. Cho, V. Chobanova, S.-K. Choi, Y. Choi, D. Cinabro, J. Dalseno,
  M. Danilov, J. Dingfelder, Z. Dole\v{z}al, Z. Dr\'asal, A. Drutskoy, S.
  Eidelman, H. Farhat, J. E. Fast, T. Ferber, V. Gaur, N. Gabyshev, A. Garmash,
  D. Getzkow, R. Gillard, Y. M. Goh, J. Haba, T. Hara, K. Hayasaka, H.
  Hayashii, X. H. He, W.-S. Hou, H. J. Hyun, T. Iijima, K. Inami, A. Ishikawa,
  R. Itoh, Y. Iwasaki, I. Jaegle, D. Joffe, T. Julius, K. H. Kang, E. Kato, T.
  Kawasaki, C. Kiesling, D. Y. Kim, H. J. Kim, J. B. Kim, J. H. Kim, M. J. Kim,
  S. H. Kim, Y. J. Kim, B. R. Ko, P. Kody\v{s}, S. Korpar, P. Kri\v{z}an, P.
  Krokovny, A. Kuzmin, J. S. Lange, I. S. Lee, Y. Li, L. Li Gioi, J. Libby, D.
  Liventsev, P. Lukin, D. Matvienko, K. Miyabayashi, H. Miyata, R. Mizuk, G. B.
  Mohanty, A. Moll, T. Mori, R. Mussa, E. Nakano, M. Nakao, T. Nanut, Z.
  Natkaniec, N. K. Nisar, S. Nishida, S. Ogawa, S. Okuno, S. L. Olsen, C.
  Oswald, P. Pakhlov, G. Pakhlova, C. W. Park, H. Park, T. K. Pedlar, M.
  Petri\v{c}, L. E. Piilonen, E. Ribe\v{z}l, M. Ritter, A. Rostomyan, S. Ryu,
  Y. Sakai, S. Sandilya, L. Santelj, T. Sanuki, V. Savinov, O. Schneider, G.
  Schnell, C. Schwanda, A. J. Schwartz, K. Senyo, M. E. Sevior, V. Shebalin,
  T.-A. Shibata, J.-G. Shiu, B. Shwartz, A. Sibidanov, F. Simon, Y.-S. Sohn, E.
  Solovieva, M. Stari\v{c}, M. Steder, U. Tamponi, G. Tatishvili, Y. Teramoto,
  K. Trabelsi, M. Uchida, T. Uglov, Y. Unno, S. Uno, C. Van Hulse, P.
  Vanhoefer, G. Varner, A. Vinokurova, M. N. Wagner, P. Wang, X. L. Wang, M.
  Watanabe, Y. Watanabe, E. Won, J. Yamaoka, Y.-P. Yang, S. Yashchenko, Y.
  Yook, Y. Yusa, Z. P. Zhang, V. Zhilich, V. Zhulanov, A. Zupanc","Measurements of the $\Upsilon(10860)$ and $\Upsilon(11020)$ resonances
  via $\sigma(e^+e^-\rightarrow\Upsilon(n{\rm S})\pi^+\pi^-)$","University of Cincinnati preprint UCHEP-15-01, submitted to Physical
  Review D - Rapid Communications","Phys. Rev. D 93, 011101 (2016)","10.1103/PhysRevD.93.011101",,"hep-ex","http://arxiv.org/licenses/nonexclusive-distrib/1.0/","  We report new measurements of the total cross sections for $e^+e^-\to
\Upsilon(n{\rm S})\pi^+\pi^-$ ($n$ = 1, 2, 3) and $e^+e^-\to b\bar b$ from a
high-luminosity fine scan of the region $\sqrt{s} = 10.63$-$11.05$ GeV with the
Belle detector. We observe that the $\Upsilon(n{\rm S})\pi^+\pi^-$ spectra have
little or no non-resonant component and extract from them the masses and widths
of $\Upsilon(10860)$ and $\Upsilon(11020)$ and their relative phase. We find
$M_{10860}=(10891.1\pm3.2^{+0.6}_{-1.7})$ MeV/$c^2$ and
$\Gamma_{10860}=(53.7^{+7.1}_{-5.6}\,^{+1.3}_{-5.4})$ MeV and report first
measurements $M_{11020}=(10987.5^{+6.4}_{-2.5}\,^{+9.0}_{-2.1})$ MeV/$c^2$,
$\Gamma_{11020}=(61^{+9}_{-19}\,^{+2}_{-20})$ MeV, and $\phi_{\rm
11020}-\phi_{\rm 10860} = (-1.0\pm0.4\,^{+1.4}_{-0.1})$ rad.
","[{""version"":""v1"",""created"":""Tue, 6 Jan 2015 10:40:16 GMT""},{""version"":""v2"",""created"":""Thu, 8 Jan 2015 07:10:14 GMT""},{""version"":""v3"",""created"":""Fri, 1 Jan 2016 01:28:47 GMT""},{""version"":""v4"",""created"":""Sun, 21 Feb 2016 21:11:56 GMT""},{""version"":""v5"",""created"":""Mon, 29 Aug 2016 03:46:02 GMT""},{""version"":""v6"",""created"":""Mon, 19 Sep 2016 15:27:28 GMT""}]","2016-09-20"
"1501.01138","Jiyou Li","Jiyou Li, Daqing Wan and Jun Zhang","On the minimum distance of elliptic curve codes","13 pages",,,,"cs.IT math.CO math.IT","http://arxiv.org/licenses/nonexclusive-distrib/1.0/","  Computing the minimum distance of a linear code is one of the fundamental
problems in algorithmic coding theory. Vardy [14] showed that it is an \np-hard
problem for general linear codes. In practice, one often uses codes with
additional mathematical structure, such as AG codes. For AG codes of genus $0$
(generalized Reed-Solomon codes), the minimum distance has a simple explicit
formula. An interesting result of Cheng [3] says that the minimum distance
problem is already \np-hard (under \rp-reduction) for general elliptic curve
codes (ECAG codes, or AG codes of genus $1$). In this paper, we show that the
minimum distance of ECAG codes also has a simple explicit formula if the
evaluation set is suitably large (at least $2/3$ of the group order). Our
method is purely combinatorial and based on a new sieving technique from the
first two authors [8]. This method also proves a significantly stronger version
of the MDS (maximum distance separable) conjecture for ECAG codes.
","[{""version"":""v1"",""created"":""Tue, 6 Jan 2015 10:42:31 GMT""},{""version"":""v2"",""created"":""Wed, 7 Jan 2015 13:13:05 GMT""}]","2015-01-08"
"1501.01139","Mark Taylor","M. B. Taylor, T. Boch and J. Taylor","SAMP, the Simple Application Messaging Protocol: Letting applications
  talk to each other","12 pages, 3 figures. Accepted for Virtual Observatory special issue
  of Astronomy and Computing",,"10.1016/j.ascom.2014.12.007",,"astro-ph.IM cs.SE","http://arxiv.org/licenses/nonexclusive-distrib/1.0/","  SAMP, the Simple Application Messaging Protocol, is a hub-based communication
standard for the exchange of data and control between participating client
applications. It has been developed within the context of the Virtual
Observatory with the aim of enabling specialised data analysis tools to
cooperate as a loosely integrated suite, and is now in use by many and varied
desktop and web-based applications dealing with astronomical data. This paper
reviews the requirements and design principles that led to SAMP's
specification, provides a high-level description of the protocol, and discusses
some of its common and possible future usage patterns, with particular
attention to those factors that have aided its success in practice.
","[{""version"":""v1"",""created"":""Tue, 6 Jan 2015 10:44:37 GMT""}]","2015-01-07"
"1501.01140","Harold Auradou","H.M. Lopez (FAST, FIUBA), J-P Hulin (FAST), H. Auradou (FAST), M.V.
  D'Angelo (FIUBA)","Deformation of a flexible fiber in a viscous flow past an obstacle",,"Physics of Fluids, American Institute of Physics (AIP), 2015,
  pp.00","10.1063/1.4905920",,"physics.flu-dyn","http://arxiv.org/licenses/nonexclusive-distrib/1.0/","  We study the deformation and transport of elastic fibers in a viscous
Hele-Shaw flow with curved streamlines. The variations of the global velocity
and orientation of the fiber follow closely those of the local flow velocity.
The ratios of the curvatures of the fibers by the corresponding curvatures of
the streamlines reflect a balance between elastic and viscous forces: this
ratio is shown experimentally to be determined by a dimensionless {\it Sperm
number} $Sp$ combining the characteristic parameters of the flow (transverse
velocity gradient, viscosity, fiber diameter/cell gap ratio) and those of the
fiber (diameter, effective length, Young's modulus). For short fibers, the
effective length is that of the fiber; for long ones, it is equal to the
transverse characteristic length of the flow. For $S\_p \lesssim 250$, the
ratio of the curvatures increases linearly with $Sp$; For $S\_p \gtrsim 250$,
the fiber reaches the same curvature as the streamlines.
","[{""version"":""v1"",""created"":""Tue, 6 Jan 2015 10:46:43 GMT""}]","2015-06-23"
"1501.01141","Evelyne Roueff M.","E. Roueff, J.C. Loison, K.M. Hickson","Isotopic fractionation of carbon, deuterium and nitrogen : a full
  chemical study","21 pages, 9 figures in the text, 3 Figures in the appendices. 7
  tables in the text, 4 tables in the appendices. Accepted for publication by
  Astronomy Astrophysics",,"10.1051/0004-6361/201425113",,"astro-ph.GA","http://arxiv.org/licenses/nonexclusive-distrib/1.0/","  Context. The increased sensitivity and high spectral resolution of millimeter
telescopes allow the detection of an increasing number of isotopically
substituted molecules in the interstellar medium. The 14N/ 15N ratio is
difficult to measure directly for carbon containing molecules. Aims. We want to
check the underlying hypothesis that the 13C/ 12C ratio of nitriles and
isonitriles is equal to the elemental value via a chemical time dependent gas
phase chemical model. Methods. We have built a chemical network containing D,
13C and 15N molecular species after a careful check of the possible
fractionation reactions at work in the gas phase. Results. Model results
obtained for 2 different physical conditions corresponding respectively to a
moderately dense cloud in an early evolutionary stage and a dense depleted
pre-stellar core tend to show that ammonia and its singly deuterated form are
somewhat enriched in 15N, in agreement with observations. The 14N/ 15N ratio in
N2H+ is found to be close to the elemental value, in contrast to previous
models which obtain a significant enrichment, as we found that the
fractionation reaction between 15N and N2H+ has a barrier in the entrance
channel. The large values of the N2H+/15NNH+ and N2H+/ N15NH+ ratios derived in
L1544 cannot be reproduced in our model. Finally we find that nitriles and
isonitriles are in fact significantly depleted in 13C, questioning previous
interpretations of observed C15N, HC15N and H15NC abundances from 13C
containing isotopologues.
","[{""version"":""v1"",""created"":""Tue, 6 Jan 2015 10:47:05 GMT""},{""version"":""v2"",""created"":""Thu, 8 Jan 2015 08:50:56 GMT""}]","2015-06-23"
"1501.01142","Vitaly Okorokov A","V.A. Okorokov (National Research Nuclear University ""MEPhI"")","Energy dependence of slope parameter in elastic nucleon-nucleon
  scattering","15 pages, 4 figures, 11 tables. This paper is the development of the
  preceding analysis arXiv: 0907.0951. arXiv admin note: text overlap with
  arXiv:0907.0951","Adv. High Energy Phys. 2015, 914170 (2015)","10.1155/2015/914170",,"hep-ph","http://arxiv.org/licenses/nonexclusive-distrib/1.0/","  The study of slope parameter is presented for elastic proton-proton and
antiproton-proton scattering with taking into account the resent experimental
data at high energies. The expanded logarithmic approximations allow the
description of the experimental slopes in all available energy range
reasonably. Accounting for the LHC results leads to the dramatic change of
behavior of the quadratic in logarithm approximation at high energies and to
the closer trends for all fitting functions under study in comparison with the
analysis at collision energies up to the 200 GeV. The estimations of the
asymptotic shrinkage parameter $\alpha'_{\cal{P}}$ are discussed. Predictions
for diffraction slope parameter are obtained for some proton-proton and
antiproton-proton facilities.
","[{""version"":""v1"",""created"":""Tue, 6 Jan 2015 10:49:20 GMT""},{""version"":""v2"",""created"":""Sat, 23 May 2015 09:56:19 GMT""},{""version"":""v3"",""created"":""Thu, 18 Jun 2015 17:07:38 GMT""}]","2015-06-19"
"1501.01143","Laurentiu Stoleriu","Laurentiu Stoleriu, Alexandru Stancu, Pradip Chakraborty, Andreas
  Hauser, Cristian Enachescu","Analysis of First Order Reversal Curves in the Thermal Hysteresis of
  Spin-crossover Nanoparticles within the Mechanoelastic Model","14 pages, 5 figures, 2014 59-th MMM conference",,"10.1063/1.4914953",,"cond-mat.mes-hall physics.comp-ph","http://arxiv.org/licenses/nonexclusive-distrib/1.0/","  The recently obtained spin-crossover nanoparticles are possible candidates
for applications in the recording media industry as materials for data storage,
or as pressure and temperature sensors. For these applications the
intermolecular interactions and interactions between spin-crossover
nanoparticles are extremely important, as they may be essential factors in
triggering the transition between the two stable phases: the high-spin and
low-spin ones. In order to find correlations between the distributions in size
and interactions and the transition temperatures distribution, we apply the
FORC (First Order Reversal Curves) method, using simulations based on a
mechanoelastic model applied to 2D triangular lattices composed of molecules
linked by springs and embedded in a surfactant. We consider two Gaussian
distributions: one of the size of the nanoparticles and one of the elastic
interactions between edge spin-crossover molecules and the surfactant
molecules. In order to disentangle the kinetic and non-kinetic parts of the
FORC distributions, we compare the results obtained for different temperature
sweeping rates. We also show that the presence of few larger particles in a
distribution centered around much smaller particles dramatically increases the
hysteresis width.
","[{""version"":""v1"",""created"":""Tue, 6 Jan 2015 10:57:27 GMT""}]","2015-06-23"
"1501.01144","Tomasz Rutkowski","Katsuhiko Hamada, Hiromu Mori, Hiroyuki Shinoda, and Tomasz M.
  Rutkowski","Airborne Ultrasonic Tactile Display BCI","arXiv admin note: substantial text overlap with arXiv:1404.4184","Brain-Computer Interface Research - A State-of-the-Art Summary 4.
  SpringerBriefs in Electrical and Computer Engineering. 2015. p. 57-65","10.1007/978-3-319-25190-5_6",,"q-bio.NC cs.HC","http://creativecommons.org/licenses/by-nc-sa/4.0/","  This chapter presents results of our project, which studied whether
contactless and airborne ultrasonic tactile display (AUTD) stimuli delivered to
a user's palms could serve as a platform for a brain computer interface (BCI)
paradigm. We used six palm positions to evoke combined somatosensory brain
responses to implement a novel contactless tactile BCI. This achievement was
awarded the top prize in the Annual BCI Research Award 2014 competition. This
chapter also presents a comparison with a classical attached vibrotactile
transducer-based BCI paradigm. Experiment results from subjects performing
online experiments validate the novel BCI paradigm.
","[{""version"":""v1"",""created"":""Tue, 6 Jan 2015 10:58:27 GMT""},{""version"":""v2"",""created"":""Sat, 2 Jan 2016 06:32:29 GMT""}]","2016-01-05"
"1501.01145","Kevin Coulembier","Kevin Coulembier and Vera Serganova","Homological invariants in category O for the general linear superalgebra",,"Trans. Amer. Math. Soc. 369 (2017), no. 11, 7961-7997",,,"math.RT","http://arxiv.org/licenses/nonexclusive-distrib/1.0/","  We study three related homological properties of modules in the BGG category
O for basic classical Lie superalgebras, with specific focus on the general
linear superalgebra. These are the projective dimension, associated variety and
complexity. We demonstrate connections between projective dimension and
singularity of modules and blocks. Similarly we investigate the connection
between complexity and atypicality. This creates concrete tools to describe
singularity and atypicality as homological, and hence categorical, properties
of a block. However, we also demonstrate how two integral blocks in category O
with identical global categorical characteristics of singularity and
atypicality will generally still be inequivalent. This principle implies that
category O for gl(m|n) can contain infinitely many non-equivalent blocks, which
we work out explicitly for gl(3|1). All of this is in sharp contrast with
category O for Lie algebras, but also with the category of finite dimensional
modules for superalgebras. Furthermore we characterise modules with finite
projective dimension to be those with trivial associated variety. We also study
the associated variety of Verma modules. To do this, we also classify the
orbits in the cone of self-commuting odd elements under the action of an even
Borel subgroup.
","[{""version"":""v1"",""created"":""Tue, 6 Jan 2015 11:02:43 GMT""},{""version"":""v2"",""created"":""Mon, 9 Mar 2015 19:24:17 GMT""},{""version"":""v3"",""created"":""Wed, 18 Mar 2015 08:09:21 GMT""},{""version"":""v4"",""created"":""Thu, 5 Nov 2015 03:51:13 GMT""}]","2017-09-14"
"1501.01146","Pasc Gavruta","M.R. Abdollahpour, A. Najati and P. Gavruta","Multipliers of pg-Bessel sequences in Banach spaces","14 pages",,,,"math.FA","http://arxiv.org/licenses/nonexclusive-distrib/1.0/","  In this paper, we introduce (p,q)g-Bessel multipliers in Banach spaces and we
show that under some conditions a (p,q)g-Bessel multiplier is invertible. Also,
we show the continuous dependency of (p,q)g-Bessel multipliers on their
parameters.
","[{""version"":""v1"",""created"":""Tue, 6 Jan 2015 11:09:37 GMT""}]","2015-01-07"
"1501.01147","Stefan Felsner","Stefan Felsner and Irina Mustata and Martin Pergel","The Complexity of the Partial Order Dimension Problem - Closing the Gap",,,,,"math.CO","http://arxiv.org/licenses/nonexclusive-distrib/1.0/","  The dimension of a partial order $P$ is the minimum number of linear orders
whose intersection is $P$. There are efficient algorithms to test if a partial
order has dimension at most $2$. In 1982 Yannakakis showed that for $k\geq 3$
to test if a partial order has dimension $\leq k$ is NP-complete. The height of
a partial order $P$ is the maximum size of a chain in $P$. Yannakakis also
showed that for $k\geq 4$ to test if a partial order of height $2$ has
dimension $\leq k$ is NP-complete. The complexity of deciding whether an order
of height $2$ has dimension $3$ was left open. This question became one of the
best known open problems in dimension theory for partial orders. We show that
the problem is NP-complete.
  Technically we show that the decision problem (3DH2) for dimension is
equivalent to deciding for the existence of bipartite triangle containment
representations (BTCon). This problem then allows a reduction from a class of
planar satisfiability problems (P-3-CON-3-SAT(4)) which is known to be NP-hard.
","[{""version"":""v1"",""created"":""Tue, 6 Jan 2015 11:11:49 GMT""},{""version"":""v2"",""created"":""Mon, 25 Apr 2016 07:20:31 GMT""}]","2016-04-26"
