"1501.03466","Piotr Koszmider","Piotr Koszmider and Crist\'obal Rodriguez-Porras","On automorphisms of the Banach space $\ell_\infty/c_0$",,,,,"math.FA math.GN math.LO math.OA","http://arxiv.org/licenses/nonexclusive-distrib/1.0/","  We investigate Banach space automorphisms
$T:\ell_\infty/c_0\rightarrow\ell_\infty/c_0 $ focusing on the possibility of
representing their fragments of the form
$$T_{B,A}:\ell_\infty(A)/c_0(A)\rightarrow \ell_\infty(B)/c_0(B)$$ for $A,
B\subseteq N$ infinite by means of linear operators from $\ell_\infty(A)$ into
$\ell_\infty(B)$, infinite $A\times B$-matrices, continuous maps from
$B^*=\beta B\setminus B$ into $A^*$, or bijections from $B$ to $A$. This leads
to the analysis of general linear operators on $\ell_\infty/c_0$. We present
many examples, introduce and investigate several classes of operators, for some
of them we obtain satisfactory representations and for other give examples
showing that it is impossible. In particular, we show that there are
automorphisms of $\ell_\infty/c_0$ which cannot be lifted to operators on
$\ell_\infty$ and assuming OCA+MA we show that every automorphism of
$\ell_\infty/c_0$ with no fountains or with no funnels is locally, i.e., for
some infinite $A, B\subseteq N$ as above, induced by a bijection from $B$ to
$A$. This additional set-theoretic assumption is necessary as we show that the
continuum hypothesis implies the existence of counterexamples of diverse
flavours. However, many basic problems, some of which are listed in the last
section, remain open.
","[{""version"":""v1"",""created"":""Wed, 14 Jan 2015 20:12:24 GMT""}]","2015-01-16"
"1501.03469","Yutaka Yoshida","Satoshi Okuda and Yutaka Yoshida","Gauge/Bethe correspondence on $S^1 \times \Sigma_h$ and index over
  moduli space","18 pages",,,,"hep-th","http://arxiv.org/licenses/nonexclusive-distrib/1.0/","  We introduce two-types of topologically twisted Chern-Simons-matter theories
on the direct product of circle and genus-h Riemann surface (S^1 \times
\Sigma_h). The partition functions of first model agrees with the partition
functions of a generalizations of G/G gauged WZW model. We also find that
correlation functions of Wilson loops in first type Chern-Simons-matter theory
coincide with correlation functions of G elements in the generalization of G/G
gauged WZW model. The partition function of this model also has nice
interpretations as norms of eigen states of Hamiltonian in the quantum
integrable model (q-boson hopping model) and also as a geometric index over a
particular moduli space. In the second-type Chern-Simons-matter theory, the
partition function is related to integration over moduli space of Hitchin
equation on Riemann surface.
","[{""version"":""v1"",""created"":""Wed, 14 Jan 2015 20:15:45 GMT""}]","2015-01-15"
"1501.03470","Maurizio Iori","M. Iori, H. Denizli, A. Yilmaz, F. Ferrarotto and J. Russ","Electron muon identification by atmospheric shower and electron beam in
  a new concept of an EAS detector","accepted by Astrophysical Journal on January 12 2015, 16 pages 3
  Figures",,"10.1088/0004-637X/801/2/140","12012015","astro-ph.IM physics.ins-det","http://arxiv.org/licenses/nonexclusive-distrib/1.0/","  We present results demonstrating the time resolution and $\mu$/e separation
capabilities with a new concept of an EAS detector capable for measurements of
cosmic rays arriving with large zenith angles. This kind of detector has been
designed to be a part of a large area (several square kilometers) surface array
designed to measure Ultra High Energy (10-200 PeV) $\tau$ neutrinos using the
Earth-skimming technique. A criteria to identify electron-gammas is also shown
and the particle identification capability is tested by measurements in
coincidence with the KASKADE-GRANDE experiment in Karlsruhe, Germany.
","[{""version"":""v1"",""created"":""Wed, 14 Jan 2015 20:18:13 GMT""}]","2015-06-23"
"1501.03471","Giovanni Luca Ciampaglia","Giovanni Luca Ciampaglia, Prashant Shiralkar, Luis M. Rocha, Johan
  Bollen, Filippo Menczer, Alessandro Flammini","Computational fact checking from knowledge networks",,,"10.1371/journal.pone.0128193",,"cs.CY cs.SI physics.soc-ph","http://arxiv.org/licenses/nonexclusive-distrib/1.0/","  Traditional fact checking by expert journalists cannot keep up with the
enormous volume of information that is now generated online. Computational fact
checking may significantly enhance our ability to evaluate the veracity of
dubious information. Here we show that the complexities of human fact checking
can be approximated quite well by finding the shortest path between concept
nodes under properly defined semantic proximity metrics on knowledge graphs.
Framed as a network problem this approach is feasible with efficient
computational techniques. We evaluate this approach by examining tens of
thousands of claims related to history, entertainment, geography, and
biographical information using a public knowledge graph extracted from
Wikipedia. Statements independently known to be true consistently receive
higher support via our method than do false ones. These findings represent a
significant step toward scalable computational fact-checking methods that may
one day mitigate the spread of harmful misinformation.
","[{""version"":""v1"",""created"":""Wed, 14 Jan 2015 20:18:21 GMT""}]","2020-07-01"
"1501.03472","Slobodan Simi\'c","Slobodan N. Simi\'c","On the subriemannian geometry of contact Anosov flows","16 pages, 2 figures",,,,"math.DG","http://arxiv.org/licenses/nonexclusive-distrib/1.0/","  We investigate certain natural connections between subriemannian geometry and
hyperbolic dynamical systems. In particular, we study dynamically defined
horizontal distributions which split into two integrable ones and ask: how is
the energy of a subriemannian geodesic shared between its projections onto the
integrable summands? We show that if the horizontal distribution is the sum of
the strong stable and strong unstable distributions of a special type of a
contact Anosov flow in three dimensions, then for any short enough
subriemannian geodesic connecting points on the same orbit of the Anosov flow,
the energy of the geodesic is shared \emph{equally} between its projections
onto the stable and unstable bundles. The proof relies on a connection between
the geodesic equations and the harmonic oscillator equation, and its explicit
solution by the Jacobi elliptic functions. Using a different idea, we prove an
analogous result in higher dimensions for the geodesic flow of a closed
Riemannian manifold of constant negative curvature.
","[{""version"":""v1"",""created"":""Wed, 14 Jan 2015 20:20:09 GMT""}]","2015-01-15"
"1501.03473","Piotr Nowak","Cornelia Dru\c{t}u, Piotr W. Nowak","Kazhdan projections, random walks and ergodic theorems","Final version, to appear in Crelle's Journal",,,,"math.GR math.DS math.FA math.KT math.OA","http://arxiv.org/licenses/nonexclusive-distrib/1.0/","  In this paper we investigate generalizations of Kazhdan's property $(T)$ to
the setting of uniformly convex Banach spaces. We explain the interplay between
the existence of spectral gaps and that of Kazhdan projections. Our methods
employ Markov operators associated to a random walk on the group, for which we
provide new norm estimates and convergence results. They exhibit useful
properties and flexibility, and allow to view Kazhdan projections in Banach
spaces as natural objects associated to random walks on groups.
  We give a number of applications of these results. In particular, we address
several open questions. We give a direct comparison of properties $(TE)$ and
$FE$ with Lafforgue's reinforced Banach property $(T)$; we obtain shrinking
target theorems for orbits of Kazhdan groups; finally, answering a question of
Willett and Yu we construct non-compact ghost projections for warped cones. In
this last case we conjecture that such warped cones provide counterexamples to
the coarse Baum-Connes conjecture.
","[{""version"":""v1"",""created"":""Wed, 14 Jan 2015 20:20:39 GMT""},{""version"":""v2"",""created"":""Wed, 18 Feb 2015 08:49:10 GMT""},{""version"":""v3"",""created"":""Sun, 11 Oct 2015 07:01:56 GMT""},{""version"":""v4"",""created"":""Tue, 10 Jan 2017 09:43:59 GMT""}]","2017-01-11"
"1501.03474","Masaki Ogura Dr.","Masaki Ogura and Victor M. Preciado","Stability of Markov regenerative switched linear systems",,,"10.1016/j.automatica.2016.02.022",,"cs.SY math.OC","http://arxiv.org/licenses/nonexclusive-distrib/1.0/","  In this paper, we give a necessary and sufficient condition for mean
stability of switched linear systems having a Markov regenerative process as
its switching signal. This class of switched linear systems, which we call
Markov regenerative switched linear systems, contains Markov jump linear
systems and semi-Markov jump linear systems as special cases. We show that a
Markov regenerative switched linear system is $m$th mean stable if and only if
a particular matrix is Schur stable, under the assumption that either $m$ is
even or the system is positive.
","[{""version"":""v1"",""created"":""Wed, 14 Jan 2015 20:22:12 GMT""},{""version"":""v2"",""created"":""Sat, 5 Dec 2015 05:29:39 GMT""}]","2016-11-04"
"1501.03475","Igor Belegradek","Igor Belegradek and F. Thomas Farrell and Vitali Kapovitch","Space of nonnegatively curved metrics and pseudoisotopies","29 pages, editorial corrections and a change in the dimension
  assumptions in Lemma 5.2 and Theorem 9.4",,,,"math.DG math.GT","http://arxiv.org/licenses/nonexclusive-distrib/1.0/","  Let V be an open manifold with complete nonnegatively curved metric such that
the normal sphere bundle to a soul has no section. We prove that the souls of
nearby nonnegatively curved metrics on V are smoothly close. Combining this
result with some topological properties of pseudoisotopies we show that for
many V the space of complete nonnegatively curved metrics has infinite higher
homotopy groups.
","[{""version"":""v1"",""created"":""Wed, 14 Jan 2015 20:30:28 GMT""},{""version"":""v2"",""created"":""Wed, 26 Aug 2015 15:19:42 GMT""},{""version"":""v3"",""created"":""Thu, 26 Jan 2017 12:40:09 GMT""}]","2017-01-27"
"1501.03476","Alberto Chiarini","Alberto Chiarini and Jean-Dominique Deuschel","Local Central Limit Theorem for diffusions in a degenerate and unbounded
  Random Medium","25 pages",,,,"math.PR math.AP","http://arxiv.org/licenses/nonexclusive-distrib/1.0/","  We study a symmetric diffusion $X$ on $\mathbb{R}^d$ in divergence form in a
stationary and ergodic environment, with measurable unbounded and degenerate
coefficients. We prove a quenched local central limit theorem for $X$, under
some moment conditions on the environment; the key tool is a local parabolic
Harnack inequality obtained with Moser iteration technique.
","[{""version"":""v1"",""created"":""Wed, 14 Jan 2015 20:30:52 GMT""}]","2015-01-15"
"1501.03477","Inar Timiryasov","A. Shkerin, I. Timiryasov","Lepton flavor violating baryon decays with a single generation","5 pages",,,"INR-TH/2015-004","hep-ph","http://arxiv.org/licenses/nonexclusive-distrib/1.0/","  In this paper we study lepton flavor violating semileptonic decays of heavy
baryons in a framework of a model with large extra dimensions and a single
generation . Resulting branching ratios for these decays mediated by
Kaluza-Klein modes of photon and Z-boson are presented in a model-independent
form.
","[{""version"":""v1"",""created"":""Wed, 14 Jan 2015 20:32:42 GMT""}]","2015-01-15"
"1501.03479","Emil Prodan Dr.","Emil Prodan","Intrinsic Chern-Connes Characters for Crossed Products by $\mathbb Z^d$","minor fixes",,,,"math.OA cond-mat.str-el math-ph math.MP","http://arxiv.org/licenses/nonexclusive-distrib/1.0/","  We present a natural imbedding of the crossed product $\mathcal A \rtimes_\xi
\mathbb Z^d$ into the $C^\ast$-algebra of adjointable operators over the
standard Hilbert $\mathcal A$-module $\mathcal H_{\mathcal A}$. By replacing
the representations on Hilbert spaces with this canonical imbedding, we define
Fredholm modules and corresponding Chern-Connes characters that are intrinsic
to the $C^\ast$-dynamical system $(\mathcal A,\xi,\mathbb Z^d)$. The
compression of the Dirac operator against projectors from $\mathcal A
\rtimes_\xi \mathbb Z^d$ produces generalized Fredholm operators over $\mathcal
H_{\mathcal A}$ and Mingo's index defines a $KK$-map from $K_0(\mathcal A
\rtimes_\xi \mathbb Z^d)$ to $K(\mathcal A)$. Using a generalized Fedosov
principle and a generalized Fedosov formula, we prove an index formula for the
pairing of the intrinsic Chern-Connes characters and $K_0(\mathcal A
\rtimes_\xi \mathbb Z^d)$. This pairing takes values in the image of
$K_0(\mathcal A)$ in $\mathbb R$ under a canonical trace. A local index formula
enables new applications in condensed matter physics to the so called weak
topological invariants.
","[{""version"":""v1"",""created"":""Wed, 14 Jan 2015 20:38:39 GMT""},{""version"":""v2"",""created"":""Mon, 19 Jan 2015 13:19:35 GMT""}]","2015-01-20"
"1501.03480","Mordechai Kornbluth","Mordechai Kornbluth and Chris Marianetti","Origin of Spinel Nanocheckerboards via First Principles",,,,,"cond-mat.mes-hall cond-mat.mtrl-sci","http://arxiv.org/licenses/nonexclusive-distrib/1.0/","  Self-organizing nanocheckerboards have been experimentally fabricated in
Mn-based spinels, but have not yet been explained with first principles. Using
density-functional-theory, we explain the phase diagram of the
$\mathrm{ZnMn_xGa_{2-x}O_4}$ system and the origin of nanocheckerboards. We
predict total phase separation at zero temperature, then show the combination
of kinetics, thermodynamics, and Jahn-Teller physics that generates the
system's observed behavior. We find the {011} surfaces are strongly-preferred
energetically, which mandates checkerboard ordering by purely geometrical
considerations.
","[{""version"":""v1"",""created"":""Wed, 14 Jan 2015 20:39:56 GMT""}]","2015-01-15"
"1501.03481","Ahmed Sayed","Giorgis Georgakoudis, Charles J. Gillan, Ahmed Sayed, Ivor Spence,
  Richard Faloon, and Dimitrios S. Nikolopoulos","Iso-Quality of Service: Fairly Ranking Servers for Real-Time Data
  Analytics","12 pages, 5 figures, 8 tables, 6 equations. arXiv admin note: text
  overlap with arXiv:1501.00048",,,,"cs.DC","http://arxiv.org/licenses/nonexclusive-distrib/1.0/","  We present a mathematically rigorous Quality-of-Service (QoS) metric which
relates the achievable quality of service metric (QoS) for a real-time
analytics service to the server energy cost of offering the service. Using a
new iso-QoS evaluation methodology, we scale server resources to meet QoS
targets and directly rank the servers in terms of their energy-efficiency and
by extension cost of ownership. Our metric and method are platform-independent
and enable fair comparison of datacenter compute servers with significant
architectural diversity, including micro-servers. We deploy our metric and
methodology to compare three servers running financial option pricing workloads
on real-life market data. We find that server ranking is sensitive to data
inputs and desired QoS level and that although scale-out micro-servers can be
up to two times more energy-efficient than conventional heavyweight servers for
the same target QoS, they are still six times less energy efficient than
high-performance computational accelerators.
","[{""version"":""v1"",""created"":""Wed, 14 Jan 2015 20:42:07 GMT""}]","2015-01-15"
"1501.03482","Alexander V. Kuznetsov","A.V. Kuznetsov, D.A. Rumyantsev, D.M. Shlenev (Yaroslavl State P.G.
  Demidov University, Russia)","Generalized two-point tree-level amplitude $jf \to j^{\, \prime} f^{\,
  \prime}$ in a magnetized medium","23 pages, LaTeX, 1 EPS figure, submitted to Int. J. Mod. Phys. A.
  arXiv admin note: substantial text overlap with arXiv:1312.5719","International Journal of Modern Physics A, Vol. 30 (2015) 1550049
  (23 pages)","10.1142/S0217751X15500499",,"hep-ph","http://arxiv.org/licenses/nonexclusive-distrib/1.0/","  The tree-level two-point amplitudes for the transitions $jf \to j^{\, \prime}
f^{\, \prime}$, where $f$ is a fermion and $j$ is a generalized current, in a
constant uniform magnetic field of an arbitrary strength and in charged fermion
plasma, for the $jff$ interaction vertices of the scalar, pseudoscalar, vector
and axial-vector types have been calculated. The generalized current $j$ could
mean the field operator of a boson, or a current consisting of fermions, e.g.
the neutrino current. The particular cases of a very strong magnetic field, and
of the coherent scattering off the real fermions without change of their states
(the ""forward"" scattering) have been analysed. The contribution of the neutrino
photoproduction process, $\gamma e\to e \nu \bar \nu$, to the neutrino
emissivity has been calculated with taking account of a possible resonance on
the virtual electron.
","[{""version"":""v1"",""created"":""Wed, 14 Jan 2015 20:43:12 GMT""}]","2015-03-27"
"1501.03483","Kirill Belashchenko","Kirill D. Belashchenko, Liqin Ke, Markus D\""ane, Lorin X. Benedict,
  Tej Nath Lamichhane, Valentin Taufour, Anton Jesche, Sergey L. Bud'ko, Paul
  C. Canfield, and Vladimir P. Antropov","Origin of the spin reorientation transitions in
  (Fe$_{1-x}$Co$_{x}$)$_{2}$B alloys","4 pages + supplementary material, 6 figures. Accepted in Applied
  Physics Letters","Appl. Phys. Lett. 106, 062408 (2015)","10.1063/1.4908056",,"cond-mat.mtrl-sci","http://arxiv.org/licenses/nonexclusive-distrib/1.0/","  Low-temperature measurements of the magnetocrystalline anisotropy energy $K$
in (Fe$_{1-x}$Co$_{x}$)$_{2}$B alloys are reported, and the origin of this
anisotropy is elucidated using a first-principles electronic structure
analysis. The calculated concentration dependence $K(x)$ with a maximum near
$x=0.3$ and a minimum near $x=0.8$ is in excellent agreement with experiment.
This dependence is traced down to spin-orbital selection rules and the filling
of electronic bands with increasing electronic concentration. At the optimal Co
concentration, $K$ depends strongly on the tetragonality and doubles under a
modest 3% increase of the $c/a$ ratio, suggesting that the magnetocrystalline
anisotropy can be further enhanced using epitaxial or chemical strain.
","[{""version"":""v1"",""created"":""Wed, 14 Jan 2015 20:43:45 GMT""},{""version"":""v2"",""created"":""Tue, 3 Feb 2015 03:59:07 GMT""}]","2015-02-17"
"1501.03484","Alexander Andrianov A","A. A. Andrianov, D. Espriu and S. S. Kolevatov","Effects of pseudoscalar condensation on the cooling of neutron stars","This paper has been withdrawn by the authors since they have decided
  to consider one more heat transport mechanism",,,,"hep-ph astro-ph.HE","http://arxiv.org/licenses/nonexclusive-distrib/1.0/","  In this work we consider the effect that the appearance of pseudoscalar
condensates in a neutron star can have on its cooling rate. We make no
particular assumption on the origin and characteristics of these possible
condensates and only assume that in regions where the pseudoscalar density
varies the propagation of photons is governed by modified Maxwell-Chern-Simons
electrodynamics. We find that this gives non-trivial reflection coefficients
between regions of different pseudoscalar density and may affect very
substantially the star cooling rate. While quantitative results do depend on
precise details that can only be answered once a proper equation of state is
determined, the general trend is quite universal and serious consideration
should be given to this possibility.
","[{""version"":""v1"",""created"":""Wed, 14 Jan 2015 20:44:59 GMT""},{""version"":""v2"",""created"":""Thu, 23 Jul 2015 16:03:25 GMT""},{""version"":""v3"",""created"":""Sat, 1 Aug 2015 13:24:00 GMT""}]","2015-08-04"
"1501.03485","Mohammad Waseem Akhtar","W. Akhtar, A. Schnegg, S. Veber, C. Meier, M. Fehr and K. Lips","CW and pulsed electrically detected magnetic resonance spectroscopy at
  263 GHz/12 T on operating amorphous silicon solar cells","8 pages, 4 figures",,"10.1016/j.jmr.2015.05.012",,"cond-mat.mtrl-sci","http://arxiv.org/licenses/nonexclusive-distrib/1.0/","  Here we describe a new high frequency/high field continuous wave and pulsed
electrically detected magnetic resonance (CW EDMR and pEDMR) setup, operating
at 263 GHz and resonance fields between 0 and 12 T. Spin dependent transport in
illuminated hydrogenated amorphous silicon p-i-n solar cells at 5 K and 90 K
was studied by in operando 263 GHz CW and pEDMR alongside with complementary
X-band CW EDMR. Benefiting from the superior resolution at 263 GHz, we were
able to better resolve EDMR signals originating from spin dependent hopping and
recombination processes. 5 K EDMR spectra were found to be dominated by
conduction and valence band tale states involved in spin dependent hopping,
with additional contributions from triplet exciton states. 90 K EDMR spectra
could be assigned to spin pair recombination involving conduction band tail
states and dangling bonds as dominating spin dependent transport process, with
additional contributions from valence band tail and triplet exciton states.
","[{""version"":""v1"",""created"":""Wed, 14 Jan 2015 20:52:28 GMT""}]","2015-12-09"
"1501.03486","Andrii Chumak","Andrey A. Nikitin (1,2,3), Alexey B. Ustinov (1,3), Alexander A.
  Semenov (1), Andrii V. Chumak (2), Alexander A. Serga (2), Vitaliy I.
  Vasyuchka (2), Erkki L\""ahderanta (3), Boris A. Kalinikos (1), and Burkard
  Hillebrands (2) ((1) St. Petersburg Electrotechnical University, St.
  Petersburg, Russia, (2) Technische Universit\""at Kaiserslautern,
  Kaiserslautern, Germany, (3) Lappeenranta University of Technology,
  Lappeenranta, Finland)","A spin-wave logic gate based on a width-modulated dynamic magnonic
  crystal","4 pages, 4 figures",,"10.1063/1.4914506",,"cond-mat.mes-hall","http://arxiv.org/licenses/nonexclusive-distrib/1.0/","  An electric current controlled spin-wave logic gate based on a
width-modulated dynamic magnonic crystal is realized. The device utilizes a
spin-wave waveguide fabricated from a single-crystal Yttrium Iron Garnet film
and two conducting wires attached to the film surface. Application of electric
currents to the wires provides a means for dynamic control of the effective
geometry of the waveguide and results in a suppression of the magnonic band
gap. The performance of the magnonic crystal as an AND logic gate is
demonstrated.
","[{""version"":""v1"",""created"":""Wed, 14 Jan 2015 20:52:48 GMT""},{""version"":""v2"",""created"":""Fri, 16 Jan 2015 10:15:42 GMT""}]","2015-06-23"
"1501.03487","Dmitry Krimer","Dmitry O. Krimer, Benedikt Hartl, and Stefan Rotter","Hybrid Quantum Systems with Collectively Coupled Spin States:
  Suppression of Decoherence through Spectral Hole Burning","5 pages, 4 figures","Phys. Rev. Lett. 115, 033601 (2015)","10.1103/PhysRevLett.115.033601",,"quant-ph cond-mat.mes-hall physics.atom-ph","http://arxiv.org/licenses/nonexclusive-distrib/1.0/","  Spin ensemble based hybrid quantum systems suffer from a significant degree
of decoherence resulting from the inhomogeneous broadening of the spin
transition frequencies in the ensemble. We demonstrate that this strongly
restrictive drawback can be overcome simply by burning two narrow spectral
holes in the spin spectral density at judiciously chosen frequencies. Using
this procedure we find an increase of the coherence time by more than an order
of magnitude as compared to the case without hole burning. Our findings pave
the way for the practical use of these hybrid quantum systems for the
processing of quantum information.
","[{""version"":""v1"",""created"":""Wed, 14 Jan 2015 20:55:07 GMT""},{""version"":""v2"",""created"":""Tue, 14 Jul 2015 16:06:41 GMT""}]","2015-07-15"
"1501.03488","Jan Vonk","Jan Vonk","Stable models of Hecke operators","19 pages, comments and suggestions are warmly welcomed; Updated
  version with some added material",,,,"math.NT math.AG","http://arxiv.org/licenses/nonexclusive-distrib/1.0/","  We investigate the geometry of correspondences between curves, and prove that
correspondences over a non-Archimedean valued field have potentially stable
reduction, generalising and strengthening results of Coleman and Liu. This
yields a concrete description of the operator on the cohomology of the generic
fibres arising from linearisation of the correspondence, via the
weight-monodromy filtration and Picard-Lefschetz theory. We explicitly
determine stable models of Hecke operators on various quaternionic Shimura
curves, and prove a generalisation of the geometric theory of canonical
subgroups by Goren and Kassaei.
","[{""version"":""v1"",""created"":""Wed, 14 Jan 2015 20:56:38 GMT""},{""version"":""v2"",""created"":""Mon, 18 May 2015 03:44:22 GMT""}]","2015-05-19"
"1501.03489","Stephan Tillmann","Stefan Friedl and Stephan Tillmann","Two-generator one-relator groups and marked polytopes","33 pages, 5 figures",,,,"math.GR math.GT","http://arxiv.org/licenses/nonexclusive-distrib/1.0/","  We use Fox calculus to assign a marked polytope to a `nice' group
presentation with two generators and one relator. Relating the marked vertices
to Novikov-Sikorav homology we show that they determine the
Bieri-Neumann-Strebel invariant of the group. Furthermore we show that in many
cases the marked polytope is an invariant of the underlying group and that in
those cases the marked polytope also determines the minimal complexity of all
the associated HNN-splittings.
","[{""version"":""v1"",""created"":""Wed, 14 Jan 2015 20:57:31 GMT""}]","2015-01-15"
