"1501.03564","Holly Swisher","Alyson Deines, Jenny G. Fuselier, Ling Long, Holly Swisher, Fang-Ting
  Tu","Hypergeometric series, truncated hypergeometric series, and Gaussian
  hypergeometric functions","25 pages",,,,"math.NT","http://arxiv.org/licenses/nonexclusive-distrib/1.0/","  In this paper, we investigate the relationships among hypergeometric series,
truncated hypergeometric series, and Gaussian hypergeometric functions through
some families of `hypergeometric' algebraic varieties that are higher
dimensional analogues of Legendre curves.
","[{""version"":""v1"",""created"":""Thu, 15 Jan 2015 03:32:47 GMT""},{""version"":""v2"",""created"":""Wed, 23 Sep 2015 12:46:09 GMT""}]","2015-09-24"
"1501.03565","Erlin  Qiao","Erlin Qiao and B.F. Liu","A disc corona-jet model for the radio/X-ray correlation in black hole
  X-ray binaries","Accepted by MNRAS",,"10.1093/mnras/stv085",,"astro-ph.HE","http://arxiv.org/licenses/nonexclusive-distrib/1.0/","  The observed tight radio/X-ray correlation in the low spectral state of some
black hole X-ray binaries implies the strong coupling of the accretion and jet.
The correlation of $L_{\rm R} \propto L_{\rm X}^{\sim 0.5-0.7}$ was well
explained by the coupling of a radiatively inefficient accretion flow and a
jet. Recently, however, a growing number of sources show more complicated
radio/X-ray correlations, e.g., $L_{\rm R} \propto L_{\rm X}^{\sim 1.4}$ for
$L_{\rm X}/L_{\rm Edd} \gtrsim 10^{-3}$, which is suggested to be explained by
the coupling of a radiatively efficient accretion flow and a jet. In this work,
we interpret the deviation from the initial radio/X-ray correlation for $L_{\rm
X}/L_{\rm Edd} \gtrsim 10^{-3}$ with a detailed disc corona-jet model. In this
model, the disc and corona are radiatively and dynamically coupled. Assuming a
fraction of the matter in the accretion flow, $\eta\equiv \dot M_{\rm jet}/\dot
M$, is ejected to form the jet, we can calculate the emergent spectrum of the
disc corona-jet system. We calculate $L_{\rm R}$ and $L_{\rm X}$ at different
$\dot M$, adjusting $\eta$ to fit the observed radio/X-ray correlation of the
black hole X-ray transient H1743-322 for $L_{\rm X}/L_{\rm Edd}> 10^{-3}$. It
is found that always the X-ray emission is dominated by the disc corona and the
radio emission is dominated by the jet. We noted that the value of $\eta$ for
the deviated radio/X-ray correlation for $L_{\rm X}/L_{\rm Edd} > 10^{-3}$, is
systematically less than that of the case for $L_{\rm X}/L_{\rm Edd} <
10^{-3}$, which is consistent with the general idea that the jet is often
relatively suppressed at the high luminosity phase in black hole X-ray
binaries.
","[{""version"":""v1"",""created"":""Thu, 15 Jan 2015 03:54:16 GMT""}]","2015-06-23"
"1501.03566","Chong Shangguan","Chong Shangguan and Gennian Ge","New bounds on the number of tests for disjunct matrices","4 pages, to appear in IEEE Transactions on Information Theory",,,,"cs.IT math.CO math.IT","http://arxiv.org/licenses/nonexclusive-distrib/1.0/","  Given $n$ items with at most $d$ of which being positive, instead of testing
these items individually, the theory of combinatorial group testing aims to
identify all positive items using as few tests as possible. This paper is
devoted to a fundamental and thirty-year-old problem in the nonadaptive group
testing theory. A binary matrix is called $d$-disjunct if the boolean sum of
arbitrary $d$ columns does not contain another column not in this collection.
Let $T(d)$ denote the minimal $t$ such that there exists a $t\times n$
$d$-disjunct matrix with $n>t$. $T(d)$ can also be viewed as the minimal $t$
such that there exists a nonadaptive group testing scheme which is better than
the trivial one that tests each item individually. It was known that
$T(d)\ge\binom{d+2}{2}$ and was conjectured that $T(d)\ge(d+1)^2$. In this
paper we narrow the gap by proving $T(d)/d^2\ge(15+\sqrt{33})/24$, a quantity
in [6/7,7/8].
","[{""version"":""v1"",""created"":""Thu, 15 Jan 2015 04:11:06 GMT""},{""version"":""v2"",""created"":""Tue, 25 Oct 2016 03:16:41 GMT""}]","2016-10-26"
"1501.03567","Yu Yasufuku","Yu Yasufuku","Integral Points and Relative Sizes of Coordinates of Orbits in P^N","22 pages, to appear in Mathematische Zeitschrift",,"10.1007/s00209-015-1406-y",,"math.NT math.DS","http://arxiv.org/licenses/nonexclusive-distrib/1.0/","  We give a generalization to higher dimensions of Silverman's result on
finiteness of integer points in orbits. Assuming Vojta's conjecture, we prove a
sufficient condition for morphisms on P^N so that (S,D)-integral points in each
orbit are Zariski-non-dense. This condition is geometric, and for dimension 1
it corresponds precisely to Silverman's hypothesis that the second iterate of
the map is not a polynomial. In fact, we will prove a more precise formulation
comparing local heights outside S to the global height. For hyperplanes, this
amounts to comparing logarithmic sizes of the coordinates, generalizing
Silverman's precise version in dimension 1. We also discuss a variant where we
can conclude that integral points in orbits are finite, rather than just
Zariski-non-dense. Further, we show unconditional results and examples, using
Schmidt's subspace theorem and known cases of Lang--Vojta conjecture. We end
with some extensions to the case of rational maps and to the case when the
arithmetic of the orbit under one map is controlled by the geometric properties
of another. We include many explicit examples to illustrate different behaviors
of integral points in orbits in higher dimensions.
","[{""version"":""v1"",""created"":""Thu, 15 Jan 2015 04:14:16 GMT""}]","2015-01-16"
"1501.03568","Taotao Qiu","Taotao Qiu, Yu-Tong Wang","G-Bounce Inflation: Towards Nonsingular Inflation Cosmology with
  Galileon Field","18 pages, 7 figures","JHEP 1504 (2015) 130","10.1007/JHEP04(2015)130",,"astro-ph.CO gr-qc hep-ph hep-th","http://arxiv.org/licenses/nonexclusive-distrib/1.0/","  We study a nonsingular bounce inflation model, which can drive the early
universe from a contracting phase, bounce into an ordinary inflationary phase,
followed by the reheating process. Besides the bounce that avoided the Big-Bang
singularity which appears in the standard cosmological scenario, we make use of
the Horndesky theory and design the kinetic and potential forms of the
lagrangian, so that neither of the two big problems in bouncing cosmology,
namely the ghost and the anisotropy problems, will appear. The cosmological
perturbations can be generated either in the contracting phase or in the
inflationary phase, where in the latter the power spectrum will be
scale-invariant and fit the observational data, while in the former the
perturbations will have nontrivial features that will be tested by the large
scale structure experiments. We also fit our model to the CMB TT power
spectrum.
","[{""version"":""v1"",""created"":""Thu, 15 Jan 2015 04:22:33 GMT""},{""version"":""v2"",""created"":""Wed, 29 Apr 2015 12:03:56 GMT""}]","2015-05-20"
"1501.03569","Lan Truong","Lan V. Truong, Hirosuke Yamamoto","On the Capacity of Symmetric Gaussian Interference Channels with
  Feedback","To appear in Proc. of IEEE International Symposium on Information
  Theory (ISIT), Hong Kong, June 14-19, 2015",,"10.1109/ISIT.2015.7282445",,"cs.IT math.IT","http://arxiv.org/licenses/nonexclusive-distrib/1.0/","  In this paper, we propose a new coding scheme for symmetric Gaussian
interference channels with feedback based on the ideas of time-varying coding
schemes. The proposed scheme improves the Suh-Tse and Kramer inner bounds of
the channel capacity for the cases of weak and not very strong interference.
This improvement is more significant when the signal-to-noise ratio (SNR) is
not very high. It is shown theoretically and numerically that our coding scheme
can outperform the Kramer code. In addition, the generalized degrees-of-freedom
of our proposed coding scheme is equal to the Suh-Tse scheme in the strong
interference case. The numerical results show that our coding scheme can attain
better performance than the Suh-Tse coding scheme for all channel parameters.
Furthermore, the simplicity of the encoding/decoding algorithms is another
strong point of our proposed coding scheme compared with the Suh-Tse coding
scheme. More importantly, our results show that an optimal coding scheme for
the symmetric Gaussian interference channels with feedback can be achieved by
using only marginal posterior distributions under a better cooperation strategy
between transmitters.
","[{""version"":""v1"",""created"":""Thu, 15 Jan 2015 04:24:29 GMT""},{""version"":""v2"",""created"":""Thu, 22 Jan 2015 13:14:37 GMT""},{""version"":""v3"",""created"":""Mon, 2 Feb 2015 07:47:16 GMT""},{""version"":""v4"",""created"":""Tue, 31 Mar 2015 09:15:27 GMT""},{""version"":""v5"",""created"":""Tue, 21 Apr 2015 10:13:21 GMT""}]","2016-11-17"
"1501.03570","Thomas Ihle","Thomas Ihle","Large density expansion of a hydrodynamic theory for self-propelled
  particles",,"Eur. Phys. J. Special Topics 224 (2015) 1303","10.1140/epjst/e2015-02461-4",,"cond-mat.stat-mech physics.bio-ph physics.comp-ph","http://arxiv.org/licenses/nonexclusive-distrib/1.0/","  Recently, an Enskog-type kinetic theory for Vicsek-type models for
self-propelled particles has been proposed [T. Ihle, Phys. Rev. E 83, 030901
(2011)]. This theory is based on an exact equation for a Markov chain in phase
space and is not limited to small density. Previously, the hydrodynamic
equations were derived from this theory and its transport coefficients were
given in terms of infinite series. Here, I show that the transport coefficients
take a simple form in the large density limit. This allows me to analytically
evaluate the well-known density instability of the polarly ordered phase near
the flocking threshold at moderate and large densities. The growth rate of a
longitudinal perturbation is calculated and several scaling regimes, including
three different power laws, are identified. It is shown that at large
densities, the restabilization of the ordered phase at smaller noise is
analytically accessible within the range of validity of the hydrodynamic
theory. Analytical predictions for the width of the unstable band, the maximum
growth rate and for the wave number below which the instability occurs are
given. In particular, the system size below which spatial perturbations of the
homogeneous ordered state are stable is predicted to scale with $\sqrt{M}$
where $M$ is the average number of collision partners. The typical time scale
until the instability becomes visible is calculated and is proportional to M.
","[{""version"":""v1"",""created"":""Thu, 15 Jan 2015 04:35:03 GMT""}]","2015-07-22"
"1501.03571","Qingyuan Zhao","Qingyuan Zhao and Daniel Percival","Entropy balancing is doubly robust","23 pages, 6 figures, Journal of Causal Inference 2016",,"10.1515/jci-2016-0010",,"stat.ME stat.AP","http://arxiv.org/licenses/nonexclusive-distrib/1.0/","  Covariate balance is a conventional key diagnostic for methods used
estimating causal effects from observational studies. Recently, there is an
emerging interest in directly incorporating covariate balance in the
estimation. We study a recently proposed entropy maximization method called
Entropy Balancing (EB), which exactly matches the covariate moments for the
different experimental groups in its optimization problem. We show EB is doubly
robust with respect to linear outcome regression and logistic propensity score
regression, and it reaches the asymptotic semiparametric variance bound when
both regressions are correctly specified. This is surprising to us because
there is no attempt to model the outcome or the treatment assignment in the
original proposal of EB. Our theoretical results and simulations suggest that
EB is a very appealing alternative to the conventional weighting estimators
that estimate the propensity score by maximum likelihood.
","[{""version"":""v1"",""created"":""Thu, 15 Jan 2015 04:49:54 GMT""},{""version"":""v2"",""created"":""Tue, 4 Aug 2015 04:46:32 GMT""},{""version"":""v3"",""created"":""Sat, 11 Feb 2017 17:27:37 GMT""}]","2017-02-14"
"1501.03572","Nicolas Schunck Dr","J.D. McDonnell, N. Schunck, D. Higdon, J. Sarich, S.M. Wild, and W.
  Nazarewicz","Uncertainty Quantification for Nuclear Density Functional Theory and
  Information Content of New Measurements","5 pages, 4 figures, 1 table; Supplemental material with 2 tables;
  Submitted to Physical Review Letters","Phys. Rev. Lett. 114, 122501 (2015)","10.1103/PhysRevLett.114.122501",,"nucl-th","http://arxiv.org/licenses/nonexclusive-distrib/1.0/","  Statistical tools of uncertainty quantification can be used to assess the
information content of measured observables with respect to present-day
theoretical models; to estimate model errors and thereby improve predictive
capability; to extrapolate beyond the regions reached by experiment; and to
provide meaningful input to applications and planned measurements. To showcase
new opportunities offered by such tools, we make a rigorous analysis of
theoretical statistical uncertainties in nuclear density functional theory
using Bayesian inference methods. By considering the recent mass measurements
from the Canadian Penning Trap at Argonne National Laboratory, we demonstrate
how the Bayesian analysis and a direct least-squares optimization, combined
with high-performance computing, can be used to assess the information content
of the new data with respect to a model based on the Skyrme energy density
functional approach. Employing the posterior probability distribution computed
with a Gaussian process emulator, we apply the Bayesian framework to propagate
theoretical statistical uncertainties in predictions of nuclear masses,
two-neutron dripline, and fission barriers. Overall, we find that the new mass
measurements do not impose a constraint that is strong enough to lead to
significant changes in the model parameters. The example discussed in this
study sets the stage for quantifying and maximizing the impact of new
measurements with respect to current modeling and guiding future experimental
efforts, thus enhancing the experiment-theory cycle in the scientific method.
","[{""version"":""v1"",""created"":""Thu, 15 Jan 2015 04:50:24 GMT""}]","2015-03-26"
"1501.03573","Jorge Moreno","Jorge Moreno, Paul Torrey, Sara L. Ellison, David R. Patton, Asa F. L.
  Bluck, Gunjan Bansal and Lars Hernquist","Mapping galaxy encounters in numerical simulations: The spatial extent
  of induced star formation","12 pages, 8 figures, accepted by MNRAS",,"10.1093/mnras/stv094",,"astro-ph.GA astro-ph.CO","http://arxiv.org/licenses/nonexclusive-distrib/1.0/","  We employ a suite of 75 simulations of galaxies in idealised major mergers
(stellar mass ratio ~2.5:1), with a wide range of orbital parameters, to
investigate the spatial extent of interaction-induced star formation. Although
the total star formation in galaxy encounters is generally elevated relative to
isolated galaxies, we find that this elevation is a combination of intense
enhancements within the central kpc and moderately suppressed activity at large
galacto-centric radii. The radial dependence of the star formation enhancement
is stronger in the less massive galaxy than in the primary, and is also more
pronounced in mergers of more closely aligned disc spin orientations.
Conversely, these trends are almost entirely independent of the encounter's
impact parameter and orbital eccentricity. Our predictions of the radial
dependence of triggered star formation, and specifically the suppression of
star formation beyond kph-scales, will be testable with the next generation of
integral-field spectroscopic surveys.
","[{""version"":""v1"",""created"":""Thu, 15 Jan 2015 04:54:24 GMT""}]","2015-06-23"
"1501.03574","Tommy Li","Tommy Li","Confinement of spin-orbit induced Dirac states in quantum point contacts","6 pages, 4 figures","Phys. Rev. B 92, 085302 (2015)","10.1103/PhysRevB.92.085302",,"cond-mat.mes-hall","http://arxiv.org/licenses/nonexclusive-distrib/1.0/","  The quantum transmission problem for a particle moving in a quantum point
contact in the presence of a Rashba spin-orbit interaction and applied magnetic
field is solved semiclassically. A strong Rashba interaction and parallel
magnetic field form emergent Dirac states at the center of the constriction,
leading to the appearance of resonances which carry spin current and become
bound at high magnetic fields. These states can be controlled in situ by
modulation of external electric and magnetic fields, and can be used to turn
the channel into a spin pump which operates at zero bias. It is shown that this
effect is currently experimentally accessible in $p$-type quantum point
contacts.
","[{""version"":""v1"",""created"":""Thu, 15 Jan 2015 04:56:45 GMT""},{""version"":""v2"",""created"":""Mon, 2 Feb 2015 06:37:40 GMT""},{""version"":""v3"",""created"":""Mon, 11 May 2015 07:55:22 GMT""}]","2015-08-19"
"1501.03575","Xiang Liu","Qin-Tao Song, Dian-Yong Chen, Xiang Liu and Takayuki Matsuki","Charmed-strange mesons revisited: mass spectra and strong decays","16 pages, 7 tables and 7 figures. Accepted by PRD","Phys. Rev. D 91, 054031 (2015)","10.1103/PhysRevD.91.054031",,"hep-ph hep-ex hep-lat","http://arxiv.org/licenses/nonexclusive-distrib/1.0/","  Inspired by the present experimental status of charmed-strange mesons, we
perform a systematic study of the charmed-strange meson family, in which we
calculate the mass spectra of the charmed-strange meson family by taking a
screening effect into account in the Godfrey-Isgur model and investigate the
corresponding strong decays via the quark pair creation model. These
phenomenological analyses of charmed-strange mesons not only shed light on the
features of the observed charmed-strange states, but also provide important
information on future experimental search for the missing higher radial and
orbital excitations in the charmed-strange meson family, which will be valuable
task in LHCb, forthcoming BelleII and PANDA.
","[{""version"":""v1"",""created"":""Thu, 15 Jan 2015 05:11:10 GMT""},{""version"":""v2"",""created"":""Wed, 4 Mar 2015 02:14:29 GMT""}]","2015-03-27"
"1501.03576","Prashant Srivastava Kumar","P. K. Srivastava, Lata Thakur, Binoy Krishna Patra","Electrical Conductivity of an Anisotropic Quark Gluon Plasma : A
  Quasiparticle Approach","8 pages, 4 figures","Phys. Rev. C 91, 044903 (2015)","10.1103/PhysRevC.91.044903",,"hep-ph nucl-th","http://arxiv.org/licenses/nonexclusive-distrib/1.0/","  The study of transport coefficients of strongly interacting matter got
impetus after the discovery of perfect fluid ever created at ultrarelativistic
heavy ion collision experiments. In this article, we have calculated one such
coefficient viz. electrical conductivity of the quark gluon plasma (QGP) phase
which exhibits a momentum anisotropy. Relativistic Boltzmann's kinetic equation
has been solved in the relaxation-time approximation to obtain the electrical
conductivity. We have used the quasiparticle description to define the basic
properties of QGP. We have compared our model results with the corresponding
results obtained in different lattice as well as other model calculations.
Furthermore, we extend our model to calculate the electrical conductivity at
finite chemical potential.
","[{""version"":""v1"",""created"":""Thu, 15 Jan 2015 05:17:29 GMT""}]","2015-04-14"
"1501.03577","Tao Zhou","Xuzhen Zhu, Hui Tian, Zheng Hu, Ping Zhang, Tao Zhou","Consistence beats causality in recommender systems","16 pages, 4 tables, 4 figures",,,,"cs.IR physics.data-an","http://arxiv.org/licenses/nonexclusive-distrib/1.0/","  The explosive growth of information challenges people's capability in finding
out items fitting to their own interests. Recommender systems provide an
efficient solution by automatically push possibly relevant items to users
according to their past preferences. Recommendation algorithms usually embody
the causality from what having been collected to what should be recommended. In
this article, we argue that in many cases, a user's interests are stable, and
thus the previous and future preferences are highly consistent. The temporal
order of collections then does not necessarily imply a causality relationship.
We further propose a consistence-based algorithm that outperforms the
state-of-the-art recommendation algorithms in disparate real data sets,
including \textit{Netflix}, \textit{MovieLens}, \textit{Amazon} and
\textit{Rate Your Music}.
","[{""version"":""v1"",""created"":""Thu, 15 Jan 2015 05:17:31 GMT""}]","2015-01-16"
"1501.03578","Liang Liu","Liang Liu, Zhenxiang Xi, Shaoyuan Wu, Charles Davis, Scott V. Edwards","Estimating phylogenetic trees from genome-scale data","39 pages, 3 figures",,"10.1111/nyas.12747",,"q-bio.PE","http://arxiv.org/licenses/nonexclusive-distrib/1.0/","  As researchers collect increasingly large molecular data sets to reconstruct
the Tree of Life, the heterogeneity of signals in the genomes of diverse
organisms poses challenges for traditional phylogenetic analysis. A class of
phylogenetic methods known as ""species tree methods"" have been proposed to
directly address one important source of gene tree heterogeneity, namely the
incomplete lineage sorting or deep coalescence that occurs when evolving
lineages radiate rapidly, resulting in a diversity of gene trees from a single
underlying species tree. Although such methods are gaining in popularity, they
are being adopted with caution in some quarters, in part because of an
increasing number of examples of strong phylogenetic conflict between
concatenation or supermatrix methods and species tree methods. Here we review
theory and empirical examples that help clarify these conflicts. Thinking of
concatenation as a special case of the more general model provided by the
multispecies coalescent can help explain a number of differences in the
behavior of the two methods on phylogenomic data sets. Recent work suggests
that species tree methods are more robust than concatenation approaches to some
of the classic challenges of phylogenetic analysis, including rapidly evolving
sites in DNA sequences, base compositional heterogeneity and long branch
attraction. We show that approaches such as binning, designed to augment the
signal in species tree analyses, can distort the distribution of gene trees and
are inconsistent. Computationally efficient species tree methods that
incorporate biological realism are a key to phylogenetic analysis of whole
genome data.
","[{""version"":""v1"",""created"":""Thu, 15 Jan 2015 05:21:26 GMT""}]","2015-09-11"
"1501.03579","Subhajit Goswami","Jian Ding, Subhajit Goswami","Percolation of averages in the stochastic mean field model: the
  near-supercritical regime","21 pages, 3 figures","Electron. J. Probab. 20 (2015), no. 124, 21 pp","10.1214/EJP.v20-4111",,"math.PR","http://arxiv.org/licenses/nonexclusive-distrib/1.0/","  For a complete graph of size $n$, assign each edge an i.i.d.\ exponential
variable with mean $n$. For $\lambda>0$, consider the length of the longest
path whose average weight is at most $\lambda$. It was shown by Aldous (1998)
that the length is of order $\log n$ for $\lambda < 1/\mathrm{e}$ and of order
$n$ for $\lambda > 1/\mathrm{e}$. In this paper, we study the
near-supercritical regime where $\lambda = \mathrm{e}^{-1} +\eta$ with $\eta>0$
a small fixed number. We show that there exist two absolute constants $c^*,
C^*>0$ such that with high probability the length is in between $n
\mathrm{e}^{-C^*/\sqrt{\eta}}$ and $n \mathrm{e}^{-c^*/\sqrt{\eta}}$. Our
result corrects a non-rigorous prediction of Aldous (2005).
","[{""version"":""v1"",""created"":""Thu, 15 Jan 2015 05:23:36 GMT""},{""version"":""v2"",""created"":""Mon, 19 Jan 2015 00:51:12 GMT""},{""version"":""v3"",""created"":""Thu, 19 Nov 2015 22:02:04 GMT""}]","2016-11-01"
"1501.03580","Xiang-peng Xin","Xiangpeng Xin","Nonlocal symmetries and conservation laws of the coupled Hirota equation",,,,,"math-ph math.MP nlin.SI","http://arxiv.org/licenses/nonexclusive-distrib/1.0/","  Using the lax pair, nonlocal symmetry of the coupled Hirota equation is
obtained. By introducing an appropriate auxiliary dependent variable the
nonlocal symmetry is successfully localized to a Lie point symmetry. For the
closed prolongation, one-dimensional optimal systems and nonlocal conservation
laws of the coupled Hirota equation are studied.
","[{""version"":""v1"",""created"":""Thu, 15 Jan 2015 05:44:10 GMT""}]","2015-01-16"
"1501.03581","Andrei Khrennikov Yu","Andrei Khrennikov","Classical probabilistic realization of ""Random Numbers Certified by
  Bell's Theorem""",,"Journal of Physics: Conference Series, Volume 626, 012018, 2015",,,"quant-ph math.PR","http://arxiv.org/licenses/nonexclusive-distrib/1.0/","  We question the commonly accepted statement that random numbers certified by
Bell's theorem carry some special sort of randomness, so to say, quantum
randomness or intrinsic randomness. We show that such numbers can be easily
generated by classical random generators.
","[{""version"":""v1"",""created"":""Thu, 15 Jan 2015 05:49:51 GMT""}]","2018-08-07"
