"1501.03656","L\'aszl\'o Guly\'as","L. Guly\'as, S. Egri, T. Kirchner","Differential cross sections for single ionization of Li in collisions
  with fast protons and O$^{8+}$ ions",,"Phys. Rev. A 90, 062710 (2014)","10.1103/PhysRevA.90.062710",,"physics.atom-ph","http://arxiv.org/licenses/nonexclusive-distrib/1.0/","  We study the process of single ionization of Li in collisions with H$^+$ and
O$^{8+}$ projectile ions at 6 MeV and 1.5-MeV/amu impact energies,
respectively. Using the frameworks of the independent-electron model and the
impact parameter picture, fully (FDCS) and doubly (DDCS) differential cross
sections are evaluated in the continuum distorted-wave with eikonal
initial-state approximation. Comparisons are made with the recent measurements
of LaForge \textit{et al} [J. Phys. B \textbf{46} 031001 (2013)] for the DDCS
and Hubele \textit{et al} [Phys. Rev. Lett. \textbf{110} 133201 (2013)] for the
FDCS, respectively. For O$^{8+}$ impact inclusion of the heavy particle (NN)
interaction in the calculations is crucial and effects of polarization due to
the presence of the projectile ion have also to be taken into account for
getting very good agreement with the measured data. Our calculation reproduces
the satellite peak structure seen in the FDCS for the Li(2s) measurement, which
we explain as being formed by a combination of the binary and NN interactions.
","[{""version"":""v1"",""created"":""Thu, 15 Jan 2015 12:53:24 GMT""}]","2015-01-16"
"1501.03657","Gabor P. Nagy","G\'abor P. Nagy","On centerless commutative automorphic loops",,"Comment. Math. Univ. Carolin. 55 (2014), no. 4, 485--491",,,"math.GR","http://arxiv.org/licenses/nonexclusive-distrib/1.0/","  In this short paper, we survey the results on commutative automorphic loops
and give a new construction method. Using this method, we present new classes
of commutative automorphic loops of exponent 2 with trivial center.
","[{""version"":""v1"",""created"":""Thu, 15 Jan 2015 12:54:43 GMT""}]","2015-01-16"
"1501.03658","Oleg Kirillov N","Oleg N. Kirillov, Mark Levi","Rotating saddle trap as Foucault's pendulum","13 pages, 9 figures","Am. J. Phys. 84, 26-31 (2016)","10.1119/1.4933206",,"physics.class-ph math-ph math.MP physics.acc-ph","http://arxiv.org/licenses/nonexclusive-distrib/1.0/","  One of the many surprising results found in the mechanics of rotating systems
is the stabilization of a particle in a rapidly rotating planar saddle
potential. Besides the counterintuitive stabilization, an unexpected
precessional motion is observed. In this note we show that this precession is
due to a Coriolis-like force caused by the rotation of the potential. To our
knowledge this is the first example where such force arises in an inertial
reference frame. We also propose an idea of a simple mechanical demonstration
of this effect.
","[{""version"":""v1"",""created"":""Thu, 15 Jan 2015 12:57:59 GMT""},{""version"":""v2"",""created"":""Wed, 3 Jun 2015 10:44:50 GMT""},{""version"":""v3"",""created"":""Tue, 30 Jun 2015 10:22:41 GMT""},{""version"":""v4"",""created"":""Fri, 21 Aug 2015 09:49:34 GMT""}]","2015-12-23"
"1501.03659","Azzimonti Dario","Dario Azzimonti (IMSV), Julien Bect (GdR MASCOT-NUM, L2S), Cl\'ement
  Chevalier (UNINE), David Ginsbourger (Idiap, IMSV)","Quantifying uncertainties on excursion sets under a Gaussian random
  field prior",,"SIAM/ASA Journal on Uncertainty Quantification, 4(1):850-874, 2016","10.1137/141000749",,"math.ST stat.CO stat.ML stat.TH","http://arxiv.org/licenses/nonexclusive-distrib/1.0/","  We focus on the problem of estimating and quantifying uncertainties on the
excursion set of a function under a limited evaluation budget. We adopt a
Bayesian approach where the objective function is assumed to be a realization
of a Gaussian random field. In this setting, the posterior distribution on the
objective function gives rise to a posterior distribution on excursion sets.
Several approaches exist to summarize the distribution of such sets based on
random closed set theory. While the recently proposed Vorob'ev approach
exploits analytical formulae, further notions of variability require Monte
Carlo estimators relying on Gaussian random field conditional simulations. In
the present work we propose a method to choose Monte Carlo simulation points
and obtain quasi-realizations of the conditional field at fine designs through
affine predictors. The points are chosen optimally in the sense that they
minimize the posterior expected distance in measure between the excursion set
and its reconstruction. The proposed method reduces the computational costs due
to Monte Carlo simulations and enables the computation of quasi-realizations on
fine designs in large dimensions. We apply this reconstruction approach to
obtain realizations of an excursion set on a fine grid which allow us to give a
new measure of uncertainty based on the distance transform of the excursion
set. Finally we present a safety engineering test case where the simulation
method is employed to compute a Monte Carlo estimate of a contour line.
","[{""version"":""v1"",""created"":""Thu, 15 Jan 2015 12:58:28 GMT""},{""version"":""v2"",""created"":""Wed, 13 Apr 2016 11:24:30 GMT""}]","2017-08-02"
"1501.03660","Graham Alldredge","Graham Alldredge and Florian Schneider","A realizability-preserving discontinuous Galerkin scheme for
  entropy-based moment closures for linear kinetic equations in one space
  dimension",,,"10.1016/j.jcp.2015.04.034",,"math.NA","http://arxiv.org/licenses/nonexclusive-distrib/1.0/","  We implement a high-order numerical scheme for the entropy-based moment
closure, the so-called M$_N$ model, for linear kinetic equations in slab
geometry. A discontinuous Galerkin (DG) scheme in space along with a
strong-stability preserving Runge-Kutta time integrator is a natural choice to
achieve a third-order scheme, but so far, the challenge for such a scheme in
this context is the implementation of a linear scaling limiter when the
numerical solution leaves the set of realizable moments (that is, those moments
associated with a positive underlying distribution). The difficulty for such a
limiter lies in the computation of the intersection of a ray with the set of
realizable moments. We avoid this computation by using quadrature to generate a
convex polytope which approximates this set. The half-space representation of
this polytope is used to compute an approximation of the required intersection
straightforwardly, and with this limiter in hand, the rest of the DG scheme is
constructed using standard techniques. We consider the resulting numerical
scheme on a new manufactured solution and standard benchmark problems for both
traditional M$_N$ models and the so-called mixed-moment models. The
manufactured solution allows us to observe the expected convergence rates and
explore the effects of the regularization in the optimization.
","[{""version"":""v1"",""created"":""Thu, 15 Jan 2015 13:00:35 GMT""},{""version"":""v2"",""created"":""Tue, 20 Jan 2015 17:04:42 GMT""},{""version"":""v3"",""created"":""Mon, 22 Jun 2015 12:35:54 GMT""}]","2015-06-23"
"1501.03661","Alex Bernardini Dr.","Alex E. Bernardini and Salomon S. Mizrahi","Coherent quantum squeezing due to the phase space noncommutativity","12 pages, 2 figures, as an Invited Comment for Physica Scripta","Phys. Scripta 90 (2015) 074011","10.1088/0031-8949/90/7/074011",,"quant-ph hep-th","http://arxiv.org/licenses/nonexclusive-distrib/1.0/","  The effect of phase space general noncommutativity on producing deformed
coherent squeezed states is examined. A two-dimensional noncommutative quantum
system supported by a deformed mathematical structure similar to that of
Hadamard billiards is obtained and their components behavior are monitored in
time. It is assumed that the independent degrees of freedom are two \emph{free}
1D harmonic oscillators (HO's), so the system Hamiltonian does not contain
interaction terms. Through the noncommutative deformation parameterized by a
Seiberg-Witten transform on the original canonical variables, one gets the
standard commutation relations for the new ones, such that the obtained
Hamiltonian represents then two \emph{interacting} 1D HO's. By assuming that
one HO is inverted relatively to the other, we show that their effective
interaction induces a squeezing dynamics for initial coherent states imaged in
the phase space. A suitable pattern of logarithmic spirals is obtained and some
relevant properties are discussed in terms of Wigner functions, which are
essential to put in evidence the effects of the noncommutativity.
","[{""version"":""v1"",""created"":""Thu, 15 Jan 2015 13:03:47 GMT""}]","2015-08-04"
"1501.03662","Gabor P. Nagy","Valentino Lanzone and G\'abor P. Nagy","Binary Fields on Limited Systems",,"Acta Sci. Math. (Szeged) 80:3-4(2014), 409-418","10.14232/actasm-012-813-7",,"math.CO","http://arxiv.org/licenses/nonexclusive-distrib/1.0/","  The intrinsic structure of binary fields poses a challenging complexity
problem from both hardware and software point of view. Motivated by
applications to modern cryptography, we describe some simple techniques aimed
at performing computations over binary fields using systems with limited
resources. This is particularly important when such computations must be
carried out by means of very small and simple machines. The algorithms
described in the present paper provide an increased efficiency in computations,
when compared to the previously known algorithms for the arithmetic over prime
fields.
","[{""version"":""v1"",""created"":""Thu, 15 Jan 2015 13:03:50 GMT""}]","2015-01-16"
"1501.03663","A. A. Ovchinnikov","A.A. Ovchinnikov","Baxter Q- operator and functional relations","10 pages, few comments added","Phys.Lett.B 742 (2015) 335-339","10.1016/j.physletb.2015.02.004",,"math-ph cond-mat.str-el hep-th math.MP","http://arxiv.org/licenses/nonexclusive-distrib/1.0/","  We obtain the Baxter Q-operators in the $U_q(\hat{sl}_2)$ invariant
integrable models as a special limits of the quantum transfer matrices
corresponding to different spins in the auxiliary space both from the
functional relations and from the explicit calculations. We derive the Baxter
equation from the well known fusion relations for the transfer matrices. Our
method is valid for an arbitrary integrable model corresponding to the quantum
group $U_q(\hat{sl}_2)$ for example for the XXZ- spin chain.
","[{""version"":""v1"",""created"":""Thu, 15 Jan 2015 13:06:43 GMT""},{""version"":""v2"",""created"":""Mon, 19 Jan 2015 11:42:52 GMT""}]","2015-06-23"
"1501.03664","Gyula Pap","J\'anos Marcell Benke and Gyula Pap","Local asymptotic quadraticity of statistical experiments connected with
  a Heston model","29 pages","Acta Sci. Math. (Szeged) 83:1-2(2017), 313-344","10.14232/actasm-016-506-x",,"math.ST stat.TH","http://arxiv.org/licenses/nonexclusive-distrib/1.0/","  We study local asymptotic properties of likelihood ratios of certain Heston
models. We distinguish three cases: subcritical, critical and supercritical
models. For the drift parameters, local asymptotic normality is proved in the
subcritical case, only local asymptotic quadraticity is shown in the critical
case, while in the supercritical case not even local asymptotic quadraticity
holds. For certain submodels, local asymptotic normality is proved in the
critical case, and local asymptotic mixed normality is shown in the
supercritical case. As a consequence, asymptotically optimal (randomized) tests
are constructed in cases of local asymptotic normality. Moreover, local
asymptotic minimax bound, and hence, asymptotic efficiency in the convolution
theorem sense are concluded for the maximum likelihood estimators in cases of
local asymptotic mixed normality.
","[{""version"":""v1"",""created"":""Thu, 15 Jan 2015 13:13:09 GMT""}]","2019-10-17"
"1501.03665","Takuya Matsumoto","Takuya Matsumoto and Kentaroh Yoshida","Yang-Baxter sigma models based on the CYBE","23 pages; v2: a reference added, small modifications; v3: minor
  corrections",,"10.1016/j.nuclphysb.2015.02.009","KUNS-2534","hep-th","http://arxiv.org/licenses/nonexclusive-distrib/1.0/","  It is known that Yang-Baxter sigma models provide a systematic way to study
integrable deformations of both principal chiral models and symmetric coset
sigma models. In the original proposal and its subsequent development, the
deformations have been characterized by classical $r$-matrices satisfying the
modified classical Yang-Baxter equation (mCYBE). In this article, we propose
the Yang-Baxter sigma models based on the classical Yang-Baxter equations
(CYBE) rather than the mCYBE. This generalization enables us to utilize various
kinds of solutions of the CYBE to classify integrable deformations. In
particular, it is straightforward to realize partial deformations of the target
space without loss of the integrability of the parent theory.
","[{""version"":""v1"",""created"":""Thu, 15 Jan 2015 13:15:07 GMT""},{""version"":""v2"",""created"":""Wed, 21 Jan 2015 06:51:49 GMT""},{""version"":""v3"",""created"":""Mon, 25 May 2015 13:12:53 GMT""}]","2015-05-26"
"1501.03666","Kai Tian","Kai Tian and Q. P. Liu","Conservation laws and symmetries of Hunter-Saxton equation: revisited","18 pages",,"10.1088/0951-7715/29/3/737",,"nlin.SI","http://arxiv.org/licenses/nonexclusive-distrib/1.0/","  Through a reciprocal transformation $\mathcal{T}_0$ induced by the
conservation law $\partial_t(u_x^2) = \partial_x(2uu_x^2)$, the Hunter-Saxton
(HS) equation $u_{xt} = 2uu_{2x} + u_x^2$ is shown to possess conserved
densities involving arbitrary smooth functions, which have their roots in
infinitesimal symmetries of $w_t = w^2$, the counterpart of the HS equation
under $\mathcal{T}_0$. Hierarchies of commuting symmetries of the HS equation
are studied under appropriate changes of variables initiated by
$\mathcal{T}_0$, and two of these are linearized while the other is identical
to the hierarchy of commuting symmetries admitted by the potential modified
Korteweg-de Vries equation. A fifth order symmetry of the HS equation is
endowed with a sixth order hereditary recursion operator by its connection with
the Fordy-Gibbons equation. These results reveal the origin for the rich and
remarkable structures of the HS equation and partially answer the questions
raised by Wang [{\it Nonlinearity} {\bf 23}(2010) 2009].
","[{""version"":""v1"",""created"":""Thu, 15 Jan 2015 13:17:47 GMT""}]","2016-02-17"
"1501.03667","Dmitry Svintsov","Dmitry A. Svintsov, Aleksey V. Arsenin, and Dmitry Yu. Fedyanin","Full loss compensation in hybrid plasmonic waveguides under electrical
  pumping","5 figures","Optics Express, vol. 23, iss. 15, pp. 19358-19375 (2015)","10.1364/OE.23.019358",,"cond-mat.mes-hall","http://arxiv.org/licenses/nonexclusive-distrib/1.0/","  Surface plasmon polaritons (SPPs) give an opportunity to break the
diffraction limit and design nanoscale optical components, however their
practical implementation is hindered by high ohmic losses in a metal. Here, we
propose a novel approach for efficient SPP amplification under electrical
pumping in a deep-subwavelength metal-insulator-semiconductor waveguiding
geometry and numerically demonstrate full compensation for the SPP propagation
losses in the infrared at an exceptionally low pump current density of 0.8
kA/cm$^2$. This value is an order of magnitude lower than in the previous
studies owing to the thin insulator layer between a metal and a semiconductor,
which allows injection of minority carriers and blocks majority carriers
reducing the leakage current to nearly zero. The presented results provide
insight into lossless SPP guiding and development of future high dense
nanophotonic and optoelectronic circuits.
","[{""version"":""v1"",""created"":""Thu, 15 Jan 2015 13:20:54 GMT""}]","2015-08-12"
"1501.03668","Cecilia Ceccarelli dr","Nadia Balucani, Cecilia Ceccarelli, Vianney Taquet","Formation of complex organic molecules in cold objects: the role of gas
  phase reactions","MNRAS, accepted",,"10.1093/mnrasl/slv009",,"astro-ph.SR","http://arxiv.org/licenses/nonexclusive-distrib/1.0/","  While astrochemical models are successful in reproducing many of the observed
interstellar species, they have been struggling to explain the observed
abundances of complex organic molecules. Current models tend to privilege grain
surface over gas phase chemistry in their formation. One key assumption of
those models is that radicals trapped in the grain mantles gain mobility and
react on lukewarm (>30 K) dust grains. Thus, the recent detections of methyl
formate (MF) and dimethyl ether (DME) in cold objects represent a challenge and
may clarify the respective role of grain surface and gas phase chemistry. We
propose here a new model to form DME and MF with gas phase reactions in cold
environments, where DME is the precursor of MF via an efficient reaction
overlooked by previous models. Furthermore, methoxy, a precursor of DME, is
also synthetized in the gas phase from methanol, which is desorbed by a
non-thermal process from the ices. Our new model reproduces fairy well the
observations towards L1544. It also explains, in a natural way, the observed
correlation between DME and MF. We conclude that gas phase reactions are major
actors in the formation of MF, DME and methoxy in cold gas. This challenges the
exclusive role of grain-surface chemistry and favours a combined grain-gas
chemistry.
","[{""version"":""v1"",""created"":""Thu, 15 Jan 2015 13:20:59 GMT""}]","2015-06-23"
"1501.03669","Giovanni Chierchia","G. Chierchia, Nelly Pustelnik, Jean-Christophe Pesquet, B.
  Pesquet-Popescu","A Proximal Approach for Sparse Multiclass SVM",,,,,"cs.LG","http://arxiv.org/licenses/nonexclusive-distrib/1.0/","  Sparsity-inducing penalties are useful tools to design multiclass support
vector machines (SVMs). In this paper, we propose a convex optimization
approach for efficiently and exactly solving the multiclass SVM learning
problem involving a sparse regularization and the multiclass hinge loss
formulated by Crammer and Singer. We provide two algorithms: the first one
dealing with the hinge loss as a penalty term, and the other one addressing the
case when the hinge loss is enforced through a constraint. The related convex
optimization problems can be efficiently solved thanks to the flexibility
offered by recent primal-dual proximal algorithms and epigraphical splitting
techniques. Experiments carried out on several datasets demonstrate the
interest of considering the exact expression of the hinge loss rather than a
smooth approximation. The efficiency of the proposed algorithms w.r.t. several
state-of-the-art methods is also assessed through comparisons of execution
times.
","[{""version"":""v1"",""created"":""Thu, 15 Jan 2015 13:23:14 GMT""},{""version"":""v2"",""created"":""Fri, 16 Jan 2015 09:26:32 GMT""},{""version"":""v3"",""created"":""Fri, 6 Feb 2015 23:36:03 GMT""},{""version"":""v4"",""created"":""Sun, 26 Apr 2015 15:33:36 GMT""},{""version"":""v5"",""created"":""Mon, 14 Dec 2015 09:49:32 GMT""}]","2015-12-15"
"1501.03670","Sandrine Codis","Francis Bernardeau, Sandrine Codis and Christophe Pichon","The joint statistics of mildly non-linear cosmological densities and
  slopes in count-in-cells","5 pages, 6 figures, submitted to MNRAS Letters",,"10.1093/mnrasl/slv028",,"astro-ph.CO","http://arxiv.org/licenses/nonexclusive-distrib/1.0/","  In the context of count-in-cells statistics, the joint probability
distribution of the density in two concentric spherical shells is predicted
from first first principle for sigmas of the order of one. The agreement with
simulation is found to be excellent. This statistics allows us to deduce the
conditional one dimensional probability distribution function of the slope
within under dense (resp. overdense) regions, or of the density for positive or
negative slopes. The former conditional distribution is likely to be more
robust in constraining the cosmological parameters as the underlying dynamics
is less evolved in such regions. A fiducial dark energy experiment is
implemented on such counts derived from Lambda-CDM simulations.
","[{""version"":""v1"",""created"":""Thu, 15 Jan 2015 13:31:10 GMT""}]","2015-06-23"
"1501.03671","Xavier Bacalla","Xavier Bacalla, Dongfeng Zhao, Edcel J. Salumbides, Mohammad Ali
  Haddad, Harold Linnartz, and Wim Ubachs","The B$^2\Pi-$X$^2\Pi$ electronic origin band of $^{13}$C$_6$H","4 pages, 1 figure, 2 tables",,"10.1016/j.jms.2015.01.005",,"physics.atom-ph","http://arxiv.org/licenses/nonexclusive-distrib/1.0/","  The rotationally resolved spectrum of the B$^2\Pi-$X$^2\Pi$ electronic origin
band transition of $^{13}$C$_6$H is presented. The spectrum is recorded using
cavity ring-down spectroscopy in combination with supersonic plasma jets by
discharging a $^{13}$C$_2$H$_2$/He/Ar gas mixture. A detailed analysis of more
than a hundred fully-resolved transitions allows for an accurate determination
of the spectroscopic parameters for both the ground and electronically excited
state of $^{13}$C$_6$H.
","[{""version"":""v1"",""created"":""Thu, 15 Jan 2015 13:31:30 GMT""}]","2015-05-20"
"1501.03672","Laure Ciesla","L. Ciesla, V. Charmandaris, A. Georgakakis, E. Bernhard, P.D.
  Mitchell, V. Buat, D. Elbaz, E. Le Floc'h, C. G. Lacey, G. E. Magdis and M.
  Xilouris","Constraining the properties of AGN host galaxies with Spectral Energy
  Distribution modeling","20 pages, Accepted for publication in A&A","A&A 576, A10 (2015)","10.1051/0004-6361/201425252",,"astro-ph.GA","http://arxiv.org/licenses/nonexclusive-distrib/1.0/","  [abridged] We use the latest release of CIGALE, a galaxy SED fitting model
relying on energy balance, to study the influence of an AGN in estimating both
the SFR and stellar mass in galaxies, as well as the contribution of the AGN to
the power output of the host. Using the galaxy formation SAM GALFORM, we create
mock galaxy SEDs using realistic star formation histories (SFH) and add an AGN
of Type 1, Type 2, or intermediate type whose contribution to the bolometric
luminosity can be variable. We perform an SED fitting of these catalogues with
CIGALE assuming three different SFHs: a single- and
double-exponentially-decreasing, and a delayed SFH. Constraining
thecontribution of an AGN to the LIR (fracAGN) is very challenging for
fracAGN<20%, with uncertainties of ~5-30% for higher fractions depending on the
AGN type, while FIR and sub-mm are essential. The AGN power has an impact on
the estimation of $M_*$ in Type 1 and intermediate type AGNs but has no effect
for galaxies hosting Type 2 AGNs. We find that in the absence of AGN emission,
the best estimates of $M_*$ are obtained using the
double-exponentially-decreasing model but at the expense of realistic ages of
the stellar population. The delayed SFH model provides good estimates of $M_*$
and SFR, with a maximum offset of 10% as well as better estimates of the age.
Our analysis shows that the underestimation of the SFR increases with fracAGN
for Type 1 systems, as well as for low contributions of an intermediate AGN
type, but it is quite insensitive to the emission of Type 2 AGNs up to
fracAGN~45%. Similarly the UV emission is critical in accurately retrieving the
$M_*$ for Type 1 and intermediate type AGN, and the SFR of all of the three AGN
types. We show that the presence of AGN emission introduces a scatter to the
SFR-$M_*$ main sequence relation derived from SED fitting, which is driven by
the uncertainties on $M_*$.
","[{""version"":""v1"",""created"":""Thu, 15 Jan 2015 13:35:59 GMT""},{""version"":""v2"",""created"":""Fri, 16 Jan 2015 11:15:09 GMT""}]","2015-03-18"
"1501.03673","Peter Hoyng","Peter Hoyng","Dynamics and performance of clock pendulums","9 pages, 6 figures","Am. J. Phys. 82 (2014) 1053-1061","10.1119/1.4891667",,"physics.class-ph","http://arxiv.org/licenses/nonexclusive-distrib/1.0/","  We analyze the dynamics of a driven, damped pendulum as used in mechanical
clocks. We derive equations for the amplitude and phase of the oscillation, on
time scales longer than the pendulum period. The equations are first order ODEs
and permit fast simulations of the joint effects of circular and escapement
errors, friction, and other disturbances for long times. The equations contain
two averages of the driving torque over a period, so that the results are not
very sensitive to the fine structure of the driving. We adopt a constant-torque
escapement and study the stationary pendulum rate as a function of driving
torque and friction. We also study the reaction of the pendulum to a sudden
change in the driving torque, and to stationary noisy driving. The equations
for the amplitude and phase are shown to describe the pendulum dynamics quite
well on time scales of one period and longer. Our emphasis is on a clear
exposition of the physics.
","[{""version"":""v1"",""created"":""Thu, 15 Jan 2015 13:38:24 GMT""}]","2015-01-16"
