"1508.01920","Qiang Fu","Qiang Fu, Mingqiang Liu","Presenting affine Schur Algebras","17 pages",,,,"math.RT math.RA","http://arxiv.org/licenses/nonexclusive-distrib/1.0/","  The universal enveloping algebra ${\mathcal U}({\widehat{\frak{gl}}_n})$ of
${\widehat{\frak{gl}}_n}$ was realized in \cite[Ch. 6]{DDF} using affine Schur
algebras. In particular some explicit multiplication formulas in affine Schur
algebras were derived. We use these formulas to study the structure of affine
Schur algebras. In particular, we give a presentation of the affine Schur
algebra ${\mathcal S}_{{\!\vartriangle}}(n,r)_{\mathbb Q}$.
","[{""version"":""v1"",""created"":""Sat, 8 Aug 2015 16:07:08 GMT""}]","2015-08-11"
"1508.01921","Omar Benvenuto","Omar G. Benvenuto (1), Jorge A. Panei (1), Ken'ichi Nomoto (2), Hikaru
  Kitamura (3), and Izumi Hachisu (4) ((1) Facultad de Ciencias Astron\'omicas
  y Geof\'isicas, Universidad Nacional de La Plata and Instituto de
  Astrof\'isica de La Plata, CCT-CONICET-UNLP, La Plata, Argentina, (2) Kavli
  Institute for the Physics and Mathematics of the Universe (WPI), The
  University of Tokyo, Japan, (3) Department of Physics, Kyoto University,
  Japan, (4) Department of Earth Science and Astronomy, College of Arts and
  Sciences, The University of Tokyo, Japan)","Final Evolution and Delayed Explosions of Spinning White Dwarfs in
  Single Degenerate Models for Type Ia Supernovae","6 pages, 5 figures, published in the Astrophysical Journal Letters,
  809, L6 (2015), added some corrections for errata","Astrophysical Journal Letters, 809, L6 (2015)","10.1088/2041-8205/809/1/L6",,"astro-ph.HE astro-ph.SR","http://arxiv.org/licenses/nonexclusive-distrib/1.0/","  We study the occurrence of delayed SNe~Ia in the single degenerate (SD)
scenario. We assume that a massive carbon-oxygen (CO) white dwarf (WD) accretes
matter coming from a companion star, making it to spin at the critical rate. We
assume uniform rotation due to magnetic field coupling. The carbon ignition
mass for non-rotating WDs is M_{ig}^{NR} \approx 1.38 M_{\odot}; while for the
case of uniformly rotating WDs it is a few percent larger (M_{ig}^{R} \approx
1.43 M_{\odot}). When accretion rate decreases, the WD begins to lose angular
momentum, shrinks, and spins up; however, it does not overflow its critical
rotation rate, avoiding mass shedding. Thus, angular momentum losses can lead
the CO WD interior to compression and carbon ignition, which would induce an
SN~Ia. The delay, largely due to the angular momentum losses timescale, may be
large enough to allow the companion star to evolve to a He WD, becoming
undetectable at the moment of explosion. This scenario supports the occurrence
of delayed SNe~Ia if the final CO WD mass is 1.38 M_{\odot} < M < 1.43
M_{\odot}. We also find that if the delay is longer than ~3 Gyr, the WD would
become too cold to explode, rather undergoing collapse.
","[{""version"":""v1"",""created"":""Sat, 8 Aug 2015 16:08:35 GMT""}]","2015-08-19"
"1508.01922","Rahul Mazumder","Rahul Mazumder and Peter Radchenko","The Discrete Dantzig Selector: Estimating Sparse Linear Models via Mixed
  Integer Linear Optimization",,,,,"stat.ME math.OC math.ST stat.CO stat.ML stat.TH","http://arxiv.org/licenses/nonexclusive-distrib/1.0/","  We propose a novel high-dimensional linear regression estimator: the Discrete
Dantzig Selector, which minimizes the number of nonzero regression coefficients
subject to a budget on the maximal absolute correlation between the features
and residuals. Motivated by the significant advances in integer optimization
over the past 10-15 years, we present a Mixed Integer Linear Optimization
(MILO) approach to obtain certifiably optimal global solutions to this
nonconvex optimization problem. The current state of algorithmics in integer
optimization makes our proposal substantially more computationally attractive
than the least squares subset selection framework based on integer quadratic
optimization, recently proposed in [8] and the continuous nonconvex quadratic
optimization framework of [33]. We propose new discrete first-order methods,
which when paired with state-of-the-art MILO solvers, lead to good solutions
for the Discrete Dantzig Selector problem for a given computational budget. We
illustrate that our integrated approach provides globally optimal solutions in
significantly shorter computation times, when compared to off-the-shelf MILO
solvers. We demonstrate both theoretically and empirically that in a wide range
of regimes the statistical properties of the Discrete Dantzig Selector are
superior to those of popular $\ell_{1}$-based approaches. We illustrate that
our approach can handle problem instances with p = 10,000 features with
certifiable optimality making it a highly scalable combinatorial variable
selection approach in sparse linear modeling.
","[{""version"":""v1"",""created"":""Sat, 8 Aug 2015 16:13:07 GMT""},{""version"":""v2"",""created"":""Thu, 16 Jun 2016 00:52:56 GMT""},{""version"":""v3"",""created"":""Thu, 19 Jan 2017 05:48:12 GMT""}]","2017-01-20"
"1508.01923","Jinwei Yang","Jinwei Yang","Vertex algebras associated to abelian current algebras","24 pages, Comments are very welcome. arXiv admin note: text overlap
  with arXiv:math/0206206, arXiv:1012.4193 by other authors","Int. J. Math. Vol. 27, No. 5 (2016)",,,"math.QA math.RT","http://arxiv.org/licenses/nonexclusive-distrib/1.0/","  We construct a family of vertex algebras associated to the current algebra of
finite-dimensional abelian Lie algebras along with their modules and
logarithmic modules. We show this family of vertex algebras and their modules
are quasi-conformal and strongly $\N$-graded and verify convergence and
extension property needed in the logarithmic tensor category theory for
strongly graded logarithmic modules developed by Huang, Lepowsky and Zhang.
","[{""version"":""v1"",""created"":""Sat, 8 Aug 2015 16:20:39 GMT""},{""version"":""v2"",""created"":""Tue, 25 Aug 2015 18:01:32 GMT""}]","2016-05-25"
"1508.01924","Luis Fernando Casta\~neda Melo L.F. Casta\~neda","R.M. Gutierrez, A.I. Hernandez, L.F. Castaneda, J.F. Castano","The Silicon photomultiplier as a metasystem with designed electronics as
  metadevice for a new receiver-emitter in visible light communications","SPIE: Metamaterials, Metadevices, and Metasystems 2015 (link:
  http://spie.org/OPN/conferencedetails/metamaterials-metadevices-metasystems)",,"10.1117/12.2190161",,"physics.ins-det","http://arxiv.org/licenses/nonexclusive-distrib/1.0/","  A Silicon Photomultiplier, SiPM, is a metasystem of Avalanche Photodiodes,
APDs, which embedded in a specific purpose electronic, becomes a metadevice
with unique and useful advanced functionalities to capture, transmit and
analyze information with increased efficiency and security. The SiPM is a very
small state of the art photo-detector with very high efficiency and
sensitivity, with good response to controlled light pulses in the presence of
background light without saturation. New results profit of such metadevice to
propose a new receiver-emitter system useful for Visible Light Communication,
VLC.
","[{""version"":""v1"",""created"":""Sat, 8 Aug 2015 16:25:41 GMT""}]","2015-12-09"
"1508.01925","Michel Thera","Truong Bao, Michel Thera","On Extended Versions of Dancs- Heged\""us-Medvegyev's Fixed Point Theorem",,,,,"math.OC","http://arxiv.org/licenses/nonexclusive-distrib/1.0/","  In this article we establish some fixed point (known also as critical point,
invariant point) theorems in quasi-metric spaces. Our results unify and further
extend in some regards the fixed point theorem proposed by Dancs et al. (1983),
the results given by Khanh and Quy (2010, 2011), the preorder principles
established by Qiu (2014), and the results obtained by Bao et al. (2015). In
addition, we provide examples to illustrate that the improvements of our
results are significant.
","[{""version"":""v1"",""created"":""Sat, 8 Aug 2015 17:05:42 GMT""}]","2015-08-11"
"1508.01926","Adnan Aijaz","Adnan Aijaz, Nazir Uddin, Oliver Holland, A. Hamid Aghvami","On Practical Aspects of Mobile Data Offloading to Wi-Fi Networks",,,,,"cs.NI","http://arxiv.org/licenses/nonexclusive-distrib/1.0/","  Data traffic over cellular networks is exhibiting an ongoing exponential
growth, increasing by an order of magnitude every year and has already
surpassed voice traffic. This increase in data traffic demand has led to a need
for solutions to enhance capacity provision, whereby traffic offloading to
Wi-Fi is one means that can enhance realised capacity. Though offloading to
Wi-Fi networks has matured over the years, a number of challenges are still
being faced by operators to its realization. In this article, we carry out a
survey of the practical challenges faced by operators in data traffic
offloading to Wi-Fi networks. We also provide recommendations to successfully
address these challenges.
","[{""version"":""v1"",""created"":""Sat, 8 Aug 2015 17:09:24 GMT""}]","2015-08-11"
"1508.01927","Keehang Kwon","Keehang Kwon","Incorporating Inductions and Game Semantics into Logic Programming","11 pages. arXiv admin note: substantial text overlap with
  arXiv:1507.07228",,,,"cs.LO","http://arxiv.org/licenses/nonexclusive-distrib/1.0/","  Inductions and game semantics are two useful extensions to traditional logic
programming. To be specific, inductions can capture a wider class of provable
formulas in logic programming. Adopting game semantics can make logic
programming more interactive.
  In this paper, we propose an execution model for a logic language with these
features. This execution model follows closely the reasoning process in real
life.
","[{""version"":""v1"",""created"":""Sat, 8 Aug 2015 17:14:09 GMT""}]","2015-08-11"
"1508.01928","Dejan Slep\v{c}ev","Nicol\'as Garc\'ia Trillos and Dejan Slep\v{c}ev","A variational approach to the consistency of spectral clustering",,,,,"math.ST cs.LG stat.ML stat.TH","http://arxiv.org/licenses/nonexclusive-distrib/1.0/","  This paper establishes the consistency of spectral approaches to data
clustering. We consider clustering of point clouds obtained as samples of a
ground-truth measure. A graph representing the point cloud is obtained by
assigning weights to edges based on the distance between the points they
connect. We investigate the spectral convergence of both unnormalized and
normalized graph Laplacians towards the appropriate operators in the continuum
domain. We obtain sharp conditions on how the connectivity radius can be scaled
with respect to the number of sample points for the spectral convergence to
hold.
  We also show that the discrete clusters obtained via spectral clustering
converge towards a continuum partition of the ground truth measure. Such
continuum partition minimizes a functional describing the continuum analogue of
the graph-based spectral partitioning. Our approach, based on variational
convergence, is general and flexible.
","[{""version"":""v1"",""created"":""Sat, 8 Aug 2015 17:14:51 GMT""}]","2015-08-11"
"1508.01929","Michal R\r{u}\v{z}i\v{c}ka","Martin L\'i\v{s}ka, Petr Sojka, Michal R\r{u}\v{z}i\v{c}ka","Combining Text and Formula Queries in Math Information Retrieval:
  Evaluation of Query Results Merging Strategies",,,"10.1145/2810355.2810359",,"cs.IR","http://arxiv.org/licenses/nonexclusive-distrib/1.0/","  Specific to Math Information Retrieval is combining text with mathematical
formulae both in documents and in queries. Rigorous evaluation of query
expansion and merging strategies combining math and standard textual keyword
terms in a query are given. It is shown that techniques similar to those known
from textual query processing may be applied in math information retrieval as
well, and lead to a cutting edge performance. Striping and merging partial
results from subqueries is one technique that improves results measured by
information retrieval evaluation metrics like Bpref.
","[{""version"":""v1"",""created"":""Sat, 8 Aug 2015 17:18:40 GMT""}]","2015-08-11"
"1508.01930","Michel Thera","Van Ngai Huynh, Huu Tron Nguyen, Michel Th\'era","Directional H\""older Metric Regularity",,,,,"math.OC","http://arxiv.org/licenses/nonexclusive-distrib/1.0/","  This paper sheds new light on regularity of multifunctions through various
characterizations of directional H\""older /Lipschitz metric regularity, which
are based on the concepts of slope and coderivative. By using these
characterizations, we show that directional H\""older /Lipschitz metric
regularity is stable, when the multifunction under consideration is perturbed
suitably. Applications of directional H\""older /Lipschitz metric regularity to
investigate the stability and the sensitivity analysis of parameterized
optimization problems are also discussed.
","[{""version"":""v1"",""created"":""Sat, 8 Aug 2015 17:19:19 GMT""}]","2015-08-11"
"1508.01931","Joaqu\'in D\'iaz Boils","Joaqu\'in D\'iaz Boils","A Geometry of Multimodal Systems","Comments are welcome",,,,"math.CT","http://arxiv.org/licenses/nonexclusive-distrib/1.0/","  Multimodal normal incestual systems are investigated in terms of multiple
categories. The different sorted composition of operators are exhibited as
2-cells in multiple categories built up from 2-categories giving rise to
different axioms. Subsequently, coherence results are proved pointing the
connections with (usual and mixed) Distributive Laws. This is given as a
geometrical description of certain axioms inside various systems with a number
of necessity and possibility operators.
","[{""version"":""v1"",""created"":""Sat, 8 Aug 2015 17:27:06 GMT""}]","2015-08-11"
"1508.01932","Francesca D'Antona","F. D'Antona, M. Di Criscienzo, T. Decressin, A. P. Milone, E.
  Vesperini and P. Ventura","The extended Main Sequence Turn Off cluster NGC1856: rotational
  evolution in a coeval stellar ensemble","8 pages 4 figures, accepted for publication on Monthly Notices of the
  R.A.S",,"10.1093/mnras/stv1794",,"astro-ph.SR astro-ph.GA","http://arxiv.org/licenses/nonexclusive-distrib/1.0/","  Multiple or extended turnoffs in young clusters in the Magellanic Clouds have
recently received large attention. A number of studies have shown that they may
be interpreted as the result of a significant age spread (several 10^8yr in
clusters aged 1--2 Gyr), while others attribute them to a spread in stellar
rotation. We focus on the cluster NGC 1856, showing a splitting in the upper
part of the main sequence, well visible in the color m_{F336W}-m_{F555W}$, and
a very wide turnoff region. Using population synthesis available from the
Geneva stellar models, we show that the cluster data can be interpreted as
superposition of two main populations having the same age (~350Myr), composed
for 2/3 of very rapidly rotating stars, defining the upper turnoff region and
the redder main sequence, and for 1/3 of slowly/non-rotating stars. Since rapid
rotation is a common property of the B-A type stars, the main question raised
by this model concerns the origin of the slowly/non-rotating component. Binary
synchronization is a possible process behind the slowly/non-rotating
population; in this case, many slowly/non-rotating stars should still be part
of binary systems with orbital periods in the range from 4 to 500 days. Such
periods imply that Roche lobe overflow occurs, during the evolution of the
primary off the main sequence, so most primaries may not be able to ignite core
helium burning, consistently why the lack of a red clump progeny of the slowly
rotating population.
","[{""version"":""v1"",""created"":""Sat, 8 Aug 2015 17:48:08 GMT""}]","2015-09-16"
"1508.01933","Sergio  Giardino","Sergio Giardino","M\""obius transformation for left-derivative quaternion holomorphic
  functions",,"Adv. Appl. Clifford Algebras (2017) 27: 1161","10.1007/s00006-016-0673-y",,"math-ph math.MP","http://arxiv.org/licenses/nonexclusive-distrib/1.0/","  Holomorphic quaternion functions only admit affine functions; thus, the
M\""obius transformation for these functions, which we call quaternionic
holomorphic transformation (QHT), only comprises similarity transformations. We
determine a general group $\mathsf{X}$ which has the group $\mathsf{G}$ of QHT
as a particular case. Furthermore, we observe that the M\""obius group and the
Heisenberg group may be obtained by making $\mathsf{X}$ more symmetric. We
provide matrix representations for the group $\mathsf{X}$ and for its algebra
$\mathfrak{x}$. The Lie algebra is neither simple nor semi-simple, and so it is
not classified among the classical Lie algebras. They prove that the group
$\mathsf{G}$ comprises $\mathsf{SU}(2,\mathbb{C})$ rotations, dilations and
translations. The only fixed point of the QHT is located at infinity, and the
QHT does not admit a cross-ratio. Physical applications are addressed at the
conclusion.
","[{""version"":""v1"",""created"":""Sat, 8 Aug 2015 17:50:32 GMT""}]","2018-04-03"
"1508.01934","Tristan Collins","Tristan C. Collins, Adam Jacob, Shing-Tung Yau","(1,1) forms with specified Lagrangian phase: A priori estimates and
  algebraic obstructions",,,,,"math.DG math.AP","http://arxiv.org/licenses/nonexclusive-distrib/1.0/","  Let $(X,\alpha)$ be a K\""ahler manifold of dimension n, and let $[\omega] \in
H^{1,1}(X,\mathbb{R})$. We study the problem of specifying the Lagrangian phase
of $\omega$ with respect to $\alpha$, which is described by the nonlinear
elliptic equation \[ \sum_{i=1}^{n} \arctan(\lambda_i)= h(x) \] where
$\lambda_i$ are the eigenvalues of $\omega$ with respect to $\alpha$. When
$h(x)$ is a topological constant, this equation corresponds to the deformed
Hermitian-Yang-Mills (dHYM) equation, and is related by Mirror Symmetry to the
existence of special Lagrangian submanifolds of the mirror. We introduce a
notion of subsolution for this equation, and prove a priori $C^{2,\beta}$
estimates when $|h|>(n-2)\frac{\pi}{2}$ and a subsolution exists. Using the
method of continuity we show that the dHYM equation admits a smooth solution in
the supercritical phase case, whenever a subsolution exists. Finally, we
discover some stability-type cohomological obstructions to the existence of
solutions to the dHYM equation and we conjecture that when these obstructions
vanish the dHYM equation admits a solution. We confirm this conjecture for
complex surfaces.
","[{""version"":""v1"",""created"":""Sat, 8 Aug 2015 18:01:02 GMT""}]","2015-08-11"
"1508.01935","Nicolas Ford","Nicolas Ford","Geometric Shifts and Positroid Varieties","arXiv admin note: substantial text overlap with arXiv:1309.0460",,,,"math.AG","http://arxiv.org/licenses/nonexclusive-distrib/1.0/","  Matroid varieties are the closures in the Grassmannian of sets of points
defined by specifying which Pl\""ucker coordinates vanish and which don't ---
the set of nonvanishing Pl\""ucker coordinates forms a well-studied object
called a matroid. Many problems in enumerative geometry could be solved if
there were an efficient way to compute the cohomology class of a matroid
variety in an efficient way just from the combinatorial data contained in the
matroid itself. Unfortunately, in full generality, this problem is known to be
completely intractable. In this thesis, we explore two attempts to get a handle
on this problem in the special case of a better-behaved class of matroids
called positroids. First we examine a method based on degenerations on the
Grassmannian that's known to be successful for an even smaller class of
matroids called interval rank matroids, showing that it can be made to work
with some effort in rank 3 but that there is a counterexample demonstrating
that it is hopeless beyond that. Finally, we give a way of producing a number
for each matroid variety called its expected codimension that can be computed
combinatorially solely from the matroid itself and show that it agrees with the
actual codimension in the case of a positroid variety.
","[{""version"":""v1"",""created"":""Sat, 8 Aug 2015 18:11:35 GMT""}]","2015-08-11"
"1508.01936","Arthur D. Yaghjian","Arthur D. Yaghjian","Classical power and energy relations for macroscopic dipolar continua
  derived from the microscopic Maxwell equations","38 pages, 3 figures","Progress in Electromagnetics Research B, Vol. 71, pp. 1-37, 2016",,,"physics.class-ph","http://arxiv.org/licenses/nonexclusive-distrib/1.0/","  Positive semi-definite expressions for the time-domain macroscopic energy
density in passive, spatially nondispersive, dipolar continua are derived from
the underlying microscopic Maxwell equations satisfied by classical models of
discrete bound dipolar molecules or inclusions of the material or metamaterial
continua. The microscopic derivation reveals two distinct positive
semi-definite macroscopic energy expressions, one that applies to diamagnetic
continua and another that applies to paramagnetic continua. The diamagnetic
dipoles are ""unconditionally passive"" in that their Amperian magnetic dipole
moments are zero in the absence of applied fields. The analysis of paramagnetic
continua, whose magnetization is caused by the alignment of randomly oriented
""permanent"" Amperian magnetic dipole moments that dominate any induced
diamagnetic magnetization, is greatly simplified by first proving that the
microscopic power equations for rotating ""permanent"" Amperian magnetic dipoles
(which are shown to not satisfy unconditional passivity) reduce effectively to
the same power equations obeyed by rotating unconditionally passive
magnetic-charge magnetic dipoles. The difference between the macroscopic
paramagnetic and diamagnetic energy expressions is equal to a ""hidden energy""
that parallels the hidden momentum often attributed to Amperian magnetic
dipoles. The microscopic derivation reveals that this hidden energy is drawn
from the reservoir of inductive energy in the initial paramagnetic microscopic
Amperian magnetic dipole moments. The macroscopic, positive semi-definite,
time-domain energy expressions are applied to lossless bianisotropic media to
determine the inequalities obeyed by the frequency-domain bianisotropic
constitutive parameters. Subtleties associated with the causality as well as
the group and energy-transport velocities for diamagnetic media are discussed.
","[{""version"":""v1"",""created"":""Sat, 8 Aug 2015 18:14:51 GMT""},{""version"":""v2"",""created"":""Tue, 11 Aug 2015 19:37:36 GMT""},{""version"":""v3"",""created"":""Sat, 17 Oct 2015 16:55:42 GMT""},{""version"":""v4"",""created"":""Sun, 13 Mar 2016 14:02:08 GMT""},{""version"":""v5"",""created"":""Wed, 9 Nov 2016 20:57:58 GMT""}]","2016-11-10"
"1508.01937","Chong Qi","Zhe-Ying Wu, Chong Qi, Ramon Wyss, Hong-Liang Liu","Global calculations on the microscopic energies and nuclear
  deformations: Isospin dependence of the spin-orbit coupling","14 pages, 27 figures, 3 tables","Phys. Rev. C 92, 024306 (2015)","10.1103/PhysRevC.92.024306",,"nucl-th","http://arxiv.org/licenses/nonexclusive-distrib/1.0/","  The microscopic energies and nuclear deformations of about 1850 even-even
nuclei are calculated systematically within the macroscopic-microscopic
framework using three Woods-Saxon parameterizations, with different isospin
dependences, which were constructed mainly for nuclear spectroscopy
calculations. Calculations are performed in the deformation space $(\beta_2,
\gamma, \beta_4)$. Both the monopole and doubly stretched quadrupole
interactions are considered for the pairing channel. The ground state
deformations obtained by the three calculations are quite similar to each
other. Large differences are seen mainly in neutron-rich nuclei and in
superheavy nuclei. Systematic calculations on the shape-coexisting second
minima are also presented. As for the microscopic energies of the ground
states, the results are also very close to each other. Only in a few cases the
difference is larger than 2 MeV. The total binding energy is estimated by
adding the macroscopic energy provided by the usual liquid drop model with its
parameters fitted through the least square root and minimax criteria.
Calculations are also compared with the results of other
macroscopic-microscopic mass models. All the three calculations give similar
values for the deformations, microscopic energies and binding energies of most
nuclei. One may expect to have a better understanding of the isospin dependence
of the spin-orbital force with more data on proton- and neutron-rich nuclei.
","[{""version"":""v1"",""created"":""Sat, 8 Aug 2015 18:18:56 GMT""}]","2015-08-11"
"1508.01938","Steven Dale Cutkosky","Steven Dale Cutkosky","Asymptotic Multiplicities of Graded Families of Ideals and Linear Series","45 pages. This paper is a compilation of the two arXiv preprints ""The
  asymptotic growth of graded linear series on arbitrary projective schemes"",
  arXiv:1212.6186, and ""Multilicities of graded families of linear series"",
  arXiv:1301.5613, with some additional material","Advances in Mathematics 264 (2014), 55 - 113",,,"math.AC math.AG","http://arxiv.org/licenses/nonexclusive-distrib/1.0/","  We find simple necessary and sufficient conditions on a local ring $R$ of
dimension $d$ for the limit $$
\lim_{i\rightarrow\infty}\frac{\ell_R(R/I_n)}{n^d} $$ to exist whenever
$\{I_n\}$ is a graded family of $m_R$-primary ideals, and give a number of
applications. We also give simple necessary and sufficient conditions on
projective schemes over a field $k$ for asymptotic limits of the growth of all
graded linear series of a fixed Kodaira-Iitaka dimension to exist.
","[{""version"":""v1"",""created"":""Sat, 8 Aug 2015 18:23:01 GMT""}]","2015-08-11"
