"1508.02012","Teresa Crespo","Elzbieta Adamus, Pawel Bogdan, Teresa Crespo and Zbigniew Hajto","Jacobian Conjecture and Nilpotency",,,,,"math.AG","http://arxiv.org/licenses/nonexclusive-distrib/1.0/","  For K a field of characteristic 0 and d any integer number greater than or
equal to 2, we prove the invertibility of polynomial endomorphisms of the
affine space of dimension d over K of the form F=Id+H, where each coordinate of
H is the cube of a linear form and the cube of the Jacobian matrix of H is
equal to zero. Our proof uses the inversion algorithm for polynomial maps
presented in our previous paper. Our current result leads us to formulate a
conjecture relating the nilpotency degree of the Jacobian matrix of H with the
number of necessary steps in the inversion algorithm.
","[{""version"":""v1"",""created"":""Sun, 9 Aug 2015 11:27:58 GMT""}]","2015-08-11"
"1508.02013","Florian Pelupessy","Florian Pelupessy","On ""finitary"" Ramsey's theorem","11 pages",,,,"math.LO","http://arxiv.org/licenses/nonexclusive-distrib/1.0/","  We examine a version of Ramsey's theorem based on Tao, Gaspar and
Kohlenbach's ""finitary"" infinite pigeonhole principle.We will show that the
""finitary"" infinite Ramsey's theorem naturally gives rise to statements at the
level of the infinite Ramsey's theorem, Friedman's infinite adjacent Ramsey
theorem (well-foundedness of certain ordinals up to $\varepsilon_0$),
$1$-consistency of theories up to PA and the finite Ramsey's theorem.
","[{""version"":""v1"",""created"":""Sun, 9 Aug 2015 11:39:09 GMT""},{""version"":""v2"",""created"":""Mon, 31 Aug 2015 03:44:45 GMT""},{""version"":""v3"",""created"":""Tue, 15 Dec 2015 06:01:19 GMT""},{""version"":""v4"",""created"":""Sun, 17 Jan 2016 06:53:18 GMT""},{""version"":""v5"",""created"":""Thu, 30 Jun 2016 09:33:16 GMT""},{""version"":""v6"",""created"":""Tue, 5 Jul 2016 08:24:20 GMT""},{""version"":""v7"",""created"":""Tue, 29 Nov 2016 02:27:49 GMT""}]","2016-11-30"
"1508.02014","Alexey Agaltsov","A. D. Agaltsov","On the injectivity of the generalized Radon transform arising in a model
  of mathematical economics","19 pages","Inverse Problems, Volume 32, Number 11 (2016)","10.1088/0266-5611/32/11/115022",,"math.FA","http://arxiv.org/licenses/nonexclusive-distrib/1.0/","  In the present article we consider the uniqueness problem for the generalized
Radon transform arising in a mathematical model of production. We prove
uniqueness theorems for this transform and for the profit function in the
corresponding model of production. Our approach is based on the
multidimensional Wiener's approximation theorems.
","[{""version"":""v1"",""created"":""Sun, 9 Aug 2015 11:54:44 GMT""},{""version"":""v2"",""created"":""Tue, 5 Apr 2016 13:13:26 GMT""}]","2017-02-03"
"1508.02015","Abhay  Kumar Singh","Sukhamoy Pattanayak and Abhay Kumar Singh","On cyclic DNA codes over the Ring $\Z_4 + u \Z_4$","16 pages",,,,"cs.IT math.IT","http://arxiv.org/licenses/nonexclusive-distrib/1.0/","  In this paper, we study the theory for constructing DNA cyclic codes of odd
length over $\Z_4[u]/\langle u^2 \rangle$ which play an important role in DNA
computing. Cyclic codes of odd length over $\Z_4 + u \Z_4$ satisfy the reverse
constraint and the reverse-complement constraint are studied in this paper. The
structure and existence of such codes are also studied. The paper concludes
with some DNA example obtained via the family of cyclic codes.
","[{""version"":""v1"",""created"":""Sun, 9 Aug 2015 12:13:51 GMT""}]","2015-08-11"
"1508.02016","Igor Florinsky","I. G. Boyarskikh, A. I. Kulikova, A. R. Agatova, A. I. Bakiyanov, I.
  V. Florinsky","Mutation activity of Lonicera caerulea population in an active fault
  zone (the Altai Mountains)","12 pages, 5 figures, references improved",,,,"q-bio.PE physics.geo-ph","http://arxiv.org/licenses/nonexclusive-distrib/1.0/","  Geophysical and geochemical anomalies may have a mutagenic effect on plants
growing in active fault zones being the factors of evolutionary transformation
of plant populations. To test this assumption we evaluated the mutation
activity of a Lonicera caerulea natural population in one of the active fault
zones in the Altai Mountains. We derived principal cytogenetic indices (i.e.,
mitotic, prophase, metaphase, anaphase, and telophase indices as well as
proportion and range of abnormal mitoses) for meristematic cells of Lonicera
caerulea seedlings. We found that the local geological and geophysical
environment (i.e., mineralogical composition of rocks and anomalies of the
magnetic field) increases the mitotic activity and the number of abnormal
mitoses in the meristematic cells. The results may help to clarify the role of
environmental conditions of tectonically active regions in microevolutionary
processes.
","[{""version"":""v1"",""created"":""Sun, 9 Aug 2015 13:13:33 GMT""},{""version"":""v2"",""created"":""Tue, 11 Aug 2015 11:10:23 GMT""}]","2015-08-12"
"1508.02017","Emilio Leonardi","C.F Chiasserini and M. Garetto and E. Leonardi","Impact of Clustering on the Performance of Network De-anonymization",,,,,"cs.SI","http://arxiv.org/licenses/nonexclusive-distrib/1.0/","  Recently, graph matching algorithms have been successfully applied to the
problem of network de-anonymization, in which nodes (users) participating to
more than one social network are identified only by means of the structure of
their links to other members. This procedure exploits an initial set of seed
nodes large enough to trigger a percolation process which correctly matches
almost all other nodes across the different social networks. Our main
contribution is to show the crucial role played by clustering, which is a
ubiquitous feature of realistic social network graphs (and many other systems).
Clustering has both the effect of making matching algorithms more vulnerable to
errors, and the potential to dramatically reduce the number of seeds needed to
trigger percolation, thanks to a wave-like propagation effect. We demonstrate
these facts by considering a fairly general class of random geometric graphs
with variable clustering level, and showing how clever algorithms can achieve
surprisingly good performance while containing matching errors.
","[{""version"":""v1"",""created"":""Sun, 9 Aug 2015 13:18:10 GMT""}]","2015-08-11"
"1508.02018","\'Edgar Rold\'an","\'Edgar Rold\'an, Izaak Neri, Meik D\""orpinghaus, Heinrich Meyr, and
  Frank J\""ulicher","Decision Making in the Arrow of Time","9 pages, 5 figures","Phys. Rev. Lett. 115, 250602 (2015)","10.1103/PhysRevLett.115.250602",,"cond-mat.stat-mech","http://arxiv.org/licenses/nonexclusive-distrib/1.0/","  We show that the steady-state entropy production rate of a stochastic process
is inversely proportional to the minimal time needed to decide on the direction
of the arrow of time. Here we apply Wald's sequential probability ratio test to
optimally decide on the direction of time's arrow in stationary Markov
processes. Furthermore the steady state entropy production rate can be
estimated using mean first-passage times of suitable physical variables. We
derive a first-passage time fluctuation theorem which implies that the decision
time distributions for correct and wrong decisions are equal. Our results are
illustrated by numerical simulations of two simple examples of nonequilibrium
processes.
","[{""version"":""v1"",""created"":""Sun, 9 Aug 2015 13:19:33 GMT""},{""version"":""v2"",""created"":""Wed, 12 Aug 2015 11:02:30 GMT""},{""version"":""v3"",""created"":""Sat, 24 Oct 2015 11:54:58 GMT""},{""version"":""v4"",""created"":""Thu, 17 Dec 2015 10:50:15 GMT""}]","2015-12-18"
"1508.02019","Georgy Alymov","G. Alymov, V. Vyurkov, V. Ryzhii and D. Svintsov","Abrupt current switching in graphene bilayer tunnel transistors enabled
  by van Hove singularities",,,,,"cond-mat.mes-hall","http://arxiv.org/licenses/nonexclusive-distrib/1.0/","  In a continuous search for the energy-efficient electronic switches, a great
attention is focused on tunnel field-effect transistors (TFETs) demonstrating
an abrupt dependence of the source-drain current on the gate voltage. Among all
TFETs, those based on one-dimensional (1D) semiconductors exhibit the steepest
current switching due to the singular density of states near the band edges,
though the current in 1D structures is pretty low. In this paper, we propose a
TFET based on 2D graphene bilayer which demonstrates a record steep
subthreshold slope enabled by van Hove singularities in the density of states
near the edges of conduction and valence bands. Our simulations show the
accessibility of 3.5 x 10$^4$ ON/OFF current ratio with 150 mV gate voltage
swing, and a maximum subthreshold slope of (20 {\mu}V/dec)$^{-1}$ just above
the threshold. The high ON-state current of 0.8 mA/{\mu}m is enabled by a
narrow (~ 0.3 eV) extrinsic band gap, while the smallness of the leakage
current is due to an all-electrical doping of the source and drain contacts
which suppresses the band-tailing and trap-assisted tunneling.
","[{""version"":""v1"",""created"":""Sun, 9 Aug 2015 13:32:16 GMT""},{""version"":""v2"",""created"":""Sat, 16 Jan 2016 23:41:05 GMT""}]","2016-01-19"
"1508.02020","Lubomira Balkova","Josef Florian, Lubomira Dvorakova (born Balkova)","On periodicity of generalized pseudostandard words","arXiv admin note: text overlap with arXiv:1408.5210","Electronic Journal of Combinatorics 23(1) (2016), #P1.2",,,"math.CO","http://arxiv.org/licenses/nonexclusive-distrib/1.0/","  Generalized pseudostandard words were introduced by de Luca and De Luca in
2006. In comparison to the palindromic and pseudopalindromic closure, only
little is known about the generalized pseudopalindromic closure and the
associated generalized pseudostandard words. In this paper we provide a
necessary and sufficient condition for their periodicity over binary and
ternary alphabet. More precisely, we describe how the directive bi-sequence of
a generalized pseudostandard word has to look like in order to correspond to a
periodic word. We state moreover a conjecture concerning a necessary and
sufficient condition for periodicity over any alphabet.
","[{""version"":""v1"",""created"":""Sun, 9 Aug 2015 13:45:55 GMT""}]","2016-10-25"
"1508.02021","David Ellis","David Shai Ellis (1), Yao-Bo Huang (2 and 3), Paul Olalde-Velasco (2),
  Marcus Dantz (2), Jonanthan Pelliciari (2), Gil Drachuck (1), Rinat Ofer (1),
  Galina Bazalitsky (1), Jorge Berger (4), Thorsten Schmitt (2) and Amit Keren
  (1) ((1) Physics Department, Technion-Israel Institute of Technology, Haifa,
  Israel (2) Swiss Light Source, Paul Scherrer Institut, Villigen, Switzerland
  (3) Beijing National Laboratory for Condensed Matter Physics, and Institute
  of Physics, Chinese Academy of Sciences, Beijing, China (4) Department of
  Physics and Optical Engineering, ORT-Braude College, Karmiel, Israel )","Correlation of the Superconducting Critical Temperature with Spin and
  Orbital Excitation Energies In (Ca{x}La{1-x})(Ba{1.75-x}La{0.25+x})Cu{3}O{y}
  as Measured by Resonant Inelastic X-ray Scattering","12 pages, 13 figures, and a supplementary .pdf file. To be published
  in Physical Review B",,,,"cond-mat.supr-con","http://arxiv.org/licenses/nonexclusive-distrib/1.0/","  Electronic spin and orbital (dd) excitation spectra of
(Ca{x}La{1-x})(Ba{1.75-x}La{0.25+x})Cu{3}O{y} samples are measured by resonant
inelastic x-ray scattering (RIXS). In this compound, Tc of samples with
identical hole dopings is strongly affected by the Ca/Ba substitution x due to
subtle variations in the lattice constants, while crystal symmetry and disorder
as measured by line-widths are x independent. We examine two extreme values of
x and two extreme values of hole-doping content y corresponding to
antiferromagnetic and superconducting states. The x dependence of the spin mode
energies is approximately the same for both the antiferromagnetic and
superconducting samples. This clearly demonstrates that RIXS is sensitive to J
even in doped samples. A positive correlation between the superexchange J and
the maximum of Tc at optimal doping Tc^{max} is observed. We also measured the
x dependence of the d_{xy} -> d_{x^2-y^2} and d_{xz/yz} -> d_{x^2-y^2} orbital
splittings. We infer that the effect of the unresolved d_{3z^2-r^2} ->
d_{x^2-y^2} excitation on Tc^{max} is much smaller than the effect of J. There
appears to be dispersion in the d_{xy} -> d_{x^2-y^2} peak of up to 0.05 eV.
Our fitting of the peaks furthermore indicates an asymmetric dispersion for the
d_{xz/yz} -> d_{x^2-y^2} excitation. A peak at ~0.8 eV is also observed, and
attributed to a dd excitation in the chain layer.
","[{""version"":""v1"",""created"":""Sun, 9 Aug 2015 14:08:00 GMT""}]","2015-08-11"
"1508.02022","Gennadi Glinsky","Gennadi Glinsky","SCARs: endogenous human stem cell-associated retroviruses and
  therapy-resistant malignant tumors","10 pages, 1 figure",,,,"q-bio.GN","http://arxiv.org/licenses/nonexclusive-distrib/1.0/","  Discoveries of endogenous human stem cell-associated retroviruses (SCARs)
revealed consistent activation of specific endogenous retroviral elements in
human preimplantation embryos and documented the essential role of the
sustained retroviral activities in the maintenance of pluripotency, functional
identity and integrity of naive-state embryonic stem cells, and anti-viral
resistance of the early-stage human embryos. Activation of specific SCARs,
namely LTR7.HERVH and LTR5Hs.HERVK, has been demonstrated in patients diagnosed
with multiple types of cancer, autoimmune diseases, neurodegenerative disorders
and it is likely associated with the emergence of clinically lethal therapy
resistant death-from-cancer phenotypes in a sub-set of cancer patients
diagnosed with different types of malignant tumors.
","[{""version"":""v1"",""created"":""Sun, 9 Aug 2015 14:10:50 GMT""}]","2015-08-11"
"1508.02023","Jihong Zhao","Jihong Zhao, Qiao Liu","Well-posedness and decay for the dissipative system modeling
  electro-hydrodynamics in negative Besov spaces","26 pages",,,,"math.AP","http://arxiv.org/licenses/nonexclusive-distrib/1.0/","  In \cite{GW12} (Y. Guo, Y. Wang, Decay of dissipative equations and negative
Sobolev spaces, Commun. Partial Differ. Equ. 37 (2012) 2165--2208), Y. Guo and
Y. Wang developed a general new energy method for proving the optimal time
decay rates of the solutions to dissipative equations. In this paper, we
generalize this method in the framework of homogeneous Besov spaces. Moreover,
we apply this method to a model arising from electro-hydrodynamics, which is a
coupled system of the Navier-Stokes equations and the Poisson-Nernst-Planck
equations through charge transport and external forcing terms. We show that the
negative Besov norms are preserved along time evolution, and obtain the optimal
temporal decay rates of the higher-order spatial derivatives of solutions by
the Fourier splitting approach and the interpolation techniques.
","[{""version"":""v1"",""created"":""Sun, 9 Aug 2015 14:12:40 GMT""},{""version"":""v2"",""created"":""Sun, 16 Aug 2015 23:38:55 GMT""}]","2015-08-18"
"1508.02024","Zhihan Lv","Weixi Wang, Zhihan Lv, Xiaoming Li, Weiping Xu, Baoyun Zhang","Preprint Virtual Reality Based GIS Analysis Platform","This is the preprint version of our paper on ICONIP2015",,,,"cs.HC","http://arxiv.org/licenses/nonexclusive-distrib/1.0/","  This is the preprint version of our paper on ICONIP2015. The proposed
platform supports the integrated VRGIS functions including 3D spatial analysis
functions, 3D visualization for spatial process and serves for 3D globe and
digital city. The 3D analysis and visualization of the concerned city massive
information are conducted in the platform. The amount of information that can
be visualized with this platform is overwhelming, and the GIS based
navigational scheme allows to have great flexibility to access the different
available data sources.
","[{""version"":""v1"",""created"":""Sun, 9 Aug 2015 14:14:33 GMT""}]","2015-08-11"
"1508.02025","Nicolas Brunner","Jonatan Bohr Brask, Nicolas Brunner","Small quantum absorption refrigerator in the transient regime: time
  scales, enhanced cooling and entanglement","8 pages, 5 figures","Phys. Rev. E 92, 062101 (2015)","10.1103/PhysRevE.92.062101",,"quant-ph","http://arxiv.org/licenses/nonexclusive-distrib/1.0/","  A small quantum absorption refrigerator, consisting of three qubits, is
discussed in the transient regime. We discuss time scales for coherent
dynamics, damping, and approach to the steady state, and we study cooling and
entanglement. We observe that cooling can be enhanced in the transient regime,
in the sense that lower temperatures can be achieved compared to the
steady-state regime. This is a consequence of coherent dynamics, but can occur
even when this dynamics is strongly damped by the dissipative thermal
environment, and we note that precise control over couplings or timing is not
needed to achieve enhanced cooling. We also show that the amount of
entanglement present in the refrigerator can be much larger in the transient
regime compared to the steady-state. These results are of relevance to future
implementations of quantum thermal machines.
","[{""version"":""v1"",""created"":""Sun, 9 Aug 2015 14:18:22 GMT""},{""version"":""v2"",""created"":""Wed, 2 Dec 2015 09:33:00 GMT""}]","2015-12-03"
"1508.02026","Mohammad Safdari","Mohammad Safdari","On the shape of the free boundary of variational inequalities with
  gradient constraints","17 pages","Interfaces and Free Boundaries, 19(2):183-200, 2017",,,"math.AP","http://arxiv.org/licenses/nonexclusive-distrib/1.0/","  In this paper we derive an estimate on the number of local maxima of the free
boundary of some variational inequalities with pointwise gradient constraints.
This also gives an estimate on the number of connected components of the free
boundary.
","[{""version"":""v1"",""created"":""Sun, 9 Aug 2015 14:19:34 GMT""}]","2018-07-04"
"1508.02027","Oliver Knill","Oliver Knill","The graph spectrum of barycentric refinements","20 pages 12 figures",,,,"cs.DM math.CO math.SP","http://arxiv.org/licenses/nonexclusive-distrib/1.0/","  Given a finite simple graph G, let G' be its barycentric refinement: it is
the graph in which the vertices are the complete subgraphs of G and in which
two such subgraphs are connected, if one is contained into the other. If
L(0)=0<L(1) <= L(2) ... <= L(n) are the eigenvalues of the Laplacian of G,
define the spectral function F(x) as the function F(x) = L([n x]) on the
interval [0,1], where [r] is the floor function giving the largest integer
smaller or equal than r. The graph G' is known to be homotopic to G with Euler
characteristic chi(G')=chi(G) and dim(G') >= dim(G). Let G(m) be the sequence
of barycentric refinements of G=G(0). We prove that for any finite simple graph
G, the spectral functions F(G(m)) of successive refinements converge for m to
infinity uniformly on compact subsets of (0,1) and exponentially fast to a
universal limiting eigenvalue distribution function F which only depends on the
clique number respectively the dimension d of the largest complete subgraph of
G and not on the starting graph G. In the case d=1, where we deal with graphs
without triangles, the limiting distribution is the smooth function F(x) = 4
sin^2(pi x/2). This is related to the Julia set of the quadratic map T(z) =
4z-z^2 which has the one dimensional Julia set [0,4] and F satisfies
T(F(k/n))=F(2k/n) as the Laplacians satisfy such a renormalization recursion.
The spectral density in the d=1 case is then the arc-sin distribution which is
the equilibrium measure on the Julia set. In higher dimensions, where the
limiting function F still remains unidentified, F' appears to have a discrete
or singular component.
","[{""version"":""v1"",""created"":""Sun, 9 Aug 2015 14:20:48 GMT""}]","2015-08-11"
"1508.02028","Kai Chen","Kai Chen, Bin Li, Hui Shen, Jie Jin, David Tse","Reduce the Complexity of List Decoding of Polar Codes by Tree-Pruning",,,,,"cs.IT math.IT","http://arxiv.org/licenses/nonexclusive-distrib/1.0/","  Polar codes under cyclic redundancy check aided successive cancellation list
(CA-SCL) decoding can outperform the turbo codes and the LDPC codes when code
lengths are configured to be several kilobits. In order to reduce the decoding
complexity, a novel tree-pruning scheme for the \mbox{SCL/CA-SCL} decoding
algorithms is proposed in this paper. In each step of the decoding procedure,
the candidate paths with metrics less than a threshold are dropped directly to
avoid the unnecessary computations for the path searching on the descendant
branches of them. Given a candidate path, an upper bound of the path metric of
its descendants is proposed to determined whether the pruning of this candidate
path would affect frame error rate (FER) performance. By utilizing this upper
bounding technique and introducing a dynamic threshold, the proposed scheme
deletes the redundant candidate paths as many as possible while keeping the
performance deterioration in a tolerant region, thus it is much more efficient
than the existing pruning scheme. With only a negligible loss of FER
performance, the computational complexity of the proposed pruned decoding
scheme is only about $40\%$ of the standard algorithm in the low
signal-to-noise ratio (SNR) region (where the FER under CA-SCL decoding is
about $0.1 \sim 0.001$), and it can be very close to that of the successive
cancellation (SC) decoder in the moderate and high SNR regions.
","[{""version"":""v1"",""created"":""Sun, 9 Aug 2015 14:26:48 GMT""}]","2015-08-11"
"1508.02029","Ralf Metzler","Surya K. Ghosh, Andrey G. Cherstvy, Denis S. Grebenkov, and Ralf
  Metzler","Anomalous, non-Gaussian tracer diffusion in heterogeneously crowded
  environments","21 pages, 10 figures, IOPLaTeX","New J. Phys. 18, 013027 (2016)","10.1088/1367-2630/18/1/013027",,"cond-mat.stat-mech cond-mat.soft physics.bio-ph","http://arxiv.org/licenses/nonexclusive-distrib/1.0/","  A topic of intense current investigation pursues the question how the highly
crowded environment of biological cells affects the dynamic properties of
passively diffusing particles. Motivated by recent experiments we report
results of extensive simulations of the motion of a finite sized tracer
particle in a heterogeneously crowded environment. For given spatial
distributions of monodisperse crowders we demonstrate how anomalous diffusion
with strongly non-Gaussian features arises in this model system. We investigate
both biologically relevant situations of particles released either at the
surface of an inner domain (nucleus), or at the outer boundary (cell membrane),
exhibiting distinctly different behaviour of the observed anomalous diffusion
for heterogeneous crowder distributions. Specifically we reveal an extremely
asymmetric spreading of the tracer even at moderate crowding fractions. In
addition to the standard mean squared displacement and the local diffusion
exponent of the tracer particles we investigate the magnitude and the amplitude
scatter of the time averaged mean squared displacement of individual
trajectories, the non-Gaussianity parameter, and the van Hove correlation
function of the particle displacements. We also quantify how the average tracer
diffusivity varies with the position in the domain with heterogeneous radial
distribution of the crowders and examine the behaviour of the survival
probability and the dynamics of first passage events of the tracer. Finally, we
discuss the relevance of our results to single particle tracking measurements
in biological cells.
","[{""version"":""v1"",""created"":""Sun, 9 Aug 2015 14:27:49 GMT""}]","2016-09-28"
"1508.02030","Genni Fragnelli","Genni Fragnelli","Interior degenerate/singular parabolic equations in nondivergence form:
  well-posedness and Carleman estimates","Accepted in Journal of Differential Equations. arXiv admin note: text
  overlap with arXiv:1507.07786",,,,"math.AP","http://arxiv.org/licenses/nonexclusive-distrib/1.0/","  We consider non smooth general degenerate/singular parabolic equations in non
divergence form with degeneracy and singularity occurring in the interior of
the spatial domain, in presence of Dirichlet or Neumann boundary conditions. In
particular, we consider well posedness of the problem and then we prove
  Carleman estimates for the associated adjoint problem.
","[{""version"":""v1"",""created"":""Sun, 9 Aug 2015 14:33:22 GMT""},{""version"":""v2"",""created"":""Tue, 8 Sep 2015 19:15:28 GMT""},{""version"":""v3"",""created"":""Sat, 26 Sep 2015 16:42:11 GMT""}]","2015-09-29"
"1508.02031","Fedor Dzerzhinskiy","Fedor Dzerzhinskiy, Leonid D. Raykov","What Is Software Engineering?","14 pages, In English","Programmirovanie (Programming and Computer Software), 1990, No. 2,
  pp. 67-79 (In Russian)",,,"cs.SE","http://arxiv.org/licenses/nonexclusive-distrib/1.0/","  A later translation (2015) of the article in Russian published in 1990. The
article proposes an approach to defining a set of basic notions for subject
area of software engineering discipline. The set of notions is intended to
serve as a basis for detection and correction of some widespread conceptual
mistakes in the efforts aimed at improving the quality and work productivity in
creation and operation of software.
","[{""version"":""v1"",""created"":""Sun, 9 Aug 2015 14:34:00 GMT""},{""version"":""v2"",""created"":""Tue, 11 Aug 2015 18:05:50 GMT""}]","2015-08-12"
