"1508.03171","Peter Lunkenheimer","J. K. H. Fischer, P. Sippel, D. Denysenko, P. Lunkenheimer, D.
  Volkmer, and A. Loidl","MFU-type metal-organic frameworks as host materials of confined
  supercooled liquids","8 pages, 4 figures + 2 pages, 3 figures in Supplemental Material","J. Chem. Phys. 143 (2015) 154505","10.1063/1.4933308",,"cond-mat.soft cond-mat.dis-nn","http://arxiv.org/licenses/nonexclusive-distrib/1.0/","  In this work we examine the use of metal-organic framework (MOF) systems as
host materials for the investigation of glassy dynamics in confined geometry.
We investigate the confinement of the molecular glass former glycerol in three
MFU-type MOFs with different pore sizes and study the dynamics of the confined
liquid via dielectric spectroscopy. In accord with previous reports on confined
glass formers, we find different degrees of deviations from bulk behavior
depending on pore size, demonstrating that MOFs are well-suited host systems
for confinement investigations.
","[{""version"":""v1"",""created"":""Thu, 13 Aug 2015 11:01:00 GMT""}]","2015-11-05"
"1508.03172","Carlo Giunti Dr.","C. Giunti and E. M. Zavanin","Appearance-Disappearance Relation in 3+$N_{s}$ Short-Baseline Neutrino
  Oscillations","6 pages; final version to be published in Mod. Phys. Lett. A",,"10.1142/S0217732316500036",,"hep-ph astro-ph.CO hep-ex","http://arxiv.org/licenses/nonexclusive-distrib/1.0/","  We derive the relation between the amplitudes of short-baseline appearance
and disappearance oscillations in 3+$N_{s}$ neutrino mixing schemes which is
the origin of the appearance-disappearance tension that is found from the
analysis of the existing data in any 3+$N_{s}$ neutrino mixing scheme. We
illustrate the power of the relation to reveal the appearance-disappearance
tension in the cases of 3+1 and 3+2 mixing using the results of global fits of
short-baseline neutrino oscillation data.
","[{""version"":""v1"",""created"":""Thu, 13 Aug 2015 11:06:52 GMT""},{""version"":""v2"",""created"":""Mon, 14 Dec 2015 16:28:01 GMT""}]","2016-01-20"
"1508.03173","Zhumagali Shomanov","Zhumagali Shomanov","Combinatorial Formula for the Partition Function","17 pages, 11 figures",,,,"math.CO math.NT","http://arxiv.org/licenses/nonexclusive-distrib/1.0/","  In this article we will derive a combinatorial formula for the partition
function p(n). In the second part of the paper we will establish connection
between partitions and q-binomial coefficients and give new interpretation for
q-binomial coefficients.
","[{""version"":""v1"",""created"":""Thu, 13 Aug 2015 11:07:48 GMT""},{""version"":""v2"",""created"":""Sat, 7 May 2016 05:39:28 GMT""}]","2016-05-10"
"1508.03174","Victor Hernandez-Urbina","Victor Hernandez-Urbina","Logical N-AND Gate on a Molecular Turing Machine",,,,,"cs.ET cs.NE","http://arxiv.org/licenses/nonexclusive-distrib/1.0/","  In Boolean algebra, it is known that the logical function that corresponds to
the negation of the conjunction --NAND-- is universal in the sense that any
other logical function can be built based on it. This property makes it
essential to modern digital electronics and computer processor design. Here, we
design a molecular Turing machine that computes the NAND function over binary
strings of arbitrary length. For this purpose, we will perform a mathematical
abstraction of the kind of operations that can be done over a double-stranded
DNA molecule, as well as presenting a molecular encoding of the input symbols
for such a machine.
","[{""version"":""v1"",""created"":""Thu, 13 Aug 2015 11:08:28 GMT""}]","2015-08-14"
"1508.03175","Michael Lund","Michael B. Lund, Robert J. Siverd, Joshua A. Pepper, Keivan G. Stassun","Metrics for Optimization of Large Synoptic Survey Telescope Observations
  of Stellar Variables and Transients","17 pages, 19 figures; for submission to PASP",,"10.1088/1538-3873/128/960/025002",,"astro-ph.IM astro-ph.SR","http://arxiv.org/licenses/nonexclusive-distrib/1.0/","  The Large Synoptic Survey Telescope (LSST) will be the largest time-domain
photometric survey ever. In order to maximize the LSST science yield for a
broad array of transient stellar phenomena, it is necessary to optimize the
survey cadence, coverage, and depth via quantitative metrics that are
specifically designed to characterize the time-domain behavior of various types
of stellar transients. In this paper we present three such metrics built on the
LSST Metric Analysis Framework (MAF) model (Jones et al. 2014). Two of the
metrics quantify the ability of LSST to detect non-periodic and/or
non-recurring transient events, and the ability of LSST to reliably measure
periodic signals of various timescales. The third metric provides a way to
quantify the range of stellar parameters in the stellar populations that LSST
will probe. We provide example uses of these metrics and discuss some
implications based on these metrics for optimization of the LSST survey for
observations of stellar variables and transients.
","[{""version"":""v1"",""created"":""Thu, 13 Aug 2015 11:11:24 GMT""},{""version"":""v2"",""created"":""Mon, 17 Aug 2015 04:10:33 GMT""}]","2016-05-12"
"1508.03176","Stefan Schmitt","H1 Collaboration","Exclusive $\rho^0$ Meson Photoproduction with a Leading Neutron at HERA","38 pages, 13 figures, 10 tables, this version accepted by EPJC","Eur.Phys.J.C76 (2016) 1, 41",,"DESY 15-120","hep-ex hep-ph nucl-ex nucl-th","http://arxiv.org/licenses/nonexclusive-distrib/1.0/","  A first measurement is presented of exclusive photoproduction of $\rho^0$
mesons associated with leading neutrons at HERA. The data were taken with the
H1 detector in the years $2006$ and $2007$ at a centre-of-mass energy of
$\sqrt{s}=319$ GeV and correspond to an integrated luminosity of $1.16$
pb$^{-1}$. The $\rho^0$ mesons with transverse momenta $p_T<1$ GeV are
reconstructed from their decays to charged pions, while leading neutrons
carrying a large fraction of the incoming proton momentum, $x_L>0.35$, are
detected in the Forward Neutron Calorimeter. The phase space of the measurement
is defined by the photon virtuality $Q^2 < 2$ GeV$^2$, the total energy of the
photon-proton system $20 < W_{\gamma p} < 100$ GeV and the polar angle of the
leading neutron $\theta_n < 0.75$ mrad. The cross section of the reaction
$\gamma p \to \rho^0 n \pi^+$ is measured as a function of several variables.
The data are interpreted in terms of a double peripheral process, involving
pion exchange at the proton vertex followed by elastic photoproduction of a
$\rho^0$ meson on the virtual pion. In the framework of one-pion-exchange
dominance the elastic cross section of photon-pion scattering, $\sigma^{\rm
el}(\gamma\pi^+ \to \rho^0\pi^+)$, is extracted. The value of this cross
section indicates significant absorptive corrections for the exclusive reaction
$\gamma p\to\rho^0 n \pi^+$.
","[{""version"":""v1"",""created"":""Thu, 13 Aug 2015 11:25:01 GMT""},{""version"":""v2"",""created"":""Fri, 8 Apr 2016 13:29:46 GMT""}]","2016-04-11"
"1508.03177","Tang Yutao","Yutao Tang","Output consensus of nonlinear multi-agent systems with unknown control
  directions","10 pages;2 figures","Kybernetika 51(2):335-346,2015","10.14736/kyb-2015-2-0335",,"math.OC","http://arxiv.org/licenses/nonexclusive-distrib/1.0/","  In this paper, we consider an output consensus problem for a general class of
nonlinear multi-agent systems without a prior knowledge of the agents' control
directions. Two distributed Nussbaumtype control laws are proposed to solve the
leaderless and leader-following adaptive consensus for heterogeneous multiple
agents. Examples and simulations are given to verify their effectiveness
","[{""version"":""v1"",""created"":""Thu, 13 Aug 2015 11:28:37 GMT""}]","2015-08-14"
"1508.03178","Jianling Wang","Jianling Wang (1), Francois Hammer (2), Mathieu Puech (2), Yanbin Yang
  (2), Hector Flores (2) ((1) National Astronomical Observatories, Chinese
  Academy of Sciences (NAOC) (2) GEPI, Observatoire de Paris)","The NGC 4013 tale: a pseudo-bulged, late-type spiral shaped by a major
  merger","11 pages,9 figures,accepted for publication in MNRAS","MNRAS, 2015, Volume 452, Issue 4,pp. 3551-3560","10.1093/mnras/stv1531",,"astro-ph.GA","http://arxiv.org/licenses/nonexclusive-distrib/1.0/","  Many spiral galaxy haloes show stellar streams with various morphologies when
observed with deep images. The origin of these tidal features is discussed,
either coming from a satellite infall or caused by residuals of an ancient,
gas-rich major merger. By modelling the formation of the peculiar features
observed in the NGC 4013 halo, we investigate their origin. By using GADGET -2
with implemented gas cooling, star formation, and feedback, we have modelled
the overall NGC 4013 galaxy and its associated halo features. A gas-rich major
merger occurring 2.7-4.6 Gyr ago succeeds in reproducing the NGC 4013 galaxy
properties, including all the faint stellar features, strong gas warp,
boxy-shaped halo and vertical 3.6 mum luminosity distribution. High gas
fractions in the progenitors are sufficient to reproduce the observed thin and
thick discs, with a small bulge fraction, as observed. A major merger is able
to reproduce the overall NGC 4013 system, including the warp strength, the red
colour and the high stellar mass density of the loop, while a minor merger
model cannot. Because the gas-rich model suffices to create a pseudo-bulge with
a small fraction of the light, NGC 4013 is perhaps the archetype of a late-type
galaxy formed by a relatively recent merger. Then late type, pseudo-bulge
spirals are not mandatorily made through secular evolution, and the NGC 4013
properties also illustrate that strong warps in isolated galaxies may well
occur at a late phase of a gas-rich major merger.
","[{""version"":""v1"",""created"":""Thu, 13 Aug 2015 11:39:23 GMT""}]","2015-08-14"
"1508.03179","Xin Zhou","Xin Zhou, Nicole Mayer-Hamblett, Umer Khan and Michael R. Kosorok","Residual Weighted Learning for Estimating Individualized Treatment Rules","48 pages, 3 figures",,,,"stat.ME","http://arxiv.org/licenses/nonexclusive-distrib/1.0/","  Personalized medicine has received increasing attention among statisticians,
computer scientists, and clinical practitioners. A major component of
personalized medicine is the estimation of individualized treatment rules
(ITRs). Recently, Zhao et al. (2012) proposed outcome weighted learning (OWL)
to construct ITRs that directly optimize the clinical outcome. Although OWL
opens the door to introducing machine learning techniques to optimal treatment
regimes, it still has some problems in performance. In this article, we propose
a general framework, called Residual Weighted Learning (RWL), to improve finite
sample performance. Unlike OWL which weights misclassification errors by
clinical outcomes, RWL weights these errors by residuals of the outcome from a
regression fit on clinical covariates excluding treatment assignment. We
utilize the smoothed ramp loss function in RWL, and provide a difference of
convex (d.c.) algorithm to solve the corresponding non-convex optimization
problem. By estimating residuals with linear models or generalized linear
models, RWL can effectively deal with different types of outcomes, such as
continuous, binary and count outcomes. We also propose variable selection
methods for linear and nonlinear rules, respectively, to further improve the
performance. We show that the resulting estimator of the treatment rule is
consistent. We further obtain a rate of convergence for the difference between
the expected outcome using the estimated ITR and that of the optimal treatment
rule. The performance of the proposed RWL methods is illustrated in simulation
studies and in an analysis of cystic fibrosis clinical trial data.
","[{""version"":""v1"",""created"":""Thu, 13 Aug 2015 11:41:52 GMT""}]","2015-08-14"
"1508.03180","Xavier  Haubois","X. Haubois, M. Wittkowski, G. Perrin, P. Kervella, A. M\'erand, E.
  Thi\'ebaut, S.T. Ridgway, M. Ireland and M. Scholz","Resolving asymmetries along the pulsation cycle of the Mira star X Hya","Accepted for publication in A&A, 17 pages, 16 figures","A&A 582, A71 (2015)","10.1051/0004-6361/201526482",,"astro-ph.SR","http://arxiv.org/licenses/nonexclusive-distrib/1.0/","  The mass-loss process in Mira stars probably occurs in an asymmetric way
where dust can form in inhomogeneous circumstellar molecular clumps. Following
asymmetries along the pulsation cycle can give us clues about these mass-loss
processes. We imaged the Mira star X Hya and its environnement at different
epochs to follow the evolution of the morphology in the continuum and in the
molecular bands. We observed X Hya with AMBER in J-H-K at low resolution at two
epochs. We modelled squared visibilities with geometrical and physical models.
We also present imaging reconstruction results obtained with MiRA and based on
the physical a priori images. We report on the angular scale change of X Hya
between the two epochs. 1D CODEX profiles allowed us to understand and model
the spectral variation of squared visibilities and constrain the stellar
parameters. Reconstructed model-dependent images enabled us to reproduce
closure phase signals and the azimuthal dependence of squared visibilities.
They show evidence for material inhomogeneities located in the immediate
environment of the star.
","[{""version"":""v1"",""created"":""Thu, 13 Aug 2015 11:43:50 GMT""}]","2015-10-14"
"1508.03181","Thomas Kalinowski","Natashia Boland, Thomas Kalinowski, Fabian Rigterink","A polynomially solvable case of the pooling problem","updated references","Journal of Global Optimization, Volume 67, Issue 3, pp 621-630,
  2017","10.1007/s10898-016-0432-6",,"math.OC cs.DM math.CO","http://arxiv.org/licenses/nonexclusive-distrib/1.0/","  Answering a question of Haugland, we show that the pooling problem with one
pool and a bounded number of inputs can be solved in polynomial time by solving
a polynomial number of linear programs of polynomial size. We also give an
overview of known complexity results and remaining open problems to further
characterize the border between (strongly) NP-hard and polynomially solvable
cases of the pooling problem.
","[{""version"":""v1"",""created"":""Thu, 13 Aug 2015 11:48:13 GMT""},{""version"":""v2"",""created"":""Sat, 15 Aug 2015 06:37:16 GMT""},{""version"":""v3"",""created"":""Thu, 25 Feb 2016 10:57:20 GMT""},{""version"":""v4"",""created"":""Tue, 5 Apr 2016 04:47:18 GMT""}]","2017-02-09"
"1508.03182","Hendrik Vogt","Amir Manavi, Hendrik Vogt, J\""urgen Voigt","A note on absorption semigroups and regularity",,,"10.1007/s00013-016-0892-4",,"math.FA","http://arxiv.org/licenses/nonexclusive-distrib/1.0/","  It is shown that, in the theory of absorption semigroups, two possible ways
of defining regularity for absorption rates are in fact equivalent.
","[{""version"":""v1"",""created"":""Thu, 13 Aug 2015 12:00:57 GMT""},{""version"":""v2"",""created"":""Sat, 16 Jan 2016 14:33:35 GMT""},{""version"":""v3"",""created"":""Tue, 22 Mar 2016 16:02:46 GMT""}]","2016-03-23"
"1508.03183","Huseyin Rahmi Seren","Huseyin R. Seren, Jingdi Zhang, George R. Keiser, Scott J. Maddox,
  Xiaoguang Zhao, Kebin Fan, Seth R. Bank, Xin Zhang, and Richard D. Averitt","Nonlinear terahertz devices utilizing semiconducting plasmonic
  metamaterials","20 pages total with 4 figures",,"10.1038/lsa.2016.78",,"physics.optics","http://arxiv.org/licenses/nonexclusive-distrib/1.0/","  The development of responsive metamaterials has enabled the realization of
compact tunable photonic devices capable of manipulating the amplitude,
polarization, wave vector, and frequency of light. Integration of
semiconductors into the active regions of metallic resonators is a proven
approach for creating nonlinear metamaterials through optoelectronic control of
the semiconductor carrier density. Metal-free subwavelength resonant
semiconductor structures offer an alternative approach to create dynamic
metamaterials. We present InAs plasmonic disk arrays as a viable resonant
metamaterial at terahertz frequencies. Importantly, InAs plasmonic disks
exhibit a strong nonlinear response arising from electric field induced
intervalley scattering resulting in a reduced carrier mobility thereby damping
the plasmonic response. We demonstrate nonlinear perfect absorbers configured
as either optical limiters or saturable absorbers, including flexible nonlinear
absorbers achieved by transferring the disks to polyimide films. Nonlinear
plasmonic metamaterials show potential for use in ultrafast THz optics and for
passive protection of sensitive electromagnetic devices.
","[{""version"":""v1"",""created"":""Thu, 13 Aug 2015 12:03:37 GMT""}]","2016-06-29"
"1508.03184","Lukasz Kusmierz","Lukasz Kusmierz and Ewa Gudowska-Nowak","Optimal first arrival times in L\'evy flights with resetting","10 pages, 6 figures","Phys. Rev. E 92, 052127 (2015)","10.1103/PhysRevE.92.052127",,"cond-mat.stat-mech cond-mat.mes-hall math-ph math.MP physics.data-an","http://arxiv.org/licenses/nonexclusive-distrib/1.0/","  We consider diffusive motion of a particle performing a random walk with
L\'evy distributed jump lengths and subject to resetting mechanism bringing the
walker to an initial position at uniformly distributed times. In the limit of
infinite number of steps and for long times, the process converges to a
super-diffusive motion with replenishment. We derive formula for a mean first
arrival time (MFAT) to a predefined target position reached by a meandering
particle and analyze efficiency of the proposed searching strategy by
investigating criteria for an optimal (a shortest possible) MFAT.
","[{""version"":""v1"",""created"":""Thu, 13 Aug 2015 12:06:30 GMT""},{""version"":""v2"",""created"":""Tue, 29 Sep 2015 16:10:50 GMT""}]","2015-11-25"
"1508.03185","Ilya I. Bogdanov","Ilya I. Bogdanov, Alexander D. Matushkin","Algebraic proofs of linear versions of the Conway--Gordon--Sachs theorem
  and the van Kampen--Flores theorem","in Russian",,,,"math.CO math.GT math.MG","http://arxiv.org/licenses/nonexclusive-distrib/1.0/","  In this paper we present short algebraic proofs of the Linear
Conway--Gordon--Sachs and the Linear van Kampen--Flores theorems in the spirit
of the Radon theorem on convex hulls.
  {\bf Theorem.} {\it Take any $n+3$ general position points in $\mathbb{R}^n$.
If $n$ is odd, then there are two linked $(n+1)/2$-simplices with the vertices
at these points. If $n$ is even, then one can choose two disjoint
$(n+2)/2$-tuples such that the interiors $(n/2)$-simplices with the vertices at
these $(n+2)/2$-tuples intersect each other.}
  This theorem is interesting even in case of small dimensions.
","[{""version"":""v1"",""created"":""Thu, 13 Aug 2015 12:07:38 GMT""}]","2015-08-14"
"1508.03186","Nuno K. Pratas","Nuno K. Pratas and Petar Popovski","Network-Assisted Device-to-Device (D2D) Direct Proximity Discovery with
  Underlay Communication","Accepted for presentation at Globecom 2015",,,,"cs.IT cs.NI math.IT","http://arxiv.org/licenses/nonexclusive-distrib/1.0/","  Device-to-Device communications are expected to play an important role in
current and future cellular generations, by increasing the spatial reuse of
spectrum resources and enabling lower latency communication links. This
paradigm has two fundamental building blocks: (i) proximity discovery and (ii)
direct communication between proximate devices. While (ii) is treated
extensively in the recent literature, (i) has received relatively little
attention. In this paper we analyze a network-assisted underlay proximity
discovery protocol, where a cellular device can take the role of: announcer
(which announces its interest in establishing a D2D connection) or monitor
(which listens for the transmissions from the announcers). Traditionally, the
announcers transmit their messages over dedicated channel resources. In
contrast, inspired by recent advances on receivers with multiuser decoding
capabilities, we consider the case where the announcers underlay their messages
in the downlink transmissions that are directed towards the monitoring devices.
We propose a power control scheme applied to the downlink transmission, which
copes with the underlay transmission via additional power expenditure, while
guaranteeing both reliable downlink transmissions and underlay proximity
discovery.
","[{""version"":""v1"",""created"":""Thu, 13 Aug 2015 12:09:52 GMT""}]","2015-08-14"
"1508.03187","Olena Karlova Dr","Olena Karlova","On $C$-embedded subspaces of the Sorgenfrey plane","in Applied General Topology 2015",,,,"math.GN","http://arxiv.org/licenses/nonexclusive-distrib/1.0/","  We prove that every $C^*$-embedded subset of $\ss$ is a hereditarily Baire
subspace of $\mathbb R^2$.
  We also show that for a subspace $E\subseteq\{(x,-x):x\in\mathbb R\}$ of the
Sorgenfrey plane $\mathbb S^2$ the following conditions are equivalent: (i) $E$
is $C$-embedded in $\mathbb S^2$; (ii) $E$ is $C^*$-embedded in $\mathbb S^2$;
(iii) $E$ is a countable $G_\delta$-subspace of $\mathbb R^2$ and (iv) $E$ is a
countable functionally closed subspace of $\mathbb S^2$.
","[{""version"":""v1"",""created"":""Thu, 13 Aug 2015 12:10:55 GMT""}]","2015-08-14"
"1508.03188","Dariusz Graczyk","D. Graczyk, P. F. L. Maxted, G. Pietrzynski, B. Pilecki, P. Konorski,
  W. Gieren, J. Storm, A. Gallenne, R. I. Anderson, K. Suchomska, R. G. West,
  D. Pollacco, F. Faedi, G. Pojmanski","The Araucaria Project. Precise physical parameters of the eclipsing
  binary IO Aqr","Accepted for publication in the Astronomy & Astrophysics Journal","A&A 581, A106 (2015)","10.1051/0004-6361/201526211",,"astro-ph.SR","http://arxiv.org/licenses/nonexclusive-distrib/1.0/","  Our aim is to precisely measure the physical parameters of the eclipsing
binary IO Aqr and derive a distance to this system by applying a surface
brightness - colour relation. Our motivation is to combine these parameters
with future precise distance determinations from the GAIA space mission to
derive precise surface brightness - colour relations for stars. We extensively
used photometry from the Super-WASP and ASAS projects and precise radial
velocities obtained from HARPS and CORALIE high-resolution spectra. We analysed
light curves with the code JKTEBOP and radial velocity curves with the
Wilson-Devinney program. We found that IO Aqr is a hierarchical triple system
consisting of a double-lined short-period (P=2.37 d) spectroscopic binary and a
low-luminosity and low-mass companion star orbiting the binary with a period of
~25000 d (~70 yr) on a very eccentric orbit. We derive high-precision (better
than 1%) physical parameters of the inner binary, which is composed of two
slightly evolved main-sequence stars (F5 V-IV + F6 V-IV) with masses of
M1=1.569+/-0.004 and M2=1.655+/-0.004 M_sun and radii R1=2.19+/-0.02 and
R2=2.49+/-0.02 R_sun. The companion is most probably a late K-type dwarf with
mass ~0.6 M_sun. The distance to the system resulting from applying a (V-K)
surface brightness - colour relation is 255+/-6(stat.)+/-6(sys.) pc, which
agrees well with the Hipparcos value of 270+/-73 pc, but is more precise by a
factor of eight.
","[{""version"":""v1"",""created"":""Thu, 13 Aug 2015 12:13:04 GMT""}]","2015-09-16"
"1508.03189","Juraj Feilhauer","J. Feilhauer, W. Apel and L. Schweitzer","Merging of the Dirac points in electronic artificial graphene",,"Phys. Rev. B 92, 245424 (2015)","10.1103/PhysRevB.92.245424",,"cond-mat.mes-hall","http://arxiv.org/licenses/nonexclusive-distrib/1.0/","  Theory predicts that graphene under uniaxial compressive strain in an
armchair direction should undergo a topological phase transition from a
semimetal into an insulator. Due to the change of the hopping integrals under
compression, both Dirac points shift away from the corners of the Brillouin
zone towards each other. For sufficiently large strain, the Dirac points merge
and an energy gap appears. However, such a topological phase transition has not
yet been observed in normal graphene (due to its large stiffness) neither in
any other electronic system. We show numerically and analytically that such a
merging of the Dirac points can be observed in electronic artificial graphene
created from a two-dimensional electron gas by application of a triangular
lattice of repulsive antidots. Here, the effect of strain is modeled by tuning
the distance between the repulsive potentials along the armchair direction. Our
results show that the merging of the Dirac points should be observable in a
recent experiment with molecular graphene.
","[{""version"":""v1"",""created"":""Thu, 13 Aug 2015 12:13:16 GMT""}]","2015-12-23"
"1508.03190","Sergei Kuzenko","Sergei M. Kuzenko","Complex linear Goldstino superfield and de Sitter supergravity","8 pages; V2: typos corrected, comments and reference added; V3: title
  changed, references and new section added; V4: published version",,,,"hep-th","http://arxiv.org/licenses/nonexclusive-distrib/1.0/","  The complex linear Goldstino superfield was proposed in arXiv:1102.3042 for
the cases of global and local four-dimensional N=1 supersymmetry. Here we make
use of this superfield to construct a supergravity action which is invariant
under spontaneously broken local N=1 supersymmetry and has a positive
cosmological constant for certain values of the parameters.
","[{""version"":""v1"",""created"":""Thu, 13 Aug 2015 12:14:01 GMT""},{""version"":""v2"",""created"":""Wed, 26 Aug 2015 08:43:11 GMT""},{""version"":""v3"",""created"":""Fri, 4 Sep 2015 10:25:12 GMT""},{""version"":""v4"",""created"":""Mon, 5 Oct 2015 02:35:05 GMT""}]","2015-10-06"
