"1508.03048","Kadir Utku Can","K. U. Can, G. Erkol, M. Oka and T. T. Takahashi","A look inside charmed-strange baryons from lattice QCD","14 pages, 14 figures. Includes a subsection on the systematic effects","Phys. Rev. D 92, 114515 (2015)","10.1103/PhysRevD.92.114515",,"hep-lat hep-ph","http://arxiv.org/licenses/nonexclusive-distrib/1.0/","  The electromagnetic form factors of the spin-3/2 $\Omega$ baryons, namely
$\Omega$, $\Omega_c^\ast$, $\Omega_{cc}^\ast$ and $\Omega_{ccc}$, are
calculated in full QCD on $32^3\times 64$ PACS-CS lattices with a pion mass of
156(9) MeV. The electric charge radii and magnetic moments from the $E0$ and
$M1$ multipole form factors are extracted. Results for the electric quadrupole
form factors, $E2$, are also given. Quark sector contributions are computed
individually for each observable and then combined to obtain the baryon
properties. We find that the charm quark contributions are systematically
smaller than the strange-quark contributions in the case of the charge radii
and magnetic moments. $E2$ moments of the $\Omega_{cc}^\ast$ and $\Omega_{ccc}$
provide a statistically significant data to conclude that their electric charge
distributions are deformed to an oblate shape. Properties of the spin-1/2
$\Omega_c$ and $\Omega_{cc}$ baryons are also computed and a thorough
comparison is given. This complete study gives valuable hints about the
heavy-quark dynamics in charmed hadrons.
","[{""version"":""v1"",""created"":""Wed, 12 Aug 2015 20:07:50 GMT""},{""version"":""v2"",""created"":""Thu, 10 Dec 2015 06:58:39 GMT""}]","2016-01-06"
"1508.03049","Luiz Agostinho Ferreira","C. P. Constantinidis, L. A. Ferreira and G. Luchini","A remark on the asymptotic form of BPS multi-dyon solutions and their
  conserved charges","Version to be published in JHEP, Journal of High Energy Physics (19
  pages, no figures, some examples added)",,"10.1007/JHEP12(2015)137",,"hep-th hep-ph nlin.SI","http://arxiv.org/licenses/nonexclusive-distrib/1.0/","  We evaluate the gauge invariant, dynamically conserved charges, recently
obtained from the integral form of the Yang-Mills equations, for the BPS
multi-dyon solutions of a Yang-Mills-Higgs theory associated to any compact
semi-simple gauge group G. Those charges are shown to correspond to the
eigenvalues of the next-to-leading term of the asymptotic form of the Higgs
field at spatial infinity, and so coinciding with the usual topological charges
of those solutions. Such results show that many of the topological charges
considered in the literature are in fact dynamical charges, which conservation
follows from the global properties of classical Yang-Mills theories encoded
into their integral dynamical equations. The conservation of those charges can
not be obtained from the differential form of Yang-Mills equations.
","[{""version"":""v1"",""created"":""Wed, 12 Aug 2015 20:08:12 GMT""},{""version"":""v2"",""created"":""Tue, 15 Dec 2015 12:18:49 GMT""}]","2016-01-27"
"1508.03050","Brian Shuve","Eder Izaguirre, Gordan Krnjaic, Brian Shuve","Discovering Inelastic Thermal-Relic Dark Matter at Colliders","24 pages, 15 figures. V2: corrected bug affecting non-pointing photon
  results for MiDM representative model; conclusions largely unchanged. Other
  minor errors and typos corrected. Submitted to PRD","Phys. Rev. D 93, 063523 (2016)","10.1103/PhysRevD.93.063523",,"hep-ph astro-ph.CO hep-ex","http://arxiv.org/licenses/nonexclusive-distrib/1.0/","  Dark Matter particles with inelastic interactions are ubiquitous in
extensions of the Standard Model, yet remain challenging to fully probe with
existing strategies. We propose a series of powerful searches at hadron and
lepton colliders that are sensitive to inelastic dark matter dynamics. In
representative models featuring either a massive dark photon or a magnetic
dipole interaction, we find that the LHC and BaBar could offer strong
sensitivity to the thermal-relic dark matter parameter space for dark matter
masses between ~100 MeV-100 GeV and fractional mass-splittings above the
percent level; future searches at Belle II with a dedicated monophoton trigger
could also offer sensitivity to thermal-relic scenarios with masses below a few
GeV. Thermal scenarios with either larger masses or splittings are largely
ruled out; lower masses remain viable yet may be accessible with other search
strategies.
","[{""version"":""v1"",""created"":""Wed, 12 Aug 2015 20:08:17 GMT""},{""version"":""v2"",""created"":""Wed, 30 Sep 2015 06:25:37 GMT""}]","2016-03-30"
"1508.03051","Enrique Fernandez-Martinez","Enrique Fernandez-Martinez, Josu Hernandez-Garcia, Jacobo Lopez-Pavon
  and Michele Lucente","Loop level constraints on Seesaw neutrino mixing","29 pages, 9 eps figures. References added. Accepted in JHEP","JHEP 1510 (2015) 130","10.1007/JHEP10(2015)130",,"hep-ph","http://arxiv.org/licenses/nonexclusive-distrib/1.0/","  We perform a detailed study of the importance of loop corrections when
deriving bounds on heavy-active neutrino mixing in the context of general
Seesaw mechanisms with extra heavy right-handed neutrinos. We find that, for
low-scale Seesaws with an approximate $B-L$ symmetry characterized by
electroweak scale Majorana masses and large Yukawas, loop corrections could
indeed become relevant in a small part of the parameter space. Previous results
in the literature showed that a partial cancellation between these important
loop corrections and the tree level contributions could relax some constraints
and lead to qualitatively different results upon their inclusion. However, we
find that this cancellation can only take place in presence of large violations
of the $B-L$ symmetry, that lead to unacceptably large contributions to the
light neutrino masses at loop level. Thus, when we restrict our analysis of the
key observables to an approximate $B-L$ symmetry so as to recover the correct
values for neutrino masses, we always find loop corrections to be negligible in
the regions of the parameter space preferred by data.
","[{""version"":""v1"",""created"":""Wed, 12 Aug 2015 20:08:40 GMT""},{""version"":""v2"",""created"":""Tue, 20 Oct 2015 15:29:22 GMT""}]","2015-10-30"
"1508.03052","Guan-Huei Duh","Gerard Jennhwa Chang and Guan-Huei Duh","On the precise value of the strong chromatic-index of a planar graph
  with a large girth","16 pages, 2 figures",,,,"math.CO","http://arxiv.org/licenses/nonexclusive-distrib/1.0/","  A strong $k$-edge-coloring of a graph $G$ is a mapping from $E(G)$ to
$\{1,2,\ldots,k\}$ such that every pair of distinct edges at distance at most
two receive different colors. The strong chromatic index $\chi'_s(G)$ of a
graph $G$ is the minimum $k$ for which $G$ has a strong $k$-edge-coloring.
Denote $\sigma(G)=\max_{xy\in
E(G)}\{\operatorname{deg}(x)+\operatorname{deg}(y)-1\}$. It is easy to see that
$\sigma(G) \le \chi'_s(G)$ for any graph $G$, and the equality holds when $G$
is a tree. For a planar graph $G$ of maximum degree $\Delta$, it was proved
that $\chi'_s(G) \le 4 \Delta +4$ by using the Four Color Theorem. The upper
bound was then reduced to $4\Delta$, $3\Delta+5$, $3\Delta+1$, $3\Delta$,
$2\Delta-1$ under different conditions for $\Delta$ and the girth. In this
paper, we prove that if the girth of a planar graph $G$ is large enough and
$\sigma(G)\geq \Delta(G)+2$, then the strong chromatic index of $G$ is
precisely $\sigma(G)$. This result reflects the intuition that a planar graph
with a large girth locally looks like a tree.
","[{""version"":""v1"",""created"":""Wed, 12 Aug 2015 20:08:42 GMT""},{""version"":""v2"",""created"":""Sun, 16 Aug 2015 14:30:43 GMT""},{""version"":""v3"",""created"":""Fri, 25 Sep 2015 15:28:35 GMT""}]","2015-09-28"
"1508.03053","Eugen Dumitrescu","Eugene Dumitrescu and Travis S. Humble","Direct Characterization of Quantum Dynamics with Noisy Ancilla","7 pages, 4 figures","Phys. Rev. A 92, 052329 (2015)","10.1103/PhysRevA.92.052329",,"quant-ph","http://arxiv.org/licenses/nonexclusive-distrib/1.0/","  We present methods for the direct characterization of quantum dynamics (DCQD)
in which both the principal and ancilla systems undergo noisy processes. Using
a concatenated error detection code, we discriminate between located and
unlocated errors on the principal system in what amounts to filtering of
ancilla noise. The example of composite noise involving amplitude damping and
depolarizing channels is used to demonstrate the method, while we find the rate
of noise filtering is more generally dependent on code distance. Our results
indicate the accuracy of quantum process characterization can be greatly
improved while remaining within reach of current experimental capabilities.
","[{""version"":""v1"",""created"":""Wed, 12 Aug 2015 20:08:44 GMT""}]","2015-12-17"
"1508.03054","Gauthier Durieux","Gauthier Durieux and Yuval Grossman","Probing CP violation systematically in differential distributions","14 pages, 4 figures, 6 tables","Phys. Rev. D 92, 076013 (2015)","10.1103/PhysRevD.92.076013","CP3-15-24","hep-ph hep-ex","http://arxiv.org/licenses/nonexclusive-distrib/1.0/","  We revisit the topic of triple-product asymmetries which probe CP violation
through differential distributions. We construct distributions with
well-defined discrete symmetry properties and characterize the asymmetries
formed upon them. It is stressed that the simplest asymmetries may not be
optimal. We explore systematic generalizations having limited reliance on the
process dynamics and phase-space parametrization. They exploit larger fractions
of the information contained in differential distributions and may lead to
increased sensitivities to CP violation. Our detailed treatment of the case of
spinless four-body decays paves the way for further experimental studies.
","[{""version"":""v1"",""created"":""Wed, 12 Aug 2015 20:11:49 GMT""},{""version"":""v2"",""created"":""Wed, 11 Nov 2015 15:16:44 GMT""}]","2015-11-12"
"1508.03055","Michael Boyer","Ling Fu, Aaron M. Kraft, Martha Greenblatt, M. C. Boyer","Origin of a Superlattice Observed in Li$_{0.9}$Mo$_{6}$O$_{17}$ by
  Scanning Tunneling Microscopy","14 pages, 4 figures",,"10.1103/PhysRevB.93.045430",,"cond-mat.mtrl-sci","http://arxiv.org/licenses/nonexclusive-distrib/1.0/","  We use scanning tunneling microscopy to study the lithium purple bronze
(Li$_{0.9}$Mo$_{6}$O$_{17}$) at room temperature. Our measurements allow us to
identify the single-crystal cleave plane and show that it is possible to obtain
clean cleaved surfaces reflecting the crystal structure without the
complications of nanoscale surface disorder. In addition to the crystal
lattice, we observe a coexisting discommensurate superlattice with wavevectors
q = 0.5a* $\pm$ 0.25b*. We propose that the origin of the superstructure is a
surface reconstruction which is driven by cleaving along a crystal plane which
contains in-plane MoO$_{4}$ tetrahedra connected to out-of-plane MoO$_{6}$
octahedra through corner-sharing oxygens. When combined with spectroscopic
measurements, our studies show a promising avenue through which to study the
complex physics within Li$_{0.9}$Mo$_{6}$O$_{17}$.
","[{""version"":""v1"",""created"":""Wed, 12 Aug 2015 20:12:06 GMT""}]","2016-03-23"
"1508.03056","Jiazhong Hu","Robert McConnell, Hao Zhang, Jiazhong Hu, Senka Cuk, Vladan Vuletic","Entanglement with Negative Wigner Function of Three Thousand Atoms
  Heralded by One Photon","11pages, 5 figures, 1 table","Nature 519, 439-442 (2015)","10.1038/nature14293",,"physics.atom-ph quant-ph","http://arxiv.org/licenses/nonexclusive-distrib/1.0/","  Quantum-mechanically correlated (entangled) states of many particles are of
interest in quantum information, quantum computing and quantum metrology.
Metrologically useful entangled states of large atomic ensembles have been
experimentally realized, but these states display Gaussian spin distribution
functions with a non-negative Wigner function. Non-Gaussian entangled states
have been produced in small ensembles of ions, and very recently in large
atomic ensembles. Here, we generate entanglement in a large atomic ensemble via
the interaction with a very weak laser pulse; remarkably, the detection of a
single photon prepares several thousand atoms in an entangled state. We
reconstruct a negative-valued Wigner function, an important hallmark of
nonclassicality, and verify an entanglement depth (minimum number of mutually
entangled atoms) of 2910(190) out of 3100 atoms. This is the first time a
negative Wigner function or the mutual entanglement of virtually all atoms have
been attained in an ensemble containing more than a few particles. While the
achieved purity of the state is slightly below the threshold for
entanglement-induced metrological gain, further technical improvement should
allow the generation of states that surpass this threshold, and of more complex
Schrodinger cat states for quantum metrology and information processing. More
generally, our results demonstrate the power of heralded methods for
entanglement generation, and illustrate how the information contained in a
single photon can drastically alter the quantum state of a large system.
","[{""version"":""v1"",""created"":""Wed, 12 Aug 2015 20:12:24 GMT""}]","2015-08-14"
"1508.03057","Kim-Vy H. Tran","Kim-Vy H. Tran, Themiya Nanayakkara, Tiantian Yuan, Glenn G. Kacprzak,
  Karl Glazebrook, Lisa J. Kewley, Ivelina Momcheva, Casey J. Papovich, Ryan
  Quadri, Greg Rudnick, Am\'elie Saintonge, Lee R. Spitler, Caroline Straatman,
  Adam Tomczak","ZFIRE: Galaxy Cluster Kinematics, H$\alpha$ Star Formation Rates, and
  Gas-Phase Metallicities of XMM-LSS J02182-05102 at z=1.6233","Accepted for publication by ApJ. Survey website is
  zfire.swinburne.edu.au",,"10.1088/0004-637X/811/1/28",,"astro-ph.GA","http://arxiv.org/licenses/nonexclusive-distrib/1.0/","  We spectroscopically survey the galaxy cluster XMM-LSS J02182-05102
(hereafter IRC 0218) using LRIS (optical) and MOSFIRE (near-infrared) on Keck I
as part of the ZFIRE survey. IRC 0218 has a narrow redshift range of
$1.612<z_{\rm spec}<1.635$ defined by 33 members of which 20 are at R$_{\rm
proj}<1$ Mpc. The cluster redshift and velocity dispersion are $z_{\rm
cl}=1.6233\pm0.0003$ and $\sigma_{\rm cl}=254\pm50$ km s$^{-1}$. We reach NIR
line sensitivities of $\sim0.3\times10^{-17}$ erg s$^{-1}$ cm$^{-2}$ that,
combined with multi-wavelength photometry, provide extinction-corrected
H$\alpha$ star formation rates (SFR), gas phase metallicities from
[NII]/H$\alpha$, and stellar masses. We measure an integrated H$\alpha$ SFR of
$\sim325{\rm M}_{\odot}$ yr$^{-1}$ (26 members; R$_{\rm proj}<2$ Mpc) and show
that the elevated star formation in the cluster core (R$_{\rm proj}<0.25$ Mpc)
is driven by the concentration of star-forming members, but the average SFR per
H$\alpha$-detected galaxy is half that of members at R$_{\rm proj}\sim1$ Mpc.
However, we do not detect any environmental imprint when comparing attenuation
and gas phase metallicities: the cluster galaxies show similar trends with
M$_{\star}$ as to the field, e.g. more massive galaxies have larger stellar
attenuation. IRC 0218's gas phase metallicity-M$_{\star}$ relation (MZR) is
offset to lower metallicities relative to $z\sim0$ and has a slope of
$0.13\pm0.10$. Comparing the MZR in IRC 0218 to the COSMOS cluster at $z=2.1$
shows no evolution ($\Delta t\sim1$ Gyr): the MZR for both galaxy clusters are
remarkably consistent with each other and virtually identical to several field
surveys at $z\sim2$.
","[{""version"":""v1"",""created"":""Wed, 12 Aug 2015 20:14:05 GMT""}]","2015-09-23"
"1508.03059","David P. Blecher","David P. Blecher","Generalization of C*-algebra methods via real positivity for operator
  and Banach algebras","32 pages",,,,"math.OA math-ph math.FA math.MP","http://arxiv.org/licenses/nonexclusive-distrib/1.0/","  With Charles Read we have introduced and studied a new notion of (real)
positivity in operator algebras, with an eye to extending certain C*-algebraic
results and theories to more general algebras. As motivation note that the
`completely' real positive maps on C*-algebras or operator systems are
precisely the completely positive maps in the usual sense; however with real
positivity one may develop a useful order theory for more general spaces and
algebras. This is intimately connected to new relationships between an operator
algebra and the C*-algebra it generates. We have continued this work together
with Read, and also with Matthew Neal. Recently with Narutaka Ozawa we have
investigated the parts of the theory that generalize further to Banach
algebras. In the present paper we describe some of this work which is connected
with generalizing various C*-algebraic techniques initiated by Richard V.
Kadison. In particular Section 2 is in part a tribute to him in keeping with
the occasion of this volume, and also discusses some of the origins of the
theory of positivity (in our sense) in the setting of algebras, which the later
parts of our paper develops further. The most recent work will be emphasized.
","[{""version"":""v1"",""created"":""Wed, 12 Aug 2015 20:16:50 GMT""}]","2015-08-14"
"1508.03060","Yunjin Choi","Yunjin Choi and Andrew N. Jordan","Three-terminal heat engine and refrigerator based on superlattices","11 pages, 8 figures","Physica E 74, 465 (2015)","10.1016/j.physe.2015.08.002",,"cond-mat.mes-hall","http://arxiv.org/licenses/nonexclusive-distrib/1.0/","  We propose a three terminal heat engine based on semiconductor superlattices
for energy harvesting. The periodicity of the superlattice structure creates an
energy miniband, giving an energy window for allowed electron transport. We
find that this device delivers a large power, nearly twice than the heat engine
based on quantum wells, with a small reduction of efficiency. This engine also
works as a refrigerator in a different regime of the system's parameters. The
thermoelectric performance of the refrigerator is analyzed, including the
cooling power and coefficient of performance in the optimized condition. We
also calculate phonon heat current through the system, and explore the
reduction of phonon heat current compared to the bulk material. The direct
phonon heat current is negligible at low temperatures, but dominates over the
electronic at room temperature and we discuss ways to reduce it.
","[{""version"":""v1"",""created"":""Wed, 12 Aug 2015 20:29:04 GMT""}]","2015-09-24"
"1508.03061","Igor Carboni Oliveira","Xi Chen, Igor C. Oliveira, Rocco A. Servedio","Addition is exponentially harder than counting for shallow monotone
  circuits",,,,,"cs.CC cs.DM math.CO","http://arxiv.org/licenses/nonexclusive-distrib/1.0/","  Let $U_{k,N}$ denote the Boolean function which takes as input $k$ strings of
$N$ bits each, representing $k$ numbers $a^{(1)},\dots,a^{(k)}$ in
$\{0,1,\dots,2^{N}-1\}$, and outputs 1 if and only if $a^{(1)} + \cdots +
a^{(k)} \geq 2^N.$ Let THR$_{t,n}$ denote a monotone unweighted threshold gate,
i.e., the Boolean function which takes as input a single string $x \in
\{0,1\}^n$ and outputs $1$ if and only if $x_1 + \cdots + x_n \geq t$. We refer
to circuits that are composed of THR gates as monotone majority circuits.
  The main result of this paper is an exponential lower bound on the size of
bounded-depth monotone majority circuits that compute $U_{k,N}$. More
precisely, we show that for any constant $d \geq 2$, any depth-$d$ monotone
majority circuit computing $U_{d,N}$ must have size
$\smash{2^{\Omega(N^{1/d})}}$. Since $U_{k,N}$ can be computed by a single
monotone weighted threshold gate (that uses exponentially large weights), our
lower bound implies that constant-depth monotone majority circuits require
exponential size to simulate monotone weighted threshold gates. This answers a
question posed by Goldmann and Karpinski (STOC'93) and recently restated by
Hastad (2010, 2014). We also show that our lower bound is essentially best
possible, by constructing a depth-$d$, size-$2^{O(N^{1/d})}$ monotone majority
circuit for $U_{d,N}$.
  As a corollary of our lower bound, we significantly strengthen a classical
theorem in circuit complexity due to Ajtai and Gurevich (JACM'87). They
exhibited a monotone function that is in AC$^0$ but requires super-polynomial
size for any constant-depth monotone circuit composed of unbounded fan-in AND
and OR gates. We describe a monotone function that is in depth-$3$ AC$^0$ but
requires exponential size monotone circuits of any constant depth, even if the
circuits are composed of THR gates.
","[{""version"":""v1"",""created"":""Wed, 12 Aug 2015 20:37:17 GMT""}]","2015-08-14"
"1508.03062","Steven Chaplick","Kathie Cameron, Steven Chaplick, Chinh T. Hoang","On the structure of (pan, even hole)-free graphs","Accepted to appear in the Journal of Graph Theory",,,,"cs.DM","http://arxiv.org/licenses/nonexclusive-distrib/1.0/","  A hole is a chordless cycle with at least four vertices. A pan is a graph
which consists of a hole and a single vertex with precisely one neighbor on the
hole. An even hole is a hole with an even number of vertices. We prove that a
(pan, even hole)-free graph can be decomposed by clique cutsets into
essentially unit circular-arc graphs. This structure theorem is the basis of
our $O(nm)$-time certifying algorithm for recognizing (pan, even hole)-free
graphs and for our $O(n^{2.5}+nm)$-time algorithm to optimally color them.
Using this structure theorem, we show that the tree-width of a (pan, even
hole)-free graph is at most 1.5 times the clique number minus 1, and thus the
chromatic number is at most 1.5 times the clique number.
","[{""version"":""v1"",""created"":""Wed, 12 Aug 2015 20:38:01 GMT""},{""version"":""v2"",""created"":""Tue, 28 Feb 2017 09:07:22 GMT""}]","2017-03-01"
"1508.03063","Alexander Moll","Alexander Moll","Random Partitions and the Quantum Benjamin-Ono Hierarchy","version 3: (i) identified meaning of results as semi-classical and
  dispersionless limits (ii) concentration of measure and Gaussian fluctuations
  generalized to coherent states in Hermitian affine spaces without assuming
  integrability (iii) clarified exposition of auxiliary spectral theory of Lax
  operators version 2: modified introduction, references added, estimates
  improved",,,,"math-ph math.CO math.MP math.PR math.RT nlin.SI","http://arxiv.org/licenses/nonexclusive-distrib/1.0/","  We derive exact and asymptotic results for random partitions from general
results in the semi-classical analysis of coherent states applied to the
classical periodic Benjamin-Ono equation at critical regularity $s= -1/2$. We
find classical $dF_{\star |v} (c| \overline{\varepsilon})$ and quantum
$d\hat{F}^{\eta_{NS}}( c | \hbar, \overline{\varepsilon})|_{\Psi}$ conserved
densities for this system with dispersion coefficient $\overline{\varepsilon}$
extending Nazarov-Sklyanin (2013). For quantum stationary states, this
conserved density is $dF_{\lambda}(c | \varepsilon_2, \varepsilon_1)$ the
Rayleigh measure of the profile of a partition $\lambda$ of anisotropy
$(\varepsilon_2, \varepsilon_1) \in \mathbb{C}^2$ for $\hbar = - \varepsilon_1
\varepsilon_2$, $\overline{\varepsilon}= \varepsilon_1 + \varepsilon_2$
invariant under $\varepsilon_2 \longleftrightarrow \varepsilon_1$. As Jack
polynomials are the quantum stationary states and Stanley's Cauchy kernel
(1989) is the reproducing kernel, the random values of the quantum periodic
Benjamin-Ono hierarchy in a coherent state $\Upsilon_v ( \cdot | \hbar)$ are a
""Jack measure"" on partitions, a dispersive generalization of Okounkov's Schur
measures (1999). By our general results for coherent states, we have
concentration on a limit shape as $\hbar \rightarrow 0$, the classical
conserved density at $v$, and quantum fluctuations are an explicit Gaussian
field. Our results follow from an enumerative asymptotic expansion in $\hbar$
and $\overline{\varepsilon}$ of joint cumulants over new combinatorial objects
we call ""ribbon paths"". Our results reflect the fact that at fixed $\hbar>0$
the weight defining Fock space is already a fractional Brownian motion of
variance $\hbar$ and Hurst index $(-s) - \tfrac{1}{2} \dim \mathbb{T} = +
\tfrac{1}{2} - \tfrac{1}{2} = 0.$
","[{""version"":""v1"",""created"":""Wed, 12 Aug 2015 20:39:57 GMT""},{""version"":""v2"",""created"":""Mon, 23 Nov 2015 07:39:36 GMT""},{""version"":""v3"",""created"":""Tue, 15 Aug 2017 17:44:52 GMT""}]","2017-08-16"
"1508.03065","Louk Rademaker","Louk Rademaker, Arnaud Ralko, Simone Fratini, Vladimir Dobrosavljevic","Avoiding Stripe Order: Emergence of the Supercooled Electron Liquid","4 pages, 4 figures, submitted to the proceedings of ""Superstripes
  2015"", Journal of Superconductivity and Novel Magnetism (2015)",,"10.1007/s10948-015-3310-4",,"cond-mat.str-el cond-mat.stat-mech","http://arxiv.org/licenses/nonexclusive-distrib/1.0/","  In the absence of disorder, electrons can display glassy behavior through
supercooling the liquid state, avoiding the solidification into a charge
ordered state. Such supercooled electron liquids are experimentally found in
organic $\theta$-$MM'$ compounds. We present theoretical results that
qualitatively capture the experimental findings. At intermediate temperatures,
the conducting state crosses over into a weakly insulating pseudogap phase. The
stripe order phase transition is first order, so that the liquid phase is
metastable below $T_s$. In the supercooled liquid phase the resistivity
increases further and the density of states at the Fermi level is suppressed,
indicating kinetic arrest and the formation of a glassy state. Our results are
obtained using classical Extended Dynamical Mean Field Theory.
","[{""version"":""v1"",""created"":""Wed, 12 Aug 2015 20:45:00 GMT""},{""version"":""v2"",""created"":""Mon, 15 Feb 2016 17:18:46 GMT""}]","2016-02-16"
