"1508.03115","Hao Tong","H. Tong","Ultraluminous X-ray pulsar: accreting magnetar?","5 pages, 1 figure. submitted to the proceeding of SMFNS2015",,,,"astro-ph.HE","http://arxiv.org/licenses/nonexclusive-distrib/1.0/","  Magnetars are a special kind of neutron stars. There may also be accreting
magnetars. From the studies of isolated magnetars, it is known that a neutron
star with a strong dipole field only is not a magnetar. Super-slow X-ray
pulsars may just be accreting high magnetic field neutron stars. The
ultra-luminous X-ray pulsar NuSTAR J095551+6940.8 may be an accreting magnetar.
It may be an accreting low magnetic field magnetar with multipole field of
10^14 G and dipole field of 10^12 G. This point of view is consistent with the
study of isolated magnetars. An ultra-luminous X-ray pulsar phase in the binary
evolution may result in massive millisecond pulsars.
","[{""version"":""v1"",""created"":""Thu, 13 Aug 2015 04:16:57 GMT""}]","2015-08-14"
"1508.03116","Christan Grant","Christan Grant, Daisy Zhe Wang, Michael L. Wick","Query-Driven Sampling for Collective Entity Resolution",,,,,"cs.DB","http://arxiv.org/licenses/nonexclusive-distrib/1.0/","  Probabilistic databases play a preeminent role in the processing and
management of uncertain data. Recently, many database research efforts have
integrated probabilistic models into databases to support tasks such as
information extraction and labeling. Many of these efforts are based on batch
oriented inference which inhibits a realtime workflow. One important task is
entity resolution (ER). ER is the process of determining records (mentions) in
a database that correspond to the same real-world entity. Traditional pairwise
ER methods can lead to inconsistencies and low accuracy due to localized
decisions. Leading ER systems solve this problem by collectively resolving all
records using a probabilistic graphical model and Markov chain Monte Carlo
(MCMC) inference. However, for large datasets this is an extremely expensive
process. One key observation is that, such exhaustive ER process incurs a huge
up-front cost, which is wasteful in practice because most users are interested
in only a small subset of entities. In this paper, we advocate pay-as-you-go
entity resolution by developing a number of query-driven collective ER
techniques. We introduce two classes of SQL queries that involve ER operators
--- selection-driven ER and join-driven ER. We implement novel variations of
the MCMC Metropolis Hastings algorithm to generate biased samples and
selectivity-based scheduling algorithms to support the two classes of ER
queries. Finally, we show that query-driven ER algorithms can converge and
return results within minutes over a database populated with the extraction
from a newswire dataset containing 71 million mentions.
","[{""version"":""v1"",""created"":""Thu, 13 Aug 2015 04:23:58 GMT""}]","2015-08-14"
"1508.03117","Canyi Lu","Canyi Lu, Huan Li, Zhouchen Lin","Optimized Projections for Compressed Sensing via Direct Mutual Coherence
  Minimization",,"Signal Processing, 2018",,,"cs.IT cs.LG math.IT","http://arxiv.org/licenses/nonexclusive-distrib/1.0/","  Compressed Sensing (CS) is a novel technique for simultaneous signal sampling
and compression based on the existence of a sparse representation of signal and
a projected dictionary $PD$, where $P\in\mathbb{R}^{m\times d}$ is the
projection matrix and $D\in\mathbb{R}^{d\times n}$ is the dictionary. To
exactly recover the signal with a small number of measurements $m$, the
projected dictionary $PD$ is expected to be of low mutual coherence. Several
previous methods attempt to find the projection $P$ such that the mutual
coherence of $PD$ can be as low as possible. However, they do not minimize the
mutual coherence directly and thus their methods are far from optimal. Also the
solvers they used lack of the convergence guarantee and thus there has no
guarantee on the quality of their obtained solutions. This work aims to address
these issues. We propose to find an optimal projection by minimizing the mutual
coherence of $PD$ directly. This leads to a nonconvex nonsmooth minimization
problem. We then approximate it by smoothing and solve it by alternate
minimization. We further prove the convergence of our algorithm. To the best of
our knowledge, this is the first work which directly minimizes the mutual
coherence of the projected dictionary with a convergence guarantee. Numerical
experiments demonstrate that the proposed method can recover sparse signals
better than existing methods.
","[{""version"":""v1"",""created"":""Thu, 13 Aug 2015 04:41:40 GMT""},{""version"":""v2"",""created"":""Fri, 30 Dec 2016 03:00:34 GMT""},{""version"":""v3"",""created"":""Mon, 23 Apr 2018 19:05:03 GMT""}]","2018-04-25"
"1508.03118","Manoranjan Kumar","Manoranjan Kumar, Aslam Parvej, Simil Thomas, S. Ramasesha and Z. G.
  Soos","Efficient Density Matrix Renormalization Group algorithm to study
  Y-Junctions with integer and half-integer spin","11 pages, 11 Figures and submitted to PRB",,"10.1103/PhysRevB.93.075107",,"cond-mat.str-el","http://arxiv.org/licenses/nonexclusive-distrib/1.0/","  An efficient density matrix renormalization group (DMRG) algorithm is
presented and applied to Y-junctions, systems with three arms of $n$ sites that
meet at a central site. The accuracy is comparable to DMRG of chains. As in
chains, new sites are always bonded to the most recently added sites and the
superblock Hamiltonian contains only new or once renormalized operators.
Junctions of up to $N = 3n + 1 \approx 500$ sites are studied with
antiferromagnetic (AF) Heisenberg exchange $J$ between nearest-neighbor spins
$S$ or electron transfer $t$ between nearest neighbors in half-filled Hubbard
models. Exchange or electron transfer is exclusively between sites in two
sublattices with $N_A \ne N_B$. The ground state (GS) and spin densities $
\rho_r = <S^z_r >$ at site $r$ are quite different for junctions with $S$ =
1/2, 1, 3/2 and 2. The GS has finite total spin $S_G = 2S (S)$ for even (odd)
$N$ and for $M_G =S_G$ in the $S_G$ spin manifold, $\rho_r > 0 (< 0)$ at sites
of the larger (smaller) sublattice. $S$ = 1/2 junctions have delocalized states
and decreasing spin densities with increasing $N$. $S$ = 1 junctions have four
localized $S_z = 1/2$ states at the end of each arm and centered on the
junction, consistent with localized states in $S$ = 1 chains with finite
Haldane gap. The GS of $S$ = 3/2 or 2 junctions of up to 500 spins is a spin
density wave (SDW) with increased amplitude at the ends of arms or near the
junction. Quantum fluctuations completely suppress AF order in $S$ = 1/2 or 1
junctions, as well as in half-filled Hubbard junctions, but reduce rather than
suppress AF order in $S$ = 3/2 or 2 junctions.
","[{""version"":""v1"",""created"":""Thu, 13 Aug 2015 04:56:59 GMT""}]","2016-03-23"
"1508.03119","Hajime Sotani","Hajime Sotani and Umpei Miyamoto","Strong gravitational lensing by an electrically charged black hole in
  Eddington-inspired Born-Infeld gravity","accepted for publication in PRD","Phys. Rev. D 92, 044052 (2015)","10.1103/PhysRevD.92.044052",,"gr-qc astro-ph.HE","http://arxiv.org/licenses/nonexclusive-distrib/1.0/","  We systematically examine the properties of null geodesics around an
electrically charged, asymptotically flat black hole in Eddington-inspired
Born-Infeld gravity, varying the electric charge of black hole and the coupling
constant in the theory. We find that the radius of the unstable circular orbit
for massless particle decreases with the coupling constant, if the value of the
electrical charge is fixed. Additionally, we consider the strong gravitational
lensing around such a black hole. We show that the deflection angle, the
position angle of the relativistic images, and the magnification due to the
light bending in strong gravitational field are quite sensitive to the
parameters determining the black hole solution. Thus, through the accurate
observations associated with the strong gravitational lensing, it might be
possible to reveal the gravitational theory in a strong field regime.
","[{""version"":""v1"",""created"":""Thu, 13 Aug 2015 05:04:49 GMT""}]","2015-09-30"
"1508.03120","Andrea Blanco Redondo","Andrea Blanco-Redondo, C. Martijn de Sterke, John E. Sipe, Thomas F.
  Krauss, Benjamin J. Eggleton, Chad Husko","Pure-Quartic Solitons",,,"10.1038/ncomms10427",,"physics.optics","http://arxiv.org/licenses/nonexclusive-distrib/1.0/","  Temporal optical solitons have been the subject of intense research due to
their intriguing physics and applications in ultrafast optics and
supercontinuum generation. Conventional bright optical solitons result from the
interaction of anomalous group-velocity dispersion and self-phase modulation.
Here we report the discovery of an entirely new class of bright solitons
arising purely from the interaction of negative fourth-order dispersion and
self-phase modulation, which can occur even for normal group-velocity
dispersion. We provide experimental and numerical evidence of shape-preserving
propagation and flat temporal phase for the fundamental pure-quartic soliton
and periodically modulated propagation for the higher-order pure-quartic
solitons. Using analytic theory, we derive the approximate shape of the
fundamental pure-quartic soliton exhibiting excellent agreement with our
experimental observations. Our discovery, enabled by the unique dispersion of
photonic crystal waveguides, could find applications in communications and
ultrafast lasers.
","[{""version"":""v1"",""created"":""Thu, 13 Aug 2015 05:17:49 GMT""}]","2016-02-17"
"1508.03121","Lucas Sourrouille Mr.","Lucas Sourrouille","Note on generalization of Jackiw-Pi Vortices","10 pages, version accepted for publication","EPL 113 (2016) 51001","10.1209/0295-5075/113/51001",,"hep-th","http://arxiv.org/licenses/nonexclusive-distrib/1.0/","  We analyze two abelian Higgs systems with nonstandard kinetic terms. We
consider a model involving the Maxwell term. For a particular choice of the
nonstandard kinetics, we are able to obtain generalized Jackiw-Pi vortices. We,
also, analyze a generalization of the Jackiw-Pi model. In that case we show
that the system support the Nielsen-Olesen vortices as solutions.
","[{""version"":""v1"",""created"":""Thu, 13 Aug 2015 05:19:39 GMT""},{""version"":""v2"",""created"":""Thu, 10 Mar 2016 04:44:11 GMT""}]","2016-03-18"
"1508.03122","Emmanuel Paul","Emmanuel Paul and Jean-Pierre Ramis","Dynamics on Wild Character Varieties",,"SIGMA 11 (2015), 068, 21 pages","10.3842/SIGMA.2015.068",,"math.CA math.AG","http://creativecommons.org/licenses/by-nc-sa/4.0/","  In the present paper, we will first present briefly a general research
program about the study of the ""natural dynamics"" on character varieties and
wild character varieties. Afterwards, we will illustrate this program in the
context of the Painlev\'e differential equations $P_{\rm VI}$ and $P_{\rm V}$.
","[{""version"":""v1"",""created"":""Thu, 13 Aug 2015 05:22:43 GMT""}]","2015-08-14"
"1508.03123","Florin P. Boca","Florin P. Boca","A note on full free product C*-algebras, lifting and quasidiagonality",,"Proceedings of the 16th International Conference on Operator
  Theory (Timisoara, 1996), The Theta Foundation, Bucharest 1997, pp. 51-63",,,"math.OA","http://arxiv.org/licenses/nonexclusive-distrib/1.0/","  We study lifting properties for full product C*-algebras with amalgamation
over ${\mathbb C}1$ and give new proofs for some results of Kirchberg and
Pisier. We extend the result of Choi on the quasidiagonality of $C^*({\mathbb
F}_n)$, proving that the free product with amalgamation over ${\mathbb C}1$ of
a family of unital quasidiagonal C*-algebras is quasidiagonal.
","[{""version"":""v1"",""created"":""Thu, 13 Aug 2015 05:31:40 GMT""}]","2015-08-14"
"1508.03124","Tang Yutao","Yutao Tang","Robust Consensus Tracking of Heterogeneous Multi-Agent Systems under
  Switching Topologies","11 pages, 4 figures, accepted",,,,"math.OC","http://arxiv.org/licenses/nonexclusive-distrib/1.0/","  In this paper, we consider a robust consensus tracking problem of
heterogeneous multi-agent systems with time-varying interconnection topologies.
Based on common Lyapunov function and internal model techniques, both state and
output feedback control laws are derived to solve this problem. The proposed
design is robust by admitting some parameter uncertainties in the multi-agent
system.
","[{""version"":""v1"",""created"":""Thu, 13 Aug 2015 05:33:19 GMT""}]","2015-08-14"
"1508.03125","Guilherme Colherinhas","Bruna Fideles, Leonardo B. A. Oliveira and Guilherme Colherinhas","GIAO-DFT Isotropic magnetic shielding constants and spin-spin coupling
  of tartaric acid in water solution",,,"10.1016/j.cplett.2015.12.003",,"physics.atm-clus physics.atom-ph physics.chem-ph","http://arxiv.org/licenses/nonexclusive-distrib/1.0/","  We investigate the nuclear isotropic shielding constants and spin-spin
coupling for oxygen and carbons atoms of isomers of tartaric acid in gas phase
and water solutions by Monte Carlo simulation and quantum mechanics
calculations using the GIAO-B3LYP approach. Solute polarization effects are
included iteratively and play an important role in the quantitative
determination of shielding constants. Our MP2/aug-cc-pVTZ results show
substantial increases of the dipole moment in solution as compared with the gas
phase results (61-221%). The solvent effects on the {\sigma}(13C) [J(C-C)]
values are in general small. More appreciable solvent effects can be seen on
the {\sigma}(17O) and J(C-O).
","[{""version"":""v1"",""created"":""Thu, 13 Aug 2015 05:46:25 GMT""}]","2016-02-17"
"1508.03126","Allan Sacha Brun","L. Alvan (1), A. Strugarek (2,1), A.S. Brun (1), S. Mathis (1), R.A.
  Garcia (1)","Characterizing the propagation of gravity waves in 3D nonlinear
  simulations of solar-like stars","14 pages, 12 figues, accepted by Astronomy & Astrophysics",,"10.1051/0004-6361/201526250",,"astro-ph.SR","http://arxiv.org/licenses/nonexclusive-distrib/1.0/","  The revolution of helio- and asteroseismology provides access to the detailed
properties of stellar interiors by studying the star's oscillation modes. Among
them, gravity (g) modes are formed by constructive interferences between
progressive internal gravity waves (IGWs), propagating in stellar radiative
zones. Our new 3D nonlinear simulations of the interior of a solar-like star
allows us to study the excitation, propagation, and dissipation of these waves.
The aim of this article is to clarify our understanding of the behavior of IGWs
in a 3D radiative zone and to provide a clear overview of their properties. We
use a method of frequency filtering that reveals the path of {individual}
gravity waves of different frequencies in the radiative zone. We are able to
identify the region of propagation of different waves in 2D and 3D, to compare
them to the linear raytracing theory and to distinguish between propagative and
standing waves (g modes). We also show that the energy carried by waves is
distributed in different planes in the sphere, depending on their azimuthal
wave number. We are able to isolate individual IGWs from a complex spectrum and
to study their propagation in space and time. In particular, we highlight in
this paper the necessity of studying the propagation of waves in 3D spherical
geometry, since the distribution of their energy is not equipartitioned in the
sphere.
","[{""version"":""v1"",""created"":""Thu, 13 Aug 2015 06:08:21 GMT""}]","2015-09-23"
"1508.03127","Roberto A. Sussman","Roberto A. Sussman and Ismael Delgado Gaspar","Multiple non-spherical structures from the extrema of Szekeres scalars","Matches published version. 28 pages, 9 figures. Minor but important
  corrections were incorporated","Phys. Rev. D 92, 083533 (2015)","10.1103/PhysRevD.92.083533",,"gr-qc astro-ph.CO hep-th","http://arxiv.org/licenses/nonexclusive-distrib/1.0/","  We examine the spatial extrema (local maxima, minima and saddle points) of
the covariant scalars (density, Hubble expansion, spatial curvature and
eigenvalues of the shear and electric Weyl tensors) of the quasi-spherical
Szekeres dust models. Sufficient conditions are obtained for the existence of
distributions of multiple extrema in spatial comoving locations that can be
prescribed through initial conditions. These distributions evolve without shell
crossing singularities at least for ever expanding models (with or without
cosmological constant) in the full evolution range where the models are valid.
By considering the local maxima and minima of the density, our results allow
for setting up elaborated networks of ""pancake"" shaped evolving cold dark
matter over-densities and density voids whose spatial distribution and
amplitudes can be controlled from initial data compatible with standard early
Universe initial conditions. We believe that these results have an enormous
range of potential application by providing a fully relativistic
non-perturbative coarse grained modelling of cosmic structure at all scales.
","[{""version"":""v1"",""created"":""Thu, 13 Aug 2015 06:17:09 GMT""},{""version"":""v2"",""created"":""Thu, 20 Aug 2015 04:36:20 GMT""},{""version"":""v3"",""created"":""Sat, 7 Nov 2015 00:15:55 GMT""}]","2015-11-10"
"1508.03128","Mohammad Shahryari","M. Shahryari","Algebraic sets with fully characteristic radicals","6 pages",,,,"math.GR","http://arxiv.org/licenses/nonexclusive-distrib/1.0/","  We obtain a necessary and sufficient condition for an algebraic set in a
group to have a fully characteristic radical. As a result, we see that if the
radical of a system of equation $S$ over a group $G$ is fully characteristic,
then there exists a class $\mathfrak{X}$ of subgroups of $G$ such that elements
of $S$ are identities of $\mathfrak{X}$.
","[{""version"":""v1"",""created"":""Thu, 13 Aug 2015 06:21:03 GMT""},{""version"":""v2"",""created"":""Tue, 26 Jan 2016 11:23:20 GMT""}]","2016-01-27"
"1508.03129","Steffen Sagave","Irakli Patchkoria and Steffen Sagave","Topological Hochschild homology and the cyclic bar construction in
  symmetric spectra","v2: 7 pages; exposition improved, accepted for publication in
  Proceedings of the AMS","Proc. Amer. Math. Soc. 144 (2016), no. 9, 4099-4106","10.1090/proc/13037","CPH-SYM-DNRF92","math.AT math.KT","http://arxiv.org/licenses/nonexclusive-distrib/1.0/","  The cyclic bar construction in symmetric spectra and B\""okstedt's original
construction are two possible ways to define the topological Hochschild
homology of a symmetric ring spectrum. In this short note we explain how to
correct an error in Shipley's original comparison of these two approaches.
","[{""version"":""v1"",""created"":""Thu, 13 Aug 2015 06:29:32 GMT""},{""version"":""v2"",""created"":""Wed, 18 Nov 2015 08:05:56 GMT""}]","2016-07-06"
"1508.03130","Aditi Raghunathan","Narayanan U. Edakunni, Aditi Raghunathan, Abhishek Tripathi, John
  Handley, Fredric Roulland","Probabilistic Dependency Networks for Prediction and Diagnostics","Presented at the Transportation Research Board Annual Meeting 2014",,,,"cs.LG","http://arxiv.org/licenses/nonexclusive-distrib/1.0/","  Research in transportation frequently involve modelling and predicting
attributes of events that occur at regular intervals. The event could be
arrival of a bus at a bus stop, the volume of a traffic at a particular point,
the demand at a particular bus stop etc. In this work, we propose a specific
implementation of probabilistic graphical models to learn the probabilistic
dependency between the events that occur in a network. A dependency graph is
built from the past observed instances of the event and we use the graph to
understand the causal effects of some events on others in the system. The
dependency graph is also used to predict the attributes of future events and is
shown to have a good prediction accuracy compared to the state of the art.
","[{""version"":""v1"",""created"":""Thu, 13 Aug 2015 06:42:25 GMT""}]","2015-08-14"
"1508.03131","Yuma Okazaki","Yuma Okazaki and Nobu-hisa Kaneko","Design and Analysis on a Cryogenic Current Amplifier with a
  Superconducting Microwave Resonator","4 pages, 3 figures",,,,"physics.ins-det cond-mat.mes-hall","http://arxiv.org/licenses/nonexclusive-distrib/1.0/","  We propose a new type of cryogenic current amplifiers, in which low-frequency
power spectrum of current can be measured through a measurement of microwave
response of a superconducting resonant circuit shunted by a series array of
Josephson junctions. From numerical analysis on the equivalent circuit, the
numerical value of the input-referred current noise of the proposed amplifier
is found to be two orders of magnitude lower than the noise floor measured with
the conventional cryogenic current amplifiers based on high-electron-mobility
transistors or superconducting quantum interference devices. Our proposal can
open new avenues for investigating low-temperature solid-state devices that
require lower noise and wider bandwidth power spectrum measurements of current.
","[{""version"":""v1"",""created"":""Thu, 13 Aug 2015 06:48:40 GMT""}]","2015-08-14"
"1508.03132","Arghavan  Safavi-Naini","C. Zhang, A. Safavi-Naini, Ana Maria Rey, and B. Capogrosso-Sansone","Equilibrium Phases of Tilted Dipolar Lattice Bosons","7 pages, 6 figures",,"10.1088/1367-2630/17/12/123014",,"cond-mat.quant-gas quant-ph","http://arxiv.org/licenses/nonexclusive-distrib/1.0/","  The recent advances in creating nearly degenerate quantum dipolar gases in
optical lattices are opening the doors for the exploration of equilibrium
physics of quantum systems with anisotropic and long-range dipolar
interactions. In this paper we study the zero- and finite-temperature phase
diagrams of a system of hard-core dipolar bosons at half-filling, trapped in a
two-dimensional optical lattice. The dipoles are aligned parallel to one
another and tilted out of the optical lattice plane by means of an external
electric field. At zero-temperature, the system is a superfluid at all tilt
angles $\theta$ provided that the strength of dipolar interaction is below a
critical value $V_c(\theta)$. Upon increasing the interaction strength while
keeping $\theta$ fixed, the superfluid phase is destabilized in favor of a
checkerboard or a stripe solid depending on the tilt angle. We explore the
nature of the phase transition between the two solid phases and find evidence
of a micro-emulsion phase, following the Spivak-Kivelson scenario, separating
these two solid phases. Additionally, we study the stability of these quantum
phases against thermal fluctuations and find that the stripe solid is the most
robust, making it the best candidate for experimental observation.
","[{""version"":""v1"",""created"":""Thu, 13 Aug 2015 06:55:51 GMT""}]","2016-01-20"
"1508.03133","Jonas Lippuner","Jonas Lippuner and Luke F. Roberts","r-Process Lanthanide Production and Heating Rates in Kilonovae","19 pages, 9 figures","The Astrophysical Journal, Volume 815, Issue 2, article id. 82, 18
  pp. (2015)","10.1088/0004-637X/815/2/82",,"astro-ph.HE","http://arxiv.org/licenses/nonexclusive-distrib/1.0/","  r-Process nucleosynthesis in material ejected during neutron star mergers may
lead to radioactively powered transients called kilonovae. The timescale and
peak luminosity of these transients depend on the composition of the ejecta,
which determines the local heating rate from nuclear decays and the opacity.
Kasen et al. (2013, ApJ, 774, 25) and Tanaka & Hotokezaka (2013, ApJ, 775, 113)
pointed out that lanthanides can drastically increase the opacity in these
outflows. We use the new general-purpose nuclear reaction network SkyNet to
carry out a parameter study of r-process nucleosynthesis for a range of initial
electron fractions $Y_e$, initial specific entropies $s$, and expansion
timescales $\tau$. We find that the ejecta is lanthanide-free for $Y_e \gtrsim
0.22 - 0.30$, depending on $s$ and $\tau$. The heating rate is insensitive to
$s$ and $\tau$, but certain, larger values of $Y_e$ lead to reduced heating
rates, due to individual nuclides dominating the heating. We calculate
approximate light curves with a simplified gray radiative transport scheme. The
light curves peak at about a day (week) in the lanthanide-free (-rich) cases.
The heating rate does not change much as the ejecta becomes lanthanide-free
with increasing $Y_e$, but the light curve peak becomes about an order of
magnitude brighter because it peaks much earlier when the heating rate is
larger. We also provide parametric fits for the heating rates between 0.1 and
$100\,\text{days}$, and we provide a simple fit in $Y_e$, $s$, and $\tau$ to
estimate whether the ejecta is lanthanide-rich or not.
","[{""version"":""v1"",""created"":""Thu, 13 Aug 2015 07:13:19 GMT""},{""version"":""v2"",""created"":""Mon, 2 Nov 2015 21:48:41 GMT""}]","2015-12-23"
"1508.03134","Cristian Lenart","Cristian Lenart and Kirill Zainoulline","A Schubert basis in equivariant elliptic cohomology","arXiv admin note: text overlap with arXiv:1408.5952",,,,"math.AG math.CO math.RT","http://arxiv.org/licenses/nonexclusive-distrib/1.0/","  We address the problem of defining Schubert classes independently of a
reduced word in equivariant elliptic cohomology, based on the Kazhdan-Lusztig
basis of a corresponding Hecke algebra. We study some basic properties of these
classes, and make two important conjectures about them: a positivity
conjecture, and the agreement with the topologically defined Schubert classes
in the smooth case. We prove some special cases of these conjectures.
","[{""version"":""v1"",""created"":""Thu, 13 Aug 2015 07:16:22 GMT""},{""version"":""v2"",""created"":""Sat, 6 Feb 2016 21:21:25 GMT""}]","2016-02-09"
