"1508.05746","Tomasz Popiel","Luke Morgan, Tomasz Popiel","Generalised polygons admitting a point-primitive almost simple group of
  Suzuki or Ree type",,,,,"math.GR math.CO","http://arxiv.org/licenses/nonexclusive-distrib/1.0/","  Let $G$ be a collineation group of a thick finite generalised hexagon or
generalised octagon $\Gamma$. If $G$ acts primitively on the points of
$\Gamma$, then a recent result of Bamberg et al. shows that $G$ must be an
almost simple group of Lie type. We show that, furthermore, the minimal normal
subgroup $S$ of $G$ cannot be a Suzuki group or a Ree group of type
$^2\text{G}_2$, and that if $S$ is a Ree group of type $^2\text{F}_4$, then
$\Gamma$ is (up to point--line duality) the classical Ree--Tits generalised
octagon.
","[{""version"":""v1"",""created"":""Mon, 24 Aug 2015 10:22:07 GMT""}]","2015-08-25"
"1508.05747","Yuichi Uesaka","Yuichi Uesaka, Yoshitaka Kuno, Joe Sato, Toru Sato and Masato Yamanaka","Improved analysis of the CLFV decay of muonic atoms $\mu^-e^-\rightarrow
  e^-e^-$","Proceedings of Flavor Phisics & CP Violation 2015 (FPCP 2015), 25-29
  May, Nagoya, Japan",,,,"hep-ph","http://arxiv.org/licenses/nonexclusive-distrib/1.0/","  Koike et al. proposed the charged lepton flavor violation (CLFV) decay of the
muonic atom $\mu^-e^-\rightarrow e^-e^-$ as one of the promising processes to
search for new physics beyond the standard model. It was found that the
attractive interaction of leptons with the nucleus enhances the transition rate
of the $\mu^-e^-\rightarrow e^-e^-$ process. We report on our improved analysis
of this process by taking into account the distortion of the out-going
electrons in the nuclear Coulomb potential and the relativistic treatment of
the muon and the electrons. As results, we found significant enhancement of the
transition rate. The transition rate for $^{208}$Pb becomes about 7 times
larger than the previous estimation, which enhances the sensitivity of this
process to discover the CLFV interaction. We also report on the energy spectrum
of the out-going electron.
","[{""version"":""v1"",""created"":""Mon, 24 Aug 2015 10:23:21 GMT""}]","2015-08-25"
"1508.05748","Vladimir Shevelev","Vladimir Shevelev","Representation of positive integers by the form $x^3+y^3+z^3-3xyz$","6 pages Adding Section 7",,,,"math.NT","http://arxiv.org/licenses/nonexclusive-distrib/1.0/","  We study the number $\nu(n)$ of representations of a positive integer $n$ by
the form $x^3+y^3+z^3-3xyz$ in the conditions $0\leq x\leq y\leq z; z\geq x+1.$
We proved the following results: (i) for every positive $n,$ except for
$n\equiv\pm3 \pmod9,$ $\nu(n)>=1;$ (ii) for the exceptional $n,$ $\nu(n)=0;$
(iii) for every prime $p\neq3,$ $\nu(p)=\nu(2p)=1;$ (iv) $\limsup
(\nu(n))=\infty;$ (v) for every positive $n,$ there exists $k$ such that
$\nu(k)=n.$
","[{""version"":""v1"",""created"":""Mon, 24 Aug 2015 10:29:12 GMT""},{""version"":""v2"",""created"":""Mon, 25 Apr 2016 13:32:33 GMT""}]","2016-04-26"
"1508.05749","Anthony Bennett","J. P. Lee, A. J. Bennett, J. Skiba-Szymanska, D. J. P. Ellis, I.
  Farrer, D. A. Ritchie and A. J. Shields","Ramsey Interference in a Multi-level Quantum System",,"Phys. Rev. B 93, 085407 (2016)","10.1103/PhysRevB.93.085407",,"cond-mat.mes-hall quant-ph","http://arxiv.org/licenses/nonexclusive-distrib/1.0/","  We report Ramsey interference in the excitonic population of a negatively
charged quantum dot revealing the coherence of the state in the limit where
radiative decay is dominant. Our experiments show that the decay time of the
Ramsey interference is limited by the spectral width of the transition.
Applying a vertical magnetic field induces Zeeman split transitions that can be
addressed by changing the laser detuning to reveal 2, 3 and 4 level system
behaviour. We show that under finite field the phase-sensitive control of two
optical pulses from a single laser can be used to prepare both population and
spin qubits simultaneously.
","[{""version"":""v1"",""created"":""Mon, 24 Aug 2015 10:30:44 GMT""}]","2016-05-09"
"1508.05750","Thomas Hofmann","T. Hofmann, K.O. Kruchinin, A. Bosco, S.M. Gibson, F. Roncarolo, G.
  Boorman, U. Raich, E. Bravin, J.K. Pozimski, A. Letchford, C. Gabor","Demonstration of a laserwire emittance scanner for the CERN LINAC4 H-
  Beam","10 pages, 13 figures, to be published in Physical Review Special
  Topics - Accelerators and Beams","Phys. Rev. ST Accel. Beams 18, 122801 (2015)","10.1103/PhysRevSTAB.18.122801",,"physics.acc-ph","http://arxiv.org/licenses/nonexclusive-distrib/1.0/","  A non-invasive, compact laserwire system has been developed to measure the
transverse emittance of an H- beam and has been demonstrated at the new LINAC4
injector for the LHC at CERN. Light from a low power, pulsed laser source is
conveyed via fibre to collide with the H- beam, a fraction of which is
neutralized and then intercepted by a downstream diamond detector. Scanning the
focused laser across the H- beam and measuring the distribution of the
photo-neutralized particles enables the transverse emittance to be
reconstructed. The vertical phase-space distribution of a 3 MeV beam during
LINAC4 commissioning has been measured by the laserwire and verified with a
conventional slit and grid method.
","[{""version"":""v1"",""created"":""Mon, 24 Aug 2015 10:34:16 GMT""},{""version"":""v2"",""created"":""Tue, 17 Nov 2015 14:03:17 GMT""}]","2015-12-30"
"1508.05751","Michael Bommarito II","Daniel Martin Katz, Michael J Bommarito II, Tyler Soellinger, James
  Ming Chen","Law on the Market? Abnormal Stock Returns and Supreme Court
  Decision-Making","25 pages, 6 figures; first presented in brief at the 14th Annual
  Finance, Risk and Accounting Conference, Oriel College - Oxford University
  (2014)",,,,"physics.soc-ph q-fin.GN","http://arxiv.org/licenses/nonexclusive-distrib/1.0/","  What happens when the Supreme Court of the United States decides a case
impacting one or more publicly-traded firms? While many have observed anecdotal
evidence linking decisions or oral arguments to abnormal stock returns, few
have rigorously or systematically investigated the behavior of equities around
Supreme Court actions. In this research, we present the first comprehensive,
longitudinal study on the topic, spanning over 15 years and hundreds of cases
and firms. Using both intra- and interday data around decisions and oral
arguments, we evaluate the frequency and magnitude of statistically-significant
abnormal return events after Supreme Court action. On a per-term basis, we find
5.3 cases and 7.8 stocks that exhibit abnormal returns after decision. In
total, across the cases we examined, we find 79 out of the 211 cases (37%)
exhibit an average abnormal return of 4.4% over a two-session window with an
average $|t|$-statistic of 2.9. Finally, we observe that abnormal returns
following Supreme Court decisions materialize over the span of hours and days,
not minutes, yielding strong implications for market efficiency in this
context. While we cannot causally separate substantive legal impact from mere
revision of beliefs, we do find strong evidence that there is indeed a ""law on
the market"" effect as measured by the frequency of abnormal return events, and
that these abnormal returns are not immediately incorporated into prices.
","[{""version"":""v1"",""created"":""Mon, 24 Aug 2015 10:43:14 GMT""},{""version"":""v2"",""created"":""Sun, 14 May 2017 19:05:57 GMT""}]","2017-05-16"
"1508.05752","Witold Bo{\l}t","Witold Bo{\l}t, Jan M. Baetens and Bernard De Baets","An evolutionary approach to the identification of Cellular Automata
  based on partial observations","IEEE CEC 2015",,,,"cs.NE nlin.CG","http://arxiv.org/licenses/nonexclusive-distrib/1.0/","  In this paper we consider the identification problem of Cellular Automata
(CAs). The problem is defined and solved in the context of partial observations
with time gaps of unknown length, i.e. pre-recorded, partial configurations of
the system at certain, unknown time steps. A solution method based on a
modified variant of a Genetic Algorithm (GA) is proposed and illustrated with
brief experimental results.
","[{""version"":""v1"",""created"":""Mon, 24 Aug 2015 10:47:47 GMT""}]","2015-08-25"
"1508.05753","Valerio Bioglio","Valerio Bioglio, Frederic Gabry, Ingmar Land","Optimizing MDS Codes for Caching at the Edge","to appear in Globecom 2015",,,,"cs.IT math.IT","http://arxiv.org/licenses/nonexclusive-distrib/1.0/","  In this paper we investigate the problem of optimal MDS-encoded cache
placement at the wireless edge to minimize the backhaul rate in heterogeneous
networks. We derive the backhaul rate performance of any caching scheme based
on file splitting and MDS encoding and we formulate the optimal caching scheme
as a convex optimization problem. We then thoroughly investigate the
performance of this optimal scheme for an important heterogeneous network
scenario. We compare it to several other caching strategies and we analyze the
influence of the system parameters, such as the popularity and size of the
library files and the capabilities of the small-cell base stations, on the
overall performance of our optimal caching strategy. Our results show that the
careful placement of MDS-encoded content in caches at the wireless edge leads
to a significant decrease of the load of the network backhaul and hence to a
considerable performance enhancement of the network.
","[{""version"":""v1"",""created"":""Mon, 24 Aug 2015 10:48:30 GMT""},{""version"":""v2"",""created"":""Fri, 18 Sep 2015 14:11:38 GMT""}]","2015-09-21"
"1508.05754","Sara Kropf","Sara Kropf","Variance and Covariance of Several Simultaneous Outputs of a Markov
  Chain",,"Discrete Mathematics & Theoretical Computer Science, Vol. 18 no.
  3, Analysis of Algorithms (June 23, 2016) dmtcs:1517","10.46298/dmtcs.1341",,"math.CO math.PR","http://arxiv.org/licenses/nonexclusive-distrib/1.0/","  The partial sum of the states of a Markov chain or more generally a Markov
source is asymptotically normally distributed under suitable conditions. One of
these conditions is that the variance is unbounded. A simple combinatorial
characterization of Markov sources which satisfy this condition is given in
terms of cycles of the underlying graph of the Markov chain. Also Markov
sources with higher dimensional alphabets are considered.
  Furthermore, the case of an unbounded covariance between two coordinates of
the Markov source is combinatorically characterized. If the covariance is
bounded, then the two coordinates are asymptotically independent.
  The results are illustrated by several examples, like the number of specific
blocks in $0$-$1$-sequences and the Hamming weight of the width-$w$
non-adjacent form.
","[{""version"":""v1"",""created"":""Mon, 24 Aug 2015 10:53:22 GMT""},{""version"":""v2"",""created"":""Wed, 22 Jun 2016 06:34:03 GMT""}]","2021-10-04"
"1508.05755","Anouchah Latifi","A. Latifi","New example of integrable nonlinear coupled equations with exact
  asymptotic singular solution in the context of laser-plasma interaction","18 pages, no figure",,"10.1088/0951-7715/29/7/1926",,"nlin.SI","http://arxiv.org/licenses/nonexclusive-distrib/1.0/","  A new set of nonlinear coupled equations is derived in the context of small
amplitude limit of the general wave equations in a fluid type warm
electrons/cold ions plasma irradiated by a continuous laser beam. This limit is
proved to be integrable by means of the spectral transform theory with singular
dispersion relation. An exact asymptotic solution is obtained. This model
accounts for a nonlinear mode coupling of the electrostatic waves with the ion
sound wave, and is shown to be unstable and does not propagate any stable small
amplitude solution. This instability is understood as a continuous secular
transfer of energy from the electrostatic wave to the ion sound wave through
the ponderomotive force. The exact mechanism of this transfer is exposed. The
dynamics of this energy transfer results in a singular asymptotic behavior of
the ion sound wave which explains the low penetration of the incident laser
beam.
","[{""version"":""v1"",""created"":""Mon, 24 Aug 2015 11:04:25 GMT""}]","2016-06-22"
"1508.05756","Nikolaos Bekiaris-Liberis","Nikolaos Bekiaris-Liberis and Miroslav Krstic","Predictor-Feedback Stabilization of Multi-Input Nonlinear Systems","Submitted to IEEE Transactions on Automatic Control on May 19 2015",,,,"math.OC","http://arxiv.org/licenses/nonexclusive-distrib/1.0/","  We develop a predictor-feedback control design for multi-input nonlinear
systems with distinct input delays, of arbitrary length, in each individual
input channel. Due to the fact that different input signals reach the plant at
different time instants, the key design challenge, which we resolve, is the
construction of the predictors of the plant's state over distinct prediction
horizons such that the corresponding input delays are compensated. Global
asymptotic stability of the closed-loop system is established by utilizing
arguments based on Lyapunov functionals or estimates on solutions. We
specialize our methodology to linear systems for which the predictor-feedback
control laws are available explicitly and for which global exponential
stability is achievable. A detailed example is provided dealing with the
stabilization of the nonholonomic unicycle, subject to two different input
delays affecting the speed and turning rate, for the illustration of our
methodology.
","[{""version"":""v1"",""created"":""Mon, 24 Aug 2015 11:08:28 GMT""}]","2015-08-25"
"1508.05757","James Loach","A. Dhar, J.C. Loach, P.J. Barton, J.T. Larsen, A.W.P. Poon","Low-background temperature sensors fabricated on parylene substrates",,"JINST 10 P12002 (2105)","10.1088/1748-0221/10/12/P12002",,"physics.ins-det nucl-ex","http://arxiv.org/licenses/nonexclusive-distrib/1.0/","  Temperature sensors fabricated from ultra-low radioactivity materials have
been developed for low-background experiments searching for neutrinoless
double-beta decay and the interactions of WIMP dark matter. The sensors consist
of electrical traces photolithographically-patterned onto substrates of
vapor-deposited parylene. They are demonstrated to function as expected, to do
so reliably and robustly, and to be highly radio-pure. This work is a
proof-of-concept study of a technology that can be applied to broad class of
electronic circuits used in low-background experiments.
","[{""version"":""v1"",""created"":""Mon, 24 Aug 2015 11:09:10 GMT""},{""version"":""v2"",""created"":""Wed, 2 Dec 2015 02:36:21 GMT""}]","2015-12-03"
"1508.05758","Debasish Saha","Debasish Saha, Yogesh M Joshi, and Ranjini Bandyopadhyay","Characteristics of the secondary relaxation process in soft colloidal
  suspensions","Submitted to Europhysics Letters",,"10.1209/0295-5075/112/46004",,"cond-mat.soft","http://arxiv.org/licenses/nonexclusive-distrib/1.0/","  A universal secondary relaxation process, known as the Johari-Goldstein (JG)
$\beta$-relaxation process, appears in glass formers. It involves all parts of
the molecule and is particularly important in glassy systems because of its
very close relationship with the $\alpha$-relaxation process. However, the
absence of a J-G $\beta$-relaxation mode in colloidal glasses raises questions
regarding its universality. In the present work, we study the microscopic
relaxation processes in Laponite suspensions, a model soft glassy material, by
dynamic light scattering (DLS) experiments. $\alpha$ and $\beta$-relaxation
timescales are estimated from the autocorrelation functions obtained by DLS
measurements for Laponite suspensions with different concentrations, salt
concentrations and temperatures. Our experimental results suggest that the
$\beta$-relaxation process in Laponite suspensions involves all parts of the
constituent Laponite particle. The ergodicity breaking time is also seen to be
correlated with the characteristic time of the $\beta$-relaxation process for
all Laponite concentrations, salt concentrations and temperatures. The width of
the primary relaxation process is observed to be correlated with the secondary
relaxation time. The secondary relaxation time is also very sensitive to the
concentration of Laponite. We measure primitive relaxation timescales from the
$\alpha$-relaxation time and the stretching exponent ($\beta$) by applying the
coupling model for highly correlated systems. The order of magnitude of the
primitive relaxation time is very close to the secondary relaxation time. These
observations indicate the presence of a J-G $\beta$-relaxation mode for soft
colloidal suspensions of Laponite.
","[{""version"":""v1"",""created"":""Mon, 24 Aug 2015 11:13:03 GMT""}]","2016-01-20"
"1508.05759","Valentina Lozza Ph.D.","SNO+ Collaboration: S. Andringa (1), E. Arushanova (2), S. Asahi (3),
  M. Askins (4), D. J. Auty (5), A. R. Back (2,6), Z. Barnard (7), N. Barros
  (1,8), E. W. Beier (8), A. Bialek (5), S. D. Biller (9), E. Blucher (10), R.
  Bonventre (8), D. Braid (7), E. Caden (7), E. Callaghan (8), J. Caravaca
  (11,12), J. Carvalho (13), L. Cavalli (9), D. Chauhan (1,3,7), M. Chen (3),
  O. Chkvorets (7), K. Clark (3,6,9), B. Cleveland (7,14), I. T. Coulter (8,9),
  D. Cressy (7), X. Dai (3), C. Darrach (7), B. Davis-Purcell (15), R. Deen
  (8,9), M. M. Depatie (7), F. Descamps (11,12), F. Di Lodovico (2), N. Duhaime
  (7), F. Duncan (7,14), J. Dunger (9), E. Falk (6), N. Fatemighomi (3), R.
  Ford (7,14), P. Gorel (5), C. Grant (4), S. Grullon (8), E. Guillian (3), A.
  L. Hallin (5), D. Hallman (7), S. Hans (16), J. Hartnell (6), P. Harvey (3),
  M. Hedayatipour (5), W. J. Heintzelman (8), R. L. Helmer (15), B. Hreljac
  (7), J. Hu (5), T. Iida (3), C. M. Jackson (11,12), N. A. Jelley (9), C.
  Jillings (7,14), C. Jones (9), P. G. Jones (2,9), K. Kamdin (11,12), T.
  Kaptanoglu (8), J. Kaspar (17), P. Keener (8), P. Khaghani (7), L.
  Kippenbrock (17), J. R. Klein (8), R. Knapik (8,18), J. N. Kofron (17), L. L.
  Kormos (19), S. Korte (7), C. Kraus (7), C. B. Krauss (5), K. Labe (10), I.
  Lam (3), C. Lan (3), B. J. Land (11,12), S. Langrock (2), A. LaTorre (10), I.
  Lawson (7,14), G. M. Lefeuvre (6), E. J. Leming (6), J. Lidgard (9), X. Liu
  (3), Y. Liu (3), V. Lozza (20), S. Maguire (16), A. Maio (1,21), K. Majumdar
  (9), S. Manecki (3), J. Maneira (1,21), E. Marzec (8), A. Mastbaum (8), N.
  McCauley (22), A. B. McDonald (3), J. E. McMillan (23), P. Mekarski (5), C.
  Miller (3), Y. Mohan (8), E. Mony (3), M. J. Mottram (2,6), V. Novikov (3),
  H. M. O'Keeffe (3,19), E. O'Sullivan (3), G. D. Orebi Gann (8,11,12), M. J.
  Parnell (19), S. J. M. Peeters (6), T. Pershing (4), Z. Petriw (5), G. Prior
  (1), J. C. Prouty (11,12), S. Quirk (3), A. Reichold (9), A. Robertson (22),
  J. Rose (22), R. Rosero (16), P. M. Rost (7), J. Rumleskie (7), M. A.
  Schumaker (7), M. H. Schwendener (7), D. Scislowski (17), J. Secrest (24), M.
  Seddighin (3), L. Segui (9), S. Seibert (8), T. Shantz (7), T. M. Shokair
  (8), L. Sibley (5), J. R. Sinclair (6), K. Singh (5), P. Skensved (3), A.
  Soerensen (20), T. Sonley (3), R. Stainforth (22), M. Strait (10), M. I.
  Stringer (6), R. Svoboda (4), J. Tatar (17), L. Tian (3), N. Tolich (17), J.
  Tseng (9), H. W. C. Tseung (17), R. Van Berg (8), E. V\'azquez-J\'auregui
  (14,25), C. Virtue (7), B. von Krosigk (20), J. M. G. Walker (22), M. Walker
  (3), O. Wasalski (15), J. Waterfield (6), R. F. White (6), J. R. Wilson (2),
  T. J. Winchester (17), A. Wright (3), M. Yeh (16), T. Zhao (3) and K. Zuber
  (20) ((1) Laborat\'orio de Instrumenta\c{c}ao e F\'isica Experimental de
  Part\'iculas (LIP), Lisboa, Portugal, (2) Queen Mary, University of London,
  School of Physics and Astronomy, London, UK, (3) Queen's University,
  Department of Physics, Engineering Physics and Astronomy, Kingston, ON,
  Canada, (4) University of California, Davis, CA, USA, (5) University of
  Alberta, Department of Physics, Edmonton, AB, Canada, (6) University of
  Sussex, Physics and Astronomy, Falmer, Brighton, UK, (7) Laurentian
  University, Sudbury, ON, Canada, (8) University of Pennsylvania, Department
  of Physics and Astronomy, Philadelphia, PA, USA, (9) University of Oxford,
  The Denys Wilkinson Building, Oxford, UK, (10) The Enrico Fermi Institute and
  Department of Physics, The University of Chicago, Chicago, IL, USA, (11)
  University of California, Department of Physics, Berkeley, CA, USA, (12)
  Lawrence Berkeley National Laboratory, Nuclear Science Division, CA, USA,
  (13) Universidade de Coimbra, Laborat\'orio de Instrumenta\c{c}ao e F\'isica
  Experimental de Part\'iculas and Departamento de F\'isica, Coimbra, Portugal,
  (14) SNOLAB, Sudbury, ON, Canada, (15) TRIUMF, Vancouver, BC, Canada, (16)
  Brookhaven National Laboratory, Chemistry Department, Upton, NY, USA, (17)
  University of Washington, Center for Experimental Nuclear Physics and
  Astrophysics, and Department of Physics, Seattle, WA, USA, (18) Norwich
  University, Northfield, VT, USA, (19) Lancaster University, Physics
  Department, Lancaster, UK, (20) Technische Universit\""at Dresden, Institut
  f\""ur Kern- und Teilchenphysik, Dresden, Germany, (21) Universidade de
  Lisboa, Departamento de F\'isica, Faculdade de Ci\^encias, Lisboa, Portugal,
  (22) University of Liverpool, Department of Physics, Liverpool, UK, (23)
  University of Sheffield, Department of Physics and Astronomy, Sheffield, UK,
  (24) Armstrong Atlantic State University, Savannah, GA, USA, (25) Universidad
  Nacional Aut\'onoma de M\'exico (UNAM), Instituto de F\'isica, M\'exico D.F.,
  M\'exico)","Current Status and Future Prospects of the SNO+ Experiment","Published in ""Neutrino Masses and Oscillations"" of Advances in High
  Energy Physics (Hindawi)","Advances in High Energy Physics, vol. 2016, 6194250","10.1155/2016/6194250",,"physics.ins-det hep-ex","http://arxiv.org/licenses/nonexclusive-distrib/1.0/","  SNO+ is a large liquid scintillator-based experiment located 2km underground
at SNOLAB, Sudbury, Canada. It reuses the Sudbury Neutrino Observatory
detector, consisting of a 12m diameter acrylic vessel which will be filled with
about 780 tonnes of ultra-pure liquid scintillator. Designed as a multipurpose
neutrino experiment, the primary goal of SNO+ is a search for the neutrinoless
double-beta decay (0$\nu\beta\beta$) of 130Te. In Phase I, the detector will be
loaded with 0.3% natural tellurium, corresponding to nearly 800 kg of 130Te,
with an expected effective Majorana neutrino mass sensitivity in the region of
55-133 meV, just above the inverted mass hierarchy. Recently, the possibility
of deploying up to ten times more natural tellurium has been investigated,
which would enable SNO+ to achieve sensitivity deep into the parameter space
for the inverted neutrino mass hierarchy in the future. Additionally, SNO+ aims
to measure reactor antineutrino oscillations, low-energy solar neutrinos, and
geoneutrinos, to be sensitive to supernova neutrinos, and to search for exotic
physics. A first phase with the detector filled with water will begin soon,
with the scintillator phase expected to start after a few months of water data
taking. The 0$\nu\beta\beta$ Phase I is foreseen for 2017.
","[{""version"":""v1"",""created"":""Mon, 24 Aug 2015 11:13:36 GMT""},{""version"":""v2"",""created"":""Fri, 13 Nov 2015 10:46:04 GMT""},{""version"":""v3"",""created"":""Thu, 28 Jan 2016 13:55:11 GMT""}]","2016-08-08"
"1508.05760","Mikhail Ivanov","Mikhail G. Ivanov","On uniqueness of quantum measurement theory","8 pages",,,,"quant-ph","http://arxiv.org/licenses/nonexclusive-distrib/1.0/","  The paper discuss the structure of quantum mechanics and uniqueness of its
postulates.
  The Born rule for quantum probabilities is fixed by requirement of
nonexistence of quantum telepathy.
  Von Neumann projection postulate describes the transformation of quantum
state under the condition of no-interaction measurement. Projection postulate
could be considered as transition to conditional probability under the
condition of a certain result of quantum measurement.
","[{""version"":""v1"",""created"":""Mon, 24 Aug 2015 11:23:17 GMT""}]","2015-08-25"
"1508.05761","EL Kaoutit Laiachi","Laiachi El Kaoutit","On geometrically transitive Hopf algebroids","30 pages, the changes were made following the referee suggestions.
  Final version, to appear in JPAA",,,,"math.AC math.AG math.GR","http://arxiv.org/licenses/nonexclusive-distrib/1.0/","  This paper contributes to the characterization of a certain class of
commutative Hopf algebroids. It is shown that a commutative flat Hopf algebroid
with a non zero base ring and a nonempty character groupoid is geometrically
transitive if and only if any base change morphism is a weak equivalence (in
particular, if any extension of the base ring is Landweber exact), if and only
if any trivial bundle is a principal bi-bundle, and if and only if any two
objects are fpqc locally isomorphic. As a consequence, any two isotropy Hopf
algebras of a geometrically transitive Hopf algebroid (as above) are weakly
equivalent. Furthermore, the character groupoid is transitive and any two
isotropy Hopf algebras are conjugated. Several other characterizations of these
Hopf algebroids in relation to transitive groupoids are also given.
","[{""version"":""v1"",""created"":""Mon, 24 Aug 2015 11:25:39 GMT""},{""version"":""v2"",""created"":""Mon, 26 Oct 2015 12:07:03 GMT""},{""version"":""v3"",""created"":""Fri, 29 Dec 2017 20:17:57 GMT""}]","2018-01-03"
