"1508.05780","Junlong Tian","Junlong Tian, Haitao Cui, Teng Gao and Ning Wang","Effect of Wigner energy on the symmetry energy coefficient in nuclei","14 pages, 5 figures, Submitted to Chinese Physics C",,"10.1088/1674-1137/40/9/094101",,"nucl-th","http://creativecommons.org/licenses/by-nc-sa/4.0/","  The nuclear symmetry energy coefficient (including the coefficient $a_{\rm
sym}^{(4)}$ of $I^{4}$ term) of finite nuclei is extracted by using the
differences of available experimental binding energies of isobaric nuclei. It
is found that the extracted symmetry energy coefficient $a^{*}_{\rm sym}(A,I)$
decreases with increasing of isospin asymmetry $I$, which is mainly caused by
Wigner correction, since $e^{*}_{\rm sym}$ is the summation of the traditional
symmetry energy $e_{\rm sym}$ and the Wigner energy $e_{\rm W}$. We obtain the
optimal values $J=30.25\pm0.10$ MeV, $a_{\rm ss}=56.18\pm1.25$ MeV, $a_{\rm
sym}^{(4)}=8.33\pm1.21$ MeV and the Wigner parameter $x=2.38\pm0.12$ through
the polynomial fit to 2240 measured binding energies for nuclei with $20 \leq A
\leq 261$ with an rms deviation of 23.42 keV. We also find that the volume
symmetry coefficient $J\simeq 30$ MeV is insensitive to the value $x$, whereas
the surface symmetry coefficient $a_{\rm ss}$ and the coefficient $a_{\rm
sym}^{(4)}$ are very sensitive to the value of $x$ in the range $1\leq x\leq
4$. The contribution of $a_{\rm sym}^{(4)}$ term increases rapidly with
increasing of isospin asymmetry $I$. For very neutron-rich nuclei, the
contribution of $a_{\rm sym}^{(4)}$ term will play an important role.
","[{""version"":""v1"",""created"":""Mon, 24 Aug 2015 12:27:25 GMT""},{""version"":""v2"",""created"":""Mon, 31 Aug 2015 03:29:34 GMT""},{""version"":""v3"",""created"":""Thu, 4 Feb 2016 11:05:36 GMT""},{""version"":""v4"",""created"":""Tue, 22 Mar 2016 04:49:49 GMT""},{""version"":""v5"",""created"":""Tue, 29 Mar 2016 07:38:59 GMT""}]","2016-05-24"
"1508.05781","Yanwei Ma","Chao Yao, He Lin, Qianjun Zhang, Xianping Zhang, Dongliang Wang,
  Chiheng Dong, Yanwei Ma, Satoshi Awaji and Kazuo Watanabe","Critical current density and microstructure of iron sheathed
  multifilamentary Sr1-xKxFe2As2/Ag composite conductors","27 pages, 8 figures","J. Appl. Phys. 118, 203909 (2015)","10.1063/1.4936370",,"cond-mat.supr-con","http://arxiv.org/licenses/nonexclusive-distrib/1.0/","  Iron-based superconductors have been considered to be very promising in
high-field applications, for which multifilamentary wire and tape conductors
with high mechanical strength are essential. In this work, 7-,19- and
114-filament Sr0.6K0.4Fe2As2 (Sr-122) superconducting wires and tapes with
silver as matrix and iron as outer reinforcing sheath were produced by the ex
situ powder-in-tube method. The mass densities of Sr-122 phase in 7- and
19-filament conductors were investigated by microhardness characterization,
which revealed a positive correlation between hardness and transport critical
current density (Jc) in round wires and flat tapes with various thicknesses.
For Sr-122/Ag/Fe 114-filament conductors, in which an average cross-sectional
filament size smaller than 50 microns was achieved by drawing into round wires
of 2.0 mm in diameter, the transport Jc can be significantly enhanced by flat
rolling, as for the 7- and 19-filament conductors. The highest transport Jc of
the 7-,19- and 114-filament Sr-122/Ag/Fe tapes reached 1.4x10^4, 8.4x10^3 and
6.3x10^3 A cm-2 (4.2 K, 10 T), respectively, showing a Jc degradation with the
increase of filament number. This Jc degradation can be ascribed to the sausage
effect for filaments in longitudinal direction and the grain refinement in
these very fine filaments.
","[{""version"":""v1"",""created"":""Mon, 24 Aug 2015 12:30:42 GMT""}]","2018-01-24"
"1508.05782","Jaan Aru","Madis Vasser, Markus K\""angsepp, Jaan Aru","Change Blindness in 3D Virtual Reality",,,,,"q-bio.NC cs.HC","http://arxiv.org/licenses/nonexclusive-distrib/1.0/","  In the present change blindness study subjects explored stereoscopic three
dimensional (3D) environments through a virtual reality (VR) headset. A novel
method that tracked the subjects' head movements was used for inducing changes
in the scene whenever the changing object was out of the field of view. The
effect of change location (foreground or background in 3D depth) on change
blindness was investigated. Two experiments were conducted, one in the lab (n =
50) and the other online (n = 25). Up to 25% of the changes were undetected and
the mean overall search time was 27 seconds in the lab study. Results indicated
significantly lower change detection success and more change cycles if the
changes occurred in the background, with no differences in overall search
times. The results confirm findings from previous studies and extend them to 3D
environments. The study also demonstrates the feasibility of online VR
experiments.
","[{""version"":""v1"",""created"":""Mon, 24 Aug 2015 12:33:10 GMT""}]","2015-08-25"
"1508.05783","Risto H\""anninen","R. H\""anninen","Kelvin waves from vortex reconnection in superfluid helium at low
  temperatures","9 pages, 8 figures; v3: minor changes (typos etc.), v2: moderate
  changes","Phys. Rev. B 92, 184508 (2015)","10.1103/PhysRevB.92.184508",,"cond-mat.other physics.flu-dyn","http://arxiv.org/licenses/nonexclusive-distrib/1.0/","  We report on the analysis of the root mean square curvature as a function of
the numerical resolution for a single reconnection of two quantized vortex
rings in superfluid helium. We find a similar scaling relation as reported in
the case of decaying thermal counterflow simulations by L. Kondaurova et al.
There the scaling was related to the existence of a Kelvin-wave cascade which
was suggested to support the L'vov-Nazarenko spectrum. Here we provide an
alternative explanation that does not involve the Kelvin-wave cascade but is
due to the sharp cusp generated by a reconnection event in a situation where
the maximum curvature is limited by the computational resolution. We also
suggest a method for identifying the Kelvin spectrum based on the decay of the
rms curvature by mutual friction. Our vortex filament simulation calculations
show that the spectrum of Kelvin waves after the reconnection is not simply
$n(k) \propto k^{-\eta}$ with constant $\eta$. At large scales the spectrum
seems to be close to the Vinen prediction with $\eta$ = 3 but becomes steeper
at smaller scales.
","[{""version"":""v1"",""created"":""Mon, 24 Aug 2015 12:35:22 GMT""},{""version"":""v2"",""created"":""Mon, 26 Oct 2015 16:25:47 GMT""},{""version"":""v3"",""created"":""Tue, 10 Nov 2015 13:28:37 GMT""}]","2015-11-13"
"1508.05784","Patrizio Angelini","Patrizio Angelini and Till Bruckdorfer and Michael Kaufmann and Tamara
  Mchedlidze","A Universal Point Set for 2-Outerplanar Graphs","23 pages, 11 figures, conference version at GD 2015",,,,"cs.CG","http://arxiv.org/licenses/nonexclusive-distrib/1.0/","  A point set $S \subseteq \mathbb{R}^2$ is universal for a class $\cal G$ if
every graph of ${\cal G}$ has a planar straight-line embedding on $S$. It is
well-known that the integer grid is a quadratic-size universal point set for
planar graphs, while the existence of a sub-quadratic universal point set for
them is one of the most fascinating open problems in Graph Drawing. Motivated
by the fact that outerplanarity is a key property for the existence of small
universal point sets, we study 2-outerplanar graphs and provide for them a
universal point set of size $O(n \log n)$.
","[{""version"":""v1"",""created"":""Mon, 24 Aug 2015 12:36:48 GMT""}]","2015-08-25"
"1508.05785","Francois Dayrens","Fran\c{c}ois Dayrens (ICJ), Simon Masnou (ICJ), Matteo Novaga","Existence, regularity and structure of confined elasticae",,,,,"math.OC math.DG","http://arxiv.org/licenses/nonexclusive-distrib/1.0/","  We consider the problem of minimizing the bending or elastic energy among
Jordan curves confined in a given open set $\Omega$. We prove existence,
regularity and some structural properties of minimizers. In particular, when
$\Omega$ is convex we show that a minimizer is necessarily a convex curve. We
also provide an example of a minimizer with self-intersections.
","[{""version"":""v1"",""created"":""Mon, 24 Aug 2015 12:47:44 GMT""}]","2015-08-25"
"1508.05786","Rafal Kapelko","Rafal Kapelko and Evangelos Kranakis","On the Displacement for Covering a $d-$dimensional Cube with Randomly
  Placed Sensors",,,,,"cs.DS","http://arxiv.org/licenses/nonexclusive-distrib/1.0/","  Consider $n$ sensors placed randomly and independently with the uniform
distribution in a $d-$dimensional unit cube ($d\ge 2$). The sensors have
identical sensing range equal to $r$, for some $r >0$. We are interested in
moving the sensors from their initial positions to new positions so as to
ensure that the $d-$dimensional unit cube is completely covered, i.e., every
point in the $d-$dimensional cube is within the range of a sensor. If the
$i$-th sensor is displaced a distance $d_i$, what is a displacement of minimum
cost? As cost measure for the displacement of the team of sensors we consider
the $a$-total movement defined as the sum $M_a:= \sum_{i=1}^n d_i^a$, for some
constant $a>0$. We assume that $r$ and $n$ are chosen so as to allow full
coverage of the $d-$dimensional unit cube and $a > 0$.
  The main contribution of the paper is to show the existence of a tradeoff
between the $d-$dimensional cube, sensing radius and $a$-total movement. The
main results can be summarized as follows for the case of the $d-$dimensional
cube.
  If the $d-$dimensional cube sensing radius is $\frac{1}{2n^{1/d}}$ and
$n=m^d$, for some $m\in N$, then we present an algorithm that uses
$O\left(n^{1-\frac{a}{2d}}\right)$ total expected movement (see Algorithm 2 and
Theorem 5).
  If the $d-$dimensional cube sensing radius is greater than
$\frac{3^{3/d}}{(3^{1/d}-1)(3^{1/d}-1)}\frac{1}{2n^{1/d}}$ and $n$ is a natural
number then the total expected movement is
$O\left(n^{1-\frac{a}{2d}}\left(\frac{\ln n}{n}\right)^{\frac{a}{2d}}\right)$
(see Algorithm 3 and Theorem 7).
  In addition, we simulate Algorithm 2 and discuss the results of our
simulations.
","[{""version"":""v1"",""created"":""Mon, 24 Aug 2015 12:49:51 GMT""}]","2015-08-25"
"1508.05787","Julien Salomon","G. Dridi (CMAP, ICB), M. Lapert (ICB), Julien Salomon (CEREMADE), D
  Sugny (ICB, TUM), S. J. Glaser (TUM)","A discrete-pulse optimal control algorithm with an application to spin
  systems",,"Phys. Rev. A 92, 043417 (2015)","10.1103/PhysRevA.92.043417",,"math.OC","http://arxiv.org/licenses/nonexclusive-distrib/1.0/","  This article is aimed at extending the framework of optimal control
techniques to the situation where the control field values are restricted to a
finite set. We propose a generalization of the standard GRAPE algorithm suited
to this constraint. We test the validity and the efficiency of this approach
for the inversion of an inhomogeneous ensemble of spin systems with different
offset frequencies. It is shown that a remarkable efficiency can be achieved
even for a very limited number of discrete values. Some applications in Nuclear
Magnetic Resonance are discussed.
","[{""version"":""v1"",""created"":""Mon, 24 Aug 2015 12:51:22 GMT""}]","2015-10-28"
"1508.05788","Nicolas Ressayre","Joseph M. Landsberg (TAMU), Nicolas Ressayre (ICJ)","Permanent v. determinant: an exponential lower bound assumingsymmetry
  and a potential path towards Valiant's conjecture",,,,,"math.AG cs.CC","http://arxiv.org/licenses/nonexclusive-distrib/1.0/","  We initiate a study of determinantal representations with symmetry. We show
that Grenet's determinantal representation for the permanent is optimal among
determinantal representations respecting left multiplication by permutation and
diagonal matrices (roughly half the symmetry group of the permanent). In
particular, if any optimal determinantal representation of the permanent must
be polynomially related to one with such symmetry, then Valiant's conjecture on
permanent v. determinant is true.
","[{""version"":""v1"",""created"":""Mon, 24 Aug 2015 12:52:23 GMT""},{""version"":""v2"",""created"":""Tue, 25 Aug 2015 15:10:06 GMT""}]","2015-08-26"
"1508.05789","Mitra Fatemi","Mitra Fatemi, Arash Amini, Loic Baboulaz, and Martin Vetterli","Shapes From Pixels","13 pages, 14 figures",,"10.1109/TIP.2016.2514507",,"cs.IT math.IT","http://arxiv.org/licenses/nonexclusive-distrib/1.0/","  Continuous-domain visual signals are usually captured as discrete (digital)
images. This operation is not invertible in general, in the sense that the
continuous-domain signal cannot be exactly reconstructed based on the discrete
image, unless it satisfies certain constraints (\emph{e.g.}, bandlimitedness).
In this paper, we study the problem of recovering shape images with smooth
boundaries from a set of samples. Thus, the reconstructed image is constrained
to regenerate the same samples (consistency), as well as forming a shape
(bilevel) image. We initially formulate the reconstruction technique by
minimizing the shape perimeter over the set of consistent binary shapes. Next,
we relax the non-convex shape constraint to transform the problem into
minimizing the total variation over consistent non-negative-valued images. We
also introduce a requirement (called reducibility) that guarantees equivalence
between the two problems. We illustrate that the reducibility property
effectively sets a requirement on the minimum sampling density. One can draw
analogy between the reducibility property and the so-called restricted isometry
property (RIP) in compressed sensing which establishes the equivalence of the
$\ell_0$ minimization with the relaxed $\ell_1$ minimization. We also evaluate
the performance of the relaxed alternative in various numerical experiments.
","[{""version"":""v1"",""created"":""Mon, 24 Aug 2015 12:54:13 GMT""}]","2016-01-20"
"1508.05790","Carole Addis","Carole Addis, G\""oktu\u{g} Karpat and Sabrina Maniscalco","Time-Invariant Discord in Dynamically Decoupled Systems","7 pages, 3 figures","Phys. Rev. A 92, 062109 (2015)","10.1103/PhysRevA.92.062109",,"quant-ph","http://arxiv.org/licenses/nonexclusive-distrib/1.0/","  Dynamical decoupling protocols are one of the most used tools for efficient
quantum error corrections and for reservoir engineering. In this paper we study
the effect of dynamical decoupling pulses on the preservation of both quantum
and classical correlations, and their influence on the intriguing phenomenon of
time-invariant discord. We study two qubits experiencing local dephasing with
an Ohmic class spectrum and subject to dynamical decoupling protocols. We
investigate the connection between the dynamics of both classical and quantum
correlations and the behaviour of information flow between system and
environment. Finally, we establish a set of necessary conditions for which
time-invariant discord can be created using dynamically decoupling techniques.
","[{""version"":""v1"",""created"":""Mon, 24 Aug 2015 12:54:54 GMT""},{""version"":""v2"",""created"":""Wed, 16 Dec 2015 13:05:57 GMT""}]","2015-12-23"
"1508.05791","Ian Howarth","Ian D. Howarth, P.L. Dufton, P.R. Dunstall, C.J. Evans, L.A. Almeida,
  A.Z. Bonanos, J.S. Clark, N. Langer, H. Sana, S. Simon-Diaz, I. Soszynski,
  and W.D. Taylor","The VLT-FLAMES Tarantula Survey. XXIII: two massive double-lined
  binaries in 30~Doradus",,"A&A 582, A73 (2015)","10.1051/0004-6361/201526408",,"astro-ph.SR","http://arxiv.org/licenses/nonexclusive-distrib/1.0/","  We investigate the characteristics of two newly discovered short-period,
double-lined, massive binary systems, VFTS 450 (O9.7$\;$II--Ib$\,$+$\,$O7::)
and VFTS 652 (B1$\;$Ib$\,+\,$O9:$\;$III:). We perform model-atmosphere analyses
to characterise the photospheric properties of both members of each binary
(denoting the `primary' as the spectroscopically more conspicuous component).
Radial velocities and optical photometry are used to estimate the binary-system
parameters. We estimate $T_{\rm eff}=27$ kK, $\log{(g)}=2.9$ (cgs) for the VFTS
450 primary spectrum (34kK, 3.6: for the secondary spectrum); and $T_{\rm eff}
= 22$kK, $\log{(g)}=2.8$ for the VFTS 652 primary spectrum (35kK, 3.7: for the
secondary spectrum). Both primaries show surface nitrogen enrichments (of more
than 1 dex for VFTS 652), and probable moderate oxygen depletions relative to
reference LMC abundances. We determine orbital periods of 6.89d and 8.59d for
VFTS 450 and VFTS 652, respectively, and argue that the primaries must be close
to filling their Roche lobes. Supposing this to be the case, we estimate
component masses in the range $\sim$20--50M$_\odot$. The secondary spectra are
associated with the more massive components, suggesting that both systems are
high-mass analogues of classical Algol systems, undergoing case-A mass
transfer. Difficulties in reconciling the spectroscopic analyses with the
light-curves and with evolutionary considerations suggest that the secondary
spectra are contaminated by (or arise in) accretion disks.
","[{""version"":""v1"",""created"":""Mon, 24 Aug 2015 12:58:37 GMT""}]","2015-10-14"
"1508.05792","Clementina Sasso","C. Sasso, V. Andretta and D. Spadaro","Modelling solar low-lying cool loops with optically thick radiative
  losses","Accepted for publication in A&A on Aug 21st 2015. arXiv admin note:
  text overlap with arXiv:1112.0309","A&A 583, A54 (2015)","10.1051/0004-6361/201526598",,"astro-ph.SR","http://arxiv.org/licenses/nonexclusive-distrib/1.0/","  We investigate the increase of the DEM (differential emission measure)
towards the chromosphere due to small and cool magnetic loops (height
$\lesssim8$~Mm, $T\lesssim10^5$~K). In a previous paper we analysed the
conditions of existence and stability of these loops through hydrodynamic
simulations, focusing on their dependence on the details of the optically thin
radiative loss function used. In this paper, we extend those hydrodynamic
simulations to verify if this class of loops exists and it is stable when using
an optically thick radiative loss function. We study two cases: constant
background heating and a heating depending on the density. The contribution to
the transition region EUV output of these loops is also calculated and
presented. We find that stable, quasi-static cool loops can be obtained by
using an optically thick radiative loss function and a background heating
depending on the density. The DEMs of these loops, however, fail to reproduce
the observed DEM for temperatures between $4.6<\log T<4.8$. We also show the
transient phase of a dynamic loop obtained by considering constant heating rate
and find that its average DEM, interpreted as a set of evolving dynamic loops,
reproduces quite well the observed DEM.
","[{""version"":""v1"",""created"":""Mon, 24 Aug 2015 13:01:02 GMT""}]","2015-10-28"
"1508.05793","Tomasz Chwiej","T. Chwiej","Effect of tilted magnetic field on magnetosubbands and conductance of
  bi-layer quantum wire",,,"10.1016/j.physb.2016.06.017",,"cond-mat.mes-hall","http://arxiv.org/licenses/nonexclusive-distrib/1.0/","  The single electron magnetotransport in a vertical bi-layer semiconductor
nanowire made of InAlAs/InGaAs and AlGaAs/GaAs heterostructure is theoretically
studied. The magnetic field is directed perpendicularily to the main
(transport) axis of the quantum wire and both non-zero components of magnetic
field, that is the transverse and the vertical ones, allow to change the
magnitude of intra-layer and inter-layer subbands mixing, respectively. We
analyze in detail the changes introduced to energy dispersion relation E(k) by
strong titled magnetic field up to several teslas for a symmetric and an
asymmetric confining potential in the growth direction. These calculated energy
dispersion relations are thereafter used to show that the value of conductance
of bi-layer nanowire may jump as well as drop by few conductance quanta when
the Fermi energy is changed what in conjunction with spin Zeeman effect may
give a moderately spin polarized current.
","[{""version"":""v1"",""created"":""Mon, 24 Aug 2015 13:08:15 GMT""},{""version"":""v2"",""created"":""Fri, 15 Jan 2016 11:42:11 GMT""}]","2016-08-24"
"1508.05794","Thomas Kalmes","Thomas Kalmes, Christoph Schumacher","Graph Laplacians do not generate strongly continuous semigroups","3 pages",,,,"math.FA","http://arxiv.org/licenses/nonexclusive-distrib/1.0/","  We show that for graph Laplacians $\Delta_G$ on a connected locally finite
simplicial undirected graph $G$ with countable infinite vertex set $V$ none of
the operators $\alpha\,\mathrm{Id}+\beta\Delta_G,
\alpha,\beta\in\mathbb{K},\beta \ne 0$, generate a strongly continuous
semigroup on $\mathbb{K}^V$ when the latter is equipped with the product
topology.
","[{""version"":""v1"",""created"":""Mon, 24 Aug 2015 13:15:29 GMT""}]","2015-08-25"
"1508.05795","Jacek Jezierski","Jacek Jezierski, Piotr Waluk","Proof of Positive Energy Theorem by spacetime foliations","8 pages","Banach Center Publications, Vol. 110 (2016) 115-120","10.4064/bc110-0-8",,"gr-qc","http://arxiv.org/licenses/nonexclusive-distrib/1.0/","  Here we present an alternative approach, requiring only basic tools of
differential geometry. This method was conceived by Kijowski and first
presented during the IV Marcel Grossman Meeting on General Relativity in Rome
(1986). It was later published in a generalized form by J. Jezierski, J.
Kijowski in 1987 (Positivity of total energy in general relativity, Physical
Review D {\bf 36} (1987), 1041-4). We summarize these results briefly and
present a new foliation gauge.
","[{""version"":""v1"",""created"":""Mon, 24 Aug 2015 13:17:22 GMT""}]","2017-01-05"
"1508.05796","Atlas Publications","ATLAS Collaboration","Search for flavour-changing neutral current top-quark decays to $qZ$ in
  $pp$ collision data collected with the ATLAS detector at $\sqrt{s}=8$ TeV","19 pages plus author list (35 pages total), 4 figures, 9 tables,
  published version, all figures including auxiliary figures are available at
  https://atlas.web.cern.ch/Atlas/GROUPS/PHYSICS/PAPERS/TOPQ-2014-08/","Eur. Phys. J. C76 (2016) 12","10.1140/epjc/s10052-015-3851-5","CERN-PH-EP-2015-183","hep-ex","http://arxiv.org/licenses/nonexclusive-distrib/1.0/","  A search for the flavour-changing neutral-current decay $t\to qZ$ is
presented. Data collected by the ATLAS detector during 2012 from proton-proton
collisions at the Large Hadron Collider at a centre-of-mass energy of
$\sqrt{s}=8$ TeV, corresponding to an integrated luminosity of 20.3 fb$^{-1}$,
are analysed. Top-quark pair-production events with one top quark decaying
through the $t\to qZ$ ($q=u,c$) channel and the other through the dominant
Standard Model mode $t\to bW$ are considered as signal. Only the decays of the
$Z$ boson to charged leptons and leptonic $W$ boson decays are used. No
evidence for a signal is found and an observed (expected) upper limit on the
$t\to qZ$ branching ratio of $7\times 10^{-4}$ ($8\times 10^{-4}$) is set at
the 95% confidence level.
","[{""version"":""v1"",""created"":""Mon, 24 Aug 2015 13:18:06 GMT""},{""version"":""v2"",""created"":""Mon, 18 Jan 2016 14:26:31 GMT""}]","2016-01-19"
"1508.05797","Tomotaka Kuwahara","Tomotaka Kuwahara, Takashi Mori, Keiji Saito","Floquet-Magnus Theory and Generic Transient Dynamics in Periodically
  Driven Many-Body Quantum Systems","19pages, 6 figures","Annals of Physics (2016), pp. 96-124","10.1016/j.aop.2016.01.012",,"quant-ph cond-mat.stat-mech math-ph math.MP","http://arxiv.org/licenses/nonexclusive-distrib/1.0/","  This work explores a fundamental dynamical structure for a wide range of
many-body quantum systems under periodic driving. Generically, in the
thermodynamic limit, such systems are known to heat up to infinite temperature
states after infinite-time evolution, irrespective of dynamical details. In the
present study, instead of considering infinitely long-time scale, we aim to
provide a framework to understand the long but finite time behavior, namely the
transient dynamics. In the analysis, we focus on the Floquet-Magnus (FM)
expansion that gives a formal expression of the effective Hamiltonian on the
system. Although in general the full series expansion is not convergent in the
thermodynamics limit, we give a clear relationship between the FM expansion and
the transient dynamics. More precisely, we rigorously show that a truncated
version of the FM expansion accurately describes the exact dynamics for a
finite-time scale. Our result reveals a reliable time scale of the validity of
the FM expansion, which can be comparable to the experimental time scale.
Furthermore, we discuss several dynamical phenomena, such as the effect of
small integrability breaking, efficient numerical simulation of periodically
driven systems, dynamical localization and thermalization. Especially on
thermalization, we discuss generic scenario of the prethermalization phenomenon
in periodically driven systems.
","[{""version"":""v1"",""created"":""Mon, 24 Aug 2015 13:27:24 GMT""},{""version"":""v2"",""created"":""Tue, 13 Oct 2015 13:47:21 GMT""},{""version"":""v3"",""created"":""Fri, 12 Feb 2016 04:38:49 GMT""}]","2016-02-15"
