"1508.05684","Alexander Gallego Mr","Alexander Gallego Cadavid","Primordial non-Gaussianities produced by features in the potential of
  single slow-roll inflationary models","79 pages, 59 figures, Master thesis",,,,"astro-ph.CO","http://arxiv.org/licenses/nonexclusive-distrib/1.0/","  We study the effects of a general type of features of the inflaton potential
on the spectrum and bispectrum of primordial curvature perturbations. These
features correspond to a discontinuity in the $n$-th order derivative of the
potential which are dumped exponentially away from the value of the field where
the feature happens. Interestingly we find that different values of the
amplitude and of the order of the feature can lead to the same effects on the
power spectrum on both large and short scales, and on the bispectrum at small
scales. Only taking into account the bispectrum at large scales it is possible
to resolve this degeneracy. We provide fully numerical calculations and
analytical approximations for the spectrum and the bispectrum, which are in
good agreement with each other. The analytical approximation allows to to
determine the class of features which give the same spectrum and can only be
distinguished with the bispectrum.
","[{""version"":""v1"",""created"":""Mon, 24 Aug 2015 02:08:36 GMT""}]","2015-08-25"
"1508.05685","Yukinobu Toda","Yukinobu Toda","Non-commutative thickening of moduli spaces of stable sheaves","42 pages","Compositio Math. 153 (2017) 1153-1195","10.1112/S0010437X17007047",,"math.AG","http://arxiv.org/licenses/nonexclusive-distrib/1.0/","  We show that the moduli spaces of stable sheaves on projective schemes admit
certain non-commutative structures, which we call quasi NC structures,
generalizing Kapranov's NC structures. The completion of our quasi NC structure
at a closed point of the moduli space gives a pro-representable hull of the
non-commutative deformation functor of the corresponding sheaf developed by
Laudal, Eriksen, Segal and Efimov-Lunts-Orlov. We also show that the framed
stable moduli spaces of sheaves have canonical NC structures.
","[{""version"":""v1"",""created"":""Mon, 24 Aug 2015 02:39:10 GMT""}]","2019-02-20"
"1508.05686","Maria Loukitcheva","Maria Loukitcheva, Sami K. Solanki, Stephen M. White, and Mats
  Carlsson","Probing the Sun with ALMA: observations and simulations","2 pages, 1 figure, to appear in the Proceedings of the International
  conference ""Revolution in Astronomy with ALMA - The 3rd Year"", December 8 -
  11, 2014 Tokyo, Japan","ASP Conference Series, 2015, Vol. 499, pp.350-351",,,"astro-ph.SR","http://arxiv.org/licenses/nonexclusive-distrib/1.0/","  ALMA will open a new chapter in the study of the Sun by providing a leap in
spatial resolution and sensitivity compared to currently available mm wave-
length observations. In preparation of ALMA, we have carried out a large number
of observational tests and state-of-the-art radiation MHD simulations. Here we
review the best available observations of the Sun at millimeter
wavelengths.Using state of the art radiation MHD simulations of the solar
atmosphere we demonstrate the huge potential of ALMA observations for
uncovering the nature of the solar chromosphere. We show that ALMA will not
only provide a reliable probe of the thermal structure and dynamics of the
chromosphere, it will also open up a powerful new diagnostic of magnetic field
at chromospheric heights, a fundamentally important, but so far poorly known
parameter.
","[{""version"":""v1"",""created"":""Mon, 24 Aug 2015 02:43:51 GMT""}]","2015-12-15"
"1508.05687","Antonio Enea Romano","Alexander Gallego Cadavid, Antonio Enea Romano","Effects of local features of the inflaton potential on the spectrum and
  bispectrum of primordial perturbations","23 pages, 18 figures, new section added with examples of how the
  effects of branch features differ those of local features",,"10.1140/epjc/s10052-016-4232-4",,"astro-ph.CO","http://arxiv.org/licenses/nonexclusive-distrib/1.0/","  We study the effects of a class of features of the potential of slow-roll
inflationary models corresponding to a step symmetrically dumped by an even
power negative exponential factor, which we call local features. Local-type
features differ from other branch-type features considered previously, because
the potential is only affected in a limited range of the scalar field value,
and are symmetric respect to the location of the feature. This type of features
only affects the spectrum and bispectrum in a narrow range of scales which
leave the horizon during the time interval corresponding to the modification of
the potential. On the contrary branch-type features have effects on all the
perturbation modes leaving the horizon when the field value is within the
interval defining the branch, introducing for example differences in the power
spectrum between large and small scale which are absent in the case of
local-type features. The spectrum and bispectrum of primordial curvature
perturbations are affected by oscillations around the scale $k_0$ exiting the
horizon at the time $\tau_0$ corresponding to the feature. We also compute the
effects of the features on the CMB temperature and polarization spectra,
showing the effects or different choices of parameters.
","[{""version"":""v1"",""created"":""Mon, 24 Aug 2015 02:51:12 GMT""},{""version"":""v2"",""created"":""Tue, 20 Oct 2015 11:12:10 GMT""},{""version"":""v3"",""created"":""Tue, 26 Apr 2016 06:18:44 GMT""},{""version"":""v4"",""created"":""Tue, 7 Jun 2016 03:19:33 GMT""}]","2016-07-29"
"1508.05688","Graham Smith","Graham Smith","Eternal Forced Mean Curvature Flows II - Existence",,"Pacific J. Math. 299 (2019) 191-235","10.2140/pjm.2019.299.191",,"math.DG","http://arxiv.org/licenses/nonexclusive-distrib/1.0/","  We show that under suitable non-degeneracy conditions, complete gradient flow
lines of the scalar curvature functional of a riemannian manifold perturb into
eternal forced mean curvature flows with large forcing term.
","[{""version"":""v1"",""created"":""Mon, 24 Aug 2015 03:17:32 GMT""}]","2019-05-08"
"1508.05689","Peng Ye","Peng Ye and Zheng-Cheng Gu","Topological quantum field theory of three-dimensional bosonic
  Abelian-symmetry-protected topological phases","11 pages. Published version","Phys. Rev. B 93, 205157 (2016)","10.1103/PhysRevB.93.205157",,"cond-mat.str-el cond-mat.stat-mech hep-th math-ph math.MP","http://arxiv.org/licenses/nonexclusive-distrib/1.0/","  Symmetry-protected topological phases (SPT) are short-range entangled gapped
states protected by global symmetry. Nontrivial SPT phases cannot be
adiabatically connected to the trivial disordered state(or atomic insulator) as
long as certain global symmetry $G$ is unbroken. At low energies, most of
two-dimensional SPTs with Abelian symmetry can be described by topological
quantum field theory (TQFT) of multi-component Chern-Simons type. However, in
contrast to the fractional quantum Hall effect where TQFT can give rise to
interesting bulk anyons, TQFT for SPTs only supports trivial bulk excitations.
The essential question in TQFT descriptions for SPTs is to understand how the
global symmetry is implemented in the partition function. In this paper, we
systematically study TQFT of three-dimensional SPTs with unitary Abelian
symmetry (e.g., $\mathbb{Z}_{N_1}\times\mathbb{Z}_{N_2}\times\cdots$). In
addition to the usual multi-component $BF$ topological term at level-$1$, we
find that there are new topological terms with quantized coefficients (e.g.,
$a^1\wedge a^2\wedge d a^2$ and $a^1\wedge a^2\wedge a^3\wedge a^4$) in TQFT
actions, where $a^{1},a^2,\cdots$ are 1-form U(1) gauge fields. These
additional topological terms cannot be adiabatically turned off as long as $G$
is unbroken. By investigating symmetry transformations for the TQFT partition
function, we end up with the classification of SPTs that is consistent with the
well-known group cohomology approach. We also discuss how to gauge the global
symmetry and possible TQFT descriptions of Dijkgraaf-Witten gauge theory.
","[{""version"":""v1"",""created"":""Mon, 24 Aug 2015 03:21:45 GMT""},{""version"":""v2"",""created"":""Sat, 19 Sep 2015 19:09:36 GMT""},{""version"":""v3"",""created"":""Thu, 31 Dec 2015 19:07:35 GMT""},{""version"":""v4"",""created"":""Wed, 1 Jun 2016 03:28:24 GMT""}]","2016-06-02"
"1508.05690","Shuchao Li","Shuchao Li and Lifang Zhao","On the extremal total reciprocal edge-eccentricity of trees","16pages, 8figures, Journal of Mathematics Analysis and Applications
  (2015)",,"10.1016/j.jmaa.2015.07.057",,"math.CO","http://creativecommons.org/licenses/by-nc-sa/4.0/","  The total reciprocal edge-eccentricity is a novel graph invariant with vast
potential in structure activity/property relationships. This graph invariant
displays high discriminating power with respect to both biological activity and
physical properties. If $G=(V_G,E_G)$ is a simple connected graph, then the
total reciprocal edge-eccentricity (REE) of $G$ is defined as
$\xi^{ee}(G)=\sum_{uv\in E_G}(1/\varepsilon_G(u)+1/\varepsilon_G(v))$, where
$\varepsilon_G(v)$ is the eccentricity of the vertex $v$. In this paper we
first introduced four edge-grafting transformations to study the mathematical
properties of the reciprocal edge-eccentricity of $G$. Using these elegant
mathematical properties, we characterize the extremal graphs among $n$-vertex
trees with given graphic parameters, such as pendants, matching number,
domination number, diameter, vertex bipartition, et al. Some sharp bounds on
the reciprocal edge-eccentricity of trees are determined.
","[{""version"":""v1"",""created"":""Mon, 24 Aug 2015 03:32:37 GMT""}]","2015-08-25"
"1508.05691","Daniel Manzano","Daniel Manzano and Elica Kyoseva","An atomic symmetry-controlled thermal switch","8 pages, 3 figures","Scientific Reports 6, 31161 (2016)","10.1038/srep31161",,"quant-ph cond-mat.stat-mech","http://arxiv.org/licenses/nonexclusive-distrib/1.0/","  We propose a simple diatomic system trapped inside an optical cavity to
control the energy flow between two thermal baths. Through the action of the
baths the system is driven to a non- equilibrium steady state. Using the Large
Deviation theory we show that the number of photons flowing between the two
baths is dramatically different depending on the symmetry of the atomic states.
Here we present a deterministic scheme to prepare symmetric and antisymmetric
atomic states with the use of external driving fields, thus implementing an
atomic control switch for the energy flow.
","[{""version"":""v1"",""created"":""Mon, 24 Aug 2015 03:40:50 GMT""},{""version"":""v2"",""created"":""Tue, 10 May 2016 11:42:56 GMT""},{""version"":""v3"",""created"":""Thu, 8 Sep 2016 08:13:11 GMT""}]","2016-09-09"
"1508.05692","Pavel Timonin","P.N. Timonin","Thermodynamics of dilute XX chain in a field","15 pages, 7 figures","JETP, 122 (2016) 1052","10.1134/S1063776116060224",,"cond-mat.stat-mech cond-mat.dis-nn","http://arxiv.org/licenses/nonexclusive-distrib/1.0/","  The isotropic spin one-half XY chain in transverse field (XX chain) has
specific ground state phase with permanent criticality (quasi-long-range
ordered, QLRO, phase) which exists in a field less than nearest-neighbor
exchange. It is characterized by gapless excitations and power law decay of
transverse correlators. The dilution of XX chain has drastic effect on this
phase: the infinite series of quantum phase transitions marked by magnetization
jumps appears in it. The thermodynamics of dilute XX chain allows exact
analytical description revealing the peculiarities of the appearing
transitions. We calculate the low-temperature magnetization, entropy,
longitudinal magnetic susceptibility and specific heat of dilute model to
elucidate the influence of quantum transitions on their field and
low-temperature behavior. The changes of pair spin correlators under dilution
are also analyzed. We argue that other dilute quantum spin chains and ladders
with the gapless (algebraic) spin-liquid states would also exhibit the quantum
jumps under variation of couplings and field similar to those of XX chain.
","[{""version"":""v1"",""created"":""Mon, 24 Aug 2015 03:43:43 GMT""}]","2016-08-03"
"1508.05693","Zidong Wang","Zidong Wang and Malcolm J. Grimson","Spin Dynamics Simulation of the Magneto-Electric Effect in a Composite
  Multiferroic Chain","5 pages, 4 figures, 39th Annual Condensed Matter and Materials
  Meeting, Wagga Wagga, NSW, Australia",,,,"cond-mat.mes-hall","http://arxiv.org/licenses/nonexclusive-distrib/1.0/","  A composite multiferroic chain with an interfacial linear magneto-electric
coupling is used to study the magnetic and electric responses to an external
magnetic or electric field. The simulation uses continuous spin dynamics
through the Landau-Lifshitz-Gilbert equations of the magnetic spin and the
electric pseudo-spin. The results demonstrate an accurate description of the
distribution of the magnetisation and polarisation are induced by applied
electric and magnetic field, respectively.
","[{""version"":""v1"",""created"":""Mon, 24 Aug 2015 04:24:21 GMT""}]","2015-08-25"
"1508.05694","Salvatore Talarico","Salvatore Talarico, Matthew C. Valenti, and Don Torrieri","Optimization of an Adaptive Frequency-Hopping Network","6 pages, 4 figures, 1 table, IEEE Military Commun. Conf. (MILCOM),
  2015",,,,"cs.IT cs.NI math.IT","http://arxiv.org/licenses/nonexclusive-distrib/1.0/","  This paper proposes a methodology for optimizing a frequency-hopping network
that uses continuous-phase frequency-shift keying and adaptive
capacity-approaching channel coding. The optimization takes into account the
spatial distribution of the interfering mobiles, Nakagami fading, and lognormal
shadowing. It includes the effects of both co-channel interference and
adjacent-channel interference, which arises due to spectral-splatter effects.
The average network performance depends on the choice of the modulation index,
the number of frequency-hopping channels, and the fractional in-band power,
which are assumed to be fixed network parameters. The performance of a given
transmission depends on the code rate, which is adapted in response to the
interference to meet a constraint on outage probability. The optimization
proceeds by choosing a set of fixed network parameters, drawing the interferers
from the spatial distribution, and determining the maximum rate that satisfies
the outage constraint. The process is repeated for a large number of network
realizations, and the fixed network parameters that maximize the area spectral
efficiency are identified.
","[{""version"":""v1"",""created"":""Mon, 24 Aug 2015 04:25:19 GMT""}]","2015-08-25"
"1508.05695","Junping Wang","Lin Mu, Junping Wang, Xiu Ye","A Hybridized Formulation for the Weak Galerkin Mixed Finite Element
  Method","14 pages, 1 figure, 3 tables",,,,"math.NA","http://arxiv.org/licenses/nonexclusive-distrib/1.0/","  This paper presents a hybridized formulation for the weak Galerkin mixed
finite element method (WG-MFEM) which was introduced and analyzed for second
order elliptic equations. The WG-MFEM method was designed by using
discontinuous piecewise polynomials on finite element partitions consisting of
polygonal or polyhedral elements of arbitrary shape. The key to WG-MFEM is the
use of a discrete weak divergence operator which is defined and computed by
solving inexpensive problems locally on each element. The hybridized
formulation of this paper leads to a significantly reduced system of linear
equations involving only the unknowns arising from the Lagrange multiplier in
hybridization. Optimal-order error estimates are derived for the hybridized
WG-MFEM approximations. Some numerical results are reported to confirm the
theory and a superconvergence for the Lagrange multiplier.
","[{""version"":""v1"",""created"":""Mon, 24 Aug 2015 04:29:08 GMT""}]","2015-08-25"
"1508.05696","Skip Garibaldi","Skip Garibaldi and Holger P. Petersson","Outer automorphisms of algebraic groups and a Skolem-Noether theorem for
  Albert algebras",,"Documenta Mathematica, vol. 21 (2016), 917--954",,,"math.GR math.RA","http://arxiv.org/licenses/nonexclusive-distrib/1.0/","  The question of existence of outer automorphisms of a simple algebraic group
$G$ arises naturally both when working with the Galois cohomology of $G$ and as
an example of the algebro-geometric problem of determining which connected
components of the automorphism group of $G$ have rational points. The existence
question remains open only for four types of groups, and we settle one of the
remaining cases, type $^3D_4$. The key to the proof is a Skolem-Noether theorem
for cubic etale subalgebras of Albert algebras which is of independent
interest. Necessary and sufficient conditions for a simply connected group of
outer type $A$ to admit outer automorphisms of order 2 are also given.
","[{""version"":""v1"",""created"":""Mon, 24 Aug 2015 04:32:01 GMT""}]","2016-09-14"
"1508.05697","William Heinzer","Shreeram S Abhyankar and William J Heinzer","Rees valuations",,"Proc. Indian Acad. Sci.vol 122 2012, pp. 525-546",,,"math.AC","http://arxiv.org/licenses/nonexclusive-distrib/1.0/","  We study dicritical divisors and Rees valuations.
","[{""version"":""v1"",""created"":""Mon, 24 Aug 2015 04:41:54 GMT""}]","2015-08-25"
"1508.05698","Noam Soker","Noam Soker (Technion, Israel)","Planetary nebula progenitors that swallow binary systems","Accepted by MNRAS",,,,"astro-ph.SR","http://arxiv.org/licenses/nonexclusive-distrib/1.0/","  I propose that some irregular `messy' planetary nebulae owe their
morphologies to triple-stellar evolution where tight binary systems evolve
inside and/or on the outskirts the envelope of asymptotic giant branch (AGB)
stars. In some cases the tight binary system can survive, in other it is
destroyed. The tight binary system might breakup with one star leaving the
system. In an alternative evolution, one of the stars of the brook-up tight
binary system falls toward the AGB envelope with low specific angular momentum,
and drowns in the envelope. In a different type of destruction process the drag
inside the AGB envelope causes the tight binary system to merge. This releases
gravitational energy within the AGB envelope, leading to a very asymmetrical
envelope ejection, with an irregular and `messy' planetary nebula as a
descendant. The evolution of the triple-stellar system can be in a full common
envelope evolution (CEE) or in a grazing envelope evolution (GEE). Both before
and after destruction (if take place) the system might lunch pairs of opposite
jets. One pronounced signature of triple-stellar evolution might be a large
departure from axisymmetrical morphology of the descendant planetary nebula. I
estimate that about one in eight non-spherical PNe is shaped by one of these
triple-stellar evolutionary routes.
","[{""version"":""v1"",""created"":""Mon, 24 Aug 2015 04:50:37 GMT""},{""version"":""v2"",""created"":""Tue, 13 Oct 2015 13:55:26 GMT""}]","2015-10-14"
"1508.05699","Curtis Northcutt","Curtis G. Northcutt, Andrew D. Ho, Isaac L. Chuang","Detecting and Preventing ""Multiple-Account"" Cheating in Massive Open
  Online Courses",,,,,"cs.CY cs.SI","http://arxiv.org/licenses/nonexclusive-distrib/1.0/","  We describe a cheating strategy enabled by the features of massive open
online courses (MOOCs) and detectable by virtue of the sophisticated data
systems that MOOCs provide. The strategy, Copying Answers using Multiple
Existences Online (CAMEO), involves a user who gathers solutions to assessment
questions using a ""harvester"" account and then submits correct answers using a
separate ""master"" account. We use ""clickstream"" learner data to detect CAMEO
use among 1.9 million course participants in 115 MOOCs from two universities.
Using conservative thresholds, we estimate CAMEO prevalence at 1,237
certificates, accounting for 1.3% of the certificates in the 69 MOOCs with
CAMEO users. Among earners of 20 or more certificates, 25% have used the CAMEO
strategy. CAMEO users are more likely to be young, male, and international than
other MOOC certificate earners. We identify preventive strategies that can
decrease CAMEO rates and show evidence of their effectiveness in science
courses.
","[{""version"":""v1"",""created"":""Mon, 24 Aug 2015 04:58:05 GMT""},{""version"":""v2"",""created"":""Sun, 6 Sep 2015 14:54:07 GMT""},{""version"":""v3"",""created"":""Tue, 8 Sep 2015 18:27:56 GMT""}]","2015-09-09"
"1508.05700","Kouichi Hagino","K. Hagino and H. Sagawa","Are there good probes for the di-neutron correlation in light
  neutron-rich nuclei?","9 pages, 5 figures. A talk given at the international workshop on
  weakly bound exotic nuclei (WBEN), May 24-30, 2015, Natal, Brazil. To be
  published in a special issue of Few-Body Systems",,"10.1007/s00601-015-1027-3",,"nucl-th nucl-ex","http://arxiv.org/licenses/nonexclusive-distrib/1.0/","  The di-neutron correlation is a spatial correlation with which two valence
neutrons are located at a similar position inside a nucleus. We discuss
possible experimental probes for the di-neutron correlation. This includes the
Coulomb breakup and the pair transfer reactions of neutron-rich nuclei, and the
direct two-neutron decays of nuclei beyond the neutron drip-line.
","[{""version"":""v1"",""created"":""Mon, 24 Aug 2015 05:07:47 GMT""}]","2016-03-23"
"1508.05701","Zidong Wang","Zidong Wang and Malcolm Grimson","Magneto-Electric Effect for Multiferroic Thin Film by Monte Carlo
  Simulation","5 pages, 8 figures, The 3rd Advanced Electromagnetics Symposium,
  Citation: Eur. Phys. J. Appl. Phys., Volume 70, Number 3, (2015)","Eur. Phys. J. Appl. Phys. 70, 30303, (2015)","10.1051/epjap/2015150129",,"cond-mat.mes-hall","http://arxiv.org/licenses/nonexclusive-distrib/1.0/","  Magneto-electric effect in a multiferroic heterostructure film, i.e. a
coupled ferromagnetic-ferroelectric thin film, has been investigated through
the use of the Metropolis algorithm in Monte Carlo simulations. A classical
Heisenberg model describes the energy stored in the ferromagnetic film, and we
use a pseudo-spin model with a transverse Ising Hamiltonian to characterise the
energy of electric dipoles in the ferroelectric film. The purpose of this
article is to demonstrate the dynamic response of polarisation is driven by an
external magnetic field, when there is a linear magneto-electric coupling at
the interface between the ferromagnetic and ferroelectric components.
","[{""version"":""v1"",""created"":""Mon, 24 Aug 2015 05:19:59 GMT""},{""version"":""v2"",""created"":""Mon, 9 Nov 2015 03:56:35 GMT""}]","2016-06-03"
"1508.05702","Christian T\'afula","Christian T\'afula","An elementary heuristic for Hardy-Littlewood extended Goldbach's
  conjecture","13 pages, 3 figures. The old version of this article ([v1], [v2]) has
  been expanded and split into two separate papers: arXiv:1807.10200 and the
  present one. From [v3], [v4] to this version: grammar was corrected,
  references were added, and figures were adjusted. For the scripts used to
  generate the figures, see https://github.com/tafula/hl_ext_gb_conj","S\~ao Paulo Journal of Mathematical Sciences 14(1), 391-405 (2020)","10.1007/s40863-019-00146-3",,"math.NT math.CO","http://arxiv.org/licenses/nonexclusive-distrib/1.0/","  The goal of this paper is to describe an elementary combinatorial heuristic
that predicts Hardy and Littlewood's extended Goldbach's conjecture. We examine
common features of other heuristics in additive prime number theory, such as
Cram\'er's model and density-type arguments, both of which our heuristic draws
from. Apart from the prime number theorem, our argument is entirely elementary,
in the sense of not involving complex analysis. The idea is to model sums of
two primes by a hypergeometric probability distribution, and then draw
heuristic conclusions from its concentration behavior, which follows from
Hoeffding-type bounds.
","[{""version"":""v1"",""created"":""Mon, 24 Aug 2015 05:25:32 GMT""},{""version"":""v2"",""created"":""Thu, 27 Aug 2015 21:00:03 GMT""},{""version"":""v3"",""created"":""Fri, 21 Sep 2018 07:35:10 GMT""},{""version"":""v4"",""created"":""Fri, 14 Jun 2019 17:45:16 GMT""},{""version"":""v5"",""created"":""Wed, 28 Aug 2019 10:25:35 GMT""}]","2020-05-11"
"1508.05703","Saif Khan Mohammed Dr.","Sudarshan Mukherjee, Saif Khan Mohammed and Indra Bhushan","Impact of CFO Estimation on the Performance of ZF Receiver in Massive
  MU-MIMO Systems","Submitted to IEEE Transactions on Vehicular Technology (TVT) as a
  correspondence paper",,"10.1109/TVT.2016.2518401",,"cs.IT math.IT","http://arxiv.org/licenses/nonexclusive-distrib/1.0/","  In this paper, we study the impact of carrier frequency offset (CFO)
estimation/compensation on the information rate performance of the zero-forcing
(ZF) receiver in the uplink of a multi-user massive multiple-input
multiple-output (MIMO) system. Analysis of the derived closed-form expression
of the per-user information rate reveals that with increasing number of BS
antennas $M$, an $\mathcal{O}(\sqrt{M})$ array gain is achievable, which is
same as that achieved in the ideal zero CFO scenario. Also it is observed that
compared to the ideal zero CFO case, the performance degradation in the
presence of residual CFO (after CFO compensation) is the same for both ZF and
MRC.
","[{""version"":""v1"",""created"":""Mon, 24 Aug 2015 06:11:07 GMT""},{""version"":""v2"",""created"":""Thu, 3 Dec 2015 04:19:18 GMT""}]","2016-11-17"
